post_id,title
ai06qq,Russian car prank
6wnc1m,"Literally, one normal day in Russia"
9gk1j4,The Russian Kebab Life Hack.
8xb43s,Siberian seasons. Frost & mosquitoes
cv6yo4,Party like a Russian
848fa4,Dealing with a parking spot dispute.
81rbcl,When the guy behind you keeps hitting the chair
d5e1nn,How to throw a grenade
dsdd1e,Lada is best
de4fwa,Russian cop gets interrupted by a pack of wolves during a traffic stop.
bpj72b,Lab mouse statue
87i4z6,Ivan! Here is a seat!
agnda9,Generations
dqxevy,Russian Hands-Free Trunk Opening Feature
8ripha,Brazilians in the Moscow metro
7b73ha,All blood is equal and controlled by the heart
dcnppn,+10 holy damage.
9eilvx,Opposition activist arrested while reporting live about arrests of opposition activists
7lraj5,When you crash your cars and wait for traffic police
7z67c3,hmmm...
7yly2q,TFW Putin offers some tea.
dexpdq,Just a casual sniper at my university
9v0jp1,"During the rush hour, Russian streets are especially prone to accidents"
9wcyw4,Many questions...many...
apkpjm,What kind of dog is that?
8oesce,On Russian television photoshoped the smile of Kim Jong-Yin
bmlzbl,The Victory Day parade today included a caged Nazi
7n1n40,Christmas Wishes
8vt22w,Accurate analysis
7k82xl,Analog ATM in Russia
dkz0ko,Tetris Challenge from the Russian traffic police. Complete with arrested person
6zdzai,Army food
7wbwtt,Russian watch dog.
dvn30f,Fat cat
8cyblj,Russian Harry Potter
dm5r1u,"Under the skin of the seat in the old Soviet bus, rock paintings of the late USSR were discovered."
95fxs9,Grade 7 teacher with her students
7ja75i,AdBlock is real in Russia
cfptjz,Spot the slav!!!
a896db,Does this count?
81xmbd,The best weapon in a street fight
83x2ez,A normal day in Presidents life
d831jd,Slavic Science meets religion 👌
7dsmiw,"Russia is a very cold country, but with warm-hearted babushkas"
7xgdma,Last woman standing
dkgsoi,Autumn in Russia
7qay4n,Russian TV
awsvv3,Normal Russian seal
87aid5,Hollywood
751m0v,Secrets revealed
6lknxz,Don't you take my parking spot
bf9owa,Spring colors
bqrlxn,"Moscow, 20 year challenge"
874j15,What's the name of this country?
7rg9ya,Babushka had enough!
7t6qn7,Wedding photo
951hmc,Moscow
axx4r1,Man in Russia arrested for attacking Stalin statue
ceaivo,Goes back to the party?!!!
b4i1ay,Russian astronauts returning from the ISS
75p11u,Just a normal stadium in Russia
7fesqb,Recycling is subversive capitalist plot
6i878f,Fidget Spinner... made of Ladas
6smd3f,Amateur demolition derby
cundum,Russian train honks
bxg1gy,Zero given fucks!
bkkh41,Morgue in Russia
ajvsyk,"Alexa, blyat"
8t07dw,D I S G U S T I N G
7yxayt,He's aware.
b2fyg2,Just a man skiing with a propeller
ac8e8e,Severe tram driver
89c4ft,Casual
6jdgdm,Before you are allowed in a tank you have to prove your blind trust in it
cks5rw,"Russian restaurant, on the wall it says, “food prepared with love”"
7m021l,"Today we built a snowman. You know, for the little ones."
abg8dr,The bridge on the skating rink in Moscow's Gorky Park collapsed in the first minute of the New Year
7m4ppn,Bored on a sleepless night
azvhoi,Truly Slav
ajfbt0,When grandpa is a beekeeper
8hncvs,Guy lights himself on fire and jumps off a building
7i6nbx,"The Motherland is calling, Sasha."
cl8f9s,Soviet Lifehack
8kctki,Ivan and Vald take car for spin
8fmg8c,Be the change you want to see in the world
71ruot,Get off the street!
cyvaxo,Putin the Teacher
5vhm8d,Russian army rations
87wjxu,A real gentleman over here
6q9khr,Putin's plane leaving Finland after state visit
7c0e9c,Shortcut to Vladivostok
ax35kz,Two countries with nuke in a border conflict? Ivan does not mind
d3q60s,Turn right at the statue to commemorate mouses we killed...
do4t6v,How to cross a road in Russia
9724v7,The most Russian thing ever...
b086i8,Solidarity
dhg7fd,Man tests to see if a helmet is bulletproof with a gun.
aizzsw,Russian kinder egg
bo0n03,Putin as a child?
c457ns,Russian kinks
8s3tqz,Putin is a simple man
dwokzp,Bear
6zssup,Tech support
75vu7c,Your present has arrived!
7depma,Just a normal dog
cancc0,Flirting in Russia
d7rks9,Russian cats in zero gravity.
9l4hrh,Russian Television
dxkp2h,Leninardo di Caprio
donqfd,And they were never seen again
cvqqdc,No one: Russians going 140mph on snowy roads:
cpkn9o,Bear in the supermarket again...
c9e2k1,Russian children on school holidays.
ddw8ku,Mom and I in USSR- Circa 1990
84lq1d,Cargo plane scatters gold bars over Yakutsk
dj2k8w,Ivan! Here is a seat!
9ept6m,Taking the breath analyzer test
8ap1ww,Peppa pig’s car
clt8kn,A normal prank in Russia
90ejfr,"Fashion Police, Ukrainian edition."
778zx8,Safety first
88hc1s,Babuska washing her car
8fye0g,Russian firefighter saving a cat.
dtwp0t,Siberian unicorn
cteh96,It's only silly if it doesn't work.
80wv06,Only in russia
cxiroi,Russia unveils statue of AK-47 inventor Kalashnikov.
awidn7,A sleeping policeman
azfj1z,Power moves in the motherland
a5fkxl,Babushka's basement
8zuh32,Gopnik and his loot.
b0ynh4,Just a flying AK
7s7ll1,Standard kids winter collection
cn4kiy,Russian girl dancing like there's no tomorrow
abtbu7,Would you liked to try going fishing in set up like this?
a3nz1w,Fasfood in Moscow
bw6dua,slav god with putin
auxcn9,A normal Speeding ticket
6ghvae,Clean energy revolution
640ect,My only Russian friend on Facebook.
9bcxu4,Ancient slavic mansion with ancestral crest
89n7zi,Lost in a strange galaxy
d8zlgb,Told my Babushka i'm working on gaining muscle mass
bd13t3,Could be a logo of this sub:
dtd8ia,Cars in Russia
9gbejm,Russian soldier with a butterfly on his hand
dwv7rx,nope
drvqjd,McDonald home delivery
baetv1,Eagle riding the subway train
d01pux,The final test to pass kindergarten in Siberia
858e3p,Playground device of death (x-post from peoplefuckingdying)
djchl2,These goddamn Russians
cewg47,In Russia you can play classic Doom on ATM
7ay674,How not to give a fuck.
bqfn1c,"Ivana: 'Daddy, can you buy public opinion?' Igor: 'Da.'"
b7ct50,Nobody believes that there is a Topol-M in my neighborhood.
anogz1,Just a normal teacher in Russia. He's from Nigeria. He teaches Chinese language. Nothing special here.
az1dfm,Sound of Russia
d1ag9y,Your average Russian rail crossing
9o22cx,Misha is on his way
8qqohe,He's not ice fishing
8q7wl4,2000s Russia was an interesting place
co0oao,"Bow down to the Tsar, you bitch!"
8tc2ns,Iranian women in Moscow
cz280i,"Why not, you know... Why the fuck not?"
cy4uph,Uber still has a long way to go in Russia.
7o27wo,"I, babushka"
7x8jfj,Adidas fence
cja6a9,Russian bath
71954x,Perfect Crime
92v1yr,A normal urinal in Russia
93bf6j,Comrade training his dogs to take down american spies
9y5sh2,Find women that treats you like a true slav you are
ayg5e5,Tired of loading every single AK Round individually? Here is the Motherland's answer to your sorrows!
d50j22,Russian first world anarchist
aauygi,"No idea where I got this from but the title I have it as is ""Russian Kids Are Fucking Insane"""
c1uq6l,Damn that guy is strong!
aqi87l,This latest western entertainment is blast
9z796d,Don’t be sad bro
drf05h,"How do you like it, Elon Musk?"
ciu0cn,One man army yesterday in Moscow
coi88n,Quality family time
9sbeqy,Visiting parents
b3hsqe,Confronting a bad driver in Moscow
cwmvch,A real Russian problem
7jqziz,Dogson
aw9i8w,When babushka goes to buy a shirt but doesn't know English
7chgf0,Flame Thrower
9xn2vu,When you asked your babushka for Converses
9amky6,a normal russian subway
d3av2v,Multiculturalism is taking weird turns in Russia
8a7nmc,"Well, that escalated slowly"
bku9kf,"Just passing through, nothing to see here"
8ts3ig,I couldn't honestly think of any title
7015kz,True love
7hi284,Taxi
daltw5,Harry Pjotr with his friend
d47ala,"Meanwhile, in Russia"
5v5s3r,Russian guy murders his friend over argument about which graphics card is better: nVidia or AMD
69wzej,Babooshkat
btmho5,People have no respect for the election process in Russia
cwxuxg,"""How dare you cross the street on the crosswalk"""
bbpfka,"Oh, I love Russian Subways!"
b1c6ow,"You see, I am ready for my morning commute across the mother land"
dpa31i,Alternative russian roulette
br94xr,Game of boris
96aurb,Mounted police
6uhq5b,"- Mikhaylo, give me that wrench"
6np6xs,Hookah on the go
alziw2,"""I'm Just a regular everyday normal russian"""
8cmrgq,Customized bags in Russia
5e4ja1,The prophecy has begun
bydu9a,Soviet bus stop
aev9lb,“Insert tank t-shirt here”
deg7qn,Run !!
af56qd,"This store in Adler, Russia has a manhole so that (presumably) the Ninja Turtles can conveniently buy pizza ingredients"
ahebxl,Another victim of war
an0435,A normal superhero in Russia
abkoi7,the Ikea mega store in St. Petersburg offered free pickle juice to customers today to help with hangover
c8lex5,Viktor Viktorovich hid his secret all these years
6xyf1r,Punks not dead
crm6hr,Russian vs American driving diagram
dmwuiq,"In Russia, cat get protec"
d4gsfg,Blyatness 🤬
akmdr6,"During the economic crisis in the 1990s, Russian teachers were paid in vodka bottles"
97u2wc,Ukrainian Judge often mistaken for Drag Queen
czct29,Greetings from Russia on their wedding day
aq1l4r,Interesting indeed
dn8zfs,Sometimes normal Russian day comes to you.
6ivyjc,When you missed last garbage day
cu0clm,A normal slav girl.
7t0c4z,Tesla vs Lada
7rpot6,President of russia
7r6fmd,It's me. Degrees Celsius.
64ckq5,Vladimir Putin takes selfie with two girls
8v2nc7,"""Ivan, tell Babushka who touched you."""
cse6qh,When the heater goes out in Winter.
77wmqt,Wedding Day!
axkkmc,Harry Potter and the rejects from Russia
9m08s8,A Russian Tank.
7arh86,Jumping into the abyss.
9phfcq,I can count on one hand how many times ive ate this type of breakfast. 15 times.
9i4cxd,Only in Russia will you find a creature that tastes like almonds.
9hdg43,Normal kids in Russia
dghrda,"In Siberia, instant noodles are also hands-free"
agwubw,Average russian PC
dsth16,Careful there
c09p9w,Just a regular slav couple
arw7sy,Slav girl on a Slav car
6t8ti4,Productive in the park
7qqxd4,A normal day in Russia
d9z6k3,Russian smartwatch
d0sulr,Welcome to the neighborhood.
9mmy7w,Scrambled eggs at -60°C (-76°F)
aa08dc,Craptimus Prime
6sus2e,A hallway after too much vodka
c25yod,Russian missile
bup2qz,Lada GPS
bz57sb,Welcome to vodka land
cm8lm1,The dream of a good car come true
d6fu69,Try to say this fast
7q3xtt,Good dog
a3hcfz,Is this not everyday
5ybefr,When babushka goes to buy a shirt but doesn't know English
drlfk9,Bus Station
asna6p,Baba Yaga fun in russian village
cbdvso,Kindergarten in Russia
7fv7j9,Eating sushi in Russia
ducfcf,Slow News Day
9xgmm4,Somebody vandalized a Soviet star in Russia by turning it into Patrick
7bmk4n,Putin likes my dog! Best day of my life.
5eu90w,"Oh look, Helicopters!"
8pq5i1,How Russian dogs are born
aehwj2,I’m a tank
7rw03c,Opposition candidate surpasses Putin and bathes at 40 degrees below zero
b4vvlv,No swimming in Chernobyl
8lzzyi,The difference between men and women in one video
7wqlyv,Harry Potter: slav version
7s2c7d,B E A R
au6gav,Ivan’s gift to Babushka when he won the lottery....
68hh20,Underground swing.
dbbcg1,He don't give a F**k
aufzjo,Sometimes you just gotta let the girls loose.
cf4rj4,"Russian pensioner in 70 years start learn coding, now in 76 he made into final of all-Russian championship for coders"
b2y8fw,We are the gasm
c5ugao,The more I look at this the better it gets
amctnr,Slavic Neighbour Cars
be5s1m,Grace and dignity
7uw3e5,Putin's Angels
buczkg,"Take it from someone who is actually from Russia, we have this old stuff laying around every where."
8u82ot,Let’s forget about football and just run away
8i66rs,Just a normal Russian Swing
7vluy1,Man locks his head in a cage in an attempt to quit smoking. Wife has the key and only opens it for meals
9g55zq,Find 2 russian plumbers.
7udrhh,Your average Russian rail crossing
bjuo7r,Raw Salvic Power
bt3ue5,Calm
d8o3tc,Chloroform are for weaklings
76xbka,First day in school starter pack
9rixjb,Hardcore police
7mf053,Frozen waterfall
94oovf,Welcome to Vlad's fun good time game.
djqnip,Russian media has enormous respect for President
c1l2tj,Swinging with retired Peppa pig
979838,A lot of Russia going on here
dq006x,That brave russian cat.
7xyrf3,Lada power unleashed
8phoqh,Just a normal Moscow subway
afhyw5,Russian drawbridge.
8jaljl,Romance
c3o493,How conditioning system works in Russia.
baod19,"The Russian equivalent of ""phone, wallet, keys"""
bdos5z,Palace of The Soviets (cancelled)
90xjam,A normal business meeting in Russia
6em724,Respek
ddl0na,Russians sure know how to laugh
7e8nk5,Babushka getting robbed
dmooop,Slav Kebobs
cviv4l,Russian SWAT (x-post r/funny)
bxpyfm,slav 100
8got8k,Enjoying rainy day in Vladivostok :)
6ftys1,This vending machine in this Russian mall is for buying likes on your Instagram pics...
b42lll,"Soviet Punk, 1980s"
69kpf0,when it rains
dikpym,Taking a relaxing dip in the river
clihyx,Holy crap ed my pants
b6fkx2,Hello dear i can't hear you
a2153g,Slav girl on a Slav car
6teknc,Jean-Claude Van Blyad
67i6b9,A Russian haircut
czk4qs,Russian parliament situation
a2nryg,It's a FACT <3
dfy55u,Genius 👌
dr4oqr,Cyber Russia 2077
6pfx47,Mandatory backdrop
b903ty,Russian Frisbee
6nz5rg,How to fix a pothole
6vvd7l,Babushka will not cry
85ez0c,An apartment with a great view!
9eazv0,Ordinary wedding
avs8br,Has anyone REALLY seen a Russian die?
aw0tef,🍓
764ajh,A sleeping policeman
cydkzx,The bank that keeps your money tied up.
dg98qm,Little cub lost in forest fire
cme818,Vodka has basically unlimited potential
axbm02,Elon Rusky field tests space helmet prototype
7orfr7,A perfect symmetry of normal Slavic doings (xpost from r/youseeingthisshit)
bq292z,Just another day in russia
a66p5c,The apple never falls far from the tree...
denc4y,Russian dash cams are the only dash cams
9tc52d,1999 Russian news room
dvbjub,"""I need your tracksuit, your vodka and your Ural bike"""
aa8s28,Playing hide and seek in Russia
7d2gy5,Average prank
a80w0h,Tired of unreliable lighters? Top russian engineering to the rescue!
c1adw6,Google street view in motherland
ciejqf,Rural Russian scenery
cxumir,Found this on Facebook
c36rlf,Q&A with Putin is more important
8mh5c2,Comrade DiCaprio on his lunch break
ct593p,"I’ll be staying at Hostel “Zareche” near the Tex-22 Power Plant, Moscow, Russia."
dx5by9,This is a color photo with no filters.
5j7ugf,The striped pants go way back
anyg5d,Lmao sounded Russian and seemed like a pretty Russian thing to do 🤷🏼‍♂️
8ra4u1,"When there are no villains, but you need some money to make ends meet."
d9qnfq,When it starts to snow in September😮
b61w4s,Look wat babushka knitted me
bjpt0a,When you're going to fly Russian airlines
a4vj8e,The Russian Army has started airdropping churches for their soldiers.
9w4ix7,Slav Armor Test
akaiub,Playing Checkers with Babushka
61m3kp,Man having water fight with a bear
a3yqu0,Cyka blyat
c4lz0j,A Slav Is Born
bzc86z,"Once Russian children learn balancing on the rear wheel, they sell the front wheel to buy vodka"
dlk0du,"Hello, are you want to talk about problems of liberalism?"
6awzta,A russian surrealism
6uowkn,Kolkhoz smekalka
b6nk8r,Weekdays of Donald Trump in Russia
9n8ynb,"Sydnev, Russia"
7y7si7,Now this is a Russian selfie
a4imdj,Vladimir happy to see his favorite Crowned Prince
789odk,That bus was unBEARable
9v8u08,Cosplay in Russia
dw7d3x,When your dad finally agrees to take you to his job
c0jl9f,A normal blyatmobile in Estonia
9a60pe,Truly Russian
bshe2f,A normal prom
9iq7iv,Just a slav chilling outside.
di8fs2,Who lost his cannon?
6ram15,The News
7fo0m4,A normal wedding band in Russia
84tmf8,Fallen from the sky gold bars in Yakutsk found laying in the snow. Some people are just lucky
8t6ytq,Vlad upgraded his car
bpoo4f,When you wear a skirt but you need to squat.
d42fks,Exorcism Russian style
711ck2,A complete set
d306m1,Nobody expects Russian TSA
7uj212,Moscow Subway Ticket Machine Accepts 30 Squats as payment
cwguiu,Abandoned mega ultra huge projects
70h14g,1000kg sunfish caught in Russia
9mdwmw,Russian Simpsons
dvv4pi,Russian gynecologist's office with a view
c6c4np,What an absolute badass
8j2ng7,Never too old to enjoy yourself.
at22w3,Just your average hotel lobby brochure.
9qxvtz,Sergei in training.
861vfj,Just walk it off Vlad
9x9yif,"Comrade Cat, Destroyer of Bourgeoisie"
bosqns,d a n g e r o u s
cjr19i,A casual Russian girl's workout
7d9cyx,Modern Furniture
7egwqe,Kind of a sad image
c6wp66,Dressed to impress.
732uaw,Temporary Grandstand for WC FIFA 2018 in Yekaterinburg
980k0s,r/ANormalDayInRussianParliament
8pb3cw,Just a normal russian profile
aqwg2s,Slavic colleges in nutshell
c84iim,"Yeah, normal"
bj6o1i,Hmmm is this accurate?!
a6ezj8,He has always been there
9umlsd,When Hollywood steals your idea
cw7ucm,Россия TV
9k4tx4,A normal Russian wedding
5opsxu,Schools out
9mtnrj,Igor is boy no more
cuvwjj,To increase orgasm just add vodka
cqm732,When wife stuck you with baby
7ts0hh,Party Like A Russian
ady9gd,Little Alexei came prepared for the bullies
cgw4pu,"Life is tough, and you have to compromise to survive.."
d2nn75,Well that didn't work (X-post /r/gifs)
cdv28k,Russian drivers are known to be hotheads
9wrx79,Pulling it off.
7cnmx7,Flag Girl at Illegal Street Race
96w2qd,Nap time
9or5d3,Balconies?
8dz4bc,Slavs get hold of a tank!
cxnycs,With her tank.
d66nt6,Dead comrade reincarnated as a cat
bgqkm5,Russian technology
bsagrj,I like it like that
7xsxbi,Armed babushka.
5yyrq5,Borscht Dynamics
c7re33,Real men shouldn't survive a car crash.
5dak58,Half naked guy risks getting bitten to save a dog from hyperthermia (xpost from /r/gifs)
61236g,Trolley upgrade
a15az9,Russian tools
79nbq9,Back home from the Crimean war
cdi9d1,And1
7v0241,Hold my vodka while I cross the tracks
7tjzdw,a normal menu translation in Russia
dh83q2,Cleaning windows in Russia
89ztuy,Russian Magic
ahm6cc,Slavwave
9jw2j0,"If we're posting weird trucks, then how about this one"
dkok0x,"Pleased to meet you, comrade."
d8f4e4,They're not wrong
ayuw3s,Stop Komrade
c7ehgv,Barber:What haircut do you want? Tom:Something Russian. Barber:gotcha
bmw40p,Only for men of culture
7gbdku,Russian game show.
c0t8re,I’m blyatman
9c2b6w,The Matriarchy. Any guesses on the topic of discussion?
9kq4sq,"Oh look, Leonardo Di Caprio's long lost Russian twin!"
dogehy,The new russian neighbour
9xwz5j,So happy for them
ba6toj,"Sergei, your jet is getting towed!"
8n6vyx,Ivan riding to work
99nqfe,Lada’s official instagram just posted this
bewi6u,A normal Russian coworker.
bg1z0n,Breakfast
acme2p,Hookah on the go.
bmf3uu,This is a color photo with no filters.
dxtom7,Russian firefighter resuscitates a kitten after putting out a fire. (the kitten is alive)
b1yag1,Russian soldiers sing “Barbie Girl” to train to refrain from laughing
9e32ax,Just a bus stop in Russia
d7jzzi,Tank drifting
ben0eb,One month in Soviet Russia
6xgsxb,Pavel powerscaling the pike
brw11v,Russian mud art
89t8tu,Normal repair of a historical bridge (Kaliningrad)
70ob8a,What is going on here?
cc0bud,Your typical Russian queue
6aekgl,Snowy
7upw1o,Yoga Instructor.
byp1ss,Olga & Vlad's wedding
9nlapt,Russian ballet class
8ootok,The russian Charizard
7n921c,Igovski the Betrayer (xpost from /r/bossfight)
96hz41,Straight Glass of Vodka in supermarket
8bqfji,Russian Block Party
7g3l5u,HD man
8tya96,I have some letters for you
csva44,Out for a spin.
80bcht,A normal Russian concert
dprain,Young father on a walk with a child
crhzf5,Yeah seems about right
77lpci,Made me laugh
a4oud0,Holiday spirit
7j2dx2,back to school deals
anhnmc,Dimitri! Stop playing with your brother and come eat some dinner!
a9pko1,Poor English skills are common in the post-Soviet countries
a6psmf,Roza Shanina WW2 Soviet sniper. 59 confirmed kills.
9nfup5,Aww man got a scratch on my lada
85kq8v,getting that hefty dose of vitamin D during dark winters
aq99vm,Keep walking comrad
ainbts,"Who are we, after all, but lonely gopniks floating around on ice floes?"
dlv33z,yeah makes sense it's moscow
ag6k00,Just warming the tank
afwpez,Russian iPhone
b8800w,They’re not real flowers if you cannot pole vault with them
dq84ez,Connection with aliens established
8m7v4c,"Boom, comrades."
5jsbhu,Breaking news.
9ay1cx,Pay the fare
daffg2,The latest babushka technology for half the ruble!
cg2l9s,Just a normal russian gym
51jd9o,Now this is a Russian selfie
dis8as,When mother is in the audience
8z0vz4,Playing Chicken.
8ox0o1,Priviet
dv2923,Free Gas for anyone wearing a bikini
7w455f,Russian Aerobics.
ayal7d,Dash cams in Russia
8wjv22,Russian RoboCop.
dk05cd,Economy is not going well in Russia.
cc9vq6,Slav connecting with his cultural heritage
c6k2tm,A normal school day in Russia
a9gdwp,Should I be worried?
bzjjp3,"Yes, Comrade, Yes!"
5ro4u0,Epic
aulaj7,A normal Russian wedding cake
anbhy0,Rush B
9uceay,Stairway to Slavhalla
553hty,Drink like a russian
bifj3u,"Twin toddlers on a Russian street, so well protected against the Soviet winter that they look like penguins"
bvf3jv,Just your average day commuting when we have a warm day.
7jzx3b,Have fun aiming your poop
ayou91,is that subway?
a0tfys,Buying vodka for the first person that tells me the name of this hardbass track
bipcoj,Somewhere in Russia
6z1mve,When Ivan drinks too much he takes off his pants and pretends he's a kitty
724lzq,Реновация
bwlsjs,Where I can buy one?
dnh543,"Train in Moscow says ""suck dick"""
dh02ec,a typical day in Russia
bjeua3,Gimme a puff dude
824s3a,"A normal day in sahalin, russia"
8km0m1,A normal carpool in Russia
aowasl,Russian Entertainment
ay4rwf,Blyat no article is going to tell me what i can do
7peusn,Russian Chess Club
9raep3,Unsupervised human workforce
dpkl7e,Found on a flea market in Russia
7ox4iy,My Master
7sp3mp,Gotta keep these streets clean
bzqiyo,Meet Sergei Krikalev
8jlwnc,Boy asks for permission before knocking out Putin
782l7q,Just a perfectly normal fridge
76q2x5,Bear drinks like real Russian
aaelp6,"Svetlana Kapanina, amazing aerobatic pilot"
asw1hw,"Ukraine, but close enough"
7net7j,Kalashnikov vodka!
a95oto,Just carying a roket launcher
a1cjqe,American vs Russian
aopkdc,Snow Monsters have invaded Russia...
5ytcuu,Russian Mc Guyver
a9oi44,Choose your Fighter!
cj15i8,Don't you take my parking spot
c11elq,Not Russia but still...
7cvp6t,I found the perfect Babysitter in Russia.
a7m5oj,Country lassies
bntc26,A Normal PC in Russia
da7ws4,Absolute facts
bas6zt,Pick a character from your last number of upvote
6uy6rq,Eating at the first McDonald's in Russia
5ezd06,Fidel Castro dressing in a culturally appropriate manner to meet Putin
c74e3g,Just straight style....
73u32o,Fishermen rescue drowning wild brown bear cub from a Russian lake.
agfpja,Wedding... Russian style
7qiiiy,"-50°C (-58 °F) in Yakutsk, Russia"
d99asi,Reason why Russia has so many smart people
arjc52,Cute
bfxdqv,How to take a screenshot in Russia
9kbm58,Typical Siberian Winter
9yfgs6,When all evil had been defeated
68mjy1,"""Ivan, hurry make photo of us"""
a1i6hj,Backpack for a long dayhike
bo9tm9,giant bird trying to fuck the guy on the phone
7zdb1k,"Welcome to r/ANormalDayInRussia, I’ll be your guide for today."
cb3lev,Good trigger discipline all around
6vcmqq,Recursive Russia
9f2fl7,"""blyat, get out of here swan, stop attacking babushka"""
b3q0ev,Just filling up a tire
aksrlq,How to drink whiskey the Russian way
dp0otl,Vodka hits harder while underwater
a5yzib,"Russian high-tech ""robot"" Boris, turns out to be a man in a commercially available robot suit."
6ec83i,In Russia no one gives a damn if you rob them.
bu4qfz,Russian fishing crew get a surprise catch
9b653y,Why pay more?
9q2dcq,I found Yuri's car.
bldz18,Babushka's Creed
94va19,"Sledgehammering a burning cinder block on a fellow human, aka “training”"
dtq4nz,Adidas warrior
bcodio,Self-defense in Russian P.E. is slightly different...
c3g7jb,We're so different
6r2nu6,"Decisions, decisions"
9ihi1q,Russian man saves women drowning of the Sea of Azov
95tbpa,Tired of loading every single AK Round individually? Here is the Motherland's answer to your sorrows!
9p8y3f,Is Turkmenistan Russia’s Russia?
8sta23,"Great parking job, Vlad!"
8py8fg,A true slav
bhkyr5,Russian Spider-Man. Vladivostok
cbtq9b,Just another typical day at a Russian airfield.
apsk7g,This iceman is freezing
dfo2x2,Combat botanya
5qf8g3,Telekinetic Clap!
ccre0e,vodka make abs of steel
53yf9g,Russian man casually drinking an entire bottle of vodka to avoid paying for it
83mrjp,Walrus asleep on a Submarine
65op8j,Latest Russian-developed electric hybrid bike.
91gja8,miracles happen
8mp77f,"Now bounce нахуй, Сука Блять!"
cx69ae,Step on it
86ns1l,Having lunch on a rotating block of ice on a frozen lake
7kja50,50 Shades of Grey
adrlbq,These slippers my gf's mom brought from her trip to her home town in Russia
bvkklr,Water Tank
c8bdn3,Water parks in motherland
94hjzd,Russian Dodgeball
9f8yyp,"Just a overgrown cat, nothing to see here"
d5o4l9,When your training isn’t finished but babooshka tells you to leave
7p5vap,Just need some gasoline
avcfy3,The perfect traffic companion
8iviyg,Cheburashka
ch8eyv,Satanic worship is an issue in Russian schools
ap2jjb,How to sculpt the greatest ice creation ever
53mdvn,Flattening the asphalt
b251pz,"They where hungry, I think"
b9rrcc,TV is getting destroyed by two babushkas
d4vcp8,"Speed Limit Sign in Arkhangelsk, Russia"
bwtkmk,Can I bum a smoke?
5nr0x1,When the pension check gets raised a few rubles
6qo980,Stopping for some gas
7kr963,Just your average Russian self-driving vehicle
cblcvv,A Good Night In Russia
9lbpq2,"That's not a knife, this is a knife!"
c31lq7,this
a7sx1v,Loving engagement photos...with your Bear.
9hl6z9,TOP GEAR Russia..
9vwrzh,Relationship goals
9hrnyk,imagine walking to your cat and you see her sitting like that ...
bs0k93,A Subway Station in Russia.
9i98n0,Babushka cutting onions
caxchu,Star war in Russia
a27w6s,A not very old car in Russia
am7989,salute.
6cac35,a cold day in Hell
af9hdr,Could be colder.
7f09sb,When you put Adidas Originals logo on your babushkas sweater
74w7tz,Today's photos from Syria
