post_id,title
avgdri,Girl vs man in action
boj8ny,Both had nothing on Yugoslav space programe
9tj6ot,Stealth technology in Russian Army
9oanlc,A washing machine in the wall.
d1mxin,Comradery
alc1nr,my 95 yo Blind grandfather finally gets his mini tv.
9bponq,Only Way to Cut Cake
8k3eex,"Party like a Russian, they say"
bly8f0,Workers rest
b9g1ov,There is so much going on here.
cs3nhs,Swimming the streets of Sochi 🏊
b2qnp8,Nice car
79gtjf,Everything is safe if you have the hardhat on
7ai8on,"Full tank, please"
bwcjs7,This says it all
9kl1c9,A normal russian train
dk7rjj,Normal room in Russia)
ata7d3,How to play checkers as Soviet
8hersx,Uber in Russia
c9m1at,Only in Russia
a4aeym,A litle snow not stop child!
73m3lq,Trying to get on a repo truck
86ssrl,"Russia has Open Carry, no need to conceal"
6k36gp,Super Slav Durability
9gv2h8,Russian tea party essentials
8lae6w,New Form of Russian Roulette
bde5pf,Babushka with axe
c908s6,Cutting an apple with a tank
bh7hs2,Come over friend! We are have nice day in pool!
cxacjz,(X-post from r/nextfuckinglevel) russian madlad
bizqaq,Norwegian fishermen discover Russian navy 'spy whale' wearing a harness and camera.
8ul3cj,Here we see the wild T-90
8jvheg,Vodka in an AK-47. Can't get more Slav than this.
5xoero,Russian soldier tasers himself (любви к Родине)
bhv5rc,Russian Jurassic park
ctrzoc,coUGaR fUcKInG aNNihiLaTEs aN inNoCEnt leOParD
8dbcv9,A Russian bathtub
ccf132,How to greet people in Russia.
ba184q,Tri poloski army edition.
9n05ty,Gods we were strong then
ae9u94,"Improvise,adapt,overcome."
c2ndp9,Russian cookingshow
6x4cmp,Tow Rope not Required.
7qzcyv,Russian playground
b8it32,Just a normal russian bakery doing normal russian things
aw2bhu,babushka
acxi4w,alcohol does things..
bla620,baby comrade
7mwcyz,Mining Bitcoins in Russia
ci90qk,A normal Russian sneeze
3z23qy,What's the opposite of shell shock?
95mvv3,"They say German engineering is the best, little do they know about Russian"
8v9lao,"Vasily was in charge of pots and pan. He screwed up, again [x-post from /r/foodhacks]"
ck8xim,Slavic problems require Slavic solutions
a741qg,Russian men
d5vb5q,Hitchhiking in Russia
83g216,Babushka in the marshrutka
9h4q60,A private russian pathway
8l3i1a,"Wind rips apart a roof in Novosibirsk, Russia"
a9x80x,Sunday Drive
dhs1ja,Perfect tattoos doesn’t exist
9d4jg7,Im just going to pour this in the sewer
9qb0t7,Chernobyl fishing 👌
4jq09h,R2Dog2
8bytyw,A Normal Day in Parliament
6rkduj,Mother Russia approves
byjoih,When you have Russians in East China Sea
7v6q90,Newcomer 2018
8mtp6u,everyday gentlemen
7yea5s,Russia Flag is illigal? so i take another thing. Back to the Past!
8jhi53,Soccer field in Moscow
a7auuu,Metal Gear Саня
7l1mz1,Proper Roles learned right form the start
78gth0,Good morning !
d6u5gx,russian vending machines
b4plfd,Babushka keeping the Jaguar warm
8kxzrm,"Currently in Russia and every walk is ""Russian Ninja Warrior""."
5f52x9,Earth diving
cmwm0s,Boss - Air that tire up and use the safety cage. Safety first!!!
7vzzs2,Flacon 9
6oew09,"Don't You Get Too Comfortable, Ivan"
amlfnl,A normal winter accident.
bbxiop,Oops...
9zxglj,My chainsaw people need me
atku5g,Grigory and Silent Boris
519ecw,Russian influence in Asia
8lqkbm,Ivan's phone mount broke but he still needs the navigation
9vp2v2,Cooking hacks by Life of Boris
9yomxi,The Slavs have taken feline form
6c20yj,the great Russian outdoors
avll8k,"My babushka, in her twenties, downing vodka straight from the bottle. Soviet Union, late 1950s"
cjmx1p,Daycare in Russia
8y835p,Another wedding in Chechnya
ap8ox5,Russian .50 cal turret
dbxoge,Not everyone has moved on.
cq0yfo,A dance to shake the world
b0p0is,OurPhone
cw4mu5,Truly Easy Rider
9ca7dq,When you need truck for truck that you got for truck for car that break down
aihqr3,Woodstock Siberia
8vmwab,Empire striking back
bfn8po,Let's go to walk human
dlajvw,This
9txcqu,“We must be quiet Sergei!”
9bi9jl,Cyberpunk 2077 in Russia
8ieudu,A Normal Russian Selfie
5neq6e,A nice day at the beach
ds04io,Game Of Russians
a5ri59,Russian style G class
cp63vn,This belongs here
9yuqnr,An outside toilet in Oymyakon - the coldest town in the world
814s66,This hood
6yn3a0,What else to do on a submarine?
d1264b,Leaving the house with wet hair in Winter!
dcxqzq,Heartwarming moment two excited lions embrace the woman who hand-reared them after being reunited with her for the first time in seven years!
98alir,Much easier than reaching under your seat
8r30c1,"Putin: “Believe me, i was also suprised”."
bvtbkp,Just your normal everyday pets
7h63jp,Why have a pet cat when you can have a pet lion
9ps85p,Typical russian tap.
7dml5v,"In Russia, parkour is not a sport"
bf1kjl,CyberBabka 2077
c2uxo0,"Russian bus stop, business class"
4pfsih,Dicaprio has a brother in Russia...
99bsxd,Putin on your wedding dress be like
5mrgbl,"Hmmmm, interesting"
7zphka,Doctor's orders
8eagkn,I didn't know it
4e0mvt,Russian Ghost Rider
6qhmer,Audi
9fz5ad,Valet Parking Russian Style
a03d25,Kalashnikov (popular for making AK47s) has unveiled the electric CV1 car
8cbdwq,Totally average Slavic Muslim woman.
4r39dp,Urban hunter
czuqom,When it gets hot
5zn5b8,Normal Russian cake
c54dp3,The best protection
9lmftx,Russian Orthodox baptism in winter. Do not recommend.
5gvtxj,Imperial march with coffee stick
chmkba,This guy was telling some pretty raw jokes about Putin
8s8p4t,Moscow. Subway. Recently
76astz,Hired a new gardener
9frcsq,Russian fashion
6yuba5,I just found this review [NSFW]
70u1pl,Unstoppable military vehicle
9jki5h,An ordinary russian train
9t7piv,Your regular russian Dogeman
6ckuaj,Neighborhood crew
8cf0po,The most slav ring I have ever seen
6865ih,The heart of Putin
a2vh5y,*Facepalm through the head*
bvyffa,Soviet students prepearing for exams in park. End of '60s
9kfu9o,A Drug in Russia
5eo7fy,Russian punks back in the day.
6euzkt,"Hold on, it's gonna be a bumpy ride!"
8gwlcz,Bought wife a car
8nhyz4,Harold's normal day in Russia
ab86sw,traditional russian clothing
8sl0vf,When a Russian sees someone on their phone while driving
6n8epy,Slav Demonstrating Wealth
6ipm0m,Average Pedestrian
cb4vds,Meeting the family
by5tkn,Babushka Stowaway
96oi2t,Day: Normal. Location: Russia. Year: 2077.
8nq4ky,01.06.18 summer hurray!
5mkz5d,"In his defense, it was a warm -40C evening"
7vtumu,This iceman is freezing
7hoxjb,cold weather makes me move
dv8fgi,Look.. snowfall
bk6uwu,"When in Russia, always wear an exit bag just in case"
87pa4b,Slav tombstone
acs7g2,Just a normal cake in Russia
divq6a,Russian Harmony
5yldts,"""Food cooked with love"""
brkpra,"When you want a pool, but live in Russia"
bch4al,GOTTA LOVE RUSSIANS
aiuiva,"Nothing special, keep scrolling..."
6gmdo8,True Slav.
ab4ng6,Advanced PC Cooling System
btwxnj,Crossing the road without looking
679o4v,Attending to an annoying cellmate
ad3vxk,A normal Russian car
afr0x4,Sasha bought a Mercedes
4maiih,Now you get it why Adidas pants have vertical stripes and the sneakers' stripes have an angle.
b9982p,The nice ocean breeze felt at the beach
5xgpgv,It has to be Adidas
8rq2f3,Russian girls are amazing
806dgs,Metro 2033
5ai29h,"""Look guys, I made a thing!"""
cxfniv,Probably the best week of his entire life
97msh6,"Soviet soldier feeding polar bears, circa 1950"
d7gjjs,Don’t go to the bathroom in public in Russia.
ck4f95,Meanwhile Russia holds a training on storm of Area 51 (video inside)
8qhycd,In Russia you bring guns on the plane
ca0mqp,pika pi
adhr79,"Trust me, I’m an engineer folks"
5uxrjn,A true russian sandvich.
9qm9ah,"Thanks, but I'll pass..."
a6y519,The way rivers freeze in Russia
8zkemx,Bus
92mvph,We can do it again
9294el,Happens all the time...
5slo95,"Da Demetri, is called Rocket League. Number one new great game from America!"
9st415,New Spiderman DLC
6o7f9v,Babushka's care
932q14,кот understands how we feel on Monday.
7be0tt,Daily Commute
bn52po,Putin action figures
bl5jnb,Future cosmonaut in training
bcat57,Russian power armor
ac1xkt,Merry-go-round
9wmhd8,Pouring fire in a manhole
7kdp9t,A Russian Hot-Dog
amruzj,That escalated quickly
5i58cz,"As the legends have foretold, The Slavatar has returned."
c8t7eh,Just some handsome
8ipivc,+20 Holy damage
912wts,3 stripe of Adidas know no bounds
caf86c,Got to stay hydrated
99uybj,in russia there is a gulag for children
837mfg,Moscow drift
6tmjya,Russian Gothic
8fgvf6,Oh that's where I parked it
6gsyvl,Man eating lunch in Russia
58bj8l,Russian Chess
8ndx27,I don't know what she is selling but i guess i'll have to buy one
bcsow1,When you said something bad about Putin in the Internet
8o1le5,Russian friendship transcends species
9vth6m,When your tools fall down
7er4ln,In his best Adidas tracksuit
8o7fnr,Magic Carpets
98haqy,Drive-by
6ok5n4,Morning commute
71hr1d,A raccoon wearing a checked shirt eats snacks at a dinner table in Russia
6s55dv,Please never drive again
6q24yl,Before and after visiting Russian clothes shop
8g9qbb,Restored 1941 Lada T-34
9s2m4g,so smooth
8df5a3,Car Stickers of Russia
82o5n4,"It`s our wedding tractor, Honey"
dd0xo1,The Soviet paratroopers of WWII
77egut,Just a priest blessing The C400 weapon system
bx84a7,A normal commute in Russia
av5ofi,Just dancin’
8xo024,Praise the king
84d338,This car art work
66urqf,Walrus asleep on a Submarine
b49906,Mechanics in Russia retrofitted an old car so that it can roll upside down while driving
6hecbd,Russian Home Security
8ek6q4,Charlie Woke Up A Bit Confused
8psurk,When you stop on the middle of a crosswalk
64ovq6,A normal head-washing in Russia
cgpzei,Portal to hell
56tao6,Miss Putin 2016
cylnl0,We're going to History
dhr1ts,this city needs a new hero
76ij4h,In Siberia and cats are hard-boiled
d0j3sq,Boys with PS
7ob7wu,Bringing the wife home after a night out
6vpj26,Russian sports car
cfkwn5,Look whom we got here...
6uamnq,"The windmills are over there, comrade"
82wncc,Russian Roads
bx4kvw,When robbing a bank is just too easy
80hxtw,"Wait, we must drink first"
8b69f3,"1 pissed off Russian guy Vs 4 others[Better known as Slav RPG] but with Ed, Edd, and Eddy sound effects [WIP]"
9862e1,Winter time
50ytiu,It's RUUSSSSIA!!
a1ubza,"'Told you we should've fixed this pipe leak before we went on vacation, Boris!'"
8f9rt7,Think this fits here better (x-post from r/Slovakia)
93lf88,Slav mood of the night
5kwxm2,Dinner with friends
c64m4x,A normal computer in Russia
d89bwu,"It’s Russia, baby"
a8txkz,Classic interior design of a Russian toilet
c5nosq,Just a normal wedding with Lenin in Russia
98st4s,Nice tire
8h56xa,Even dogs are drunk
butoy6,A normal NASCAR in Russia
90nw18,A normal sailor in Russia
dnvuot,Trying to steal a monitor in broad daylight
cnv0jq,"You see comrad, if you show your ass to radar it can't give you fine."
7kwuip,Grenade zip-tied to wheel
9cub8g,Cheesy salary
8e87cg,Don't fuck with comrad's mailbox.
669twb,The scratches are so good that he can bearly contain himself
7gv76o,just riding
7ses2i,Art in pancake house
ca69gd,Cold?
bp796b,Flying on a bar
9cmtlo,Just a normal Mario
bfgldj,A normal coal in Russia
8th13y,"""клекшоп"" squatshop in Sofia, Bulgaria"
9chiov,NO. LITTER.
ceoxz5,Not in Russia but Russian vehicles
7f6obt,The life of Barbie and Ken in a Soviet communal apartment
78ump4,Cat
8c5q92,"Iron door handle, blyat"
833ad9,Parking the bike
80muek,Too much snow? No problem
4od59m,Another boring day in Moscow
baz9if,Gopnik women love hentai.
bd7qpy,Just a white dog on the subway...
95ywih,"Vlad, turn on the AC"
5bzn2a,"""Yes, blya, my IT guy is fixing it right now.."""
ahtuz8,The wedding squat spot
8eyhr7,This latest western entertainment is blast
aepuvx,Don’t pick a fight with me or else...
3hg61a,"If it hasn't got three stripes, it's fake."
74cmjj,Excavators working together
8mz0w9,A normal Russian traffic jam
6p0vkm,You might ask yourself: how did I get here?
7tctog,Catnip dealer
ao5uov,This Camel pulling out car from snow in Saratov. Russia
98m9am,Ivan’s mutt had enough.
4kytsl,Going into space is serious business
9jca2z,Advert for 5l plastic Vodka bottles «for real men» using Vinnie Jones photo.
7dzwma,"*Record scratch* - *freeze frame* - so you must be thinking ""cyka how did I get in this situation?"""
9joqad,Potato.
61hi7t,Russian graveyard
8dmc9m,Poor Masha
4yub7u,Russian disco club
8us5e7,Usual price for russian people
7gm4kw,This should be a sport called Trotski
5svsvx,Russian special forces
9969x6,Man splits giant rock with hammer
8esoxp,The Russian mob has arrived in Brazil
bxt6l4,Just a Russian sneezing
