post_id,title
dpfb24,"My kid is Bloodhound for Halloween. We tried, anyway."
b5m7m5,SEASON 1 UPCOMING TEASED CONTENT
czluld,Oh! Hi! (wife's footage she asked me to make a Reddit post)
axokeu,The reload animation made this feel so much more badass!
dbr8rs,Be careful of who you make fun of in high school
aocnkb,Upvote / Downvote Concept
c0wv2t,Wraith Dodges Punch with her Finisher
dods9r,Was at a Halloween party last night; discovered Octane playing as Octane.
dbxwx6,Dr Disrespects Banner for season 3
asu3f1,Wraith Tip: To see how long your portal has until it disappears watch the recharge meter. Once it hits 39% your portal will vanish.
b63dxc,I drew Bloodhound and his birb a while back. Hope you guys like it!
aqerzm,This is so dirty...
b07msj,The sacrifice had to be made
b7n8t9,I'm quite concerned about where this game is going.
bya6ob,New legend! Electrify the arena! WATSON!
cok1sh,This new Pathfinder Skin is LIT🔥
bc0aks,"We only serve one, the AFK lord"
cg24mm,"The 3 Best Items To Find As Soon As You Land, Change My Mind"
b4z1jn,"Made a poster for Bloodhound, let me know what you think!"
diwn5g,Probably the luckiest apex player we've ever met! WTF
dd5vek,Heihachi from Tekken in the new longbow skin. Anyone else?
dh8klz,The legends as cats (Sorry Gibraltar)
bff45k,This is how you infiltrate a loot-goblins home
dnc5hp,So I've heard you lot enjoy a good Pathfinder's grapple
cc0tpt,Imagine dying like this in the last ring
bvd6f1,One hell of a loot box
dgz65g,How to Play Caustic in 3 EASY Steps!
bgko4i,Sooo... Apparently Epic games has been making People work 100h weeks to push out content. You know what... I can wait for the next Apex update. I don't want Respawn to destroy themselves or go full EA. So let Respawn Employees have a life... Lol.
bg9nwt,what 200+ hours of editing looks like on the apex trailer
c08fa4,The guy your Jumpmaster told you not to worry about
dudmra,I did a thing.
b9gyms,"Rework the Body Shield LVL 4 perk to function similar to Octane's health regen, but with armor instead."
aq6qwv,"You merely adopted the smoke. I was born in it, molded by it"
bbkpyv,Doing our part to keep local communities clean! #trashtag
boj5iu,"Self-Rez has almost never helped me out in this game, but for once it was my savior."
crykix,"PR team and devs, well done. You have alienated your playerbase."
b5pdze,Motion to replace the Leviathans with AT-ATs for May the 4th (Star Wars Day)
asrnzh,New Weapon Havoc
cbucfb,Nothing else matters
c2pnl6,My vacuum here has a built-in Phoenix Kit
crj544,We're Sorry.
b8hqy3,Teammate revived me for the hell of it at end game. I had no inventory at all. Was going to try to revive my other teammate but went with something else.
b3r87k,How about an option to set favourite 3 legends in order of preference to auto select?
cq079z,Leaked screenshot from Season 3
bxv3ov,This is the day you will always remember as the day you almost killed Captain Mirage.
coujey,"Tried being a team player, but couldn't help myself"
bs4ujr,Instantly refill purple armor with this one simple trick!
ao2zvs,I feel so sorry for whoever this Bangalore is
br230p,What Apex has become
b06nd6,I swear if we don't get the battle pass (Apex pass?) today or at least some info on it...
dx8chc,Made a full set of Ultimate drink coasters.
dpm2ff,I've been bamboozled
arsi5n,what your main says about you:
dp2giw,My 1000IQ Octane play
cgetus,A map of locations random teammates are willing to jump to
cffi52,What the Last Squad in the final ring looks like. (100 % Win Rate)
doo4in,"Tips by bean: Don’t land here, it’s not a sniper spot."
d85k97,"Alternator here. Two alternating fire barrels, easy to control. Extended light mag here, level 3. You need one if you don't have it."
dex9s2,Opening a supply bin on the train be like
bsfre6,"Mr ""I've opened 500 packs and didn't get my heirloom"" is either full of it or bad at math. So please put away your pitchforks and stop validating him with karma and medals!"
as8c3a,And the fact that Bloodhound and Pathfinder are awesome
d4s6fk,"Corona here, level 4."
aq8bh7,Apex Legends 2.13.2019 Preseason Patch Notes 01
dwdo9n,"Did a little Wattson Military skin for fun, since I like playing her a ton in Apex. Hope you guys like it."
di72ho,Octane is Daddy
dg9m2u,I got locked out of the final circle by the zone and managed to win
bqj4vk,Golden death box? Most times a turbo charger. Let's see...
bj4u1l,I'm glad we got that sorted out before the game started
apyw9q,Don't Objectify Your Healer!
bcu66m,Matched with a random newbie. Had to pass on my valuable life lessons. Never felt more proud
b1n0j3,Had a go at designing a Level 200 Badge for Apex.
cefqug,1st and 2nd ever Kraber kill (400m collateral)
ayvrl2,"Excuse me, are you hiding in the same bush?"
d4zmw1,When you accidentally press grapple instead of shoot but it makes you look awesome...
asbzsm,So we tried out the whole mobile bubble shield thing...
du9lkd,Spent the last couple weeks building bloodhounds heirloom
bid8dg,Not really a Bloodhound main but here's a watercolor my Dad and I worked on last weekend.
c7de3d,"Wattson's finisher is terrifying, so I drew it"
b2zorz,Season 1: Wild Frontier Patch Notes
dj4nrl,Yo I think I hopped on the wrong evac ship...
dmg8vg,Moments like these are why I love pathfinder -- the style
b5qah2,"Have Lifeline say, “Health Drone not ready yet” when activating her uncharged tactical ability"
d4pw5q,This is what Pathfinder was made for.
btncm1,The level 100 reward I always dreamed of.
c9e0pw,Dinosaur Double Kill for the Win LMAO
ap3gt6,I got to go through a portal during an execution
awy6tv,"Took me some time to make, hope you guys like it *Audio*"
dthwd1,When failure isn’t an option
buvs9h,Limited-Time Event Coming Next Week Plus First Season 2 Battle Pass Details
avfc1k,Lifeline doing her thing.
bxz4rr,Being excited for Wattson because
dlu5h4,My portrait of Lifeline with her new infernal skin.
ashtc1,REQUEST: Make Badges you haven't unlocked darker
d6r3u8,My r301 was better received than anticipated so here’s a wingman.
cog97r,"Just Octane Things (feat. Beautiful, Explosive background)"
bndffc,Apex branded Camaro ZL1 I saw this morning.
d0x4ss,"Good ping, 0 packet loss on my end. Why am I being punished for my enemies playing on toaster WiFi?"
c9cd0p,This would be a nice addition to console
bxdckl,"Suggestion: What if the Golden Armor is the same HP as the Purple Armor, but the segments are in thirds instead of quarters. That way a shield cell heals a bit more than it would for purple."
b1h83l,Underrated comment about ultimate accelerants.
at2g53,Servers are currently down!
cpp7vr,Our devs are being dumb so we will be joining rn apex train tomorrow
dvvh23,Added a little twist to u/Timothyredx19's trickshot vid
ckq6yn,did you know?
bbpxvk,The only way I can ever get a kill with the Kraber
betc6x,This is why you finish your kills
bxt2pg,What 3.5 hours of Apex looks like with mouse tracking software pt.2 (colorized)
czu33e,Is this some sick joke?
arh01i,Spent 3 hours getting a no bullet win.. This was the outcome
bgldg7,"With all due respect to the US Military, where we dropping boys?"
b5t0r7,"Suggestion: Make all golds customizable from the main menu, so they can be kitted out with what we personally think is best"
cmd1ye,"""The most requested feature since launch"""
bb90u3,Well it was definitely worth the grind... (guaranteed legendary apex pack)
bxadw7,Suggestion: Give us golden/legendary magazines that reduce reload time by 25%
d54hx8,Mandatory Weapon Charm: Disconnect 100 times while your team is still alive.
dkzkjd,Game Boy Demake
b2ld1v,Welcome to the Wild Frontier!
d3dn88,How to use wraith the right way
dsdlfm,This game can be so cinematic!
brh3ds,People who have Wraith's heirloom should be able to hold pistols like this no cap.
b4uhgs,This is why you should stock up on arc stars for the late game
cflarg,Muzzle Flash Is Ridiculous Sometimes!
d26ojo,Apex snipers feeling like....
dm7iar,"[BUG] Watch with sound, please dont let this get buried! As a Gibby main, no one believes me and there aren't any reports on Trello about this bug, so I made a video about Gibby's season 3 ""game-breaking"" Gunshield bug."
b1e9w5,6 weeks ago a record-setting game was released...
d8qtb9,So I did a wall bounce :)
dtwutl,Tubby Pathfinder
bjgppf,New digital threat
bf67gv,ScaryColt kicked my ass but least the finisher looked super dope.
aqhhrp,So far the store seems to be predatory. 1100 apex coins for the epic gun? But you only get 1000 coins for spending 9.99.
bacmdk,Found another pupper on the training grounds.
bujvn3,The luckiest string of loot I think I'll ever get
cjg6hy,"Would be nice for everyone to have 5, 10 and 15 kills badges since 20 is almost impossible"
b308v3,RIP to the Bunker Dwellers
dtezj3,This Mirage definitely broke his controller
d44ob7,Got lucky with the end circle and used the rift to win a 3v1 :>
cqu9ph,"Now that things are getting a little heated around here, I just want you to know that Respawn's Titanfall 2 is $2.99 right now (Deluxe Edition is $5.99, you got the full game and all the DLC for not even a quarter of what you can spend on this event). Support a game that actually deserves it."
ce1vm6,So for my next trick I will be turning a downed Pathfinder into a walking Lifeline.
bjwa93,Want a free kill without wasting any precious drop ammo? here ya go
daw3bw,"I spent 25+hours editing the season 3 trailer to be a bit more ""realistically funny"" while we all wait for the update to drop! Hope you guys enjoy!"
bns71i,Thanks for all the love on the last piece! Followup Octane Watercolour as promised!
cvly6t,Your Brain on Bloodhound
cmmm9k,6 shots 0 misses 3 kills
bf2msh,The fact that reload doesn’t take priority over everything else on console is so broken and should be fixed!
ar7yxj,Apex Legends Netcode Needs A Lot Of Work - Battlenonsense Netcode Analysis
dwt0ft,"Apex Legends wins ""Best Multipler Game"" at the Golden Joystick Awards!"
b2zxc4,"New Legend, new season, new GIF 😊"
ax1v9n,I made a pathfinder Snoo! I hope you guys like it!
bcetj7,Not another 3D printed wingman
b9fo0m,"Well Apex it’s been fun, we had a good run. (Hi everyone me again) so it’s currently been nearly two weeks since my initial support request and I haven’t heard a peep from anything expect automated support. I bought the bp and came back to this a few days later. This is my last cry for help"
c43h6f,My friend found this in Berlin. So much potential!
cigy3t,I don't think my heart can take another play like this. (1v3 for the win)
bte861,"Mozambique squad wipe, hate to be them"
cc2gl7,Wraith and Bloodhound could be ex-Gen 10 Titan Pilots
cqlzto,"Why the Iron Crown event Lootboxes are a problem, from the perspective of someone who has suffered from addiction in the past."
chrqq6,Tried to do Fight Club but they wanted the win
cfr39m,Was .4 seconds from quitting before I realized my teammate had the gold knockdown shield.....The comeback that ensued was legendary...
cahlz5,"""If you dont want the Mastiff I'm just going to throw it off the edge so we dont get killed by it"""
bnnr0q,Huge funny but also tiny sad :(
ba0mgj,This happened to me last night and my friend thought it deserved some music. Hope you enjoy it as much as I did!
dk33ru,"GET FIT WITH LIFELINE - Figured I could use a bit more exercise, so here's this for the community. <3"
c5c0z3,REPULSOR HAS TURNED ON!!! It has begun to spin like it should've been
bpjzlo,"Thought this could be funny, was worth the death."
aq7iai,Pathfinder is pretty cool imho
c9qv85,This really should be a loading screen
dvgxcg,UFC all up in here with the friendliest enemies I've come across so far. Shout out to them for being good sports.
dhti42,Fight or Fright collection event trailer
d8fja6,"My friend pointed out that all the funky letters spell ""Answers Tommorow"""
cj3vgc,So my teammates disconnect before the game and then this happens
brpk1f,Always use doors to your advantage
bqwa50,My Mini Octane does it for the rush..AND the fans.
bgs0i0,Loot collection!
aos5id,I made a Legend-concept based on Titanfall movement
cjuxy6,Everybody is complaining about the final circle but I’m kind of having fun with it
dac1dr,"Finally finished my Wattson fanart. Had some trouble finishing this but here it is, hope you guys like it. :D"
arc1se,Does anyone else find it a little annoying how intense the bloom effect gets when entering and exiting the storm?
cyq7hm,"Wattson, my first hand made cosplay"
br58kw,This Save Could Only Happen Once Per Lifetime
dnfkf7,My son pieced together his own Octane costume.
cyohlj,Mirage putting on plenty of deodorant before the W.
apshkf,When I forget to relinquish the jumpmaster control. [OC]
b1hs5x,Of course Wraith has a knife
ca6vl2,Major props to the design team - ‘Extreme Measures’ is an AMAZING redesign of ‘The Victory Lap’
dv3imd,I've edited video and mixed sound for 13 years and this is the most fun I've ever had on a video project. Here is my fan-made Apex Legends AMV
aw7yzh,My preferred loadout.
atv2ty,Pathfinder's Mission to recover a team mate
avan1a,Took one for the team
btk0xh,If Spiderman had a P2020!
drysd8,I know I just posted something but...
b95e0i,Suggestion: Change golden armor perk for something not useless
b7b4rk,anyone ever seen a simultaneous squad wipe before?
arv8h8,Amazing Trickshot (I can't believe I hit it)
d0fgcl,You got bambooz... oh wait
b1q7px,Margelore (inspired by u/schnaks)
cl62zt,"""So, how was your week?"""
dasv5h,Drone friends!
bftlt3,Every time...
clvaz5,Moments that reduce my heart's longevity
bkjogb,This is the closest win I ever achieved and I'll probably never achieve anything closer
c4tegx,Mirage ultimate for the squad wipe to win the match.
dakqum,Playing this game as colorblind sucks. :(
asv6z6,Every Bloodhound wet dream
by1me4,Don't tell me Mirage ult isn't OP after the update.
d21yn0,The Voice Actress For Bangalore got married 🥰
d6b0e0,So on the Titanfall Wiki theres something wrong with Bangalore...
bk8ux9,The Longbow is DiSgUsTiNg
arqosu,"""The perfect slide"""
ch7p0a,Button proposal to collect all the loot. Only and exclusively my own loot box after a reappearance
b2ggqj,Oh man that was a close call...
dxg91e,"Can't believe I made this shot , still freaking out about it"
bqgvro,I never realized there was a helmet breaking animation on headshot kills until looking at a replay today. It’s pretty cool.
bp2jfe,"Finally, I can return to the outside world."
bru2h8,Would this not be a perfect caustic skin?
c6s2bi,Anyone else loves how the Leviathans were so angry in the Launch trailer but apparently only eat plants in-game?
c2wpj9,"My mission, grapple a flyer. I both succeeded and failed"
d1wizd,so I made a montage out of killing TTV's with their reactions and I thought I'd share here. hope you enjoy :)
bczjj8,My experience playing apex today
dkmbhm,Safer in the bubble.
bcrll2,Got to hang out with a family of Nessies thanks to the bin bug.
dk83ce,Damn Right I Swiped Right 👉
at7x1c,Bloodhound and Bangalore are my favorite legends to pair together because of plays like this
b7xwwl,Mozambique Appreciation Day
cb5kkr,"You can grapple the legs as they're moving, makes for a pretty awesome ride xD"
b1u6uo,I tested all the interactions between Octane's Jumppad and all the other Legends
br9j42,So I think we can all agree that the Triple Take is just a shotgun with better range
bmzot3,Probably gonna get downvoted to hell for this... But my buddies and I still enjoy the game even in it’s broken state. All the complaining on this forum makes me feel sick of this community. This subreddit has gone from friendly to salty real fast. Please don’t affect the game with your behaviour
c48trv,Backseat Jumpmaster
bhbhi9,An Update on Apex Legends from Respawn
azkvsb,How I felt when I saw the Mozambique for the first time
b1610d,Poor Overwatch :(
b5s9tm,There is a special place in hell for people like me.
cbxz1z,Finally finished my Bloodhound artwork after three months of going back and forth with the piece!
cpx4db,Vote with your wallets! This pricing model is a disappointment in all aspects.
bov6i1,Your Apex Prime Package Has Been Delivered
c7z6bu,Apex Legends Season 2
bhyfyp,What this game really needs is item synergies
d5y6ap,Crypto LET ME IN!
by78mo,Painted my favorite Wraith skin
apu624,Petition for people to receive apex packs when they win a game
dp84e2,⚠️ H A Z A R D ⚠️
dtqa1t,This might be the peak of Mirage gameplay.
arx9fy,I drew Mirage. Took me a few hours. (I’ll post the better version later.)
dr7lxa,Broken game or new mod?
duy46r,I animated a Caustic finisher I call: BEAKER BREAKER
bs1581,Apex Legends’ revenue drops drastically for a second month in a row
djaf2w,Omg this skin is AMAZING
cpcdgz,Went to a local comic book store and found these..... yes i took them home 😎
bdvs0i,1.1.1 Patch Notes - Patch going live around 10am PST on 4/16
bwl786,No...Please :(
b9b3z7,"People should automatically ""Unready"" if someone leaves the lobby."
awgt4i,"Pack it up boys, Apex gets boring too quick."
d0sgts,New Leaked Mirage Rodeo Emote!!!
c4lzgs,Honest Apex map 2.0
bz7dc6,"Since a lot of people don't see the difference between the Leviathan locations in my last post, here is a better comparison from a similar angle"
cww80d,Man I love Octane
c1y3fd,Accidentally found this spot
awryjm,Proper portal usage
au99h1,What happens when the whole server drops bunker
bk2k4x,Just a Pathfinder Doing Pathfinder Things
clj8eu,Epic Pathfinder Play
auo4w0,My first squad wipe! As an average player I just wanted to share it with the 4 people who sort by New.
bigtry,We had no idea where the last guy went... poor guy never even reached the ground (alive)
ci0yt0,"How my past week of Season 2 went, in four minutes and twenty seconds."
b4j46e,Pathfinders Grapple can be satisfyingly smooth.
dag0yt,"Gibby Is Tom Cruise From ""The Edge Of Tomorrow"""
aq5y47,PSA to younger Apex players on loot boxes
cn37r3,Most terrifying APEX moment in my life
bocz9u,"This is the ideal wraith player. You may not like it, but this is what peak performance looks like"
aqurnu,Suggestion to see your teammates ammo type
ar9bze,Instead of balloons we need titans around the map that gives players free yeets.
bdmy19,"Say what you want about Caustic, but he's the only one who can defeat Bloodhound's crow"
dtc3q3,Frag artist A streamer who donates to disabled veterans is the first person to hit 1000 season 3 wins
b3dtfk,Dodged the final enemy's punch with Octane's Finisher before winning the game!
dl1335,"I put in alot of effort in this, hope you guys like it"
bmtulz,Pretty much sums up this game...
b2ia9h,Speed hacker runs too fast and falls of the map...
csugfq,"I'm just not sure why the COPIOUS amounts of constructive criticism and legitimate concern was ignored, and the devs scrolled down to the dicks and ass-hats to reply."
dlo6rv,TIP: most people think there’s not a way to get up to the top of Train Yard without a pathfinder. It does take its time to learn. But once you do. It’s a game changer
csiqjp,I drew Wraith
axw8ps,to the annoying ~10 yr old and his uncle i played with yesterday
b1i20i,I Main Genji In Apex
ar2pe5,Apex Fanart - Hope you like it
b7gipa,The worst way to respawn
d1h59v,Have some Wattson fanart! Taking some time off and relaxing <3
apbtcp,I feel like there was a skin mix-up with the LMGs
aogthg,"Wraith's punch is too strong, please nerf"
ar8etp,Totally calculated.
b4n7w6,I didn’t even know collaterals were a thing in this game
c8bul6,Season 2 Battle Charge Begins! Patch Notes Here.
d010zv,Finished making something cool yesterday
dkjd78,Feel the heat
c3ngkt,Everyone in Apex Legends right now 🦅 ‘ca caw’ 😅
anqe8e,"The no-hype marketing strategy is going to become huge. If EA had pre-announced a “not-titanfall” free to play, lootbox, battle royale — it would have been dead on arrival. But no one had the chance to whine about it, and now we all get to enjoy a great game."
asmfju,Gotta feed Lifeline her ultimate juice!
dx6g8i,With the recent Peacekeeper buff I feel like this meme has become more relevant
ao4zsy,Pro-Tip straight from a Dev
cipmq9,No ammo and my Grapple (Always wanted to do this!)
dk1vda,"Trick or trick, that’s it really."
c5nj8v,Pay attention to the ammo in both of my guns
as5v3l,[Idea] Friendly ultimates should have different colour.
b2ki6f,[Serious] The country of Mozambique needs our help after cyclone! Please donate!
cso9oe,Head of respawn responded to the recent things going on here on reddit
bd1dbj,I made it to the giant animals outside of the map but unfortunately you can't land on them
ast6yw,Surprise Mothaf***a!
ciyjnf,"I just tried to launch one dude off the cliff, ended up launching two."
cetcf7,Found this on Twitter
aq5dqg,Loot Tier Zones Map to alleviate drop master anxiety
dd225g,Mirages new quip for pinging geysers is hilarious
b2xfxl,Can we take a moment to notice Mirage poking Wraith's hair bun
d5lnk4,Crypto's new teaser be like
bsp6l4,I've seen some things man.
auvoxu,All those games of waiting... Finally someone fell for it!
b1bo05,Thanks for the respawn.
c8tm8i,"Can we please get a ""Mark all as seen"" this is getting out of hand... (both for legends and loadout) Thank you."
aqitfe,No one's talking about bunnyhop-healing so I guess I have to show you myself.
dnqfwu,I kidnapped gibby and murdered him......
asmzt0,So Respawn... how about Night Mode?
b9l40i,So i have made an Apex Loot Pack!
cevj0o,Saw these guys at SDCC WINNING
bxh3mu,Wraiths voice artist as wraith. Photo credit to “mizuri”
dqt8by,All aboard the Octrain!
axlp6t,Everyone is showing off their cool grappling tricks and i'm just here like
caeg8f,"This has to have been covered before but I just realized why it's called an EVA-""8"""
b64ftv,I painted a chill Mirage sunset scene
as007r,"Excuse me, I just need to grab these banners real quick."
b1k6f0,some say he’s still zip lining to this day
bjiqvo,Got tired at work and the first match I joined...
cz8y75,Downing 10 people at once (INSANE)
ap3go7,"For April Fools, Respawn should turn fall damage on"
cmtb00,Solos Limited Time Mode Coming 8/13
b82df3,I have met my equal on the battlefield.
awfjh1,New hero confirmed
c9i4if,Can we take a moment to admire how amazing is this Caustic 'Black heart' loading screen?
at7cm6,Chappie wears his heart on his screen
axv3xh,Boom. Double Headshot!
drvp9b,Well this was... interesting
b90yrk,Just got this L-STAR and it’s not even in game yet
deiggw,Who doesn’t love a good ol’ bouncy house!
dromwb,Pure skill
cgt1k0,Idk why but...
byuaow,Random Lifeline with the kill of the year!!
b4f2i7,The Voices.... Void Specialist Wraith Fanart I painted... On Myself.
axcw0i,Who's Ready to Fly on a Zip line? I am!
arnzng,"Just received this off my 58 year old dad, he's not very good and doesn't understand half the mechanics but he tries hard! Thanks to whichever of you PC boys carried him through!"
ci7vgk,"If you play opossum good enough, sometimes it just might work"
aypqdy,Not falling for that...
cbhy0r,If Apex Legends was a retro 2D fighting game [OC]
d08w02,My girlfriend’s DIY London Calling Cosplay from AnimeExpo2019!
aoumle,I knew that looked familiar
c11vek,"I don't know about you guys, but this is where all my good games go to die."
ckaw01,This has to be the most insane kill ever. Clip from Aceu
axf8tt,Shielded Fortress
d7ya5i,"Respawn can you please add all the attachments, scopes and hop-ups to the training mode, its really gonna help us use every weapon too its fullest."
az2zae,Wholesome looting (credit u/shitty_watercolour)
d43rov,Crypto got so mad he put bloodhound into a different game
bsiuak,"When you play with randos, work really well together and win with everyone equally carrying their weight but then neither accepts your invite to play again after the game :("
c1n3bv,Can you make that when we open the inventory on console the cursor will reset to the center of the screen? Will help to drop things quicker.
b34130,The best use of Octanes ultimate
dr2frb,Thought that I should share this on behalf of Enyo Sarah. What do you guys think?
axbjvw,"I'm terrible at this game, so of course this is my first kill..."
atjte9,[humor] when no one wants to be a jumpmaster
chlndk,I need more of this on my insta feed
bxl8j0,I had no idea Mirage's finisher looked this ridiculous from a third party perspective
cwro07,Why Pathfinder is the best
c1iwx8,Did I do what I think I just did?
daap3e,LEAKED SEASON 03 GAMEPLAY TRAILER. Apparently EA Korea accidentally launched it early!!!!
cgp3he,I had to do it 🤣
clpx5q,A very unexpected win to get apex predator
arjiwn,"Been playing this game everyday for the last 50 years, still fun. Good job, Respawn :)"
aofmpv,"Please, for the love of God, do not reduce the TTK."
b33fxz,"Just a heads up, Octane's ult has a very precise hitbox"
b5fmtw,Shroud summarized in 6 seconds.
cj9aw1,"I made a piece of Apex Legends fan art and wanted to share it with you all, I'd love to hear what you think!"
aqa24e,Caustic’s beard makes it impossible for his respirator to get a seal. / OSHA VIOLATION / Improper Use of PPE
awmep7,"Don’t ban cheaters, instead discreetly blacklist them and make them play against each other."
anufmq,QoL: Show teammate Ammo Type
apt43t,Finally finished the Pathfinder wallpaper *high five*
bqqr9c,When your super thristy! (This guy was not happy!) 🤣
def06t,Crypto currency
b7e5me,"I'm an idiot and missed the fanart deadline. Here's my painting anyway, ""Three for All"""
b9yean,The way this guy got banned over and over is just satisfying! Thank You Respawn!
awlqhg,"You guys like my bloodhound work so much, I decided to make this one. Hope you like it!"
b2v26b,Season 2 rewards leaked
bykqy7,"The new Caustic skin is great and all, but can we give some credit to the guy they got ""inspired"" by?"
dt1z5k,"Since you guys said I should do more Wraith, I want to show you that I have! sorry for kawaii pose idk how to model."
ap0kpc,"“My dad owns this game, he’s gonna ban you”"
