post_id,title
bv5wbd,Rate my squad mates!
bpdcap,I’ve never been more upset at myself...
c7625x,3d printed Wingman now it just need to be sanded and painted.
aofu3d,Enjoying the game so far
atngj2,I can't decide...
b5gfrz,Using Octane’s ultimate in the final circle
c5szas,CRYPTO LAPTOP has appeared!!! [Video]
bsybol,After hearing my boyfriend yelling this for two hours...
c22zrq,"The champion squad’s sociopath, a horror story."
azv2p6,Priorities
de8aju,"When you clearly said “Ring is moving, Oscar Mike ladies!” and none of your ladies are Oscar Miking"
d9ydgl,Leaked image of Kings Canyon's skies on October 1st
bx4b2t,All right Ya'll LISTEN UP I'm gonna teach ya a thing or two on how ta Spitfire and become an Apex Elite... listen close and listen good
aot8kh,QoL: when you unbox a new skin instead of telling you what skin you already have equipped it should show a side by side so you can decide visually which one you like better instead of trying to remember what the skin name is
atqpfb,Anyone else think this is a stupid system? My one complaint about Apex
burpee,Living on the verge of death is what I do best
azy48w,Upcoming Legends Datamined Today [UPDATED]
bsh5yr,The creator of mirage is somewhere smiling
d61nkk,What we see vs What Crypto sees
c3rn3x,Calculating grenade trajectory 🤖
b26tdr,Using a downed enemy to my advantage
b3xy9n,This guy kept pinging “I need health” but wouldn’t pick up the med kit.. afterwards he got on mic and yelled at me for doing this😂
aou1o5,The removal of a Pre-game lobby is a good thing
dqi2o9,My best 1v3 clutch to win all thanks to the gold knock and backpack
ca9pzp,"""Im taking your breath!"""
apugxj,Trying Apex Legends for the first time
b88vva,1000 IQ
aw7neb,Take notes shroud
c16yz0,When there’s two squads left and you all decide to duke it out
cq3rwu,Heirloom concept - The Iron Collector. Pride and accomplishment sold separately.
c0sgq7,🔥💀 When Mirage’s Legendary Finisher Comes in Clutch 💀🔥
dsrjkn,“Thats a happy fence!”
c68e0s,*Crunch*
aqyv5t,It would be nice if we got some sort of notification that we unlocked a badge on a character after a game
cvhxv6,I made a medieval map of King's Canyon!
dslho2,I too agree this game can be cinematic.
ar778o,MAKE THE DEVS SEE THIS: Please make the teammates banners transparent. It blocks vision on enemys: heres a clip showcasing the issue
d91c8z,Hidden picture in new Apex twitter picture by increasing exposure
d3skeq,It's at 100%
c24vkz,Apex Legends Season 2 Weapons Update
dn0niu,"""I Guess this is... Goodbye..."" - a doodle I made of Caustic's barrel. The one you left behind."
ap081r,Winning a match should grant everyone on the team an Apex Pack
ddu226,An entire family of nessie plushies
baksi1,I made a borderlands intro with the apex legends characters
bmxfmo,Bangalore as a damascus steel statue with tempered steel accents
awa5fv,So i was supposed to party up with this guy I met on a discord server but ended up getting on with some friends and i some how got in with the dude i was supposed to party with and he was the final kill....
ax72y0,Can we please get revive tags removed when enemies are standing behind them obscuring vision?
c7wdc6,Respawn is not playing around anymore with these quitters and I love it.
b1i1cp,Made a custom legend - HEADLINE - Interested in any feedback on the design!
bybyq8,no cluster foxtrots in my unit
clg4el,This was the most boring match until this happened...
b6kd50,Why I absolutely love Pathfinder
c00tug,Random Lifeline with the kill of the year!! Part 2 - Lifeline's POV.
cwhje4,So.. I just 3D printed a Leviathan
dctbnk,"Oh yeah, now it is complete!"
douli5,Be careful what websites you go on kids
bo2iz8,I wish there was a kill cam sometimes...
c8432k,Found Bloodhound in my Titanfall 1 artbook from 2014
b3p1mw,"RESPAWN, PLEASE...DO IT!"
b26o5w,That one guy who always brags with his kills
cmylu1,Community Event for the Solo LTM! Would be amazing to see the insanity that unfolds! (Sorry Respawn)
drkwih,Get yeeted lol
c3e6w9,Idea: Apex Legends Prestige - Progression Beyond Lvl 100
ax0oua,A MADMAN
b1u6qk,Teammate saved me from an execution by yeeting a Bloodhound off the ship
bo7vzk,Arc Stars >
b4ej4b,Fatality
dc70ce,"I was wonder ,why Crypto have such a strange and interesting skin, so I search and find that this is traditional South Korean lion mask and lion dance (u can see also Crypto banner with lion). Hope it was little info but interesting. Thanks Devs for interesting stuff in games."
aqmdrn,"Welcome to APEX.. where the more creative you are with your movement, the more crazy gun fights you will win."
dftudz,"To the Pathfinder that fought me in the Dojo tonight, if you see this...Thank you for the fight!"
c3xxtq,Fired up the laser cutter
bppjdn,Who said apex don't have team deathmatch
b1t2ix,I have peaked
btvh4w,Finished my Bloodhound costume.
d78pz1,Oh ho ho! It's sshowtime! Octane fan art by me. I call this skin 'The bone collector'
b3apsy,WINNING HAS NEVER BEEN EASIER
apm40r,My cousin that doesn’t have reddit just did this... Flying kick kill
d7t4aw,Got the Bamboozlin in again this last weekend. Thanks for all the love Big Texas Comicon.
ap7rr4,can Respawn add an option to play another round with the squad you were just with? sometimes me and a squad are ballin and then i never see them again
bdiics,19 death boxes in Bunker
apy43w,"I entered my own portal by mistake, looks like the guys camping it were more surprised than me"
anmphh,This ending was INSANE! Apex is off the charts.
bemun2,I made this small Octane out of clay! Hope you like it!
dqesiz,How to make 15 shadows angry
d158aw,"my game crashed, and this is all i could see. did i die and go to heaven?"
av6rgn,How 2 Apex Legends (40+ hours of Editing)
cpisg8,So Pathfinder Spider Webs are a thing! 8 is my most so far.
b3i61o,My teammates left even though I grabbed their banners but it led to me having the game of my life!
apv627,"Hey Respawn, could we get ""Total Kills"" and ""Total Wins"" added to the Tracking Lists?"
ci3w09,When you feel your MW2 skills creeping back
bp16cd,Oddly satisfying
d17jwb,He just crawled off with my banner
aycr0e,The AVERAGE Apex Experience
d8n4v5,"Check out my Bloodhound Cosplay! 😎 I had so much fun with this shoot, feels so unreal!!Kudos as well to my awesome photographer, North Gevero. Can you guess what my gender is? 😉"
bu4x3w,Highest point on map - Kraber Bullet Drop Extremely Satisfying 345M’s- Wait for it
b31kp9,"Octane lost his legs to a frag to set a gauntlet speed run, commonly called fragboosting over at r/titanfall"
b0bau0,Mirage Hip Hop/EDM Track (Full version as requested!)
chxxaj,"“During development, we use heatmaps to look at where players land, move through the map, die, etc. We use this data to draw conclusions on map flow and balance. This is a heatmap of Legend movement from about 6 months of testing internally, before we shipped” vía Jasón mcCord apex lead designer."
bed8cu,“That’s a gigantic freakin rip”
asbl9w,Portal 3 looks insane
c1ta3l,Found a Mozambique on my trip to Japan
azb1bt,Something is up with my wraith portal
dbykgv,All the legends facing the same way expect Crypto. Literally unplayable
apriq4,When your team gets deleted by a guy with 6872 total kills.
bmn29x,All of my Spider-Man training has led to this lol..
apd1uu,This clip has got to be the number one best moment in my apex legends history.
c9rycg,Watson’s real use
ao3z9b,/r/ApexLegends just hit 100k Subscribers in 3 days!
dbgyb6,Teammates Now Call Out When You Are Being Third-Partied!
bcwn3h,This caustic literally scared the shit out of me
cs3tvw,Calm down everyone! Respawn is only teasing the next legend!
c4ui2p,3 Shots for 3 heads
c7mx4c,I think we would all love this as a Caustic skin!!
axeozv,Biggest lie in the entire game
d35nmw,"Within a day of arriving at the Preseason invitational, I get really sick. I told EA and they sent this up to my hotel room 😭"
cyrsqo,New Apex Legends cinematic | Stories from the Outlands – “Voidwalker”
dur1zs,I had to go AFK and came back to this
b9dhcr,Jumpmaster should have option to detach teammates once you get to a certain height to prevent landing in the same building.
b3kp3x,I guess the new octane ultimate has its uses
b2xqzd,Ran out of ammo and encountered the smallest circle I have seen so far
ck27lb,What 1000 hours of Pathfinder looks like.
dnot62,Wraith and Crypto coincidence
cqysik,"All credit goes to @zimtdrache on Twitter, incredible work!"
dn68pc,All I needed were a few more points to rank up
b0m5a0,Best kill ever with Nox Gas
bw4iyf,So today I brushed my teeth and realized that my toothbrush is the new Flashpoint Wraith 😅🌚
cy3qzw,"Finally, the grind is o-"
bo41pp,A Tippex and pen drawing of Pathfinder
crn0gv,Respawn's apology in a nutshell
czb52n,"3D Printed Apex Legends Shield Cell, Shield Battery, and Phoenix Kit"
cm0ube,Current diamond ranked state:
as9tab,Controversial Opinion: Apex Legends will live or die based on the cost and benefits of the Battle Pass
d3n9d9,All I could do was laugh at this poor bloodhound
aq9ans,The Holy Trinity
aqjtf2,So thats how you play caustic
dr2752,My first try at Octane Map Art
c37a5p,That beautiful time of year when the Shield Cells are in bloom 🌷
ay07u7,Mirage's lobby Photo animation is actually a banner pose.
b5wdqb,"Bunker has been changed, but this doesn't matter!!"
bgfprz,Gibby the suicide bomber
d38tvp,"Live total In-Game Damage Stat - Although you get to see your total at the end of the game, having a live tracker in game would be great for those chasing badges/increasing awareness on how your combat is progressing. (P.S Apologies for my dodgy MS Paint creation haha)"
djet2n,Unlocking sixth sense. (my artwork)
dqjcps,"You can stay on top of ""slide off"" zones (like the actual top of Tree) by placing Caustic traps."
b0reek,So I found this interview with a Respawn employee...
ax3haf,"Saw the other one, made my own badge"
b4zr6i,Intense Clutch Finale 1v3v3 Killing All 6
c8w6eg,When Wattson put her defence and you're watching on enemies team
b591g2,This Octane’s stim drop animation
c00k2s,"The Navigator skin is AN ACTUAL SOLACE MAP!!! Showing Leviathans, Flyers and Prowlers close to King'S Canyon!!!"
b0c9ut,New Update is looking great so far
ave0my,My friend’s banner got exploded off the edge of the map but landed on the rocks below. We had high hopes that this would work.
cdmgno,"It would be great to have more creative Limited Time Modes that would cycle in and out, how about a Chamber Match style game mode?"
chhsje,"Every time someone leaves early in a match, I take a screenshot if we win and I send it to them. It ain’t much, but it’s honest work."
aubenk,u/Hold_the_apples bunker drop except its ballroom blitz
c5jwno,"Dang, no teammates and im still picking last"
dn2cvu,Created this graphic during some spare time. Took a lot of trial and error but finally happy with the finished product. Hope you all like it! :)
dd9vdy,Gotta love easy daily challenges!
duvkgh,"Random Frag FTW, Literally"
dab58u,"And thus ""Bamboozle"" was born."
dlw7um,Am I the only one who always gets bamboozled by this pipe in Sorting Factory thinking its a level 4 helmet?
ba3n0p,Advanced rescue mission vol.2
cma2dp,I miss this place ;/
ay5q8c,"Shots fired, double timing it!"
axtvxx,Caustic’s legendary skin “Sixth Sense” has a game breaking visual bug...
ayxqla,Everyone opening Level 4 gear and then there is me....
cd4izz,Octane was a little bit too sure about winning
awfja1,Pro Tip: You're supposed to break off from the jumpmaster and choose your own building/section to loot
b35608,"Opened my show on Saturday with the Apex drop song followed by a few ""Mozambique Here's""..... 95% of the crowd we're thinking wtf but it was worth it."
at2mdz,Pacifist Champion
b66zoy,Sniper senses kicked in at the right moment!
axdnhm,"So apparently the ""care package push"" pushes bullets..."
as5hp8,I Spent $5 on Apex Crates. Here’s my Story
csvrfk,"To the guys who had the dedication to carry that many nades, WHY"
bekgcm,9000 IQ grenade
baw8vx,"With The Release Of Octane, There Was A New Meta Handgun Ranking"
djnb8x,"So, how's your day going"
b3drz2,Octane and Pathfinder work so good together <3
asyq5h,Does anybody else think that listening for and finding these is one of the most fun things in the game?
azqfca,Mirage needs a new passive
c8zse7,Wattson fanart by me. I hope you like it bois
