post_id,title
ap5z3r,This guy deserves nothing but respect. A one armed veteran going by the name of “ToeYouUp“ on Twitch getting his first Apex win. Incredible.
b0uif2,The state of r/apexlegends
ay44ko,When you're playing solo and the squad head in different directions...
avrk2w,"11 months ago, this was leaked in r/titanfall. All he got was pessimistic comments."
bu1wsw,"OP claims to have made a Bloohound Cosplay. Get’s 20k upvotes, 400+ comments of praise , dev-comments and gold. I cautiously suspect stolen content. Get downvoted and ridiculed. Turns out I was right."
b49bay,That one teammate
b0qwet,Give us the battle pass or the space cow gets it
aqf1ck,Me :(
aqluy2,"Petition to make Pathfinder say, ""My battery is low and it is getting dark"" when low on health"
apefd7,Welcome to my Lab
cqe9u7,Leaked screenshot of future Apex update
b7tssb,I won the game with a jump pad triple kill after both of my teammates quit! Can't believe my last ditch effort panned out!
aqzlkw,In this game I haven’t felt satisfied with any of my wins yet. Does anybody else want this instead?
b9qf4z,"Hackers are crying, it looks like a huge banwave hit them. Good job Respawn."
b0nmjl,Apex guns ordered by sound
b1z591,That one teammate
aw8o1e,Petition to give the Moyai water shoes so they do not step on pointy rocks
avqht3,New Legend Leaked: KARMA!
cscsua,Apex monetisation in a shellnut
at5wic,Let the kill leader have a crown on the skull next to their kills!
b04lv6,"Let us bite peoples ankle for like, 5 damage while we’re down if they get too close"
bm2lh8,EA trying to stay positive.
auu3ot,"Jokingly asked EA support to play a game of Apex, did not expect this."
aqqt5j,Pro Tip: Take control of early game with this method when you're unable to find a gun
b29625,Basically what’s been happening in this subreddit these past few weeks...
dpro5b,Respawn Dev came to work dressed as a door from apex that he helped create lmao
ax7edd,50 million players
b3qjp1,PULL!
atr7rr,When your squadmates carry you the entire match
avz65t,Lifeline Cosplay
dct95i,Don't Forget To Wipe
aw5yxn,A friend of mine suggested adding Proximity Voice Chat. So I made this video to show why we should('nt).
bb885f,If Respawn listened to this subreddit's UI recommendations
b2p07e,This sub right now
bfqcxa,Thanks for the info!
beylfm,Death box got stuck in the air so I had to improvise
cr3jsd,I just had one of those moments you usually only see in game trailers
b1jios,My first impression of the jump pad.
b6izri,Sometimes you work well with your random squad. Would be nice to be able to vote to stay in the squad for the next match.
aulyuq,Wanted to make sure that this amazing gem did not go unnoticed.
aug2aj,"In honor of the $18 skin in the Apex Legends store, let's harken back to Titanfall 2's $2.99 camo pack with 20 universal skins for every weapon, Pilot, Titan, and Titan weapon."
b3404e,Wait a minute....
aqu464,Figured out how to walk Gibraltar shield!
bucpnv,Just a reminder from your friendly neighborhood Pathfinder
ath2lc,Found some armor in my hotel lobby
b249eq,Become FIT Apex Legends
bbqc38,Longest grappling hook ever recorded!
asm7g5,"This will probably get buried, but this one goes out to all the randoms who like to wander off on their own. [OC]"
aygfv6,Map shows we're spread out a lot
awt7bv,Suggestion to Add Mozambique Pings Tracker
awnl9j,Wholesome
c0kbuu,This is what I show my friends when they ask me how good I am in Apex
dkom5m,"My gf is very shy about her art, but I convinced her to let me post this here :) Hopefully you like it as much as I do"
axjij6,Something's not right..
b0fg8s,Some great advice for PC players
c8jsm6,When the new girl gets all the attention...
awxw5m,I know it's not easy but we all need a bit of patience
au80j4,Found out Pathfinder can do this
cdfe43,"Most of the time I play this game I do it with randoms. Occasionally, my team mates disconnect before giving me a chance to recover their banner, and sometimes I win the game solo. I wish when that happens, a message like this shows up in their game."
av3v2j,When you bamboozle yourself
aycamq,Trying to raise awareness
bc4b35,The Alternators primary use? Holding attachments until you find a R-99 or R-301.
b390jo,whoever came up with the idea to have Octane run like that deserves a raise.
baotl8,I hope it left you satisfied #apexlegends #loot #3dprinting
co3aew,This shot 100% got me reported lol
au0q08,When you watch too much anime. ¯\_(ツ)_/¯
cnnhuy,I wheezed so hard
blx28b,"New badge concept, what do you guys think?"
archtj,"So there I am in a now 1v1 scenario, healing myself with a phoenix cause I'm 1hp, and all of a sudden the last guy HURDLES MY BODY and takes my portal which leads OUTSIDE THE CIRCLE, which then CLOSES BEHIND HIM AND HE DIES."
b2b6qd,Let's talk about scopes
b91hdz,This is what 150+ hours of Bloodhound looks like
bjt195,Don’t camp see what happens lol
cxi54t,Calculated Nade Play 🤔
b0bun9,When you ping an ultimate accelerant
bkek46,Voices of Apex legends
cz4gag,Breathe it in!
dgrs4m,"Masive thanks to Apex for adding my little mirage drawing i made long ago into the game as a little easter egg in the first loading screen. I swear, that alone is now my permanent loading screen now!!!"
arwbpa,"Guys, I think they sent in the wrong package"
cudq9b,Who’s ready to fly on a zipline? I AM!
ds6fug,Someone suggested I post my Halloween costume on here. So I made a reddit just to show y’all this...
czhp74,Too all you below average and god awful players...keep grinding. My K/DR was locked in 0.11 for ages..... not anymore ;-)
auk4bn,Imagine thinking you won the game and then this happens
b6b96b,Grapple is by far the best ability in the game.
b1tixa,"Henry J. Waternoose set to be next Legend following Octane, here's a screenshot of him shielding"
ctknr3,How it really goes down at EA
azximn,My wife's handcrafted Peacekeeper
axnbaw,Anakin is THAT teammate.
b19oqy,"I’d like to thank Respawn for including my best friend and I as cameos in the game. You didn’t have to do this, but you actually modeled us in the game’s map and I am eternally thankful for that!"
dmua3l,A little meme i made
cpwoqr,"I’m sorry Respawn, but this is where you lost me"
apr42o,The decreasing amount of Apex Packs as you level up feels like a punishment for enjoying the game.
auo0fj,That actually looked so sick
b1458a,When you have been playing too much Apex lately...
b605e6,5 hour freehand sketch of Bloodhound. If you guys like it I'll do the other legends :)
dswm76,"Not even going to deny this is a dog play, but a fun one at that"
azts23,I really like this dudes idea for a rework for Mirage’s (currently pointless) Ultimate
avi90d,When browsing this sub at work pays off.
b5b0u9,"Give Caustic and Gibraltar ""Momentuos Momentum"", making it so they cannot be slowed by bullets since they're both ""Larger than Life"" characters."
bl2x0e,Dodge skills: Master
b5pu4j,Can respawn please make the golden wingman come with a digital threat instead of a 1x - 2x variable?
ce83gq,"Proud gaming dad moment🏆 me(lifeline) and my 8 son(pathfinder) got our first ever win on apex legends, albeit the 3rd member carried us the full game but we both got 4 kills each and he's now went to bed singing we are the champions. These are gaming moments that'll live with me forever."
cdltht,Good thing I respawned Rocky Balboa for the endgame KO
au9oiv,No wonder why we couldn't find anyone all game.. half of the lobby died in here.
crnyk9,Not really Apex but found this gem in the Iron Crown Update Thread.
b5hacs,Fan Art: Custom Octane Finisher
atjraj,From Arby's Instagram page this morning.
audg8e,Another successful use of Caustic's gas chamber
d99b9l,Kraber shot that I won't be able to do it again
bwzulc,New update be like
ayowea,Mirage Set Off Decoy And Leaves Work
bcid0i,So this is probably the pinnacle of my gaming career
c93fyv,Decided to make another pair of APEX inspired sneakers. What do you guys think?
bzitzi,Hopefully not made before
b6uheo,"We decided to hunt down speed hackers, our own Vigilante justice"
asay4m,Care packages are deadly.
asznkn,So this is my life now
dq2kwp,Lifeline cosplay
b26x7i,Vince Zampella on Season One Release Date
arn2kj,"Enemy tries to do a finisher while I’m self reviving, but my team mate was one step ahead of him."
b3u85c,"idea - post game travel and kill log. show the route the player took throughout the map and highlight the kill locations, downs, revives along with the landing area and death/win location. also show the distance traveled and time alive. just a rough sketch, ui needs some work"
cx1qpm,I bought some Chinese Apex figures from eBay. I was not disappointed.
b07c4p,"For you who didn't know, there's a cute little easter egg in the training area"
dfe783,I was proud of this win so I thought I'd post it
auats0,5 Movement Tips to Improve Your Gameplay in Less than 1 Minute
d4jnc0,"I too, tried my hand at animating the Caustic loading screen"
cjrrj2,These final circles in ranked are getting out of hand
b3g59g,"I showed my coworker who has a 3D printer an Apex meme, and this shows up on my desk the next morning"
aq5ie1,"Many users experiencing crashes, EA support denying or ignoring. Please signal boost this."
b0w3sp,Current Asia server
bq2l3s,To EVERYONE in the APEX subreddit and community - #MentalHealthAwarenessWeek
cxb4y1,"squad, can we please?"
dcbmaz,Literally people are still figuring out the map and Crypto is still in his over use stage like every legend at release. Also Respawn will make adjustments based on the data. Y'all insane.
as20wv,Mozambique Buff Concept
d2aoqo,Caustic teammates be like
awbzf3,Bloodhound's True Identity
av0660,Ya can't kill ANYBODY with the Mozambique
b86cer,Death box UI options
b94jqs,My friends professor is a Lifeline main.
bzc01p,Punishment for leaving is back!
d5kl2r,CRYPTO has appeared!!! He ran away!
b10x0u,Hello Battle Pass! Oh...
crx3b6,How is this acceptable?
ayqfu3,Idea: allow grapple to reel in downed friendlies like foes?
dgex5o,The Most Evil Thing You Can Do in Apex Legends
aydwfb,Squad goals
b1ce6c,Made a spotify playlist for when I'm playing :) What do you think?
av9uz6,"100 push-ups, 100 sit-ups, 100 squats, and a 10km run every single day."
b2h2zp,This is how I feel everytime a teammate leaves.
cvt0ix,Cheaper than a skin and actually serves a purpose
atc9k2,A Gif highlighting a way to make Mirage's Ult. more team-focused.
c9uqcd,When you're with your grandparents... You gotta make do
cwla23,Please bring back solos
apu4yr,Surprised there's no badge for this in the game.
deo7pr,I miss this robot
azfv6k,Most efficient way to use Lifeline shield
ax8rg4,Add me for more high tier plays like this one.
b8jd73,Thou Shalt Not Nerf Bunker
dgks8m,I'm sorry.
c7rs0r,My first suicide trickshot on Apex!
cr8e16,The Office: Apex Legends Edition (fixed version)
azs97g,Gibraltar In His Natural Habitat
arinq3,How to Defeat/Exploit Caustic's Traps
b0bl2s,Some Clarity Around Datamining and Season 1
az4252,"Self-revive, 1vs3, limited ammo, 1 HP, HOLY COW"
batqz0,Apex Anime「SHITPOST」(My pc nearly died while rendering this)
bat0c4,Friend and I had an AFK Gibraltar in our game and he made it to the end with us. Turns out the only time Gibraltar is useful is when no one is playing him
bd7rvi,This is what 2 games on pathfinder looks like
azafr2,Golden barrel stabilizer on Spitfire shreds
d5b719,Friends. Together. Strong.
aoi66h,Please do not add dabbing or floss dance or any of that shit to this game
cqrup5,"Spent 2 days editing the ""Iron Crown"" trailer to better reflect the communities opinion on Loot Boxes! Enjoy!"
d9hcz8,How to kill the champion squad
b8wkam,This is what 150+ hours of Pathfinder looks like.
b3cc0v,Really starting to like octane
aru5tz,I couldn’t let him get away after that look he gave me
byhbgp,"""Nah we're full"""
aw0tkj,Ride the wave...
bhpij1,What an awesome reward for grinding out 91 levels of the battle pass...
axcda6,How it feels to use THAT Wraith finisher.
b2l696,"What others call dangerous, Legends call Tuesday. Season 1: Wild Frontier coming at 10:00AM Pacific tomorrow"
apm6w3,How to play Apex
au5e30,The magic bullet. I’ll never be this lucky again
b4j3x3,Pro tip: Use an XP miner when you cant play to get that sweet battle pass level ups!
csz5b6,I’m The Best Fisherman On Apex 😤😤🔥
azvvj1,Warning: Ring Closing
cvc86c,"I'm a lifeline main, so i painted my headset, what do you guys think?"
b33z5m,Teammates don't always listen
cn985g,If you have ever wondered why you can't find any ligth ammo.
aokjhq,"Respawn knows what they are doing. Suggestions to change TTK, footsteps, recoil, loot capacity will lessen the game. Suggest QOL improvements all day, but I trust Respawn more than you for gameplay."
arat7l,When Your Jumpmaster is an Asshole...
bm61uo,This sub in a nutshell.
ays019,All Father blessed us with GOLD.
bbhsdv,This is the buff Gibby Needed
cq6xr9,"Hey Drew, how's that look in the mirror going? (GamesRadar pre-launch Interview 04 Feb 2019)"
bwc1h9,I got a DM from the devs!
cgyp39,When someone says Apex is dead but it takes 3 seconds to queue in a game and it’s streaming third on Twitch
b9uzq1,"""Mozambique's here!"""
ba60qr,Octane's teeth are green on the main menu but white in game. Literally unplayable.
ccdgv3,This teammate was a loot goblin all game and demanded if their was a Kraber in a care package it was his... showed him.
bgtqu8,"Level of nastiness: I pick up every R-301 Carbine I find in a game, change their fire mode to single-shot and then drop them all again"
dli3lc,The most satisfying bullet I'll ever fire.
b5bqqq,Octane's launch pad execution
asf4c7,This is so Accurate
b6g1u6,Here's Lifeline
aplxtf,An Update on Apex Legends from Vince Zampella - 25 Million Players Milestone
ap87ow,To the Gibraltar in my game last night with no kills and 56 damage...
b6o1w5,"Everyone complaining about teammates leaving early, while I'm still dealing with this garbage."
df2jv0,Hey Crypto! I got your message!
djuhr3,Who is...Mirage?
crez8f,"DO NOT FALL FOR IT, remember this?"
aqiwtc,Can dreams come true? Link in comments.
b43rdb,"Fat-fingered a finisher, thought I was toast"
d4dddr,Squad mates happened to slide up at the best time
b3ywbk,Level 3 armor: *exists* Octane:
b7142s,A simple visual suggestion to make Caustic teamplay a little bit easier
cs1zx2,"While we have a right to be upset, we cannot let a few bad apples (replies) warrant chopping down the whole tree. What I’m saying is we can be civil and NOT resort to full on toxicity, the store and it’s prices 100% needs work and tweaking but let’s not act like all of Respawn is evil here."
bzstnk,What it feels like playing against Pathfinder.
cduywj,Respawn please don't support this!
cuuror,Ope. You gotta be quicker than that.
cayags,Every lifeline main not in a party
ar8mvf,There's a one in a million chance that Wraith can travel through time and space using The Void
cqgmuj,Best Meme I’ve seen in a while 😂
b2xd3l,"Devs , A devastating cyclone has hit the country of Mozambique . It would be awesome if an in game Mozambique skin could raise money to donate to the Red Cross. Anyone else agree ?"
cuxnzi,Wholesome moment
d6yurh,Becoming Champion by doing literally nothing 😂
cupm6o,Bangalores Crash Apex Server with 30 Ultimates viral
b9eohe,"Fellas, I've fixed the spacebar issue"
bqk59x,"Wow, turns out most of the guns in Apex are based off real life counterparts."
cujp9j,We can make memes in apex
bjlcrd,Thankfully for this guy there are no kill-cams
di3cjc,"Yeah, that sounds about right..."
bg0yza,Watching myself getting the t-bag
cbeejl,Is it me or am I the only one who will trade out a level 3 sight for this level one sight?
b7d08y,The best way to respawn
dhkait,Not mine but thought I'd share it here
b01ndm,I spent six hours on this. Time well spent I guess...
bgf8kl,"""No Hostiles"" I would actually use Bloodhound if they buffed his scan."
b75vo4,Wraith & Caustic cosplay
chdaal,Anyone else think the loading screens should be on a random rotation instead of always seeing the same one?
avdj80,How to be Pro at Apex #3
c6jweu,"For those of us who won’t be good enough for Bronze, I created a badge for us."
ctdt51,Seeing as everyone is doing it: My drawing of Wraith
b3qml5,A proper use of the notch
ax3g3d,Honest Apex Map
dcfgux,Lets you know the enemies positions
apb8ms,when the enemy keeps getting bamboozled
ckza5s,THE R-301 IS OP! Clearly needs to be nerf
b30es1,So apparently because i live in Belgium i dont get packs but crafting material instead.
bpa9fb,This is Epic
b8be43,Best way to bait someone out of hiding? Start a fake gunfight with a nonexistent enemy team and wait.
avmr5z,Octane: Leak
b1lgu2,Comic: Just a second
bbc2mt,Decided to put the new caustic/gibraltar mechanic into use.
d2txjh,Oh baby a triple!
bfgiiy,Only buff Gibraltar really needs
b3dkh6,Looks like a big firefight went down here...
dnzqfh,Concept idea for ‘Don’t Shoot’ ping
b0kt77,"Thought this deserved it’s own post, full credit to u/ladybears"
b0zit1,Killing a speed hacker. Thank you PeaceKeeper.
aw2oan,New Legend leak: CRASH
bejr6w,"Over a decade ago I played counterstrike. Each match we won or lost; no xp, no reward. I think we need to ask ourselves why we play a game."
c2fanv,caustic pls
dvqz0j,Am I too late with this?
cyg9p3,During all of December Lifeline should say “Here’s ya Christmas present” instead of birthday present
bqb5nk,Made by ME. Shown off at megacon this week. And yes the grenade smokes lol
bonvbu,Showing my friends the ropes
biwfaa,The correct way to use lifeline's passive ability
b9giac,This is what level 100+ and over 200 hours looks like.
bb6bsq,[LEAK]MASSIVE BUFF FOR JIB AND CAUSTIC
ar55zj,2.15.2019: An Update From Respawn
dm2kgf,My attempt at lifeline cosplay 🤗
b11yqk,It’s zipline time!
ark8ge,How you feel as Bloodhound main during your ult
arm4z8,"TIL that you can’t portal while already “in the void”, but apparently the other guy thought I could, resulting in this accidental 200 iq play."
dbb6kh,Crypto's new dive animation be like
da39tt,Season 3 launch trailer
cf55h1,How to Play Wattson (100% Winrate)
bccx6m,This response from a Respawn Dev on why they don’t mention the features they’re working on adding deserves a lot more attention than it received.
bswv3f,This is what 1000 hours of Pathfinder looks like
djnirq,Loot ticks are afraid of shadows.
aoxjwj,They created beauty!
cbo5px,"Man, these new daily challenges are getting ridiculous"
d9lxwd,Re: How to kill the champion squad
cxvz9b,If you listen closely you can hear 3 controllers shatter
bz1cfp,Leviathans have begun to get closer to the Island [COMPARISON]
bipm20,Found some of you Reddit weirdos
b08ws4,The Origin landing page for Apex Legends has been updated
bafh47,I set up shop in the marketplace
az6m2p,Mozambique+Helmet+Armor=Dream
cu3jg1,Applies here as well.
dclo0w,Remember to keep your Crypto in a safe spot!
awuda1,Badge Suggestion: Lower Back Pain - For when your squadmates do absolutely nothing
cy8epk,Pathfinder's survey beacons need to be nerfed
crtjb0,This sums up the apex store better than ever
c60fhp,Second Season 2 Trailer (BETTER QUALITY)
bmwqya,Ya'll ever attend a Hacker Viewing Party?
bb2cya,Perfect map of apex and it's current state
b7aatu,My little brother birthday
bnjc7g,Finally got a kill with the Mozambique
c8o2ia,I tried to make a cinematic comparison. Kings Canyon in Season 1vs2
asrq80,Fight Club
cp0ue6,Change the Digital Threat to a Red Dot sight. More space inside sight to see enemies
aq10m1,TIL if you shoot the doors handle it opens
apkn09,Is this a bug or was pathfinder's grapple intended to do something like this with skill?
cm48hk,Apex Legends Servers
cpsdyf,“Who’s ready to explode!” “I am!”
b2q4n1,This sub is a joke.
b8q4w9,"Chased down a Gibraltar the other day, turns out he was just a wandering merchant!"
ayjnz4,When your teammates are getting annihilated but you only have a Mozambique
awtest,Hi! I'm a Japanese player. I have an idea it can surely make this game better! So I want to show everyone!
cman8s,"That's all it is, Pathfinder. A leap of faith."
b2w1wo,I did some number crunching to figure out how much value you can get from your 950 Apex Coins.
b7kd6x,Apex Factions & Sponsors
bkyj63,"I wonder if anyone at Respawn have asked thelmselves, ""Does that look like $18 skin?"""
bfklrp,I knew Wraith's hitbox seemed familiar...
dkxb7z,"picked gibraltar on accident, made the best of it"
b6suz9,Why can’t all randoms be like this :’)😭
c70jit,Spent the last 2 days SPICING up the season 2 trailer while we all wait! Enjoy!
ay5hh2,Live Balance Update live on all platforms - let's talk about meta
b3lq33,Bangalore has a new hairstyle <3
b8n42j,Wingman here
bj1qy0,900IQ Accident
azexzg,Another anime shitpost [reworked]
cs3kyj,"I'll admit, this took me too long to make [meme]"
do65rk,I guess I got the badge (664m).
b48ril,My brothers 200 IQ kill on his first ever game
drf0ku,what 1900 games w/ octane looks like
dsibbr,This is an amazing little detail and I LOVE it
cyvv6t,This guy definitely broke his controller
baw1ad,When you think you have all the time in the world to loot
b5sydi,I get to main one of my close friends in this game!
bgsxre,Why was it removed? How is this removal going under the radar? What's happening to this subreddit?
auox1r,Longest Phoenix Kit Of My Life
aqyyd1,T-Pain isn't having a good time.
awf953,When you want to make sure everyone knows you're cheating.
b64vwa,"Everyone's printing the Wingman, I've looted two houses and have yet to find a gun..."
cegqkb,"Somewhere out there, there's an Octane main with a shattered controller. And that just makes me smile."
b80atc,1 in a million save as Pathfinder
bmh1c1,Probably the dumbest fight I've had in this game so far
cpxaoa,Do NOT spend money on these new packs.
diay3w,There's a portal to Hell underneath The Pit
aqx6s7,Shoutout to the downed teammates that still ping the enemy
bec5ku,I accidentally did a thing.
dhcalh,[Suggestion] Add a caboose to the end of the train that acts as a moving loot vault. TRAIN HEIST GAMEPLAY!
dxmqzx,Can we get this?
bhf2n8,"Walked around the corner at work, and suddenly I found myself in Bunker."
b1rsl6,Just in case you didnt know.
dv9o4c,"Honestly, makes sense why half the time I’m left for dead when I go down"
ayzbhj,Respawn Check In : 3.8.2019
cd36ps,Moving the cursor over the crow's eye gives it a fancy crow monocle
de1c1t,This Wingman skin is on another level
cw4dpi,Rare G7 Scout Reload! Mag comes out the top like a M1 Garand
dflsn0,"“Yo did he have anything good?” “Nah, just a couple of thermites”"
baifnm,By far the coolest thing I've ever done in Apex
bbx1nn,Apex legends but all legends are bugs.
axu8y9,My friends and I decided to try win without ANY guns
bvwwrp,I’ve been trying to think more outside the box with Pathfinder. Made this clip a couple nights ago. Hopefully it inspires some creativity :)
awgop8,"During wars, it was common for soldiers to keep photos of loved ones under clear “Sweetheart Grips” on their pistols."
dbkqeb,"6000 times I’ve jumped into this beautiful world, tonight will be many of our last. Until we meet again, King’s Canyon."
cgbjuq,Holoscope Redesign to be inline with the Hcog
awrfg4,Switcheroo
be256h,How to catch a lifeline
bccc9z,I thought I had a Peacekeeper
az15z7,I drew some Apex Legends fanart... old school comic-style
aq42em,Pathfinder is S-tier on the drop ship
c2jxnu,Captured What Happens When You Land on Flyer
bi0moi,"If you can't beat them, yeet them"
crm8w4,I present: the biggest-brain play of my career
as332h,"Gone Fishin'. When you can't play well, play smart."
aq997m,I drew Wraith!
awi4vv,How I Be Playing Bangalore.
atuhu1,Worth it.
dd9qpl,Just want to point out that these things can kill you
as92vx,what the fk happened here? :D
d1ao40,Yes my champions... Come in a straight line and don’t move please 🙏
byude4,Squad Selfie!
b6ixxr,Searchin for a weapon be like (just saw on fb)
cz7wos,This is what happens when you queue up straight after a new update..
aop521,Quick Update Before the Weekend
azw38o,Every single time.
as57a5,Some light ammo guiding me to treasure
ap746z,Petition to have Chappie as a Legendary Skin for Pathfinder!
b7p0us,“My Methods are only controversial to those who lack imagination”- Caustic (2019)
bib0ps,I found an unreleased mirage finisher in the game files.
cakt5o,NRG guys are simply insane
bdy4dw,They all doubted me...
bdg8nh,what are the odds
d1smue,Helpful Tip: To Help Teammates Knocked 😸
bvjbac,Was on a hike today and saw the brudda
c88a5i,Bro i'm SAFE
dikns3,The Apex Mating Call
ct5efy,I made a Wraith kind of bamboozle
cp7md1,Had an interesting graphics glitch for a few game. All the crates were solid black. Make this into a thing Respawn cause this looks F R E S H
bkcbmb,Every time I select pathfinder I feel the unquenchable urge to fit the cursor perfectly on his face
bcq1li,"Respawn, can you guys please bring back Elite Warpaint from Titanfall 2? These skins are such gorgeous and vibrant, and they would fit perfectly with the theme of Apex."
ati6op,"If the original jumpmaster doesn't select a legend, the role is bumped to the next player to prevent an afk jumpmaster"
b4shgp,"HA, you got double bamboozled."
ddj9x0,Gibby's Magical Flying Dome
b46rq9,"My girlfriend took my energy ammo, so I took her life. Ignore my laugh pls"
aqvl60,All the sliding can be hell on your knees! [OC]
aph7op,When you've finaly got your friends to play Apex Legends and they enjoy it.
b1ht6q,Found Octanes Leaked Ult by Market on Xbox.
c9j8lf,I did the thing
anscou,All unlocked cosmetics should be listed first. I shouldn't have to scroll to find something
b3j7qe,Ouch
dmju08,"I am my own shy girlfriend, and this is a portrait I made of Revenant"
b4tt2q,Apex legend Wraith Rare 👌 Animation
dwprhr,Working on some R&D for smoke simulations. Thought I might as well make one inspired by my main.
bi7ysl,GIVE PATHFINDER A JACKET
