post_id,title
an7yag,21 Savage running away from ICE
8zhvgj,Relevant (x-post from /r/The_mlMueller
6bowsr,'Arrested Development' Officially Renewed for Season 5 at Netflix
8u03h4,The time that my wife and I blue everyone away with out Arrested Development cosplay at DragonCon.
76gqvx,Watching the Cubs/Dodgers game when suddenly.
91bjsr,Accidentally broke my roommate's Gob glass... But it landed hilariously.
7yinyg,"My husband and my lame self went to recreational dispensary for the first time, they asked if we wanted ""flowers or wax"""
8ghx36,Mitchell Hurwitz be like ...
528g8r,Never forget
6yk04m,My sister lost a finger tip recently so I made her some prosthetic replacements for her birthday!
7hp0yr,He's very good
632a7t,One of my favorite Arrested Development scenes
6dhg05,He's going to be all right
7u5had,He's worth every penny
3lzcfo,I really love that this pope grew up looking like Buster Bluth and now looks like George Bluth.
8pe84o,Love this
avk8qe,Gob’s on Board
6vetao,Found this at a thrift shop today and all the main cast's signatures were on it
6aukkl,Jason Bateman confirms new Arrested Development is happening!
6td0ra,Spotted in LA today!
8kky65,Who else is watching the royal wedding?
7ai1ai,"It's one banana, Michael. How much could it cost?"
79exuo,I am Tobias Fünke.
8jie51,Found a brand new Carhartt jacket with the Bluth logo on it for $4 at Goodwill here in LA! From someone on the crew perhaps?
6mc55r,The instructor for a class I'm taking looks like an Indian Tobias
6j57vp,He got me again!
8hizuc,Bluth Stair Car spotted in NYC. Season 5 release date!? 😱📆
697mz6,Happy Cinco de Cuatro and Star Wars Day everyone!
5uam4t,I got a promotion out of nowhere today.....
3kjb8e,Never forget.
7oazzf,"I know what an erection feels like, Michael!"
8n980w,Seen in NYC subway car ... thought it was a real fashion ad at first
384x9x,Found this on tumblr
8eagfn,Just finished this painting last night. I giggle every time i look at it.
8p156f,"Finished painting ""The Last Supper"" with the Bluths!"
5ef50w,"Ah, there's the woman I'm sexually attracted to!"
53qiby,Arrested Development S5 to begin shooting in January according to Jeffrey Tambor
6cn1v8,(X-post from r/Tinder)
95n5ba,The resemblance is uncanny
b5go9j,A Sorcerer named GOB.
8mu8ax,When its 00:03 in the UK and S5 isn't on Netflix yet.
8ltwa8,Jason Bateman today
8ho6oi,Arrested Development - Season 5 | Official Trailer
94lc99,"Everytime somebody asks what perfect line delivery is, show them this.."
99ymld,Isn't he the best?!
85ylbx,John Dorian himself
a2jjds,The best Goodwill find of the year!
6m0b6h,My immediate thought when people use GoFundMe like this.
8acg90,Another one of my favorites.
84gffb,One of my favorite parts of the show
3gprxh,Jeb Bush = Gob Bluth
61rxpb,Tale as old as time...
6kxidx,"In this scene, Michael is talking on a closed flip phone."
3v0gxq,"My reaction when my friends ask ""Who the hell subscribes to arrested development!?"""
bgmv9h,Need some of that stiiiimy
6y1ayc,Didn't notice this until my 5th time re-watching arrested development
8u9qtr,Am I the only one that thinks Kristen Wiig was the perfect actor for young Lucille Bluth?
8r2rnc,When I go in for a job interview hoping for a change in my field
8k5mk6,Netflix announcing season 5.
92goy6,Like father like son?
71oams,"Obviously, this blue part here is the land"
7iaccb,"H & M men's section. ""There are dozens of us!"""
ap9l7f,Franklin Comes Alive!
5xbfbg,Up here Michael... up here.
apimhw,I don't get everyone's gripe with this new Genie...
97ug7z,Possibly the best Barry Zuckercorn line in the whole series.
bk9r50,When it’s the eve of Cinco de Cuatro and nobody has posted a single thing about it
7e2yy7,I've made a huge mistake
8otwok,Something came up.
81lck5,Some absolute genius with only 25 subscribers made Star Wars into an Arrested Development episode -- let's encourage them to keep it going!
5q41b6,"Donald Trump's plan for a wall along the Mexican border is being announced today, the first image of the plans has been leaked"
8ytltg,"My reaction to coming back to my car and realizing I left the window down overnight, but nothing was stolen."
8ogwo1,When Netflix only released half a season
2dqd92,Is this true?
95whd3,Met David Cross in North Carolina today. Asked what he was doing in NC and he said looking for Anustart.
63ol6a,me_irl
8s85fp,Space Force
6wpmny,It's Arrested Westeros
5pdcm2,My sign from the Women's March in NYC today. No touching!
c0x3pd,Reposted
7cgetm,"The only time Lucille actually says something directly to Tobias. Season TWO, episode 11"
79w6ov,There's Always Money In The BANANA STAND!!!
6ouwfq,meirl
9eh7zt,"Now the story of a wealthy family who lost everything, and the one son who had no choice but to keep them all together"
9g0o4z,Tobias's Great Times
5wfsrv,There's been a huge Oscar mixup
5tq1rg,Nothing inside!
aw61sh,How in the world did she not laugh?
7gm2v8,Random arrested development apeared
57v0lr,People were wondering why I started laughing in the middle of The Accountant
8daut6,Except for Jeb
9ezte9,Never forget
76s4sd,Reminds me of a certain lawyer I know.
6bh4dm,You get yourself a tape recorder...
ct8sv1,Mrs. Featherbottom
878i8b,Finally finished my Tobias cross-stitch piece! (NSFW text)
7ya4fq,"Yet another little thing - when Tobias ""inadvertently photographed himself"" in a bathtub, there's a blue smudge above the water line from his blue man make up."
6yymx9,Arrested Development Alignment Chart
cib0a1,OP deleted before I could get some AD appreciation- COME ON!
a7ttvt,We all know who really should have been cast as Genie
58ju0w,"Up here, Michael"
8br4z6,Money where expected
73irgv,Stallone with his acting teacher!
7x68f8,Picked this up from a local artist for $10!
7a9cqz,"My fiance doesn't watch Arrested Development, so this joke was wasted on him."
8wpb83,"It's only one banana michael, how much could it cost?"
6zp50r,You can always tell a Milford man
6e1lfg,Arrested Westeros
770byy,Ron Howard just announced the title for the Han Solo movie!
7y24we,Probably my favorite line of the series
2hqp1r,Found Lucille Bluth's black doppelganger.
b2kohz,Lucille responses are always so unexpected
7dh28v,"she got them apple bottom jeans and the boots with the fur (with the fur), got the whole club lookin at"
5e5xih,Getting ready to have my mom ruin thanksgiving break like...
9p8u93,I want the guy with the one arm and the fake blood...
54ctnl,Here's mine
61j0nz,"Found at Goodwill. Honestly, who throws out a $3,000 shirt?! COME ON!!"
1f431t,Can we just take a moment and give Netflix a round of applause?
8gut0n,Happy Cinco de Cuatro Everybody!
8vc4bt,I was looking up Hot Dudes Reading on Instagram for unimportant reasons when I spotted these blowhards
asplgp,is it just me or...
blg80f,My favorite scene in AD seems relevant after the Starbucks cup was left in last night's Game of Thrones episode.
8a1lnu,I can't believe it but I think I found a new detail: George Michael leaves a note for GOB on the back of a Barnacle Bill's receipt. Portia De Rossi (Lindsay) stared in an ad for Barnacle Bill's in 1992.
7jav4s,And he’s very good...
8wi26r,Us trying to get Netflix to release the second half of season 5
8wy6lv,A New Start
acm6sm,Wendy’s is a fan of the show
8ital3,"Half naked girls get thousands of updoots, what about our Leather Daddy?"
ab6nni,The Seal is for Marksmanship.
8hf2l5,"When George Michael says it should be the other way around, the piano he leans on plays high notes when it should be low. It should be the other way around."
77u6xs,"It’s one banana Michael. What could it cost, forty-one dollars?"
81tot2,And he’s worth every penny!
9fgwk4,What is this feeling?
8cy4si,This mug I got for my husband when he got his first management job
7g4xpd,A million f***ing diamonds!
78shcb,When you don't fully commit to the Halloween Costume...
bq6ad0,My sister’s graduation cap from today
afg2oe,Football fans be loving AD!
df7grz,Literally the White House right now
6rss1f,Your very own Sudden Valley home.
8i7088,This was driving around DC yesterday. Had to watch out for hop ons
1j44x5,Saw this on tumblr and I couldn't agree more.
768cxn,GOB in the 90s
99882o,He’s not wrong
8hw5b2,Arrested Development Season 5 | Official Poster
1zfwyf,All I could think about when Harvey Weinstein asked if $200 would cover 3 pizzas last night at the Oscars.
awr4c1,Tobias’ name tag at the Swallows restaurant says “Tobias Swallows”
8skyvl,Whenever I start shitting on S4 I forget how perfect this delivery is...
b2y11t,I don’t care for Gob
2m6wp2,"TIL 2 different actresses played Ann Veal. She's so forgettable, I never realized they swapped her out."
5ocwnv,I have Pop-pop in the attic
d80k2j,Congrats to Jason Bateman for his Emmy win!
bexzda,"By pure accident, I caught my fiercely loyal friend in a very familiar pose..."
azhzy2,You can always tell...
ano9e2,The star of the SOTU
ditp1i,HE FINALLY MADE IT GUYS!
8n0f0e,When you binge season 5 in one sitting and no longer have anything new to watch
aoggxs,You can´t leave Buster alone...
7c33hs,"Buster, Maeby and George Michael, Season 5"
docdst,Alia Shawkat is now older than Portia de Rossi was when the pilot was shot
bl3nw6,The Sonic redesign is more controversial than I could’ve ever hoped.
8qb2zu,"Oh Tobias, you old blow-hard."
b4b2qp,I Can Hear This Image
3c81u4,"My friend sent me this picture, and I can't help but read it in Tobias' voice."
7wtx7z,One in eight
7k1x6o,Moms around the world today
5bnjl4,How I feel about the life crisis I've been going through
93z4la,Worlds first
702zm3,The title kept reminding me
926qe0,"Violets are blue, roses are red"
29d1iv,"My wifi has been Lucille Bluth for five years now. Look who showed up today. ""I think she's going for a power grab. That BITCH!"""
1e7r1d,Season 4 Trailer is here!
8ixykn,Street vendor gold.
8nfxth,"Graduating HS, I’m starting at ANU next year and I couldn’t resist!"
5l5tid,"Trying to stay positive, but..."
271ohv,Just moved to Seattle from England. Taking my US driving test next week.
d2nzfd,"Oh u/LegoG8rb8_511, you blowhard!"
8ke7sx,MRW I binge watch the first 4 seasons 2 weeks before season 5 comes out
bg2phk,I hope no one made this already
71dbii,(Ron Howard voice)
6g60fj,This one exchange provides great insight into the enigma that is Gob.
6p8zi9,Lucille 2 really did a number on Michael.
90zetu,I was playing COD WWII when I noticed a familar dance.(GOB's chicken dance) that I had to share it here.
8j4g45,"There were dozens (dozens!) of never-nudes in Austin yesterday, and they left their mark wherever they went"
b9c8qc,Big deal. I had that same basic idea years ago!
bkkshr,"Happy Cinco de Cuatro, go see a Star War"
8w471l,Every day in July that I wake up to no news of Season 5b
8xd0p8,Spotted on Big Britain’s breaking news feed
anwwdn,Life is Hard....
8m4cbj,Jeffrey Tambor addressing the allegations of misconduct.
7qtv21,Easily one of my favorite scenes in the show
7b571j,George Michael remembers the past
a74oht,Gene! Isn’t gene the best?
8rufdz,Thought you guys would enjoy my moms halloween costume from about 5ish? years ago.
139zhg,Getting ready for Motherboy.
10xtad,Bluths are back.
28mopk,On their way to Motherboy
7pg64z,Motherboy
88bp8w,The Living Classics Pageant
6y9zta,Mother and me
9s9dzw,I decided to take advantage of my blonde hair and dress up as Lindsay Bluth for halloween
bc43xq,It took me a while to get into the rhythm of Arrested Development. This was the moment that finally hooked me.
9mquic,You’ve never actually set foot in a hurricane have you?
99dx3b,I've got the worst f****** attorneys
7462kl,The best shirt found at Goodwill
1m6aty,Never forget....
8ksxwi,Well annnnnnyyyooonnngggg Annyong
23cimr,In light of Mrs. Doubtfire 2 being created....
1bnjgd,New season unveils May 26th!
b3elbr,I mean COME ON!!
6vzgcu,This is funny.
1egoog,Just a selfie someone took in Times Square.
cfhwp4,"I made Tobias cookies, DOZENS OF THEM"
1e53p0,Another Year Book Gem.
bqudbo,ha..ha...the wizard and 3000 year old...the..COME ON!
1sy882,"Say what you want about America, thirteen bucks can still get you a hell of a lot of mice!"
akmk4i,Mister Manager
8bg8ls,"With all this Facebook/Zucerberg mess, I'm glad i switched to Fakeblock years ago."
8pnsn4,Her?
agzqoj,So where's our second half Netflix?
8q6m1k,I’ve made a huge mistake
bbnkn2,All over the news
1eixy7,Jason Bateman and Will Arnett walking hand in hand yesterday
8ga1b6,OFFICIAL NEWS: Season 5 coming VERY soon and 'Season 4 remix' coming this Friday!
1jp7st,"My girlfriend's dad saw this car almost 6 months ago, and thought it was funny enough to take a picture. Little did we know..."
8w8r93,"After spending 15 minutes being amused with my own poor sense of humor, I decided I would share this."
14aol2,Cousins [FIXED]
ddhf0h,Her?
8lbemv,Rejoice!
2064kg,How I feel browsing reddit today
99pgwy,God knows they're squinters
aql1kn,Happy Valentine's Day from Gob!
b1txa0,Jessica Walter is so pretty and we don’t talk about it enough
c756d8,Clearly I overestimated how many people would catch an Arrested Development reference in the wild
1gkyg8,Just noticed that the Thing is a never nude..
cq0n72,The best scene ever: Michael asks “is there a carbon monoxide leak in this house?” And it cuts to Gob just blankly staring
ai9yzk,80 year challenge
8md43j,"After four seasons, this is my favorite joke in the whole series."
bu1np4,You can always tell a Milford man.
a63pj6,"Miniature Banana Stand made from paper (and yes, there is tiny money in the walls...)"
65q4gk,Found this on /r/flatearth
b7yel2,"We shan't be fallen, shan't we?"
8gygx6,“We should start our own holiday”
89b3kp,Never-Nude in the house! Infinity War trailer.
5o4nse,A sign I just made for the Women's March next weekend
6p14qu,This picture always gets me
5zwdka,I'm utterly convinced David Cross actually did this.
1hoxgp,"Girl at a party was wearing a t-shirt with this design and swore up and down that it wasn't Tobias Funke, it was just a blue man. COME ON."
6gbtkk,The first piece of art I noticed at my Airbnb today
1ibybe,Everyone on Steam right now is reminding me of this scene
xb5hf,First photo of Michael Cera back at the Bluth home!
61z9od,Ahhhh It's Gene Parmesan!
cqbg7n,My favourite Michael reaction
c3s6mo,"My dog, whose name is Buster, proving to me that he is in fact a TRUE Milford Dog."
1stagi,Well played
9u2ce1,The BBC knows what's up!
aeurb2,"Found this while browsing, sums it all up pretty well"
akce1f,Found this shirt at a flea market in Argentina! No idea how it got there but it has now become my favorite shirt ever
24gx34,"My wife doesn't like anyone touching her belly while pregnant, so I made her this."
1fwgvv,Saw this in a local Mexican restaurant...Maeby? Is that you?
5imstq,In honor of Rogue One release
1ebbr9,Anyone notice the 'misspelling' of Nellie's job title?
9pjrwi,What's wrong with you?
1d35lw,It was theme week in our kickball league. We chose Arrested Development.
8g2s9p,"In Motherboy XXX, Henry Winkler jumps the shark. I’ve watched the show dozens of times and never noticed this joke :D"
7h7hnj,This is Tobias Fünke. He sold his family's life rights to Carl Weathers for a role in a poorly narrated TV show.
d8w2lh,"Ron Howard Narrator Voice-Over: ""Actually, he did. """
8v6ekf,Excuse my face but y'all I just met DeBrie Bardeaux herself!!
1fa9z0,Netflix is willing to do more Arrested Development
b1gttm,MRW I didnt know new episodes were coming out today so I log onto Netflix and see that they are there
5xzgi8,Lean in close...
5eze7w,Talking about the Christmas ornaments with my 4 year old.
8mqexl,NYC Time Square promo video!
9lrkx5,I don’t feel so good
8vy7hv,Does the new Stephen King novel cover look familiar to anyone else???
1iyveo,Found this
8l21fk,The horror! The horror!
815l34,Has anyone in this movie ever even seen a chicken?
7t5l9o,Certainly a Bluth...
7byfha,Veteran's Day (observed)...
adzyqc,🐔 A-coodle-doodle-do! A-coodle-doodle-do! 🐓
3wgn1i,JEB Bush is GOB Bluth
1fmny9,So um... I kinda own the Fantastic 4 movie they keep referencing...
13xu0v,"as a non-drinker, i can relate. "
b5rwey,The Infinity Beads.
19qjjb,"It took me a dozen series run-throughs to realize that, in Tobias' mind, he's dancing completely nude before the family."
cb02pe,My therapist asking me about my anxiety.
8h6lhy,When Season 5 doesn’t come out on Cuatro or Cinco.
2xwy3m,The most underrated Tobias Fünke quote.
arzsbd,"While Bob Loblaw talks about how someone with a listening device may have been the leak, a boom mic is in the frame. (Season 3, Episode 5)"
8om7z0,Motherboy 1980s
1h05sh,Tobias?
dbup8y,Buster and Barry reunited
1w99t7,Mother boy
1k5ojt,"Just moved in. ""I break for kids"""
1upwsu,Remember how GOB's 'P' kept falling off from the 'President' tag on his Segway? Well....
1d0blu,Cracked up when I saw the Huffington Post's Tech News front page today
by07j3,NBA player Draymond Green's wardrobe is inspired by none other than Lucile and Tobias
8nrk1j,Can’t wait for this Netflix Original
d8f7xv,"""I don't know what I expected"""
2274qw,"Happy birthday to our very special Uncle T Bag, David Cross. Don't leave him hanging!"
1ke3ry,Just saw a certain someone on the subway. :)
389cdh,More Arrested Development Is Coming to Netflix in 2016
1fl24f,A friend got me this
1dsvde,Buster's randomness can't be beat.
8zv59t,Found this yesterday. I didn't know he was a real person.
7iwct9,GOB's Chicken Dance made it into Destiny 2
9oxzg7,"I've got a really good body, so... no"
deo4uu,This is one of my favorite (S2E16)
xzsrz,Curiosity takes first color picture on the surface of Mars
ao6dk5,A friend just mentioned that BOTH of these statements are probably true. Blew my mind.
4bsuds,"This joke is so simple, but it's one of my favorite in the series."
1ogmzd,"One family, six different versions of Tobias"
9ryyjq,Buster and Franklin Costume
1rd1ah,You forgot to say 'away' again.
8q04t5,"Good enough, I suppose"
6yrq4c,"I just noticed Lucille's prison ID is ""anyong"" upside down."
2lxg4d,So this just happened on Netflix
65cno2,Took me only like twenty rewatches to put these two things together... C'mon!
8ptsrn,Russo brothers re-used their AD-twist in Avengers.
avvyd2,gets me every time
7dwse2,MRF
806qtg,Damn the jokes on this show can be really dark sometimes
78j33u,Spotted the stair car!
8t06ks,I love it when Ron Howard's narration also breaks character sometimes
1ecx1r,Easily my favorite George Sr. line of the series
5uzcle,You're looking at balls.
1ywpu9,Lucille on Arizona's new law
cuh3dl,We’ll see who brings in more honey!
6q13yl,Dr. Fünke's 100% Natural Good-Time Family Band Solution
903pkq,Best informant ever
8nonbu,"I just noticed that Lucille 2's ""bloodstain"" is shaped like the number 2."
a5huoy,Found this on IG
1c2ag6,"Nine new Arrested Development posters, one for each character!"
6h3v0b,AD clue on Jeopardy last night
cbaszb,Saw the top pic on r/animalsbeingbros and all I could think of was this..
bajxcn,My favorite line from the first season.
8aogfo,I cherish every minute Mrs. Featherbottom is on my screen
befq2o,"Umbrella broke, and I was about to recycle it until my daughter stopped me. She said “I wanna be Buster”"
1h4bx0,Watching a scene with George Michael at his desk when I noticed this
1g1njf,[Spoiler S4 e13] George Michael's iPhone contact photo for Michael is his grossed-out Mayonegg reaction face.
7ipwuo,Chickens don’t clap!
1fqh2x,I was an extra on AD season 4. I worked for two days and appear in two different episodes.
dqk8z9,"""No, no, it’s pronounced a-nal-ra-pist."""
1jvazm,Depressing joke I never noticed about Michael's wife
bd87ko,I actually found this quote pretty profound
c3ff73,Uh this guy again
c5qfl0,"If you haven’t seen Toy Story 4 yet, Tony Hale is the voice of Forky and any fan of Buster will love this movie"
a3ffjs,Today I found out my math teacher is a fellow fan!
4w4okq,DOZENS!
b1ozny,"On my full rewatch, i think this is my favourite joke in the whole show"
95e4w4,"In Season 1, Episode 22, Gob refers to George Sr. as 'Big Bear,' because he was forced to watch, and overhear, George Sr. and Lucille in the conjugal trailer in Episode 6."
6fnslq,Anus Tart
6lme3u,Arrested Development vs. Godfather
1d1h8v,New AD pictures! (Netflix Streaming)
1ewa95,"Today, I was Mr Manager."
1gdxks,Met my favorite Bluth today. Nearly blue myself.
1dwrp5,Tobias Fünke on his marriage with Lindsay.
cxllgz,Saw the top photo on a meme and could only think of one thing
9gtg0k,The worlds worst lawyer now has an Emmy!
1cgzqe,AAh! He got me again! (x-post from r/StarWars)
9nlzzq,Why should YOU go to jail for a crime someone else noticed?
247lya,Barry isn't a very good lawyer.
1smxs3,If I look like a man who made love to his wife last night...
1pbjfd,"Up here, Michael."
1ob6sf,Finally made the right emblem for my GTA V crew.
1i1w7h,"Even with the NSA stuff, we're still a great country."
9gmsjx,iOS 12 has Siri shortcuts which are actions triggered by one phrase. This one was pre made by Apple
8rf7rr,Aldi's recalling Cornballers!
6iuey7,What Ron Howard's Han Solo movie should look like (x-post from r/funny)
1vm2f6,Arrested Developments finest moment
apsjv2,Aladdinsideme
9ssgs9,Happy Birthday to Everybody's Favorite Worst Attorney. Henry Winkler Turns 73!
1x3ymo,my mother captured my very own Buster Bluth moment
8xpoao,"You’re gonna ban the guy in the $6,300 suit? COME ON!"
a7dtsm,never noticed that Maggie Lizer owned a Bluth Cornballer...
c24cf6,but check your lease man. cause you’re livin in...
68ibsk,For British Eyes Only
9omu8w,When you move out of your mother's house
2nverl,We threw our friend an Arrested Development themed birthday party last weekend. Needless to say it was off the hook!
abw5jm,"Bob Einstein, the actor behind the surrogate who was worth every penny, has died aged 76"
dpwg3m,"Look at me, I’m an actor. An actor for crying out loud! Do you know how much rejection I have to deal with? But in this business of show, you have to have the heart of an angel and the hide of an elephant."
69x7n1,Young Jessica Walter
71ztt3,GOB was warned
bx54ws,How much could one monitor stand cost? 100 bananas?
1c7cqa,Netflix emailed me a few months ago saying that I'm a potential contest winner to be flown out to LA and be an extra on the new season. Shortly after they told me that I lost.
awwsfl,Gob thinking Ann is talking about herself when she says “egg”
3ttlo5,Darth Maul was a Never Nude!
dorc2c,"Quick question, though. Am I panicked about the fire, or am I being brave for everyone else?"
1f2dj7,My next seven and a half hours
6uq407,How many up votes for the mothers that our brave boys have to leave behind??
1mfbc5,"I get to choose the image for my new debit card, what do you think?"
14qw51,Best. Lego-set. Ever.
3x81yi,Here's some money. Go see a Star War.
10jvby,"As a recent college graduate working my first 9-5 job, this is how I feel during our afternoon meetings"
2kk2ns,I'm half way through the 2nd season. This had me burst out laughing.
1u6t64,"""People hear the name Tobias, they think big black guy."""
9of3ea,Those Hollywood shows are so incredibly detailed
1xm54v,Looks like life is going pretty well for the both of us
de4487,Whistleblowers
2nhmx2,"My little brother came home from army last night, so I welcomed him home the only way I knew how"
1c4ra8,It's crazy that my absolute favorite moment from all 53 episodes doesn't feature the main cast. But that's Barry Zuckerkorn for you...
18ga06,As all my friends talk about their plans for tomorrow
6f2a5f,You can always tell a Milford bird.
cvodej,An entire thread of arrested development jokes ensued.
9jfkbl,Tony Hale just posted this on his instagram
dr6blx,Are you forgetting that I was a professional twice over? An analyst and a therapist. An analrapist.
96t6gg,Original Motherboy singer and his lawyer
cw8fwr,"Here’s one of my top favorite moments. I’d love to know yours, ya freak bitch(es)."
9kq1to,Have some money go see a Marvel.
9sek7t,I thought you guys might like my Halloween costume. I'm going as a Milford Man.
11ceak,Guess who sat next to me on the plane....
9kx1ea,Saw this headline on Newsweek and thought it could use a more appropriate image.
b0wt6o,"sometimes, i’m completely dumbfounded by what comes out of tobias’ mouth. this one is just too much for me"
a1yp8q,"No matter how many times I watch it, I'm always finding new references! (S2E4)"
aqxbcg,Wink. Did you say wink? Or did you wink?
b0lqqp,Buster is my favorite
1rpqfd,"Happy Black Friday, AD folks! Make smart choices"
7n96st,"Ron Howard on Twitter: ""[AD5] Already in the can. I start narrating in Feb!"""
12ewao,And that's why you always leave a note.
c4hj0h,My favorite joke from the entire series
6nvfnd,"This is Lou Seal, official mascot for the San Francisco Giants. Their catcher's name? Buster."
7zeyz8,Repost from r/funny
1gjd3d,A poster I did in anticipation of the fourth season.
1a5l5z,Never noticed this detail before
bqmtqq,"The attention to detail is absolutely brilliant, I can’t get over this"
8rmmhn,"Got a new task at work today, the responsibility totally went to my head, Tobias would be proud."
6zaqct,Leather Daddy
yr7ik,"Well, that's why you don't fire her. You don't fire crazy. You never fire crazy."
bavrbw,Good grief..
1esaki,"Army had a half day, so I made 44 Facebook cover photos for you guys"
c8wny1,DON’T YOU CARE ABOUT GOB
6vsg9l,They are shooting Arrested Development in Culver City near my SO's work! Very jealous right now.
72czvc,I 3d printed the car from archer
1hzy3f,Their twitter bio's reference each other..
9szc39,My work-appropriate Tobias
1lwc28,My house was used in Season 2 of Arrested Development!
1if8cj,One of my favorite Buster moments
d6etbl,I've made a huge mistake
wcv6b,Arrested Development starts shooting in a month!
1ddw0g,I think Annyong may have changed more than anyone else...
cf2kab,Baby you got a stew going
