post_id,title
1f1c8z,"Just a reminder: some of us have to work tomorrow. Keep this in mind when posting to Twitter, Facebook, Reddit, etc..."
8m6elf,"Mods are asleep, let our beautiful Annyong get to the front page."
3a7shq,Bob Loblaw has a point.
8uv1rt,It ain’t easy being white...
13j8dh,Now we know who does Susan Boyle's PR
2b5vq8,Today is my birthday.
av6tz5,Gob: Yes
1gt42s,"Bob Loblaw, IRL"
a0eipx,"""Actor"""
2czk0c,Tell me I wasn't the only one who thought Will Arnett brought Jimmy Fallon a dead dove last night on the Tonight Show...
4z3qm3,"Very obvious, but somehow I missed this until my 3rd-4th viewing"
dtsgww,"What is this, a crossover episode?"
1bdjnv,A 'study' Buster took part in...
dawu7d,"When allegations surfaced that he’d illegally built homes in Iraq, George Bluth, Sr., assisted by his secretary, Kitty.....(photo taken at a bridal shower I attended)"
ajzk0i,Swoop me Dragon!
bjwva4,An interesting title
9kcgh8,les cousins dangereux
ac01pc,If AD characters were subreddits
1cnm2q,Coming to a theater near you:
9mi9bd,"We just call it ""sausage"""
9yoish,With club sauce!
9cpvvw,One of my favorite moments in the whole show
dgrs9d,Her?
bm4ezt,Just like my Family 😂😂😂
akzdip,"Hey, whatcha tryin' to say to me"
1firfr,"A friend mentioned that she thought Charlize Theron's best role was in ""Monster."" Pshh, I disagree."
1tzjxs,Her?
1g9rxd,This line from Lucille Bluth gets me every time.
1kol7g,My girlfriend made this shirt for me in San Francisco
24vgys,Was watching CNN after the White House Correspondents Dinner
8obiv4,You mean... leather daddy?
2n3rps,The moment I knew I loved Lucille
aq1baw,🎵It Aint easy being white...🎶
8vjn3g,Got a good laugh. Posted by @bluthquotes on twitter
ase14o,Arrested Development will return on March 15!
1ghu3s,Buster logic.
16i35c,"Never noticed George Michael's sign says ""cousin""."
1ka68a,"My AD gift exchange giftee never posted the gift I put a lot of effort into, so I thought I'd share some pics here."
1d7x2u,"LA Times asks ""Will you watch the Netflix season of Arrested Development?"""
9zjggq,reminds me of a certain doctor...
19h3yv,Which brother?
7p7zjr,Marriage Expert
8zb6vd,My wife wouldn’t slow down enough for me to get a good pic of this musty old clap trap.
1bor9v,How the times have changed
yttvy,Guess who's filming down the street....
ahp9ct,So I noticed this on both twitters and thought it was funny
1932ml,One of my favourite lines.
9zsygp,My friend drinks coffee out of this on the mornings she is hung over
4c024r,Hollywood loves detail
9hucem,Ron’s recording new narration!
cv1cpt,"For the 1% of the people that get this in my town, I make them smile."
9dx9xn,Just Bleuth it.
1goswy,Was anyone else disappointed Ann wasn't in season 4?
7n2n5a,Today I went to see a Star War
dcefbj,"Check your lease, man, because you're living in F**k City"
6xftpn,"Ozark, 2018"
11gkkw,Jason Bateman uploaded a photo on his twitter: Chin Deep in balls 
a6j2gm,You can always tell a Milford Man
27hhqw,Party at Whole Foods!!
3b76vk,Free at last!
20odg4,"Will Arnett, you classy motherfucker"
biwm13,Every time I see the Airbnb logo
7eqbpw,I guess no one got it.
1lfu7n,Leather daddy at the VMAs
6sq4rp,Say what you want about America
1un85a,Ran into Buster last night at the BCS National Championship!
25yx8d,Honestly one of my personal favorite Tobias moments. I always thought he had acting potential
1y0c1v,"My mom just texted me this and said ""Jealous?"""
bcthld,"My Buster cosplay, because Army had half a day"
9b429n,Found at my local good will
1e91jf,Banana Stand quite popular in NYC
brahbe,Just like any normal family...
9n2qtf,Foreshadowing 8 episodes before Buster loses his hand
844ad2,Army had half day.
dvfc49,You can always tell a Milford man!
20cf2t,He's getting better at hiding himself
1emynp,"In anticipation of the new season, an Arrested Development/Godfather graphic for anyone not aware of these connections."
al4897,😒🍸
boj2zj,"Not oc, but I couldn't stop laughing when I first saw this. (spoilers for Avengers: Endgame)"
40vvyg,Everyone playing the Powerball tonight (myself included) [xpost removed from r/adviceanimals]
8to2kj,Saw this Deceptive Sign and this was all I Could Think of. . .
algvsh,Season 5 Part 2 drops March 15th!
1apvah,Classic Gob - A glimpse from the script of the new series in the works
6qongp,TIL Jessie the publicist (Jill Ritchie) is Kid Rock's sister
d73sca,Kinda blue himself up with that one
c6mr3a,"The army had half a day, so I made this"
4vzvv0,buster_irl
bsikns,Back in 2006...
20u9qr,Greatest Twitter Conversation Ever
19exg3,Always money in the banana stand.
1g4zdv,When I opened my report card expecting all As [x-post from r/gifs]
9equfr,Mr Manager and Maeby spotted at Salt Lake FanX
cu1xwp,Happy National Honey Bee Day!!! BZZZZZ
dib6ut,"Fortunately, she had the good sense not to drive herself to the meeting."
7xjina,Happy Vday!
1myvmn,"These are my awards, mother. From Academy."
1da1jo,The littlest things are the funniest
1h2kcy,More Unwelcomed than Gob
8icp49,And say goodbye to these!!
6zwigp,Finally caught this joke after all these years
8ycvv1,Press f for arrested development because they split season 5 in two to get considered for an Emmy nomination and they got 0 nominations
dlje2t,Name a more iconic duo. I'll wait.
7f2qsb,Happy? Thanksgiving
2k5663,"This will always be one of my favorite jokes, and a prime example of the genius of AD's writing and the actors' delivery"
dm20qz,“Off the hook...” Just put that together today
3vxx05,Netflix: 31 original shows coming in 2016 (Arrested Development season confirmed)
7tsvqy,Fourth time through the series and the first time I noticed Tobias's name tag.
1661ew,As a college student who recently started an internship. [x-post from r/funny]
1g3o04,Mitch Hurwitz Confirms More Episodes of ARRESTED DEVELOPMENT on the way
9ug9w3,Is this Altitude magazine?
bnupkp,Big yellow joint
auc9gd,Maeby Tonight -- Not OC -
16bp0c,Those Hollywood shows are so incredibly detailed! 
b2dlbq,“Best 17K mom and dad ever spent”
1hecfr,"So, I was going through old family pictures and found out my father has a problem."
14clnf,"I hope one day, I can be half the woman this lady is."
7v4l1q,AND THATS WHY YOU ALWAYS LEAVE A NOTE
1xaplj,Fonzies still got it. Ayyyyyy! [x-post from /r/funny]
5w63ze,made me chuckle
a28x87,"Among all the references to the Bush family in Seasons 1-3, somehow I never realized that GOB’s Segway was among them."
6kkecl,"Oh, God, it's Motherboy time already?"
2uij58,All I could see in their faces at the end of the Superbowl
1e8ugp,Across the street from Radio City Music Hall. Today only from 11am - 6pm!
1i9zf4,So many poorly chosen words..
1jklmz,"With the news of the Avatar sequels having been leaked, I thought this would be fitting to share"
13hapw,Bluth Chicken Dances
d5209x,National park service gets it
8ipak1,Probably one of my favorite shirts I’ve ever bought
1budxc,Pulp Fiction crossover I found in Tumblur
9o6u64,"You know what, I am done with this subreddit. I hope you've saved some karma, 'cause you're gonna need every bit now."
bhsvdw,We just say car wash
1yfqk9,Classic Tobias
cpmb7m,"...and baby, you’ve got a stew goin’!"
bh1051,Posted on Twitter. I love this man.
88ryx0,Nice
1h9v0b,Obviously the blue part here is the land.
2lrlth,Arrested Development Guess Who game I made.
9xzodo,Nice to see that The Sims 3 has accurate personality traits. We’re finally represented.
69iclb,Happy weekend everybody.
ahwch0,Just found this
cn05jo,You can always tell a Milford man
9t4vuz,"Tobias, you blowhard"
dahdrw,Bees?!!
bdioe3,STEVE HOLT! (I used my mom's embroidery machine for the first time)
15474e,A friend got his final paper in music history class back today...
1m2i59,My new mug has finally arrived!
63wpti,"Lucille's prison number in Season 4 is ""hello"" upside down"
6ufdwq,I thought this sub was about Arrested Development... the hip-hop band.
1r5jto,How I feel when someone labels their post [OC] (X-post from r/AdviceAnimals)
19o850,The only time Lucile ever directly addresses Tobias.  Season 2 Episode 11
bo8jjd,Barry Zuckerkorn is a genius!
88mk3r,"Rose are red, I have an itch."
1e2jld,BEADS?!
dpgdwj,Unexpected Reference
1hihz0,Lucille 1 has taken her feud with Lucille 2 beyond AD. (Season4)
czgsus,Good ol’ memes
7kylcq,Those are balls.
1k4a1r,A Bluth Model Home.
1eyx50,AD Prize Pack from Netflix Arrived!
d6v3i7,OH COME ON!
8c92ni,♪ Solid as a rock ♪
xtr42,It's Official: New Arrested Development Season Starts Shooting Today
89lj2j,The mere fact that you call it that tells me you're not ready.
7fhio8,...her?
24rtae,"Meant to post this yesterday on Star Wars day, but let's never forget this quote."
1jrkfa,Arrested Development Wallpapers
1hkj7q,Why I originally got hooked on the show.
82qbmv,AND THATS WHY you never talk back to your father!
935r9r,There’s always money in the
1hv8sz,"Happy Birthday, Jeffrey Tambor!"
d79a58,"Me whenever I ""forget"" to scan groceries at the self scanner:"
29k22g,Arrested Development is known for it's eye for details - so this really bothered me
2022r5,Maeby tonight? (xpost from r/funny)
8fl2jo,Why should you go to jail for a crime someone else noticed?
1dkvl0,Possible Season 4 hint in Michael's Netflix promo photo?
1ru8k3,little known fact about vodka.
1jj7rj,"My reaction when I realized the ""on the next arrested development"" scenes at the end of the episodes aren't really teasers and that I skipped every one of them on season 1."
863kqh,"When buster hit Michael, that was unscripted."
2io1tk,...away
3i9f33,Netflix posted this on their Instagram.
byrzkr,"TIL that the character of Ann Veal was meant to be played by a different actress in each episode, but it was decided that Mae Whitman would be the permanent actress because she made ""the whole not-memorable thing work"""
18ml79,Blue myself when I got on the F Train with this guy 
1edyyj,Soy loco por los cornballs!
6wa703,Saw this on top of a wheel of cheese at an Italian grocer in Chicago...couldn't help but smile
1b8mn8,My sister gave this to me a while back. I've used it every single day since. I decided it belongs here.
wrvzn,i agree with this dude.
9aklmg,Her?
9331o4,G.O.B.'s favorite skill tree in Skyrim.
8b2q25,I’M A MONSTER!
2vckfs,Has this mannequin ever even SEEN a chicken?
cmrkop,Some foreshadowing to the Rita situation in s3e2
1emmnp,"This isn't one of the usual foreshadowed jokes in AD, but I love the double meaning of ""drive"" in this dialogue."
8miucx,Seen at the local Ben & Jerry's
7i1lgy,Has anyone in the White House ever even seen a chicken?
accq72,Wink
2y1f0g,Who wore it better?
9tbogv,A slut and a blowhard
1bk4dc,I found a never nude while watching Adventure Time
10fj2o,When the girl I like mentions her fuckbuddy
znnt1,My favorite Gob moment.
ad6lnn,Its an illusion big bird. A trick is something cookie monster does for cookies
2l6jvy,"My Tobias Tennis Headshot Costume (with nevernudes, of course)"
cbpzi4,“Don’t you judge me. You’re the selfish one. You’re the one who charged his own brother for a Bluth frozen banana.” Bought from Etsy by @makemoody.
7uw98s,Mr. Manager achieves his final form. (2049)
b90vem,There's ALWAYS money in the banana stand
1zq29r,I was going to stay in my office tonight
atl313,"“Sister’s my new Mother, Mother!”"
796tlt,When I find out a stripper named Kitty was involved in the JFK investigation
5cgi9o,I didn't want my mom to mistakenly eat my edible. She didn't get the reference.
1xdtn5,Arrested Development Valentine's Day designs
77fhos,"Saw this on news feed. ""Actor"""
21x9zw,Someone set up a banana stand on campus.
8q2fa0,This might be my single favorite joke from any show.
cjt93e,I built a banana stand (and dressed like Lucille)
ccwdsp,When only 12 people show up to Area 51 on Sept. 20th.
93r2sh,"How else would you buy groceries, Michael?"
13na1i,"Filling out a sex survey at school, came across this."
110ckf,Looks Like There May Be A Funeral On The New Season. 
1mt0ik,I was once called the worst audience participant Cirque du Soleil ever had.
1gffab,heh. Veal Marsala
1dmp6z,Why this is the best month ever [X-post from r/daftpunk]
c1flkb,"28,000 people and only a dozen knew what I was going for.."
c2gc8p,Found on Ask Reddit. What show would you revive for one season?
2pd7nl,I'm a high school psych teacher. My students will be taking this quiz today.
aaazw9,You can always tell a Milford man
bfksrc,I wasn’t “Super prepared.”
abl9tz,Say hello to Mr. Manager
1o0oh8,Buster?
9ve88z,“I’m afraid I just ‘blue’ myself.”
1cxwma,I just blue myself (AD Promo Posters taking over Overland & National in LA)
dwyi0m,"It's an illusion, Micheal"
191j84,Your chair...
1weaee,When I saw him on the cover of an in-flight magazine a few months ago I had to made a quick change...
119glx,Soon...
22muf3,Couldn't help but laugh when I saw this at my work
1ll3m5,Jack Black just posted this on Facebook.
czpv4o,Look at banner Michael!
1ze1c0,Who wore it better?
1eqqoi,Tobias at his best
a12ofv,It'll be a dry run after all
8rr910,Spotted at a flea market in Boston. I guess you could say I was... buy-curious
1a9xyg,AHHH he did it again!
16rx6v,Why I love this show so much
aynu3x,From r/Tinder
17bafg,X-Post from r/breakingbad - The Most Important Thing.
1ik2ds,"Just posted to AD's facebook page, Season Four Emmy Nominations"
a9z91n,My favorite scene on a tshirt.
9h7as2,Love texting my wife Tobias quotes with my new Memoji
1gs2kj,Coolest arrested development photo I've ever seen. (x-post /r/pics)
1ce6tm,"When Buster accepts his medal from Army, he's holding a flashcard that says ""And most of all Mother (choked up)"""
1euqru,So I was taking an Arrested Development Quiz and I accidentally hit NEXT without an answer.
12v6b9,Bob.
dnn4u6,Triceratops
d65ezw,This seems like something Tobias would say after being caught doing something feminine
858wlx,Getting representation on r/marvelstudios
ax5hkq,Accidental GOB on BBC News
6pkzxe,When someone asks what type of funeral I want...
18uec8,I enjoyed this flight more than you'll... Never Know.
1it5h6,Found this great reference on the marker board in the first episode of season 4
7s9pjc,Bluth Brothers.
17llxe,Walking down the street when suddenly...
2ydy45,You can always tell a Milford cat. (X-post from r/pics)
1e0yc1,"Thanks, Netflix!"
2qyi6m,Celebrating the New Year with my parents tonight.
6tjy53,I feel like America needs Dorothy right now
1hh4ct,"I timed George Michael's ""unfailing internal clock."" I don't know what I expected."
6e86n8,I don't see anything wrong with this at all.
vr17n,"Take a look at poster, Michael!"
8ex3nz,“WHY DID YOU BURN ME DOWN MICHAEL”
1g81r9,Netflix chose a sexy time to freeze up.
1w6wz9,Lucille Bluth is my spirit animal
6kqcw5,"The mere fact they call it ""Pop Pop"" tells me they're not ready."
26dwad,"My grandpa made me this for my graduation party, and yes, it's lined with my grad money!"
180er9,Someone at the Kentucky basketball game blue themselves.
17nb95,"I know people have issues with Mrs. Fingerbottom, but this is hands down my favorite AD moment. "
1wv9mu,"A Little ""Afternoon Delight"""
8sqe36,Gob's plan ft. Buster
byiojc,Happy birthday Mae Whitman!
2buzv5,"GF sent me this from the Netherlands, there's always money in the orange stand. (x-posted from r/pics)"
5fdhv7,Getting tests back on a monday...
dg6jbv,"""Also they cannot charge a President and a VP for the same crime"" - his lawyer, probably"
9cil74,"Probably illegal, but here goes"
ajr2u8,Never nude leather daddy
raqvy,"I am ""STEVE HOLT”! (Justin Grant Wade) Ask me anything. "
5dcfhm,The face I make when other people don't get my Arrested Development jokes...
8svtij,It's called Fakeblock
8o5cq5,"To celebrate my enthusiasm for the new season, I made a pixel Tobias from fuse beads! (crossposted in r/beadsprites)"
15qoxy,"Oh, you're going out to the club on New Year's Eve?"
38o5wt,When you see someone having bees in a place where they don't allow you to have bees
22upuy,It's Arrested Development. In emojis.
60wfhb,Netflix is dropping Arrested Development
16juqs,Happy birthday to this guy!
b67av3,This person understands more than you’ll never know...
dd1t67,Mrs. Featherbottom
b7oj2f,"Anyway, it involves us making some money with our Mexican friends from Colombia."
18397p,Has anyone in this family even seen a chicken?!
7sp4tf,Egg (x-post from /r/FrankOcean)
1e6sda,My 2nd favourite Bateman expression
1hl38n,Young Jessica Walter (Lucille Bluth) = megababe.
8xzppg,Apparently they were going to keep recasting Ann until Mae Whitman nailed it so well...
3esw5t,"Found this on the wall of a bar in Soho, London."
1bi8ph,Hulu April Fool's Prank
dq60r4,"“...And so Tobias found himself booking passage to India.” Only a few of my coworkers knew who I was, but it was still fun HAHA"
bjimv5,"These are my awards, Mother. From Army. The seal is for marksmanship, and the gorilla is for sand racing. Now if you'll excuse me, they're putting me in something called Hero Squad."
blvwlh,That is a good excuse...
16lesu,"It's not only the birthday of Jason Bateman, but also this guy.  Add one more birthday in there, and baby, you got a stew goin'."
d9j3wu,You can always tell a Milford man
7j4oou,The Russo Bros posted this on Facebook
1f2dke,Looked through the code for AD Netflix page...
1n6dmm,Gob finally made it.
16nanm,So you just finished off the bottle??
82ko20,Obviously this blue part is the land
d49myq,You can always tell a Milford man.
8s0ssh,What joke or aspect of Arrested Development took you the longest to get?
256bm0,My friend didn't think the yearbook staff would let his quote through... apparently they liked it. [Picture]
1tael7,Ran into a familiar face at the gas station today
1kqwxk,Intern at a horror festival. Boss asked me what my favorite horror movies were for the festival's website.
11xnmd,Ron Howard...(found via tumblr)
85sp3v,Looks like Lindsey is running Absolut’s latest marketing campaign
1xgpn5,Gene Parmesan Valentines card
8mslt8,I did go to law school
c43qvc,"""What have we always said is the most important thing?"" ""Breakfast..."""
aqbqcg,Its the final countdown
ye41e,A friend of mine just got a new job...
9m3wfj,"Trevor is told that Michael and Rita are in Legoland, he leaves to search for them and later in the same episode, is seen wearing a Legoland t-shirt."
14pae6,'Arrested Development' pauses production as Netflix episodic order grows (looks like 12-15 episodes instead of 10!)
9e4vk4,"Shhh shh shh sure, the guy in the $600 Banana Suit..."
24p2a1,In honor of Cinco de Cuatro AND Star Wars Day
2iuf43,Young Lucille is a hot tea.
18541d,This rolled up outside my office today...
91w1mo,When I’m bored at my job but have nothing to talk about with my office mates
640os0,"These are my awards, Mother. From Army"
6xo933,Made my friend a housewarming present with her favourite AD quote
cg02dd,GoT x Arrested Development
1bbsie,Koo Koo Ka-Chaw!
8lpg4t,Our lovely Lucille Bluth (Jessica Walters) has been doing the wink for a lot longer than we realized
421ksx,My mom was going through my childhood things today
6xtf3n,Uncle Father Oscar
2sazyd,The Bluths
2dc8cb,Mrs. Featherbottom's version of Mrs. Doubtfire :(
buwfka,The crossover we deserved!💯
9wbqoe,You can always tell a Milton gran
7q4chc,There are dozens of us... dozens!
1i31kc,My reaction when my boss told me we will start selling beans...
1o39up,It's Arrested Government...
1f5bta,/r/ArrestedDevelopment is back!
1f10gy,No lie in tomorrow.. (S4 goes on Netflix at 8:01am British Time)
6n3gbs,"George Michael's ""places I have been"" map only has 3 pins in it (s04e01)"
6ohqq4,Season 5 will be a murder mystery
82f07z,A truly touching read about the life of a closeted homosexual. Highly recommended
1e3v55,My wife and I found the never nude department.
9ifhx2,"For some bizzare reason, the stair car in Arrested Development appears in S07E012 of TNT's Rizzoli and Isles"
8wdq97,“It’s not happening- is it?”
7uqcmp,"Obviously, this blue part is the land"
2auxrq,"Out of all the new guest stars in season 4, Kristen Wiig as a young Lucille Bluth is by far my favorite. Spot on impersonation!"
1l54g4,Mitch Hurwitz confirms the Arrested Development movie is moving forward
a4yc2m,Getting a major Arrested Development vibe from my Coke bottle today
6ehf3c,And that's why you don't give yourself nicknames...
86lhph,Back up Marvel
6drmtj,The woman Michael thinks is his sister (but she actually isn't) is played by Jason Bateman's irl sister
14fhe5,I can't believe this was in my school's newspaper!
18xi6o,You made a gif of... her?
z328o,Let's vote for Bluth's Frozen Bananas Chips in the Lay's Create-A-Flavor Competition!
cer14d,Well obviously the blue part is the land
a8m5mz,"The Genie No One Deserves. By your friends at The Midnight Society, LLC."
884iq2,Say what you will about America...
dxi9xo,BEEES??
2p9ops,Flashbacks to Catalina at a wedding photobooth last night
ab0hki,Hmmmm
3asg99,I'm so proud of my son. You can always tell...
1lh4vq,Greatest pet name ever
b4wem0,Your back in the cutoffs again!
9d9tv6,#1 acting coach
1diebc,Jeffrey Tambor AMA tomorrow
cwldke,These cats up for adoption where I work...
87nop4,Finally framed this Etsy poster
9pva02,We have unlimited juice? This party is gonna be off the hook
93jw74,Arrested Development Reference in Splatoon 2!
725m7d,MOTHER!
15kzsk,"I said ""Cot"""
6nf5eh,You can always tell a Milford man.
d3qlg0,"Like Father, Like Son"
1q1igx,My brothers lunch. Couldn't help myself.
7z53zn,Rewatching S4 and just noticed Lucille’s prisoner number... ƃuoʎuuɐ
b4ohqo,"Just an appreciation post for this young actor. His young Gob was so believable - identical mannerisms, facial expressions and locution as Will Arnett's. He did a really wonder gob."
chyfsq,Friendly reminder that Tobias Fünke is part of the Marvel Cinematic Universe.
ch9oo3,The analrapist is in
9715r2,"In S4, Gob and Tobias are eating Parmesan and Mustard. In the movie Clue, Gene Parmesan played Colonel Mustard. COINCIDENCE?!?!"
1sjsct,Gene Parmesan + Ann Veal =
bt6tez,I really liked Aladdin movie
7zqqpn,Some words of wisdom from George Sr.
3vf7n0,There's always money in the banana stand reference in Just Cause 3(x-post r/gaming)
2o2a86,A sad day for British eyes
8c4uhw,Found him. He’s doing well.
1g58hr,"My little brother, out of nowhere, comes running up the stairs; looks me dead in the eyes and said, ""Mother, I'm going to army."""
scwde,Steve Gobs
81yrp5,Vodka is technically vegan.
d2h35j,The many set-ups for Buster’s hand is one of my favorite things
1exqux,BK's least appetising menu item.
cybqju,I'm afraid I just blue myself
6i3lk3,Fathers' Day trip to the museum and I noticed they had a photo booth
8ujsin,"Please tell me I'm not the only one that just realized this nice little touch. Jessie works in PR, ""spinning"" perception. Michael meets her in at the gym on the stationary bikes, aka indoor cycling or ""spinning""."
6v4gmo,You can always tell a Milford man
7marq4,I think this belongs here
1gq3hu,That Fünke that everyone keeps talking about...
9r17by,"I want to come clean to you all, because I think you should know."
bcrzji,MRW I see liquid on the toilet seat and I'm the only male in the house
zc70m,"Drinking a beer, then I saw it."
a6s706,Thought you guys might appreciate my grad cap - Just in case the job hunt doesn’t work out...
1dy5xk,I morphed Dr. Tobias Funke and The Great Gatsby cover. It turned out appropriately.
bhzqic,In honor of Tobias being an official MCU character
4h7axj,"Like you're going to send me to the penalty box while I'm wearing a $3,000 suit"
92qoha,EVERY time!
w7yai,"Happy Birthday to the man who taught me to ""always leave a note"""
15c7wb,thrift store t shirt find
c8dzq0,"""Tobias was on trial for breaking a man's sternum while giving him what turned out to be unnecessary CPR. Unfortunately, while demonstrating his innocence, he also broke the sternum of the obliging bailiff."""
1fpcaw,Loved the Workaholics guys in S4 EP1
bah09f,Spotted Gob on Sesame Street. I think he meant to say illusion?
1s0rzy,Arrested Development and Frozen
botgbb,"Let’s all be like Tobias, and blame it on 9/11"
7rkavm,Perfect match
60hzt1,"My whole life, all you've ever praised me for is my looks."
9rq46x,When my mom calls to try to shame me into spending time with my abusive grandparents...
1fvbaz,She's got a little hard-boiled egg going there.
3s5vc8,"Was watching Sesame Street with my daughter and didn't expect to see ""Max"" the magician."
1fgdvp,"Google search trends for ""Hello darkness my old friend"" in the past 30 days"
157tio,Poster I made for home office. Not my best but It really helps me to keep my head down and power through..
1g3haw,Arrested Development: The Show So Good Even the Cast Quotes It To Each Other
2bohqn,So my ftiend bought a shirt in Thailand...he had no idea
16ortc,highlight of my twitter career
9lam98,Her?
1gnjt5,"Was watching Sesame Street with my son when, ""Did somebody say magic?"" GOB must have gotten back into the Alliance."
dxzevs,Map porn didn't get it but Buster was right!
bcftzd,"Bees? No, beads!"
3r1gnc,Say what you will about America.
737p0m,Wow I lost my mind when this happened
4h2eik,I like how Time used the Bluths as an example.
465bmu,Popped up on my newsfeed today
bdrlqe,My favorite joke from Season 5b
9kk41b,Tobias?
6s0bb6,Inspired drinks seen at a local NYC restaurant.
dntn64,"Oh, stop booing! There's nothing wrong with it."
1ycrds,We shan't be telling your mother about this...
1e00ej,Never noticed this subtitle before
b6ihae,Who knew that Thanos was a never-nude?
1qrngl,This chick-fil-a has been sponsoring their own motherboy date nights
9l3b3l,Co-worker got promoted to manager. Her reaction was everything i hoped for.
18z23e,"My brother served in Afghanistan, and bought bootlegged DVD's when he was there. This is the AD case he got me."
zhakw,Why Will Arnett and Amy Poehler Split After 9 years of Marriage
1d7g2c,Arrested Season 4...
