post_id,title
djb8eg,I think I need to go to the hospital right away...
8rk3mj,I forgot about this moment in Season one. Oscars first episode when he was asking for money
1e1dxc,Friendliest. Dude. On. Earth.
1anl0w,Just watched season 3 again and remembered this!
14vdbc,Happy Birthday Nichael!
a8fyen,Saw a familiar face while watching Sesame Street with my daughter
5h2h6k,I see nothing wrong with this.
9q36nv,Words of wisdom
a5lnle,When the custom character you made as a joke shows up in a cutscene
7vg4ii,In S2E3 Buster says “I never thought I’d miss a hand so much”. I’m just realizing now they were setting up his hand getting bitten off for years before.
9frzvo,EVERYONE knows!
1dq6ve,The many faces of Tobias Fünke
alas0k,Is she funny or something?
dke52u,Facebook just reminded me of this stupid thing I made a few years ago.
1kcvl8,George's finest moment
1gc4a4,Noticed an advert for Maeby's film in a 2 second shot on Gob's first episode. The attention to detail is staggering.
3fn40r,I couldn't help myself...
7zjw8g,Still the funniest moment from season 4: George Michael’s picture ID for Michael is the mayonegg reaction face
760sx0,"Arrested Development in r/askreddit, there are dozens of us.. DOZENS!"
73zu8x,"Probably should've noticed this sooner, but I just realised that Ed Helms plays a realtor in 2x01 and again, 9 years later in 4x03."
4uj01k,Loose seal
1yj598,You've got three days
adge7z,"Somewhere over the rainbow, there's another rainbow."
a4f7fs,Banana Bank
6gtlux,I got to illustrate Jeffrey Tambor's memoirs. Here's the one I did for the Arrested Development chapter.
26wlen,Tell him Rollo wants him to say goodbye to his legs.
cdnc06,Charlie Brown Christmas song plays
1etgin,The thing I'm most worried about for Sunday
1avo11,I walked into a friend's house and he had bought one of these and was running it. This was the first thing I thought of.
cqs4be,Tobias represents the inner gay in me before I came out lmao
7xe44a,It's not a story your Aunt Beru would tell you.
2yk22d,Obviously this blue part here is the land...
1npsfu,Bob Loblaw is gold.
9v1x12,was reading a deadpool comic and saw this
9exkdw,Flying
17k54h,"Saw this painting for sale, figured you guys would appreciate it."
c6alh1,You can always tell a Milford man
9magt6,Steve Holt!
az5ysn,We found him boys
1i7t6x,My favourite Tobias line
bftzs8,My cousin let me decorate one of his eggs today. Should I get her all glittered up for Easter?
669zu0,"The image of Motherboy from ""Motherboy XXX"" is actually 4 members of the Bluth family plus a writer."
1hn5es,I wonder what Maeby's high school mascot is..
97nu40,"Nice little detail: When Gob is living on the yacht he has framed pictures of Michael, George Michael, and (I think) Buster around the yacht."
8e1yl1,Found this on r/politcalhumor
6wczro,Local brewery knows
b8ee20,Huzzah!
19y0ho,Three Hermanos
1qjdru,However... [x-post /r/TelevisionQuotes]
48t8cc,"""Has anyone in this family even seen a chicken?"""
1xt0bc,It's become a part of my marriage.
3dqsem,And that's why you always leave a note
1j7rn8,Looks like Tobias was on my flight earlier today
9yxdqn,It sure is.
9tjasv,Arrested Development is 15 Years Old Today!
1fzd75,Happy birthday to her?
amhd2b,Glad to see that the actor in El Amor Prohibido is all grown up and has a part in Narcos: Mexico
3owxqb,For all you girls out there looking for a slutty Halloween costume
839628,Who of you lovely never nudes scored this awesome license pate?
26sxmk,This party is NOT going to be off the hook
1micdp,One of my prized possessions. Signed by Mr. Tony Hale himself.
1jhr2h,"TIL that Mitch Hurwitz and his brother Michael started a cookie stand (an old taco stand rented to them by their father) called ""The Chipyard"". It was so successful that it helped pay for their college education and is still in operation today (and was the inspiration for the frozen banana stand!)."
aelf9u,Meaby she not my cousin
1ra5sq,Alia shawkat getting high with aubrey plaza.
91o078,"Well, I don’t know what I expected."
5a6kkp,Get ya a girl that can do both
bn1eub,At the Milwaukee Zoo. There might be money here.
94df9l,Found in a Chicago Thrift store
7we1lw,I found Maeby Fünke's favourite frozen dessert out in the wild.
5m7sfo,MFW I look at my phone and see our PRESIDENT-ELECT's latest tweets...
1xwerm,What are the chances?
8fcauj,When Carl Weathers tried to turn me into Tobias.
56t5ag,When they don't give pop-pop their hair
1jmp0w,"I called it, ""Tobias"""
dwj6z4,Carl weathers went all the way to space offering acting classes
72l2kk,BEADS?!!
2g7caz,I think I know which studio exec greenlit this show...
7gwuxg,"""I know what an erection feels like, Michael."""
9wmqbp,That's a Cross...
9nxmdp,Steve Holt!
1j9yu4,"Found this wallpaper, had to make a few additions"
10ledu,AHHH HE GOT ME AGAIN
brmrqu,Her?
8gqpok,"When George Sr. is hiding in the attic wearing maternity clothes, he's reading What To Expect When You're Expecting. Here's my copy for comparison."
1b1idj,"Still doing that, huh?"
13154p,Discovered Dad's new koi fish died while he was at work. He asked me to bag them and put them in the freezer so he can take them back to the pet store later. 
26g4gj,I'm still trying to memorize this title.
18n5i9,Bees?! Why?
1cggqd,Gob caught me sleepin (u/Hawkonthehill)
cpachz,Buster: I'm a scholar. I enjoy scholarly pursuits. Also Buster:
cm0pnp,A trick is what a prostitute does for money. Or candy.
1eikp2,This was part of an email that Netflix sent me.
2j25k7,So Siri just told me this
21ie4g,"When my girlfriend and I want to flirt via text, this is what we sent each other. [Seriously]"
d5vu2d,"I can't believe I've seen this show so many times, and only just picked up on this!"
1mkdxf,Found this on a trip to Switzerland this weekend. There were literally dozens of them.
17hz4r,When you see it...
dkhw8m,Obviously this blue part here is the land...
7fot7d,"I saw this on Facebook, it reminded me of the show"
43c3du,look at tobias's name tag
7km7ca,*air horn*
amv4qd,Never Nude (original post from r/2healthbars by u/epix97)
9qs2fe,"Obviously, this blue part here is the land"
7bp3rv,NO TOUCHING
agccax,"Needless to say, tonight is going to be off the HOOK!"
7gh9eo,Please make sure you are fully inside the free speech zone before beginning your protest
1g0j8i,No one in my family understood this card.
