post_id,title
87p14j,Please change the icon for collapsing a comment on desktop to anything but an up arrow.
7fl2hj,[Feedback] The Reddit Chat Idea
967zwp,Why is 40% of my feed Showerthoughts all of a sudden?
4chs6v,I totally forgot I was in beta mode
do4ruo,"Annoying that the ""new"" Reddit still lacks features the old Reddit had."
ahlx1w,"When reporting spam and the sub's mod agrees, you should be rewarded for helping the community - one ""point"" or such."
88chy6,[Feedback] I turned beta off.
dpolxe,I read all the top posts on this sub.
8cx7f7,"[Feedback] Redesign should have a built-in dark theme, or at the very least incorporate the themes that come with gold."
ajrsn6,"[Feedback] It's been a long time since you introduced v.reddit/i.reddit and yet it is still a buggy piece of shit on Firefox, and especially on mobile. Why, what is the hangup? You guys are super busy selling Reddit into the ground so I know you have the money to fix this issue."
8st9vw,"Now that we DO have a chat feature, how hard would it be to have a ""delete chat"" option, on a scale of one to not-very?"
cwo06g,The official app has horrendous loading issues.
ck9102,[request] stop warning me 2 separate times every single time I open an NSFW link’s comments.
9w1sih,[Feedback] Apparently 308k upvotes is less then 283k in r/all when sorting by top of all time
6imw1x,[Feedback] Post to profile will turn reddit into Facebook.
anmll8,Prompt before auto-jumping to the top
ai429c,I think it would be wise to have an epilepsy trigger warning for content with flashing content.
9df65j,takes like SIX SECONDS just to load the comments
bjeqgl,"Confirm your email! ""Got it!"" No, seriously, confirm your email! ""Got it!"""
7kletc,[Feedback] What's with forcibly making everyone log in?
boi5qt,Reddit getting slow in loading posts and sometimes downright stops loading them.
8irlcm,For those of you who miss the random buttons as much as I do..
76gt4a,"[Feedback] Reddit Gold should allow me to turn off ""Recommended"" user posts"
9qrdkt,Can we block subs please?
c6zvv1,New award for reposting karma whore
7sfaf5,"[Feedback] Not sure if this is a ""Beta"" change, but Reddit is just awful now."
af96ii,Why does old.reddit.com redirect me back to new?
a67op6,Why doesn't Reddit have an option that lets you see who is following you?
8e7q5d,[Feedback] I really do not like the new design.
7cvgoz,"[Feedback] Please, give us an option (a checkbox) to disable Reddit Chat."
ba0k25,Can I stopped being logged out multiple times per day? Same browser and i have a static IP as well.
banx4u,Reset scroll.
atnyaf,I keep getting told what’s trending on j r/The_Donald even though I’m not subscribed
ak2xne,Seeing promoted posts even though I've paid my yearly fee.
8vhb2j,I really miss having my subreddits in the sidebar!
88obsn,Mobile app not showing upvotes and downvotes on comments.
60pekc,[Feedback]New User pages
bhua75,Please stop nagging me to use the redesign.
7x9xzv,"[BUG] Guys, help me remembering all these forgotten years"
d1rh25,"We can get spam in our chats now, good times."
cxw84q,Is the Reddit app bugging for anyone else right now?
blfuhf,"Subreddit Moderators should be allowed to ""quarantine"" their own communities."
8p3yd3,"I dont totally hate teh new beta, might be growing on me. But I hate how when you click a post and it pop ups on the same page."
d6f48x,The Reddit App hasn't been loading posts 90% of the time
3vy7zl,New Beta Feature for Mods: Sticky Comments
defydc,Place a watermark in corner to display whether it’s a video or a gif.
46ax3q,Beta update (2016-02-17) - Media Previews
c5d0dp,Since when were ads in the midst of normal posts on old reddit?
ady6l0,Update on the bug where you’re randomly reverted back to new Reddit
7hg5w8,The Blue header bar defeats the purpose of night mode
at5168,Karma not showing on 90% of posts
c7crsh,[Feedback] Why are there so many adds on reddit now? I use old.reddit and have never seen this many ads before.
aiifrp,DOWNLOAD THE APP! download the app... DOWNLOAD IT AGAIN!
cduae3,Hide posts I have seen
d6146s,Get RPAN out of my face please and thank you
9srrc3,Can we implement a way to not show users sponsored/advertisement posts after they downvote them?
8bob5m,I accidentally clicked open in new incognito window instead of new window and i got the redesign...damn it felt so fresh and crispy but I got too excited and logged in which led to the redesign going away....arghhhhh
a8ynnh,Stop fucking reverting me to the new Reddit.
bs8rfj,"[Bug] Stop fucking randomly logging me out, eh?"
c9wdm1,"we should have a"" force show controls"" on gifs and videos"
dpf3uz,I don't care what today's top growing communities are
apod5p,Please allow mobile users to filter subreddits from their r/all in less than three clicks.
ct29pc,"They should remove the ability to guild cross posts, often the cross post has many more karma/awards than the original."
cphcpp,"[REQUEST] If I view and upvote a post, don't notify me when its trending."
6bv2f1,[Feedback] Here is why I dislike the new profile
a555es,Summary of my reddit experience this past week
8529zt,Please don't obfuscate CSS classes to allow custom styles or scripts
cabzrt,[Feedback] Remove the GET NEW REDDIT button
a29ynf,NSFW Posts Now Start Off Blurred in the iOS App
aaqsmn,I'd like to be able to filter a person's post history to a particular sub
c7sc2z,[Feedback] Seriously reddit. Spam bots in chat. Code your shit better
dex6bs,"I only viewed the sub, why am I getting spammed with more content from it when I didn’t even join?"
dbz2qz,Please allow users to block a subreddit from spamming!
5ftxtn,[Suggestion] Beta Features should have a beaker icon or similar to remind the tester it's a beta feature.
ciur6w,Request: to be able to make a list of subreddits that you don’t want to see and the subreddits will be hidden from sections such as popular posts near you and trending subreddits
8gz55j,Can anyone implement a SFW mode for reddit that removes NSFW posts from your feed?
chtg9j,There should be an option to change your username but...
aej527,[Feedback] Reddit Silver = 24hrs of benefits
a0d5vr,Can there be a block NSFW option?
6uckvg,[Feedback] Stop auto-playing videos.
ashyud,"Add a ""politics"" tick box."
9lwonm,"I'm already logged in. You know it, and I know it. So what gives?"
dg0jdb,Why can we only report some ads?
crxct0,"I have premium, why am I getting sponsored posts?"
bx161o,I keep seeing certain subs suggested to me that I’m not interested. Is there a way to say “never suggest this again?”
8qadtb,Thanks for listening to feedback!
8kclyp,Is sneaky adverts a thing?
8j336u,New Reddit
8wlczp,Dude you GOTTA put some space in here.
7c5c0z,Screenshots of the new desktop beta!
dlrg32,NSFW thumbnails are no longer blurred out on the feed
alhxhb,[Feedback] We should be able to see comments we've upvoted or downvoted like we do for posts.
btrck9,Spambots are abusing the chat functionality.
9rks1n,[Feedback] Reddit search maybe the worst search I've ever experienced
3l1v5j,[Question]Can beta testers get a cool little flask trophy?
doai6g,"There should be a sort option that sorts by ""dead"", showing posts from exactly one year ago."
ao6bov,Can we get a ‘save draft’ option for comments?
8m90ob,Feedback: Fake content ads from blocked users still displayed in the user's submission feed.
bfc4w3,Reddit needs a graph of people online on subreddits.
9gwelf,Major Issue At Work: NSFW Post thumbnail shows up!!!
cuiy55,"please move or change the color of RPAN icon. Also, please make the RPAN post hide-able."
88zyac,[Feedback] Using an actual hamburger icon for the hamburger menu icon isn't very intuitive
8130fu,Did it just get harder to collapse comments?
aq7aec,My screen started vibrating.
6d53kj,[Feedback] So who else intensely regrets turning on the beta profile?
d3ov0k,why offer the pop up use reddit app or continue to browse in chrome when it just freezes and i can't do either.
d220pm,Blocking someone should stop them from seeing your posts
bqgqop,An option to turn off people from following you would be nice.
40gqv4,[Meta] It's finally happened. RES has updated and stopped messing with the beta flask.
8m6ivo,Let me comment on ads or go fuck yourself
35762a,Welcome to /r/beta
cp4umb,[REQUEST] Hide All Child Comments
d88dz0,How do I PERMANENTLY LEAVE A CHAT so I will stop getting notifications for it?
8if7tk,[Feedback] Can you not put the “try the redesign” button so close to the “My subreddits” tab?
dij7go,The Saved posts feature needs more depth
6nf5nd,"Another problem with profile posts, as explained in the Shitty_watercolour thread on r/all right now"
avtvc1,We should be able to filter out NSFW subs from appearing on Home page
51vdig,"[Feedback] can we make the notifications say /u/ instead of u/, and /r/ instead of r/"
8nnody,Clicking on a post on mobile opens the top popular post
avazff,"Like/Dislike numbers show up as ""•"" on some posts"
a2gvxb,"For months, I keep getting sent to the redesign despite having opted out multiple times over."
an6ae5,Naming convention.
7in5s3,"[Feedback] Thanks for putting an icon next to all v.reddit posts, now I know which ones to avoid."
9i0jci,[NSFW] And today's promoted post is...
7qvt9f,"[Feedback] seriously, overview fucking sucks"
7dcp7i,Does every beta user have the chat right now or was I randomly selected?
4g6lxs,[Meta] If you're going to auto-subscribe all beta-testers to this subreddit can you moderate it?
9pum0k,Bring Back The Random Idea
cgw4zp,Add a reporting option for scams.
akv341,Nightmode turning on/off
cao7sv,[Feedback] You threw ads in the middle of classic Reddit pages. Now stop reverting me to new Reddit every day.
cx8naz,Memory leaks after scrolling for a while
8t2nmu,[Feedback] It's really slow
a5ks3q,"I've opted out of the redesign, but oft times--but not all the time, when I click a link I'll stay logged in, but get the redesign."
929zen,Petition to make this a sub about beta fish!
8hf1j1,Can we get a time estimate on dark mode?
dk6lum,You should unlock coloured usernames when you gain a certain amount of karma
ab1773,"[Feedback] I’d like to be able to sort by Top - Last year, or 2 years ago, or last month, etc and not just Top - the most recent year or month"
96zffa,Reddit must have options to block or mute users
90x53v,I would appreciate if clicking the scroll bar do not close the post I'm reading
8rb3gm,Can we make the right side menu hideable?
bxa3zj,"There should be a ""collapse all replies"" option for mobile."
abpoub,Pls fix
9ozq5o,The platinum icon doesn't grab attention at all in the same way the gold icon does.
b09gy5,"Reddit shows me ""personalized"" ads even though I have them disabled."
952b4j,Promoted Post spam
dgrysx,I keep seeing posts I've already seen before
9mzzah,[Beta Bug] Stop pushing new reddit to me... I don't want it!
7w66w9,[request] block users without the need to submit a report.
7l4i6x,Swipe left!
b9hkpl,I apparently moderate someone else’s user page
9e8b6v,Reddit is forcing me to install its app... [android]
d9lrq2,Why am I getting notifications from a subreddit that I'm not subscribed to anymore?
cyp802,Night Mode keeps randomly stop working
aq038k,Dark mode randonly switching on and off
6ab61q,[Feedback] The profile feature leans more towards what Tumblr or Facebook would do...
4ybq2c,"Is this part of the beta? Chrome notification popup, have never seen it before on Reddit"
6n9lg8,[Feedback] Inboxed recommended posts are something I don't want to see
9bd4a5,Up/downvote and comments buttons no longer working on mobile
834e47,Why does this whole redesign feel like Google built it?!
8atn9n,[Feedback] Is it OK that inadvertently clicking on a promoted post may result in an app install?
dh42wu,Reddit needs an option to hide/see reposted content.
cz3yi3,I'm still being spammed
cofuc7,Allow comments to be pinned by post creators.
8psogx,Highlight Reddit's promoted posts?
7f7b50,"A little note spez sent me, just thought you guys might want to see it"
8i17di,This new UI is almost physically painful to use
9n8a94,"The new Subscribe button vs the ""+"" in the subs profile picture is much easier to press - thank you!"
7i7rqx,[Feedback] The new chat icon looks like a Ninja
d6t91v,Request: Sort by “Hot ‘n Spot”
7ynaog,[Feedback] If I’m scrolling through comments on mobile I don’t want half my screen taken up by the original post
7e9pwu,[Feedback] Really need to let me remove the new 'Local Subreddit' crap.
73thne,"[Feedback]The Crosspost feature is very nice, thank you Reddit"
bvy9xu,I keep getting recommended New Zealand related subs.
8ixrkp,Can I make the new Reddit dark in any way?
89p75v,NSFW posts blurred in redesign
590zx8,[Feedback] I honestly forgot I was in beta until I accidentally clicked here. So good job keep it up!
cnzrw5,Flairs in Dark Mode
cig898,Can their be an option to change your username
84w0lp,/r/jailbreak has a dickbutt problem. Was this some kind of test image?
9dt3is,I see this ad everytime I open Reddit
ain2wt,Sidebar ads are messing with my feed
ci3iu5,Congrats to chat being annoying as hell.
b5lfo8,Stop logging me out. Please.
acu8ll,Can we have a switch account button?
d5x5ou,Clicking on ad goes somewhere else and potentially misleading
7algao,"/r/Beta mods, please sticky a Reddit Chat invite megathread."
6tdxll,[Feedback] New report flow is pretty patronising and unhelpful
bg024p,what’s up with all the Indian people posting links to exams and songs? Do they not know that this is r/beta lol
5q5qrd,[Feedback] I don't like that I'm forced to use the mobile site
bl8a7w,Sort by most downvoted?
bky274,[Feedback] How many times am I going to have to opt out of the redesign before you stop forcing it on me?
ay41lk,I feel comfy in the new Reddit design
a2tpx3,This is getting out of hand..
8bhqle,"You know what would be great? Having a ""find in page"" function for the app."
9sgxch,Night mode gets disabled regularly when I open a post
d4l0vw,Ability to use Themes and Dark Mode
91uac2,Request: Allow some subs to be hidden from your post history.
8rjnuc,I have an idea for the new Reddit Chat feature.
9d6076,Display Karma given as public user stat
dujkxa,"I have tried to hide r/pewdiepiesubmissions from appearing on my feed like, half a dozen times."
acedhp,Give us more control over ads!
8mnef5,[beta] the current system is blocking pages from being archived on Wayback Machine ...
82i6re,[Beta Bug] Can't use reddit on main account after opting into redesign
7uaj7b,"[Suggestion] When hovering over a trophy on a profile, show the trophy requirements in the mouseover text"
by6kj2,"Buttons should have flex-flow ""row wrap"""
97k1tg,"""Software blocking extensions interfering with Reddit's ability to serve content"""
d290zv,So... when am I going to be able to see my followers?
bpdk7l,"[Feedback] I would like to be able to opt out of chat completely. I have never used it, never plan to use it, and the only chats I've ever gotten have been spam (which appear every few weeks or so, and I have to go through the process of clicking them away, which doesn't always work at first.)"
bgktqu,Push notifications for Trending subs that spoil film/tv
6ec6e9,[Feedback] just realised how close the user pages are to Facebook. Please do something more unique
4il6mv,Beta update (2016-05-09) - Receive notifications as emails
bqpa5b,"Reddit’s official mobile app has “live” comments, new reddit on desktop does not."
b7qv4w,upvote/downvote pie chart
7a7xx3,I will invite you to reddit chat.
9vmlb4,Forever old content?
8zfixr,[Feedback] Hate that you can't edit your comment from your comment history with the redesign
96uief,Ability for OP to pin/sticky their own comment?
7erji4,"[Feedback] Instead of location specific home pages, what Reddit needs is a filter for US specific content."
cyya5a,"In the “for you” tab, you should be able to say which subs you don’t want there."
9opu8n,The silver award is dumb
80mrwy,"[Feedback] Karma would be more helpful if it displayed total Karma, not just post Karma."
7oapq0,[Beta Bug] NSFW posts are showing in /r/all even if option to hide them is checked.
dxbj6n,Secret santa singups are open and we don't care if you dismiss that message
c302x4,"""You are doing that too much"" redundant dialogue box"
92q084,"For the sake of quality communication, can we have a draft function?"
8jdcpx,Hide all NSFW posts on Home Screen.
8iggz6,How about adding darkmode to redesign?
aaka1f,Im upvoting posts before I even know they exist...
a7142x,So here's a question: what is the point of having Reddit media?
5ttobf,More than 8 months on Reddit Beta.
8i2yfy,Your ad system on the mobile app is spamy as can be.
dkkg5q,Make it possible to zoom in on GIFs or videos
9c58v7,"Can we get a way to download an offline copy of all our saved comments, liked posts and so on??"
8jf14p,Since i've seen no progression in terms of readability/comfort; I simply customized the css myself the way i like it the best.
9k1x36,I've found a fix for the scrolling performance on Safari (macOS)
8soq95,I like the new reddit
akq6x3,"Ads make the page jump around, like house of pain."
cnhkic,[Request] Let users use LaTeX in comments and posts
9uieg9,Dark mode setting changes back to Light mode on it's own and I'm logged out with no warning.
9zyns0,How is a banned user able to post?
b7ex2w,"Blocked a user, and now can see his posts."
a9eb18,[Feedback] Turn old Reddit Gold icons into Platinum?
9jq26l,Account that I blocked keeps sending countless chat invitations.
7thcd4,"[Feedback] New profile provides me with half the content as before, with only 1/6 6th the per-comment actions, while being around TWICE as slow (3.81s vs 1.75s). Overlay can not open comments in new tab."
6ln5se,"[Feature Request] When searching for SubReddits, sort by most subscribers/readers."
am8cra,Got notified on my phone of a reply to a comment that was made with an account that's been deleted.
7p2nok,Showing subs I did not subscribe to?
4cn4tj,Welcome to r/beta!
a9pxdg,(Suggestion) Option to up vote both the cross post and original post
9kqtto,NSFW stuff blurred out even though option is correct
8ue6zk,Sub list (desktop)
7ir7bp,Pictures will occasionally be displayed under the wrong post
ap4w8h,Random subreddit button?
9racee,NSFW blur on reddit dark theme on mobile
a9jd2a,New reddit looks great!
bro1tr,An idea
9hpxsg,Been getting a lot of spam lately. Every time I report it my Messages icon stays at -1 for hours.
9219fs,Request: Delete private messages
8ue9ff,Sidebar is gone
br60hu,Get notified if a post you upvoted gets edited
cqvb6s,Sorting by random
cb3sq9,"Still seeing ""similar communities"", just got it 4 times in a row"
a38c41,I miss RES
dl6b0u,Add a button that will hide replys on a comment so you don't have to scroll through all of it.
bzntxc,Ability to keep subreddits in favorites while not joining them
bavner,Opt out of redesign does not opt out.
937der,Enough With the App
8aqcnw,[Feedback][Idea] Ability to organise our Saved items.
b9rxvg,Gotta find a way to stop repeat posts.
c87q6r,Data saving should be a feature
bensx8,Region of popular content
b5aicx,"Mobile NSFW button, swiping left and GIFs not playing"
8t9gfu,Random Subreddit
bn1u8a,Did the r//all algorithm just change?
8n32ei,"""Your chats will show up here"" keeps showing up randomly after I've closed out of it each time."
biaqan,"""Mildly similar"" : what a nice feature !!!"
7zic1z,"[Feedback] ""Welcome to reddit"" popup"
7n1mgt,Any chance there'll be a option to change the username?
czk0ln,Decrease cooldown time
bwlfeb,Reupped Reddit premium and didn't get my coin allotment.
9z5s33,"When I am on mod.reddit.com, and I type in /r/subreddit, it errors out. I forget to take out the ""mod"" part of the url often when I am acting on a modmail quickly. Can you just make it forward to the correct domain?"
54zzbj,[Beta Bug] i.redd.it gifs sometimes never load.
8dmb1d,Please save our style and sort choice per subreddit
79ovyn,Seeking participants for user research
74mykp,"Posts repeated when scrolling twice , and even three times. Anyone else?"
cty1b8,"Why do I keep getting ""notifications"" on trending items"
bab1c7,Please make it so I can see how many posts I've ever upvoted in my profile page!
9o37os,Getting posts from communities Im not subbed to in my home feed.
6l3aro,"[Feedback] Getting a reward for beta testing would likely increase the beta testers by a lot and keep the current ones happy For example, one month of gold after 6 months of beta testing would be amazing"
8fpwo4,Did you ever use reddit before the mobile client
6121zn,[Feedback] Personalized Profile Page - Good. Posting Directly to Said Page - Bad.
br1yzm,Ability to block Subs from feeds
bdgnch,soundcloud plays that come from reddit do not get counted on the actual soundcloud song
7riiqf,New profiles cause physical pain to sensitive individuals
dox9me,STOP SENDING ME REDDIT EMAILS WHEN I OPTED OUT OF THEM
90hv7i,Keep getting signed in and out of reddit
8wgvgo,There is no option to go to wiki in new reddit UI.
77k4rz,"[Feedback] I don't appreciate having my profile pic and cover photo, that I had to go out of my way to crop, and have it be taken down and replaced with this 18+ logo."
ammxjg,"Searching ""Kingdom Hearts 3"" breaks site in new theme."
8bs73w,"The icon to hide the hamburger menu sidebar should not be an ""X""."
89eltx,How do I make NSFW content unblurred by default?
awfokf,Reddit image and video is slow and laggy (i.redd.it and v.redd.it) Use Imgur for Images/Gifs and streamable for videos.
7q6osw,[Feedback]Really Not Enjoying Forced Login
cvu7nd,Official Android App Doesn't Remove Notifications After Item is Read
7rtoqs,[Feedback] New Profile is hard/impossible to read for users who are slightly vision impaired and/or dyslexic.
9lbtjx,[Beta Bug] Old Reddit Preference not being honored randomly
c6b5bx,Please improve the “Trending Now” recommendation algorithm
diptsw,"Why does the search function work on Old Reddit, but seldom works on New Reddit?"
b3nuim,It's pretty annoying that these lines and arrows don't line up why you're viewing comments
47evo2,Beta update (2016-02-24) - Media Previews removed from public beta
boz8d9,reddit desktop up-vote/down-vote link/button size
aichm9,Will i ever be able to see who is following me?
9xzqp3,Does Reddit Lose Money With Premium?
9rjgg9,"NSFW Blur: Unblur to see play button, play button triggers re-blurring"
6snh5q,Reddit Video Beta
4xdzr4,Upvoting or downvoting a submission automatically trigger the expando-button
c1fgn3,Can we do something about the spam on this sub?
bxva2v,[Feedback] I've been getting spam PMs from brand-new accounts via the chat feature.
bflyov,[Meta] Does no one here actually know what the subreddit is for?
amqdve,Messages section is broken / Losing Night Mode on each subreddit
dotudp,Why the hell am I still getting sub recommendation
ccz7xf,Make the option to choose default apps outside of Reddit for different things
9s7334,[Suggestion] Crosspost upvote
cm6hro,Not all of my crosspostable communities are showing up
7ma2di,"Since the removal of /r/spam, how do we report users NOT using the beta?"
dmas9d,Infinite scroll is an insane resource hog! Refine unload process or bring back pagination.
c00cve,Allow users to see the names of their followers.
9u2fgz,Negative comments are closed by default
82ycf1,How to close the ****ing chat?!
7aw3ag,[Feedback]Can you PLEASE make v.redd.it links open into a direct link to the image/gif/video instead of to the comments?
8gi48p,[Feedback] To frequent Promoted links
ad4yw5,What's up with the change of zooming on pictures?
8xdo31,Negative unread messages?
8a8rmz,How can I deactivate this chat-feature completely?
79a969,[Feedback] Suddenly getting ads with gold
c8m8g9,It would be nice if the desktop site consistantly brought you back to where you were in your browsing when you hit the back button to get to the front page rather than clicking the Reddit icon.
bkmaa1,Reddit feed shaking?
aqt9bs,"[Beta Bug] I've gone back and forth reporting to admins, nothing gets done. There is a vote ""protection"" system in place and it's hindering real people's votes. Say there is someone spamming a topic with tons of comments and you downvote them all, only about 3 will take effect."
9jlg5n,Can we move the upvote/downvote to the right hand side on the mobile app please?
6bycro,"For anyone who wants it, here's a quick and dirty script to modify any profile link to always go to the Overview page, effectively turning off the new Profiles."
cwg8ko,There should be an option to sort for posts lost in new.
bkbr8b,Blocking sibreddits
aqha3m,Is there any reason I'm getting random subs that I'm not subbed to on my home page
coul10,[Request] Blacklist individual people from seeing your profile and following
ad9syo,"Why does the ""Saved"" Posts in my profile redirect me to old Reddit then back again?"
a6kq11,"[Feature request] When crossposting, don't automatically fill the title field if the post is OC. Crossposters end up creating posts where the title claims it's their own OC."
6gm7a2,[Feedback] Make it so you can turn the profile off
506eve,[Beta update] - Live orangereds
c3r7om,NSFW issue
brbt25,Comment cooldown?
8by938,"Redesign: Middle-click-opening posts shows them as ""reddit: the frontpage of the internet"" until you click them"
6sgacy,[Feedback] Ok whom the fuck decided to split the notifications? What is the reasoning behind this?
abz08y,"[Beta Bug] Every time I log in, it launches Reddit in the login window instead of the full page."
d99tf5,"[Feedback] Make it easier to browse my saved posts with search, filter, and/or sorting"
7lh0l3,[Feedback]Is it possible that a comment reply can be automatically marked as read once you upvote (or down vote) it without having to go into your inbox to mark it as read?
35mzi8,Update on beta features + /r/beta
c28t36,"My app is working great, keep up the good job."
be6r28,Why we cant block users that advertising?
