post_id,title
7czxtw,"Chat does not belong on this site, profiles to not belong on this site, bios do not belong on this site, user images do not belong on this site. Facebook doesnt not belong on this fucking website."
85gsm8,Dear Reddit: Please remember why Digg went down.
92745o,Just purchased our first beta today. Poor girl looks rough but we’re hoping to bring her back to a healthy little lady. Please help answer a question for me. Thank you!
8uy56m,Feature request: Add “NSFL” tag
60q48w,[feedback] The new profile pages is exactly the reason I left other websites.
9168z9,"Downvoting an ad should tell Reddit I’m not interested in that product/site, etc and stop it showing up (ideally) as much."
8b2wk0,Admins: Please abandon everything you are doing to ruin reddit. We don't need another facebook.
9v07vy,Not letting us comments on promoted content is horrible
9ti6fj,"Again, why is Reddit so aggressive"
8vkzvg,Please stop asking me to use the app
8pkaa3,"Instead of putting more ads on pages, create more of an incentive to buy Reddit Gold."
9we2r9,"Please, add an NSFL tag."
8ac51z,Ads promoting gambling should be only viewable to people who have NSFW content enabled
8lv96l,[Feedback] please don't ever remove old.reddit.com
7mosfr,"[Feedback] As reddit grows newer posts naturally aggregate higher vote counts which means that in most cases ""Top: Year"" and ""Top: All Time"" are identical. Give us an option to pick ""Top: 2014"" or ""Top: 2009"" That way great older content isn't impossible to find."
8tghlw,The ads shouldn't be so similar to posts.
9p6xux,"No one likes the new coin system, Reddit!"
9oknja,The award system is getting way out of hand...
96g9qp,Fuck right off with automatically turning Trending notifications on.
8n400g,I don't want to fucking chat if I wanted to fucking chat I would go to a chat website!!!
8exla1,Please don't ever remove old.reddit.com
93pseb,CUT THE SHIT ON MOBILE!! EVERY DAMN CLICK DEMANDS TO USE THE APP!! This is worse than in-game purchases. Especially because it doesn’t change even if you HAVE downloaded the app.
7djkx9,[Feedback] reddit now blocked in my company due to it's new feature - chat :-/
8ocpne,Ads shouldn't be posts! They don't need comments/votes
3582su,[Feedback] This is hideous. Reminds me of buzzfeed and other click-bait sites.
cke8c9,You should be able to set 'work hours' on reddit so NSFW posts are hidden in that time frame.
97y7vw,"For the last FATHER FUCKING TIME, you’re making the mobile website worse, pushing me to stop visiting because I hate your poorly designed, decreasing visitors to your own site and discouraging users (old and new) from ever bringing you further revenue"
9ys9w4,"Ads insulting minors, new low?"
8os06g,"Is anyone else downvoting every single ""Promoted"" post that appears in your news feed, made to look just like a real post from one of your subs?"
ajep5f,"[Feedback] OPEN REDDIT APP, open reddit app, OPEN REDDIT APP, open reddit app, OPEN REDDIT APP, open reddit app, OPEN REDDIT APP, open reddit app, OPEN REDDIT APP, open reddit app, OPEN REDDIT APP, open reddit app, OPEN REDDIT APP, open reddit app, OPEN REDDIT APP, open reddit app, STOP THE SPAM!!!!"
buzz30,i think my beta is struggling and i’m considering euthanasia
987yq5,"Dear reddit. Let me block a specific """" sponsor"""" who is harassing me personally, and let me see the other crappy ads. Since reporting does absolutely nothing. Thanks."
b8plcz,This is my porn account. Stop recommending /r/bestoflegaladvice
8p9sy9,Seriously? Ads are getting ridiculous.
9fj60y,"Hey, Reddit! Now that you have chat, I can finally get camgirl spam while browsing your site! Great job."
9nbu5h,The new gold icon...looks kind of childish IMO
8fvk3t,There's no point in complaining about the redesign. We're not the audience Reddit is trying to attract. They couldn't care less.
bir67o,"Could we change the share button name to ""spreddit"", the delete post button to ""shreddit"", the upvote button to ""creddit"", and the downvote button to ""discreddit""?"
a43jy1,How can this possibly ever be allowed to be an ad? No NSFW tag and blatant nudity and advertisement for porn. (Mobile)
b82axv,NSFW And NSFL are very different things and should have different marks.
8h2chs,"[Feedback]Please stop refreshing my main page if I click a link. Some times I like to go back and read other stuff. But when my main page shuffles every time I load it, I miss out on things I wanted to check out. It's horrendous and it needs to stop!"
9cv3of,"Please... I beg of you... stop refreshing the front page when clicking/swiping back! Posts that I want to read and/or comment on are completely disappearing. It's infuriating. You are changing the built in, expected, browser behavior! Huge no-no in web app UX."
8jud44,It drives me nuts that hitting the back button refreshes the feed
9ru6qp,Reddit makes me hate the products in the promoted posts
ag0nta,"If you’re gonna push ads, at least let me comment on them"
992nck,I DON'T WANT TO USE THE APP! OH MY GOD!
btedlb,There should be a difference between sexual NSFW and discusting NSFW
9upumg,[Feedback] Stop bugging mobile users to download the app.
db3n4n,Feature request: Add “NSFL” tag
9oux74,"Since we are doing microtransactions now, can we get some opposites to Reddit Silver/Gold/Platinum to use as mega down votes?"
agu2jz,There should be a Reddit Gold free denomination that everybody gets to use once per month called Reddit Pyrite. It would make it possible for people on lower income to show enthusiasm towards certain posts and would be regarded well among the community while also not putting a dent in Reddits wallet
9qbmce,Can we fuck off with the trending notification?
8jm1j9,Let's all take a minute to appreciate this one feature of New Reddit...
8mdxx9,"Cute move regarding advertisements and Reddit Gold, admins."
dp32tf,Reddit should plant a tree for every gold or silver awarded.
bm54an,"[crosspost] Why isn’t there a separation between sexual NSFW posts and violent/gory NSFW posts. Depending on the sub, a NSFW post might just have a topless women or maybe someone who got a hand cut off."
8ne7rk,I see you're now locking PROMOTED posts by default.
a9128s,"You did it, you finally made me install an adblocker."
a1654g,[Feedback] Ads should not look like links to subreddits.
b5vsn3,Reddit is 13 years old and yet theres still no way to edit the title of a post.
89f5y1,How many people with disabilities did you have test the design before you let people try it out?
7kcn6b,"[feedback] please use Cake Day instead of ""Reddit Birthday"""
bfqsfv,Please add hide button for post or autohide option
c0hh40,Reddit video player is utter garbage
adnhc4,Stop. Sending. Me. Back. To the redesign!
cu5cup,"""Trending"" posts do not belong in my inbox. Period."
drciud,"How would you feel about a feature where if someone upvotes a crosspost, the original post is upvoted automatically?"
a7v82h,ADD /NSFL TAG
cpr1tt,[Performance] Reddit video is appaulling
8zv3t1,It would be super cool if you could mark some posts as read and only look at whats new when you reopen the app a bit lager. I hate going through stuff Ive seen already
8hlaz1,Does anyone else keep seeing the same 10 posts over and over and over.
ae803l,[Feedback] Reddit Premium is waaay overpriced.
9331iy,"""Reply"" button swapped up with ""Give gold"" button is such a terrible design."
8xfkn6,I'm still unable to talk to girls even though I've spent so long working on myself.
8v8q9a,I really liked when clicking on a post didn’t take you to a separate screen.
8ga2ch,Bring back the Random button!!!!!!!!!!!!!!!!
7nizhg,It feels horrible to come back to the front page after a few hours and find almost exactly the same posts.
azy8j5,"Can we ""Turn down the Volume"" of popular sub-reddits that drown out our smaller niche sub-reddits on our home page?"
8lo9bh,Do you want users to enable AdBlock? Because this is how you get users to enable AdBlock.
98n9qg,Upvoting a crosspost should add karma to the original post if it’s 2 different users
8f88di,Am I the only person who likes new reddit?
8cj9ls,It would be cool if there was an option to see the oldest posts in subreddits
8kue3b,STOP SORITNG BY BEST AUTOMATICALLY
7drxwt,"[Feedback] Reddit Chat needs to be optional, or gone."
9mc4vj,"My phone's OS does not support the app. Please, stop asking me to install it."
a5ufz9,Please stop suggesting I use the app
cqjm6i,There should be an option to sort by “cold” so we could see the most downvoted comments/posts
czuvd0,They need to add an undo button for when you accidentally scroll to the top
akfjil,Multiple silvers should award reddit premium
alt7tc,Sort by worst
bpklsy,An undo button for when you accidentally refresh the feed so you go back to where you were
93b16e,Please make the app stop acting like a creepy stalker who won't take no for an answer.
60v5ex,[Feedback] User Profiles takes us closer to a Facebook/Instagram environment that promotes paid endorsements & a culture that we all came here to get away from
7j3l2f,"[Feedback] Tinfoil predictions come true, Reddit now by default tracks user information both locally and from ""third parties"" to ""allow personalization of advertisements and content."" Are we okay with this?"
8s8xrl,I hate the new reddit
9atg4i,can i please have a NSFW quick toggle.
8dpd66,[Feedback] I do not play Enter the Gungeon. I do not own a copy of Enter the Gungeon. I did not click the subscribe button on r/EntertheGungeon. I do not want to be subscribed to the subreddit r/EntertheGungeon. STOP AUTOMATICALLY SUBSCRIBING ME TO R/ENTERTHEGUNGEON.
8zvxfi,stop recommending me the app
ds6uwu,I do not want to get coins. Please remove the item in the top bar telling me to.
cj1u17,Upvoting a Crosspost should upvote the original post
clsblg,"How would you feel about introducing an 'undo' function to Reddit, that takes you back to where you were, if you accidentally clicked away while scrolling?"
aytz8g,There should be a button which you can press to only view posts you have not seen in that subreddit yet.
8m1rzn,Thanks reddit for the night mode
87vvd4,Would it be at all possible to have a sort by “not yet seen”?
88ubvt,were they in a coma when Digg tried this exact same stuff?
61699z,"[Feedback] There has been an overwhelming amount of disappointment, dissatisfaction and dislike in regards to the new ""personal pages"". Reddit, we hope you're listening."
9zhwvs,Twitter removed thousands of Russian bot accounts before midterms. Facebook did the same with hundreds. Why have so few been removed on reddit? There's absolutely no way Russia just skipped us.
dhzxa7,"It’s 2019 reddit is nearly 15 years old, we should be able to download all videos on all devices and operating systems!"
a78g13,As soon as I opted in to the beta my entire family was suddenly gone
7ihsxe,"[Feedback] I am not okay with ""active in these subreddits"" being featured in Profiles!"
comrw0,"[Feedback] Knock it off with the ""Use the Reddit App"" pop-ups in mobile view."
dq1vs3,FIX THE FUCKING VIDEO PLAYER
6c2w3b,"[Feedback] ""Upload your own profile image. Image must be exactly 256x256 pixels, .PNG or .JPG format and less than 500KB."""
c0waft,Can we please have a forward button
8lbhvf,I find myself browsing reddit less with the new redesign. Anyone else notice this too?
94leaf,"Frustrated by ""Can't do that right now. Come back in 8 minutes."" I'm just trying to comment and build on the discussion. I'm not a bot, and this kills the convo. Instead of coming back I just close the app and walk away."
9xkofn,Epilepsy/migraine warning
98p686,"I have NSFW turned off, and these ads are Disgusting."
c4kxii,Allow people to change their username
35du3z,"[Feedback] Okay, I'm convinced. This looks just like clickbait to me."
7nw60m,New reddit app is UNBEARABLY slow
b947yf,Please stop inserting huge advertising banners for the redesign
ddq2ih,Reddit just emailed me...
7jyyb7,[Feedback] on A/B test of requiring a login to browse: It's unfriendly and off-putting to people who want to get a feel for the site first or aren't sure whether they like Reddit. Please don't
8yuv0z,Ads on mobile are getting out of hand
9kwfkf,"I’m incredibly confused about the necessity of Reddit’s video site. It is probably the worst streaming site I have ever visited, desktop or mobile. Either hire better programmers or dump the platform, please."
72tyo5,Today We're Testing Our Chat Beta
cvgwhr,There needs to be an option to sort by NSFW
8kon9u,So many ads!!!
crb6bb,Thanks for the flash of pussy befor the nsfw warning came up.
8upnhi,"First you give us the power to click on the background to go back, then you take it away! :O"
8u1nzd,Dark Mode's Great
8ljw4f,I don't like/want followers of my profile
97dl5h,Reddit video is horrible.
905sz3,Please do not make the entire post region clickable
d4aqvh,When someone upvotes a cross post it should also upvote the original post.
9cg5sa,"Hi Reddit! I’ve been harsh with you, and maybe there’s been enough criticism from myself and others, but it *appears* that you’re no longer trying to force the mobile app down our collective throats, so I wanted to say thanks!"
9vdxae,"I opted out, stop auto opting me back in."
b4zrna,I absolutely hate the video player
55p8jl,[Beta Bug] Thanks Reddit
aa81gu,I think the death of old Reddit is coming soon...
9iu1ax,We conducted an opt out survey on new Reddit. Here are the results.
8i2rrw,"Instead of circlejerking the old design, why don't we post constructive criticism/suggestion more often?"
c8pppt,[Feedback] What the fuck is with these ads in the middle of my feed being presented like posts?
9ingkf,I actually like new reddit
bu7o1c,Please let me sort my saved posts by subreddit!
86tbg1,"Can we *not* use ""best"" as the default sort?"
a9vyiu,IDEA: Add polls to reddit to make it more user friendly...just an idea
dck3tv,Reddit Gold is great but
8jhnqa,"""Wait ten minutes before posting"" deletes drafts forever and makes them lost forever (meaning they must be completely retyped). This was not the case before the redesign."
bysle2,[Feedback] Brand new accounts shouldn't be allowed to send chat requests
cxkzkr,"The “Don’t show posts I’ve downvoted” option I have selected should apply to promoted posts, too."
7l9i9j,"My dudes, please update the front page algorithm"
a3b2vm,PLEASE change your video player.
9h5nrh,[Feedback] The chat is useless and it just encourages spam
9jcfxv,What do you guys feel about the new Reddit Gold system?
9vg437,"Reddit Suggestion: I would like the option to ""follow"" a post."
dt34e7,New idea: Bookmark. But like an actual bookmark. Saves your spot in your feed.
99nwnn,The mobile site is unusable now.
dmoz7w,DO NOT redirect me to the New Reddit from the Old Reddit!
dhhfua,Please allow us to select and copy text on mobile.
8dxy8b,The redesign has led me to use reddit on my desktop way more often.
ah6v1l,What if Reddit changed to night mode automatically based on the hour of the day?
dmcba1,We need an NSFL tag
9m5412,"Whenever I’m in browser and it gives me the “Do you want to open this in the app” banner, if I do click on it, it takes me to the App Store and not the official app, which I already have installed."
9xb1th,If you already absolutely want to force displaying ads into my face every 5 posts at least let me block those ad accounts to not see them again
d19nsz,there should really be a way to change your username
bo4d1k,"Yo people of Reddit, Do you think its a good idea if we had polls on here?"
95gico,Every other Ad
8o8d60,New reddit is not at all responsive. What is this 2010?
cn3a8r,The mobile site has become really disgusting. Shame on you admins
9aj31m,I do not want the app.
d7bjlp,"Please remove the ""you are doing that too much. try again in 7/x minutes"" text. I was simply correcting a removed post for violating community guidelines."
9mnivi,For the love of god please move where I am in the list of shit if I accidentally swipe out of an image
470gxv,I strongly dislike the new expander system.
9of25f,I prefer seeing my accurate karma number rather than a rounded figure
9y4pd1,I have Reddit Premium until July 2020- however I am randomly receiving promoted posts and ads in the redesign.
8kjd55,Why the heck are new/low upvote posts making it to my front page?
9gn8m5,Digg lost to Reddit because of a redesign
9ey3de,Can we maybe look at why the initial page load is over 5 megabytes?
9k9s7i,[Feedback] OUT OPT MEANS OPT OUT
b6khyo,"oh hey, you're on mobile, ""open this up in the reddit app"" on each page load"
9b3u0y,Thank you for finally removing those damn download app popups
8z1r8h,so beta got me PERMAbanned from a subreddit due to rules section not showing links
8g4dyb,[Feedback] New site is ridiculously slower than the old site
9gbteb,Let me say when an ad is irrelevant
92jcju,"Does anyone else think the ""I am not a robot"" captcha test is too aggressive?"
8s05kd,Glitch on the redesign? Nothing but ads.
aop6eb,I like the redesign
9nqkw5,If I have to choose between navigating around the huge 'download the app buttons' on mobile and actually using the mobile app I'm just not going to use reddit on my mobile.
8fjepo,"[Bug] NSFW subreddits show ""There are no posts in this subreddit"" after clicking ""I am 18"""
beclka,"I usually keep my ad-blocker off for Reddit, but this.... this is too much."
d2znei,Ads Are Crap
9ftopd,Idea: Number posts so that if Reddit accidentally gets refreshed you know how far down you need to scroll to get back
7u4b9m,[Feedback]I hate the profile page and I want out of it
9ede9o,What about a search bar for saved posts?
7z4hrm,Kids can learn any language and learn it quick. What does prevent adults from unfolding this skill again ?
7aewu7,"Congratulations, Reddit now has 250,000 beta testers!"
8d5qbo,The redesign keeps telling me about the redesign
bunk6d,"Dear Reddit, please stop randomly going into light mode and blinding me"
7nff82,Is it me or the updated Reddit Apps hangs a lot?
85xlqm,Reddit home suggestions? Please no
9cq09y,Please stop notifying me of trending posts
84m4kf,Let us mute/block subreddits
dto0ct,The new upvote button doesn’t look good. Change back to the original.
95woj2,[Feedback] Stop Forcing the App on users that already have the app downloaded.
8be1v8,"I beseech you, in the bowels of Christ, give us a dark theme"
an25qb,Do not auto refresh feed please.
8e4x8f,Uhhh... why is it vibrating?
8ee730,"I get that ads need attention, but this seems like a little much"
86jzqi,[Feedback] Excessive amount of promoted posts
bjzxil,A confirmation whether you want to go back to the top of the front page.
au7b37,Why the hell do I automatically get subscribed to r/politicalhumor whenever I go anywhere near that dumpsterfire of a sub?
bbeugc,Stop spamming me with Nightmode and Infinite scrolling banners
ctpewl,[Recommendation] There was a post on r/teenagers by u/Thor44Football that said we should have a hot section for heavily downvoted posts. I think I would be fun to see.
89x3a7,Why is there so many promotoed posts?
9sydey,Stop autoplaying audio from ads
a4dzoi,Ad Algorithms - Why Doesn't Downvoting remove useless ads?
aev8ao,The ability to tag NSFW comments
9l4hw7,"Idea: If OP responds to my comment, add a microphone next to their name on my notifications."
8uf00j,Full screen posts? No thanks.
83ak4p,Advertising that moves (especially poorly) with page scrolling is a no-go for me.
akxtmz,Night mode deactivated randomly
9r1tik,"I'm about tired of the endless login loop - This bug is ancient at this point and has yet to be fixed. Yes I've read all of the duct-tape fixes for people when it occurs but that doesn't fix the root of the problem. Also, stop the mobile app spam. You're the 5th biggest website, not Target."
9eewd4,I am colorblind and I can barely see a difference between the upvote color and the unvoted color.
alq4ss,"Why 90% of the news at ""NEWS"" tab are Trump-related even if I disabled Politics and US/World?"
ab7qq6,I want to be able to sort my saved posts
83uz5s,"Can we switch 'share' and 'save' for 'edit' and 'delete', please?"
8op39o,"Using the old interface, I have 52K karma. Using the new I have 63K."
886ph9,"Please, provide a way to disable Reddit Chat forever (including hiding that Chat icon near ""preferences"")."
7xow0y,Whatever you do PLEASE DON'T remove CSS styling!
7wb855,"[Feedback] Please for the love of God learn from Snapchat and dig. Listening to criticism is good, fixing what ain't broke not so much."
aglek9,What's up with /r/all's algorithm? The same posts have been at the top of /r/all for almost a day
ayeh6o,Allow us to save in folders. Need to organize our save areas.
awjm4m,[Feedback] PLEASE get rid of trending notifications
a3ofxc,[Feedback] Not sure where else to post this but can reddit stop advertising hentai?
8c1zfd,I miss being able to see how many people view a post.
b1w0lu,Once again the reddit mobile app video player is complete garbage
ar4va7,"We should be able to sort our saved posts into different folders (videos, gif, etc)"
aclm70,Can we get a crackhead version?
947rn3,Reddit keeps posting ads. I Block the user to avoid its post. They still show up
8ddvin,It is Incredibly Easy To Accidentally Click Down-vote When Collapsing Comment Threads
8o05x2,Unsubscribed r/politics two weeks ago and now what? The News feature came out on mobile that is full of r/politics news
9zqoi6,Please let me block subreddits from appearing on my front page.
7ftp2h,Kinda important thing about the chat
35i10u,"[Feedback] Not a fan of the ""Read Next"" feature. I agree with the consensus that it seems too much like clickbait."
d4w028,Why does Reddit use more battery than YouTube?
8y2b2a,"Can you please stop changing my sort preference please. Everytime I refresh it defaults to new. I don't want new, that's why I change it."
al7fcb,It would be nice for the OP to be able to see how many downvotes and upvotes his post or comment has got
c9mjgq,Ability to set a timer mute/snooze for a subreddit's posts to avoid spoilers till you catch up with the show/movie/anime/manga/comic
7un5sp,There is now an option in your preferences to view legacy user profiles by default on desktop
4y79e8,[Beta launch] - Live Orangereds
b1ikuq,Sort only by sfw and nsfw
9x1e9h,"I have premium, yet I see ads and my home feed is full of subs I am not subscribed to-"
9wsn0o,Is there a way to filter out all posts about American politics?
7xzkq4,PLEASE DISABLE THE SIGN UP POPUP AT THE REDDIT HOME SCREEN/MOBILE SCREEN
9qi3as,Just because I unmuted a video to watch it doesn’t mean I want every fucking ad I scroll past to play.
bdp6au,How do I disable this annoying game of thrones Subreddit banner?
ctbq69,"There should be a trophy case when you click on someone’s profile that displays all of the medals they have earned including reddit silver, gold, platinum and even custom awards! (Example picture in comments)"
ae4isi,It infuriates me to no end that I cannot select text on mobile.
7t7uno,the new profile is terrible
8j9e0l,New design feels like I'm staring into the sun
afsdfs,"It's 2019, can we please have inline photos in comments? Threads like this would be so much better."
cdaqfm,Add the ability to block subs from r/popular
8gsi7s,"Chrome extension to automatically use ""old"" reddit"
8i7p0c,I don't think 7 posts from the same subreddit and user should pop up in Best.
csp6a7,"What the hell is this ""RPAN"" bullshit?"
8goli5,Endless loop on front page
bbn1a9,"[Feedback] Notifications should be made for notifying, not for advertising"
b6yclt,i swear to god if you dont change it back to subreddit snoo gets it. im not sorry. you have 24 hours.
bz3wfj,"If you downvote a user 5+ times, offer to block that user"
car9gg,We should have a random subreddit button
8l83ex,Drop down menus! Bad!
dqgm8e,"This subreddit has ended up being for everything BUT beta discussion, enforce some rules already."
8rnmff,"Comments should alternate between ""by best"" and ""by new"" so good comments don't get buried."
da8iva,[Feedback]Way too many promoted post ads are creeping into the feed
dxlwhh,[Feedback] please create an auto-hide to hide all posts I already clicked
d8tta2,Stop showing me the same post
cmovpd,Stop with the constant messages about my Reddit premium
bgxc05,Why am I getting trending notifications from subs that I am not following??
8umo68,[Feedback] The lack of the sidebar made me switch back to the old design
7qlnva,[Feedback] People are installing add-ons to avoid the new profile/overviews. We need an option in Preferences to turn them off.
9bui5v,"Is it just me or is everyone getting "" Sorry, couldn't load posts for this page"" errors on a daily basis (desktop)"
d0kdjf,A notification when something you reported gets taken down.
bd38em,r/beta posts are incessant whining and complaining instead of feedback concerning beta functionality
c93p51,"""Similar Communities"" pop-up is the 2nd most annoying thing you've ever tried."
8vscfj,"I preferred the original beta, when opening posts were Modal, rather than covering the entire page"
cca97c,You should double tap gifs to restart them
c1rfk1,How about a search feature for saved posts?
8dcufn,"[Feedback] Bring back the ""Random"" subreddit feature from the old interface"
7wxug1,Anyone else feel like /r/all is being tailored to your ‘preferences’ (ie click history)?
dkr39j,Add a sort by “seen” option
bxhwfr,Temporary throwaway accounts from a normal account.
8mrtuu,I don't want to save 20% on Dark Souls for the Nintendo Switch with Prime Twitch Omega Maximum Bundle
a8l0y3,[Feedback]Please stop sending me to New Reddit.
ceczzh,Let us hide subreddits
8s54ya,I miss the 'random' sub button.
assq47,Custom upvote buttons
dtwy2o,We can't report ads now?
8hgtrl,Make something for Big resolution and 21:9 displays
cjmevd,[Request] Bring back the custom Upvote and downvote buttons to the new reddit
bl3q9y,Can we get a Search Function that actually works?
