post_id,title
bcgdfh,Please listen to beta users
81yegu,[Feedback] Chat spam
cha8mr,"[Beta Bug] Can we please, please, please, not have the audio stream for v.redd.it videos autoplay despite us closing (or just not opening) the expando?"
8tq7co,Clicking outside of a post modal will discard your unposted comment
7iygh9,Will Reddit Gold users be able to use the new desktop site redesign before other users?
c8b5f1,[Feedback] The number of Interpost Advertisements is ridiculous!
98349x,"Dear Reddit, I'm a French dude living in Europe. Stop showing me ""Cowboylifestyle"" ads on how to recognize ""Fake Cowboys"". Thanks."
8y9io8,Why is the frontpage different between website and app?
8x5ov6,Clicking outside to close post?
7miu2t,Does somebody else has a Problem with a unstable app?
czdsqp,I would like to see an ability to pin a comment to the top of the reply feed of your post.
cw0joe,Animated profile pic
a6qx6e,"Well, I noticed a bit of an error here..."
8q3vbb,Comment entry area no longer resizable? Why?
8758xu,Why does right-clicking and middle-clicking my comments on my userpage act as though I left-clicked it?
6brg4h,[Feedback] Let those who dislike the new profiles change back.
cjwlqo,[REQUEST] Introduce to desktop version the arrow which lets you go from comment to comment on mobile version
bo1hfx,I know this is said a lot but can we please change settings and go into quarantined subs on the app
99ducm,Whenever I click on a “#X of replies” it just disappears and I can’t read the replies.
djc39n,My user flair keeps being set to default text
a1hi3k,I have been charged for Reddit Premium and not received my monthly coins. Anyone experience something similar?
amefnl,Some post elements are moving/shaking/wobbly when scrolling down
8hxpmj,I liked it more when you could see right away how many new massages you've got.
85b4el,"[Feedback] Okay, I really tried, but this is just a big downgrade from the current static version."
7rftlp,"[Feedback] Hiding the Saved, etc. links behind a menu is a pointless and frustrating change"
7cg28n,Please make it so that crossposting doesnt requure a title.
7lr5xb,Can’t browse while playing music. Gifs stop the music
b6jsr2,[BUG] NSFW warning popping up on nearly every subreddit I view on mobile
b3vgw8,Just using the site like a normal procrastinator and get randomly logged out.
7i3fmb,How can I get rid of that stupid chat icon next to my inbox?
dvrg4d,Cannot see what I type in any reply on mobile. Is there a QA team at Reddit?
as0fbw,Is there a way for text to populate when you type r/nameofsub?
9yhqsz,Add a Reminder feature!
aiz967,Trending
9a9fb2,"Page refresh, after page load, when using back button? Please stop. Terrible user experience. (Safari, iPad)"
94lk37,A low bandwidth mode would be really useful for situations like what's happening in Bangladesh right now.
88j48m,"NSFW post blurred in multi, even though ""Hide"" is not checked"
86ksfo,can we get a dark mode?
a4mwao,My preferences keep getting changed.
8rrxl0,Many posts aren't inline expandable now? Twitter and Imgur
74x6mp,"Do we have a beta date for the new ""Reddit4"" Design?"
3jj94a,Beta update (9/3) - color-coded modmail
cben0o,"When switching from full-screen mode (swipe right for next post) to the card view (swipe down for next), why do the cards still show the top posts instead of syncing to the post you were at when in fullscreen mode?"
764km5,"Is there a way to unsubscribe from a user if they delete or change their profile name? I just keep getting a “Sorry, can’t reach Reddit” error with no options to change subscription."
36k0u3,Beta update (5/19): New search page
dgeyqn,Viewing Image Switched to Corrupt Reddit Page
90mcck,"Received an email about Reddit ads, and in the footer, the email displayed isn't mine"
bt51k6,Could you make karma visible like in the old design?
9ix5dz,Does anyone dislike the new gold icon?
96yobe,I disable NSFW posts but something(not me) enables them every few days. What gives?
8nw6rx,[Feedback] Please don't make the chat icon the same general color/shape/location as my inbox message. It's just confusing.
8nqwqr,Mixed (http/https) content on homepage
cgnxpu,[Feedback] Reddit must implement the simple measures needed to prevent bots & others from verbatim stealing user created content.
9ess5s,[Feedback] We really need to be able to report spam chats
8qitem,[Feedback] The new comment view is not really usable with touch screens
6ifuy5,[Update] Bug fixes and updates to the Profiles Beta
deqm9i,"What happened to ""Rising?"""
9yddkv,Why can't you see who follows you?
99w6y1,Chat button deceives me
95d3ka,Why are links almost indistinguishable from regular next in the new design?
8ayuwq,Suggestion - Add a comment OP.
bce20g,Problems with infinite scroll
adgjx8,Why can’t I block this one ad spammer???
7uy295,[Feedback] Apparently user epiris has helped pay for 0 hours of server time in the new profile system.
bjumkz,"Marking ""do not send comment replies to inbox,"" still getting replies in inbox."
9jwe52,Really sluggish performance / high CPU usage Safari MacOS
8g22ow,Subreddit Chat Rooms (Beta) Has Been Released to Select Communities
7y7edf,"[Feedback] Don't remove comments posted under deleted posts from the ""overview"" profile page"
7tmeyg,"/r/Beta mods, please sticky a ""How do I disable beta user profiles"" megathread"
6e7zvj,"[Feedback] The new ""You're Active in These Communities"" gives a distorted view of an user's real activity"
3icqnp,Beta update (8/25) - What's going on with the beta program?
a31gfb,Delete direct chat and messages
86dg04,Not a fan of this new site-wide font
d5hknz,Mystery subscriptions
7vwbcs,"[Feedback] There should be a private and a public profile, with the private profile curating the public profile"
7qemhe,[Feedback] What does the new social media overview actually do for users? It makes no sense in the context of user usability. Now if I want to check how a post is doing I get to make 4 clicks instead of 1.
35781e,[Bug] Toggle Userbar - Name is clipping on left side
c2302c,Reddit app just constantly loads and only works sometimes.
bg1h1v,There should be a way to check who is following you.
ax0t8c,Grey out the subreddit name on posts you've read
anetbg,flipping back and forth between old and new Reddit
8r70fh,[Beta Bug] Old.reddit Keeps asking me to sign in on every page
6dbnqr,"[Reminder] If you don't like the new profiles, you can effectively disable it globally by using the TamperMonkey script I made."
bi2aw9,BUG: You can see the amount of subscribers for r/lounge!
8cq041,Please change things so i can open them in a separate windows
b20uyb,Reddit Statistics change since implementing the redesign
a9x5yl,"I'm sure it's been said, but the new gilding system is whack."
de8cib,"Has anyone else seen a 'poll' option when posting, only for it to disappear a second later?"
c5r5y9,Sort by locked posts in subreddits
at3d41,Opening a reply through a browser notification should mark the according inbox message as read
abivsw,"When crossposting to a community, it would be great to either have a search bar up top or alphabet on the right hand margin to quickly find the subreddit you are looking for."
9ypj9s,[Feedback] I swear Reddit is trying to condition us with New Reddit by making it pop-up every 5 seconds
8wvwpb,Some thoughts on the new reddit design.
6zaxr2,Reddit Testing Out Location Based Front Page Where The Content Is Tailored to Your Area
3covvu,"[Feedback] In subreddit searches, make the subreddit name searchable"
dbq558,Big please about the fresh new view on pc
7jw57r,Encountered an account signup modal with no method to exit
704gl3,"[Profiles Update] Overview page, bug fixes, and other updates to the Profiles Beta"
dfaqfn,[Beta Bug] Reddit has the wrong date
8gz4zc,"Reddit, maybe you could address some of the things people are complaining about?"
7yjo8v,Can we send pictures in chat?
60sdgf,"[Feedback] These ""User profile"" pages are horrid."
60quo5,"[New user page] I along with a large number of users, think this is a terrible idea"
duuxhn,"Please consistently be in markdown when I have selected ""Default to Markdown"""
ceozlz,[Feedback] Will there ever be a feature where top mods can manually determine mod seniority rather than being stuck with time as a mod only?
95slfd,"[Beta Bug] I get logged out repeatedly. Clicking Log In ""Confirms"" that I am logged in but does nothing and keeps me logged out."
7ghekv,Pornography on profiles?
6to4ze,[Feedback] [Usersub Idea] It would be cool if we could sticky posts we've made in other subs to the top of our own profiles/usersubs.
aysfes,"Definitely do not like ""trending posts"" being a browser notification. Any way to disable?"
8wa6od,"Easier access to ""Safe browsing mode'"
8f30h0,"I just somehow accidentally got stuck on ""new reddit"". Good lord it is terrible."
7d2aam,[Feedback] I don't like anything the beta offers. Please abandon the entire project before reddit is ruined.
6bqemt,Try the new profiles page yourselves and tell us what you think
cbwb4d,"Unable to load new reddit, old works just fine"
b46tao,[Feedback] The popular page weighting posts from subreddits that I'm subscribed to is very annoying.
dcua4n,Join a sub? Now your whole feed is focused on that sub's post.
avohi1,There is genuinely nothing I hate more than the DM system
9sbo69,Opt-Out of redesign ignored
98hvqu,[Feedback] Can we please get this telemetry/tracking shit disabled completely? It essentially puts two entries for every page I visit in my browser history
8gt0ln,Reddit Beta's take on the Hamburger menu icon is cute but very bad for usability
7n8gis,[Feedback] Text post only (low data) mode
7fgojd,[Feedback] The new profiles are hard to read and makes exploring my comment history a pain. How do I revert back to the old design?
5miy00,"Spoiler tags have been in beta for 2 months now, any closer to a release?"
98vmt1,[Feedback] Can the color of the new chat logo be changed from orangered because everytime I see it I think I have a message.
c40xhk,Bookmarks/Categories for Saved items
bh98ft,[Feedback] Forcing people into new design
acyk2o,(Mobile) Suggestion: put an icon when a video is from an external site
7s70ss,[Beta Bug] Whole list of chat bugs and feature requests
dtneyx,The latest Android update broke scrolling when writing a post or reply.
byjqkl,"Posts take ages to load on the app and sometimes require rebooting to ever load, and it constantly crashes. Reddit is becoming unusable"
8alc46,"Love/hate ""best"" on front page"
829xfv,Given enough votes can the posts made directly to a user profile reach the Front Page of /r/popular or /r/all
7v6weh,How may I enable a dark / night mode in the new alpha
7q19yz,"/r/Beta mods, please sticky a ""How do I disable beta user profiles"" megathread"
90qi75,A Thing I like in the redesign.
6fkryt,[Feedback] Stupid yet entertaining things I've discovered about the new profiles.
3w9tkt,Beta update (12/10) - Report menu update + some rules for r/beta
c890d0,"[Feedback] So not only has old Reddit had mid-page ads added to make it more ""similar"" to new Reddit (despite the whole point of old Reddit being to, you know, not change over to new Reddit), Reddit is perfectly fine with advertisers presenting anti-science medicine."
bj9z6w,"[Feedback] look, i got that the new theme exists....but please stop trying to force it changing as the default one auto every week or so"
dqxihe,App force closes
9k9c0m,Why does reddit not tell if you’re banned?
8ff7w5,[Bug] Banned subreddit is shown in the sidebar and it's impossible to remove it
83q773,[Feedback] Chat doesn't give me the reason someone wants to chat with me. Why would I ever accept?
78r5ar,"[Profiles] ""Active in these communities"" is no longer based on the karma breakdown."
6e0hei,[Feedback] Allow us to remove Profile Pictures once set!
dfok81,Add Mute Words.
dat3y1,Is it a way to disable stupid popup behavior while opening a post?
c45nyf,“Delete comment” is too easy to misclick!
9w8ygj,Allow users to default to Hot
61b591,[Beta Bug] You have -5 new messages
8zlyw5,"For the new Reddit, why change the Best/New/Rising etc. function into a drop-down?"
7utruy,[Suggestion] Ability to delete chat threads
dce62l,Warning when visiting reddit from Vivaldi browser
a238sd,[Beta Bug] Many posts that contain video are only showing a photo. Even after several minutes video loads.
8hapqn,Visibility of OP(Original Poster) and Moderators in comments
73ar1y,[Feedback]I think it's BS I can't put my snoovatar as my profile pic.
6w1vzd,[Feedback] New frontpage makes no sense
c2h7qk,The mobile app won't show the same content as the PC version
aunvks,The Desktop reporting screen fudges up constantly!
8snkqs,[Feedback]Reddit forcing redesign on me
7zu60y,[Beta Bug] Thumbnails still not displaying on NSFW profiles
6brkoa,[Profiles] It is horrific
60qkx4,[Feedback] Not really liking the new profile
bwb3hk,Page elements bouncing slightly on Firefox
b3217i,"When sending links through chat, by pasting the link on the latest (topmost) chatter and pressing enter results in said link getting delivered to the just below chatter (penultimate). This is really risky. Please see to it that it is fixed."
a0xso2,Your Session Expired (When trying to log in)
8nsrkn,For a week you could delete your comments from the 'Overview' tab in your profile. Then that functionality disappeared. Can we have it back please?
8e3uqf,Redesigned reddit.com don't show some imgur media preview on post
80wtn8,Spam option needed when reporting user through chat
79wrn0,[Beta Bug] v.redd.it STILL not respecting profile preferences
dn2k2d,Reddit rotates images automatically
bnof7p,"[Feedback] not sure what you did, but system keeps logging me off."
abklf8,Allow us to set subreddit pages to default to new
90eita,"Sometimes you want to subscribe to comments notifications for a post of another user, and there's no way to do that :("
djstfc,Videos won't download with sound when saved?
cf0m3i,[Feedback] the app should state why a pending post fails to post
b29fix,Why does it not allow me to comment if I comment a certain amount of times?
axg105,Why am I getting posts on my home page from default subs?
ax6u4k,Strange soundbite when exiting some threads
81ajjz,"[Feedback] The current frontpage takes about 5 seconds to load the post names, from pressing enter in the URL bar. The new alpha Reddit takes about 9-10 seconds."
75xwu8,Videos not playing from v.reddit
dsu0kb,"Can we decide on a single ""create post"" button on the front page?"
dd6hlq,Notifications.
a124a4,"""Opt out of redesign"" does not opt out of redesign."
dvcz9n,Getting spammed with opt in messages
da4qfk,Suggestion Post: The popular page should not include the same news from two different subreddits
af3sj8,Search Engine
8r4xup,Where is 'crosspost' and 'parent comment' on the redesign?
dw7frl,Community Reminders Notifications on direct messages
d7sg4s,Crashing after switching account
clkjr6,Reddit Premium Shows Two Different Prices
cfzk4r,[Feedback] Preference so that the entire post 'card' is no longer a click target that opens the post?
8w0uzc,[ESC] to close post exits Safari full-screen mode on Mac
6j3fdg,I really don't like the new profile. Is there any way to change it to the original ?
84f96f,[Feedback] Delete Message/Chat
7wnmc9,Nowhere to click to see actual image of post...
7iu2yf,[Feedback] can we please not have the following other people option on this website?
6i9mex,New Feature On The Profiles
dp128g,Allow subreddits to be deleted.
bhik1g,Hide button
8f3lqu,Having to horizontally scroll to read a comment sucks
866zj1,[Feedback] In light of Facebook getting in to hot water over personal data and people standing up for privacy will you guys be willing to walk back any of the upcoming changes?
dld5ct,block subreddits
bvlbun,"Clicking on ""Get New Reddit"" doesn't take me back to new Reddit."
bkm9aj,[Feedback] the abuse reporting forms have no way to report an entire subreddit that is a ban evasion of a banned subreddit
b0plq8,"Can ""Continue this thread->"" continue in new tab or be an user option option?"
alu8s4,Nightmode Turning Off Again (But Much Worse)
abh3bl,Setting to mute or snooze selected subreddits
94vuz3,Generally I like the new Reddit. Do I need RES?
36opsa,[Feedback]The new Search Results are unusable.
9731n6,"Gold will become ""Reddit Premium"""
8xapxm,The Random Button
7f0swd,"[Feedback] ""Recommended"" posts showing up in my home feed."
aw7n5j,Ability to search comments inside a post?
a84lz6,How many times must I tell you I don't want to use the app?
9y6rha,Can you just put in a button to collapse all posts to only parent comments without the child comments?
8pzosm,"""Opt into beta tests"" can't be turned on or off..."
879s0g,How do I get the chat noti to go away?
cc6rkc,Improve the community theme while using Night Mode
8my5tn,Why can't all imgur images be expanded?
7bpd1y,New update to the user profiles
dfjgcs,[Bug] Message symbol shows new messages after I have just read them and go to homepage using reddit symbol.
cnpqjg,"Where is the ""Other Discussions"" tab that was on old reddit? If it is gone then it should be added back to new reddit."
a4v9gs,New Reddit user pop-up box with Follow Button not following user when clicked
8f1546,The new reddit transfers 20 times more data than the old one.
8epyuq,[Feedback] I do not like the redesign at all.
6rtpbo,"[Feedback] Profile view should not default to ""Posts"". It should either show a blend of any recently-submitted content or just comments."
bne9i0,Clicked on my Username > User Settings > Profile Tab. Not loading.
8gmk5o,My opinion on the Redesign
bvhmru,"Sometimes for me, the app crashes when I upload a photo or video."
8il083,When i click on a post it opens up a post from a completely different subreddit
8i273e,"Auto-subbing to /r/beta makes sense for beta users, but it's the most toxic sub ever"
7wj0lj,What is with the st= and sh= bullshit that the iOS reddit app appends to any article URL I try to share?
70p6qn,"[Feedback] Long comments which you are replying to should have a ""read more"" button after a certain amount of characters."
b6b4nl,Turn off browser notifications for trending.
apfiam,[Not a bug] The state of sub-reddit banner and icons
a7o00o,Hidden NSFW still bugged?
8lm6zt,"[Feedback]I don't ever want the ""Chat"" popup to come back. I've closed it twice now. How do I keep that from ever showing up again?"
8esxi9,Do not Digg it.
5e0wun,[Feedback] Love the spoiler tag!
d8ndvl,Why can I only save videos and gifs sometimes?
9g32lh,Instant new post notifications for subreddits
8imla8,No padding on Image posts
843uyr,In the new design how do I remove a banned subreddit from the list on the left-hand side?
771yft,How do I see how many redditors are viewing my profile page?
6kiec8,[Beta Bug] Tried to sign up for the new profile page with an alt. It applied it to this account.... which I was logged out of.
drvhx3,Does reddit iOS have a TestFlight version or something?
bmpcsk,I'm not receiving notifications.
bbcgv0,"[discussion) When is the ""new Reddit"" estimated on being done and being set as the official layout?"
a6gndl,[Feedback] I should be able to report direct chat requests that are spam to Reddit from the chat window
8ueg4z,What happened to the black section on the side of posts
8ftyi9,The Reddit Desktop Website Redesign is Atrocious.
8a6lbc,"When I hoover on someone's name and click message, it creates a reddit window, inside a reddit window."
89bjpp,I miss the permalink shortcut
b2m36h,Limit on sub post
9u7yx0,[Feedback] Why do I get notifications for subs I'm not even subscribed to?
9lp3vq,So tired of getting my comments and posts deleted when opening the app through a notifcation
8ml4qk,"Bug Search breaks when searching for percentages, 50% etc"
7wrhu7,"How am I supposed to +friend someone on the new and """"""""""improved"""""""""" user page?"
7pa51d,[Feedback] The new profiles should allow you to decide what the default view is.
79kpew,Anyone else having troubles with their feed stopping loading suddenly?
3hh2k1,[Feedback] The green lab flask annoys the hell out of me
arkqlv,Can't see links or replies on app
ar033w,[Bug]If I subscribe to a subreddit it will overtake my frontpage.
5f20j8,[Feedback] I Love the Pop-up Notifications!
d0x3rv,Can't opt out of re-design
b7nbqi,Let me post a picture and also a caption or explanatory text
afl1at,Not Sure if Belongs Here
7bzz27,[Feedback] Chat is great. Subreddit chat?
7bdfxw,[Feedback] You should be able to shorthand link subreddits in the new Chat.
35ad7h,"[Feedback] I don't like the ""Read Next"" feature"
bm1nk8,How can they keep making the reddit app on mobile worse?
91ihab,"IDEA: sort saved posts in groups created by the user. Examples: food, places, diy..."
7hu4z0,[Feedback] [Feature?] Not sure if this is a bug... different snoo icons accessible via URL
6ogj1g,"[Bug] Almost everytime i click on my username it, pops up a page that says ""oops you broke Reddit"""
6mpgjp,Trending Notifications
360jbf,[Feedback] Read Next shouldn't suggest a link the user posted.
c5zf8t,[Annoying] Every time you open a post a 'Similar communietes' box appears
9tvuq6,[Feedback]option to change placement of upvote on mobile
9pprbb,Recent Post Box Bug
9e4mpe,"[Beta Bug] I'm unable to login to ""new"" reddit"
7h1id3,Upvote/Downvote/Share bar is hidden until a vote on a comment
745m32,Are we still beta testing the desktop version of Reddit
6xwdk5,[Feedback] You're active in these communities
6qx03k,[Beta Bug] Upvote-Downvote Number is not vertically aligned
4xb1kk,Beta testing features without being opted in
csgmdg,"Found a bug, I guess."
ay16i0,Getting logged out while opted out of redesign
acjd3f,Unsubscribe button is not visible when using the dark theme on Android.
95nj1d,Why are there two search options constantly in the Reddit app?
80t783,Collapsing Threads on Mobile
804uq9,[Beta Bug] When shrinking down a comment thread you cannot open it back up on Chrome (not mobile)
7gexno,The username popup thing still doesn't have a preference to disable it.
6cn4en,[Feedback] Let me search my profile like I would search a subreddit.
52gvk3,[Feedback] The browser notifications is working well.
7zyno0,[Feature Request] Send a thread to my phone
dy3imi,a way to look at the subs oldest to newest
asazuq,Is there a way for pages to actually load?
7vrshc,[Beta Bug]You have -2 new messages
7pgwga,"[Beta Bug] I'm opted-out of betas, but still got forced to the abhorrent beta profile."
6t1ew4,[Feedback]Reddit Video player auto-plays in comments
d2r9rq,Deleting messages and chats
ccobp0,Tap comment to bold - and any of that users replies.
cbqa92,Let us disabled Direct Spam
atifu1,Post over a year old keeps showing up in recently viewed.
8za7gn,Turn off autoupvote.
6c0szg,"[Feedback] All I really want is a profile picture and maybe a banner, but not a ""profile"""
8cec88,Comment preferences not being followed in the redesign
7gpwey,Increasing Access to the Reddit Chat Beta
crsmxf,I'm sorry. I know this doesn't qualify but I don't know where else to ask. Where can one post regular reddit feautre requests?
c598v8,Search only my subs
arcrpi,Bug: Not able to edit my Profile in User Settings?
9g78r5,"If I'm already clicking off onto another page, don't make me do it several times please."
8x2ncw,[Feedback] My keyboard shortcuts for cvim are being swallowed by reddit.
azoh91,Firefox notifications
8w0krf,"When people link to other subs in comments, it could be cool to have those posts redirected to the subs."
bf5myz,Opt out of new content replacing content already viewed.
a9ni48,"[BUG] There is no ""unblock this user"" option"
85slhb,"Feature suggestion, remember view setting for each subreddit"
d55t0m,What just happened?
bexl4y,Recommended for you...
aohelh,My reddit occasionally crashes when I open it. It can sometimes take 2 it three attempts
9j4rhh,"New personal message icon is orange, but I get ""there doesn't seem to be anything here"" after clicking it"
9b0ng3,So reddit has a new iOS icon...
8f3fgy,Links should not be the same color as other text on the page.
6gdh90,"[Feedback] What's the point of the ""More Options"" button on the new beta profiles if the only option is ""Send a Private Message"" ?"
dolrp0,Mobile bottom tile position should be customizable
c2tpxy,I can’t change my profile picture?
a7qfgn,Cropping when adding an image would be so helpful.
8989lw,[Redesign] Comment Collapse should be more noticeable
88ipe6,There's just not enough space for content in the new design.
9ja6yc,Infinite buffer on videos mobile app
8ekqvg,[Beta Bug] Chat shows 16 unread messages. Don't see any unread messages.
8duxkm,It's annoying having to scroll up every time you open a new thread just to see what the poster wrote.
81q2d9,Post button for dark theme.
7r8mp4,"/r/Beta mods, please sticky a ""How do I disable beta user profiles"" megathread"
790seu,[Profiles] Text is waaaaaay too light on new profiles
52xbqr,"[Feedback]comments threads interrupted by ""more from /r/(subreddit)"""
36r9bf,"[Feedback]A spell check for subreddit names, if possible"
