post_id,title
cqxmdm,"Roses are red, don’t be a goof"
85ir8f,"Roses are red, my name is Keith"
ctdxlt,"Roses are red, no one can debate it"
can96m,"Roses are red, buckets of piss,"
9vbbqd,"Roses are red, my life is in disarray"
9h4y4x,"Don't call it a ""trunk"", you American pig,"
7nbnj4,"Roses are red, Obama is well spoken"
az5f2b,"Don’t summon satan, god will be furious"
8r2iil,"Roses are red, my brain is full of knowledge"
8jqppi,"Roses are red, the moon is a crescent"
dqz3gh,Made with notes
b61t58,"i like to smoke kush, pretty much everyday."
d8exp7,"Roses are red, no need to shout"
8z4ypm,"Roses are red, geniuses glisten. We all know"
acug32,"Roses are good, violets are better, but this fucking book is the..."
c0c0xi,"Roses are red, love is not a sin"
9wghpq,"Cats like to meow, Dogs wag their tail,"
8t9non,"At this rate I’m failing, I won’t go to college"
depmb7,"Roses are red, my computer brand is dell,"
as39iq,"Roses are red, vacuums suck"
97qili,"Roses are red, and just as you promised"
8m2yi6,"There's blood on the sheets, I must change my bedding"
a0924i,"Roses are red, I want a pet sloth,"
akbfsm,"Roses are red, I think I might buy it"
albxt1,"Roses are red, alert next of kin,"
dt07zk,"Roses Are Red, Carrots Help You See"
dg5osv,"My philosophy; to be or not to be,"
a5j2i1,"Roses are red, apple pie is a confection"
a818rv,Soymilk is known as Silk
97idhb,"Roses are red, can you lend a hand? I just need to know"
b3h4ni,"Stop right there, you've violated the law! Prepare to die because..."
d0em12,"I like minced beef, sometimes I eat Quorn"
d2ooz5,"This post is meaningless, without a doubt"
bhdze7,"Don't try to hide, there's nothing to fear"
9zedt3,"When I feel lonely, I look up at the stars"
afitbi,"Roses are red, The Hooked Captain abuses Smee"
9pm4sm,Roses are Red Sugar is Sweet
9q3wc8,"""This bitch empty"", Terry goes ""YEET!"","
6vr0i7,"Roses are red, puppies are Snuggly"
7qrv22,"Roses are red, I drive in a car"
cf2307,"She threw my rose away, I’m having bad luck"
c1m1cd,"Roses are red, a bouquet of flowers,"
9o7ro8,"Roses are red, count to ten,"
bw9mwh,"Roses are red , I feel like the man"
9elqn6,roses are red this subs full of zingers
9xmj4s,"Here comes the sun devil, you better start praying,"
c7r5p5,"One two, seven three"
axbv32,"Roses are red, I must spread my seed,"
7l4g65,"Roses are red, I got shit on my shoe"
bbylp9,"I’m so hungry, but I’m really broke dude"
8he2ff,"Roses are red, Violets will lie, you know what they say"
axyo4z,"he was annoying, truth be told..."
9rbjc1,"The floor is all muddied, this professor is a sham"
c530qn,I hate it when my classmates think they're tough.
c1d5xs,"No, I swear, this isn't fake"
815eal,"Roses are red, my shit is a brick"
cu0boj,Caught one in the wild
bc753z,"The text is relatable, the image is art,"
9fqfhm,"Roses are red, Oxen have tongues,"
9uvsx4,As a foreigner I don’t care who won
9szv9k,"Sky is blue, dogs make catches"
8ajtag,"When the violets are blue and the roses are too, that's amore"
bdedj5,"Roses are red, from an acorn grows a tree"
9bho1y,"Roses are red, like my eyes after two joints"
ahps8n,"We love our puppers, they play all fall,"
bwhjfn,"This is great news, an absolute win"
8rj1j4,"Teens go to prom, Birds migrate down south"
6etwll,"Roses are red, Violets are frightening,"
9xrx82,"Roses are red, I bought crocs on a whim"
aew1dg,"roses are red, salad is tossed,"
7abhvq,"Violets are blue,roses are red"
9l5q7k,"Roses are red, I am quite dim,"
a7wj44,"I’m at the junction, it’s not very sublime"
ag7ari,"Perfectly balanced, as all things now are"
cc3t5g,"Roses are red, unlike Rick Ross"
dsokv2,"I have a small car, you're about to get hit"
av9w3j,"He stalks his prey, he aims and shoots..."
9jzjpt,"Rose's are red, His name is Peppy, He run so fast because,"
dvwkln,"I am worst! Although we all see examples of treason, we’re out of luck."
d7gpj0,"Roses are red, I stubbed my toe..."
8clh1x,"Roses are red, she’s kind of a rat"
dlflwg,"Roses are red, light shines through a prism"
7vvq9v,"Roses are red, today’s a new day"
7ow3v7,A wild boottoobig
747efa,"Roses are red, I need to clean my dentures,"
9sl2cz,"The flu goes around, cars go zoom."
860m7g,"Roses are red, I'm new redditor"
8hia6j,"Roses are red, Windows are glass,"
9j3x0m,"Pornhub is great, but it’s a toxic community"
708mwl,"Roses are red, Euler's a hero"
a4l4s1,Sneaky
cjngai,"Roses are red, I’m an american,"
cv7gtx,"Roses are red, I have a happy demeanor"
bboaah,"In chat we stay, there are no lies. You know what to do..."
7qcxm1,"Roses are red, I’m too hot to handle"
a061xe,"Roses are red, I want my own wombat"
ax9bof,"My name is Tim, I throw trash in the bin"
dmxj1q,"Rain Drop, Drop Top, Hop-Frog,"
7elh6y,"Roses are red, Donald Trump is fat"
dbyhi8,"Haloween sucks, the whole day is a bore"
9q9y3n,"Roses are red, beware the Brits"
agez5e,"Roses are red, lying is treason"
cynfv4,"Dogs are damn cute, I want some more"
9955if,"Roses are red, I don't want to fight"
a57hqa,"Roses are red, and green is the grass"
af7uam,"Roses are red,"
ayksq4,"Roses are red, my name isn’t Kevin"
7airxx,"Roses are red, bananas are wonky"
cwz33n,"Roses are red, rap is crap"
apu46q,I draw my sword from its leather sheath.
cbqe7y,"The proof is in the pudding, they’ve said it all along."
9woirn,"It can't be that bad, anon, don't just assume..."
9xw0y6,"Roses are red, garbage is rotten"
by84jz,"Roses are red, spring comes before fall"
8mo1ln,"Superman wears a cape, Gandalf has a staff"
b6tkxk,"I walk into school, people are talking"
ae77zw,"Roses are red, jesus needs no guns"
cpd3os,"I'm rubber, you're glue"
7zfa8o,"Roses are red, Keep your nuts in a jar-"
83z6w1,"Roses are red, murder is wrong"
axjyxe,"Roses are red, I’m fucking grinning,"
9jqoj5,"Roses are red, moths deserve rights"
atndfo,"Roses are red, this card is shit"
cs1nv7,"Roses are red, I love chicken breast"
901jec,"Woses are wed, waifu's depwived"
czeog8,"I went to the mall, someone sprayed me with mace"
9ewpj0,"Roses are red, the zoo has elephants,"
c8026c,Roses are red
bd0qbs,"Roses are red, Whatever will be will be"
acbaej,"Roses are red, shit's about to get hectic"
c9addj,"Roses are red, don’t make a peep"
8bozhi,"Roses are red, humans are quite fond"
92534l,"Don’t give me sass, I drew this proudly"
d4c1te,"Roses are red, I was in quite the tizzy"
8shyd2,"We all go to school, and see the new craze,"
7m59np,"Roses are red, Carrie Fisher is dope"
9p75cv,"Roses are red, fidgets spinners were a fad,"
da26ji,"Send me a text, I got no time for callers"
9e0d5z,"Roses are red, summer is gone,"
a51jpo,"Roses are red, I dont want to go to hell"
9ci99b,"Roses are red, this picture is odd"
792qkj,"roses are red,our love is sacred"
cmo5ft,"Hot sun, heat rash..."
czln1g,"I'm getting old, not receiving my pension"
cvj39n,"Roses are red, I hate my ex,"
a7luto,"Some people have money, some people have class,"
ao2fnw,"When I jump on the bed, the bed keeps on rocking"
a5swuq,"roses are red, today i give up, look at this, and..."
7vk48t,"Roses are red, a swimmer can dive,"
b1hmbl,"I am your dad, my name is Darth Vader"
8o9cjf,"Roses are red, Violets are blue"
cqfd0o,"I stalked my prey, arrow in my quiver"
b8gjh6,"Roses are red, I'm ready to mingle"
6pvxtl,"Roses are red, I have a sword,"
atublm,"Roses are red, My favourite flavour is lemon and lime"
c3dycz,"Roses are red, their relationship will have no end,"
7xp6pq,"Roses are red, strawberries are fruit"
anpxso,"When I entered the room, I heard nobody talking"
9sxqeu,me_irl
7bqzkq,"Roses are red, my cup has a lid,"
c6631g,"Roses are red, my sleep was pristine..."
95aewf,Roses are red…
bi13ef,"Roses are red, earth looks like a face,"
7zvy9q,It's gonna take a lot to drag me awaaaay from yoooou
b1kwg6,"Roses are red, stuff in a can,"
cna0ob,"Roses are red, nukes are the bomb,"
84ds71,"roses are red, i hear dead people's voices"
bebcep,"This is a stick-up, reach for the sky,"
7p7j90,"Roses are red, the Jedi are wise,"
8up74z,"Hyrule is doomed, makes me sick to my belly"
aihnen,My girlfriend broke up with me and nobody cares
b7j0n8,"With doggos like this, it wouldn't be hard to go on dates"
8tjm0i,"roses are red, i am allergic to crab"
br19dv,"Roses are red, Teachers Like Stapling,"
7j1qrr,"Roses Are Red, Elf Practice Is Unavoidable"
934gfs,"Roses are red, the book was returned,"
8kcefd,"Roses are red, my stomach is full"
6w9ngq,"Here is the church, here is the steeple,"
7e88r0,"Roses are red, I want to cry"
bnvf99,"Roses are red, I’m in the zone"
a7gvp3,"Roses are red, I ate sashimi,"
9lxna6,"Happy holidays, season’s greetings!"
9dm74h,roses are red I believe in repentance
7t7c13,"Roses are red, the Bible is real"
a56aco,"Roses are red, I like poems with rhyme"
dwn86w,"Now it’s time to sing my song, but everybody’s depravity won’t save me."
a8piwz,"Roses are red, I've accepted my fate,"
aby5d1,"Sandra Bullock is great, Birdbox was lit. People of Twitter,"
bcdqf0,"Roses are red, Stalin, to your power I bow"
8ejv43,"there’s no context, but here’s a treat"
cp1c16,"Roses are red, I'm a big deal"
8fzhxq,Mods are asleep upvote bigger boot
bkdznl,"Roses are red, I’m going through a relapse,"
83oiai,Roses are red and received from an elf
8z0fao,"Roses are red, I only take cash"
73jwnl,"Roses are red, leaves are green"
colzq8,"Roses are pretty tight, some kids are bright,"
9l00ex,"Roses are red, I’m doing fine"
bn3bcw,"Roses are red, I own mismatched socks,"
d3ub6n,"Roses are red, I buy clothes in a shop"
9r2n8l,"Roses are flowers, porn is also called smut."
ay6kit,"The sun is bright, the ocean is deep"
7dsa77,"Roses are red, violets are blue"
cyy83e,"Roses are red, don’t give me no sass"
76idja,"Roses are red, I'm used to rejection"
91xhjv,"Roses are red, I don’t have a plan"
bfg0ar,"Here is the church, here is the steeple"
b4bdet,"Roses are red, some keys don’t fit"
bfb5h5,"roses are red, i have a pet rock"
ahds51,"It’s cold outside, so hot choclate you’ll pour"
8fojrz,"Rose's are red, my shirt has a collar"
8lwvsx,"Roses are red, my heart needs a break"
9unvs0,This plumber has power; he's ready to flaunt it
6zmgq2,"Roses are red, this movie is hated,"
9jw6of,"Roses are red, people make me nervous,"
bio0wg,"Roses are red, root 2's a surd, look at this beautiful"
81l4mr,"Roses are red, Pencils have lead..."
6v4kzw,"Roses are red, I like to eat fruit,"
ayp1wu,"Roses are red, I just got kicked in the groin"
8h280i,"Roses are red, that's a dead meme,"
b19bka,"Roses are red, you clean yourself in the tub....."
6tfrti,"Roses are red, most candy is junk"
a8hcfk,"Roses are red, I'll always be there"
afscav,"Roses are red, fedoras are shady..."
9kl5et,"I have student loan debt, I am very poor"
6xdo74,"Roses are red, Steak dinners are Hearty"
apfut8,"Roses are red, violets are blue"
98t2pp,Roses are red...
b66kh2,Everyday I make sure to call my mama
b52dws,"Roses are red, Lets go on a date"
8sbu6x,"r/boottoobig, why do I bother?"
du20w8,"Roses are red, I'm a bum"
7z9rap,"Roses are red, I've baked many a cake"
7o3dgr,"Roses are red, violets are blue..."
ckzrq4,"Boss makes a dollar, I make a dime"
8k1y5z,"Roses are red, I live in the ghetto,"
5t7rvu,"Roses are red, this message is urgent"
7aquud,"Roses are red, Kevin Spacey is gay"
94w01w,"This is a repost, it's already been said."
8okd5f,"Roses are red, my feet wear socks"
8v57km,"Roses are red, ice cream I scoop"
92ztaa,"Summer flowers bloom, the songbird sings."
cm727d,"Roses are red, but when your lady mistreats ya..."
7ie8hv,"Roses are red, manhole covers are round"
99mxpg,"Roses are red, I’m a nice guy,"
7h2a5q,"Roses are red, my dad is Canadian..."
8svfkh,"You can run, but you can't hide"
9zy5n5,Accidentally posted to r/boottobig first
7zz1n5,"Roses are red, Giraffes live at the Zoo"
9ah444,"Why so sticky, Gorilla Glue tube?"
7xjmqa,"Roses are red, I'm as cold as an icicle,"
8xnixa,(does this count?)
7yujvy,"Roses are Red, I'm going to the Shops,"
afkoxv,"Roses are red, jewelers make rings"
7mflb0,"Roses are red, bow down to your master"
8nzj1n,Roses are red i am feeling quesey
8v16v5,"Roses are red, white is the snow,"
8eakrk,"Get off your butt, time to play some chess"
93ymt7,"I got stung double by a bumblebee, Seasons are changing and it’s nearly fall,"
9b2zmj,"Roses are red, I have lymphoma"
6b3c61,"The age-old dilemma, of quality or speed,"
8itrxd,"Roses are red, reviews are on yelp,"
d77d1p,"Can I go home, I feel quite queasy"
8f9t9d,"Woah, we're halfway there. Woah-Oh"
bv02h1,"The Roses are red, First push it then pull it"
9z3jqc,A BoottooBig in the wild
8qebip,"Roses are red, college is long,"
dk0f1o,"It’s freezing at night, but what can you do?"
7uow0y,"Roses are red, bellyflops into a pool"
dtlql0,"Roses are red, grab the rope,"
8r92fr,"Roses are red, this is not a quiz"
8tg87r,"I like horses, they are what I mount"
bw585o,"Roses are red, I ate an armadillo..."
an1m8j,"Roses are red, the kids better run"
bd2sm6,"Owls are weird, in Spanish ‘dominar’ means master,"
6ovalw,"Roses are red, you're doing that wrong"
dxycr6,Thor's hammer is an alloy on a stick
acon2z,"Roses are red, my favorite gum is Bubble Mint"
b4p8ps,"Oranges are orange, it's the fruit of kings"
8u68ai,"Upon all of Reddit, we are but a stain."
73ly6o,"Roses are red, I hope my parents are proud"
co2tzt,"I'm tired, you're dead meat,"
d0m805,"Roses are red, there are plenty of hats, I'd like you to meet the"
dwxqtn,"Roses are red, that fish looks lean:"
7dkd2y,"Roses are red, my mortgage is due..."
amygxq,Close the damn windows and shut the fucking door
ajrg9z,"Roses are red, yummy writing utensil"
9k4grk,"Roses are red, he shows no remorse"
8kxwb5,"It doesn't taste great, so be on the lookout."
9b7n60,"If you hunt big game, you'll get lots of hides"
b0uunz,"Reddit is cool, I need to go to the loo"
7gmuu7,"Roses are red, I listen to Slayer"
ddwwom,"Roses are red, I need to go potty"
c6frdg,"I looked out the window, what did I see?"
b8mxhb,"I am British, and i love a cup of tea"
81rxo7,"Roses are red, I ate a burrito,"
8rzr67,"SpongeBob is porous, a pineapple is a fruit"
9qe63y,"Roses are red, I have a small peen,"
92vbsw,"Roses are red, the bar can’t get lower,"
986q61,I like Pied Piper and I hate Gavin Belson
9cmc9h,"Roses are red, my soul is in pain."
7i0689,"Roses are red, I’m tired of beating"
86b9d2,"Roses are red, he can lift some mass"
8eg73k,"Roses are red, Trump thinks he slick"
8rqdba,"Roses are red, My favourite basketball player is Reggie Miller"
bcvxyt,"Roses are red, violets are blue"
9r04dz,"You lovely thing, tilt your screen into view"
a6nt75,"Roses are red, grass makes you itch"
8j34ly,"Roses are red, I ooze confidence"
bkses7,"If it was a girl, he would have ate her,"
ai51uk,"Roses are red, death can be shocking..."
6ttg0l,"Roses are red, I cannot speak"
7dzudm,"Creddit to u/OxtailMakail, I didn't mean to be rude"
8papkm,"Open the door, get on the floor"
bgwgpv,"Love isn’t dead, but it’s not that far"
8jvdzi,"Roses are red, just go with the flow"
9kpnlq,"Hurry! while the mods slumber, everyone upvote this picture of sweet sweet lumber"
azzr74,"Roses are red, the Romans were sloppy"
a64msr,"Made him out of snow, he was a great pal,"
a9umpl,"""If I lose to my dad, my soul will be stuck in limbo,"""
aau94c,"Roses are red, 2018 was lit"
9dcdzn,"Best dad jokes in town, this pun’s for you fam."
bg7npy,"Roses are red, I can’t swim,"
78uz57,"Roses are red, everything is silly..."
bxvxt0,"Oh god please help, I think I hear howling, oh wait it’s actually"
dayzr0,"Roses are red, they probably used staplers"
9a36a2,"Roses are red, Being a villain is fun, Stefán Karl has passed away, but he will always be number one 😭"
dgs4fw,"Roses are red, here comes the rain"
auqp7r,"Roses are red, tell me the code"
bowv3s,Grass is green this belongs in a bin
dbjah6,"I steal credit cards, I never know the pin"
9z277z,"An interesting title, i just created. Yet kinda sad. Cause im just hated."
804g3b,"Roses are red, god may be real"
dhvp6t,"One head tells the truth, the other will lie"
99trrj,"The toast is burned, these eggs are too runny"
839tfz,"Roses are red, you'd better start running"
9hooej,"Roses are red, don’t choose blindly"
bd8ufm,"Roses are red, I’m not a mobster"
ay4nvl,"Look at his head, try not to frown,"
750gkf,"Roses are red, no right to an appeal"
75i4lo,"Roses are red, children have wept"
867dgr,"Roses are red, you cut your grass with a mower"
71q46h,"Roses are red, water goes in buckets"
6pgff7,"Roses are red, no ifs ands or buts"
cb68eb,"Roses make me miserable, they fill me with hate"
8w5msk,"I am enraged, this format’s preferred,"
77ljjb,"Roses are red, fish live in the sea"
9rhr8f,"Roses are red, I’m made of meat,"
8jbc19,"Roses are red, plants need pollination,"
cgr9j3,"Roses are red, so is the gore"
7tchwz,"Roses are red, Santa has elves"
98zty8,we will survive.
7hoyyt,"Roses are red, I get it - you vape,"
7p23im,"Roses are red, OH SHIT HITLERS ALIVE,"
6ymtoh,"Roses are red, I've been expecting a shipment"
bpvjha,"Roses are red, I just ate a bee"
8froxc,"Bring your pick-up truck over here, there's a large load to haul"
a4gkn2,"This sub is reviving, don't let it die in poverty"
7q0s7d,"Roses are red, this will be litty"
anqml5,Roses are red this is all a blur
9ywhtg,"Spaghetti is cooked, sashimi is raw."
93m7cy,Roses are red this rhyme is not clever
9gpeew,"I control the underworld, I control the sky,"
6xkyn9,"Roses are red, ducks can fly"
9irsev,"Roses are red, my house has a gate,"
87929x,"Roses are red, I like my toys,"
5r0bkp,"Roses are red, life is a drem"
8rn46o,Roses are red. My abortion was late.
86hdde,"Roses are red, there was a maple syrup heist,"
bba2qw,"Roses are red, I am a T.rex"
al7qrg,"Life is amiss, I hate to be blue,"
c6ybps,"When ln x = 1, x = e,"
bnjtz8,"Roses are red, insurance is my specialty,"
653xs5,"roses are red, weed makes you lazy"
9eh7xi,Browsing Reddit When I Saw This
923dv7,"roses are red, my girlfriend's a libra"
9kcy28,"Roses are red, my life is quite blue"
7raaet,"Roses are red , I eat tangerines.."
7b3ifo,"Roses are red, I drink water daily"
6bojwb,Temples have Monks. A church has a pastor
7krikn,"Roses are red, the Death Star is round"
biuf15,"Roses are red, food is what I'm buying"
dnwtjy,"What a crisis, a solution can't be seen"
a498mc,"Roses are red, my grandma turned to ash"
8vfy8j,"Roses are red, towels are absorbent."
c6mw6e,"Roses are red, this is a hoot"
8hm975,"Roses are red, I don’t know how to enchant"
8nl7bp,"Roses are red, it's time to take pics,"
8sniow,"Two men can be wed, I was punched in the spleen"
86kaje,"Roses are red, melons are melony..."
8ugb8w,"My coffee table’s cherry, my hallway is narrow"
7ezsp8,"Roses are red, my mental health is whack"
9b0myo,"Roses are red, does this have to rhyme?"
7hh2fj,"Roses are red, the end is nigh,"
al0joy,"Roses are red, the wind is blowing"
8agpli,"Roses are red, Please don't sing that song,"
bamr03,"People can change, that I can recognize,"
7f5za3,"Roses are red, you're acting mysteriously,"
6ogs41,"Roses are red, sunflowers are more yellowy"
9nz877,"Roses are red, my mom is a nun"
914p1v,"Transport, my fort"
7kcuqn,"Roses Are Red, People Open Lids"
ar44e4,"Rose's are red, they closed the Wii shop mart,"
90blkv,"Communism is red, I live in San Francisco"
as5hrs,"Roses are red, tulips are pink"
7fdk21,"Everything makes sense, when I put on my monocle"
7d3g8l,"Roses are red, I'm an adopter"
7e11ry,"Roses are red, my mom is a dude,"
aju1nk,"Roses are red, I'm dead inside"
7inreo,"Roses are red, I like drums..."
86c79b,"Roses are red, I got a new phone"
ar1l0y,"roses are red, im all alone"
bsn7b6,"Roses are red, says Sylvester Stallone..."
6p8trb,Roses are red. Violets are blue...
7bvmah,"Roses are red, violets are blue,"
8hq6y3,"Roses are red, the floor is for show"
cxpi99,"Roses are red, I’m down on my luck"
8o4oq2,"Roses are red, I sell stocks"
7xq8dl,"Roses are red, he found a toy,"
