post_id,title
c7576j,Oof
90knuc,"Train track, Belt buckle"
a1dmn8,"You realize your mistake, as you flee to your Honda,"
anftx7,"You’ve lost the will to live, you’re bored out of your sack,"
8wmutz,"Roses are red, Henry Cavill is dreamy"
80xwjt,"Roses are red, those crackers are wheat"
9fgrvo,"Roses are red, it’s hot like hell"
90y8tm,Itsy bitsy teeny weeny
7erv3c,"Roses are red, Pai should be in detention,"
6r43h3,"Roses are red, violets are blue"
949ywe,"Roses are red, but here's the best part"
7wk30j,"Roses are red, Jordan could dunk"
b5ae14,"I have cancer, I need a cure"
b08p0f,"Roses are red, I grew up in a small town,"
cdhy2h,"I cannot walk, for I am stricken,"
7qk35x,"Roses are red, pass me that pear,"
7x1da7,Relevant
93rrgi,My bank's robot assistant got me today.
90uola,"Roses are red, Rihanna can twerk,"
ap4c8o,"Roses are red, I am single"
88pzse,"Roses Are Crimson, Zuck Is A Crook"
88dhym,"Roses are red, that’s a nice lamp"
aw9ob7,"Roses are red, collectors like stamps,"
8n4q89,Mods are asleep. Upvote boots that are too big
9e5b7i,"Water is clear, sometimes it's cloudy,"
a22kdo,"Roses are red, my humor may worsen,"
cjxsx9,"Roses are red, hey man lets get out of this joint,"
aj940j,"Roses are red, check out what I found,"
bvpyrp,"Roses are red, I found great deals"
9n2nnr,"Roses are red, cock it and pull,"
ali5c5,"Roses are red, i planted a seed"
8dk5er,"roses are red, i put jam on my crackers"
a6rkev,"Roses are red, some parrots may talk"
9xb2qj,"Roses are red, I like to snort chalk"
diqo3n,"Free Hong Kong, I ain’t no snitch. Never forget,"
a956t0,"I ordered a present, it came in the post,"
ayczed,"No messin’ around , no time to dily Daly"
ashp2e,"Violets are blue, roses are red"
azho03,"Roses are red, compliments make me blush"
cset2v,"Roses are red, prepare for an attack"
b70g6q,"Roses are red, violets are blue,"
c4bcq1,"Roses are red, I drive a truck"
amsvpy,"Roses are red, rocks are gray"
d1pcum,"Roses are red, my shoulders are bony"
7wqk4d,Spaget!
d5v5h5,"I'm short of breath, my dad does meth"
dhb4ay,"Roses are red, his love sure is true"
9jlv1i,"We are lost in a dark forest, and we need some guiding"
a2x6ki,"Share your emotions, Don't keep them bottled"
7w2g8i,"One of us, one of us"
bezb0y,"We'll all be like bears, who have found too much honey"
de4uf0,"No one got hurt, it was a small wall,"
763sje,This'll never get old
at8jus,"Roses are red, why do I try,"
9qsdll,"Roses are red, I live in my dad's van"
dqj9ap,"Roses are Red, He was Dressed for a Dungeon"
a8kyz8,"It's Christmas times, so I love you all"
9i9pwz,"Roses are red, we're here to stay"
7pfxvq,"Roses are red, violets are blue"
c182ya,I hate rice
8zf72h,"Roses are red, ice cubes are cold,"
98jhe3,"Bang for your buck, here’s something that floats."
6zuq6q,"Roses are red, my hand is a bee"
7z5bdj,"Roses are red, I play on the grass,"
ahz0xv,"Roses are red, my smiles are often forced,"
6n8sxc,"Roses are Red, Good thing she floats,"
8vre8x,"Roses are red, cocaine is snorted"
ci19gp,"Roses are sad, there’s too much at stake"
99cn0k,"Roses are red, drank from a cup"
aamxt4,"roses are red, my dad left me when i was nine"
do7q5j,"Roses are red, my mind is in a flurry"
au4pkd,"Roses are red, well I'll be damned"
7se7rc,"It’s getting pretty hot, I think I need a popsicle"
9gjd38,"Roses are red, I’m actually a mage,"
c4mryc,"Roses are red, I love to wear pants,"
8tppqs,"Pigs eat carrots, horses eat hay"
8cr5lq,"Roses are red, my wallets empty honey,"
cchhfi,"I really like jazz music, but I hate to sound snobby."
7vewz8,"Roses are red, I'm not a hero"
adsvrj,"Roses are red, i lost my clogs"
a5zmf1,"Roses are red, I wish I was blind..."
dka0k3,"Roses are red, violets are rad,"
btszht,"Roses are red, provolone cheese,"
7ri55c,"Roses are red, it's time for me to go"
8v9l1f,"Roses are red, my life is a haze."
ctpmu1,"Roses are red, magnets are neat!"
cwmoix,"What’s going on here, Kowalski analysis,"
9ufkfx,"Roses are red, I'm browsing on Chrome,"
854o28,"Roses are red, Hit me with a bus,"
a75wpe,"A strange voice I hear, He's getting so clever,"
bnc1wx,"Roses are red, on the bed he sat,"
atgcrp,●
7q77pv,"Roses are red, violets are blue"
8evlrm,"the song got an update, the horse was replaced"
doua2q,"I drive a car, I ride a bike,"
ac5v06,"Roses are red, walls are plaster"
7suzgv,Roses are red...
dihdch,Is this a lie? I'd never tell.
cyfx74,"Roses are red, I’m from Siberia"
ah7jg4,"There once was the hero, he was often fanned"
b9i1w0,"Roses are red, I eat peas,"
byv9en,"Some people ride bikes; I ride a scooter,"
92az0i,"Small Boots are rampant, Sunday's just junk,"
7axa43,Saw this on my front page this morning
7vppsd,"Roses are red, blasphemy is unholy"
bteazm,"Roses are red, my name is Greg"
89r5wj,"Roses are red, pigeon's a bird"
ak0fw6,"Every two Saturdays, I visit my aunt"
882h5t,"Peach is thicc, her booty phat"
a2ekvh,"Roses are red, I hate the taste of lime"
93g9db,"Make me a deal, I'm on my break"
dselnl,"Soda is sweet, water is wet"
b31dhx,"I’m so lonely, I’m going to cry. Why won’t you"
9cchkl,"Roses are red, KKK is a cult,"
c0uvqm,"Roses are red, plants grow in the ground."
cukfuf,"Roses are red, my favorite saiyan is Broly,"
akhnoe,"Memes can be funny, ‘omniscient’ means all-knowing,"
7x8jm8,"Roses are red, the pope is holy,"
amh2go,"Roses are redd, butts have a cracc"
9bu8nd,"I don't want no heckin' rudeness, but I hope you admire my coolness"
9tdmkz,"Roses are red, there’s going to be gore"
brks90,"Roses are red, cash is spent"
8yuapw,"Roses are red, I’m a trendsetter"
cfab2o,"Come along, lets have some fun,"
aoqhkw,"Roses are red, this doesn't work as advertised"
8or2xg,"Roses are red, I drink corona with lime"
bkz0sx,"I'm at a church, right under the steeple"
9rmrbu,"This sweet smile-boi, he brings me real joy"
anwj5t,"Roses are red, i'm not ready"
8rd0v5,"Crayons can color, scissors can cut"
9a6leo,"Roses are red, most pigs have trotters,"
avx1a4,"Roses are red, move at your pace,"
9zsl9k,"First it was neck guy, the meme we all dreaded"
addpsj,"Rose are red, we all have a spleen"
dkm1ae,"Roses are red, Warriors never fall"
8ks2x4,"My walls are plastered, my skills are mastered"
dmga1n,"Roses are red, I need to pee"
bzu5od,"I swear to God, this is not a pun"
bu1eu1,"Roses are red, your mother knows best"
8bi68m,"Stress readings are high. My eyes are bloodshot. Initiate sweat,"
b275e3,"Roses are red, follow my lead"
9ad6w9,"My life is pain, I’m just a coward"
97w29l,"Politics are hard, in this country I’m a resident."
clpbxi,"Roses are red, 69 is my favorite number"
bjtcg5,"Roses are red, this is not bait,"
arrv3n,"Shibas are cute, but dumb as a brick"
8ozxp4,"Roses are red, I used to lift"
7jrznq,"Roses are red, I don't give a fuck"
c0k2u1,"My favourite anime is Thomas the Train,"
adk93k,"Roses are red, my haircut is a taper,"
9u2ygn,"Roses are red, it's a pretty safe bet"
bek8wq,"Rose are red, I just turned 8"
9rz750,"Shiver me timbers, I am a good boy"
9pd881,"Roses are red, MS has Paint"
bas99w,"Red as Roses, Green as Grass"
cmf2dl,"Roses are red, I don't like jam"
cvqnk5,"Roses are red, I’m under oath"
cag0im,"roses are red, you may be in a bubble."
8zpl4h,Roses are red and my worst class is chem
a3eqlm,Jack
9hz1bb,"Roses are red, get closer to my ear"
bk6si9,"I had a race, but I came in last,"
956h2j,A true classic.
dq2re9,"Roses are red, I like long walks on beaches,"
avpe56,"Roses are red, plutonium, radioactive"
abh6ll,"Roses are red, i can’t count to five"
8myg9w,"Roses are red, I have a heart"
80b4h1,"Water is calm, the sun is gleaming.."
bzarne,"Heavy as a melon, round as a ball,"
bp6izp,"Better yet, go get my shank,"
8x1u3h,"Roses are red, we live in our huts,"
aq302v,"It's all over, my life is done"
dj46og,"My owner plays dead, still i'm gonna try"
bm9vl9,"This tweet is not approved by my ex,"
b43klc,"Roses Are Red, And For This Country To Survive,"
9y221e,"Roses are red, outside it’s very dark,"
cayvnc,"I love my snek, i think he has been fed"
74nc8u,"Roses are red, my English is fluent,"
7oj553,"Roses are red, I feel a strange sensation"
8mh6ow,"Roses are Red, I joined the Roman legion"
8t5gwd,"Childhood ruined, I need a Corona"
a9gbc3,"Legs going numb, on the toilet I sit"
8gb3gi,Roses are red; I love your embrace
9d5ud7,Does this count?
94mhz8,"Roses are red, I really want a treat"
c03taj,"It's his name, and it's not stencil"
aqw8oc,"With a group, go to New York"
9rt6ib,"Roses are red, Hit me with a bus,"
c5yn22,"His name is Clayton, and he’s come undone."
9h18lt,"Roses are red, war is a thing"
b86u4p,It's April Fools day! The mods are mute. Upvote a picture of
cfkm7n,"On the railway he came, as he ended all the fun,"
9g9apg,"Roses are red, he goes to the club"
7ry3xa,"Roses are red, I'm off the grid"
c9o97i,"Roses are red, gameboy is outdated,"
dxg9f8,"I do have so much to spend, better go slide in her dm"
covicf,"Roses are red, I don't do meth"
d8o2ql,"Roses are red, I'm scared of tornadoes,"
bv7z2d,"Don't offer it money, don't touch it's neck"
9txapj,"Roses are red, violets are fine"
c92sz7,On this fourth of July you are all in our thoughts
bs36yo,"Roses are red, I live in a dream"
9pt1ol,"Look at Megan, she likes to yeet"
aefnv6,"Roses are red, why burst my bubble"
7k79ci,"roses are red, the choices are mine"
85a2af,"Roses are red, I don't like animal feces,"
8indyf,"Why won’t it stop, my alarm keeps beeping"
96jsse,"Roses are red, achieve all your goals"
dp5ubq,"When we die, we will go to heaven"
br9sqs,"roses are red, they are used improperly"
b5laxo,"Roses are red, just blame inflation"
dh0nvp,"The batter is wealthy, the announcer is pleased"
adydql,"Excuse me fine sir, are you down on your luck,"
9vjy5j,"A cat in Yemen, was fed by her Miss"
a9ckqm,"Anarchy is cool, That crab’s a real beauty,"
b2morh,"Knock down some pins when I give the ball a whirl, try to get a strike but my skill is fleeting"
a1jq2n,"Roses are red, I'm really annoyed"
9x2bbg,"Roses are red, where have you been?"
7gfoja,"Roses are red, I’m ready to mingle,"
boef8d,"Roses are red, I like my eggs fried,"
89zri7,"Roses are red, I like chewing gum"
a29e9l,"Roses are red, I eat lots of fiber,"
b3u6u8,found one out in the wild
aul2gk,"Roses are truly red, right now I cannot blink"
bscwdf,"Roses are red, conditions have become dire"
9hizfc,"Roses are red, I like rice and beans"
b0nidv,"Today is a drag, the weather is mild"
8pkufg,"I made a mistake, it didn't slip through"
cw45hx,"Roses are red, prepare for my reign."
avg11w,I lie in bed until I cry
96ov7w,"Roses are red, I hate global warming,"
8a99kt,"Roses are red, I like Lana Del Rey,"
8ys8s0,"Love can be wonderful, love can be strange,"
d8zxzn,"Roses are red, no need for foreplay"
cdu4h5,"Roses are red, I’ll catch ya later"
d3lg7k,"Thunder is loud, and so is the rain;"
appldz,"Light your joint, and let’s get blazing,"
bt4w4o,"Roses are red, wiping's a nuisance"
91i0su,"Roses are red, spiders make silk"
968a0g,So no one told you life was gonna be this way
arx1lb,"Roses are red, I don’t want no drama"
czxi1u,"Roses are red, I work at a distillery"
9omenl,"Do not stare, far down the road"
bbixou,"Tigger is my friend, I love Winnie the Pooh"
agypiw,"Rose's are Red, I am a Cook"
8zuyq5,"Roses are red, I always finish last..."
9dttqe,"That's not a cure, it's a prevention for fucks sake"
9awtbw,"Roses are red, violets are blue..."
a7b5g8,"Her body is trembling, she lives in fear"
8mr2kj,"Roses are red, don't hate on linguine,"
bqb3k6,"What a rapscallion, he only comes for the sermon"
clwrm2,"Roses are red, I just got a few drinks at the bar..."
d2aha0,"If you want to be a yacht, but you're the size of a freighter"
8d5c32,"Roses are red, some lions don't roar"
dd5rgm,"Roses are red, I believe in fairness"
c2v0ct,"Roses are Red, I sleep on a Cloud"
clh55b,"Roses are red, life ain't fair,"
au99x4,"I ain’t got rhythm, I ain’t got rhymes, so forgive me if this is wrong"
aia8h0,I’m so happy these memes are fire 🔥
c1ttyx,"Roses are red, there's books on my shelves,"
b9v3gy,"Roses are red, I love you to death"
95v09l,"I thought to myself, as I started to weep;"
9hb8uk,"Roses are red, candy is sweet"
bhmqz2,"I really love my dog, even though he’s pretty dense…"
cebj5h,"When a chip does it, it gets a pass."
afzf15,"My cat is an asshole, he knocked over my vase"
8lkpwj,"There were tombs of gold, in the pyramids of Giza"
8ih1cu,"Roses are red, a greek god is Zeus"
bhvyyc,"That pupper is smol, I just wanna hug it"
7gv8qd,"Roses are red, I play the accordion"
8b8bq5,"Roses are red, my barber’s name is Cyrus"
dpqbog,"Roses are red, salad is healthy"
amntz5,"Roses are red, it's an unfortunate time"
8yi1uk,"roses are red, please don't hurt her,"
bo2jbr,"Roses are red, I like Johnny Depp"
a8z19h,"Roses are red, I post here a load"
9q03am,"Roses are red, I'm sat on a chair"
7cvsni,The bard of youtube
9zkjqf,"Roses are red, she sure is all that,"
dpgf8f,"I’m going to the store, I’ll text you when I’m there"
cbgfog,I gave a girl flowers because she had a pretty face...
b39iip,"Roses had the mood, violets had the weeds"
cget2i,"Life is too short, storm clouds are gray,"
9y6ltc,"Last name Norris, first name Chuck"
9kg2kd,Roses are red and my dick is quite flacid
aoyhij,Violets are blue and roses are red
7tk2p8,So I showed my grandma this subreddit.....
9np0nm,"Roses are red, I’ve got a plan"
6p16on,"Roses are red, your eyes are like heaven"
9c7uxb,"Roses are red, oh god it stings"
aaziv7,"Roses are red, I like Tyrannosaurus Rex,"
af3glo,"Roses are red, my granddad’s a herder,"
awy8e7,"Roses are red, I need to go pee"
9ctqu4,"Roses are red, I am the one with the force"
7ymovg,"Roses are red, violets are blue"
arjvtr,"Roses are red, I'm doing well..."
bvwhqv,"The earth is flat, i love cheetos"
dggkh8,"Roses are red, love is in the air"
badyey,"Roses are red, I’m under detection"
bnnz9p,"Roses are red, this isn't a prank"
8knog2,"Roses are red, i have a bad cough"
b5qk5h,"Roses are red, i'll tell but never kiss"
8l2ujy,"Roses are red, violets are blue,"
be486e,"Roses are red, Mortal Kombat has Fatality,"
962hzj,"Roses are red, Butter is churned"
bfnf6q,Yeah let’s try that again
81y01h,"Roses are red, violets are blue"
a3n31c,"Roses are red, I'm an intellectual"
d1bcld,"I showed this to my friend, her name is Anne,"
asowfz,"This is a battle, there’s no place to hide."
bcof9o,"Roses are red, you’re in luck!"
98azv1,"Roses are red, there’s nothing to fear"
ajeopf,"Roses are red, I’m dying alone"
8f2b48,"Woah, we're half way there. Woah-oh..."
7309fw,"Roses are red, violets are blue,"
dn90ui,"Roses are red, I’ll do a little dance,"
8s6giw,My life is sad I'm always weeping
9czgce,"Violets are indigo, mockumentaries are silly"
76xn84,"Roses are red, I have a cough..."
cerxfo,"Roses are red, I hate recitals"
c22x4m,"Roses are red, a door has a lock,"
95o1hl,"We know it's the truth, and though we all dread it"
dw98s3,"Roses are red, Batman’s a winner, now that’s what I call a"
7zmi9b,Boot Too Big 2!
c8toub,"He came out as gay, some people are meanies,"
b7nlaf,"Roses are red, I don’t dream,"
b94ft4,"Time flies so fast, I just wish I was younger"
7a4cs0,"Roses are red, Mercury's in thermometers"
db9d1q,"King Crimson is red, Sticky Fingers is blue,"
bkkb99,"When I am running, I get out of breath"
ayuddp,"Roses are red, ignorance is bliss"
b4virr,"Roses are red, my dad's name is Paul"
a2o310,"Roses are red, I am a hen"
7b83cz,Today is gonna be the day That they're gonna throw it back to you
a7qm7i,"My chair‘s made of leather, my blanket’s made of silk,"
aciq0a,"Roses are red, I’m covered in wine"
9vrdkc,"When shit hits the fan, from danger I flee"
8g5rnq,"Where did he come from, where did he go? Where’d he come from"
cnor8n,"Roses are red, my shirt says “supreme”"
73zvmb,"Roses are red, Uni is long"
d36kng,"Roses are red, blood is the same,"
8pshmv,"Roses are red, my friends keep disappearing"
dlqc30,"Roses are red, I am alive"
7fuogv,"Roses are red, grass is green"
b2g8rv,"Wyoming is a state, water will evaporate"
dxou3k,"Roses are red, I need a comb,"
bgqks2,"Roses are red, Belle loves the beast,"
7wupbb,"Roses are red, my violets are infested"
a9zkej,"Roses are red, unlike Mike Pence,"
chp739,"Roses are red, I chopped down a tree"
82onb9,"Roses are red, my hamstrings are fucked,"
d7pi5q,Holding my cow by the tongue won't hurt her
9boz5i,"Roses are red, the earth is flat"
c88x6s,"Roses are red, I need some more cats,"
a6ykkx,"Roses are red, he bought a season pass..."
8n8dm6,"Roses are Red, You drink from a cup"
9wvpen,"Roses are red, Pikachu used Thunder Kick"
awh0wk,"My thoughts are deep, they give me the shakes"
99hpq7,"[SKS] Roses are red, it is the curtain call..."
ct23o1,"Roses are red, just like the color I’ve bled"
cpovhs,"Roses are red, they take away my breath,"
bmvlev,"For full offense, scream and snap:"
6zekn4,"Roses are red, Narnia's a chronicle"
9m2408,"It's finally spooktober, time to upload this boot"
c5nkjl,"I read the bible, you should too"
82jsfs,"Roses are Red, and turn grey as they burn..."
bjgtw2,"At the end of every tunnel there is a light,"
9amgs0,"Roses are red, my eyes are blurry..."
8apxc3,"Roses are red, I need to practice my vows"
9vw2h1,"Roses are red, music has sound"
a13od8,"Roses are red, Italy is cool"
ad0p1t,"Roses are red, I have violets in my room"
70n3jc,Incidental boottoobig
djhmf6,"I know this really hot guy, he works as a pole dancer"
8cen99,"Roses are red, I am so done"
byl3ml,"Roses are red, something just doesn't click,"
aahdhh,"Roses are red, giants are tall"
8e412h,"I have a track meet, and I'm forced to compete"
a65eb3,"Roses are red, Aryans are blonde,"
b10dcy,"Roses are red, this is what cats are all about"
aq9bfv,"Sights are seen, sounds are heard"
aa6mo6,"Let's point out the phonies,"
av2036,"Roses are red, George Lucas is a God"
bwt2my,"Roses are red, this picture is neat"
87qxwg,"Roses are red, my niece is ten"
825glu,"Roses are red, Google’s got Chrome..."
drzljq,"Roses are red, I have an amplifier made by Roland"
apbnza,"Roses are red, he got the power like Bill Nye,"
ck8y4b,"Rocks could live long, but alas, erosion"
9c2hl6,"Roses are red, do you play the flute"
ainwp1,"Roses are red, I feel a connection"
9ixlke,"Roses are red, Scooby-Doo's tail is waggy"
9lavib,"You stole my pants, I don't know what to do"
9imue9,I don’t even have to write anything.
8tzbxa,"Orange is nice, my favorite is green"
arep6y,"Roses are red, I am not gay"
buskwa,"Roses are red, this image gives me purity,"
80rad5,"Roses are red, keep the goddamn door shut"
92rs7x,"Roses are red, Get off my lawn"
7lukob,"Roses are red, i smell them with glee"
bq27l1,"i've been gaining weight, i need to cut back"
7cdosb,"Roses are red, violets are blue"
d4kai0,"Roses are red, happy thanksgiving,"
d2yra0,"Roses are red, Obama is well spoken, I’m sorry sir"
99x8hi,"Roses are red, I eat steak with a spoon"
9oenqj,"Roses are red, never say never"
8cw2of,"Roses are red, let me grab my phone"
bj26p4,"Youtube recommendations made me watch this now,"
9qljyh,"Early bird, worm plucker."
bxqaqp,"Roses are red, I’m all alone"
cgzc67,"Life’s good, I’m alright."
92ltol,"Roses are red, my fist has a blister,"
aemi9q,"Roses are red, I can't stop squeezing;"
9wbrp3,"On money they print, “In God we trust.”"
cuuks6,"Anakin's dead, the empire is burning"
duay55,"Lisa is Homer’s daughter, and Homer’s son is Bart"
bdunxm,"roses are red, last night i got trashed"
atw3lq,"roses are red, escargot is snails"
agsxv0,"Roses are red, I like Invader Zim,"
aab79u,"Roses are red, my butt really itches"
a3ucow,"Roses are Red, I'm cleaning a knife;"
b1y6wl,"I like little kids, I am the pope"
9mptmg,"I’m a smarty, smile and nod"
8qs0qd,"Roses are red, I used a train station,"
9jaiw0,"I'm a sick fuck, I like a"
9o21bl,"I need to get paid, my vices are rife"
bpcvcv,"Roses are red, Mom says I can't swear"
di5ti1,"Roses are red, Fishing uses rods"
98nnf3,"The truth is revealed in my failure to plan,"
auwyj0,"Soviet Russia, Too good to be true,"
a5ewc2,It's getting out of hand
a89tly,"Roses are red, I'm wearing a cardigan"
79ntqw,"Roses are red, the walls are plastered"
844mou,"Roses are Red, I wear a hat"
86tgjv,But he boot too big for he gotdamn feet
9mb4f2,"Roses are red, Let me show you my wrath,"
axpuw4,"Cocoa Pebbles are yum, they make a great treat... (but)"
9gdsxx,"Roses are red, Jesus didn’t drink lean,"
9ntdzg,"Antarctica is cold, but gets warmer with time,"
bla17y,"Roses are red, you deserve to be hit"
9p05qq,"Roses are red,"
ccvg1p,"If death is a letter, the envelope needs stamping."
dcranm,"I like you, I don’t know about the others,"
6ng154,"Roses are red, I slept with your mama"
7nvw15,"Roses are red, Logan Paul took a body count"
9ihds6,"Roses are red, some cats are blonde"
9faiwf,"Roses are red, I fell in a pit"
7citkm,"As red as roses, my cheeks are blushing..."
9u9v3j,"Roses are red, his butt cheeks were flappin"
am2msb,"Roses are red, Vladimir Putin"
8wsokh,"Roses are red, your mind is in the gutter"
8rvlwn,"Nitrogen is in the air, helium is in a balloon"
bzlp1s,"Roses are red, I have epilepsy"
a9p2ww,"If you are still hungry, I do not care:"
alx680,"Roses are red, the cold weather will worsen"
88jjpw,Roses are red...
bqs9gb,"Roses are red, there's a band on the stage"
afd7rh,"Roses are red, you can overdose on Cardizem;"
dtu5uq,"Roses are red, here I lay.."
6w54lk,"Roses are red, i need a crutch"
buc642,"What's the word, this is absurd"
9w4cuf,My neck... my back...
b1rquk,"Roses are red, It's totally alright y'all,"
a4q9he,"Roses are red, the meaning is clear"
cha1dh,"Don't look ahead, or get overrun..."
d830eq,"Minecraft isn’t hard, just give it a push"
9sc7yh,"Roses are red, chief this ain’t it"
9liu8k,"I have anxiety, in runs in my genes"
c9vvwm,"I live in the mountains, there is a lot of fog,"
9439v6,"Roses are red, hakuna matata"
bygh5g,"We live and we die, what’s it all for?"
7opc8z,"I’m rubber, you’re glue..."
94qvxq,"Roses are red, just sit down and eat, we don't serve fish just"
a1vjhh,"Mods are asleep, upvote a big boot"
9zaulm,"With the sweetest voice my true love calls, hey there hot stuff"
dvidwc,"November is over, Commence masturbation"
787hwv,"Roses are red, the sun is shining in Ibiza"
b7v456,"Roses are red, I think Justin's fainting,"
df3i7i,"The oven isn’t working, but the sun is beaming,"
bgg2kc,"Roses are red, I just ate a pear"
8uuome,"That’s enough, I have been torn"
9k6tqz,"Roses are red, hit me with a truck,"
dr9of7,"Roses are red, I like to get fit"
blzkvr,"Roses are red, could this be a double rhyme"
brqnp2,"It brings me great sorrow, I'd really love to go, I wish I could hangout tomorrow, but I"
9m4s28,"Im driving alone, this road goes real far"
a0u8zr,"Roses are red, I like corn on the cob"
8wabw9,"Follow the message, then say your “goodbye”..."
cxy2ce,"Roses are red, violets are blind..."
by3r5w,"Roses are red, it's a no-brainier"
asa0f1,"All of my farm animals escaped, because i opened the pen,"
cbvd6b,"Roses are red, the only thing to fear is fear,"
b6kggv,"Roses are red, chicken heads are steady"
c2le5o,I'm a Christian. I wont deny that
9kvys7,"Roses are red, they make my heart melt"
8iy301,Roses are red and what can I say
c8lnjp,Commit a big crime? Felon. Best fruit with a rind?
bopdg9,"Roses are red, i think I'm getting fat"
cj0re1,"Roses are red, I ordered it last,"
9et1a7,"Roses are red, Ignorance is bliss bro"
8l7z1h,"Roses are red, newspapers have editors,"
d0ukzr,"Roses are red, lambs go to the slaughter"
8ofrcv,"Roses are red, I like the boob"
7kxpt3,"Roses are red, woe is me,"
9bcot5,"Roses are red, there’s no point in trying"
cxatjz,"Roses are red, I just raised my happiness bar"
bqiwkf,"Roses are red, life isn't great,"
d1zqwf,"Roses are red, data is neat,"
cjbyoe,"Roses are red, i like it when it rains"
9i4ww4,"Cow goes bark, dog goes moo"
96epbu,"Roses are red, I've had a few beers"
dnfqsr,"Roses are red, eagles can fly,"
ca7dk8,"Roses are Red, I like to drink Beers..."
ak6v7c,"You may be powerful, but I don’t give many fucks"
dv60yo,"Roses are red, he's filled with glee"
6qhe52,"Roses are red, so are some trains"
bigz8p,"Roses are red, I’m doing swell"
aknvsi,"I live by the Sea, My workplace is Swell"
alqirt,"Roses are red, my eyes must be blurry"
augy1r,"Roses are red, Water is what plants absorb,"
cco8sx,"Roses are red, and so is my ham-flavored lamb"
cn2pal,"Roses are red, I just think they're neat"
bfvb5d,"Roses are red, some violets are blue"
62l8ig,"Roses are red, Harambe is in heaven..."
b7cgq4,"Roses are red, we'll see about that"
cqoa3m,"My mom makes food, i garnish with chives"
b6evel,"I am speed, but I still need to go faster"
c3ptkn,"Eyes are black, white floof has no curl"
ba7efh,"Roses are red, I love bugs"
ab6gos,"Lightsabers are red, I also like their sound,"
8mav4k,"Roses are red, these feathers are long"
c35izq,"Roses are red, I ride on a boat,"
ad66s3,Best excuse
8e07qb,"I asked if she loved me, she said ""platonically,"""
ddhdw5,"Rose's are red, I do what I can to get by,"
9ec0sg,"Roses are red, and now with a kiss,"
bdn4co,"Roses are read, haven’t you heard..."
971ucn,"Roses are red, life’s hard and unfair."
7pujo6,"Roses are red, I'm wearing a cardigan"
a8u6wi,"Roses are red, I have a new hook..."
7s5y8x,"Roses are red, sinners go to hell,"
a6gqnl,"roses are red, i have just one query"
bia4g8,"His name is twig, Give him a pat"
bg12hh,"Roses are red, I just had some beer, this is the"
aohvx1,Praise the Lord and pass the Ammunition!
7ee961,"Roses are red, his allegations came later. It's"
cklri3,1 2 7 3
dhmqbq,"Roses are red, is that guy gay?"
dtc7vd,"Roses are red, my name is not joe"
ar81e2,"Roses are red, this sub is a gem"
6ryepm,"Roses are red, he once was a pup,"
cfs748,"Roses are red, his name is Tim"
8xto31,"roses are red, lemons are sour"
c5axt7,"Roses are red, I weigh more one pound,"
