post_id,title
dez4yc,Breaking: Blizzard entertainment bans pro hearthstone player for standing up for Hong Kong and then fires the casters just for being there. Will this happen to WoW?
cz3b6a,<-- This amount of people are not racing to 60.
cxwdm1,Meanwhile in Thousand Needles...
d4e7qy,It's the little things that make this game great 😊
dgw8ex,How a professional earns mount gold
d96f04,Target icons in dungeons/raids
bojzwo,HERE WE GOOOOO
cxpyeb,Thank God for Classic WoW
d60dz0,"“If it criticizes the Horde, its low effort.”"
duhykf,Gotta love quest ratios
c1ubdc,This is the only day you can upvote this
cydxoo,Asmongold failed classic wow
cx9rvv,Trying to fix the timeline.
dvukun,World first 60 Method Jokerd ninja'd Staff of Dominance from my raid last night...
d9ia6u,"I don't know which game you play, but this is how my groups seem to do it."
daqh8j,PSA: Asmongold's Officer Royson Teaches Us A Lesson On NinjaLooting...
d80iqi,Reported someone in Gadgetzan for using the arena range exploit on people. GM contacts and for some reason gives me a warning and then hangs up mid-conversation.
d3chdf,How would you guys like Classic to progress in the future?
dhgdn9,For the glory of the Alliance!
czk5s0,When you’re level 60 and a low level rogue hits you with a /wave
d16otb,That's above my pay grade
cyb5gi,"Blizzard after 15 years of failed ""WoW killers"""
d1pibs,I guess the quest designer just sort of gave up when writing the quest objectives on this one!
dc73w2,Mage.mp4
d3monn,GAME BREAKING BUG - spells in the german version of the game have a 9.36% longer range
d7o1hx,"It's about the journey, not the destination"
d65efv,"I thought I was useless, but then..."
czyjpf,Just got invited to this guild on my bank alt
d1ksyv,My submission for a close call while traveling in Azeroth.
d7xv7k,Long live RP realms :P
cyvkna,I'll Take it
df33fx,"Blizzard, on behalf of ""casuals"", please slow down"
d7hht3,Today we drowned a gnome in Tanaris. We mind controlled him and kept under water until he drowned.
cu6a86,NO DUNGEON GROUP FINDER ADDON FOR CLASSIC!
dbnrtk,Logang
cvt7mu,Reposting my favourite classic meme.
d4l2l5,I love the barrens
d0ubfv,Helped a low level through enemy territory and...
d5ojmd,Coming back to Hillsbrad at level 60
cx80yt,Classic WoW has corrupted the community
cy2u30,World First Ragnaros Downed! Classic
cxl0te,It's all over now! We have our WORLD FIRST LEVEL 60 on Classic Wow! GZ TO JOKERD!!!
dahlk2,"Oh Duskwood, how I've missed you"
d6bkkz,Drew this while waiting for my Warrior to bank Rested XP
d35t7v,met this man while waiting for a boat and immediately felt nervous.
dcpl2b,When WoW turned into a LoTR battle scene
d6rcl3,Ragefire Chasm [By Dreamwalker] - Don't forget to bring some ice cold water when venturing into the chasm! - Hope you like it <3
cwmeym,When I pass by a mage as a priest
cwcvag,"You think you do, but you don't"
dm1txo,Darnassus with no layering
dehx0w,No horde were around to help so this glorious adventurer waited 10 minutes to help me kill an Elite quest mob after I used /point to let him know I needed to kill it too. Salute my friend.
d1zehg,"As a dungeon master, I completely agree"
cyz68r,[by request] The best pirate I've ever seen
d3trsb,The Indifferent Samaritan
dkikgb,Not sure that was here.
cxfxac,Classic right now..
dgnd3p,I look fucking ridiculous
d3okxi,Not on my watch
bxujnf,I wanted to share my greatest vanilla achievement. Dingjng 60 as horde by discovering Stormwind.
cuxi4s,My first (and last) meme.
d445xh,Someone once said you can't go home again...
d8sq28,HEALERS HATE HIM!
d558gy,"I'm a truck driver, but my thirst for classic must be quenched."
dtl1jn,<------- Number of people who think free realm transfers need to be faction specific.
d5d8h3,World of Warcraft Classic Fitness game (just for fun)
d2iz25,"Listen, I'm just a healer."
cx4uu3,"Friendly reminder to Alliance, there's easy skip from Stormwind flight path to the bridge!"
czhqab,Road to Brill [By Dreamwalker] - It is dangerous out there... Hope you like it <3
cw86oa,My experience so far as a druid
dg1bpj,This Is What I Get For Purchasing The Cheapest Level Appropriate Shield On The AH
cvj4yn,"Vanilla Memories: Just so you know bro, I always kept that letter..."
dab5oh,Worth it...
cxxu84,Classic leveling
csycrq,Nice
dtvt9a,When your druid friend says balance is viable
d50ukk,Extremely helpful Hunter Macro
db9m5l,Me and my buddies in Classic Wailing Caverns for the first time.
d8np1x,Sometimes people can be very helpful and descriptive in chat! Other times...
d76gup,"TallFrodo's Journal. October 12th, 2019.:"
cx0qt4,Low levelling without hearing and seeing these stupid things is a joy
d5il93,I made my own AddOn and I loved it <3
czpn6n,"My personal classic WoW mobile, different networks, about 100 miles from my from my PC, I’ve leveled this character completely on my iPhone."
d996uo,"~7.5 years ago my childhood friend who introduced me to WoW passed away. For classic, I recreated his character with the same name, appearance, and spec. Today, Scribler got his mount :)"
cwhwnq,I love seeing all the OG devs still in love with this game.
d86rs0,My list of recommended addons that will improve your quality of life without changing how the game looks and plays
cth8m7,Wow classic life as a casual player
d6izt9,About the DDoS a few weeks back. Ladies & gentlemen. They got him.
dinksg,I just wanted a guide to level cooking
dlgfx2,*Happy warrior noise*
dmojkj,"When you salute at the same time, you become brothers."
ct08c7,Welcome to the /r/ClassicWoW Subreddit AMA with the Classic WoW Dev team!
d0fss8,Every priest in the booty bay boat.
d0prwy,what my wife sees when she divorces me
d26x9n,This is how you advertise a hardcore raiding guild (ZT-EU)
dkymbw,"I spent an obscene amount of time setting this up. It's far from optimal for group content, but still thought it'd be a cool thing to try!"
di4cs8,The Stockade [By Dreamwalker] - A little gory but what do you expect from a mutiny? D: - Hope you like it <3
davv1x,The Things We Wear On The Path To 60...
cv8gip,Is this meme allowed here or is it too low effort?
dvm00j,Wise words from our healer
cykkvl,"In original Vanilla, I ignored professions entirely. Not making that mistake again. Super proud of this"
de1lts,"Im the GM of a Guild called State Bank of Azeroth, the biggest guild with bank alts in Razorgore. Today, I woke up to this mail in my inbox with the subject: Request for promotion."
djl45y,When the party in Startholme asks me why I didn't skip mobs but I'm low key farming rep.
dd5jij,"I don't know who Thassimar was, but I know he fought with bravery and died with honor"
ddcn4r,My wife has agreed to try WoW! We start tonight. Wish us luck! She’s not a gamer.
d2ugpm,My friend is playing WoW for the first time in Classic. Oh you sweet summer child...
cyosew,It's a tough dating scene for us under 5 foot boys in Azeroth
d0hrzu,"Bought a plain letter from the AH for 5 copper, not sure what I expected"
d2g7ym,Not the charge path i would of taken...
da73d6,Just wanted to share my extremely lazy setup for classic wow.
cqoem0,"Just 12 more days, and our lives will begin"
dcu95i,"One map to rule them all, One map to find them, One map to bring them all and in the Azeroth guide them! *UPDATED, see comments for smaller file size(s)."
cx9s8a,In-flight buffing service now in operation
c1874h,Good luck 🍀 Healers
dffddj,Keep yer fheet on der Ground
deaaju,wtf reddit
d47g6l,Decided I’d use up some scrolls in preparation of a quest... not realising I was buffing the quest-giver
cx3es3,I'm the Bag Man
d70ekk,A tale as old as time
dp470i,In case you are getting spammed by Gold Offers
cy748n,"People are hitting 60 and downing MC, meanwhile my friend gets on a roof and gets stuck in a chimney. Proper Classic!"
d8gbfw,Goodbye Monday. Hello Azeroth.
cvn53l,Gotta go fast.
dwr0tc,Last night was a big bucket of giggles
djp893,"I didn't expect my last edit to blow up as much as it did so I decided to make another, I hope you guys enjoy this just as much!"
dgqhj1,For /u/jakabov
dbfv2w,No ChAnGeS
cvyocd,When you think you’re safe from a random error DC and the queue
ctz0e9,Only 102 hours left! good luck everybody!
dh4wfd,"We met like 15 levels ago in STV, and instead of ganking we kept greeting and helping eachother when mobs got too much to handle. Suddenly someone spams /wave at me and it's my favorite horde. :D He gave me a pet through AH, in my color! If you're out there Swosh, you're awesome! Cya around! ^^"
cvzkpp,good old classic nostalgia
cyrj74,Found my alliance counterpart in Thousand Needles
cyxy4e,Petition to give Classic WoW its own tab in the battle net launcher; upvote/comment to sign
dsy9kc,Game breaking bug: Carrot on a Stick does not increase Gryphon speed
da1mj0,"I decided to edit another video at 2am, again I'm sorry in advance"
d582im,I handed out a bunch of Greater Magic Wands to level ~13 players to help them and many didn't even say thanks. This guy not only thanked me at the time but remembered me 15 levels later after he finally got an upgrade. For some reason this pm is the most joy I've gotten since returning.
cylivd,My old coworker posted this on LinkedIn - super cool!
dw6wd7,The most expensive item paid for in WoW
d51vsr,When you have Questie and accept all the quests in Un'Goro
dov636,"The reason this game is awesome. My guild sent me this kind mail for getting married, which I wasnt expecting. Thank you guys, yas are all great."
depx9i,When you miss once while leveling your Warrior
dpkv1v,Name a more iconic duo
d0eary,"God damn, I almost thought he wouldn't go through with his promise."
cqfenk,Blizzard added a Thex NPC to retail!
d5ks3e,Questing in Shimmering Flats
dwdfnt,A fitting quest to ding 60 on:
cvcr7i,What we have to look forward to tomorrow!
dwxf07,Hillsbrad trash talk is high IQ
cy9d6t,When you are trying to fish..
d8lcr3,"I pickpocketed this of a troll in ZF and this is what I like the most about Classic WoW, silly items and easter eggs here and there."
djcwe4,You join a Dire Maul group. *Location of your party members*
d9qpha,"[UPDATE: Rooftop Warning in Gadgetzan] Will give credit where it's due. Blizz CS overturned the warning and apologized! Was not expecting this at all, thank you Blizz for mending the situation!"
do0x6h,"Best Friends: Then, Now and Forever"
cw1wus,This is the classic I waited a year and a half for
de5bwt,We ran from one side of Kalimdor to the other on a level 1 and drank each time we died
dv701s,Northshire Abbey [By Dreamwalker] - ¿Do you remember the first time you created a human character and started leveling? What a delightful memory. - Hope you like it! <3
bpbicd,Most of /r/classicwow
cumjuu,Blue post regarding the LFG Add-on
dy0ffr,Game altering bug? Ever since the patch my game is only running in black and white? Is this happening to anyone else?
d1epvj,DdoS has started again (?)
dridna,What people are really looking forward to in phase 2
d6ydki,Gotta appreciate the hustle in general chat
dshkdi,Teaching how to kick people from guild (WoWBash)
dn17hn,I was unaware of the scarcity of copper ore in Azeroth
dby0po,2 screenshots - 14 years apart - to the exact same minute : oct 1st 2019/2005 20:31
dnn0fx,Leveled together from level 1. Today we all hit 60 together.
d7vx2b,We've all been there..
cjqelb,Why does it keep following me?
d1ebal,"Little to my knowledge, the maddest of lads was about to save me from certain doom."
cta2vs,"Back in early 2005 I used to lure people to the edge of the world in Winterspring for a ""secret chest"", only to be mind controlled off the cliff by my NE Priest friend in ventrilo with me."
dqs9cg,"The Successful Experiment! 15 years later, still works"
dcmaok,Wailing Caverns [By Dreamwalker] - ¿wanna grind some deviate hide? - Hope you like it <3
cyd80x,"NOPE, Classic WoW edition"
busqyn,Who remembers the first time you got to the stairs event in Vanilla?
ddjwgi,How to Netflix/YouTube and WoW if you're a poor pleb w/o dual/triple monitors
cs10mg,a small price to pay for salvation
cay1m8,Me and the boys when layering doesn't get fixed.
ddlylx,Are you a minor?
d56l1c,Bans for layering exploits are beginning to go out
db8lfp,"""I'm having a moment, thank you"""
ct1xj2,"When you finally reach level 40 as a Warrior, learn Mortal Strike and start dealing damage."
canfh7,Rolling as a Priest in Classic
cxp4o4,Classic WoW Charge
dhuq4o,"Bold Strategy, Cotton"
dq3g3r,The truth is always Ugly...
drxoy1,That moment when you realize the blink icon is a blinking dwarf facing sideways
c7gv8e,"""Welcome to Tirisfal Glades"""
dxb4c7,Alliance guild abducts a Horde player with Hand of Rag to be judged by the King of Iron Forge
dh9kfc,"My Guild's GM just ninja'd Hand of Rag mats, disbanded guild and deleted discord. WoW drama at it's finest. He also made a reddit post on our realm subreddit - link inside"
d5zut9,I found a nice level 2 Dwarf Paladin in Darkshore
d5v32v,Me: I need to level up faster. Also me:
bxl3hn,In response to Sodapoppin's entitled beliefs about blacklisting stream snipers
d4n7h2,Mob priorities
cq9yy0,(fixed) I made a nice Infographic for WoW Classic Keys & Attunements!
cv9kds,"In celebration of launch tomorrow, I painted the log-in screen! (Wallpaper link inside)"
bym7eq,Literally this entire week
d282ny,Everyone showing off their lucky jumps to make a boat/zepp...this is the true classic experience
dirxjg,"Found this amusing, nothing like being an elitist towards someone playing the game during actual Vanilla"
d90jtg,Wait a minute...
du72gw,Just found out Alliance can say this to Horde:
cwch6x,just having fun on wow classic
d00jv7,My buddy zoomed in while killing gorillas in Un'Goro and got a pretty good shot...
cqtfio,Prepare your self!
chlv8a,Soon in wow classic!
d0v87z,This random guy on the boat made my day!
cvzie4,Guys only want one thing and it's fricking disgusting.
d3rc6y,Life for druids at 60
d54hst,ClassicWoW is #1 on Reddit again
crtax0,No one heals by hurting
bx4u4b,"Would you all like for Mountain Dew to re-release their ""Game Fuel"" Alliance and Horde versions for the Classic Launch?"
d1pr4v,*record scratch* *freeze frame* Yep. That's me. You're probably wondering how I ended up in this situation
dqjnhr,The unspoken rule
cv1vai,The Alliance is gathering! Hope you like it <3 Classic is upon us!
cp3uh3,Blizzard needs to fix layering before the WoW Classic launch
cprtp7,Everyone in this Subreddit right now
dt8wkj,The luckiest thing that has ever happened to me in WoW
crdvow,Made by Hurricane
den9d2,Dire Maul Arrives October 15th
d0awqm,When you're in a new zone trying to find any landmark to open the map up...
cvgs6s,Always /Wave Back
do8j8z,It's been a dream for 10+ years. What do I do now? Horde First Skeram-PVP.
bvs1ax,People demanding beta
d0k2u2,I have mastered the Baradin Bay boat
d7p7du,The nerves on this guy
cwtiaj,This is the part where we throw our heads back and laugh
czrakt,My buddy just entered Shimmering Flats at level 32 as Alliance. He sent me this picture about 10 minutes later.
dlyogp,Me as a Horde on a PVP server doing a kill quest with an Alliance
dbulv0,She claimed to be fighting climate change
dkaghc,First mask I get....
cwkokm,Classic made me realize how terrible BfA is
cvojxk,New loading screen tip for BFA
bv9asm,"Level 10 I traveled to Undercity, through Silverpine, to Hillsbrad, through the ocean to wetlands, through the dwarf tunnels to Dun Morogh. To find the bear Mangeclaw, who is level 11. He killed me 20 times, due to a stun/knockdown he has that interrupts taming. But he missed one and i got him."
cv62il,'Twas the Night Before Classic...
caclx2,Orc Warlock... maybe Undead Mage... maybe Gnome...
coy0jw,Blessed be the Paladins
coja9q,Layering seriously needs to get fixed before release.... - Cant even play with friends.
cu2p9u,Tauren during character creation
d22ny4,"I'm an idiot, I traveled as a level 27 all the way to Feralas to learn Artisan LW...the trainer had some words for me."
co15mj,"Made an animated version of the Classic Wallpaper for myself, so i figured i share it."
dstxbd,[Serious] Blizzard: Please update the servers. World PVP is literally unplayable.
c8b4dz,Stay Hydrated
cz7off,“I’m quitting WoW for good this time”
dxlt74,"In the same way that Blizzard brought us Dire Maul early, Battlegrounds should be separated from Phase 3 and delivered early."
dhh458,never autorun afk in desolace
d7o13l,This is the best reason to play Classic for
dgd65d,Just another day in a starter zone
djzjhm,Now THIS is real advertisement! :D
csiasa,Team ATLANTA reporting. Can't wait!
d7bz42,"""A Classic Journey Part IX - Souvenirs of Death"" by Valdihr"
cvny2w,Nice one blizzard
dme5dr,CoD confusion
dnba01,Bobbing for apples is probably a lot more hygienic in the Alliance-only zones
cz9cv3,Free Character Moves Coming Soon
dlqljr,"Server: Skeram, with no more layers."
dd7540,What happens after you dismiss your voidwalker
c0jjm4,Getting back to the game
ckhacv,"Need help deciding on your class? My wife and I are making a series of class pros/cons, starting with Warrior!"
dj2zul,It was story time in Ironforge yesterday
d12ci0,Actual photo of the DDoS suspect
cvtq4h,"Not all Heros wear capes, ours wore a hoodie"
cnhyu0,"My latest poster art <3 I remember the first time i quested in the barrens, this is what WoW of old made me felt back then. A tribute to the upcoming wow classic."
ctnl2d,"the face you make when you realize Ironforge gets to be the true capital of the Alliance again, not that shitty Stormwind"
bs0h7g,Imagine participating in a stress test and being burthurt because you stress tested the server
d1d8a8,How to not miss a flight
d1enff,Nice Tap
dmut4c,It would be a shame to see him go to waste!
cwqwuj,Shout-out to the guild Gravediggers on Zandalar Tribe EU! Nothing like a level 10-30 battle 2 days after launch
cl2xok,"Stop Saying ""You're Going To Have Trouble Finding a Raid Spot"" Because It's Bulls**t"
bset97,Forgotten wisdom from a WoW strategy guide
cwoqfl,You know something is wrong with BFA when you jump out of your chair when these drop...
dmam6p,Isn’t this how life works?
cw1fs8,When you meet your future Soundcloud rapper-self
d1em5h,World PvP Interaction
c655mx,"2 months to launch and no final word on an RP-PVP server, let's make it to 1500 and hope Blizzard will reconsider!"
ctdbab,"So Joana locked his guides behind a paywall 5 days before Classic, so... Welcome to ALLYROUTE, Alliance 1-60 step by step leveling guide. Website AND In-game Addon versions. 100% Free."
d4yfvx,warrior vs mage
a16wwq,Unpopular opinion : The future of WoW classic
diogkt,Finally got to 40 and my mount. Onwards to the next big grind!
cvuvgn,A Toast to 15 Years
d382qp,Dat Warrior Life
dpawsj,My proudest PVP moment from someone who is bad at PVP.
cz4d27,"A few people stood arround a campfire in Goldshire for about 2h, more people joined, we talked about life , we laughed, we cried, until we left our guilds and formed a new one called ""Campfire"". This my friends, is World of WarCraft (someone has better pictures, sorry for low quality)."
dkysxh,"Alternatively, Killing 400 of the same mob because it's the only one you can find uncamped spawns for"
bru3ws,Let's gooo!! Grinding with my new friends on the beta!!
cyytey,"We just finished a long weekend full of laughs, frustration, junk food and memories that will last a lifetime! THANK YOU BLIZZARD!"
diflch,Just a very friendly guild
ddzybl,Thanks Reddit <3 Made 20g because of you!
cx3wnk,Explaining WoW Classic
cvnbvs,Thank you private servers for getting us here. A new dawn awaits.
czjc72,Me after 1 week of Classic.
cdfx13,Team #Nosleep
d31a2s,The boat to Theramore is lookin pretty lively. (US-Herod)
cyqsx0,To those people that run up and loot the chest while you’re killing the mobs that guard it: I hope you never find happiness.
cbcbhp,I bet I am not the only one who did this shit before loging off
cvylu8,Absolute unit of a number
dl9gq6,"I think I've got a reputation on my server, and that's pretty cool"
cwxqov,My experience so far
cnowfl,"Race to 60 - Choosing the right diapers. I know it's gross to talk about, but I've reviewed a few!"
ce49tb,"""Let's just wait until they pull another mob..."""
d0m5yb,I don't know why people do this.
btc0kr,"Some people aren't messing around. Yes, these are USB macro foot pedals."
d44884,"For the first time in years, I feel like I'm playing an MMO again."
cuh9ly,The hype is real boys!
ciio20,Nothing new
dqlojg,A streamer camped a lowlvl guildie. A day later we had a welcoming party for their MC raid!
cwjkzt,The Classic Experience
cr7ym4,Friends coming from different countries for a LAN party week of launch. 3D printed and painted meeting stones as gifts!
d05kp7,I just got drive by knock knocked.
coy0w3,I understand the purpose of layering in the open world - but wouldn't it be better if it at least was disabled in the big cities? Orgrimmar should be full of people right now - yet it's just so empty.
cw7knn,In honor of today's 22k long queue
cbwo97,[LocalDefense.] The Crossroads is under attack!
c9snip,Blizzard PLEASE bring back the old style damage text
d4xwiz,"[NSFW] When you give into your desires, but can't stop questing."
dsd0fh,"Level 1 guy has been at Kargath for several hours giving out Deviate Delights for donations or ""alliance blood"" to boost morale. True horde legend."
cr0lpt,r/classicwow is one of the top Growing Communities on Reddit
d01tjo,Who is Nijel and where is the rest of his basketball team?
cwowr6,Maximum Realm Capacity Increased – 28 August - WoW Classic General Discussion
donmwt,When you're 18 and 81 at the same time
bnh6vs,The Final Few Seconds of Vanilla
ddsfv9,Pro gamer tip: shouting increases your chances of winning rolls
cvlqt9,Coming Home
dlidx3,Every single party I join...
bwdlln,My vanilla wow experience as a warrior so far!
ckm02t,"Blizzard HQ, September 4."
cr3io8,"Classic WoW - Darkshire, by UnidColor at Deviantart"
dvz2s9,Joker suspended from method after the ninja incident.
dnhyck,When you get back from Ironforge and bring stuff home to RL - Happy Halloween
dgaj3f,"Late night leveling my new character in Dun Morogh, couldn't help but share this screencap."
dxuahq,The most OP ability for ally right now
d0gyrs,Anyone know why I can't pick this briarthorn?
dbcfcf,Do not log into your NA WoW account from Europe
d0yaai,“I’m telling you my character just turned and fell off”
dibicg,Horde not allowed to enter Dire Maul on Gehennas-EU
d07dim,Today I hit level 60.. while dead.
dsxq83,"Last night was the best raid night I’ve had in 15 years. Worked for months to get my small guild up and running, and yesterday we finally downed Ragnaros. May be a small achievement for some but I couldn’t be happier. I’m ecstatic so wanted to share!"
cz4rk4,Cooking as a hunter
dm6kaz,This
dbqnbf,Just everyday things in Ironforge
d930ci,"There are better reasons to play mage, than AOE farm."
c2oca1,Ding
dftta7,Came to Stonetalon to watch water elemental's hate to campfires
cwhfmf,Best thing about Classic. Normal Size Lore Characters
cpznfm,LF1 DPS
cwnnxl,Thanks Ace!
bv5qdu,Did some say...
cw8c3g,The greeting I got during the cinematic last night
ctvoi7,5 days / 4 sleeps till we all go home ladies and gents
cue2cw,I took out an ad to share my excitement about classic WoW :) It ran for a couple of hours (and cost less than a cup of coffee!)
curymh,This is all I want from Classic.
cypfq0,Stitches and the World of Loading Tips
cy8r04,When your friends asks you to gank alliance member before Phase 2
bqx476,100k Subs!!! We did it!
cxtcu8,"My night elf died on the RP server, but i've fully embraced my new vocation as a wisp, gathering wood for my faction ! (Please tell me it's not a too obscure reference)"
d6w02d,CRITICAL BUG: Crits do not deal damage to absorbs
d2xpn0,I think all the classes are pretty neat.
d5y2j9,How not to advertise your guild.
cwqfs9,Barrens chat never disappoints!
cz09tj,I accomplished my goal! Server first 60 Shaman on Stalagg!
d4ddv5,Planet fitness bans all paladins
dqd76l,Naughty secrets!
br4msh,When my friends say they're going to play Classic WoW with me...
drthf3,Finally hit lvl 60!!
d1rrcv,“Say it again louder for the people in the back!”
d1rol4,When another mage comes to your farming spot
cyt71l,Any fellow weebs?
dvglcm,"""A Classic Journey - Alliance - Part I - A Threat Within"" by Valdihr"
cxg7ux,How it feels to finally find veins
d06gzu,Blue post about layering issues.
dei94r,[Suggestion] Give the fine folk of Tinker Town alchemy lab tables they can actually work at
c6agj3,A reminder to control yourselves.
bz9ygy,Can't wait to enter the SM.
dhc029,A WoW-Machinima I made - The Log-in Queue
bq5rxj,Can someone explain this discrepancy in mob damage between vanilla and classic beta (200% difference)?
d5hbax,"If you steal a mining node while someone is standing next to it fighting, I hope you accidentally step in something wet every time you put socks on."
dd9sf7,"I hit level 40 as a total noob with only 76g. A level 60 warlock whispered me in STV and asked me how much I needed for my mount. Thank you, Onithruster. I love this community"
d3qwgk,"We haven't spoken in almost 8 years, randomly got into a group together, were on the same server, and doing the same quest. We had no form of contact and he remembered my RL name/character. That is just pure awesome. Anyone else have something like this happen?"
ctggma,So hyped for classic I forgot I'm not an artist
df3t5g,Rogues are the most overpowered class. It's a fact.
d41g01,This asshole just refused to speed up or get out of the way
cz6wv6,Bringing a Night Elf to Stormwind (in ~100 seconds)
dbp926,Jumping across every river in Azeroth.
dbv4qj,I was training my lvl 22 skills when I realized you need to SCROLL DOWN for the other skill trees
czyfr6,The true Capital of Alliance art: Connor Sheehan.
cz45j8,Leveling A Warrior
dtq6m3,Constantly.
cls09j,"I met Chris Metzen today, and it was everything I always hoped it would be!"
