post_id,title
cyf3cv,"I joined a Dwarf only guild a couple days ago. It took them a while to find out I was an Elf, only just got kicked yesterday. :("
c2ipdh,I prefer the Classic
cnovht,"In honor of the upcoming launch of Classic, here is the original Bloodscalp server that I played on for many years, still in the package!"
cxnuwj,Has this been done yet?
d7qetu,"He can't be that stupid, he can't be... he's that stupid."
dd6dbb,"After a few hours of farming to get the last 12 gold I needed for my mount, I hearthed back to town with full bags assuming selling everything in them would finally give me enough for my mount...."
boayol,Key & Peele meme takes on the Classic WoW Zones
d186cl,"So, not only did RNGesus decide to have all four six slot bags drop in the span of an hour and a half, but all the bags are different colors too."
dp661v,When the guild finds out you can 10-man the levelling dungeons
cwywnp,Bro... I missed this atmosphere so much.....
czn9jp,PSA to Hunters: Grab the Staff of Conjuring in Dead Mines. You can use it to summon endless free food for your pet if it eats bread.
cz5iqa,"Meet Questless, my mob-grinding locked Ultimate Ironman"
cyd0r7,My girlfriend wanted to go to the beach... (I know I screwed up the towers)
dxmdei,Safe spot!
dusizg,Don’t rush to 60 for Phase 2
cqubg8,Come on...come on....
ca7pkr,The Priest can cast their own dang innervate.
d2565j,I am a traitor to the Horde
cxl7pk,It’s interesting how much more proud I am over how my Level 24 looks than any of my max level retail characters in recent memory.
bhchhu,I drew this in anticipation
ahpa31,Don't take it too serious but let's be real here
c4woy4,Classic Beta animations and visuals bugs
cy9pjx,Who cares about world first Rag and Ony. Look what I got
d4sxqv,Got a laugh out of this one the other night
cxwywo,"During times of war, some look for peace"
bafpii,It do be like that
cbz6b9,30 to 40 is going to be fun.
bwve02,me_irl
d4g7ug,I'm only level 38 and this is the proudest I've ever been to complete an armor set in WoW
d6v3kh,True dedication
czgync,LPT: Use fear to punish players who behave poorly
cwj02m,Me as a Druid in Classic
ctjj2o,Don't forget to report Gold Sellers Power Leveling services etc.
cz3aql,Tip for new priests who may not be aware...
covqj1,I just got layered and forced to start a new group
dklksn,You will get nothing and you will like it
byjcyp,The magic of getting your first shoulders
bok2r5,Mark Your Calendars: WoW Classic Launch and Testing Schedule
dy61ey,Classic WoW Audience
d4pgon,Priest MC on boat - Karma is a bitch
d1vq51,"PSA: You can dance whilst wanding, leveling a priest is a celebration"
ctjok1,Hilarious and very confusing
czgxws,"My wife, who barely ever plays video games, this morning when I went to work... I even offered her the Battlestation but she prefers the cozyness of the armchair. Thank you Blizz."
db2pwe,I'm broke but boy I am sure fancy
c11lf4,Level 20 Mage training has to be the best spells at any given level for any class
cxj58q,When you ding level 10 on a lock
bmxoih,Summer is in less than a month
djrfar,"As I watched the new SnackBox video, it suddenly dawned on me that Ricardo was in Scarlet Monastery all along."
d6j5p4,Biggest lie in the game
d567f1,"Hey :) I noticed you were not in a guild. Would you like to be? We are fully fleshing out our raid team, and have a healthy interest in world PvP on the side."
cyobww,"General chat, never change."
ce06ck,We all have that one friend
d9ss28,When you want the screenshot after a 23 man kill but the mage skins the boss
d04z6d,"From someone in General chat yesterday. r/Showerthoughts, WoW edition."
co7e1n,Herod
dbad5d,Dont start fights in wrong places
cxz7eo,Peek-a-boo
bn53ip,"Felt cute, might drink some Mountain Dew later idk"
d6bib8,"Shoutouts to Laer Stepperunner in Thousand Needles, using a baguette for an offhand as the only Tauren Rogue in the game"
cwqm8w,I'm really happy with my character names.
d2vhae,What talking to the other faction looks like
dc8kho,It happened! Deathcharger's Reins on Zandalar Tribe!
cw7zda,Next level - off to the gym and checking in once in a while on mobile.
df5ao8,AH Drama!!
cfy5fl,When the reality looks better than the expectation you know you play vanilla
btyl3g,Let me out of westfall already
czzmur,Those rare moments while leveling where your gear actually makes you look like your class (Warlock) is supposed to.
cszhr5,When your friends tell you they are rolling ally
br86ov,Elite Damage is Way Off (Evidence)
9uojdl,The only sharding in the game I want to see
cudu3d,ms paint: boating anxiety
d1p923,Somebody recreated Stormwind in Unreal
d8dkor,"""A Classic Journey Part X - Elixir of Agony"" by Valdihr"
d8n5aq,"""Lapdogs! All of you..."" - Patreon Reward from Valdihr"
d21tvq,Bring Back 'Screenshot Of The Day' !
cz0jq4,Gotta get those quests done
db9nhd,How to run off the Glow effect -
d0qmxb,Raced a Shaman from the zeppelin in Brill to the Undercity door and he sent me this in the mail later..
d5unf6,Not today scum rogue!!
a8wfy2,A picture of me playing WoW in 2006
c56sh0,"Leg movement fixed, Rogue stealth fixed, several Hunter pets fixed, right-click report removed, suggest invite removed...I mean, EXCEPT possible layer hoping (which will probably be fixed)...WHAT THE HELL are we going to talk on this sub for the next 2 months?"
bkkuj4,Title
bel7dy,People who will play classic at work be like...
d9nxg9,How to PvP against Hunters
bo3uez,Everyone seems to be so sure that there will be Beta...
cbv7ac,Every seconds put into this made me pass time faster waiting for classic
b46ry6,Loot Trading in Classic
cx34rb,My life flashed before my eyes.
cvfkw2,"Since launch is hours away I thought I'd post my wooden replica of my favorite weapon in any video game. It's over 5 feet tall and weighs over 40 lbs. [Sulfuras, Hand of Ragnaros]"
a0otqa,Revisiting an Old Prophecy
d4sxyg,They're currently planning a fight.
co65uz,"Alliance version poster, hope you like it! <3"
ctgf26,People trying to make Joana out to be the bad guy - f* off
d6hqri,Uhh... First time trying out the Gnomish Death Ray and this happened
db4y4p,"Loot from 1,000 Scalding Whelp"
d69hhq,I achieved my first major classic goal today :)
dqd820,An epic moment ruined
dlc6pc,Again?
coyhf4,Layer Switched Instantly When I Ran to Orgrimmar
cs0w9k,It's just nostalgia guys
cv8o6z,The sad truth about fury warriors
d8ktdc,WE LIVE IN A SOCIETY
ctxssw,"Its entirely your own decision, but i would recommend that unless you are rushing to endgame for some reason, you dont use a leveling guide and instead just take your time and make your own journey."
cpwnow,So everyone is going to use Ventrilo for classic right?
ddtfuc,I feel ripped off.
dd75ls,A Bunch of Idiots DESTROYS asmongold raid in wpvp
d6llix,Never been so stressed seeing alliance players in my life
becaqp,[MrGM] WOW_CLASSIC_BETA just went up on the Blizzard CDN (Content Delivery Network).
d6ejul,"""A Classic Journey Part VIII - Satyr Horns"" by Valdihr"
dwb4bg,Jokerd booted from Method
d1ncy0,Salty
cwn1al,You guys use baby monitors to watch the que....I use my baby.
ddqz7q,Rogues will understand
cbk4ry,Literally every time I'm in STV.
d9z8og,Thogg
bm66ei,Every time Blizzard comes with a new bluepost..
cvk8k0,Just reminding my friends of what's to come
cy5e19,They are starting to leave
c3cjtt,Sodapoppin gets ganked and simply changes layer to avoid being ganked again
cw3j0w,Im really enjoying Wow Classic lads!
dawly3,Finally got my armor to match.
cf5bri,Remember guys when you find a treasure chest in classic
d09eqi,Actually laughed when I read this... Posting for my horde brothers who would've missed it
byhu6u,Hope this meme isn't dead yet
czkfvs,Missing attacks should generate rage for Warriors. I feel absolutely FURIOUS whenever one of my attacks misses.
c6okz4,Painting of the greatest city in Warcraft
dot4k8,Why are people like this?
c85k1h,When Vanilla players meet Retail players in Classic! 😂... My last Post was removed due to Rule 7.. I hope this is good enough for ya..
bxsmnd,Hating streamers is alright as long as you're creative [Fixed]
dhp2lk,Objectively the best
cv3sxd,"This new ""World of Warcraft"" game better be amazing after being delayed for 16 years."
ddpq0s,Anyone seen Fozruk?
d5nek2,"Yup, this is classic alright!"
cvtu7p,Starting wow with friends that have already played
b6kklr,Spell Batching in Classic
ctk9iw,Classic WoW Login Screen - Original Art By Espenartman
d5wdgv,"Opinion: If they go for Classic+, Uldum MUST be a new raid/zone. It's so mysterious!"
d3lnw6,"""A Classic Journey Part V: Wailing Caverns"" by Valdihr"
d4lsf8,"Got tired of looking for an RP fishing guild, so I made my own: the <Master Baiters>"
dcrd3h,Today was a good day for the bank account
bsy6ai,Some oldie post that I thought would fit here
cmxjx7,"""What debuff frustrates you the most"""
dw4fkd,How are you bird?
d6btoy,When you fly over The Barrens
cvlryk,Me and my Bois in about 12 hours
bplxlk,Retail streamer -> Classic Beta
bawa65,Classic pvp content plan
bujmg1,Can't wait for this BIS Trinket to make its glorious return
cwlt8p,When you've been in the queue for 4 hours but just want to play
d52e7b,How it feels like once you unlock soulfire as warlock in vanilla.
d8co24,My fourth Classic comic! Sometimes I wonder what it must be like for retail players trying Classic for the first time.
by5bvo,"When Classic releases: remember guys, everything in moderation!"
dxeurv,Found at Rock Bottom Brewing in Indianapolis
bpvd6z,Esfand IQ500
b2ocz9,Thanks I guess?....
cz5wuz,Anyone else been on that mage AoE grind?
bv19sl,Horde attempt to form a Pentagram to summon a GM
cy4sg6,Westfall chat right now
d9pea0,"""A Classic Journey Part XI - Shadowfang Keep"" by Valdihr"
dli8lu,My girlfriend is getting used to playing warlock
cpldjj,Everyone today...
cpwg9b,A thorough analysis of chair counts in all major cities
cx0lkb,All these hardcore roleplayers on Normal Realms
da2mw2,"30 seconds prior, I helped them kill an elite they pulled. They turned their backs on me and would soon regret it."
a6sg3x,"Me, Summer 2019"
degs0j,I always wonder what people like this are like in real life...
cuxjuz,Beginners guide to optimized spell casting
cuoewy,Who else wished this came out before Classic?
9uhrtq,/oom
cu9on8,In just under 4 days we press F
d6wt92,The best compliment a tank can get
