post_id,title
d41nun,just lost nightblade on a tie roll
d0bycm,This one hit close to home (Full Circle).
d270g6,That moment your first shoulders drop... grey item but still so happy!
csa1am,Classic fishing map my wife made of Kalimdor
cu9oa8,The adventurers are gathering! Hope you like it <3 Classic is around the corner *.*
c3qfv2,"My mates and I August 26, 2019"
cuo15p,One reason to play Alliance
dedzrs,"2 weeks ago, I helped someone get his lvl 40 mount, he asked for 40g and I gave him 55, just so he doesn't hit 0 gold. and today he returned it as 100g."
bhxuny,Post raid logs banter
bpjec1,Asmongold WOW Classic (BETA) Deadmines run gets 100k views on Twitch
d41kae,Won Nightblade on a tie roll
9tsidk,The thing that concerns me more than sharding
cpd7sv,Blizzard knows more than you
c233kw,Durotar - first day of Classic
bp2c6u,"""Twitch WoW Classic stream"" starter pack"
cvec89,We are in the endgame now.
cz7bco,"Oh Barrens Chat, how I've missed you..."
d3nzjp,High Inquisitior Whitemane by Narga cosplay
bkpp0t,And I couldn't be happier
ccpab5,"Back when one mob was a fight for your life, and orange level was scary!"
c7vkw9,It be that way
d11gze,Prevenge
c9d7ro,My beta application in a nutshell
cw07yy,My New-to-WoW friend wondered why his equipped gear wasn't showing up on his character
cptikj,Now That We All Have Our Names Reserved
d1c2mv,The beauty of Classic: found someone out in the world wearing shoulders made & auctioned by me
dkzjym,When you meet a fellow WoW/pun lover ...
azv3g6,Classic Content Plan
c8lwsf,Language-Specific servers confirmed for Europe
d8bpvu,"Thanks, I guess.."
d11zaq,"I explained the DDOS attack to my little brother as “zombie computers” attacking the servers, he proceeded to draw this"
d93bu3,"Who wants to play a game called ""Sweet Nectar or Bleach?"""
d1s9nu,When you're lvl 37 and trying to tank Scarlett Commander Mograine
cktck2,Looks like Twitch has changed the WoW icon :)
cx0qc0,Classic community is the best community
c0bral,"In preparation for Classic, I felt compelled to paint the greatest city in Warcraft [ x-post from r/wow by Conpatshe]"
cpjehz,Name reservation rage thread
bzineq,Infographic on Differences Between Classic WoW & Modern WoW
cxle0m,Blizzard seeing that guy hit level 60
buhmpa,Only you can defeat yourself
cr62mx,Nice to see Blizz having fun with the Classic advertising (FB)
cxd6zp,My friend offended a Dwarf RP guild
cr7qmi,Petition to move Mankrik's wife to unknown location
c3apkh,"I loved u/Conpatshe's Ironforge paitning, so I hung it above my desk"
d0geky,"My friend: ""My internet went out from the storm, am I in a safe place?"""
cmj4n4,Please be toxic
c4mb5g,Time travel
d8g9a9,I think i just found the best glitch ever
ci8zfe,"My friends laughed at me, my parents disowned me, but I kept my ZBoard ready for just this moment... Anyone else dumb enough to buy one of these bad boys back in the day?"
btl4g8,Rate my setup
bwqcpf,All I can picture when I think of WoW classic
czlpd0,To The Warlock Gnome Known as Crysis...
cg3fs7,petition to keep cringey posts banned so we don't devolve into /r/wow
drpnxz,I was today years old when I realised the trinket slot icon is an earring
cxmjhg,As a Skinner seeing all the animal corpses people leave behind in The Barrens.
cq6fn8,"Many people were asking for a high-res scan of my Druid Leveling Sheet, so here it is! (Even made some corrections, thanks everyone for pointing out various flaws :)"
cqg8jo,High Fantasy RPG Character Creation
d1q9ae,A tutorial on how to successfully share your World of Warcraft Classic memories with fellow redditors in one image. You're welcome.
dan9l6,that just happened
d3da08,Just witnessed this absolute legend
d9nv0k,"me horde, me smash"
c3lmjb,Classic WoW Has Ruined Current WoW For Me
cthqnh,When you're an '05 Stranglethorn veteran and you empathize with what the first-timers are about to endure
dt959u,Un'goro world chat at 4 AM
d2jw60,"Guys only want one thing, and its fucking disgusting."
cvpp3o,World of Warcraft has surpassed Fortnite in Google searches for the first time since Fortnite's release! All hail Classic Hype!
dixfr8,Now that's Biizzare...
bb9rzm,When your party isn't looting beasts
bqfg8u,when you finally get to play a 15 year old game everyone keeps telling you you're not going to enjoy for a 2nd time
9vkqzj,Herbalism +1
cznmxq,Gotta level up mining.... ah ha ha..
bw0g9m,My cousin is an altoholic and keeps changing his mind on what to play for classic. I made this movie poster to motivate him.
d5sax3,oh my god antonio look out behind you its stitches oh by the light he cant hear us he has airpods in oh god
dd7zng,The synchronized triple 60
clbz25,"To cap off this weeks pros/cons art, here is Shaman!"
czi4d9,I dinged my warrior to 60 after 6 days 9 hours 4 minutes and 20 seconds
dftn1z,The WoW Classic Experience
cwzwt5,Clothies represent!
ddmo7e,I just want my Whirlwind axe man [Remastered]
d771xd,[Item Showcase] World First Hand of Ragnaros - <Senseless> - Firemaw EU!!! Congrats Kembria!!!
cgy1tm,we don't do that here
dndk88,All these posts about Toxic Try Hard guilds and our guild is all like...
cc8nqb,"I am not going to do one every day until launch, I promise"
cpgwbm,Sodapoppin speaks on the server most streamers will be choosing.
dgrvsh,Every Stratholme run
db6mni,When your leveling gear is aesthetically pleasing and optimal.
da3orr,Raid Leaders who don't tell PUG members of reserved loot are essentially ninja looters. Am I wrong?
cyug40,I miss college
c0rniu,you gotta do what you gotta do
dcvo1g,"""A Classic Journey Part XIII - Scarlet Monastery Graveyard"" by Valdihr"
d43zi8,How to log out in Undercity. The proper way.
cxag26,Met this gentleman earlier today. I love wow.
d94et4,Rogue gank attempt
d38274,how to make mr monkey real happy
dwe3w0,Prepare
c4hwno,"First time ever I will be playing WoW day one. No 1000s of 60s hanging about, no guild raids on city’s. empty AH, everyone at the same stage! I will be at the start of a ‘new‘ MMO world and that excites me more than anything. I cannot wait to shape this new era with you all!"
d6yh1o,Apparel by Georgio Amanih
d2vayl,I caught a Tiger with a tunafish sandwich!
cvgv1i,Had no idea Windows 10 had targeted wallpapers.. (Scarlet Monastery?)
d4io9k,"""A Classic Journey Part VI: Betrayal from Within"" by Valdihr"
cxenc9,Felt sick spending 1 gold training polearms by mistake at lvl 20. Then find this in a chest almost immediately after. Blizz gods have smiled on me.
cstni5,Superman knows what's up
cuuya7,"It’s official, amazon is going for alliance"
d05fjp,Nice
d040sx,The biggest pull in classic
dwofld,There's always a bigger fish
cw2mzo,This is how its done 😅 setup baby camera so u can watch movies downstairs
c1hadc,Pretty much
cx3pw6,Low effort server queue meme
d0pwg5,"World First Eye of Sulfuras by Venture-Flamelash (EU), also realm first kill on Ragnaros today!"
cpyou2,"In a desperate effort to bridge the remaining days til launch, I made myself a leveling sheet with useful info for my Druid. I think it only made the wait WORSE..."
ct6cwe,"Please Blizzard, let player corpses stay persistent!"
d4p3ls,Impressive
cvruzp,"Norwegian ISP was planing maintenance tonight, postponed it because of Classic"
bows9y,Sharding versus Layering
d38sbh,"Said ""me lo ve y o u' to a Horde and I was met with the most wholesome response a classic player can get"
bxwikk,Choosing a server on launch day
d6oaz4,Public official caught on camera denying a citizen the use of public transportation based on class
dfn8ck,I found my nemesis.
dddwbp,Voidwalker Comes Home from Work (Art by me)
czgkkj,RFK chat
dxbyw9,"The ""sounds like pvp happened on a pvp server"" starterpack"
d72dlg,Using terrain or buildings to avoid guards in neutral cities is officially against the rules [GM Whisper]
byubuv,Don't You Guys Have Phones?
c1ma0y,When the DPS tunnel vision and pulls another pack
bfo9xe,"PLEASE Blizzard, include the old weather & night effects in Classic. The difference in immersion and experience is massive."
cyx3ae,Finally got Ghost Wolf! It's so nice to not have to run.
ctud8d,The most horrifying sound you’ll hear next week at 15% hp
9yhk6l,This is why i love earlier versions of world of warcraft
d31kji,"Finally, my Tank is wearing Full Plate armor..."
d1vjxm,"Dear leveling warriors: Heroic Strike should rarely be used while soloing (and really, in general)"
brhrio,Let's gooo!! Finally got it.. had to re-download game -.-
cw1ptd,Main thing I've noticed on this subreddit is people don't know what this key is....
ddu0p6,The original Post Malone
cvjju2,"Funny video I made, I am by no means a meme warlock"
cz2f32,Just got a world drop!!
cv6r5p,Me realising everyones going to either be rushing engineering for pvp or gathering profesions for gold so I can make bank living the dream as a bag salesman
cofyu8,Asked Discord about showing WoW Classic instead of just WoW.
czmwl1,"Playing WoW Classic so I thought why not draw scenes with memorable quests and experiences? This first one is for Hana'zua, the troll bested by Sarkoth in the Valley of Trials."
ctc3aj,Squishy Jokes
d9897u,"I’m prepared to accept layering, but don’t take away my hot pants."
cy5usy,Worlds First Onyxia Kill! <APES>
da3ile,Never played WoW before Classic. Just got my first mount!
dc10ok,Classic
dbzmf1,"Noticed a level 44 warrior running yesterday, I gave tossed him 1g towards his mount and went on my way. Got this in the mail today!"
cd2sow,43 days left!
c8svzm,Esfand interviewing Venruki in-game.
dx56iz,3 Rogues vs 1 Venruki
cvrmd5,God speed to Night Elves doing 'The Run'
dd9fze,Too real
d5wwmq,"I was kicked of LBRS with less than 5000xp from lvl60 due to server restart, so I decided to pay Thrall a visit and ding 60 with the warchief"
dcxs8p,I’m a Captain in the US Army attending professional military education. Today we discussed best practices for operations and planning.
cnb9n3,Returning to the Hearth
dff4ya,The reddit discord is now banning all conversations regarding Blizzard's response to the HK player.
cvogj7,Dear college kids of WoW...
cf79qa,I made my playlist for grinding
bsl153,Thousand Needles.
cfqgev,"List of Irreplaceable Quest Rewards, and Choosing the 'Right' Quest Reward."
c40v5m,When You Hit Level 40... Proud Moment
cw7i5i,So EU now has a Queue for a queue
cxaogx,My life this week
by6w22,"With all the old vanilla screenshots from Photobucket. I present you, the only screenshot my 15 year old self deemed worthy of uploading."
ddo8n3,"""A Classic Journey Part XIV: Scarlet Monastery Armory"" by Valdihr feat. Herod face reveal"
d0ynm4,Immersion
d8fszn,Is this a lucrative business model? Lmao
cwg51m,*human aggro sound intensifies*
c31neb,Blizzard's response to the outrage of EU players about no language specific servers
d0zptn,Dug up an old painting I did of Judgement Armour on Iron Man
d1ojvr,"As a level 20 WoW newbie, I have just discovered that there is a tram between Stormwind and Ironforge."
cpvj1w,"Pope Francis blessing the Blizzard servers minutes before the name release. [Circa - 2019, Colorized]"
bjwlcm,Perfectly balanced.
btuacn,People are having more fun on a level 30 capped beta server than on a full scale retail sever with 15 years of content.
crpw9a,You think you do... but you don’t.
cw07cu,"26,000+ later.."
cu6ko8,Roll Need
d1ar11,Gotta find a way to make money
cuvvj6,Not leaving the house til 60! U.S. servers are up at midnight for us... time to ruin the sleep schedule!
cvmqlg,"PSA: Start the Southpark WoW Episode at 23:39 tonight and you will kick off the launch with Cartman saying his ""Now we can finally play the game""."
cxhpcb,"If WoW Classic has proven anything, it's that we don't seek instant gratification"
ac67sf,Please remember to use language that is inclusive of Classic players.
cviy3o,"Dear Devs, Goodluck Tomorrow!"
d1opik,Inspired from whatwouldrivendo’s screenshot
d87vav,Logged in and my pony was rainbow.
cwbxgh,TIL: you can use the hot coals in the military ward to cook food!
ctmq0w,Getting the playlist ready for a true authentic experience
cw8bkk,"The old weather effects were amazing. Fog and rain, they add so much to the atmosphere. Retail was dumbed down in everyway."
d7v007,Paladin PvP at its finest.
cz2q71,"After a weekend of gaming non-stop, this sums up my feelings."
co9n55,Me and the boys leaving BFA for Classic WoW in 16 days
d6vo9w,What is a smile?
drlci8,Don't let Phase 2 get to you.
dlw0wc,For /u/Ace_Throne and his lady love
dnswmj,Horde has a vastly superior questing experience over Alliance
cjiiye,2005-01-20 - A very confused Orc wondering what the heck he is watching
c48qed,Instance Portals
d9scka,AGAIN.
cwoy8o,Had my first 'you're on classic now' moment last night...
diuxb6,ive literally never died in wow
dbgv7h,"I work full time as a nurse, have a wife, and 3 kids but I just hit 40 last night with 98g in the bank in under 2 months. Praise my filthy casual achievement ye peasants"
cynr5w,Hardest Boss in Classic WoW
cvmvsd,Everyone here today.
dajs4z,Mages are the New Hunters - Change My Mind
d19syy,Gotta love when you get an all matching set while leveling
c0p6x7,Blizzard Bringing Back Original ‘World Of Warcraft’ So Thousands Of Gamers Can Relive Most Depressing Era Of Their Lives
d4v0fk,"With realm restarts, we're deploying a bugfix for the exploit that allowed instanced encounters to be completed repeatedly"
crk258,r/classicwow Top Growing In Gaming
cwvash,I was wrong
daw0qt,Your dungeon group in WoW Classic
bqjk7j,Let's gooo!! Finally made my character. The grind begins!
bxc4un,After running around Thunderbluff for 10 minutes looking for the zeppelin to org
cv0f3s,That one guy
bwiz5n,I am guilty
drfsxy,Learning to count with my raid
d1p0ji,"When there is no horde to group up with for your elite quest, so you ""group"" up with the alliance guy doing the quest and you take turns tagging the mobs. Ended up doing the whole elite chain with this alliance guy, on a PvP server - only communicating through emotes."
c6wmly,"Do NOT ask youtube what class you should play, they are all awesome!"
cfz2vh,We are two weeks away from reddit cringtopia!
bsty57,"Flight paths are very very bad in the beta, here's a comparison between the old flight paths and the beta ones"
cvooeo,I will be restarting the 1-60 Boar Challenge as promised.
d9gw8e,Going back to Shimmering Flats during peak hours after I post this. Wish me luck!
ctrxq3,Therapist: So where do you see yourself in two years? Me:
cddo86,according to this sub
cwgou8,RIP retail WoW 2004 - 2019
d5ty93,I still feel guilty about this
d3o3jn,Unlimited luck: got a pouch from the first mob I killed
d2mfk2,"""A Classic Journey Part IV: Lost in battle"" by Valdihr"
bkwmdz,Logos I made for each phase's highlights :)
d00kkt,The griffonmaster has to be joking...
dct8zr,"Realm Layering Update - 13 realms to single layer, every other realm down to 2."
ctjnpp,WoW® Classic with Creators
c2dz2d,Life after Classic Release
d25ta0,Finally completed my bank alt BIS
cu29ng,The character creation has been... difficult.
b3sy1w,As soon as you leave Elwynn..
9poemb,When you're a high lvl and decide to boost some lowbies through deadmines
bt2vjb,Let's gooo!! FINALLY killed Ragnaros with new friends!
d595mp,Friendly reminder that if you pull aggro off your tank to run TOWARDS your tank.
dq1ndl,My Guildie caught this awesome screenshot of Me and Onyxia as she died.
c37u22,My take on national servers.
cw296r,World of Queue
cw38l5,My spouse and I were the first people on Westfall server to visit the Dark Portal last night!
dcq39q,Let us not resort to our baser instincts-
bfw0xr,"Thought I’d share this photo, made me giggle"
bz0s66,My favorite zone of them all
dbwx7b,I dedicate this meme to all my fellow Arms Warriors
ch9cu0,Can’t find time for Classic? Make it!
co4cx3,Official Classic WoW NA Server List
d57zjp,"Sat on top of a gnome today, turned into a pretty amazing facelift"
cp8zgq,A word of warning about /world in classic
d2ogly,"Got bored waiting in queue, thought up some new specs (guys these aren't serious suggestions, just for fun)"
czyoyg,I can now go to sleep...
d823an,Accidentally charged people for mage water
cu0k2f,"Blizzard needs to ban this ""ClassicLFG"" addons (and more)"
bpq6oc,"Thank you, Nostalrius."
d01qwx,I can't be the only one keeping track for later. Is anyone else this petty?
c1zgcs,Can't decide!
d21if8,Gnomeregan in a nutshell
dabpdz,Grobbulus (Horde) has its own <Uber> summoning service; do other realms have people doing things like this?
dah0wi,Hunters. Hunter never change...
c8n06j,Denial is not just a river in Kalimdor.
bg0vsu,When you’re a level 60 farming mats out in the world and a level 47 rogue /waves at you
blc5iw,What waiting for classic feels like
cd7gep,"Oh, I'm sorry, I thought this was Azeroth."
d3gr4w,WoW Classic is so popular it's holding up the developers of other video games due to programmers taking time off work.
butjwy,A sea of stress testers at Stormwind gates last night
d6etnl,My heart skipped a beat...
dg4pdu,What I do when I am waiting for a tank
cs4y8t,Why everyone hate Hunters.
cotprm,Cross REALM**** (So sorry) Whispering In the Third Classic WoW Stress Test.
bx0i98,"one last time, let's do this"
d2e1l0,You never know when the knowledge you've possessed would come in handy
brvv5b,Spending the next 2 hours unsuccessfully attempting to login and create a character so everything goes smoothly during actual launch
cuefc5,That little something I missed a lot
bqsbdd,It was high quality world pvp
cybd8k,Total satisfaction
cutqj1,Vanish
d3dnh0,I love the little details in this game. Kodo spirits spawn at the Kodo Graveyard in Desolace that you can see while dead.
cyi1r4,10man dungeon farming NERFED
d4v9x3,I've missed the disco cave
awgt88,Prototype for a more interactive bis-list viewer
cw2yrm,After years of playing I met my soul mate during the classic launch.
d7edto,So you mean to tell me we're sailing through two land masses and don't realize they're there?
czxs2m,The journey begins
cbno8f,Everytime
bt6zwd,warrior life
brwyef,>When you finally get in the beta to play with your favorite streamer
d8do2w,Thought this was hilarious
dhyu3w,So nice to see new people enjoy the game as well.
bh1mzd,"""That One Friendly Guy on Your Server"" Starter Pack"
dbcyqe,My revised cheat sheet of all your characters vocal emotes
d0jocd,Your Two-Handed Axes skill has increased to 2
d6tyrw,Honesty: 100
d1hgmx,Somebody got too immersed.
d3657n,Ragged John wants to do WHAT to me?
bqhv8w,Only 3 months until the true faction leaders return!
djczc2,When the Fear hits just right
ddvpa5,The last thing a craft Thunderbrew IPA sees before it dies...
ducyo6,Justice for Taurens! We cannot fit thru many Horde doorways while mounted
d5m114,Classic flight paths be like
djh1g1,Layering in a nutshell
dhoczf,"The ship was full of skull level hordes. I decided to travel in third class, for safety."
dg1en3,I've met my match
czcztu,Literally just my level 33 Rogue.
cgiw8a,Made this Stormwind hanging sign out of insulation foam for my WoW wall!
d54pyq,If you were exploiting layers in instances then you deserve a perma-ban
cj9i2y,Are you all ready for this?
cwe806,My friend drew all the classes after I tried to explain them
dr980g,"Coldgrin's journal, Day 20. I have slain more gnomes than I can count. On some cold nights, I despair, and long to return to my steamy jungle. But I am reinvigorated by my compatriots, fellow vengeful Frostmane. Together we have banded together to defend our frosty troll-hole in Coldridge Valley."
dls0ij,"Fishing knows no faction, neither does true love."
cxi8ql,Hmmmmm
cwic46,"WoW Classic Queue Progression chart (2019, Colorized)"
czzjkc,Two crazy people took Teremus the Devourer from the Blasted Lands to the Throne Room (server Firemaw).
cwzri5,Got to admire the hustle...
dhtrm1,"Found this on the forums, did not expect this as the only reply (Not mine ofc)"
c0wcj1,Watching the cool kids test AV this weekend.
c5pqgi,All the factions with rep in classic wow
drd72f,Our first guild raid dungeon run. We are all so happy that our Troll only guild is finally complete.
czoplt,High Elves/Blood Elves in Classic be like... Just you wait 15 years
d9wc9v,When I see people in Desolace asking for Rexxar
cueajv,Oh No....
cr5pdv,Blizzard Bringing Back Original ‘World Of Warcraft’ So Thousands Of Gamers Can Relive Most Depressing Era Of Their Lives
bv6soq,Just what I needed
dfcd2q,Planning to buy my epic kodo tonight.. didn't work out the way I planned.
dqhc86,When the UBRS grind gets too real
bws2ta,83 Days 14 Hrs
d9hulw,Guns skill 1/300
bu4v2v,My wallpaper from middle school.
domiao,"Unpopular opinion: the Tier 0.5 sets and World PvP objectives should be Phase 2, not Phase 5 and 6"
dmjwmx,Helped someone with part of the Rok'Dhelar chain and thought their response was great
cpkpk7,The Virgin Asmongold vs the Chad Alexensual
bzo9en,How dare my mom try to sell this for $0.75
d3po82,Guys only want one thing and it's f**king disgusting
bs4rj1,The emptiness
cyyeca,Name a better duo (This can't be a coincidence right? xd)
dclqse,Ninja logic
cvqz7i,/cry in wow classic
cdpp8x,"Testing the water with this, thoughts?"
dge92t,Spotted On Pagle in Kharanos. They've got a long way to go to Blackrock mountain...
d50aiu,Modern problems require modern solutions
cyxrur,Pass on the /nod
d0a2ru,"I asked my Voidwalker if he preferred retail or classic, he's sensitive about his lisp. (xpost from r/wow)"
ctzx3y,ms paint of this one time i got ganked in ratchet
d5dvfa,Someone come pick up their orc please 😁 #Whitemanerealm
cxhugq,The bombs are fun but...
cxd8oa,Here’s to the only mmo without a cash shop in 2019
cwy0mu,Oceanic Server Update
cpljqw,Got my name before someone snagged it!
cvsp4u,BFA Today
d20mym,Not so fast!
bvn72a,Then and now... and now again
d36st9,To the dwarf priest who posted a couple days ago about being able to dance while using your wand: I must thank you. I look so goofy every time I wand now and it's made for quite a few laughs already. =D
cv8wuq,When A PVE Player Plays On A PVP Realm
ck7mic,My wife is very supportive of classic
cpkq20,Better luck next time guys.
cl0ra6,Old skool boiiiis
chzuot,I present you the daily r/classicwow Buzzword-Bingo! (I am not good at graphics)
dwevol,When you stumble upon an AFK Elf in Shadowmeld
dvbk3v,🦀Layering is gone 🦀
bgkldf,Day 1 of WoW classic
d3iafv,"A very useful map, when you need to decide where to go next."
czmpy8,This Game is Beautiful Sometimes.
d1djcp,My warrior just reached lvl 26 and got his first head gear...
dtygzt,Don't let those airlines scam you.
b7wqy3,When you're a lvl 22 human questing in duskwood
ctjt6z,Have you ever...
bzumr0,The truth
brn9ut,Played me like a damn fiddle blizzard
d3b0uv,"""Sweet I finally got that huge weapon upgrade!"""
cmo645,My friend is away for the weekend of 30th. I made him this - thought you guys might like it.
d70sgm,This is fine
bq1ult,Behold our saviour ... 'Omar Gonzalez' Classic WoW Dev
d3lgl6,Please stop asking for the future of wow classic
c2ajx1,Don't forget to play this while PvPing to get the full Vanilla experience.
b69n1j,We all have this indecisive friend
dr5p5p,Get you an Orc who can do both.
d61mhq,Grand Theft Egg. It's good being a rogue
bs6mxw,Gather Around Vanilla Newbies. Let Me Warn You About The Not-So-Much-Talked-About 40-Man Guild Killer: Blackwing Lair. I'm Here To Warn You It Will Resurface Itself Soon To Destroy Your Guild.
dtvrfi,Denmark Shaman
cxfnsj,Horde hunters in a nutshell (OC)
be656j,IRL Azeroth
cv8ydx,"Prepare yourself, Druids..."
bq46sj,Laughed way too hard at this
dn1xse,Imagine getting bent out of shape over 40s
bvi1m6,Visually clearly the most beautiful zone in WoW Classic! What do you think is the prettiest zone?
ctxeyh,"My friend's wife reached out to me for advice on a Classic launch gift for him, I may have blown his cover..."
bubw5i,Amazing old wallpaper
bwnvxk,Soon...
dvv7w7,"Just chilling in Orgrimmar, getting ready for Ony buff when I see this in chat... [EU Firemaw]"
9q8gvs,Real talk
bxk6cd,I've printed this screenshot of my Paladin back in vanilla and kept it since..
crpg5d,My face on launch day after I stayed up all night to log in to my server only to see that there's a 40.000+ queue.
ceg4nx,A reminder for those of you who have recently started families.
dsgz2v,Unacceptable amounts of lag during large scale PvP
9tmwev,RELEASE - SUMMER 2019
d3nlst,Times are tough
d0fhq3,Truth Hurts
cvmg0o,"My friend painted my druid, Fluffball."
czs1rd,Classics really bringing the family together.
cwqwox,2019 Barrens Chat has evolved.
bw5vgu,Discovering flight paths naturally maps your progress and it feels so rewarding!
dq5ncb,Grobbulus RPPVP has its own known guild territory structure; do other realms have anything like this?
cxwofb,Giving back to other players.
cu297l,“Zhevra Hooves 0/4”
dff5rb,Wasting life mid day mining
d3da8z,So close yet so far...
dfj706,BiS raid trinket
dauejp,My guildie has the power to summon people IRL
9w7pzy,when a lvl 60 horde visits redridge
czl2ba,Level 39 Lil’ Herod
c25d5o,How I choose to self identify.
cwfq62,This week is the last time in your life you will see this place without any mounts running around (and probably also first time)
cdh7pc,"When you want to play Ret Paladin, but your Guild Leader wants serious progression."
c2spns,Bubble + hs
cro5du,I wanna play Ion the gnome.
czx5gi,<Storm> - Herod server first rag kill
cmyswr,When your friend says he’s goin Alliance for Classic
dhtin4,My journey from 1-60 in a video of screenshots
deyuur,PSA: Tab targeting function that I never knew existed even after 15 years of playing WoW...
dg6w9d,I know most helms look pretty wonky on Taurens but the Deepdive Helmet is just on a completely different level
cyzgfu,"As an herbalist, I feel like a golden retriever sometimes"
cv6gxq,"No goblin gliders in Classic, so be prepared!"
bzvzqs,The BOARing Quest - Update
