post_id,title
dewyi2,Pro-German French snipers open fire on General De Gaulle's victory parade in Paris (1944)
dsd4mj,Entrenched Rebels vs overwhelming firepower
bwclnw,"[WWII] Soldiers of the U.S. 7th Infantry Division loaded a shell in a small mortar for launch against Japanese machine gun and sniper positions on Attu, Alaska, USA during the Battle of Attu (May 1943)"
bg4ywq,[WW2] Beaufighters strafing German Destroyers and merchant ships during an air raid. 1944.
avg8mr,[Vietnam] US Plane drops 6+ Napalm and White Phosphorus bombs on a series of huts.
8hktz6,Finnish soldiers using a slingshot to fire grenades at Soviet troops during the Winter War
bqgxhj,Screenshot from a video of armored bulldozers from the Philippine Army clearing the streets of Marawi of debris so that the combat units of the AFP can safely maneuver inside the Main Battle Area. One of the bulldozers here is fondly called Megatron. 2017 [1137x640]
9g8woa,Having fun on the battlefield
dagy70,First lieutenant Walther M. Baskin of the 361st FS in his P-47 Thunderbolt hard on the tail of a Fw 190 on January 14th 1945
cqy1og,Syrian Hezbollah fighters are cornered and killed by ISIS militants in Abu Kamal (November 2017)
8oh8p5,"German soldiers coming under artillery fire, 1942"
b4yx68,[Vietnam] Low Level bombing runs on enemy concentrations.
alfddo,"[Chechnya] A Russian military transport runs over an IED, a soldier emerges out on fire and is finished off with rifle fire."
91099v,HMS Barham Explodes and sinks after being struck by a German U-331 off the Egyptian coast. Killing 862 of her crew.
duse0v,"Group of 18 years old Houthis rebels lands accurate mortar fire on a yemeni outpost and loot what's left behind. Jizan, september 2019."
afxmkr,[Vietnam] US Marines carry a wounded Marine to a med evac chopper under heavy enemy fire.
clgpmq,Excellent Vietnam war bombing footage from Operation Linebacker
b0p9ei,"[Vietnam] US Soldiers kill three Vietcong Soldiers, they then proceed to place an Ace Of Spades card in their mouths after searching them. Operation Baker."
5pzd94,Abrams commander killed by drone-bomb in Mosul
d9okye,Outgoing tracer fire invites an immediate response - Ukraine 2015
96z7am,[Vietnam] US Army soldiers pull a deceased comrade into cover under fire.
dcq55o,FSA technical puts rounds danger close to fleeing SAA fighters near Aleppo - 2015
b80xaq,Kurdish forces raid IS sleeper cell in Syria | October 2018
873p6w,"Patriot missle fail, Riyadh 25 March 2018"
bxb64l,Syrian rebels fire an elaborate but inaccurate homemade MLRS system towards Gov. positions - 2013
dbyk3y,"[Iraq] US Marines take casualties as accurate machine gun and sniper fire hits their position during a firefight. Operation Vigilant Resolve. Fallujah, Iraq. April 26th, 2004."
ah1hle,"Can't believe I've never seen this A-10 gun footage before, especially as you can actually *see* the effects on target. JTAC sounds stressed AF, but hogs save his ass. [Afghanistan, CAS]"
bb9ddu,Al-Nusra militants attempting to assault an apartment building are caught in the open and killed in Aleppo [2015]
axs919,Syrian tank violently cooks off after a TOW missile hit outside of Aleppo - 12/7/2015
bbm14j,"NVA mortars almost kill US soldiers in South Vietnam, 1968"
a7zt8w,"[Afghanistan] US Marines engage Taliban fighters, LCpl Sharp his hit by enemy fire, the Marines carry LCpl Sharp to cover where he later died."
c26uod,Syria: footage purportedly shot today showing Rebels attacking a Regime position on N.Hama front nearly killed by shell.
chvqey,Algerian patrol is brutally ambushed by AQIM insurgents
db8f83,Video of Houthi drone and missile attack on Aramco oil plant in Saudi Arabia. Source 60 minutes
51byyh,"U.S. Marine Sergeant William Bee from the 24th Marine Expeditionary Unit has a close call after Taliban fighters opened fire near Garmser, Helmand Province. (2008) [3443 × 2588]"
cebe41,"Influenced by the post from u/CraftsyDad. Here is my entry of the Pre-invasion Bombing of Pointe Du Hoc by 9th Airforce Bombers, France 1944. Partially Overlayed on modern Maps."
8aazgj,"The commander of a tiger tank that has previously been directly hit in the barrel by a shell fired from a Russian T-34, examines the damage with fellow officers who look a little confused and amused if you ask me"
aqtwq3,"Compilation video of various airstrikes, gunruns on Taliban targets in Upper Gereshk Valley, Afghanistan (2011)"
a4hlzy,HTS Militant Gets Shot in The Head While Rushing Enemy Positions
6id0ph,British airman bails out of his stricken Bristol Blenheim in the nick of time near an Italian position during Operation Crusader - Winter 1941 [gif]
dfq9p2,"May 2016: Peshmerga giving an Islamic State fighter medical care right after 20 of his friends got killed in a firefight. From the author of ""Blood Makes The Grass Grow"" Instagram account."
cx0bjo,Opposition fighters displace after a Russian airstrike hits their building - SAA Offensives - August 2019
b3bf47,"101st airborne search and destroy mission, South Vietnam (Most realistic Vietnam war footage I have seen)"
cfaoy7,[Chechnya] Chechen Mujahideen use a VBIED to take out a Russian supply column. Second Chechen War.
bj5s3d,Leopard2a4 engaging isis positions during Operation Euphrates Shield 2016
b45af0,AC-130 hitting Daesh positions under Jabal Baghuz last night
ce2gg0,"Photo of a massive British creeping artillery barrage in Méteren, France, during World War 1, August 18, 1918. By John Warwick Brooke."
9vvmdw,[WW2] US Army Soldiers hitting the beaches of southern France.
a3jai0,Brutal IS VBIED filled with giant ball bearings used in Syria - 2014
bju2dp,203mm artillery barrage on isis positions Operation Euphrates Shield 2016
b8qu5t,Army of Al-Azzah TOW operator destroys a Syrian tank north of Hama - 10/11/2015
cyptrk,F-105 Thunderchief strays into the line of fire of a fellow aircraft targeting a MiG over Vietnam
8pt36y,"Syrian T-72 gets hit by an RPG-29, causing an intense ammo cook-off."
566bqj,Russian Cruise missile flying overhead in Syria.
bokhbs,"[Vietnam] A-1 Slyraider drops napalm on an NVA Position, conducts strafing runs using the main gun. Operation Long Reach. 1965."
bcp4hs,"Allegedly LNA Mi-24 strikes PNA troops, Libya"
auxzxg,Waffen SS using a flamethrower during an engagement
cyb2tg,"[Vietnam] A US Marine Recon Patrol comes under direct fire by enemy combatants, Marines throw grenades and call in Air Support. March 16th, 1967."
a2ciyk,Tank surfing at Arras in 1918
9wqt0v,[WW2] US Marines take a swig from a rum bottle while pinned down on the beaches of Tarawa.
98l9r9,"[Somalia] The moment Black Hawk helicopter ""Super 61"" crashes over Mogadishu."
bowogu,Gunfire from an F-86 Sabre sets off a MiG-15's cannon during the Korean War
awz5rl,Hellish footage of fighting last night between the SDF and ISIS in their tent city
akmrna,"T-55 turret on truck (Syria,2017)"
d4iu23,360th Fighter Squadron pilot 2nd Lt. J. H. Williams chases a Bf 109 off the tail of a fellow P-47 pilot and shoots it down with an impressive deflection burst on August 4th in 1944
cus8pd,"ACV-15 moves in, lays cover fire, and tows disabled M113A2T2 armored ambulance away, Operation Euphrates Shield 2016"
cjubzn,"Syria: Drone footage captures strikes on militant positions in northern Hama (July 24-28, 2019)"
crk9zn,Taliban engaging ISIS in the Korengal Valley(June2019)
afj40c,"Unrestricted Submarine Warfare in WWI, a surfaced U-Boat sinks an unarmed merchantman with its deck gun"
53cfnv,WW1 Flame Thrower (source video in comment)
7nurcq,"A wounded marine is being helped across at hill 484, Vietnam 1969 [More pictures in the comments]"
6z03kx,Shit hits the fan in a moment and catches a young marine by surprise. (Facebook link)
bci5z3,[WW2] US cruisers lighting up Mount Suribachi with tracer fire in preparation for the landings.
9iglta,Ad hoc artillery support from US Patton tanks in Korea in 1951
btb0hq,"[WWII] Soldiers of the U.S. 7th Infantry Division scanned for Japanese snipers firing at them from the mountains on Attu, Alaska, USA during the first day of the Battle of Attu (May 11, 1943)"
2vsdoy,Thousand-yard stare of Ukrainian soldier after 9 hours of combat
aq6kxg,The Wreck of the WWII Carrier Hornet has been Found!
cm90oz,Malian army fighting tuareg jihadist who tried to infiltrate the city of Gao
cuf5jk,[Vietnam] US Marines assault Hill 454 near Khe Le Valley. 1966 (Correct link)
ccjumf,(NSFL) Soldiers in Afghanistan call in a Danger Close Airstrike on a Taliban position and inspect the aftermath. Date and Location Unknown
c9unjs,"Rebels (Faylaq al-Majid) blowing up group of regime fighters, who tried to recover a wounded or killed regime fighter, with ATGM at Northwestern Hama frontline today."
d5z5qk,[Vietnam] A Navy Corpsman works on wounded Marines during a firefight. Quang Tri Province. 1968.
bizdpm,WW2 Photo British Soldier with Gas Mask
cmpfbo,Nigerian army destroying boko haram camp in sambisa forest
9p5b3g,"Gun camera perspective of a Focke-Wulf Fw 190 raking a Consolidated B-24 Liberator with cannon fire, closing to just 50 meters"
9ib3az,[WW2] US Marines hitting the beaches of Iwo Jima.
bmih82,Peshmerga forces destroy an IS VBIED in the desert
8y18ll,Direct hit from Patriot missile on intruding drone from Syria today in Israel.
a6ixas,Turret gunner eliminates threat to squad. Iraq
br4kfk,"2 insurgents attempt to sneak into a FOB in Afghanistan, but unlucky for them they didn't see the Marines that were posting security until it was too late"
a9r7dr,[Vietnam] US Planes drop two Mk-82 Bombs on a NVA supply route.
cpfr82,Insurgent blows himself up trying RPG at US troops.
a3ba6j,"5"" Rocket Trucks in action on Iwo Jima"
apxx11,[WW2] D-Day at Green Beach as the 1st and 2nd Battalions of the 28th Marine Regiment land on Iwo Jima. Marines maneuver through enemy machine gun fire and artillery on the beach.
8ut8eh,"Somali Soldier and Police officer in combat, Mogadishu"
a66wtt,P51 Mustangs over Japan WW2.
bisn3k,"[WWII] A Japanese Zero plane piloted by Tadayoshi Koga was downed by anti-aircraft fire over Dutch Harbor, Alaska on June 4, 1942. The pilot was killed when his Zero crashed in Aktun Island and the aircraft was recovered by U.S. forces and served as vital intel for U.S. victories in the Pacific War."
crnqqt,"[Vietnam] Tunnel Rats of the 1st Calvary Division searching and destroying an enemy tunnel. Operation Pershing. September 3rd, 1967. Bình Định Province"
9vnax7,"RPG narrowly misses FSA Southern Front fighter by inches, Daraa (September 01 2017)"
dm043a,Turkish backed SNA destroys YPG/SDF Humvee with ATGM
74p9cu,NSFW/NSFL: 2 Apaches kill a platoon of Taliban fighters setting up to ambush a U.S. special forces patrol [Afghanistan]
742zg5,"Operation Rolling Thunder, A-4 and bombing footage"
d3o1jv,"Street combat in Transnistria, 1992."
ab8ksn,[Vietnam] A Vietcong solider receives medical aid by US Soldiers after being shot multiple times.
bldgmr,"[Vietnam] US Soldiers defend a US Command post during the Tet Offensive, repel a Vietcong attack. 1/31/68."
7qr25b,Last moments of Oscar Perez and the anti-government group while Venezuelan forces siege their compound
7enfmj,FULL CCTV footage of North Korean soldier's defection
62vv57,Beirut 1978
cqhmul,"Ukrainian""Chechen"" Mercenary's? Battle to harbass"
7r0ea6,German cavalrymen patrolling behind the front lines (1918)
9jz4ct,[WW2] US Paratroopers jumping into southern France during the invasion of southern France.
axejk4,"FSA ""Hell Cannon"" almost hits their own drone midair while filming a tunnel bomb explosion - Aleppo 2016"
4jayyt,Kurdish PKK shooting down a Turkish army helicopter in Colemêrg province yesterday
bu87wh,"Chinese soldiers from the 348th Regiment assaulting positions held by US 1st Cavalry Division near Unsan, modern-day North Korea on 2 Nov. 1950. The Battle of Unsan was the first major combat between the PVA and US troops in Korea."
alt1pr,[Chechnya] Multiple Russian soldiers resting by a BMP are ambushed by an IED and machine gun fire. One soldier tries to drag his buddy to cover before he is also killed.
c0z1cm,"[WWII] American soldiers advances across a hill near the coast of Attu Island, Alaska under enemy fire, as the fog began to roll in during the Battle of Attu (May 13, 1943)"
762478,How one properly uses a BMP-1
c6d7ww,"Opposition forces scatter an SAA forces use a UR-77 mine clearer in an offensive role - Damascus, 2017"
b2yrco,"[WWII] - U.S. Marines watched as the burning oil tanks exploded in vast proportions during the Japanese attack on Dutch Harbor, Alaska, USA (June 3–4, 1942)"
7a6tk2,"Photo titled ""Tracer bullets from antiaircraft guns ashore and onboard ships, cut a pattern in the black night over Iwo as American forces set up a barrage to repel a Jap air attack on portions of the Island held by the Marines."" 1945."
4mdjkg,"Large World War 1 album, gruesome photos at the end (x-post /r/morbidreality)"
a8g3nn,Massive IS VBIED annihilates an enemy position - Iraq 2015
bia4xd,Russian Air Defence Intercepting Incoming Enemy Missiles - Syria 28/4/2019
58yg6l,A Kurdish special forces about to fire an anti tank missile at an ISIS armored plated/suicide truck bomb in Northern Mosul
94qfbn,Hot extract. Australia's SOTG responding to a high arm arterial injury on the MV-22 tail gunner.
cxsnr2,Turkish M60A3 engaging targets and pulling back to cover. Not sure if it's Euphrates Shield or Olive Branch. Footage is from drivers perspective.
cg2hb2,Soldier Survives Shot To Helmet During Firefight
cj3onm,"My Close Call, firefight in southern Afghanistan"
cka8df,[Iraq] US Marines take fire and respond while patrolling down “Elizabeth Street”. 3/1 Marines. Operation Phantom Fury. Fallujah.
am674s,"[Vietnam] US Soldiers rush aboard to the extraction helicopter after a patrol, they pass around smokes and sit in relief."
ag87je,VVS Ilyushin Il-4 bomber disappears into the clouds after taking fire from a Luftwaffe fighter
ab09te,[Vietnam] F-4 Phantom barrage an NVA held village during Operation Scotland.
9xexih,They Shall Not Grow Old (2018) - Produced and directed by Peter Jackson (of LOTR and Heavenly Creatures) it presents 100-year-old archival footage of World War I in colour [1:36:31]
a5m05s,(New) captured GoPro footage of ISIS fighter who was killed in recent clashes with SDF near Hajin
bhr73t,FSA PKM Gunner engages an enemy position with a long burst of fire - 2015
9z2ii6,Messerschmitt Bf 109 ambushed on takeoff in December 1944
c75yc5,Last stand of Ukraine soldiers at Donetsk Airport
bzz9bn,Iraqi PMU flushes out IS fighters with grenades and small arms outside of Mosul - 2017
d943qs,TRUE HAND TO HAND COMBAT FOOTAGE WW2
6d5dv3,Suicide bombers try to fake surrender and detonate themselves in Tabqa
awajy9,White phosphorus used against the Daesh camp in Baghuz tonight as the SDF clears it out
5vl9ip,"IS car bomb in central Iraq, 2017"
dmjxax,"[Iraq] US Soldiers evacuate wounded personal into a field hospital after their vehicle struck an IED. Tikrit, Iraq. October 1st, 2003."
cz7q1a,[Vietnam] XM-26 TOW missiles attached to UH-1s score hits on NVA armor and fighting Positions. May 1972. Kon Tum Province.
dekcjr,2012 Allepo's rebels get obliterated by SAA tank while defending the street. Situation is explained by the war reporter
b2iysw,"Point blank fighting between PKK and the Turkish Armed Forces (Infantry fighting starts at 0:55, enemy visible)"
c069hd,"[Vietnam] US Soldiers of the 101st Airborne Division engage NVA sharpshooters at a close proximity to their artillery encampment. October 1966. Operation Hawthorne. Kon Tum Province, South Vietnam."
bqunm6,"[WWII] American soldiers climbs over a snow-covered mountain ridge under intense barrage of Japanese mortar shells on Attu, Alaska, USA during the Battle of Attu, part of the Aleutian Islands Campaign (May 1943)"
a4o19k,"Firefight in RC East, Afghanistan featuring one of the calmest and most polite infantryman you will ever see"
ajqu83,"[Vietnam] US Soldier carries a severely wounded soldier out of an ambush under heavy VC fire, Battle of Dak To"
6a5v9o,Colorized aerial shot of World War 1 no-mans land
bdtsyw,Go pro Russian soldier/Ukrainian separatist steps on land mine and has leg blown off.
9oo0xt,"Finnish troops engage Soviets during street fighting in Medvezhyegorsk, Russia. [Continuation War, 1941]"
a4zep6,[WW2] V-1 Rocket shot down near St Leonard.
bu08q8,"[Vietnam] 1st Calvary Division Air Assault, near An Khe. 28/12/65"
9zng5m,HTS ambush Pro Regime outpost with suppressed weapons in CQB.
ahhuy9,"Tahrir al-Sham fighter eliminating two Syrian soldiers in close range, Northern Hama. A few days ago."
ageiye,[Vietnam] US Marines pull a deceased brother to cover under heavy NVA fire during an ambush near the the DMZ.
5bjfsy,Exclusive: CNN reporter trapped in deadly ISIS attack in Mosul. [Actual Video Report]
dhrhf7,"[Vietnam] US Marines search a village before burning down it down. Operation Badger Tooth. “Street Without Joy” area of Quảng Trị Province. December 26th, 1967. 3/1 Marines."
dit5nr,Devastating SDF/YPG 9K111/9K113 ATGM strike on TFSA/TSK vehicle
btuhw9,"US Army convoy hit with multiple RPGs, injuring a turret gunner and disabling at least one M-ATV [Afghanistan]"
afaqcl,Declassified 1945 US Aviation Footage. Truly Haunting.
9x3d2r,Royal Saudi Land Forces 4th Armored Brigade unit targeting houthi technical by Raybolt ATGM
224mip,"On a slightly lighter note, this T-72 knows what it means to be a good friend."
dv2b1i,"SAA air-burst incendiary munition detonates above Haritan, Syria - 2016"
c490kh,Russian drone shot down with AA gun in Syria
6z437b,Jaish al-Islam cameraman on the receiving end of a MiG-29 strafing run
9qq7tg,New ISIS release shows another of their rare motorcycle-mounted DShKs in action
5xrr0l,"""double deck"" firing position, Iraq 2017"
apbko2,FSA anti-aircraft gun engages a suspected government position - Aleppo 7/23/2015
dabc4e,"First Battle of Grozny, Chechen forces clash with the invading Russian Army. From the documentary ""The Betrayed"""
aryrdb,"Anderson Platoon closes in with the VC, South Vietnam, 1966"
cp6qun,Rio De Janeiro Military Police Goes Into City Of God
a3nj1f,B-26 Marauders leave a trail of destruction in their wake over France in 1944
a60nvg,"RPG disables an Iraqi T-72 with a turret penetration, one crewman bails on camera - May 2014"
bo61oy,Airstrike levels a building in Idlib along with a few bystanders.
dihoxe,Marine tosses a grenade during house clearing
97b7qw,[WW2] Allied soldier steps on a landmine. (Somewhere in the pacific)
9m5110,"British soldiers traveling through destroyed village, with bicycles [WWI]"
a9gphj,US Marines in Afghanistan narrowly missed by a rocket
coygpt,"[Vietnam] Elements of the 25th Infantry Division clearing out VC trenches at the Michelin Rubber Plantation. Cu Chi Province. April 9th, 1967."
9kgw9x,"Egyptian MiG attempts to take off while Israeli Air Force fighters attack its airfield in June 1967 during Operation Focus, the opening shots of the Six Day War"
9kpvym,Soldier Taking a Smoke Break in Ukrainian Battlefield
3tu262,My dad recovered audio from a combat mission he flew 46 years ago in Vietnam and I helped him turn it into a video [x-post from /r/videos].
bsglh1,Dutch marines arrest 10 Somali pirates who hijacked a ship.
arhuyw,"Anderson Platoon is pinned down by Viet Cong machinegun fire, 1966, South Vietnam [Actual audio]"
d2zkoh,Stalingrad - Heavy Combat Footage [HD Colour]
50w2j0,Danish troops kill 5 taliban in close combat
b9vy0p,"FSA ""Hell Cannon"" round wedges itself into the wall of an SAA position before detonation"
ae5xy9,"Kamikaze attack on SS John Burke (ammunition ship) results in very large explosion: Ship destroyed instantly, all crew lost. 1944"
9zurl2,Just Another Day In Rio!
9pms42,One of the most haunting interviews of war vets I've seen. WWII medic talking about how he experienced the loss of human life
d43zyq,Peshmerga defend their positions against ISIS attack Iraq 2015
ck6ckv,Nigerian army repelling bokoharam attack
cfn37c,Tank crushes car full of bombers before massive blast at Egypt[Sinai] checkpoint. July 2017.
6dcn89,Iraqi mother fleeing with children struck by ISIS sniper fire.
at80el,"[Vietnam] US Soldiers M-16 jams on him during a Vietcong Assault, Operation Junction City II."
bpc0m6,Syrian/russian army striking militant targets - Hama offensive - May 2019
9z5ddq,[Vietnam] US Navy using flaming throwing patrol boats to clear river banks.
bugo46,"[Vietnam] Casualties of the 173rd Airborne Brigade being evacuated to the 93rd Surgical Field Hospital. November 6th-8th, 1965."
9wpjcy,"Houthis ambush Pro-Saudi forces with IED near kilo 16, Hodeidah"
cw4jl9,Heavy Combat footage Eastern Front WWII
bav52r,"LNA jets striking the Mitiga Airport in Tripoli [April 8, 2019]"
a6iwl8,Single shot hits machine gunner thru ammo belt in Syria
6lxpje,"[WW1] Canadian charge into no mans land, Date unkown"
76qroi,FSA takes out small combat group of Assad loyalists with TOW missile (NSFL)
64m68v,IS suicide bomber sneaks through a gated compound to ambush two Iraqi soldiers in Mosul (2017)
ajgqa8,[WW2] RAF Fire bombing German cities.
48w3qx,A Marine door gunner realizes his friend and co-pilot is dead [VIETNAM 1965]
d11k9l,Air strike on Hamas air complex in Gaza - minutes ago
9xp6zr,[WW2] US Marines on Peleliu use flamethowing tanks to clear Japanese strong holds.
864u2t,"Exactly 15 years ago, at precisely 2100 local time, 500 cruise missiles and 1,700 sorties struck targets across Baghdad and Iraq in the opening assault of Operation Iraqi Freedom."
bg0w9b,Turkish Air Force hitting a tunnel entrence during the first days of OOB January 2018
4gnt1o,ISIS combat footage from VICE report
8ho96t,Syrian T-72 watches its ally get de-turreted by an FSA RPG-29
b8zjlx,[Vietnam] US Marines capture multiple Vietcong fighters after a brief engagement.
aysuwu,Syrian soldier is ambushed by a lurking rebel in Darayya [NSFW]
ae21pk,B-17 bomber engaged with cannon fire at close range
5rw9wb,"Over the top. A British officer leads the way amid the bursting of German shells on the Western Front, Date Unknown."
c2emz4,"National Guard soldiers ambushed while advancing up a hill, multiple soldiers are wounded by close Taliban fighters and engage in close combat near COP Najil in Laghman Province, Afghanistan (2010)"
5nc161,"Finnish troops on patrol with tactical reindeer near, Petsamo, Feburay 1940."
57o4qw,Iraqi soldier in front of the oil fields that have been set on fire by ISIS (near Mosul)
cd3hln,Filipino Army's 1st Lieutenant Geraldo Alvarez relates how he brought out most of his men alive from 5 days of constant combat after being cut off by an Islamic State ambush on the first day of the Battle of Marawi (May 2017)
9rj193,Apache engages squad of insurgents. Iraq
5jf36k,"Drone view of ISIS SVBIED attack with near miss and crash [war in Iraq, December 2016]"
9li7iq,[Afghanistan] ANA helicopter lands directly on top of an IED in the Kunar Province.
a8owi9,"Chinese Peacekeeper killed, six injured in south Sudan"
axzlge,A-10 Thunderbolt II in action against Taliban hideout
ap371a,US soldier in Afghanistan sent backwards from backblast
93f10t,"[WW2] B-29 Super-fortress crash lands in the Pacific after returning from bombing run in Tokyo, all crew members survived."
bm6rv8,[Vietnam] US Marine and Corpsmen patching up wounded after an NVA mortar attack. Operation Scotland II. 12/28/68.
845149,[Photo] A Coldstream Guardsman bails out from a Warrior set on fire during an operation to free SAS members from a Shiite militia prison in Basra on 19 September 2005
aexq2e,Ilovaisk massacre. More than 1000 Ukrianian troops were killed during a vicious flanking attack by Russian forces
asb8xe,"Colombian Army troops fire at ELN positions after an attempt to block the Tadó - Guarato road, 11/Feb/2019"
5yr9dh,"US soldier Zachary Boyd, fighting in Afghanistan in pink ""I❤️️NY"" boxers."
50p73y,"An American soldier's private video of an airstrike his unit called on a group of Afghan insurgents, and its aftermath (circa 2011-2012)"
9v9adt,"German large caliber mortars and howitzers firing. Footage of shell traveling through the air, bouncing of the ground and exploding. I presume it was posted before but I guess it won't bother you to see it again."
9uffcr,Military Motorcycles used in Iraq
99scn4,Syrian BMP engages rebel buildings while running parallel to civilian traffic - 2014
bd6nuk,Kurdish troops stop an IS VBIED short of its target - 2015
69drdq,[129 pics in album] My Vietnam War colour album [WARNING GORE]
dx5mmz,Being pinned down by heavy gunfire and other chaotic scenes from the streets of Moscow during Russia's very short civil war (October 1993)
croxah,"US Marines from Alpha Company, 1st Battalion, 4th Marine Regiment, raid a police station in Kufa, believed to be held by fighters from the Moqtada-al-Sadr led Medhi Army, during the battle of Najaf on August 20, 2004. [1080x1080]"
9yg8gy,U.S. Special Forces & ANA in firefight with Taliban in Afghanistan
9q1ckw,Accurate burst of cannon fire from a Fw 190 shatters a B-24 Liberator cockpit during a head on pass
9owfjl,"Palestinian militants in Gaza prepare a rocket launch, get struck by Israeli Air Force."
c6x56s,Soldiers of opposing side call mother of a fallen soldier that their son as died (15:10)
ctcvc9,Israel bombs Pro-Iran militias weapon depot in Iraq.
ad5rk1,Messerschmitt Bf 109 forces a RAF Westland Lysander liaison aircraft to crash into the sea
afngmo,[WW2] A Japanese Bomber drops an Ariel torpedo on the deck of the USS Yorktown during the battle of the Corral Sea
8xgk0n,"Bulldozer IED survives RPG before detonation - Iraq, 2015"
bjj8x9,T-155 Fırtına spg fire and reload during Battle of Al-Bab against isis 2018
4xnj9h,Rocket misses Islamic State soldiers
d0jg7a,US Special forces engage ISIS targets in Afghanistan.
60j8zr,Fabulous somali kid and probably his father in combat.
