post_id,title
4d0fl5,"Hans-Georg Henke, 16 year old Luftwaffe anti-air gunner captured by the U.S. Army in Rechtenbach, Germany on April 3, 1945 [1600x1590]"
356ioz,"173rd Airborne spraying M-60 machine gun fire, along with .50-caliber machine gun fire from a M42 Tank at a sniper in the hills at Hensinger's Base in Phu Tai, Vietnam, April 1970."
b66i8l,"Syrian government tank drive-by shooting among civilian traffic on the Damascus-Homs highway in Qaboun, Damascus city (19 June 2013)"
5mzeg1,Soldier runs as his base is hit by a Taliban VBIED in Afghanistan
8vdbli,"(Heads up) The UK government has a proposed law that would make it illegal to view ""terrorist material"" online (up to 15 years in prison)"
a76ngy,IED sends an Iraqi HMMWV 100+ feet into the air - May 2014
9j3wxm,A nerdy Al-Rahman Corps rebel and his 23 mm homemade gun (2015)
apsl4l,[Album] Colorized battle of Tarawa photos from WW2
7b1x8m,Egyptian Air force Strike on ISIS in Sinai[GIF]
3foz6y,Launching Grad barrage.
9e0vqz,Hot extract! 2nd Commando Regiment taking fire during exfil via helo.
6l765e,Daesh(?) shot while running.
4cp1fc,"Unidentified soldier snorting dope with an M-16 rifle and pump-action shotgun by his side (Photographer Aldo Stephen Panzieri, 1969) Vietnam"
caxv2q,Ukrainian army truck hit by ATGM
71xwu4,"Drug Dealers vs Another Group of Drug Dealers vs Police/Army at Rio de Janeiro, Yesterday"
7s54va,"A pair of Junkers Ju 87 G-1 ""Kanonenvogel"" engage Soviet armor maneuvering in the snow with their 3.7 cm cannon - January 1945 [gif]"
8zk88f,Islamic State car bomb attacks iraqi humvee whilst being strafed by an iraqi helicopter
5fpnt5,A rocket from Gaza intercepted by the Iron Dome defense system over Tel Aviv [17/11/2012]
6w5vc5,U.S. Army 120mm Mortar Crew in Action in Afghanistan
6nmkx4,8.8cm Flak 36 employed in the ground role scores a direct hit on an Allied tank in North Africa - February 1942
2os1pl,Iraq War Vet Tells His Tragic Story in Cartoon Form
ahveb5,PKK fighters killed with .50 cal RWS by Turkish Armed Footage (Brutal)
bshia9,[Vietnam] US Marines assist wounded after a transport truck struck a mine. 1966.
bc8x6d,"Soldier disguised as a city worker intercepts a suicide-bomber disguised as a soldier in Aden, Yemen [April 2017]"
9s5xyz,Iraqi soldier pinned down by ISIS sniper uses classic decoy head technique to move to cover.
5v8wzr,Frozen in time WW2 fighter place crash: Pilot found in peat bog still clutching parachute straps as he tried to escape cockpit
diafde,"Raw footage of a failed attack by TIP Uyghurs in the area of ​​Abu Dali in Northern Hama, ending with the 18-years-old cameraman being shot and killed (May 2018)"
5vehkp,US army veteran's story: 'I killed four people in one hour in Iraq'
2tjnjn,"Dash cam view of rockets hitting cars going in front of you, Mariupol, Ukraine"
b83nh6,[Vietnam] US Marine smokes a pipe while suppressing Vietcong positions with his M-60.
d1tkg4,Hürtgen 1944 [WWII]
cc5bhz,"An air-to-air shot of a B-17G of the 100th Bomb Group bombing beach defences near Boulogne - France, as part of the Overlord deception planning, 5 June 1944. Superimposed over modern day mapping. If you zoom into the town at the lower left, it’s getting pounded by bombs."
3cg09l,"A Russian unit routs after hearing that German cavalry have broken their lines, 1914-1918"
aggfgb,Southern Unification Brigade uses a trebuchet to launch an anti-tank mine at enemy positions - 2014
7cnxkm,"Good video showing what it is like to be under a Arty barrage,fighters cower in their fortified mountain position as rounds are walked in on top of them,leaving one bleeding out."
a9dcr5,"1988: Bus hostage rescue by Yamam, 40 seconds, 3 hijackers dead, 1 hostage dead"
78b6a2,The Taliban Attempts To Ambush The Red Devils In 2006.
7wsgn1,Soviet T-34-85 burns after being ambushed by Panzerfaust armed troops in the Courland Pocket - 1944
3qb5bo,"Photograph of British commandos attacking under the cover of a smokescreen during Operation Archery in Norway, December 27, 1941."
6bxrhk,Horrifying view of multiple suicide bombers
a88zl3,Egyptian tank crushes car bomb at checkpoint in the Sinai before detonation
2ie03m,He is one salty mother fucker
dc4kzt,"Dug too deep to be harmful, an IED gives an Abrams a fun ride. Iraq War"
7e4lv2,U.S. Special Forces Combat Footage in Afghanistan - Helmet Cam Live Action (x-post from r/WarUpdates)
6gm2dt,Fairly iconic WW1 photo. Anyone else see British helmets on the left and German Stahlhelms on the right? They don't seem to be fighting one another.
9w8bt9,ISIS car annihilated by airstrike
8fxixs,"FSB spetsnaz in anti-terror operation. Republic of Dagestan,Russia"
54m6k1,WWI: An album covering the Battle of the Somme.
9f2i58,Somali Special Forces members laying down fire during firefight with Al-Shabab terrorists
468d0k,B-25G Mitchell Gunships firing their 75mm M4 cannon [gif]
8ddzhn,Sturmgeschütz III providing direct fire support with its 7.5cm StuK 37 L/24 during the Battle of Smolensk - August 1941
6y4p3w,Ukrainian Volunteer Army sniper kills several Russian-backed separatists using night vision scope [August 2017]
68a85o,"The landscape of Okinawa during the muddy month of May resembling that of no man's land, May 1945"
cjp6ad,"Dien Bien Phu, 1954: FFL paratroopers attack on Hill 781"
2ycqxb,WWII: photo of US bomber about to crash after dropping parachute retarded bombs
do0cht,"Iraqi T-72 destroys a VBIED, 2018."
68ilk4,[Vietnam] American Soldier Photographs US Army Attack on Nearby Sniper
92q5ia,Mikoyan-Gurevich MiG-25 Shot down over Vietnam by Soviet SA-2 missile.
5uha5q,"South Korean Marine rushes into a K9 Thunder self-propelled artillery as North Korean artillery pounds his position (November 23, 2010)"
4qhmc8,ISIS convoy fleeing Fallujah is destroyed by Iraqi Army Aviation - 28/6/2016
36e7m2,Incoming ATGM looks like that
bkzntx,Israeli civilians who couldn’t make it to the shelter try to take cover as missiles fly overhead
55fmx2,Please stop downvoting and reporting links based on your political affiliations
bunhir,Syrian miraculously survives an ATGM strike on his civilian vehicle - Hama - 7/3/2015
aaxqgf,Good Buddy of Mine Being MEDEVACED After Being Hit by an IED while on Patrol - Afghanistan
biv811,"US Marines holding hilltop watch B52s from Guam drop their bombs. Con Thien Vietnam, September 1967."
9sjwar,Color footage of the Battle of Normandy
782inb,A cameraman films own is death on an aircraft carrier during Korea War
3u2y7d,Russian helicopter hit by TOW missile
bzh5k6,F-15E smart bomb targets an SA-2 SAM site - Operator tries to duck out of the way
23nbvm,"Uploaded my entire Syrian War photograph folder, tons of combat photos inside"
58paog,Inside a captured Islamic State suicide vehicle
795qj5,(NSFW) Hayat Tahrir al-Sham storming IS position in eastern Hama
8ufber,"[WW2] A German U-Boat destroying various ships, then footage of the U-Boat being destroyed by US Cruisers."
3q59o8,[1915] German attack up a hill
ca5osb,Yemeni soldiers sneak into Houthi bunker
bpv0va,"Polisario Front guerrillas ambush Moroccan troops in Western Sahara, 1977"
8klpr4,Tank crew suffer different fates. Disturbing. [NSFL]
5umkgj,"[40 pics in album] The 79th Infantry Division conducts an assault on the Red October factory, Stalingrad, Oct. 23, 1942."
bpm043,Intense shootout in Syria
2k3zk5,[PHOTO] The last moments before ISIS militants were vaporized on the hill west of Kobane. source : @AFP
3ul9mn,"This is Pigpen, I was a combat helicopter pilot in the Vietnam War. AMA."
ccpmmx,"[Iraq] US Corpsmen and Marines patch up Lance Corporal James Sperry after shrapnel struck him in the head and chest. November, 2004. Fallujah."
bbsnb5,"MH-6 Littlebirds supporting and harassing besieged contractors in Najaf, Iraq [2004]"
anl3ob,Syrian Rebel machine gunner walks his rounds in on an unsuspecting Government trooper - 2016
5w5rcy,A South African Defence Force (SADF) Ratel 90 encounters an Angolan T-55 in the bush
2s0trn,A F-16 dodges six Iraqi SAM launches during the Gulf War. Two fighters were shot down that day; the fear audible in the pilots' and controllers' voices is incredible.
2cai3l,"Israeli 2,300lb GBU-24 missile just before striking a building in Gaza city [600x816]"
6kp1v3,Raqqah: Marines pounding ISIS with artillery (M777-A2 Howitzers)
47gapz,A few of my favourite WWI pictures.
6779lq,Iraqi journalist captures a moment of wounded ISIS militant blowing himself up (photos)
3afi38,[1914] A German sharpshooter unit holds a position during the Battle of the Marne
digjtl,META: FBI Agent followed up for reporting ISIL supporter in this Sub
b8cvfy,"Australian infantry get into a 90 minute firefight with Indonesian troops before arranging a ceasefire in a tense standoff - East Timor, 1999"
aw5564,FSA Sapper Squad DEEP In Enemy Territory Plants Mine and Gets Ambushed
7gtw4i,Battle of Marawi
9op6ff,[Syria] Man records a tank battle on his phone from meters away.
727xsf,Indian commando was laying down suppressive fire during 2008 Mumbai attacks
93vrrj,Mexican army stop sicarios
8nnsdd,Al-Nusra catches the death of a Syrian soldier on camera in Idlib [2015]
73u40t,"(Graphic) Hay'at Tahrir al-Sham raid near Aleppo showing close combat with suppressors, eliminating several pro-regime fighters"
7xemg5,Two British Harriers take on four Argentinian Skyhawks during the Falklands war 1982
azd3k6,Close quaters - close call. Enemy (ISIS) visible very close range
7t6wki,The Iraq War as captured by David Leeson
6vlxse,"Mexican army shootout against armed group in Tamaulipas, Mexico"
5ggrr3,"[WW1] PHOTO - German soldier aiming. Probably after a French assault (dead French soldier in the foreground) , Verdun"
6bnttl,Iraqi Army bulldozer blocks ISIS car bomb before it detonates!!! [Dashcam video]
dw7u30,M16 Multiple Gun Motor Carriages use their quad .50 cal M2 Browning machine guns as indirect fire artillery in Europe late in WWII
cfj8u9,Nigerian army repelling boko haram attack
3ikxv6,Ukrainian soldier showing his post under mortar fire and gets hit
b8mekp,"[WWII] U.S. Marines employed flamethrowers to clear out Japanese caves and bunkers in late February/early March 1945 during the Battle of Iwo Jima, eventually burning a score number of Japanese to death."
9f92em,Kiowa co-pilot firing on enemy's with M4A1
8nuzk0,Uzbek Mujaheddin trolling a pro-Syrian sniper.
3di7op,"Islamic State in Sinai has conducted a rocket attack on an Egyptian navy ship near Rafah, North Sinai."
aa1aek,[WW2] Stukas doing strafing runs on Russian armor.
5y942c,ISIS fighter killed by improper planting of his own IED
90rx6f,Philippine militia ambushes a Philippine military out post.
cf3ytj,Combat footage in Idlib Province
djy2wt,"600 mm Karl-Gerät ""Ziu"" firing in Warsaw in August 1944 [colorized]"
abiqsj,An in depth study of Kamikaze Attacks with some interesting footage of such attacks on the Pacufic Fleet
969710,[WW2] Soviet Soldier killed in the streets of Berlin. (Battle of Berlin)
buvn94,Quick reminder from a person who love this sub
b12fe7,Afghanistan - The Korengal Valley# U.S. Trops vs Taliban
40nu4h,[GFY] IS sniper gets a headshot on a moving Iraqi Army/PMU soldier in Southern Iraq
3a5cm1,Japanese coastguard sinking a NK spy ship after they seem to ignore hails.
b497vr,Scenes from possibly the last ISIS release in Syria in Baghouz camp.
3he98g,kurdish marksman overlooks destroyed area of kobani after city liberated from isis. a powerful photo of the war IMO.
2w8l3c,Album of high quality photos from Ukraine capturing the brutality of war
8sew3a,F-16A Shoots Down OV-10 Bronco during attempted Venezuelan coup in the 90s
9n3dby,"ISIS firing a DSkH mounted on the back of a motorbike at SDF forces in Susah, Syria. Today."
6m7tci,Mosul endgame in images
91nv3l,"500 Pound Bomb Dropped on U.S. Soldiers By Mistake -- Paktika Province, Afghanistan"
9r3kos,"""Handley Page Halifaxes of No. 35 Squadron RAF bombing the German battlecruisers Scharnhorst and Gneisenau in dry-dock at Brest, 18 December 1941."" IWM photo."
93or7f,[WW2] 3 Japanese soldiers are gunned down by 6th Div. Marines on Okinawa.
bahlm2,"LNA forces using MLRS to shell Tripoli [April 6, 2019]"
cl23au,"HTS drone footage of yesterday's SVBIED attack on government positions in northern Hama countryside, feat. very extensive shockwave & fragmentation effects"
5tajpo,Suicide bomber sneaks in on coalition forces and detonates - Mosul
319ywz,SAS Troopers land on the Falkland Islands.
2hczw1,My Chechnya/Bosnia Wars photo's i've collected over the years.
degk1v,Documentary about The battle of Marawi in the Philippines in 2017 Phillippine army against ISIS
45kxl5,15 Astonishing World War II Photos with the Original NARA Descriptions
c844y6,German pilots surrendering to USAAF. May 1945.
6ws1xs,"""The tense moment an ISIS militant surrenders to Kurdish soldiers"" (Iraq 2016)"
9ogmkk,British soldiers walk through a dead forest [WWi]
4w03ll,Dying rebel says his goodbye to his family via a video (Syrian Conflict)
21ixp5,"Photograph of three waves of German infantry advancing towards Haumont Forest on the first day of the Battle of Verdun, 1916."
5xm07s,American soldier with an M-16 in Vietnam
df5oq7,Improvised SAA rocket battery in used near Damascus - 2018
8mah0r,Australian soldiers aided by New Guinea natives attack and defeat Japanese in jungle fighting (1943)
8jkr0l,2017.05.06 Jaish al-'Izzeh use a BGM-71 TOW missile to obliterate a regime forces BMP-1 on the al-Zalaqiat front lines of northern Hama
9nwsvn,"Original color footage of a US Marine mop up operations against Japanese troops hiding in dugouts during the Battle of Eniwetok, 1944."
64chrd,IS sniper's tracer shot wildly ricocheting off a head of an enemy militiaman in Iraq
andimi,"FSA undermine a water-tower / bunker thing, with an unexpectedly cartoonish result (2013)"
aap8p8,Jaysh al Islam shoots down a regime MIG 21 with a ZU 23 2 autocannon.
9w598p,Lest We Forget. Normandy D-Day footage rendered in 60fps
3m2ie7,35 years ago Iraq invaded Iran on 22 September 1980. Here are some pictures by Alfred Yaghobzadeh
djgroh,Any footage of Mexico rn ?
8oc0yn,"""At the approaches to Leningrad, sappers of the Red Army are seen as they create strongly fortified zones which promise unpleasant surprises for German invaders."" Photo taken in 1941."
6urmmk,"On this day 36 years ago, two US Navy F-14s shot down two Libyan Mig-23s that were ordered to intercept them. Radio footage & gun cam."
4w62d2,"The moment a tank shell hits a Syrian rebel checkpoint, killing 3 (2012)"
2k9bqv,"Battle for Donetsk airport, Ukraine. Includes some pre-war photos for comparison."
98i0v9,"ZSU “Shilka” engaging structures, pausing only to let civilian vehicles through - Syria - ANNA News"
70cbp1,"WW1 photo titled ""American sharp shooters picking off Boche rear guard. Their particular prey were the German machine gunners."""
609i01,"p38 gun camera shows the last moments of a BF109G. 1944, Germany"
cie4rp,"Operation Buffalo, done by the US Marines in the DMZ during the Vietnam war, 1967, excerpt from the documentary The Vietnam War by Ken Burns"
9agwuk,T-34s at Kursk seen through the gunners Sfl.Zf. 1a sight on a Nazi Ferdinand TD
b7pvcc,FSA RPG gunner engages an SAA T-72 but is met with immediate retaliatory fire - 2013/14?
1l0wma,Craziest footage I've seen out of Syria: SAF air strike hits rebels firing anti-air gun
9qbf4x,Bombs from a Focke-Wulf Fw 200 Condor hit an Allied transport in the Atlantic in 1940
a151gd,A messy direct TOW hit on a group of Iranian personnel in the Al-Rashedin neighborhood in Aleppo (11-5-2016)
8cvuma,8.8cm Flak 18s deployed in the ground role in North Africa during the Battle of Bir Hakeim - June 1942
8c49lb,Syrian air defense systems active over Damascus as US starts missile strikes
a6q23p,"Photo of a Japanese Kamikaze plane diving towards the HMS Illustrious, June 1945. “The airplane scraped the bridge with its wing and crashed in the sea. It dived out of the clouds on the port bow and from the time it emerged from the clouds until the time it hit the water was only 11 seconds.“"
8c6ntg,Rocket Strikes Against ISIS Syria
2ytlis,[Album] 64 photographs from The Soviet-Afghan War (1979-89)
2ok0bg,"For the Americans, it was the costliest battle of the Pacific War. Okinawa, 1945. (album)"
832iwx,US Army patrol gets hit by IED in Iraq
43zz9o,"[GIF] Drone footage of IS car bomb striking an Iraqi Army convoy + Two other VBIEDs (February, 2016)"
3e8ycm,"American soldiers take cover on the Nibelungen bridge over the Rhine River, as German snipers on the opposite bank of the Rhine take aim. Worms, Germany. 28 March 1945. [629×800]"
