post_id,title
5rem78,"A Russian unit routs after hearing that German cavalry have broken their lines, 1914-1918"
dud0ks,"[Afghanistan] British soldiers evacuate the body of Pvt Chris Gray after they were ambushed from 15 meters away. A Co, 1st Royal Anglian Battlegroup. Now Zad, Helmand Province. April 13th, 2007."
bsv39t,“Rouse the believers” raid on fortified Syrian Army positions in Norther Latakia two weeks ago.
any3x9,WW2 p-51 ace Richard Peterson describes watching a German 109 shoot up american parachutes and does the same to him
9400tx,"[WW2] US Marines use explosive charge to blow out a Japanese sniper, Okinawa."
4apzqb,"Wehrmacht closing in on Stalingrad, 1942 (x/MilitaryGfys)"
av23bb,[Vietnam] US Marines and Corpsmen move and treat wounded Marines while being targeted by a Vietcong sniper.
dbn3nn,Taliban insurgents gunned down by Army soldiers at close range in Afghanistan. (NSFW)
9lwux2,German troops standing around horse-drawn ambulance after artillery bombardment [WWI]
8er5bn,Syrian army rescue two scared kitty from Yarmouk Camp amidst heavy shelling
7smgjj,Boeing B-29 Superfortresses of the 29th Bomb Group return fire as a Mitsubishi Ki-46 III-KAI interceptor tears through their formation over Japan - 1945
bvbz8u,"A Somali Man sits back and smokes Aug. 31, 1993, as a U.S. Ranger guards the front gate of a garage that was being searched for arms. Mogadishu, Operation Gothic Serpent."
d83zyz,Islamic State of Iraq ambushes American Intelligence convoy in Baghdad
9su2bd,[Iraq] Iraqi bulldozer driver crashes himself into a Daesh VBEID. (Filmed from the “DashCam”)
aqer20,The hazards of collecting combat footage: Cameraman filming an FSA SPG-9 attack is met with immediate return fire - 1/28/2015
8dwx8k,"Kataib Hezbollah fighter kills at least 5 ISIS fighters with grenade (Baiji, 2015)"
a6o73i,Japanese Coast Guard sink North Korean Spy Ship 2001.
c2zfvu,Alleged footage of iranian SAM shooting down the MQ-4C Triton drone
96kkch,[WW2] U.S. Marines use flame throwing tank to burn out hiding Japanese soldier. Saipan.
avarif,Alleged footage of Indian jet being shot down today
ans8y4,[WW2] Allied soldiers on boats use an explosive to draw out German Soldiers from a barn after Allies flooded Walcheren Island.
7f10yl,My WWII photo album (with descriptions)
add6jy,V1 flying bomb shot down by allied fighter ww2
3ojmcu,My Entire Vietnam war collection. More in the comments.
6azh17,"ISIS fighter is nearly hit by a shell during the capture of Brigade 93 base in Raqqa province, Syria"
9cae38,Insurgent firing from a technical in Afghanistan is lit up by an Apache helicopter
d0vs1y,RAF Spitfire avoids the fire of an Axis fighter over the coast of Malta
7v1mjt,Life for soldiers in the Korengal Valley by Tim Hetherington (child warning)
2u6obu,"A Kurdish fighter stands in the center of Kobani, Syria after it was recaptured from ISIS militants(x-post r/militaryporn)"
a6dqos,"A pimped-up M113 of the Philippine Army providing supporting fire to soldiers maneuvering in Marawi. Writing on the panels of the APC means ""It's Christmas now my love... And I'm still here in Marawi"". 2017 [720x405]"
9ykyki,[Vietnam] A Bell UH-1H Huey crashes shortly after dropping supplies to troops.
2p3xlo,27 Rare color photos from WWII
c5nfv3,Iraqi Kiowa Helo attacks ISIS
dj37np,A VBIED explodes in the middle of an Iraqi convoy.
4x20s2,600 lb ANFO IED detonates under MRAP [IRAQ 2008]
27e4fc,Picture Album from the Pacific War
651cjp,Brutal Pacific War Footage *Graphic*
9y5ei3,Russian KV-2 heavy tank cooks off
8gere7,Injured US Tankers Iraq 2004 (?) info in comments
6721u3,Bf 109 pours cannon fire into an Allied P-40 Tomahawk at close range in the skies over North Africa in early 1942 [gif]
9jck57,South Vietnam troops resting near the bodies of dead Vietcong during the 1968 Tet offensive
6489hz,[GFY] IS Marksman Headshots Kurd Soldier
4f1orw,Powerfull Iraq war pictures
9czawa,"Incredible Footage of an Embedded Journalist with Colombian Paratroopers. Whole Squad Dies, Journalists gets Captured."
6misl8,"[GFY] IS Fighter Ambushes FSA Fighter at Syria-Turkey Border - Azaz, Syria - Summer 2016"
dng4gv,"Afghan National Army vehicle blown up by a Taliban IED in Afghanistan, date unknown"
cagr54,Aerial Combat footage over Europe
9t44z5,[Syria] A Russian Mil Mi-24 conducting close air support near Palmyra loses its tail rotor to a Daesh anti-aircraft missile.
7sdu4k,Panzerkampfwagen IV crew observes a Soviet SU-152 Assault Gun burning in the distance through open hatches at Kursk - Summer 1943
ayrsk7,"[WW2] A kamikaze smashes into the USS Columbia (CL-56) off Lingayen Gulf, 6/01/1945"
90eu2k,American LRRPs and South Vietnamese Marines fight NVA on hilltop
dxliwx,FSA technical putting shots downrange
bf2cvq,"[WWII] Incendiary bombs unleashed from B-29 Superfortress bombers of the USAAF 500th Bombardment Group upon the city of Yokohama, Japan. At least 42% of the city was destroyed. (May 29, 1945)"
7w02rx,A-10 strafing a fleeing taliban vehicle
dy3uxa,"On this day 28 years ago, the fiercest battle Europe has seen since World War II ended with the fall of Vukovar"
4hn45t,"Members of the Soviet Siberian divisions near Smolensk, December 1941"
4wrpxy,SS John Burke explodes after being hit with a kamikaze. (/r/catastrophicfailure)
dgi53l,Volunteer Soldier for the Kurds Freaking Out on an Oncoming Suicide Bomber
d6ar1m,Fallujah IED Cache House Destroyed by my USMC EOD team Nov 2004
9ivh9s,Renault ft-17s on the western front 1918 (colorized)
6ugeh4,Douglas A-20 Havoc gets hit by anti aircraft fire.
7hrvid,"The USS Franklin recovering after being hit by two 250kg bombs dropped by a Japanese dive bomber, 19th of March 1945"
b4uxsb,Kurdish village guards shotting down PKK's armed drone
69ak6n,Sound of incoming rounds from a tank.
4achsm,B-24 Liberator hit by flak in the Pacific
cztooz,"SAA T-72 operating in Yarmouk, Damascus - 2018"
bhmo5n,Brutal RPG failure for Syrian rebel (2013)
azhr79,Spectators watching a battle between Ukrainian forces and separatists near Donetsk
8keyl9,Islamic State car bomb obliterates iraqi army vehicle convoy
bj8k45,"Guaido’s forces distinguishing themselves from that of Maduro’s by wearing blue bandannas, scarves, and armbands in an apparent coup against Maduro’s regime."
6yamis,"Alleged photo said to be taken of an aerial dogfight during WW1 titled ""An aerial combat at 15000 feet over the trenches."""
8slw8x,"Iraqi Insurgents gunned down after being chased by US Marines, after they shot at them."
a1gzho,Polikarpov fighter loses its tail to the guns of a Messerschmitt
9fty1h,"Syrian rebels shoot at aircraft, get bombed by it. Extended video and with two synced view points."
au03q8,Militant sniped in Yemen
a54ylt,US soldiers counterattack Taliban with speed and violence in Afghanistan.
9315fx,ISIS fighter wounded while trying to fire RPG in the battle of Mosul
cfhk5e,American B-24 Liberator after being bounced by a Me-262 jet
boftu8,"Afgan fighter using so-called ""Australian"" grip"
dqsyzf,"Marines from Golf Company, 2nd Battalion 3rd Marines, are pinned down by heavy enemy fire after their corpsman gets shot in the lower back. Moments after being shot, he pulls out his camera to record the action."
cetk96,"Actual surveillance footage of the Battle of Mogadishu, Somalia (inspiration for Black Hawk Down) (October 3-4, 1993)"
b4kqy8,"[Chechnya] A Russian patrol is hit by a Chechen IED, killing and wounding multiple. *NSFW*"
2y8ttv,Iconic war photographs and stories
9xvzpy,Japanese troops retreating under machinegun fire on Okinawa
6b96rh,"Three photos captured the last moment of B-25J ""Jaunty Jo"" after it was hit by Japanese flak and subsequently crashed near the Byoritsu Oil Refinery, Formosa, May 26, 1945. Note the gaping hole opened next to the pilot's side in the 1st picture."
4t1xr6,Footage of Turkish Attack Chopper opening fire on Turkish Police Station and killing 17 Police Officers.
b9ve5l,[Vietnam] US Marines Evacuating wounded out of the Field. Operation Medina. October 1967.
342aex,"Tomahawk missile filmed flying by, Iraq 1991"
6r7vq4,"Two photographs of a Union artillery battery during the Siege of Petersburg in Virginia during the American Civil War, c. 1864-1865."
95nk9i,"[WW2] Japanese Zero gets set on fire by US anti air, then crashes in the sea. Battle of the Philippians"
bs313h,"German armoured column advancing in Russia, 1941"
bd2o9x,Footage of an LNA airstrike direct hit on GNA troops (with sound)
an4hdy,"CBS Vietnam reportage ""Hill 943"" (1968)"
b85e5t,"U.S. troops move down a street after a raid Waldenburg, Germany 1945"
b3kl7d,US Air Support Dominates Taliban Attack on Patrol Base Skullet
droybi,On April of 2003 the 11th Marines were on the ground conducting fire support for infantry operations outside of Baghdad.
do4059,Indirect Fire from SPG-9 and AGS-30 /Latakia
8tdk6k,"[WW2] Japanese or Korean soldier trying to flee from US Marines is shot and killed. (The Battle of Tarawa, 1943)"
56svbu,I'm back with more (10) WW1 pictures my grandpa took during his time in the First World War. I included a surprise in the end! (NSFL)
90ch4b,Massive Tunnel Bomb
3qql77,"Unedited gun camera footage and audio from a 1989 dogfight between U.S. Navy F-14 Tomcats vs. Libyan MiG-23 Floggers. It gets intense at the end, but the Tomcat drivers come out on top."
8ncctl,"""Infantrymen of the 27th Infantry Regiment, near Heartbreak Ridge, take advantage of cover and concealment in tunnel positions, 40 yards from the Communists."" Photo of American soldiers during the Korean War, August 10, 1952."
amm360,Luftwaffe pilot bailing out of his Messerschmitt Bf 109 caught by the gun camera of an Allied fighter
a7pzar,[Vietnam] PBRs engage Vietcong after they ditched their boat loaded with explosives.
84y9fs,"""British A. A. guns illumine the desert wastes."" Photo taken during an aerial Axis attack in Tobruk, Libya, c. 1941-1942."
5f6wtr,Bf 109 cannon fire tearing chunks off an early model Spitfire - 1941 [gif]
clseqc,Battle of Crete [1941] in color
bcc7hc,Napalm dropped on village of Trảng Bàng in South Vietnam
d9e69x,Al-Qaeda's splinter group AQAP members attacks against Huothi militants in Yemen
28a8b1,"Having lost a soldier, Americans cross the street under cover of Sherman tanks while taking sniper fire from the upper floors of buildings. Western Germany, c. 1945 [1200x985]"
7fumfs,French Special Forces destroying an ISIS kamikaze car on approach (Raqqa)
amv2vd,Syrian opposition engages Government armor with a hidden TOW missile - Ghouta 2017
aox23h,B-1B over the last ISIS town today just before dropping
7rwwu8,1944. Cca. 1 minute after of the german V1 rocket strike in London looking from Drury Lane. Source in comments
a7ffy0,[WW2] 3rd Army engineers attempt to build a bridge under heavy enemy fire.
99igxs,[Turkey] Turkish Insurgent gets shot in the groin area with a tracer round. Footage taken from truck-mounted remote weapons system.
asiuv8,"FSA ""Hell Cannon"" cuts power in Aleppo while engaging a sandbagged position - 5/26/2014"
2qaoa8,Iraqi Rambo finds out why people fire from cover.
d3v673,"Marines taking cover on the beach during the 2nd Battle of Guam, 1944"
7x5zn6,"The last stand of the Ukrainian ""Cyborgs"" before being overwhelmed during the second battle of Donetsk International Airport 2015."
7f8xmk,South Korean Mechanized Infantry in Vietnam (1968)
acggdx,Brutal WW2 Video: Captured By A German Cameraman - YouTube
cw42ck,"Mi24 shot down, filmed from the inside"
ay3c5i,[Vietnam] Footage shot shortly after US Soldiers were ambushed by The Vietcong.
2jfj9i,"Taliban fighters argue after failed IED/small arms ambush, like something out of a comedy"
637kmz,Ten years since my most difficult deployment to the Middle East. A buddy of mine made this using everyone's combat footage. Enjoy.
65by5x,Official footage of GBU-43/B Massive Ordnance Air Blast Bomb (MOAB) dropped in Afghanistan yesterday
bx3p7o,[Vietnam] US Soldiers of the 101st Airborne treat a wounded man after taking shrapnel in the leg from mortar fire.
5wb1fa,Somali pirates VS Private security . Polemic REAL FOOTAGE
aykbfk,MLRS attack on a Syrian cement factory - 10/25/2015
c7f8cq,Taliban fighters ambush a Pakistani patrol attempting to clear a compound
af16co,"[Iraq] After a US Marine is shot in the head by a sniper, a heavy firefight ensues. 1/3 Marines, Fallujah 2004."
9tlaf5,A low-flying MiG fires its cannon directly at Syrian rebel cameman (2014)
47l0yi,Large album of my favorite pictures from WWII
9jlhtf,Another mine clearing charge. Syria
cha8c2,"[Afghanistan] Footage captures the moment Lance Corporal Christopher Levy is shot in the head by accurate return fire. He would not survive the injury. December 7th, 2011. Helmand Province."
blx0rs,"Turkish armor engages isis targets and destroys sbvied, fsa cam, Operation Euphrates Shield 2016"
ddjuu7,Battle of Midway 1942
3qvcp5,IS member in Libya uses a shopping trolley to mount his .50cal (re-submitted because of rule 3)
34nzf2,ISIS has disguised a Grad launcher in the bed of a dump truck
551jr6,"WWI: Death at Herenthage Park, 23rd of August 1917"
c45ro7,"Indian Forces assault a compound, Kashmir"
2yxlin,Kamikaze plane getting shot down (circa 1945)
8hzr9t,"Photo taken from the periscope of an American submarine of a Japanese hospital ship during World War 2, March 1943."
6om2qq,Philippine Army actual rescue under enemy fire with subtitle.
ct83w8,"Cameraman Khaled Hamad and paramedic Fouad Jaber killed in IDF shelling (Shujaya, Gaza 2014)"
5s1ahn,"The Nazis' Remote Controlled Goliath tracked mine, Date Unknown. [WWII]"
bkai73,"Receiving end of 155mm arty barrage, Operation Euphrates Shield 2016"
8owjdk,ISIS fighter uses a surface to air missile against an Iraqi helicopter - 2014
9c4mm6,[WW2] 2 Japanese soldiers are narrowly missed by an American strafing run.
870xvf,"French and British troops prepare to repel a German attack, March 25 1918."
a7ca3h,152 mm Ukrainian artillery working on Russian positions in Donbass
9a4d4e,"""Retreat from Verdun. Anti-tank gun in action. Hill 510. 1918."" Photo of German soldiers from IWM."
9hfs1o,Reporter embedded with NATO troops in Afghanistan gets hit in the face with an RPG.
95dqq7,ISIS soldiers (terrorists) hopeless in face of government tanks (blown apart at 3:17)
9h6s7q,[WW2] Tank battle of Cologne.
cxgroi,Afrin liberation forces operation against turkish backed rebels Aug 30 - Daghilyash
5twqe1,This Is What Effective Small Arms Suppression Looks Like
c52a3r,Saudi F15 taking down Houthi drones on its way to Saudi arabia.
aljleg,Syrian Rebels use a homemade trebuchet to launch anti-tank mines at SAA positions - Daraa 5/13/2014
9weoeb,Iron Dome in action now over Netivot in Southern Israel. Major barrage of rockets coming in from Gaza now.
cbdh1g,Iraqi Mi-35M against IS militants
5b3xmo,We need to talk about rule 3.
bkcj4x,Fallujah 2004 Inside Hell House
7v7fm7,Purported last stand of the downed Russian SU-25 pilot yesterday
63nk9v,"[WW2/PHOTO] Urban warfare in Crimea, 1942"
ck6te1,"Death in the Ia Drang Valley, by Vietnam war veteran Jack Smith"
c0lksp,"British soldier fires Bren gun near Arnhem. Operation Market Garden, September 1944."
8q0cqo,"WWII Dog fights, pilots bailing, gun/rocket strafing. Beauty of a video for WWII air nuts like me."
6jmhvj,Special Forces Soldier Shot Three Times And Treated On The Battlefield
dq90yd,More Iron dome footage from 20 minutes ago. Priceless reaction.
6vdgyj,Recently discovered authentic footage of a German soldier being shot in the neck by a sniper during World War 1.
5xl9tb,First Chechen war
7bc084,"Syrian reporter films his front line position getting hit by 4 Syrian regime tanks, east Hama. incoming tank shells clearly visible"
47u1xr,German Mech. Infantry Assault - Eastern Front (Color)
8kzkb2,“Give em some cowbell.”
71ss55,"Ken Burns' new documentary ""The Vietnam War"" is available for free at PBS.org. Amazing."
bmpd6b,"""Troops take cover while waiting to go forward on Queen beach, Sword Area, 6 June 1944. Part of the German strongpoint 'Cod' can be seen in the background."" IWM D-Day photo."
959z60,"Hamas militants fire at IDF forces on the Gaza border, IDF responds with tank fire."
7nnc35,Soviet Snipers - Stalingrad 1942
5df3p4,Syrian Soldier records a goodbye video to his mother as his position is being overrun
8yd0f0,"ATGM strike on the rear of an Iraqi M1 Abrams - Ramadi, 2015"
bh3wbk,US Special Forces Combat Footage in Aghanistan. Helmet Cam Live Action
5ijk80,Suicide bomber (SVBIED) detonates inside army base - Afghanistan
7q6y0z,"[Vietnam] A wounded Vietnamese ranger with his weapon is ready to answer a Viet Cong attack during battle in Dong Xoai on June 11, 1965."
9clerc,1 US Marine killed 1 US Marine wounded from rocket attack during battle of Hue City (1968)
5g5sm0,Drone view: Truck bomb in Mosul attacking parked Iraqi vehicles.
8uj1ne,"""Iraqi SOF in Mosul, taking cover behind a HMMWV after a cab bomb explosion [4000x2667]"""
9e7qcm,"[WW2] B-17 Super-Fortress spirals out of control after being attacked by ME-109s. One man bails from tail gun, another from the bomb bay."
5m44om,Messerschmitt Bf 110 G-2 tears into a lone Boeing B-17G in a prolonged attack in the skies over Europe - 1944 [gif album]
ad0rrx,IS fighters trying and failing to break siege around Mosul [August 2017]
apznx9,T-72 sets off massive VBIED
9hs9gm,[WW2] Japanese soldier shot and killed by US Marines.
9mxnx4,A US sniper team operating out of COP Honaker-Miracle engage Taliban positions in the mountains of Afghanistan
75k9vb,member of the FSA gets shot in the head as he attempts to aim an rpg
62dnda,Passchendaele Before and After Third Battle of Ypres
as4fr7,Syrian Army forces detonate a tunnel bomb under a fortified Al-Nusra position - 6/2/2016
5njsuv,"""To clear the way for the first airstrikes of the Gulf War, eight Apache helicopters had to covertly destroy Iraqi radar sites. This is a first-hand view of how their mission went down."""
9gjb08,"[WW2] US Marines on Okinawa attempt to free a tank crew trapped inside of tank after it struck a mine, it then blows up. No chance for crew inside."
6cex31,ISIS suicide drone targeting Iraqi troops in Mosul
brbctw,"[Vietnam] Medics patching up wounded, preparing them to be flown for further treatment. 7-3-68."
7gocmd,First Chechan War Album I Graphic [Russia][Chechnya][Caucasus][209 pics in collection] XPOST From /r/Jessicamshannon
agxhrv,Taliban militants blown into pieces in an airstrike
7xm2l7,"Original color photograph captioned ""USS Idaho (BB-42) Fires the 14/50 guns of Turret Three at nearly point-blank range, during the bombardment of Okinawa, 1 April 1945. Photographed from USS West Virginia (BB-48)."""
7svzrt,Special forces rescue wounded soldier amidst firefight
b2fg7a,Blackwater Little Bird MEDEVAC rescue of Polish Ambassador Edward Pietrzy
avw5lf,WWII original color: B-29 Superfortress bombers escorted by P-51 Mustangs on a strategic bombing mission came under attack by various Japanese fighters over Mount Fuji (1945)
44lzbo,Romania '89 - can't have a revolution without cookies
2uck03,Peshmerga hits an ISIS fighter with something and sends him flying.
8f03qg,British Soldier Fixes Weapon Jam With Multitool During An Intense Firefight
2kds57,[GIF] American Apache gunship takes out 4 insurgents with 40 rounds of 30mm [Locatiion unknown]
cak6bq,Lucky Is fighter almost killed
6piks7,US navy fires warning shots at Iranian patrol boat in Arabian gulf
3am4c5,First ever photo of actual combat. Taken 1870. Prussian soldiers advancing on the French positions. Photo taken form those positions. x post /r/HistoryPorn
7fl2ga,"Iraqi Air Force destroying ISIS car bomb near al-Hadar, Anbar province"
9bpabv,[Syria] Syrian Tank crewman with blown off leg attempts to get away before he his shot to death.
87lkvo,US Army caught in crossfire in Afghanistan taking incoming from Taliban and US National Guardsmen (lots of incoming rounds heard and seen)
9vhlgl,"A Face of War (1968) - a company of American Marines in Vietnam are intimately filmed for 3 months nonstop. Fierce firefights, long stretches of restless boredom, and awkward encounters with villagers portray a raw, unflinching depiction of armed conflict. No narration, no musical score. [1:19:05]"
8yqppk,"While not available yet, Peter Jackson is working on a new documentary with some amazingly restored WW1 footage. Thought I would put it on your radar."
6hp1he,Large ISIS tank truck bomb in Mosul
4ewfwo,Rare vietnam war photos
cuyy4r,ATGM fired by Al-Nusra hit a large group of Hezbollah infantry standing on hilltop
2hgp79,Here are my Vietnam war photo's that i've collected. Cause my Chechnya/Bosnia wars photo's were much appreciated.
810015,Australian Special Forces provide excellent suppression fire for a casualty during extraction [Credit: Dan Pronk Instagram]
4yv7d9,"D day June 6, 1944 Normandy landings"
9k7y9h,"Kurdish PKK fighters clash with IS in Sinjar, Iraq, one fighter is wounded by sniper fire (2014)"
6h6s7u,"""Rock & Roll to the World"" (Marawi)"
9q13a6,"Humvee gunner would've died by sniper if it landed literally an inch higher, you can see the bullet hit on the right armor plate next to the barrel"
89tq7r,Photos of American troops in combat during the Meuse-Argonne Offensive in 1918.
49rqak,Iraqi sniper kills marine and targets the medic attending to him 2004 Fallujah
c9k6fm,Houthis destroyed 6 targets with an ATGM in Marib. 05.07.2019
69mp4q,Ukrainian soldiers fend off an attack from DPR forces from their trench positions
1ug98y,Life of a Marine Grunt
98d8u0,[Syria] Chechen commander is killed by a mortar round.
b5p5al,French last bayonet charge - Sarajevo 1995 - interviews of french soldiers
3xwavx,"Frozen Lives, Not-So-Frozen Frontlines - Photojournalism in Donetsk, Ukraine"
9962va,[Chechnya] Russian soldiers on patrol step on a massive IED.
9862oj,[Chechnya] Russian LAV is hit by an IED.
3tyirs,"Luftwaffe fighter attacks a B-17 formation head-on in close proximity to ""friendly"" flak [gfy]"
4kb0pp,Google Earth view of Donetsk Airport being destroyed over time. (Album) [Ukraine Conflict]
83n82o,"US SAW gunner fights off an ambush until A-10 CAS comes in to save the day, followed by some mortar fire. [9 min, POV, Helmet Cam]"
7mypvb,Egyptian Citizens rushing Isis soldier after being wounded.
97w0cf,Nazi Sturmtiger firing on buildings
42oab1,Mexican soldiers with a Hotchkiss machine gun take cover in a YMCA building [1910-1914]
80jo63,Different view of CRAM at night
bdnb7j,SAA barrel bomb knocks a cameraman off his feet after landing danger close - Darayya 5/20/14
6xszfa,Combat medics treating casualties in Iraq in the war against ISIS. Very small and underrated channal.
67nq8l,8.8cm Flak 36 brought up to deal with a Soviet bunker in Kiev - July 1941 [gif]
1x3o9s,A German train full of vehicles derailed by Russian Partisans during WWII. [GIF]
2aviec,[GIF] Taliban position annihilated by 9 x 1000lb JDAMs
atmm6s,[WW2] US LTV is hit by Japanese Artillery as it approaches the beachhead.
8e6m3y,What It’s Like to Endure Aerial Attacks
7751ka,US SF soldier assigned to Combined Joint Special Operations Task Force-Afghanistan fires a Carl Gustav recoilless rifle system after receiving small-arms fire
2zpdd0,"March 20, 2003. Invasion of Iraq, Bco. 2nd/187th Infantry, 101st Airborne."
dx8lbd,"Drone records exchange of gunfire and grenades in close combat in Saada, Yemen."
4221oq,[GIF]Drone footage of VBIED attack at outpost (Syria - Jan-1-2016)
dd4igs,GRAPHIC Special Forces Combat Up Close and Personal (Afghanistan) (NSFW)
c37o7e,"British Army's famed use of Vickers machine guns in indirect-fire as creeping barrage weapons, here during WWII in France (1944)"
6pamk0,Jordan has released security footage related to the gunfight that killed three U.S. soldiers in November at Al Jafr.
6qxu7w,Americans watch Afghan insurgents accidentally blow themselves up while planting an IED in 2009
5s9zo5,That time when British Royal Marines strapped themselves to the sides of Apache helicopters in an attempt to rescue a fallen comrade left behind in a hostile territory in Afghanistan [07/01/2007]
c68dhw,SAA soldiers standing around some cars at a checkpoint where completely obliterated in an ATGM strike today by the NLF
6b43wg,"U.S. 2nd Infantry machinegunner just before and after he was killed by a German sniper in Leipzig, 1945"
3kkpyx,"""They're telling us they'd rather die than come out and surrender... so they're going to die."" USMC in Iraq"
1rv2a2,Australian Soldier Killing with a Flame Thrower During the Borneo-Pacific Campaign of WW2
brobxk,"Jammed .50 Cal at close range. Paktika Providence, Afghanistan."
7qcu0c,Private Military Contractors Shoot Up Approaching Somali Pirates
6dx9f8,"3000lb Mk.118 hits bridge near Dong Hoi, Vietnam. Either 1965 or 1966."
9gxfui,"The German pocket battleship Admiral Graf Spee in flames after being scuttled off Montevideo, Uruguay, after the Battle of the River Plate, 17 December 1939. IWM photo."
5284e8,Various ww2 images
8tq4vm,US Marine Hit By Iraqi Sniper Tells What It Felt Like. (Old footage with commentary by the Marine added).
5lfh8f,German Combat Footage from the Second Battle of Kharkov - May 1942 [gif album]
7bll1r,"Street-fighting around the Kremlin, November 8, 1917. Officer-cadets loyal to the Provisional Government fight the Bolsheviks."
52f4b4,"(xpost from r/HistoryPorn) [WW1] Battle fatigued soldiers stare into the camera but the machine gun dogs turn their heads to a sound or smell that comes from their right, Belgium 1914. [735x500]"
6o400r,"Austro-Hungarian grenadiers with German Stahlhelm and Austrian Berndorfer helmet on the Isonzo front, September 1917"
81ymrb,[NSFW] Resurfaced ISIS video in Mali from US SOF head Cameras (incredibly brutal and disturbing; includes screams of agony)
bj8agb,Guaido’s forces and Maduro’s forces exchange gunfire on a crowded overpass near a Venezuelan military base.
5rj6nt,Australian soldier takes aim with his M3 Carbine during the Korean war.
