post_id,title
9ro5ra,Iron dome intercepting ~10 missiles fired from gaza (30 minutes ago)
atvgea,Libyan T-55 tank is catastrophically hit with an ATGM
ch0ufn,US soldiers blow up an Iraqi fuel tanker with an M203 grenade launcher (2009)
bfpd8q,"Los Angeles-area gangsters fighting for Assad in Aleppo, Syria [2014]"
c2ma1i,Tank dodges an enemy projectile
8s23il,Soviet paratroopers sliding off a Tupolev TB-3
c8b5hr,"Lone US Army soldier gets left behind while under fire in Charkh District, Logar Province (2011)"
cejt20,"An image of a dead German soldier in France, side by side with the present day location."
8lc5ak,Drone dropping a bomb on armored vehicle.
ckkij6,[OC] It’s not your typical combat footage. These C-RAMs have saved countless lives from incoming rockets.
b9e932,[WW2] US Marine uses an explosive to blow a Japanese Soldier out of his spider hole. Somewhere in the Pacific. **NSFL**
aois4x,Militant sniped in Syria
ai1alm,Iron Dome intercepts a Syrian projectile over the Hermon Ski resort.
bem62j,Dodging a sniper's bullet
6hxq7u,"Volunteers Try to Extract Little Girl From The Kill Zone [Mosul, Iraq]"
bl4041,Iron Dome interceptors against Hamas rockets
aicqcw,"[Vietnam] “Black Rambo” hip fires his M-60 to suppress a tree line, Operation Cedar Falls."
9tr9jc,"Iron Dome intercepts incoming missile fired from Gaza, missile impacts feet from cameraman (2018)"
ba0loa,IS suicide bombers rushing an Iraqi PMU detonate in gruesome fashion
a59slg,[Vietnam] US plane drops two Mk 82 bombs on a Vietcong position.
dn2ikf,Syrian rebels use a crude trebuchet to launch burning pitch towards government positions - Damascus 2013
ayyyft,Syrian taxi finds himself caught in the middle of an active warzone - Damascus 2013
bkj5u0,Iron Dome intercepts projectiles fired from Gaza over southern Israel an hour ago
c6mdtx,"NATO bombing on Serbian train/bridge, killing 20-60 people"
cmy701,A large gathering of Taliban fighters is hit with a Hellfire missile in the Nad Ali District of Helmand Province
ci3bho,FSA sharpshooter using a modified DShK to engage government forces in Aleppo - 7/18/13
c8o0pj,French Foreign Legion battle with the Taliban
ampcko,French farm workers busy themselves with the harvest in the Summer of 1944 as US heavy artillery fires in the background
71hbwm,Iranian drone shot by US Navy
bkplzn,Iron dome intercepting Hamas rockets during a news broadcast near Gaza Strip
cge7ds,Taliban fighters get taken out with a Hellfire missile
cdkn2p,Ukrainian dashcam captures the moment a rocket artillery strike hits the city of Mariupol.
ay8j5g,"Paschaendale aerial photo, before and after battle"
a1oai0,Apache annihilates squadron of Taliban whom were on their way to ambush a U.S. patrol (Afghanistan)
c4jepc,Just a another morning in Syria.
aucyvd,"IS fighter falls dead in front of cameraman, who uses him as cover while reloading"
chdhok,"Taliban fighters making their escape on a motorcycle are intercepted by an A-10 Thunderbolt II (May 28, 2011)"
65ihd2,[88 pics in album] My Colour Pacific war album [WARNING GORE]
dk0bt9,"Marine under artillery fire in Korea, 1950"
a2l2l9,IS sniper engages the ammunition box on a Iraqi .50 cal - Fallujah 2015
d1kfn7,Unique footage of a door gunner in an Iraqi Mi-17 laying hate onto a fleeing ISIS vehicle
beawzm,[Vietnam] Green Hornet door suppresses enemy positions with a Mini-Gun.
6jtasl,Sniper battle inside Raqqa city. YPJ fighter avoids death by inches.
abjel6,Narrow miss from RPG
c5cc7p,"Extremely rare footage of GROM in action. 20 GROM operators were surrounded and ambushed by over 80 Taliban militants while conducting anti-terrorist operations in Ghazni, Afghanistan."
aqlm5h,RPG launch failure in clashes against ISIS today
bij3x9,Libyan government fighters demonstrate some interesting machine gun techniques
6lottj,"No One Would Buy My Photos, So Here They Are For Free: Mosul 2017"
drf4gj,Indian Central Reserve Police Force fires Thermobaric shoulder mounted weapon towards Militants/Terrorists after he killed the hostage in Kashmir.
9whqcl,"Iron Dome intercepts multiple targets over Ashqelon, one lands within frame."
cs07s9,"Syrian soldier paralyzed from the waist down after taking a bullet, Damascus."
akzqmp,UH-1 door gunner pours fire into the treeline with his M60 as troops are evacuated in Vietnam
ao3qk0,Islamic Front rebels targeted by the MiG-29 they are filming [Syria] [2015]
aj273p,[WW2] An Ailed fighter strafes an ammo dump causing a massive explosion.
6u5ngn,Isis fighter films himself getting killed by a grenade
5zdad0,In case youre interested. Some colorized German WW II pics nsfw
canezk,"[VERY NSFW] 5 Taliban engages a squad of Danish soldiers. 2 Danes are injured, 5 Taliban dead."
9qf3cc,[Iraq] Iraqi volunteers use an excavator bucket to lower a fighter to into a ISIS tunnel to clear it out.
assl6z,[WW2] Japanese kamikaze narrowly misses group of sailors on the deck of a Carrier.
9i2997,Uniquely British Response to Incoming RPG
dko0ok,Marines fighting in the Pacific. Unknown location or date.
dorjcr,"[Afghanistan] US Soldiers recover the body of Sgt. Mycal L. Prince after he fell down a rock face after he was hit by an RPG during an ambush in Saygal Valley, Laghman province. September 15th, 2011."
dqiu84,Near suicidal low level strafing by 354th Fighter Squadron P-51 pilot Lt. Joe Mellen in November 1944
bfe6th,[WW2] US Marines on Iwo Jima smoke out Japanese soldiers hiding in caves.
cbx7ql,"[Iraq] Helmet Cam Footage captures the moment a US Tank allegedly fired a shell into a building where a platoon of US Soldiers where in, killing two Soldiers. Ramadi. December 4th, 2006."
awhnah,US Army soldiers disarm a Viet Cong log booby trap
boazdj,"FSA fighter demonstrates his low crawl after tracer fire passes danger close - Aleppo, 2013"
bnn9c2,Suicide bomber vehicle explodes in Iraq
ddp19r,"[Iraq] After an Iraqi insurgent falls in between two buildings, a Marine throws a hand grenade in the gap, then uses his rifle to kill him. Fallujah, Iraq. November 2004. 3/5th Marines."
axx6jb,FSA soldier films himself when an IED takes out part of his convoy. Syria
a2s047,"General Eric Bonde smokes a cigarette after being ambushed in the Congo, 1961"
cx6wfg,US Marines attempt to engage an insurgent in Iraq
56nol6,Excited to share my Great Grandpa's own photographs he took during WW1!
cjbfs8,"South Korean troops in Vietnam, 1967"
cezgsk,A lone Taliban fighter shooting at US forces is tracked and eliminated by an Apache team
aaail1,RPG flies right at the camera and hits an MRAP
cvndl3,Young man being nearly killed when he filmed a Russian airstrike on his house in Southern Idlib.
9imkf4,My Grandfather took this photo during a bombing mission from inside his B-26 Marauder over France during WWII
djlzmw,"Yemeni man carries his injured comrade under fire, makes it to cover."
bbrs1f,Houthi militant scores an impressive RPG hit on advancing Saudi armor
4mvadr,Omaha.
dvapft,Palestinian jihad rocket hits the road near Gan Yavne
azz9k1,What remains of the Islamic State tonight
d8gbnh,Taliban sniper close call in Afghanistan
bz8tim,Syrian rebel engages the enemy
60ufrj,Normandy D-Day Gif Rendered In 60fps
7ys7m4,[Afghanistan] US Machine gun nest gets caught in a crossfire
aiqhhe,[Gaza][Israel] IDF soldier's helmet after being shot by a Palestinian sniper (soldier lightly injured) (2019)
bh9iah,Picture of my Great Grandfather during the finnish Winter War 1939-1940.
c8vwjx,"Whoever asked for that D-Day footage, here it is. Full color and real time. Can't remember where I found it, i've had it for years."
cyy4r0,Kamikaze
b6hmbw,Australian SASR soldier keeps shooting at a PKM wielding Taliban fighter in doorway at point blank range
dgahyd,"The crew of a US AC-47 plane fire 7.62mm GE miniguns on a night mission, Vietnam 1966."
cv8pxq,[WW2] A Japanese pilot gets ripped out of his parachute harness after being bailing from his aircraft.
dwq2wl,"Rare action photograph shows an American soldier being wounded by a mortar shell, while on patrol in an Italian village, 24 April 1944"
b7c9s1,[Vietnam] US Marines capture an NVA Soldier hiding in a spider hole. Battle of Hue City.
a48jkd,Taliban training facility in Helmand Province gets destroyed
bhyhwo,Sniper vs 14.5mm AA gun - Libya
d2itln,ISIS in the Sinai (Eygpt) taking heavy casualties
a80ikn,[WWII]Nagasaki shot from the ground
9rxxxn,Drone captures MLRS salvo on daesh targets in Syria⁴
dqzipv,Perfectly aimed SPG-9 lob shot
9yrxy1,Helicopter Picking Up Soldiers on a Jagged Mountain
61yq1m,[92 pics in Album] My colourised WWII album [WARNING GORE]
bznp46,Japanese Special Naval Landing Forces in Battle of Shanghai 1937
6owf2l,[118 Pics in album] Huge Kodachrome WWII album (WARNING NSFW)
d39t7a,"[Iraq] A firefight breaks out after LCpl Phillip Tuesey is shot in the leg while returning from a patrol. Ramadi, 2006. Kilo Company, 3/8th Marines."
9upi9y,[WW2] US Marines use flame-throwing tanks and flame throwers to clear Japanese pillboxes on Iwo Jima.
cwmnq4,"[Vietnam] US Marines pinned down by a Machine gun bunker crawl up to it and exchange hand grenades. Operation Meade River. Quang Nam Province. January 16th, 1969."
akajbc,"Combat Footage from Donetsk Airport, Ukraine"
a34azn,"Two British soldiers on sentry duty in the trenches, WW1, colourised stereograph"
d6bk12,North American F-100D Super Sabre dropping two Mk 82 Snake Eye retarded 500 pound bombs over Vietnam
9w4k4p,"20 rebels vs 4 Philippine army soldiers, whom were expecting the attack and immediately counterattacked, killing 5 and injuring the rest."
d00h86,"German battleship Schleswig-Holstein fires her main battery at Polish positions on the Westerplatte, and in doing so fired the first shots of World War II"
byzgkx,"[WWII] Searchlights points at the suspected enemy object at night, as the U.S. 37th Coast Artillery Brigade attacks it relentlessly with artillery guns and .50 cal machine guns in Los Angeles during ""The Great Los Angeles Air Raid"" (February 25, 1942)"
dxph58,"Color footage of American B-17 Flying Fortress bombers under attack by German Messerschmitt Bf 109 fighter aircraft, 1943"
du4vax,Marines find an insurgent hiding inside of a large building in Fallujah. They break the window and give him a grenade as a gift. Afterwards they make entry into the building and finish clearing it.
atk3xe,US Humvees attacked with RKG-3 grenades in Iraq
cbksjc,"Mortar attack on a US Marine Rifle Squad, date and location unknown"
dgz9y5,"Syrian Arab Army getting hit with an IED, from couple of months ago"
cg9y74,Brazilian BOPE snipers track and engage a group of gang members carrying rifles in Rio de Janeiro
bc7sts,Army of Pride TOW operator hits a Syrian tank moving near full speed - 3/22/17
ar08kv,"Two British soldiers, stereograph, The Great War"
cequ8d,"American Soldiers trying to cross a street under heavy sniper fire, side by side with the present day location."
5t3u5w,"The crew of the sinking Japanese air craft Zuikaku salutes as the flag is lowered for the last time on October 25, 1944. The ship would sink with the loss of 843 men."
ds140u,Saudi airstrike
7j8a2v,Gunship takes out 4 insurgents
bnc2er,"[WWII] Japanese naval infantry troops landed on Kiska Island, Alaska and conducted a combat sweep of the island, becoming the first foreign military forces to establish a foothold on the continental U.S. since the War of 1812 (June 6, 1942)"
4b9qxw,10 years ago I visited Fallujah. Here's 100 Photos of how it went down.
9meb9y,Marines extract a little girl from the kill zone
cgr39s,"One of the earliest active combat photos, from my home province- battle of Batoche Saskatchewan (1885)"
9r9hrh,Russian Navy vessel opens fire on North Korean fishing ship after attempts to board were unsuccessful. 2016
apkbqb,[WW2] B-29 bombing runs on the Japanese mainland.
d2b3dk,.50 caliber M45 Quadmount laying down a wall of fire as part of fixed defenses in Korea
bgfiuo,"[WWII] U.S. soldiers of the 7th Infantry Division fights Japanese troops through the cold, snowy frigid mountains in Attu Island, Alaska, USA. The Battle of Attu remained the only instance where ground warfare took place on U.S. soil during WWII. (May 1943)"
d6gu3e,"An image of US troops advancing in Köln, Germany, 1945, with the present day location"
dfxlom,Bike technical rides again in Tel Abyad
cno6hq,A civilian vehicle gets lit up while attempting to drive through a Ukrainian military checkpoint
bkf10p,"US Soldier narrowly avoids the full blast of an IED while patrolling in Khost Provence, Afghanistan"
a0ak4j,Helo fires on crowd in Turkey
dpczma,The video of raiding baghdadi's compound
da0g2y,View from inside a USMC Sherman tank as the coaxial machinegun engages Japanese infantry on Iwo Jima in 1945
b59t2d,"[Photo] U.S. soldiers assigned to Charlie Battery, 1st Battalion, 320th Field Artillery Regiment, 2nd Brigade Combat Team, 101st Airborne Division fire a M777 A2 Howitzer in support of Operation Inherent Resolve at Platoon Assembly Area 14, Iraq (November 29, 2016)"
9u34bo,Junkers Ju 52/3m transport makes a forced landing under fire
5dx3sm,Granddad in vietnam [mildly nsfw]
9pewcb,[Bosnia] A French UN Peacekeeper is killed by Serbian sniper fire. Sarajevo.
a3v8v8,IS insurgent drops an improvised impact explosive on an Iraqi HMMWV - 2013
c5xn3h,"Photo of the actual B-17G (337571) my grandpa got shot down in during the war. Taken while on a bombing run over Germany Summer of '44. (final mission, after action report, aerial reconnaissance, BDA and POW picture in comments)"
9vsj3k,Soldier Casually Talks with Someone while War is Happening
cly3tt,Nigerian Rambo's spraying at boko haram
ak1814,"T27 ""Xylophone"" launchers on 2½-ton truck cargo beds unleash a barrage of M8 4.5"" rockets in the ETO 1945"
dl5utv,PKK fighter narrowly avoids getting shot while tossing grenade towards Turkish troops - August 2016
dhhsg8,Iraqi gunship comes in low before popping up and engaging IS positions with rocket fire - Mosul 2018
b5g7a7,Indian Security forces blast a house after militants took a boy hostage and killed him.
b150h3,"Israel - ""iron dome"" system intercepting two missiles launched from gaza strip towards Tel-aviv - 14/3/19"
dt8fzj,Ordnance impacting in dense urban area /Syria
cfrw5a,"Saudi police officer successfully defends himself against two rifle-wielding ISIS terrorists in Riyadh (January 7, 2017)"
dh83a3,DNR sniper
5j4wx0,"Lt aims a flaming arrow at a bamboo hut concealing a fortified Viet Cong (Vietnam, 1967)"
aemitc,6 soldiers killed as rebels attack military parade with drones - Yeman.
dq2u5v,Messerschmitt pilot uses a hydrogen filled barrage balloon for target practice during the Battle of Britain in 1940
b72bae,The perils of following a Soviet tank - Infantryman in Ukraine almost takes a spent cartridge to the head
aee47z,"Syrian Army troops use a step ladder and balcony railing to launch a GRAD Rocket - Yarmouk Camp, Syria"
dauma8,9th Air Force B-26 bursts into flames and loses an engine after being hit by anti-aircraft fire over Germany in December 1944
9nl7hb,[Turkey] Massive PKK truck bomb obliterates Turkish forces outpost.
7r8if6,First ever photo of actual combat. Taken 1870. Prussian soldiers advancing on the French positions. Photo taken form those positions
b1u7we,"10th Mountain Div. troops watching an explosion, Italy, 1945"
4y4hz3,"Ukrainian soldiers evacuating a wounded comrade under the shelling in Shyrokyne [June 4, 2016]"
bw0vsn,Iraqi Golden Division member sniped in Mosul [2017]
cc5rmg,"Boeing B-17 of the 483rd Bomb group brought down by flak over Nis, Yugoslavia (present day Serbia), April 1944. There were no survivors. Image is superimposed over present day mapping"
ctpr1o,"Tilbury, London on October 4th, 1940. Luftwaffe bomb aimers view as payload is released. Image is superimposed over modern day mapping"
dojzgb,"Truck Bomb in Maidan Shahr, Afghanistan"
azh2pf,[Vietnam] Cameras start rolling shortly after a US Soldier tripped a Vietcong boobytrap. (NSFW)
dgqsw0,Missile POV upon impact. 2 targets hit. Iraq
dj6emd,An Iraqi soldier carries a wounded civilian in the open before being wounded himself during the liberation of Mossul.
dnrq2w,75mm leichtes Infanteriegeschütz 18 crew hammering a Soviet tank with AP tracer shells in 1941
ba7x7g,"[Operation Desert Storm] Anti-aircraft fire lit up the sky of Baghdad, as aircraft from the USAF and USN as well as other Coalition nations began bombing the city [January 17, 1991]"
cpsfsh,German flak rises up to meet Allied bombers hitting occupied coastal positions
abyqln,"""A sniper from 'C' Company, 5th Battalion, The Black Watch , 51st (Highland) Division, in position in a ruined building in Gennep, Holland, 14 February 1945."" IWM photograph."
bre3t4,US National Guard soldiers kill Iraqi Insurgents at extremely close range in Fallujah (2004)
5mm7jk,Saudi police officer taking out two ISIS attackers with only his pistol
crb1xs,Iron Dome intercepts 2 Hamas rockets over southern Israel an hour ago
dm6eey,Taliban IED Team Prematurely Detonates Device On Themselves.
bk2fh4,Syrian BMP suffers a catastrophic explosion after a TOW hit - Aleppo 4/10/2017
axljve,Disabled Mi-8 falling over Darayya city in Syria
cdcsd0,"82nd Airborne in Grenada, 1983"
bxgdzn,Ukrainian soldier shot by sniper
arnsc6,"Russian airstrike targets a crowded intersection in Sarmin, Syria - 10/20/15"
dljag7,"[Iraq] A Turret Gunner is almost shot in the head as accurate fire hits inside and outside the turret shield. US Soldiers and Iraqi Police then push down the street in search of the shooter. Sadr City, Baghdad. 2008. 4th BCT, 10th Mountain Div."
c7sxi4,"Footage from a GoPro on top of an LNA T-54/5 Tank, showing it engaging targets south of Tripoli, Libya."
a5v1e9,[Chechnya] Chechen militant gets grazed in the face/neck by a bullet during a firefight.
dpmokm,Peshmerga survives IED blast (Northern Iraq 2015)
b3t741,Kurdish separatists explode Turkish military base
9buus5,Kamikaze strike an ammunition ship
a9y9v8,"NATO bombing of Serbia 1999, attack on railway bridge killing 20 - 60 people"
bypk3b,"German infantry attacking through a burning Norwegian village, 1940"
c4qacp,A-10 gun run on Taliban position
ac559i,The moment US soldiers attempted to take out a Viet Cong sniper during the Vietnam war [1336x912]
agjz16,1st Air Cavalry UH-1 inserts a six man squad in South Vietnam October 1967
cy0l9m,"German air raid on Moscow July 26, 1941. Thin tracks - the work of air defense, a thick white line - German lighting rockets with parachutes to illuminate the area for an adjustment of bomb strikes."
631ocy,"IS quad-copter with shuttle cock tailed grenades, captured by Iraqi PMU"
dfci4w,"M4A3R3 Sherman, Iwo Jima [X-post /r/WWIIpiics]"
dcbmci,CRAM fires at incoming mortar rounds in Iraq. Unknown date
67bvza,[63 pics in album] My Korean War colour album (WARNING NSFW)
d6v26g,IDF Mirage shreds a Syrian MiG-21 on April 7 1967 over the Golan Heights
adph4i,VBIED with mounted .50 cal turret bulldozes his way into Iraqi vehicles before detonation - Mosul 2017
cdth06,Winter Sniping in Korea (1950-53)
duf4t5,"An Iraqi PMU soldier is shot by an ISIS sniper while trying to save a child from ISIS sniper fire in Fallujah. The rest of his unit then mounts a daring rescue mission. Utilizing some nearby armor, they cross into the danger area and retrieve both the wounded soldier and child."
a19opy,[Vietnam] AC-47 “Spooky” lighting up Vietcong positions.
d41nwd,A Houthi tank is knocked out with an ATGM
bkxgvi,[Israel] Rocket falls near bus full of soldiers
c7hmdf,IS terrorists in Dagestan eliminated Russian style [2018]
bwnugt,[WWII] German troops during the battle of Norway on the 9th of April 1940. They are here seen during fierce fighting with Norwegian troops in a valley 40km west of Lillehammer. Their goal was to intercept the escape of the Norwegian royal family and representatives of the government.
d5nhak,"US troops cross Suicide Creek with tank support. Battle of Cape Gloucester, 26 December 1943 – 16 January 1944"
a6ryzs,[Vietnam] F4-Phantoms barrage Vietcong position with “Mighty Mouse” rockets.
cql393,"American photographer trying to sleep when IS terrorist SVBIED detonates outside (Manbij, Syria 2016)"
c3bcbq,Syrian militants trying to shot down SyAF/RuAF plane
ar9hwp,Iraqi Security Forces ambushed by concealed ISIS fighters while clearing IEDs
dxd8f2,BMP turret mounted on a Toyota truck used in Syria - 2013
cstb6d,RSAF F-15 shoots down Houthi drone
cu29ma,"Austro-Hungarian dreadnought battleship SMS Szent István sinking after being torpedoed by Italian MAS torpedo boats (it was on its way with rest of A-H fleet to attack Entente blockade at Otranto) WWI, June 1918, [Colorized] [1600 x 1200]"
cit9rj,Nigerian army contact with boko haram while on patrol.
9ee378,"[WW2] French resistance fighter throws a grenade or incendiary device in the back of a German Troop carrier, sending the burning soldiers scrambling."
d196zt,"Type VII U-boat uses its 8.8 cm SK C/35 deck gun to sink an unescorted Allied merchantman in the Southern Atlantic, early 1941"
dtmyoi,[Afghanistan] Marines provide covering fire for their Corpsman during a firefight after a Marine was hit in the leg with shrapnel. Lima Co. 3/7th Marines. Southern Green Zone of Sangin. 2010.
9obh8x,French flamethrowers in action in WWI
d0gj7x,"Mitsubishi G4M ""Betty"" in late war natural metal finish hit at close range over the Japanese mainland in 1945"
c1hk0e,Poor lads get ran down by a tank and shot at while retreating in open fields
5o3zcf,Turkish Cobra (Attack Helicopter) Shot Down By The Kurdish PKK.
cnw6h9,An Iraqi insurgent firing an RPG at US forces is spotted and eliminated
d7chb5,Eastern front (Soviet perspective)
81g0nx,Naval smokescreen from WWII
c0g1t5,"Grozny, First Chechen War"
9o103a,Maritime security forces engage pirates. Gulf of Aden
68v9dv,"Photograph of US Marines dragging the body of 2nd Lt. Donald Jacques out of the underbrush near Khe Sanh during an ambush, South Vietnam, February 25, 1968."
anq6fm,Combat Footage from Ukraine
c189rx,Russian partisans attack a German-occupied village near Leningrad. August 1942
dlqqu0,Taliban fighters attempt to record a night attack against an American position but the Camera IR light gives away position.
6c4dmr,U.S. .50 gunner close call with incoming round
dqckz8,"Continuous machine gun fire defense of COP Keating, Nuristan."
ahnu82,[Vietnam] 1st Division Marines use flamethrowers to clear out brush in search of tunnel entrances.
cfszix,(NSFW) suicide bomber being shot with a rocket by a Kurdish fighter- English voiceover.
bamy1v,"FSA ""Hell Cannon"" lobs a shell into a Syrian position across the street from the camera - Aleppo 6/13/2015"
dvp35k,"Ammo truck struck by ATGM in Hama, Syria 2015"
dd5sww,Deutsches Afrikakorps 20mm Flakvierling AA gun brought into action against Allied ground forces in Libya in 1942
a979z1,[Vietnam] US Marines capturing Vietcong POW during Operation Piranha
73e183,Anti tank mine removal in Yemen w/ Boobytrapped mine
a418en,"The USS Arizona explodes in Pearl Harbor. December 7th, 1941. “A date that will live in infamy”"
bs8f0s,You can see the muzzle flash of a combatants weapon (not sure the type) before the tank fires
bvbyb0,Islamic Front detonates a tunnel bomb beneath an alleged Syrian strong point - al-Ma'arra 10/14/2014
cokvcg,Greek civil war soldiers capturing communist guerilla fighters.My grandfather is in the left holding what I assume is a Thompson smg.
6k8n7f,Venezuela 1992: An F16 shoots down an OV-10 Bronco during an attempted Coup
66ni05,Somali Pirates VS Ship's Private Security Guards
de3y1m,Syrian T-72 takes no chances when coming around the corner - Darayya - 2013
9fnncs,[WW2] Cameraman films a Japanese kamikaze hit his ship.
a7tapr,IS RPG fails to penetrate the frontal turret armor of an Iraqi M1 Abrams - Iraq 2014
7ot6gg,Girl’s reaction from almost getting hit by ISIS sniper in Syria.
66di77,Photographs of World War II from Axis & Allied photographers. [NSFW]
6t17sa,"M67 Flamethrower tank with US Marines clearing out a Vietcong stronghold in the city of Hue, 1968 Vietnam"
a1yax7,"The Cold Never Bothered Me Anyways: American Troops of the 339th Infantry Regiment, part of the North Russia Corps, defend the Trans-Siberian Railroad with a Lewis Gun and M1903 Springfield rifle (circa: 1918)"
co2lvy,"Austro-Hungarian soldiers leaving their trenches and charging Italian position during Caporetto offensive (12th battle of Isonzo), Italian front, WW1, November 1917, [1000 x 718]"
9l1h30,"B-52 Stratofortress levels Taliban training camp. Badakhshan, Afghanistan"
c3tbuc,[Vietnam] UH-1B gunship door gunners laying down suppressive fire with M-60s.
b23svy,British RAF Beaufighters and Mosquitos strafing German targets in 1944
bmytbu,"Only the Dead See the End of War (2015)- Insane journalist Michael Ware's hand-recorded super NSFW documentary on the clusterfuck that was the invasion of Iraq and the subsequent insurgency that grew from it. First hand account of Fallujah, too. Very humbling. Repeat- very NSFW"
d7psj0,British salvos bracket the French fleet at Mers-el-Kébir during Operation Catapult in July 1940
czjfrl,"SAA artillery hits militants on motorcycle, At-Tah, Idlib - September 1."
d8p0ag,"[WW2] US Marines assault a Japanese bunker, using Grenades and a satchel charge. Battle of Peleliu. 3/5th Marines. September 17th, 1944."
9y1054,"[Vietnam] A Corpsmen pulls a wounded Marine to cover under suppressive fire, then begins to work his magic on the injured Marine."
c1p432,"[Vietnam] 3/17th Air Cavalry extracts a wounded POW out of the field, near Khe Sanh. 21/08/70."
b7nrlk,Belgian Special Mission Unit (SFG) destroying tunnels full of terrorists and providing tactical combat casualty care during combined action counter-ISIS operations in Iraqi deserts.
a0lbga,[WW2] US Marine mercy kills a mortally wounded Japanese soldier before throwing a white phosphorus grenade in his hiding spot. Okinawa.
dtswt1,Huge fuel explosion from tanker truck VBIED
