post_id,title
cnaede,My fiancé’s first Paint By Numbers kit that he made for our kitchen while he was in the hospital ☺️ I love it!
dpgzu8,Little woodland friend
7yq2ab,Gardenias from paper. I made this gift for my mother. It’s her favorite flowers
dh7nev,This is why crafting takes longer than necessary at my house.
dforbc,I finally finished this miniature apartment!
buue7q,"Here is my favourite artwork, its natural owl skeleton with feathers, electroformed in copper."
a6e3jd,My Miguel (Coco). Polymer clay :-)
8izbag,[WIP] Crocheted Harry Potter Gryffindor Dragon Scale Scarf
czmrr1,"Double round porcupine quill earrings. Wedding set I made for my older sister. Dyed quills, Swarovski jewel center and rhinestones, sewn on moose hide."
b200nz,Not as skilled as many people here! But made some geode pass-through necklaces today!
8c9u15,"I wanted to try embroidering, so I sketched it out and completely winged it."
ay5s1t,"Just finished this shell, sandstone and copper pendant."
bhf2zd,DIY Bulbasaur planters!
abzshg,Another one done! :D
b16a5i,Handcut 20x16” box frame mountboard in my retired show dog’s profile to display some of his rosettes.
brvgqx,I’ve started making candles.
adqc52,My first sewing project. A fleece blanket for a terminally ill relative.
9qq0uf,I painted the end of a day :)
9c2h32,Pie pot holders I made
dx2nga,Found a beat up $20 playhouse at a garage sale and gave it a cozy makeover for my kids.
96pbgr,My latest DIY wreath!
czhb7l,I painted these flower boy earrings and I beaded them myself 🌻
9pimhw,An Autumn Witch cooking a very important brew
ck73gu,I made a miniature crochet of a Mandrake from Harry Potter
c33jxq,Someone I know makes these awesome Resin rings. Show some love!
93vq2j,I attempted to make a sunflower wreath and I’m proud of it!
7gui8w,My wife has been trying her hand at homemade ornaments .
c6kv6q,This is the tiniest Two Trees pendant I've ever made.
bve0ym,Nyan Cat and Cookie Pillow:) when you make such cute things you become a little happy!)
8df314,I made a moonstone bracelet with transparent glass bead
dm0f93,I made wooden page holder for books with figure of whale.
c6im0g,"My clay snake before it's first firing in the kiln, and after it's last. I'm stoked to have finally finished him!"
bncw0h,"I painted the prettiest girl using watercolors, gouache, and colored pencils"
d9xj4w,A wire tree I made for my 94yr old grandpa based off the one he gave me when I was little.
