post_id,title
7dcl9p,These Golden Girls Crocheted Dolls.
b2bayp,I heard y’all liked succulent wreaths
cjago9,"My bead crochet bag. It is made of ~ 20,000 beads, each of them is crocheted. 80 hours of work"
b4xe7o,Moon phases I made for a birthday present
dwrg4w,A client want a cross body bag with a leopard on it
cby94i,Baseball Boutonnières I made my son & the other Seniors on their team for Prom. He actually liked it and said I got compliments all night.
dkuadh,Got asked to make some wands for a Harry Potter themed convention nearby. ;) This was the first batch.
ba3xb7,Its far from perfect and the colours are a lot darker in person but I'm really happy with how it turned out.
ceybfh,Rushed to make this for a little girl's birthday. Her mom said she loves unicorns and I was only given a week notice on the party! I hope she loves her.
amls5r,First hand embroidery project ever. Decided to try French knots. It’s messy but I am proud of my work!
boexvr,Does neon bending count as a craft? Because I made this butt!
9lh9z4,Here’s my most recent embroidery piece: A purple and mustard floral wreath on butter yellow fabric.
d88xhe,My favorite characters that I made of polymer clay:-)
9fj2ft,Coasters I made.... and done!
awkl6x,I did a thing!
agonew,"New craft, new hobby. Lots of practice still needed but I can't wait to do more. This was from a starter kit from Amazon."
dhzs8m,This is extraordinary! Such dedication to a project. And superbly executed. Wow!
b0rlqm,Heart of flowers
aivkbd,I posted my first alcohol ink artwork three months ago. This is how much I've progressed!
cs07eh,A little drawing I did of a Good Girl :)
alz3ao,"I make Macramé,one of my friend ask for something she can wear on ears,so i made these.What do you souls think!"
cg3dtl,"Update! You were all so wonderfully kind about my unicorn but the birthday girl didn't care at all! She said ""cute"" and tossed it with her other toys. QQ. Oh well, here's a giant Dratini I made for a friend who did love it!"
9ukqzp,Sorry this is a Halloween craft. I just found this sub! Here's my monster wreath I made.
aozuaa,I crocheted a Chill Pill!
amuca9,I love making one of a kind kids clothes!
8sb11g,"First time I try to do a tree of life with rope, I'm so happy and surprised with the result!"
cyxmr9,Some paper silhouette portraits I made
a8uzkz,Squishy was meant to be a gift... I think I’m keeping him for myself
9kwye2,Self portrait embroidery.
a6962j,"Wow, just wow!"
8q4hc3,"My first cross stitch. Not perfect, but so so close to being done."
d1tpna,Finished my first bargello tapestry!
7z6k9v,"Decided to paint my cat, Gravy."
aksf6o,"It’s crazy what a couple months of practice can do! Left is from October, right is from last night."
b0ly5x,My take on the succulent wreath posted last week. Thanks for the inspiration!
9u7kql,One of my favourite finishes to date
9bp8u1,Granddaughter doll
adjxin,"I also made Charlie. She passed away a while ago, but she’s in our hearts, and now also on Christmas tree. ❤️"
a1z4nl,So talented ♥️
89l0wq,"In loving memory of a good boy, Watercolor, 9x12"
apcx2h,The sunset inspired this beanie!
cnzpyx,What I did with leftover pavers and bricks.
dcrrb8,It’s October Third
dc23wv,Coasters I made using alcohol ink on ceramic tile and sealed with resin
8iexxu,"I made a 7 ft long paper mache shrimp, because I could"
aturj7,I painted a mechanic :)
6wmvgb,"I got bored, so I painted a board."
7yeq1u,This is my biggest embroidery project yet. It’s not perfect but I love it!
9ezdk3,Turning Old Christmas decor into New Halloween decor
8y9u7t,Egg-cellent egg collecting apron for my friend starting a sustainable farm
8u9ydo,I painted The Great Wave Off Kanagawa on my concert ukulele
d5wopk,Finished my first elephant. I love him a bit.
996ask,New tie dye shirt 🌈 first time trying this and I really like it😊
9ap90p,"My latest ceramic project next to my first one, 2 years worth of progress"
aiahcd,I make personalized creative ring box for Wedding or Engagement. Do you like?
a6exl2,Silver Slytherin Inspired Ring with Emerald i made with dad! Let us know what you think :D
7ohf13,I designed some stickers.
ciiip7,My father made me this adorable Wall-e out of soda cans and told me to post in here again since he got so many nice comments last time! (I've posted a motorcycle he made the other day)
bmk0cc,I made a necklace using scraps I had
byxs13,I made a bead bracelet
9ss87g,"First custom made to order wreath I’ve ever done, purchased by someone other than my mom"
coo94v,I made a leaf witch doll!
cfaewo,"Yesterday someone used my photo as their own in this sub. You guys called them out for me, so here I am, surrounded by my monsters and unbothered. ❤️"
c8gubl,Harry Potter cake for my niece! I wanted it to look different from every other HP cake out there.
av1t7z,Fantastic work... See to the end. 👌👌
csjp54,"My husband's graduation present! I created the template and hand stitched the whole thing. No rivets, no glue. Tooled front with an etching of my husband's grandfather's handwritten notes and schematics. (My husband is graduating in a degree his grandfather had also studied in)"
a2w01e,"scanned some old birthday cards and made 3 of these ornaments for myself, my sister, and my cousin. my grandma passed away in 2012 and my grandpa passed this may, but I wanted to make something to have them “here” with us this christmas"
dsbnz8,I made this copper and quartz pendant and I’m kind of proud of it! :)
anekf6,Blue painted mandala ukulele 💙
cth25n,"After five months, I've finally finished a pair of hardened leather gauntlets. Entirely made by hand."
aj7byb,"A mess, thoughts?"
a95jy2,I painted a little portrait for a family :)
cfivtr,A heart I cross stitched for my best friend who is a cardiologist 🙂
aejezg,Just started needle felting!
c0lbx5,my last button creation was well received so I thought I would share my second one! I just love whales :)
c0dvz2,I finally told that little voice saying “nothing is good enough” to shut up. I am so proud of these wallets.
9ursou,Yet another wire tree!! Shaping is complete. This one I'm going to clean thoroughly and fix it to a Cherry wood base!!! I'll return with the finished piece in a few day!!!
8r6hz8,Felt veggie garden I made for my little ones
82v5wk,I love painting dogs
9ndyq8,"Same embroidery pattern, two ways"
9ccavl,Daughter's Creation
dmfj8p,Painted my dog on a planter pot
7vzwlv,"I made a collection of small vessels! Made with resin, gold leaf, and glitter"
cyqnpv,I’m not sure if anyone will appreciate this but when I get bored I make wire sculptures.
a5v7e4,I made a thing!
c8965u,"Stayed up late each night for the past week and a half working on this bday present for my wife today, just finished last night. Our son was born 3.5 months early and she watched over him in the NICU while I had to work. She says he is her little angel. He is 5 years old now and ready for school."
9lo1re,some beaded camera straps i made
cdy3wz,I just finished my first attempt at resin art
b0t3jj,My first time to make a two-sided pendant.
ckoajq,Made a glaze rainbow with my handmade mugs!
ah3hdw,made a string art portrait of my mom
al2kd7,The eternal struggle
9dwfbv,Hi! I create lampshades in the shape of flowers that will glow in the dark and would like to share my work :) [OC]
apgxxj,i made a flower crown!!!
aock5a,Pretty planter I painted with alcohol ink :)
99qp2j,My dad broke his leg then my mum broke her arm straight after. I made them these bears which they loved. 😂
dvzqud,Copper mushrooms and amethyst pendant I've made
ca5ji2,"Wood resin fish, share with everyone"
bbb5u4,Just finished this hand painted drawing and trasfered it onto a mug. :)
9mpmd8,I made a malachite leaf necklace.
cmn0g8,My pink Lily is handmade. Cold porcelain
at8q4x,I made this crochet otter last week :)
cx4v5n,Little triceratops made of polymer clay
7inl8l,My favourite embroidery piece yet!
bf1rrj,I embroidered my moms dog for her for Mother’s Day
d0172j,Finally fixed the tear in my pants 😊
a2pcg5,"Here's a herd of hippos, sculpted and fired in raku glaze"
d13uvy,My second attempt at a harry potter inspired dresser. This one made for my niece's birthday.
bsv5cc,Just finished this Rosy Maple Moth embroidery today!
ctvkdk,Mustard crochet bag for the upcoming autumn :) THAT color <3
cascvm,My friend got into Med school and has to move to a new country and can’t take her chonk with her. I decided to make her a needle felted version to keep her company.
c22fo1,Flowers I made from crepe paper
abtn9j,My homemade wedding dress and overcoat I thought you all might enjoy
888jgc,My mother in law makes amazing things with polymer clay and doesn't get the credit she deserves - here's some tiny pizza and a cutter she made
8050dq,My colleague begged me to make a Giraffe for her new baby due in May!...I enjoyed every minute of this amigurumi project :)
c6xxqx,"My girlfriend makes personalised felt dogs, they’re not the most lifelike but I think they’re adorable"
ajekpz,My husband hand-made an emerald ring for me!
8upi1g,Experimenting with painted additions to my bird embroideries!
9cgvx4,I’m working on a bird costume for Halloween.
b9tenl,A little peek into my book binding process. Here I am pasting the pretty papers onto the book board.
9r3ywq,It’s nowhere near done but I love the colors so much!
cm20dl,My latest- a yarn ball wreath for my first post!
b6f6v4,"As a guy I never thought to give sewing a try. Just started and I’m hooked. Meet my new Crawfish, Leroy"
akw39y,Not sure if you'd guys count this as a craft....but I make mini sets and photograph Furbies in them
aac82n,Stained glass scarves I crocheted for my mom and myself!
c4egbv,Found this hat at the thrift shop and then added my own lil flair.
arfjdo,WIP- first try at embroidery. Working on a little Corgi set for my sister’s birthday gift.
bqzpor,I bought some new beads and couldn't wait to try them out! I hope you like my latest bracelets :)
bgfb0r,"I'm painting my way through the zodiac, today was Leo :)"
cs8v2c,Stitched this tiny fox kit surrounded by foxglove
c8rsx7,"I love ferns and woods, so I made this hair piece"
d2qc0w,Flower arrangement I made from paper
aqx5x1,I made these Crescent Moon Dreamcatchers
9gupz5,polymer clay & resin koi pond in a tin
83p3xz,my first attempt at an embroidered shirt!!
87ehfl,My 'floating' balloon embroideries on organza
9fze7e,I'm never going back to wrapping paper! Used a grocery bag and some string and decided to add an origami cutie to the top.
a5i4up,"I made sushi candles as part of a white elephant gift, I thought this would be the best place for them"
9vlegq,I return with the finished piece!! Throughly cleaned Copper Wire Bonsai nailed to Cherry wood base. I couldn't be happier!!!
a0rpo0,Just wanted to share some of my embroidery pieces!
bt7pu5,Got my wife’s stain glass she made framed. Been in storage for nearly 20 years but now she can enjoy it properly.
d80o1u,Stepped out of my comfort zone with these vibrant colors.
de2tyg,My first time needle felting :)
afiye7,Six of my most recent watercolor forest animals. I made this paintings for my Etsy shop. :) Hope you like it!
bibzdh,I made these leaf earrings.
bb42qu,I’m really proud of this barrette I finally finished in size 15 glass beads. Freehanded the pattern based on ‘Starry Night’
bnecak,I’m not artist but I tried a thing
coguya,I painted my Zippo just because Im too much in love with a Van Gogh’s painting named “Almond Blossom”
8zw1hz,Paper flowers I created for a wedding bouquet
aw61g7,I make clothes and this dress is still one of my favorites
8wkij0,I painted my cousins adorable dog as a surprise gift for her!
837xgv,Decorating some of my mugs!
cbqn7j,I finished my very first sewing project!!! Calcifer ❤️🧡💛
9cn7qg,Paper Polly Pocket toy!
drmd9g,I made a few (hundred) pompoms.
8ui38h,Beer cap table im working on
9dik5r,Bread dragon I made for the Great British Bake-off promo
cia7sw,Glass in Airplane watercolor painting
8kt0lb,I drew my friends dog who sadly passed a few years ago. He was a good boy.
7l18dq,"Practice makes perfect, been at it a month now!"
axuu6n,This one holds a special place in my heart.
anmxhw,My first knitted crossbody bag.
a25g9i,I wanted to post my DIY pom-poms and figured this was the best way to do it 😊
cu4m0w,First Macrame Wall Hanging Ever!
8rbf58,Wedding band I made out of a British penny for my grandma. She and my late grandpa married in '64.
dtep3z,I made a little felt Freddie.
ahukt5,My polymer clay berries. Bracelet and brooch with cloudberry :) You like?
dd1hsg,I made a birthday card with a llama that changes expressions
bwic4v,miniature greenhouse (for ants)- here is my latest self care project. I am very frustrated and unhappy with many of the components but wanted to share
9zoozb,A pillow I made for my friend
9ygajy,Embroidered Monday Mood 🎉
afzj8l,"""Forest Master"". Jade ring"
9id7ys,I recently made this for a sweet lady named Rose who retired from the department I work in after 20 years!
ake20b,I made Mouse doll. Do you like?
9j21tz,A witch out for a walk I drew to honor the season change :)
bueiip,"My daughter is super proud of her painting, we absolutely LOVE it"
bhutvf,"Created my own wedding bouquet using coloured paper, comic books and lights."
blsxoc,Handmade Copper Wire Pine Tree Sculpture
9oon6y,"I painted a little desert scene on a quarter, then found a nice floater frame to display it in!"
dv03u0,Slowly getting better at woodburning. What do you think?
cxujjb,My Aladdin and Princess Jasmine )) Colored polymer clay.
bh82qd,I made another poncho. It’s hand woven and can be worn in various ways
dhgzv4,I made little lilac sloth with stars and little cloud☁️ He glows purple✨
dqrxdx,"Doing my art as jewellery was feeling a little cramped, so I am expanding! Broken cymbals upcycled into crazy armour for my battlejacket"
9tf4v6,I'm the sister who made Ursula! Check out the Oogie Boogie I made for my son!
biilov,My husband made this for me while I was on vacation. I had no idea he had such talent.
9tyo31,I think my rubber stamps turned out well! Such easy custom packaging for my art!
9gq756,My niece asked me to make her a white purse with sunflowers
c6dniu,Made my first octopus stuffed animal. My youngest picked out the colors. Took me three to four hours to make. There is improvements to be made but not to bad for the first time.
aa3vcq,I drew a little magic lesson :)
akr83o,Hi! I crochet small things and make them into jewellery. Recently I have been making these forget-me-nots 😊
a8ldub,"I made this for my girlfriend. She loves turquoise, and I call her my honeybee. CC welcome!"
9trbfh,"I knit my first headband and I’m so stoked I completed it. It’s got its flaws but honestly I’m just so happy I did it, I think it’s perfect."
cxjv02,My GF makes beautiful woven pearl bracelets and is so shy about them. I am very proud and think they look great!
bq3fwx,I carved this little Gandalf out of wood
a0dh0x,A rocking moose I repainted for a friend’s little girl (it was originally red).
cdmhc3,Went to Switzerland recently and decided to bring a little piece of it back with me.
biytzv,"My painted snake. Bit of a work-in-progress, this one."
cgjesc,Hand embroidered a hummingbird and flower on this sweatshirt.
9uy4ai,"I made an origami Happy Dwarf from one piece of paper. It's so hard to give paper expression, and it's still not perfect, but I'm practicing :)"
dlijea,"Raspberry earings, my creation"
8v40tj,I made the cake for my great nephew's first birthday. The Very Hungry Caterpillar was the theme.
9ys61h,HBP Advanced Potion Making textbook
94d2lo,I tried my hand at simple macrame to repurpose my yogurt cup to a tiny hanging planter. It's my first project so I don't know any fancy knots yet
ch92wz,I made my first brutal handbag
a22yod,My Ralph and Vanellope. Wreck-It Ralph. Polymer clay.
8qvzvo,"I picked up a needle for the first time ever two days ago, and this is my second piece - I'm proud of how it came out, considering I was winging it!"
bkklem,I made a snecklace
bjn3vp,I made a mini series of abstract landscapes. I think I might make more they’re SO fun. The bottom right is my favourite.
bgtrj5,"I asked a friend to knit my dog a sausage sweater, I love how it turned out"
bwqsnw,That's the kind of work that comes out of eight layers of 6mm plywood
92r7o1,Wanted some colour but not allowed to paint the walls (not perfect but I love it)
d7fbhw,"He needed a BIT more help with this one, but I'm still so, so, sooo impressed with his talent! If this kid can do this at four I can't wait to see the stuff he makes as he gets older! He did the running stitch pretty much by himself and needed help with the satin stitch."
9lt3uw,I turned a jack-o-lantern candy bucket into a boo to match my sons Mario costume last Halloween!
8oe390,My 13yr old made these from polymer clay. I think it's amazing
dn0xx4,I made a trio of gnomes from an ombre fabric. What do you think of them?
d8lszs,A wire tree I made
cr7yo4,I've been making these little macrame pots to hold my airplants. This shape is my favorite so far.
borh84,A German Shepherd I painted in watercolour
9krohi,Lunchbox my brother made me for my birthday. Can't wait to go to work tomorrow!
8zfwdd,I made a Netflix present for my friend. It has a lot of snacks and movies to watch in it. What do you guys think?
cgz20x,Stunning hand knitted fence made with fishing net twine ( Anne Eunson of Shetland)
clpm6w,"For everyone who’s permanently in a summer mindset, regardless of the season"
an7rxd,Highly textured lace doily. My hobby crochet doily.
9ayuh9,Hand cut mother of pearl and abalone UFO pendant inlaid in ebony! Abalone makes a perfect tractor beam
8yt8j6,I made my own chandelier to replace the utterly hideous fake candle and crystal one in my new home
986jgp,Ive just started making these cute little felt decorations. Theyre still a bit rough round the edges but im slowly getting better at the embroidery etc
9g4xsf,Some earrings I've made these last few months. :)
ba9qk7,"My Cricut, some lovely paper, some acetate and a few pebbles later...a terrarium card I'm very proud of!"
a3grb9,"Small piece of furniture i made for a school project, any thoughts?"
9cxzdf,Indigo hand towels i made yesterday. Thinking of opening an Etsy shop for my indigo goods
db6n9n,Hand embroidered pins!
a01i3j,I made an advent calendar vending machine for my dad
ajdhm5,I made a star pendant.
cqoz90,Took Your Guys' Feedback and Made Smaller 1.5in UV Resin and Polymer Clay Lemon Earrings
a7qv0g,Cross stitch for the Flower Child in my life
bp5igz,I made a blanket for my brother and his fiancé for their wedding next weekend! (Crossposted from r/brochet)
d7134j,Girlfriend likes purple so I made this for our bedroom
a70ran,I made an amethyst necklace with glass beads.
9o7d3h,Made the flying house of Up in a glass ball! :)
d39tzn,"Not sure if this counts as a craft or an arrangement, but I'm happy with how this display turned out."
8pbx8u,First time sewing! Made a dress for a Pride and Prejudice themed Regency ball
c9lge7,Felt camping toy set
a0jbi3,hand turned acorns out of various woods
8vjrf3,"I've been trying to find ways to use hand lettering for things other than just writing on paper. I used my iPad and Apple Pencil to do the lettering in Procreate, and cut the decal out of holographic vinyl on my Cricut machine. What do you guys think?"
a7x1te,I painted a royal portrait :)
ci2bbu,"Watercolor snake. A work-in-progress still, but he's finally getting some scales!"
ce63m5,"My friend is going through a tough breakup, so I painted her a portrait of her pup (picture for reference, he's a total derp lol)"
diqvcq,"Never thought I'd be the costume making Mama, but here is my daughter's oogie boogie costume"
aavt5a,Just finished etching this koi Bowl with a micro Dremel. I think it turned out pretty neat! I would like your opinion to or ideas
d31nj5,Flowers my mom made from paper!
afubm8,My first go at embroidery :)
bx2iju,This color turned out so amazing 😍
b750zl,I had fun making these I hope you like them!!
aryk7e,"Sloth, my creation."
cy3ua9,I drew on my leather jacket! Constructive criticism very welcomed.
di9f1t,I painted some small pastel colored mountains! 3x3 inch canvas finshed with a resin top coat.
brcqe3,Paper flower bouquet I made for my dining room
cv0ioo,First attempt at bleaching a shirt and used leaves from my back yard.
b3abnb,I drew a snack break :)
88qzdd,"Not sure if this is considered crafty, but I made this bench for our bedroom."
dp5ze7,My Halloween costume this year! Homemade papier-mâché pumpkin head
9z7tkc,Mushroom season is over so I'm making some copper shroomies pendants
7ncjyi,"I'm a stand-up comedian and for 15 years, I've had venues I play give me a postcard as part of my rider. Just finished this: ""The United States of Touring"" (4' x 8')"
6zgz7c,"Just finished the Great Wave Off Of Kanagawa made completely out of duct tape! - 48"" x 36"""
9w48do,"Made a tiny ""fairy world"" in resin."
cgi11r,hand-embroidered fox brooches
a3on5u,A little custom painting I did :)
aw07s1,"But, but it's more fun!"
asc4mn,Felted a little avocado pin!
9dmo23,8 years ago I left art school. This is the first thing I’ve made since.
bfavkn,I made some traditional polish Kraszanki (scratched Easter Eggs)
93kf6p,Axolotl plush I made in honor of becoming an axolotl momma
doxckm,"The rose on the left is my handiwork from cold porcelain, on the right is alive."
cp5n0d,"Couldn't afford a model to showcase my beaded jewelry. Luckily, my cat works for treats."
cq7t2e,...Turned out I'm in love with crocheting round bags <3
ajiyzu,I crocheted a tiny Koopa Shell from Super Mario Bros! (Blue shell in the comments)
9ptolv,"Belly rubs please! Chubby fella hand sculpted and raku fired, by my mom"
bfwj36,Since we're on a Bob Ross kick - my first and second attempts at the same painting
97onnn,I've been painting some rocks recently
91qxug,"Mini barn wood paintings i also made last night! Im in love with them, you?"
c1vvbg,I’m obsessed with tie dye
81tugd,Sassy stitch I made a while back
dbsbui,I crocheted a very terrifying ghost!
cjro67,"Iron fences, old school"
aeqr9i,"I created two molds (the base and the moon), then casted this in resin :). It still needs sanded down in spots and polished, but already love it!"
7ukfwf,An orrery I just finished today. Had to make 5 prototypes to get one that is accurate.
c9d4c3,"I finished off this lemon embroidery last night. This was my first time using all 6 strands of floss at once, and it was really fun! More chunky embroideries to come!"
akixxb,I made a gallon jug igloo for my kids!
ak9n5x,"I’m don’t know what I’m doing when it comes to wood burning, but I figured it’s the thought that counts."
9hfimp,Made this solar system bunting for a co-workers baby shower
c4oxzw,Discount articulated wooden hand I made into a palmistry hand.
acv2v7,Made a pyrite crescent moon & opal ring
9fratu,"Fridays are for pizza, and squids"
cmboi4,"i try new material for my dolls, from wood to polymer clay. and this is the result"
a3ptt5,My first resin attempt
9hqblf,White Gold Pikachu Ring with matching Rose Gold Eevee Ring that dad and i made :)
av0mv6,"Polymer clay Bowtruckle Pickett.Fantastic beasts.All parts are flexible and change position,wire base."
bycnga,We had to sell my grandparents house after they died so I made my mum something to remember it by.
al4i0p,"I got an overwhelming and wonderful response on my post yesterday! And I decided to make the piece I posted into a triptych. Here it is! All that’s left is to mount them onto panels, and resin them."
da5bec,My latest Sailors Valentine. I tried to make one in the style of the originals from the 1800s. All the shell colors are natural and not dyed. Hope you like it!
8c29w9,I’ve been making some felt friends!
dlo4pb,Stitched this tiny brown bear cub
8t4ui1,I like to paint tiny versions of famous paintings on pennies
bylme5,Pretty AND practical bathroom embroidery I made this weekend
ay8c11,"My nephews wanted a gun safe for their Nerf guns just like their dads gunsafe for Christmas. So a repurposed Ikea cabinet, a calculator, many coats of various types of paint, aaaaand yada! They loved it!"
chiauw,Coconuts from polymer clay. My first experience :)
bttrq4,Where are my pottery people at? :) I make mugs inspired by my garden!
ab1w8y,I painted a portrait ☺️
7vb3gz,My first completed cross stitch
cc9o68,I made a chubby mini turtle!
9o5oiz,Made this Addams Family Polly Pocket set!
cii5i2,I made a collection of crochet succulents. Somebody said people here would like them so here you go 😁.
agwjqh,Learning the silver wire wrapping ...
d4a16g,I made flower collars for shelter animals and had a nice photoshoot. Hoping it will help them to find a new home
ckvc3t,Melted crayons into molds for nephews birthday present.
d5eecc,Time to bring out my candy corn throw pillow!
9y52nq,I made a face hugger silver ring from Alien
8hi1qd,I knitted and designed a new scarf :D
aewzac,Recently finished this mini Water-Diorama
b5a2x7,just finished the dollhouse garden kit I’ve been working on. 60+ hours and a whole lot of tiny flowers
ajpku6,Flower bouquet from paper
9456ej,Made this for my boys out of old throw blankets and felt. A dinosaur mat that bundles up everything inside for easy transport.
9t9whe,My sister made me an Ursula costume (and my husband a mermaid tail) for Halloween!
a4wj9a,I made a wedding bouquet from paper
9odcai,"My first mini-planters, made from clay!"
8htty5,Tried making a whale plush for fun
8nr3h2,🐋 ☁️ mural for my baby’s nursery 👶🏻
bmc0yz,My sister made this birthday crown for my nephew's fifth birthday...truly the most intricate and beautiful thing I've ever seen.
7atdss,A flower crown ear warmer I just finished crocheting :D (x-post r/crochet)
b5eila,I made hand carved wooden brooch.
