post_id,title
9pkri0,The finished product!! 🎃☠️🕸🕷
a0vyi0,"I want to share a ballgown I've just finished, I was inspired by a painting"
d44pd9,My first string art attempt
9hk8az,I made a bag for my mother
9i379m,Bubbly cauldron candles that I made. I love how these turned out.
cgssff,A mix of flowers I made from crepe paper
95hzln,I made some little felt pins!
ajuqtr,"Just finished this piece, it's called Aurora. What do you think? Be honest please, Sterling silver"
cnnwec,Any Brooklyn Nine-nine fans? Boyle and Terry are my favs.
9tk6a0,"My mom made this more than ten years ago, and she says it's not very good. I still love it. Dwarf hippo."
73ah8b,Went to a pottery painting place and my sister made this unbelievable plate
c7clfv,Made a cup for propagating my plants out of polymer clay.
dbuasv,I make these cute leather owl purses. Thought you guys might get a kick out of it.
becf0t,My Elephant 20x20cm. Made from 7 intricate layers of wood.
8piqdk,Excuse the shadow but I stitched a hobbit hole
aa99af,I weaved this bracelet with silver wire and turquoise beads
bzvd6b,"Lucas, my latest work ..."
bkwzxs,Picture from my moms work table
bj7j2o,Finishing touches done on the cat bed we made.
cpwtu4,"I think they look very cute together, and you ?"
dtk3m3,Last mug I made at class
85id47,I taught myself to knit this weekend so this bear I made could have a little sweater
cab0qa,"Me and my boyfriend made ramen bowls, and today was the first time we used them!"
cz6ib8,"my new ""babies"" are ready :)"
cdviiy,"After 7 or so hours of work, I have myy first legitimate embroidery."
a8qlp2,My mum made these two red gum wood tables. First attempt at wood work and she’s nailed it!
dqi5ba,made this freshwater pearls chain bracelet
am7wf2,My MIL make these adorable lil lazy gnomes. What do y'all think?
cisp3o,I've loved reddit this past year and I've really been looking forward to my first cake day. I made this fella to celebrate.
bzige6,Brand new to this crafting thing but I made a button bird for my friends graduation gift!
c755bg,Practicing my lettering...yay!🍊🍋
a07uog,Made some geometric wood rings
bew7mz,🌎🌍I crocheted a tiny earth pendant for Earth Day 🌎 🌍
9wjn11,"Started as a doodle, but I think I’ll try to embroider it!"
7sycgx,My Grandmother retired and started a new hobby.. I try and convince her to share her work but she doesn’t believe it is worthy😭 So I’m hoping that the craft lovers will help me show her she’s amazing!! She’s a great grandmother with talent I believe!
ccw3pb,I drew a witch working on the perfect potion ;)
ag41oj,"I started needle felting 2.5 weeks ago and I can’t stop! I have made 15 critters so far, here are my new ocean friends, hope you like them! 🐳"
8hnywu,I embroidered for the first time in 2 years! Trying to relearn some stitching.(design idea from Pinterest)
chr3t2,This morning’s obsession was Harry Houdini. I’m very pleased with how this one tuned out!
99wdje,An origami Nazgûl I folded from one piece of paper.
9o2qel,This is the reason why my hands and my back are sore today. It took me a whole day to make this necklace. The result is totally worth the pain I'm in now. Lol! :)
8w1bi1,Large wood burning I did. Might add color later.
8kd4b2,Blue dragon soaring in the clouds - made out of felt
99eglv,Tried my hand at a larger clay project! It was a pain in my behind trying to shape and smooth it all... but I still love it. :)
dobs25,Polymer Clay & Resin Pink Lemon Slices by me
a9pksk,Handmade Copper Wire Informal Upright Bonsai Tree
a58h10,I've started making acrylic pour earrings
dxab2x,"My ""new"" coffee bar."
dl5b5t,[WIP] Here's a little clay chameleon I made a while ago :)
daq2si,My first attempt at a Halloween wreath!
c3vvyx,Handmade ceramic pitcher for cocktails on the beach
bnehei,A ramen bowl I made in my introduction to pottery class today! It was my first time working with clay really love how it turned out.
cn6jqf,I made an elvish ring.
c2aht1,I’ve been in love with Edward Gorey’s style since I was as a child. This is my attempt to recreate some of his work on linoleum. It didn’t turn out exactly as I imagined but I don’t hate it.
bjua02,"I made these from paper for my mom, her favorite flower is Sunflower"
9xmqp7,"Another compass I painted, this time it's a purple milkyway!"
9q3ph6,The result of 8 hours of non-stop crafting. A macrame bracelet with rose quartz crystal. :)
cgbzv7,"Hi, yesterday i made a Celtic ring. What do you think of it?)"
a2dmmy,I like more after oxidised it! ❤️
a9ryd8,I painted a puppy portrait :)
boxk55,Slouchy hat for my friend going through chemo ❤
9mwslb,I learned to knit today!
doz507,It really takes a lot of times to made such a beautiful necklace.but it's worth it.
c43ien,Made my sneaks a little more fun to walk in.
bd9nyn,New to posting much on Reddit but hope you enjoy my take on a Scottish ball gown :)
7n2c0h,A rainbow narwhal ornament/wall hanging decoration I just made.
9u4j8v,"I know it’s only the beginning of November but here’s some embroidered Christmas ornaments I made! 3 designs, each with 2 color schemes."
cqgndn,"One of my fav nostalgic paintings - California, 1976"
adlgsv,Trying my hand at macrame - would y'all pay for something like this? (Unfinished)
9siv1w,I made a leather arrow quiver. Definitely the biggest project I've ever taken on. Photo album in comments.
bs54it,Wife's first mosaic
8xq65w,2nd attempt at this stubborn medium :)
8sdfau,One of my recently made Dragon journals! Everything in it - from paper to the dragon on the cover - is made by hand.
8w9mqn,We have an abundance of Alpacas in Yorkshire...and here's one of them! ;)
ahainw,Six of my most recent watercolor forest animals. I made this paintings for my Etsy shop. :) Hope you like
co95z5,My library is awesome and has a laser cutter machine. Tried it out for the first time today.
c91r3r,"Hand embroidered LIZZO purrtrait. Be gentle, it’s my first time."
bll60s,Baby shower gift for a couple from two different African countries!
a5a2zu,Nice mix of colors in this marble I made a couple days ago
8u2clb,Wedding bouquet made from paper
7vn7wb,Thought you guys might appreciate art my sister does.
czu58a,"I have been working on this Princess Mononoke pendant for MONTHS and I am finally finished! I wanted to share it because I am pretty proud of myself for completing it and not having a break down. Ha ha ha! It is made from recycled sterling silver, copper, and brass. Have you seen this movie?"
ay1hfw,A very simple embroidery piece I stitched a year ago!
9jn04j,"Foxy makeover I gave to some boring, black suede wedges"
9n9dp5,I painted a Sneaky Witch :)
bms6tv,I’ve expanded the spectrum of my glacial mugs!
bpcaso,I made my friends dog from felt. Note the curly tail 😆
cki8k8,Old rusty can sat in yard for 30 years....cleaned and painted it up!
9ge77r,I made this floral wreath for my upcoming wedding using the biggest embroidery hoop I could find.
9ba1hj,Putting a little pep in my step :)
94rhmv,I made a Pusheen plushie for my girlfriend's graduation
8txjiu,Made my fiancee an engagement ring!!
dubime,Created my first ceramic pieces
9v5n7f,I made this little clear drop charm bracelet using 14k gold filled wire and clear resin on a 12k gold filled chain
cl9zzv,"My favourite hoop, I love how it looks hand drawn!"
cr0xy1,I loved making these types of pens in high school
cb8zwt,Figs in watercolor
dokize,Handmade shop-bag using mainly popsicle sticks.
b00wcl,I painted a tiny novelty watering can 🐝
8dp8kq,My 3 year old son asked me to paint some spaceship shoes using the images he chose on Google
9p3ajd,Some hand drawn/cut papercuts my wife made. My favourite is the bee/seeded eucalyptus one...
cfvyj3,"I made ""beeded"" brooch :)"
90zcfp,Custom Macrame that I did for my first official customer!
9hc8yr,"Hey crafters! Here’s a video of me practicing flower crowns on dogs. If you’re interested in receiving/gifting a pet portrait for the holiday season, let me know! I love this sub, thanks for all your encouragement and support."
b0e84z,Homemade resin dice. Work in progress.
bwbiio,I wire wrapped a moonstone ring.
btds3k,"This is my first attempt at embroidery, and, my first craft after damaging my spine... my hand shakes a lot but I think it came out ok. It’s about 6inches."
agizd7,My attempt at making an Oompa Loompa
8kqx6p,Card I made this Mother’s Day using watercolour. She liked it and it was a good mindfulness activity for me :)
9e41kj,Proud of these. Made felt boot covers for my son's Captain Jack Halloween costume.
bonayk,I made Pineapple earrings with Swarovski crystals
bw3pz3,This guy's piano shelf is really neat
d952ig,I painted this today!!!!!
9dfwa4,Hand stitched rainbow waves! This was a “nesting” project when I was preggers
b6y379,Ranunculus I made from paper
9nv3rv,Gold foiled poppies in all their glory! Photographing gold foil is tough!
9f8kvu,Latest commission piece I just mailed out today
8lphdj,"A couple of months ago, someone posted a ring wreath and I was obsessed. I finally made my own!"
dxu8b7,"My sister's favorite show is Bob's Burgers, so for Christmas I made her Louise's hat. I just hope she likes it"
cv82e1,"Hand embroidered Shrimp, on my dress 🦐"
axl9hp,"""Horse"" pencil and coffee 13x13cm"
8o5c4p,I cut off a tee shirt and added a skirt from my scrap stash. For my granddaughter. Total cost $2.50 + 1 hour.
6pskbm,Some of the soup bowls out of my most recent firing
9rl3z5,Some of my newest handpainted pendants!
bxgnf6,Mr. and Mrs. Fredricksen from Pixar's Up are reading Reddit comments sitting in their fancy armchairs. Polymer clay figurines :)
a4aoyv,Well it’s done! Just in time for Christmas 🎄
bks8df,I've been working on sculpting wands recently
9pkc8p,A wedding bouquet I made from paper
9w4quo,Blackwork embroidery piece
8i58lz,"Been trying out mosaics lately- here’s a table I made for my turtle-loving stepmom for Mother’s Day. Still learning how to cut glass properly, but I’m pretty proud of how it turned out!"
8eki7h,"I made a balcony lawn for my indoor cats by using a flowerpot coaster, stones, soil and timothy grass seeds."
dijyvj,"This jumper made me $15,000"
bzyfev,My first painting! I painted this for my first born.
9lmvgm,Earrings I made :)
bdfutm,Mah participating in the birdhouse decorating contest at her job. She thinks she doesn’t stand a chance. Show some love!
8hxth9,I made a stained glass horse!
8geylh,Found a perfect way to practice painting flowers while still working on my pet portraits
8z9t0c,I crocheted this little guy for my 4 year old son who is going to have to get eyeglasses and he's afraid of being laughed at by his friends so I thought having a little friend who also had glasses might help him transition more easily to wearing his own pair when they finally come in...
8uz17s,I’m very proud of this one
b661ul,Made some kawaii carrots 🥕
8jm09o,I made a moonstone choker with glass beads.
dqc6qz,"Here is a photo of my charcoal drawings in their frames :). My favorite frames to use are antique or vintage; I have a closet full! Also included in the photo is me to show I am an awkward female, not male like most people assume on social media's when they see my work ;P."
d0ybx5,Stitched a wild rabbit with forsythia flowers
942dho,Dahlia made from paper
a129so,Soon-to-be pendants using flowers from my garden
c12xgi,My latest embroidery - an ermine moth
d1i3xt,Painted some peonies I hope y'all enjoy!
crhsaq,"I posted my first embroidery here a few months ago, took me a while to finish it, started other embroideries in between. But now it's done. I posted a gif before but i think a picture is better"
a52wg9,I love experimenting with new colors....only 4 fails before I reached this beauty!
a3wxxg,Made this for my niece. Been doing embroidery for a 6 months now.
doprs1,I lampworked a micro glass Swordfish
87w07t,The four clay succulents I made go a group photo before I sent them off :-)
bqb0tc,I’ve started making gemstone jewelry!
c1dt9h,"I paint small canvases for fun (5×8cm), here is Nighthawks"
b1fi95,"I made the first bracelet with this combination. Called ""Forest delight"". For a long time I tried to make realistic blueberries, while this is the most successful option :D All from polymer clay."
a45kr3,My favorite lace doily. Highly textured lilac crochet doily.
bhd6de,I crocheted a Mondrian painting. Thoughts?
cfq7in,Working on a new sign for my front door
bk7nag,Some of my recent creations.
cyfog7,Taught myself to weave last night. I made a simple shawl/scarf thing!
8apbu1,Tiny needle felted baby penguins 🐧
9bg0ny,"I make some bath bombs, I think they turned out nicely."
dv3acy,I made a felt campfire for my nieces and nephews who are in love with camping.
a16sfy,Building a miniature world
8fbikx,First try at painting a Flamingo
cjku7m,"I learned how to sew today, and made all these!"
djdujm,I finished this bad boy in two days while binge watching top chef
a1bapy,My first ever completed crochet project! A stuffed owl for my friends birthday. I’m so proud!
ancbk7,"My sister has been working on this crochet blanket for my nephew, on and off, for around a year. Total labour of love!"
7l9e6o,I might have a knitting problem and my husband might be a little over dressed to go outside
aaqcrx,Knitted a yip yip stocking for my husband for Christmas!
95wbsz,Ravenclaw Lost Diadem Ring that Dad and I made. Thanks for all your support on our last post! Let us know what you think :)
aomx0p,"I carve stones, experimented with labradorite and turn them into moon,sun,fishes,buddha etc.,what are your thoughts? 🌼"
78br0h,10 months of and on of work and I'm finally finished.
bh0sqo,Polyme clay 1/2 inch Hawaiian rolls!
9kgtaa,I made a labradorite bracelet.
c19xzj,I've been making silver coin rings that glow in the dark.
cpcekj,Dirty windshield Koi Fish with Q-Tip & a toothbrush
8x1rjk,Break away quilt
95anwv,"Kirby bracelet I made for a friend! Not sure where to post this, so I figured this would be a good start."
cxfwq1,"Just look at my new crochetted necklace! It looks like real snake, isn't it?"
ccpiao,My first polymer avocado :)
7gesa2,A pair of earrings I made using single hydrangea petals layered with Queen Anne's Lace flowers. Made with resin.
c58klz,A flower bouqueth I made from crepe paper
b82oph,Finished up this home sculpture last night for a client. It was her mother’s house and the house she grew up in. They had to sell it recently.
cliocb,What can I do to improve this beetle juice inspired ‘Polly Pocket’ set? There’s something about it I don’t like and I’ve already put so much time into it :/
btilax,I needle felted a teeny tiny polar bear for my husband 💗
dvru6c,We need more kids like Jonah!! 🧡🧶
9ymiw6,"I was feeling stifled by working solely within embroidery hoops, so this is what I came up with!"
928gef,French Knot Brontosaurus
7ieio7,My girlfriend’s first time carving! They’re not perfect but I think they look good.
bz5bqc,"I painted these terra cotta pots. I’ve never done anything like this before, so I’m pretty stoked with em!"
ddnety,I drew a magic lesson :)
aawntf,I made these a few weeks ago for a local honey shop.
9nre91,I looove painting pitbulls. Such beauties
b5yjew,"Little vases, anyone? 😊"
bfh4uq,Wooow
b7a0eq,Weird jewelry I made for a horror movie convention. All made from thrifted dolls
95p1z3,My new tie dye creation 🧙‍♂️
8t9n66,"You were all so nice and encouraging, I just had to make another one"
7qod8j,Otter cake topper I just finished :-)
cwzl02,Some wire wrapped pendants I've made.
a28vyc,Getting braver with backgrounds
9qel8b,"People said I should wrap this Luguna Agate in gold, but it was too late. It is in sterling silver now!"
86d2fh,Clay succulent :-)
9qzp41,Hand painted shoes. My friend loves to sew and asked me to paint her sewing supplies .
8ypnte,Painted some pots
du40xj,Stitched this while waiting for my Hogwarts Letter.
7wm3ez,I made a four-labradorite necklace
b5pcfz,That she blows! My newest crochet little blue whale
dnmho5,Happy Halloween from me and my daughter Annabel. A friend had given me my bear costume as a present and I wanted a matching one for my baby but they didn’t make them in her size so I sewed her one myself!!
a8h4sl,Check out the tiny bubbles in the glaze of this mug I made!
ctob64,I made a baby swing for my twin girls. They love it.
bcd6xe,"first time working with driftwood, and no one told me how unforgiving of a medium it is; two restarts and weeks of whittling, carving, crying, and sanding later... i’d say it was a good learning experience! and i’m pretty dang proud!"
cdz5di,Needed a holder for my wand from Universal and so I made my own out of an old copy of Sorcerer’s Stone and a mannequin hand
9acr21,Just finished this beaded copper wire bonsai tree
dfjo3d,I made wooden hairpin with cat ears headband.
9edysb,I made my first ever wreath for Halloween
cgj35r,A shadow box I made from cardstock
bm75dj,A little bit crazy Idea i now😋😆
clwknh,I finished make pink octopus.
cl5fn6,I made a wood resin pendant
c8j3zc,I taught myself to sew over the past few days. I made this shirt today!
bsc456,Oddly Satisfying- spent 2 days undoing a giant rats nest of embroidery floss
8zmpme,A couple of handpainted pendants I made. They started out as painted quarters!
cyaso2,Resin and Wood Pendant!
ayl7uj,Painted these beetle bois a few months ago. Thinking about making more soon because they bring me joy
cevaj2,A soapstone fox I finished this morning
a4ngym,Some of my hand carved Christmas ornaments
dfvxje,I turned a shower curtain that would otherwise never be used into a rain jacket for my daughter :) I also lined it with an aqua cotton fabric.
bnrcsp,I am making all of my own wedding signs for my wedding next month! It’s a lot of work but I love how they’re turning out 😅
dsn57f,Experimenting with sequins and beading!
9zdjzy,I tired to capture my thankfulness :)
9b5sbt,I cross stitched a lil thing! Pattern by me
c9sg79,A part of my polymer clay earring collection
8m26i1,"I made a necklace, using a moonstone cabochon and three labradorites"
96bne0,Wood flower heart board.
8g0jmr,I'm making paper flowers for my friend's wedding backdrop :)
9ivhil,My Halloween wreath a little early but couldn't wait any longer! Also made a little hat and broom for my seasonal spooky squirrel.
c98r4m,Been making these for around 8 years when they were very popular on Tumblr. Every once in a while I’ll make one for a friend’s birthday. Painted the canvas black this time and I’m really impressed with the results.
aaf5vu,I made this for my Dexter obsessed cousin. He is made by needle felting.
dlv8ni,I can’t sleep so I made my dog some party hats😂
606tp1,"My mom passed away last month, and I pressed some flowers from each flower arrangement at the funeral and framed them"
9t70gu,Another mini box theater project is just done! :P (built from a kit)
9lclyd,I painted A witch practicing her practical magic :)
96t939,I made my very own cross-stitch of Jiji from Kiki's Delivery Service. Please let me know what you guys think!
7faock,I wanted to share what I've been working on lately: altering shoes with acrylic paint and fimo clay.
bzpytj,#spanishpour my latest one. Still drying!! :)
dr1zq9,Hand stitched Arthur
9zkb4a,Made these for a silent auction at my daughter's school. Do these look like something someone would buy? I feel embarrassed about them...
dj4ssd,2 years ago I made a siren costume
9ea7m1,Made these sunflower potholders for my friend's wedding gift
9ajx6j,Needle felt bison I made
do3z4a,My undersea-themed hand embroidery
9bue4j,Here are some polymer clay creatures I made yesterday. They're called Flomps.
6x2iqw,I am having way too much fun with nail art!
cnu3on,Nearly 2 years of learning to make pots - and I photographed every single one
am37wn,I finally found a way to attach the glass dome without ruining my painting underneath!
8mowvd,Did the flowers for my brother’s wedding yesterday!
8t6jr3,My crochet Eleven doll! (WIP...Still working on the face)
bzd9fx,I wire crocheted an amethyst necklace.
a3ejpw,Paper roses i made
dy1dvv,Witchcraft
b6kxnn,Hand made breakfast set!
a8r2f6,Made this for my best friend for Christmas.. she’s a coke girl and I’m a Pepsi fan.
9sovu9,A wedding bouquet I made recently from paper
9ehqrp,Finished these rainbow Cthulhus yesterday. I’m so happy with how they turned out! 🦑❤️🧡💛💚💙💜🦑
8gq61h,Forest and magical sky embroidery. Made this with watercolor and embroidery floss
d2hp0d,I made a baby mobile for a lovely couple who are expecting. They have been calling the baby whatever fruit/veg their app says she is the size of (I.e. baby aubergine). 🍎🍋🍒🥑🍆
d0farp,I turned my watercolor paintings into little stickers!
b8j08o,"Some rings I made in my metals class! Not the best, but I’m still proud of them."
btm4ay,I managed to keep the red and blue apart (for the most part) and maintain some white.
bsr5yd,"1975 II, Pencil Drawing, Self portrait"
7k3gci,This little guy I crocheted for my nephew.
7aji2s,Cross stitched this self portrait the other day
8kmpg3,Wood and Resin Lamps!
dkd5t4,Decided to take up whittling. These are my first little Santa Ornaments I’ve ever done. Hope you enjoy!
aphmlo,Handmade paper Dahlias
8d5vbj,Blocking a hue shift afghan. The best project for my bus commute to work.
doygc8,I made green eggs and ham for my MIL’s Dr. Seuss themed Halloween decorations at her office!
8t27ft,One of my most recent paper flowers creations
9bi5d1,Carl and Ellie: best love story. Polymer clay.
dx4tcp,300 photos later :)
be7pts,Followup: I bought the snake necklace posted here
dvplyt,Giant cookies by me! What you prefer - vanilla or chocolate?
5dd40m,My husband was complaining we didn't have enough pillows on our couch so I made him an 8' squid.
97epex,"Finished making a scratching post for my spoiled cats today! (Ignore the different shades of green, there were some dyeing mishaps and multiple trips to get more twine)"
bp73a4,"Today was my last day of highschool, so i made a bunch of these miniature koi ponds to give to my friends :)"
asyg0d,My fruit is made of polymer clay. Bracelet and earrings with lemons.
ced8i1,My first string art attempt
a9thwn,I’ve started refurbishing antiquey looking things I find while thrifting. My latest project!
9ttswj,Polymer clay cake slice charm I made for one of my employees at work for her birthday!
7lopfg,A senior taught my class to hook rugs using year. It's a surprisingly relaxing hobby. Designed and hooked a cardinal in memory of my mother
dskdrt,"I make these from card in my spare time. The models are created in blender then a net produced, printed and cut out and glued"
932r1s,A Solar System bracelet I made!
apou0r,Hand-sewn Ursa Major Plush w/Glow-in-the-Dark Constellation
9ywhjw,A hand drawn/cut bee papercut my wife made recently.
cvu95r,Blue Tourmaline Wire Wrapped Pendant // Sterling Silver & Titanium Wire
91ylav,Finally found a use for my bottlecaps!
cf9j7w,Crafted this precious paper piece for best friends celebrating their first wedding anniversary 🥰
97bzrv,"I've been making jewelry for a while, but now I'm learning how to cut my own stones too! (x-post from r/somethingimade)"
8fde8q,"My grandmother passed away recently, our thing was Wizard of Oz. She was a colorful person so I made these to wear to her funeral."
bawqv3,I just finished this embroidered portrait of Walter. He’s so cute I almost can’t stand it!
828snd,Rings made from antique spoons and forks
dtnidj,Van Gogh Heart Brooch
byrf43,"I've never painted before, but I attempted to use water colors today"
93pw5t,My 8 year old asked me to make him some Johnny Test shoe. He apparently does not think Mom's hobby is embarrassing anymore ;)
c3qf6s,"Made ice cubes with mint of epoxy resin. On a lemon bracelet, it seems to me, it looks very juicy :) Almost mojito: D"
8qajdi,My first time making succulent from paper
blw7pu,A memory canvas I made from plastic debris I found on a beach in Hawaii
9vzgdw,Cloth candy canes! I plan to add these to Christmas presents instead of using bows on top
aq8l8y,I made an Overlook hotel ‘Polly Pocket’ from paper and sculpey clay!
dnu14y,Happy Halloween from Ms. Frizzle! Didn't like the costumes online so I cut all the vinyl and made this one myself
crt0ap,Made this decorative cactus with crochet. What do you think about the result?
b54073,Apparently my mom made her first metal feather today! I'm so proud of her for trying something new!
4rwnr3,DIY wife gets crafty.
7rok6t,It took me two years to finish a “paint by number” painting but I’m so proud!
a2ipvh,Final for my wedding cakes class! I’m super proud of it. The flowers are made from gumpaste and the white dots and shell border are royal icing. Everything else is fondant.
d6805r,I think this is my favourite thing I’ve ever made!!
bcqfl1,"Pink peony flower from cold porcelain.The flower is light,all the details are soft,flexible and not fragile."
9p8eo8,Im super proud of this - a crochet overlay Mandala pillow I designed and made :D
7ngpar,Made this because I was to broke to buy a shelf for the bathroom
ajww3k,Baby shower gift I made for a friend!
c5je0c,I made this for my mom for her birthday
dhhrdk,"Gingerbread house, but make it spooky"
c2wnjn,Ceramic galaxy mug
9248ko,"My newest decoration collection, moon wall hangings hand sculpted and painted with crystals"
85db7o,A set of bamboo shot glasses that I carved and burned as a gift! What do y'all think?
9c46jx,I think this is the prettiest ring i have ever made.
8dkg75,I welcome Spring with Daisies!
drkgvp,Finished my ceramic Fox God
cfzkpi,I make epoxy haribo bear pin
bzvgqk,Hand embroidered pet portrait necklace
bisk8n,Finally putting last summer’s pressed wildflowers to good use
8pvoi7,This is my latest project. Macrame necklace with malachite gemstone. :)
