post_id,title
6ztxpj,This octopus candle holder that my sister hand made at her pottery shop.
azfegj,My Ariel. Colored polymer clay.
7otj48,My Handmade Geode Soaps
alk5ut,"My 15 year old granddaughter decided to try watercolors, I think she's off to a great start!"
7y3ld0,finished my sister's birthday present 😍
az4rr1,"I recently started a new hobby, Polymer Clay. I made a whole lot of tiny plants and cactuses to practice 🌵"
alr5pj,I made a bunch of paper cranes and attached them to a branch. Hope you guys like it!
acjpea,I've tried the new threads...that's a result. Newborn tree
7jfeui,I painted birch trees on my window
ap4nae,I finally gave embroidery a try! I'm really proud of my first project
bc304q,Nearly 9 months later and this monstrosity is FINISHED! First truly big crochet project and I’m extremely proud ☺️
7tvfci,I made a cactus pin cushion.
7o3zrw,"Guys, my boyfriends mom is incredible at pottery and she made me the most beautiful yarn bowl!"
9osj96,I spent way too long on this.. Addams Family ‘Polly Pocket’ style playset 🦇
avuwnw,Glass octopus 🐙 My husband blows glass and makes some cool stuff. This guy is one of my favorites
aihd8s,"My elderly nana & papa make trips up to he obsidian mountain areas and haul raw ugly rainbow obsidian. They spend days and days hand carving out these animals & pendants. They take HOURS! Nana says she doesn’t think people like them. they don’t really use phone, can they still get internet points?"
b8ncsu,Hi new here! My mother makes homemade cards and just recently she entered in her card to a Facebook contest. All the old women in the group don’t seem to like it and she’s upset because she spend a lot of time on this card. I want to prove her wrong that people actually like her card! Thanks!
azmgnp,My wife has been having problems with anxiety lately and crafting helps calm her down. So I made a craft corner for her with all her favorites! And some Bob Ross for the extra help!
a34m6t,"Every year my family makes a whole ""gingerbread"" house village. We use grahm crackers instead of baking gingerbread. I got married this year and my wife helped with the icing. She's talented at art and henna. It was a fun combined effort because I like woodwork and DIY and she's a wonderful artist!"
8vta6e,"As I am only 100cm tall, I sewed myself a Jacket out of a pillowcase."
80mwak,A Tolkien-inspired embroidery piece!
7uwwic,"Some armor I made for fun, have some new designs in a notebook so comment if you want to see it :)"
ax8ylp,"I made a lilac branch out of cold porcelain.Very long and painstaking work, a lot of small parts,stamens,but it's worth it."
c1lset,My wife had dresses made from my old shirts for my girls to wear on Fathers Day
b7g3ik,I Swarovski’d my prosthetic leg
ant7q6,A headboard I made for the new house
cvilur,Feeling this hard today :(
apvern,My wife is studying to be a goldsmith and made this silver pendant
awuij8,I made a yellow rose with Play-Doh.
bu4s9q,I painted another rock!
8s2e9r,My mom is a painter. Here is one of her latest pieces!
byfwvq,Dresser Ive been working on for my sons nursery.
aotebs,I crocheted my baby boy 💖
970son,My husband made this mountain shelf as a gift for a baby shower. It’s his first try at woodworking and I’m so proud!
aunk1m,"This kit was from a 100 yen store. I've never done basket weaving before, but the instructions were easy to follow. I think it turned out pretty cute!"
bfnyxm,I followed along with Bob Ross for the first time (first time using oils too)
8jrgw2,I have been practicing a more realistic embroidery approach by making birds!
amem7h,"My little robin! What do you think, do you like it too?"
bqmikp,Needle art - I’m currently going through IVF. This is what my husband made me using my discarded meds. GOT me laughing.
ao5j00,I use beach pebbles to portray fond memories. Here's me with my Grandad.
a7fvt8,My brother-in-law is planning to propose to his gf and commissioned my wife to paint these Addam’s Family nesting dolls in which to hide the ring
9jwv5f,"My mom had a ""flawed"" sculpture she didn't want to sell. So instead she painted it in two colors I chose, now it's mine, and I love it!"
bi2ch1,I have been making brooches for 1 year. There are my first brooch (left) and my twenty second brooch (right)
6ofxlt,Decorated rocks to hide around town
72brm3,My first reddit post with the help of my awesome son. Real fern in clear crystal shaped resin pendant.
b3gnqh,I've been working on some more of my little pebble people.
coxv76,A friend of mine made this wooden migaloo automaton
b96rt7,"I got to tile a bit of backsplash in our kitchen. Tiles painted by me, put on the wall by my dad."
am94cr,My mum made my baby boy this quilt. I think it's pretty cool!
ahilr2,My polymer clay berries. Bracelet and earrings with strawberry :) You like?
cd52zt,185 teeny tiny watercolor paintings I made!
9syqy3,Chubby seals crafted in ceramics by my mom
b7oj8y,Leg bling in full view from my Swarovski post
ak1dtm,My niece asked me to make her a unicorn cake topper for her daughter's birthday.
ave85y,My daughter is a glass artist and made me the glow in the dark moon and sunflowers. I am a metalsmith and created this kitty in her nighttime garden from silver and gold. I love that we made this *together*
awb95j,"This is our girls’ new bunk bed! My husband did the majority of the work, but it was a joint effort. Still need to add flowers to the flower boxes and curtains to the windows. I love it as much as they do!"
as63hh,I crocheted a braided cowl!
9nkyqj,Finally got my foil to adhere properly on these hand drawn poppies! Some projects just make your heart happy.
atk29p,Here’s what 500 hours of embroidery by hand looks like! I’m surprised I have any fingers left!!
8l129v,A person requested if I can replicate his wedding bouquet from paper so he can give it to his wife at their first year anniversary. How did I do reddit?
7uawvg,I wanted to share my favouite thing I've designed :D
b076n0,My first ever “dream catcher” I’ve made using gemstones
cmvmxd,"I finished my Beetlejuice ‘Polly Pocket’ set! Thank you all for your suggestions, I made a few changes and I’m much happier with it now! On to the next one, think I’ll do Simpson’s next 😊"
aogch3,I made a necklace of beads
bvsmlg,Thought i'd share my fav recent watercolor with you guys <3
9zejyc,I made a whale for my baby boy. 💙
a61emf,My mother-in-law consistently makes beautiful wreaths for every occasion imaginable but isn’t confident in her work! Show her some love so I can prove to her she does amazing!
ahng2p,I Made a Thing
adva1u,The most challenging project I have worked on to date. It took me 16 hours to make. I hope you like it! :)
59do6m,I embroidered a feather on my favourite pants
b4h7nd,Not sure if this is the place. But a tiny stained glass panel I made.
ayxr2d,"My friend and I made a giant stuffed lobster named ""Clawford"""
9d88ae,Starting to get the hang of this needle and thread thing!
dg71x8,My Mother-in-Law’s office is doing a Dr. Seuss theme for Halloween this year. Her cubicle will be decorated like The Cat in the Hat. I volunteered to do some crafting for her! Just a few props to post so far.
aj124w,Winter is dark and cold. So I decided to add some color🌈 and wove this scarf
a99c1o,I made a First Christmas ornament for my daughter and son-in-law.
dsv53w,I planned on making space jewelry and they came out looking like nebulas.
8vaka9,"Painted my girlfriend for our anniversary. It’s my first time painting, so go easy on me!"
a8b3e3,A 3D picture I made with my paper flowers
9ik7ah,Girl braiding her hair.
ac65dy,My christmas embroidery...
a9wqxu,my polish folk art inspired gingerbread house!
brlvqm,This is the second dress I’ve ever made
dne4n9,Hand sewed this Stranger Things swimsuit from 2 men’s thrift store pollos
d27i60,We made it!! My Copper wire trees have found a new home in a new local store!! Exciting times ahead!!
dkkand,My necklace didn't get much love when I posted it last week so I'm posting it again. I spent so many hours drawing the perfect design and making it. I hope you guys will appreciate it. :)
b3pwzb,I think i captured childhood nostalgia and disappointment well.
6xgaav,My second set of giant paper flowers
d51yhe,A BIG let down...
dpi6ff,My jellyfish costume
apo2zx,Moonstone in sterling silver.
akn870,Trying to capture an image of ocean wave in jewelry.
d6pe6h,"My four year old wanted to learn how to ""sew"" (do embroidery), so I drew a simple pattern and taught him the running stitch. I helped with the first three rays then talked him through the rest. I'm so proud!"
aqb36f,Just finished a Zookeepers Baby Blanket to take to my colleagues baby shower :)
agb2bh,Making progress on this crochet project! Now just need to sew in the ends...
blcood,Foiled a poppy drawing I made in honor of my grandparents & the poppies at their cabin. Love that gold shine!
ad97bo,Another Christmas tree in process🙂 can't stop making them...
df7o1d,I completed my first large driftwood piece!
baj0dz,I'm really proud of this huge plushie i made. Hes 8 feet long and sewn entirely by hand.
acetac,One embroidery pattern- two different colors!
d9b3wf,"I taught myself to sew about 2 months ago, and today I just finished a fleece for my friend. It turned out great!"
abdxdy,My ten-year-old got polymer clay for Christmas and we’ve barely seen her since!
djnhxj,I had a dream that I had a bra covered in googly eyes and my roommate said it would be creepy and weird if I made one. 530 googly eyes later...
av7clg,"What I love about Resin is that it mimics glass: it’s almost like a prism, at every angle the crimson red flowers look different. (it’s my first post please be nice)"
cut7hn,"Hand embroidered, for a baby's gift."
b9lgjb,Ceramics improvement after 3 years 😃
awqmev,I had a hysterectomy and while on bed rest I decided to make a Cholo Sock Bunny.
ddafhj,I infuse waste denim with resin and press the wet layers together until they dry. I then handcraft this material (it's like Micarta) into sunglasses with brass details and polarized lenses. I make different styles in blue and black denim.
aset7r,Crochet Taxidermy as Baby Shower Gifts
9a6yrr,Finally finished this Halloween banner I’ve been working on.
albom4,I’m so happy I found a new craft that I love. These are all of the hand embroidered pet portraits I’ve done since September. 😻
bxlj67,"My son asked for a sponge bob theme for his bday next week so I made these for his presents. Hit hard times and money is tight, I made paintings to match that we can hang by his bed. My hands are really shaky and I paint to help anxiety so ignore the line-work please."
9bxwf9,My winged key mobile for our Harry Potter nursery! So so happy with how it came out.
7yz38i,I crocheted an anatomical heart ❤️
ayf22v,A gaggle of goldens I painted
dxk9mw,I made my first ever journal and am totally thrilled with how it turned out. Desperately needed to show anyone who would pay attention!!
7er3ag,Dyed the fabric for this hoop and stitched on a starry night
cw4mlp,Pencil shark of scrap leather. Sewn by hand. Made for a 9 yo autistic boy who is into sharks
ays9vk,"With the positive feedback I received on my beetles, I wanted to share my little bee boi that I painted for my boyfriend"
dvdj8n,Polymer Clay Goldfish by me
9128g2,I recently tried my hand at needle felting to add another dimension to my embroidery. So far I’ve made a camel and a donkey.
9eryky,A little Halloween doily.
aqj37i,"To celebrate our 10th Valentine's Day together, I made my husband 10 individual miniature cards. Each has a watercolor illustration corresponding to a special Valentine's day memory!"
arsk8w,"A birthday mandala for a friend. I buy cheap canvases from the dollar store, paint over the tacky art with chalk paint, and it looks totally legit!"
ar6aor,Tribute to my Father-in-law who passed away! My wife & I are expecting our first child in August. Her father passed away before I ever had the privilege of meeting him. I wanted to include him in our sons nursery. Using my cricut and a photo of him fishing I made a massive decal to put on the wall!
d9m1ed,I wanted to share my newest embroidery project! A Gothic floral hoop for Halloween
9rfxxl,"I made Mary Poppins' parrot umbrella using polymer clay and acrylic paint, I'm thrilled with how it came out."
7pgsak,Dress with a lot of colour and flowers. Handmade by my girlfriend
bjepl4,Fat teenage boy puppet I made for an animated short!
cpl9sm,Polymer Clay and UV Resin Citrus Fruit Earrings Made by Me
bchohk,First attempt at a galaxy!
aufmhn,Coffee table I made from a wall hanging from Hobby Lobby and a set of hair pin legs from Amazon.
aipzw0,I realized a new idea for Wedding Ring Box or Engagement. Do you like?
asr0xy,Made a modeling chocolate cat for my niece's birthday cake
86vyne,"You guys have been really nice, so here’s a new one I just finished!"
8rhdbs,"Started painting my terra cotta pots, this is one of them"
6qseij,One of my latest embroideries
bl48o7,After 6 weeks it’s finally done!
bxbr1q,I’m so happy with how my first batch of soaps turned out!
aczkxu,Just a guy learning how to embroider in my down time. One down many more to go!
batj8k,My 3 newest embroidery hoops. Currently obsessed with greens!
b2o8pp,My wife's Nightmare Before Christmas Mosaic.
92xggj,"Finished my antisocial party banner, turned out great! Can’t wait to post them."
djun09,My mom has been working on my sister’s 15 dress for 2 months she’s almost done
bujfxa,I painted this in watercolor. I’m really happy :)
ad70tq,I’m working on throwing my best friend a baby shower and tried my hand at towel folding. I’m surprised that they came out well!!
c7ma2b,"Needed a hobby since my kids are in school full time. Started doing mosaics from broken plates. This is Finn, my niece's sheltie."
90fzrt,It took me over an hour to make this Dahlia from paper. What do you think?
aoke8f,I just finished making the bouquets for my wedding and I’m so proud of them.
9hwj86,"I know it’s not Halloween yet, but here’s a Halloween inspired embroidery hoop I just finished!"
a8z3hx,I was told this sub my like this Christmas present I've made for my siblings: Diagon Alley!
ar8baq,Dad and i made a Silver 8-bit Heart Health Bar Ring with Ruby. Let us know what you think!
au76r9,"Hi, this is my first post, I want to show my works.🤗Peony from polymer clay.Tinted artistic oil and dry pastel.Flower flexible, lightweight and durable,has a wire frame.The height of the branch is 35 cm, the diameter of the flower is 13 cm."
a6mybd,"New to watercolor, but making the family some Christmas cards"
b1iobt,My mom specialises in elephants. So chubby and whimsical - Raku ceramics.
8fue3i,I made my sister engagement’s bouquet from paper. Can you tell that they aren’t real?
ahy2xw,My berries from polymer clay. Magic pink raspberry! Yummy?
bkc1vb,I crocheted a little schnauzer for a friend and now everyone I know is asking me to make their dog!
b18ed6,My mom and I collaborated on a baby gift - diaper bag sewn by mom and blanket crocheted by me!
cej6nm,I don’t have a before picture but I redid an old beat up telephone bench that I picked up for $20.
bdux5o,My mom made me a crochet bunny and I made a miniature version out of clay.
btt3k9,Some little hunny pots I made for my baby shower ...
a5mzyk,My inner princess strikes again! 😂 I wanted to make a necklace that would look like it came out of a fairytale and this is the result.
b2h4ay,"My latest hand woven creation, I call it a poncholette"
a75xv3,Attempted to bring my cross stitch to another level with lights!
b4oe3y,Sitting with my hand made and dyed throw pillows
aqriq1,My first try at a Valentine’s Day wreath.
a4qj1s,Having a pixel artist for a boyfriend really helps when you're trying to learn cross stitch
9wowbl,Made this sign post for my girlfriend’s birthday coming up. I hope she likes it
c2p9im,My spare tire cover that I painted (:
arlppi,I made a beaded choker
bcv3pr,"I can't knit, but I can knot :)"
9q0fyi,"My new town is really big on this ""hidden rock game"" I've heard so much about, so I decided to paint up some rocks to go hide in the parks!"
at2kn9,"Antique Sea Glass. ""Sea Leaves"", get it."
9rqjb4,I made the headpiece the childlike empress wore in the Neverending Story!
94m13c,My mom crafts some pretty lovable animals in ceramics
9ue2vv,"Workin’ on some monochromes. My trees definitely still need some practice, but I’m getting there. 🌲"
axpks2,First time making a succulent wreath!
8ppxx5,Handpainted butterfly heels
ct3wi0,"First post, but I'm proud of this one and figured it would be appreciated here more than anywhere."
ag76jb,I made a wool raccoon
7qeuh6,"I got a 3D pen for my birthday, this is my first attempt at making something."
c2h6ih,One of my first pieces!
avnb0o,Resin pour on a tray
98gg28,Follow up post: You guys my cats are using the scratching post I made them! More pics/videos in the comments!
b44s32,"You guys said I should make more, so I did. I’m not tired of moonstone yet."
atcd34,"The bear is crocheted, his clothes are hand sewn and his phone is painted plastic. So I couldn’t decide if it belongs to r/sewing or r/crochet or what. Here."
ampi8e,11 year old boy wins awards for his crochet projects
dejdcx,Wedding bouquet I made from paper
aux6ox,I love to sculpt onto old teapots that I find!
dax84z,My Halloween Hearth
9x0ide,A wedding bouquet I made from paper
9wux81,"I’ve posted my little 4” embroidered wildflowers before, but I have some new designs in this series! These are my latest works. Inspired by the province where I live."
9k8j1y,My first attempt at embroidery!
bo6j98,adding some uv resin to this sub - hope you guys enjoy~
8tji0c,This is quite possibly the best thing I've created all month - Starry Night inspired hand dyed yarn :D
d1dnip,Sculpture I made and cold cast using powderd Iron
c7z8ku,"Needed to fill a wall in the dining room, so made some art inspired by Michalovic Wood Art"
c3ad98,"I learned how to use a bead loom a few days ago! It's for my sister's 18th birthday, she wants to work for NASA"
aztdys,Gf's mom made me a giant squid stuffy! (Queen sized bed for scale)
afotyq,Made a beach inspired jewelry dish. What do you all think about it??
axf8ka,I think my needle felted goats are pretty darn cute!
d8w41p,Wife has been crafting to work through her depression. Love these resin pieces
afa210,I made a personalized peg doll family portrait
bbrx4o,All the burritos I made during a weird Etsy burrito craze
bnwkip,I’ve been wanting to get into painting for awhile now. Here’s my first go with alcohol inks.
b86qwd,I made my first flower tiara today and I tried it on my dog
a840g0,Not a great photo but I finally finished knitting my first blanket yesterday and I’m really happy with how it turned out
bsjkzw,I painted a puppy :)
9g8bb3,Made this tiny theatre inside a box!
b2zhkm,Made a wooden ring with an inner diameter of 17.5mm
ax27ft,I made earrings using real flowers that I handpicked and encased in Resin. (It's my second post yay thank you for being such a lovely community :))
aq684b,Valentine’s Day feels cross stitch. Pattern and FO made by me.
aal83o,My scarf didn't get much love first time I posted it so i'm sharing it with you guys 😊 xx
bvl17b,Embroidered myself a necklace of The Starry Night. So happy with how it turned out!
8fm6v7,Some more of my hand painted pennies!
2xysvw,Couldn't find a large inexpensive octopus themed art piece. So I tried to make one myself.
8xdi0l,My favorite project so far 😊
an0ifo,"I knitted a gift for my newborn niece. This was my second knitting attempt ever, so I'm pretty pleased."
cwehkw,Made a direwolf out of a coke can and a ballpoint pen
dq4crm,"My daughters ""Sally Witch"" costume I crocheted."
cbgfpa,Broken Plate Mosaic
9ohgol,Made a giant paper flower wall for a bridal shower and now it’s hanging in my house above the stairs (about 8 ft x 10 ft)
9lzez8,I made a clutch bag
9oyrq9,My DIY Paint Swatch Halloween Costume
9rv5sl,"I love making stuff for friends & family. I feel like it has so much more meaning, even if it’s a quick, simple card. & saving $5 on a card doesn’t hurt either. 🙈"
d7t5y2,"Guys, I did it! I designed and knit my own sweater :D"
b54qvu,UP! Quilt I made for my friends' first baby.
8h9c5x,Made me giggle 😁
dpqnwr,I’m an alien abducting some cows
9xw6cp,Made this dragon scarf for my husband
9m6c7u,I made a modem concealer
bxxk6q,"Chubby seal from clay, guaranteed to make your day :)"
dgu0rn,"Lilac earings, my creation 💜"
ao4ml9,Wall art I made as a “headboard” for my first apartment. Twine and fabric scraps.
8514f8,I made cardboard kitchen for my kids
9sane8,"‘“There were once three brothers who were travelling along a lonely, winding road at twilight –”’"
9h4rnb,I made a Beauty and the Beast inspired stained glass :)
ahcjgb,I drew my mom and her sisters as a gift for my grandfather :)
ck1el4,"Thank you science, very cool!"
a9lh53,"My mom makes personalized stockings for each member of the family. This is her newest, made for my husband for our first Christmas as a married couple. She blows me away with her creativity and craftsmanship."
ahya82,my first try at a resin and alcohol ink coaster!
ck958r,"Today I crafted an engagement ring. I named it ""Forget me not""."
aykv4z,"finished my dollhouse kitchen kit, very happy with how it turned out"
8ohugk,My Sea Turtle Blanket.
cj0dys,Painted a little shelving unit to keep all my witchy crap in
ay04bg,Faux shaker card I made. Cardmaking is my hobby
b11741,Six of my most recent watercolor forest animals. I made this paintings for my Etsy shop. :) Hope you like
bpph86,An embroidery I've just finished of a green scarab beetle
bg6qr9,Rainbow glitter octopus. Polymer clay with lots of glitter mixed in. Made my hands sore.
aecd4p,"Made this for my mom to cheer her up, her two cats"
cchejc,"I have finally finished my first blanket! A wedding gift, but I wish I didn’t have to give it away!"
9jcekx,Recently picked up a new hobby and now people are placing orders asking me to repaint their statues.
92lm6m,Dad and I have started making Geeky Themed Jewellery. This is our Golden Snitch Ring :)
9pbwqf,My friend creates excruciatingly beautiful jewellery and I think she deserves more love
bmzmc9,Made an anniversary gift for my husband with our vows & a silhouette I made from one of our wedding photos. 👰🏼 🤵🏻
ab8rj2,I made my husband a sign of our twins’ sound wave patterns saying “Hi Daddy” for his office
9zy5x9,My Buzz Lightyear and Woody. Toy story. Polymer clay
dagmyo,"Cake for my G’ma, inspired by scenery at her vacation home in Canada"
bd3l7m,Those purples. 😍 Love getting new watercolors to play with.
d6ebwk,Found outside a local craft store
awhn6q,I made a necklace of beads
ac5fpy,I really like shoving doll faces inside broken watches
beoc23,This is my largest embroidery hoop to date- 12 inches. I usually don’t go larger than 8.
9mf80e,I made these cherry blossom from paper
b1rzv2,I made a Dungeons and Dragons style cave explorer in polymer clay.
d0oug7,My husband is in the masonry business and does woodworking on the side. Tomorrow is our belated wedding reception and I’m surprising him with this!
aftcjt,My life like needle felted mice - entirely handmade - storybook inspired
9q85vk,"When I was 8, I bought a craft kit and sewed up a few pieces of it, but gave up pretty quickly. 15 years later, I finally decided to finish it!"
a6ts4p,My husband made a dollar store wreath!
dcdokt,I've started my Christmas preparation!
ae70yh,Finished another mandala ukulele! Went with bright colors of this one. What do you think?
9s3awb,I made a Halloween wreath from Dollar Tree stuff
acrq36,I needle felted my cat
cudkpw,A simple summer wildflower embroidery hoop
792e6n,Made some Halloween themed sock puppets! What do you think?
9cr3hs,"I ran out places to put plants, so I macramed myself a plant-holding curtain. Turned out better than I thought it would!"
a9g2sh,My goal of the holiday season was to try making a wreath for the first time— these are the results!
91ie39,"Got an Alice in wonderland, white rabbit statue for my birthday and some money to buy paint. Pretty happy with the results 😁❤️"
af4n9p,My first carving. Someday I’ll finish it.
al253l,Some embroidered necklaces I finished this weekend!
7zromg,Watercolour portrait I painted of my friend's cat
b7wyub,"Bluebonnet Season . (A few things I would like to change, but I like it. )"
blyvon,My try at a tulip wreath!
d3t5hq,Llama with embroidered roses
dkb9uh,"I’m brand new at cross stitch, but I’m so proud to complete my first project."
dgkqcz,"Raspberry hairpin, my creation"
c3k1ja,Wire wrapped a tiara without a template and I'm super happy with how it came out!
b8zdgj,I painted a set of rocks for a class of graduating midwives!
dcmm2s,I turned a vintage tv into a display case for my oddities.
cbvt1e,Yellow roses I made from paper
a1hepc,'Tis the season for peppermint swirls! 8 panel circle skirt with pockets and snowflake stitched hemline!
8dvxhn,"I’ve done other types of needlework for years, but I’ve just started learning embroidery. This is my second completed piece, and I love it!"
dbg7qk,My dad is really into wood burning. This is his latest creation!
bhn2di,Finally finished my mom's retirement quilt. Only four years late! Love this pic she nabbed of me and dad trimming loose threads right before I put the binding on. Paper-piecing pattern called cattails in the meadow.
9vb9dl,Little crab wall hanging I made from beer bottle caps
a3ysla,I chosed to make the bushes using the French Knots technique... it took some time to finish but I think it turned out OK
dk3bqx,10” seahorse in purples and pinks
9x7dgg,Baby Simba I made using needle felting
aewaqg,I made some bookmarks to help motivate me this year!
