post_id,title
c605aq,Who made this masterpiece?
cq9fun,How a Lawful Neutral character steals money
co7nnd,Dumb Dumb Mister
dx69xk,Illogical deception roll
cxhpf3,It's important to discuss these things in session 0
dbbl8u,Brilliant dedicated RP.
cb6brq,Need one of those
dmwj1a,"Three fighters and a warlock? No, no, that's totally cool."
dvg6e1,"Neutral Chaotic, where you only fuck shit up given the chance to"
de2uiw,I rage again
d92q84,When the Barbarian & Warlock realise they share the same God
d8d8wm,I’ve never played dnd but I desperately want to
cyb9b2,Weird choices can have unexpected consequences
cco7cs,An Average One
d2hybc,This is a great idea
d5ge7l,Sounds about right
cgyjdl,"“You’re still casting mage armor? Ugh, that’s so 1470s DR”"
do6tuh,Those random NPCs...
dprkl6,The big sad
dc1762,Chaotic good in a nutshell
crnp40,"Same character, different name"
bcdlin,Im going to include this in my next campaign.
dn5itv,Has this been done? This was me last night for my campaign...
cw625i,Eric with a K
dy2t8g,I forsee a meme
draj7z,Gottem
cp2j08,DEUS VULT
d6d382,Someone needs to roll a death save...
dlpwwu,Put hallucinogens in your campaign they said
ct9o5f,LOTR movies were sooo long
d8px0y,My concept for a rogue who isn't an edgy little orphan
cd5hoa,Healthy relationships with others.
czipqk,When the cleric doesn't really care
d7akrn,Overqualified
di5tfw,"Just because you beat their AC, doesn't mean you hit"
cuebdb,I'd like to buy a magic bullet please
d12oat,Lemme tell you a story....
d0k88s,New setting for iPhone
b5n44o,Time Travel is risky
dofa9u,How did I never notice this in the very front of the DMG?
da3i3v,When a player rejoins the group
b29smh,I can’t be the only one
dtvxwe,Visual representation of a DM steering players
bkx14e,Found a similar meme on r/memes redid it so it fits here
cvv9bn,I bet they all had nightmares after his death
c6ibm6,"3 Clerics, 1 Warlock"
dbsdmh,There is always that one guy...
dwducu,Wallace and Gromit has so much meme potential but it's utterly wasted.
duruzc,U/shady2kover game me permission to use his post.
devum1,"Finally, a game system I could DM effectively"
dfw17x,Beint the DM has its perks.
cbzxg3,"Kind of persuasive, actually..."
bwnyvr,Tragic backstory
cn62ng,When the party asks for a healer.
dggzga,"Something, something, Warlock"
d6ma2a,Save to take half damage
d84rg3,Never trust your player’s get rich quick schemes
cxzzfy,True
dei70z,Some rivalries never change
drgkar,Any tips?
d7qd4n,So tell me again how you did 40 damage as a level 2?
csw1tc,This is too real
ckppj7,Just as good as a Tesseract.
djagl8,Multifaceted devil spawn
d0w1r0,Matt Mercer Syndrome
ca78y5,Rules are rules
dmeuok,The entire party: We would like to rage
c19onf,But we finally killed the goddamn boss last night
btlm6u,It was justa chair...
d3uic2,When your campaign starts at Level 1
cmdh94,Experienced players doing their part
byf72e,Haven't seen this on here and it gave me a chuckle.
cz2uy4,Shouldn't have accepted that m&m....
d43r6g,“So it’s settled then. We burn this place to the ground.”
ddksrf,Perhaps you feel you're being treated unfairly?
d0e639,"The way our ""heroes"" have to exit most scenes"
d2yz37,DND is a necessity
d1a0tv,"Dnd't see this posted here, from r/wholesomememes"
db2zjp,How I imagine “modern” campaigns
drwqb2,Don’t we all?
cvhk9d,Assistant to the Dungeon Master
dsx9bt,I Know What My Next Build Is Going To Be
con67v,*Matt Mercer knocking impatiently*
dm470z,"Y'know, I'm starting to think you aren't LG at all!"
dt3j9i,When the party is sick of the the splash-caster's shit.
dnl776,I may get downvoted not going to lie
dv8dmr,Archfey warlocks don't HAVE to sell their soul...
divr6e,Imagine GRRM as your dungeon master.
dcget9,Such an underrated one liner
bpc5vd,Joining a new group and trying to play along with the weird lore can be difficult
d6xjjz,Necromancers are always fun
csfiut,Based on a true story
bpw5hk,When the Barbarian rolls a nat 20 on an impossible Athletics check and saves the whole party.
djin2t,‘Tis a thing of legend!
czzn4d,*throws new expensive dice*
dfofj7,Mac would never cheat.
bqhl2e,"Alternative caption: When you didn't read the lore text, but still want to rp"
cx4p1x,Bards can fight!
bufjks,"If you're playing a high charisma character and encounter a dragon, consider this post."
cgrdew,The possibilities……
dj2z5h,What an Idea
ds5jue,When the party starts asking your doctor npc about where he works
dkjsce,Just because it’s there does not mean you need to pick a fight with it.
dxmkc3,When the Zealot Barbarian has Tavern Brawler
d2p4kv,What’s going on?
dljeqx,college of whispers be like:
ck6sbg,Bard vs Rogue is always fun.
dpn08z,I’m afraid
dgqqfj,"When a Rogue uses ""Stroke of Luck""."
d678wp,There are three types of players when it comes to dice
deptrg,I won’t stop till I can make a pride flag out of tieflings
c4akqc,I share the same favorite
c7rb8c,I hope others can relate to their party's stupidity
djncij,When your rogue doesn't actually has a dramatic backstory
dw7x1e,The power of Torm compels you!
cjghg6,Name a more iconic Oathbreaker Paladin
bvwjnh,"Hobgoblins of the world rise up, you have nothing to lose but your chains"
cpsih7,"don't mind me, just here to cause some chaos"
dlywu6,Roll 4d6 and 1d1
dr0s7u,I'm squishy.
dcopqx,It's honestly incredible
cev5cb,Got any more interesting item ideas?
c38gxg,full party of bloodthirsty orcs.
d3ni1j,"Are you prepared for the kind of death you've earned, little man?"
dh83kg,Some questions you can never prepare for
dtappc,What I have to remind myself every once in a while
caqmyn,Can we play dnd now?
d299fb,They never expected a thing
d4yguw,Thou hast finished me!
dipfjd,Devils are just white collar demons.
dmor5p,Combat tactics
dwxv6s,Now I understand it
dkscfa,Beware of assassins! (OC: u/eldercactus)
d9mdnk,"Remember children, always drink whatever you find in a dungeon immediately"
d2t372,The Truth about DnD
dc86bx,The tool of gods
dl6nrq,I need this campaign in my life.
bqvgqw,"""The noble's level 15 bodyguard notices you"""
dcbfw1,Tip of the Day:
co0nc1,Not all rogues use daggers
bw25h2,OC Sudden Realization I had after watching Dr. Strange
dxre15,This is an actual quote from one of my players.
ca0r3c,"You dun goofed, son. Roll Initiative"
dp3m5r,An orc that knows how to treat a lady
covdzy,Thank you so much DM
daenlg,You know what really grinds my gears?
bykn44,Please support the people who make your hobby possible!
cja3or,"Just remember, everyone needs their time to shine and you don’t get to be a part of everything."
dfgfd2,wack
cth382,Poor Rangers
deceev,Found on r/airforce
cur43l,Lesser known dice
bx0lmw,You just fucking drop dead
ctxnzq,Who knew that clerics had a secret language as well?
cee5td,Praise the Sun
ddoxox,Squishy wizzy
c8nwc6,the terror of the seas
d7vo0q,Anyone need a party mascot?
ciz9kv,“That wasn’t even the main puzzle in this dungeon guys and it took you an hour!”
dvr27m,Seeing your first character sheet
dvze2o,Can confirm. I am NEVER the adult as a warlock.
dua3f8,My seduction skills are uncanny
cmybl2,How many times has this happened?
chsmuu,It is to bards
ds2wcd,Always fun to see how others play the class!
dpaaa2,"When you bring your injured to a cleric, not knowing they are Forge Domain"
dkeyjs,When the rogue chooses to become an arcane trickster
cogf7m,"Look, you get me talking and this is what I’m going to talk about."
clk2cp,"Thanks DnD, you’re always there for me"
d5vts9,"This Friday, we'll be making our characters!"
dsdz2k,Shout out to the DMs of the world
c9tvg5,It’s just going through a rough patch right now.
daxf73,Bards can be edgy too!
cilgcu,Checking the rules
d59v03,We are many
cuw1dd,Shlurrp
b7b0bw,Just pay for things
ducc8v,I feel this applies to us as well
bh15gn,A new rule?
cdz6ew,They have a sixth sense for it
c3hq7d,"Not really the usual stuff, but its funny"
df8ko6,“Let us love you back to full health”
bwb30y,Being a DM in DnD...
dia31w,I can finally have sessions all the time
du4hww,[OC] Those pesky mimics!
d4jq8l,Nagas with Swords!
av3luf,"Not mine, but I thought it was hilarious. No idea who OP is 🤷‍♂️"
ck0clk,Meme I made. Sorry if something like this was already made. I'm kinda new.
cerqtj,"Player: “wait this might be a trap, I want to insight check the puzzle to see if it’s a trap” DM: *screams internally*"
dqjilt,Monks in Combat
dsovjc,"Well, my mini's weren't always this glam... I was a drab little DM once."
dq4l1o,Dang it
dv1guj,Neanderthal time.
cg32cz,This is my curse
cymudh,Rolling a Nat 1 perception check
bfazji,Burn all your welcome mats now
dphxk9,When the caster calls themselves a doctor but they have a +0 to medicine and no healing spells
czs02u,I love this format...
bixea4,When you're the only PC without an edgy orphan backstory
c33mym,Sinister af
dgb1ov,the potent anger of one emoji
c753kc,Same
ch9del,I’M 👏 NOT 👏 MATT 👏 MERCER
dtq037,It looked way cooler in my head...
cs0yby,It’s smitin’ time
cpwmp0,Roll a persuasi(O)n (C)heck
cxub8p,Nobody make eye contact
cpatue,“I got a nat 20!” “... for what??”
cc8y6b,The struggle is real
asog5u,When the DM isn't into history and and adds modern day conveniences.
cflv57,Can you repeat that?
d9hnju,This is what pain is.
d1dkj0,PSA from /r/bisexual
cr00n3,"After being a life DM, one of my PCs is taking up the torch"
df12m4,You fools! It's been staring us in the face the whole time!
c0jmfi,I would have been mad at the barbarian if he did that.
c13a1p,By Haridraws. Accurate.
dkxy6w,When the Tabaxi Rogue is trying to ambush the enemy:
cnjzt9,Treating your pet like a disposable lookout
d3ay5b,Cleric Vs Artificer
d8jxzj,Me (DM): How did you even learn common? |PC: The local druid makes my parent woke af.
chenzl,Bye
bpqwjw,How DM'ing works
cwjdwr,How every battle normally plays out
ctrka0,RP Quest going Extremely Well
dq7e6v,Your race doesn't need to give stats that work with your class
cr6ktg,When you didn't write a back story for your one-shot bbeg
dak00r,Memes before everything else
cyqc0q,One of these days
brr6lp,Have you thanked your DM today?
d54ktv,Drunk improv is the best improv.
cfzc5c,Mathfinder
bsvjsg,True story
cw294r,"Let's be honest, druids are probably A LOT more freaky than bards are"
b8wrv0,Don’t be this player
caj5ip,Fucking swordfight me
c1goo8,I touch myself..... LAY ON HANDS ITS LAY ON HANDS
cwm7m1,Creating new characters
ci2255,It be like that sometimes :(
dsi353,Keep eyes peeled for racist bees
ddw6e8,He also does voices
c6yb5m,PSA: You can Counterspell on your own turn.
b2zsuo,Dedication at its finest for sure
cm0yku,Very old meme new gif
bhpgt6,5ft apart.
dw8qan,You love to see it
btajb1,Bonus giggles if the NPC also has a goofy name
cbo61j,When you just accept your fate.
diwi16,How to emotionally torture your players 101
crc5ty,Suddenly Eddie Lizard is the most important party member.
c6acmu,Long vs. short lived races
c08bc4,Chaotic neutral rogue
cvnszh,Nat 20 bebey
d3dbie,Character Reference
dhgoam,My friend told me to post this so show him love pls
dk7oig,happens alot
cjs7hr,I feel like theres a good puzzle in this sentence
dtgiad,Elven arrogance + Dwarven obstinence = Humanity's ignorant pursuit of self-destruction.
c98hns,MFW my DM says yes to a seemingly mundane question not realizing she's now enabled my master plan
dgqtcl,"Man, the 80's were weird"
drq4z6,“It’s what my adventuring party would do”
c4m2pk,Just a friendly reminder that most people don't know the nuances and happenings of your Dnd group (aka keep your memes relatable)
c3uo08,Me with all of my friends who express the slightest interest
d5mxg9,"Dare I say it, my party is hilarious"
cl9go1,For those of you who wanted more Dungeon Cop
aflyw8,Epic
d265wv,Anticlimactic
berr7f,Revised Ranger excels at this
c51gpt,When you gain a level in druid
c8cvk4,Precious eldritch blast
cu1h6g,One day I’ll be satisfied
dk1t5o,Karma
d9yxdv,How’s that alignment doing
d9a4o3,Where do I come up with this stuff?
dfjhwg,Not to get political...
d1oxik,He's playing a halfling who talks to ghosts and is on the run from the church...
dd7m2v,"It's True, You Know"
cmyw03,May this meme give you some comfort.
bobrd5,"If you think this has a happy ending, you haven’t been paying attention"
clgu20,The sacred texts!
bo7i3j,"True story, this actually happened"
cqszah,You study for your magic?
cv9yhv,The dark mistress is satisfied
d756it,"""Why did you increase Charisma instead of grabbing Sentinel?"""
c22ks3,Mother hecker
cxcb76,"""Can I multi-attack with hand crossbows?"""
dg01ti,Replacing dice?
c2nawr,meirl
dbm499,Bards be like
d6simn,Pungeon Master
cf7u05,When the kindergarten teacher plays chaotic evil
cftqzn,Hope this isn’t a repost. I laughed out loud.
dk5m3y,Every time
ck9wvg,"""I don't care that you have a +4 to charisma, it's natural intelligence is 2."""
dmhakj,A young storm cleric
dl0aqu,Don't be that kind of rogue
dab6w7,When your party has two edgy rogues
dcys7t,It do be like that
doqvr1,Never. Split. The. Party.
d06nki,flawed chars are fun
d1wiln,SOME-
bx4xkf,My buddy made this before our session today
br32rs,thought i’d share this gem lol
c7zhxs,Blaming the class for your bad rping abilities
dqse6l,First impressions are everything
cif5kx,Mind Breaking question.
caytwm,From google
c28yoc,Accurate
cznqhj,How you get warlocks
c9fhh6,Oh you sweet summer child. You have much to learn.
doj4io,it’s actually hellish to fight a goose
bhy3pi,When DMS play God to much
duods9,"Me trying to convince my party that necromancers aren’t inherently evil,"
ah6137,Detailing the session like
by75hj,You only get one safety net now...
c4q8kx,I haven’t had a long rest since I was born
dnr13c,[OC][Art] Dungeon Masters
dgvjl5,"Multiclass bard confirmed to have worked on the set of ""Escape from New York."""
dctb70,Nat 20 on my money and time
d3609d,I'd accept the quest for free
and0pb,The Bard Experience
doo0h9,Every time. Save my worst rolls for those constitution saving throws.
cs2idh,Horse
brl9t7,Hopefully someone shares my sense of humor on this
cjmy0o,Posted on Tumblr and thought you guys might appreciate it
ccu7u0,"I'm so happy that the longer I DM, the less murderhobo my players are"
dd4wy3,Always be very careful on how you word your wishes kids
bkqzgi,The Gods are merciful
clwi7j,But I might need it later!
dh0xj2,"Wow, what an original character"
d4kcmp,It was worth a shot.
civ3jl,I genuinely enjoy it when my players are actually excited about their character
ch6um4,Fishing for Crits
arym89,"Not Slytherin, not Slytherin.."
c2uxd3,When will you learn—that your actions have consequences?
bmxjto,cool title
cv7r8k,*metagaming pigeon noises*
cv2ja9,One of my players just sent me this
ccgdsr,"Don't stop me now, i'll be having such a good time"
cunj33,Uhhhhhhhhhhhhhhhhhhhhhhhhhhhhhhhhhhhhhhhhhhhhhhhhhhhhhhhhhhhhhhhhhhhhhhhhhhh
cpzvtn,Guess who's back
dxw6x0,truly cannot relate
d4o7st,We’re going to ignore the law
cki77h,"Jokes on you, we can’t even get our group together."
bvdh6d,"That’s it, that’s the game"
b9bc3u,"I can’t be the only one who just assumes every DC is 15, right?"
cza09g,Comedy gold
cgi6ph,The Lorax Strikes Back.
c87i7n,As a DM you have to learn how to improvise.
do0c38,Good guy cleric
bebdau,That moment of sheer horror.
bb6dy8,Should’ve rolled higher insight when you met
dqo1ar,No more parties comprised entirely of orphaned loners with no friends
dfesst,Still love my boi though
bze5j9,*the party cheers in unison*
cpgeko,Ohhohohoho
d9k9zm,DM: *Googles puzzles for toddlers*
cwrfbe,God Bless DMs
cnp4rw,Second job
bluax6,"Found on Facebook. Not mine, but dang, that bottom part seems so perfect as a campaign for D&D..."
bnp86s,BARBARIANS
bagzfq,"Bracket style tournament arc, no killing, no magic items, just a test of ability. Honestly really excited!"
cgd016,They run what you might call a family restaurant.
d6gixa,Nothing is better than irrelevant abilities suddenly becoming relevant
dfm8t0,Guess who's never using a bonus action for something useful ever again
dxf5ph,Clearly they have never tried to plan a DnD session
cm7rnb,What’s your max hp again?
c9f6j6,"""Hulk min-max!"""
d224ef,Make sure your party is balanced
c2gq3o,This is blasphemy
dtjcn7,"""Don't hurt me, I'm just an old man"
bjbm6p,You're good enough!
b2so4c,poor wizards
cs6gen,When the rogue finally succeeds
danpyw,Why would you do it like that?
bojn0w,Never. Split. The. Party.
c5otx4,How I met my patron
aylnl5,It's run by... some dude maybe.... sits on a big chair...
clnsun,Pretty standard
cebkot,i'm so sorry for the terrible editing but i've had this stuck in my head ever since my party decided to take the mountain route instead of the underdark route
dcbitx,Cheeky...I Like It.
buxo9c,God can I please get more mature players?
bung0g,A gaggle of bastards
dlvqk6,Flex baby
dpz5sx,So a group of adventurers walk into a bar...
drnjz2,"Play stupid games, win stupid prizes"
bgb4nc,Wizards vs. Sorcerers
bgtd0q,bUt It'S WhAt My ChArAcTer...
aruiw2,So true it hurts.....
cfh9pa,When the rogue and the bard get up to some shenanigans
c3oqla,“Build a role playing system” they said. “You won’t go insane and alienate all of your friends” they said.
dtymc2,Damnit alex
bjqups,Not all players are murder hobos ya know
d4abmo,For those who work in IT...
bfp2m4,"Saw a new potential meme template, took advantage of it"
bdvise,And that's why I never played a wizard again
c1qbcp,I cast regret
d64cxj,Uuuuummmmm. Let meeeee check...
dngjrc,Or live life on the wild side and mix them all in one big bag! 😮🎲🤯
c91ffq,Deep down we all know it's true
cdmp3n,"As a DM, watching your players solve a simple puzzle"
dtf5vk,That includes yourself! DMs should be having fun too.
djt8e0,New UA Rogue in a nutshell (Repost but with new context)
d1xhhg,Was not expecting this
bmhet4,This was not part of the plan
chldo1,Oh no
c58z4t,I made this one for my party of all casters
b7ntj5,Fudging rolls from time to time has its place
cwcngj,For the Fancy Barbarian in your party.
crtll8,Should have put the cloak on earlier.
chd16s,"New players wondering why their DM hasn’t tailored the campaign specifically to them and their character, use unique battle maps and minis for every encounter, and have dozens of different voices and personalities at their disposal."
ay20tl,I wish there was a rouge in our party.
bf29nc,Sometimes you got to do what you got to do
cndwve,Players be sleeping
c94olr,Oh yeah me? I bet I never counted on this!
cwyime,Sunny Days
dsyj08,Ring of Intelligence
day0mk,Sometimes you just wanna play
cqnsew,So that's why that modron never returns my calls.
brbo7g,When edgy characters bring up their past unprompted
clhvq0,For those who needs facts about which is better
bm9cbd,Every. Single. Day.
cq3oi2,Don't judge a tome by its abyssal cover
dduag0,This sounds like one hell of a campaign
d1pd33,The party: hol up
cl2ipt,I have a problem
cvantx,"Congratulations, you’re a Warlock"
bu6ao7,Happens more than you'd think
d6ujym,Me helping a first time player with his rogue backstory
bc28w7,My first opposite gender character
cmnngp,Story of my life
dsl88a,Guess it's time to introduce his brother
c65vax,There’s always one in every group
de9isu,When the high level rogue crits
d1ka1v,Every single arc in my campaign hinges on a pun.
dp220s,Me a year ago
d5rcry,Because I say so
djunfj,Dwarves like their rocks
btypsw,Just D&D things
d0omsz,They walk among us
de1u27,Why dice and not minis?
d499pi,You all meet in a speakeasy
c9q0fw,I-
d3uio6,"""I'll ask the dog if he knows anything, if not, you go ask that bush."""
dqefyi,"They have a tendency to overreact, to put it mildly..."
d4t2l0,"something something, I roll to seduce"
bvk6mi,Lookin for that bulk purchase discount
c7jd03,Found this gem on tumblr
cg96dv,TiaMatt
bnhd22,When the Barbarian takes a level in Druid
d0s4gp,When the Cleric is DONE
bsgwcm,"To whoever is feeling a little down today, here's a necessary reminder"
cns9fo,"When you roll a 1 on your attack, then the DM asks for a dex saving throw and you roll a nat 20:"
ckeouy,"idk if this is a repost or not, sorry if it is"
c7gwby,That's not a man!
dhbhhx,vrum
cntoug,Seems fitting
b65m0s,"'Wow, all goblins killed with one spell?'"
cd0svp,"Yes, I do play a character based on Obi-Wan"
dcv01x,sometimes the bard memes can be pure instead of lewd
drh4ar,Lizardfolk barbarians be like
c9l3gx,Neutral Evil talking to Lawful evil
cyhu1w,Introducing new PCs is fun
be5v18,Nobody: Me: *this meme*
bfjhsj,Somebody cast Heat Metal
d9u75u,Mom says it's my turn to be God
cplvkw,*gets scooped up*
cdh0rl,I am the hero we need
ci7bkg,Wizards vs Druids
dvoxp6,The possibilities are endless.
ar1wec,Epic Bard
ar9b31,*Cries in DM
cqppid,When your PC is an idiot so you have to play along with the obvious trap
cf2bte,The battle of the century
c0fdk4,When your players tell you you make it look easy to run the game.
ci62oi,Is there a Lurker Character?
b1jsqz,"At this point I've given caring about what ""Makes Sense"""
cdd3rg,This is when the rest of the group takes a break
a3b03y,Stealth at it's finest
b500at,Is this that combat/roleplay balance everyone keeps talking about??
d7j9c2,How Power Word Kill really works
cl6ug7,DnD Warlock Idea
d7nas6,When you constantly need to calculate your attack and damage bonus
ckxmpl,Anyone else been there?
dim1dd,Glas cannon
d1r1k9,Those under the effects of Feeblemind won't get this
dddqio,Though this belonged here
cxnh4p,"""I'm just a very short human."""
dinvue,Let this be an end to it.
civo8o,"3 hours in, still checking for traps"
c6obef,Not the children
dfzm1s,It’s a constant struggle
bzaz07,Money well spent
bektt2,I'll be the dwarf nomad.
b818i4,Reusing NPC's across campaigns like
dgdwta,Better than an egg...
bovjn2,Putting the antsy in fantasy
dl6h68,"Fuckin' Bards, man...(College Of Swords)"
a69m1d,I spent way too long making this
cfpqiv,Choosing spells
bxxod2,How to deal with a Medusa
bh7fpt,A man can dream...
dwbeja,Level 9 is Strange Territory
bii9jj,When its been a roleplay heavy session and the gunslinger is getting impatient
bp1sb6,Dungeons & Tarrasques
cmrb7y,Unearthed Arcana: Expanded rules for bards.
bnboik,I made this mid-session cause I was pissed
dih7ua,It happens to the best of us...
d4ho61,"Hello, my fellow Satanists"
dr71fj,This is where I'm at right now
cu73gy,"They look basically the same, at least back when Spencer had long hair"
ce468i,They Called Me a Mad Man
aysyye,Is a 20 good or a 1 good?
cs8pzj,It seemed like a good idea at the time.
d1gcks,The sacrifices I make for my players
cy9226,Inspired by a comment
bjkiyb,Every. Single. Time.
bd1hlj,"""What, Dwarf is tasty and I won't let this go to waste."""
bl7z3p,The absolute unit
bbf628,DM Life
dbj0zm,I am always prepared to run at any given moment.
d8n0mw,You don't need magic to see through an illusion!
bd9aou,I sure hope we get there little guy
cueynt,Why be in student loan debt when you can be spiritually in debt to an eldritch sugar daddy?
bys6em,"People are going to make Bard jokes, but this is me no matter what I'm playing."
dib6b0,[Horrified laughter intensifies]
dk341q,"Contrary to popular belief, J.R.R. Tolkien did NOT fudge dice rolls."
dal132,"I'd play D&D, but I'm short on friends"
cagzqe,Or the bard got bored and learned smithing
ci9ase,I'm playing a sorcerer pretending to be a bard. Should I...
bg3mmw,Also the party: Did we level up yet?
cyxhe1,The canonical lore is very deep
b5d5bg,Xanathar's father
bbov1r,Now it’s a real challenge
dqqmv8,At this point just add fluorescent lights in every encounter
dcuezt,When Warlocks go to sleep:
b0apq9,#AllCharismaCastersAreSexy
c7bt4x,Every time my party uses two-handed
c8u0jt,"Fall back on that cantrip, son."
dxgq99,Rangers can be fun
cqikho,Amarite?
duy4i0,Diabolical
d9d2dq,I have no idea what I'm doing
byvqr2,Gnomes are underrated
bdfhvx,"I just started to learn it, but idk if can DM the Party"
cihgub,Poor d12s
d2526k,My players in a nutshell
bwv543,There’s always someone better than you
b6irak,Nothing to see here
c4u0lb,I was shook
cj5iyz,Dungeon Cops
cdu760,"You guys need any help? No? Everyone's already dead? Okay, I'll keep looking for interesting fungi."
crw7j6,Seems legit let em join the group
c8qkqv,Points for creativity
bzq3pu,Also the XP is nice
axkxlk,Alignments and Dice Etiquette
c8gotj,Roll for community
bqpekv,Not again
bggup0,Feelsbadman.jpg
bl2ogs,Gave me a good laugh
b6wbyt,How do you wanna do it to 'em?
b0yfd4,am smart
d6xis0,Another die council meme
dbha71,Hisssss
dmli4f,"As a barbarian, I was almost killed by our groups Wizard last session."
cu20e2,When your elven archer goes to the gnome thinkerer for a new weapon
blhwlb,Epic
ctns66,We all know That Guy
c1xtba,"Your world can't contain me, Jon"
czq0r8,“I approach the free samples station” “roll initiative”
chnz4h,"Next dungeon you go through, spare a thought for the hardworking maintenance crew"
dmvycv,Just gotta find this farmer’s wife first and then go win the drinking contest at the local tavern.
c1nd4o,Never met a PC that wasn’t like this
c41vg2,I didn't give up my soul just to not use it
dmlnmc,I...may actually try this one.
d1ak62,Enemy Wizard with 103 hit points: Sweet. Love this one.
bjfqtv,Con matters
crjboa,Why is this so accurate?
d3hkmb,A man of many roles
awf3tn,Creates a badass BBEG with a complex background. PC's first interaction with them...
bia44y,Clerics are OP
dqbbxq,"My first post, really excited to make a lot more"
c1mo7i,Original artist is Dingo doodles
dhdp16,When the Warlock tells their backstory
bzr9dt,Hello new friend
bv959j,*Insert title here*
aulr26,How about the 6th? Elvensies?
b2o0ca,BUt dM ı'M bOReD oF tHis ChAraCtEr
dug6ik,I’m not a professional I’m just an idiot
bqaw4d,me_irl
bz6dow,None of my players play Dishonored so they’ll never know
abjw3p,time for some saving throws
d6e2nh,When the party uses several nat 20's to continue the chase scene way longer than the DM intended:
c1rzwp,It all makes sense now.
