post_id,title
bzkuir,Jot that down
bgq10m,Argument is valid
apzhkq,I love my players
bzu490,When your players keep murder hoboing.
c06lxw,When you suck at making backstories and giving your character a reason for the adventure
dtiae0,Wild Magic is Fun
bxs10a,Best if they have all almost the same voice
dtn5wk,Ich habe so etwas gemacht
bfz9p8,And that's when my table decided our kobolds were the dog variety
d613ol,Casting Meteor Swarm feels like
crk07d,Mo bards mo problems
dqtx7q,It do be like that sometimes
dldfbk,The scaleless ones make good pets
cwerto,"I was remembering my favorite reaction to this question today, and had to make a meme"
bowdsp,Literally.
dier6g,Finally we have answers
b7syoq,When D&D nerds go out to eat
c0xdwv,Why spend money when you can shed blood?
at2ycs,(It’s the same button)
durgw4,"And just like that, he was gone."
cb07no,When you need a great name for your next D&D Villain ...
bsdkdh,Honestly I was hoping this is where it would go.
bdnmzw,"Role playing doesn't stop when combat starts, combat will be as interesting as you make it."
b142fw,Got into D&D at age 24. Wish it was much earlier.
dfnh8i,It do be like that
bv71ub,"When everyone including the DM just has fun being murder-hobo's and the game evolves around it, then a new player joins the group."
bmmw1c,DM Protip: The Bard can only seduce your monsters if you allow it
c42vn6,Every. Single. Encounter.
dtk5wj,Introducing New PCs can be Hard
db80hq,Dark Dungeons Lied!
dgngkk,From Soft I am not.
atgs1p,Time to shake up this template!
c0psp2,How PCs approach DnD
dlwagp,Well obviously my strength is too low to dig them up with a shovel...
d1s99y,Spin to win baby!
cdj6po,Our wizard the last few sessions
bsmu8n,"IDK, just something funny that happened today"
b0lia6,You know it's true
d2vm5x,I’ll get around to it
dko37m,A player talking to a npc about the bbeg
cfxifu,When you're a stength based monk
aqvvy6,I see you enjoy yourself Mr.DM
dlhc2u,What else are they gonna do?
b4nx1h,DMing in a nutshell
az40u5,Those darn radical gnomes
bo1lvk,"""Trust me guys its totally gonna work!"""
cgm205,Strahd is gone
bm3yzn,Why didn't you help me!?!?
cvda1k,when the halfling learns disguise self
dtiisk,Like stealing from the poor to keep for myself
bvoft2,Did someone say Monk Memes?
cky0c0,Me when my players are being quiet during a conversation with an NPC that i prepared major dialogue for
da5jpk,Cooking up a new character
bbjstq,Hope it isn't reposted
aqblrv,But that's what it is...?
cjppo2,Evacuate? In our moment of triumph?
dd7kpj,Does anyone every actually show up on time though?
cyauau,Love me some werebears
c1r66p,"It's FIREball, not fireBALL."
aiywyp,The twinkle in the eyes of a newbie
cuz9n0,Someone save me from the horror of the Mercer Effect!
ck7uqc,6 hp grandmaster
cubje4,Truly a destructive force of nature
cy6hb3,When the DM rules that you can use healing items at any time regardless of who's turn it is without using an action.
bryq1f,Pathfinder be like
d4s90g,Am I the only one whose bothered by this?
d25ab4,When the dice are against you
bttqun,"I NEED more ""Concerned DM"" memes! It's my new favorite and I cannot believe how few there are!"
ck4wdo,This is the truth
bwhpay,Somebody do this
ct3doo,People can never tell if I’m saying lizard or wizard and I hate it so much
drkow7,As bard I didn't come up with anything on the spot
dfiidk,It really do be like that
d49n7d,If they have enough int to not be a mindless killing machine that is.
batt2m,Somebody stop them
bjxqmo,Based on a true story
cabwcc,I think they appreciated my voices
ccgrlt,DM flex
dv3lpc,I'd go to this type of game
b0kfvt,This had to be done
bxc5q4,Is it really though
d423mn,They aint muderhobos
d46wn9,"It is you who are in the danger zone, friendo."
b3ovyd,This did actually happen in one of my groups
c02m2t,Please no
awvrjc,Half damage...
dddtl0,He's spitting fire.
cs39i5,Pretty clever actually....
dweiz2,They'll never know how close
bbwnkl,Hello there.
a0v2sy,Me trying to justify my Druid/fighter multi class with a backstory.
cz5udx,"""Have you tried talking to their leader?"""
c8vh97,When the Dm literally only has 5 voices to choose between
dvbj30,Succeeding where it counts (credit to u/BacoOverlord for this gem)
b43m1y,Matan...
blonu4,Please more Father Ted memes
c7jz90,Sometimes the best in game is just the casual dialogue
celpup,Don’t forget trying to intimidate the dragon
czzrw5,The BBEG introducing himself to the level 1 party
difgk5,"Vader is an oath of conquest paladin, change my mind"
d9q74o,Leafal Weapon
d7d7yv,Just some ideas
dvpya6,Well... Yes but actually no
a16t4s,Sad but simple truth
duk19q,"Even if you play, you have to make a reason someone wasn’t there"
bq388w,Lizzardfolk amiright!
djneid,Thank
bhcyv0,Who says divine magic isn't real? ✨
cit4oo,That revenant should have lasted longer...
d0jx82,Sounds like Tolkien would have made a great DM
c5tlt0,Infinite money generator
drosqn,My parents are dead
dh8oru,Next in the initiative order is...
c88tz7,Beautiful
dma1oi,imagine using spell slots to cast mage armor
b9rh2f,My group every time
aewe3g,"If you run D&D long enough, you will do this at least once"
dqypbm,Bards make the best Necrodancers
d9zrv0,Y'all are kind people
bxtj3h,Confidence boost!
au80zl,What about a spear? I also have a spear.
dhi3ye,"The party almost collapsed, but at least we're all taking the game seriously"
bv436u,“♪ save me from myself ♪...(and encountering dragons at level 3)”
ds48hl,It’s all comin together
a561pt,A dm's tale
aqnztm,Template in comments
c0tqtd,"Rogues can be good, paladins can be evil. It happens."
dst35z,When Two Druids Team Up:
dxt1mv,What D&D realizes
dbmbhp,Big green and not so mean
dq39rl,What can I say
ba4j2l,"I like to roll dice for no reason sometimes, just to see how my players react."
b245ng,Blessed
bhmd5g,Helpful Insight
axzkoa,whenever I decide to play warlock
dv0uho,"Works on Firegiants, Azers and Genasi"
ds7phe,I guess I’m a magic sugar baby now
djqn9y,Can I roll to seduce the toilet?
b3ewjh,Obligatory Warlock Meme
dak4rb,"When the story is actually supposed to go another direction, but the fighter rolls a natural 20."
bzwx7v,Apparently my DM didn’t think it’s as funny as I did.
bt09yr,Creative..
bb0qs2,Every rogue should keep this in mind.
ce8clx,Probably should have fudged some rolls in there
bw897g,Zoo parties...
czdmjz,Dragon Tax
dejcvc,Branching out
blbycp,Kobold
d004lz,Grampaladin got some upgrades.
crc42z,Learning the rules
ci2jwu,“But...but I want to make a perception check for ladies in the tavern”
akk158,"I came here to have a good time, and I'm honestly feeling a little attacked right now"
dd8wft,DC of 23
azmsp3,"""You see what appears to be"" an OC meme"
ad7adh,Dedication
chgol7,This is why we can't have nice things
cpidt9,I'm gonna need to see some ID.
ao5dad,They always have the most fun
bk9ap5,"good night, sweet prince"
drocjp,What’s the difference between fighter and paladin?
clxz71,1d12 vs. 2d6 am I right guys?
dpn0kz,Always important to have a DD (Designated Dungeoneer)
cmkjyx,To all you wonderful DMs out there
ace1za,"im begging of you, this is a call to arms. Keep OC memes credited!"
dgw6cr,When the barbarian multiclass with druid
azsxyt,Mentality of a bard
bi1u5c,Maths was done
dr0jfh,The sacred character
cs4not,Here's a meme for you guys
br8ram,It's been a long time
d1pfkz,This is fine
b9ov4l,"I read about this somewhere in the comments, so now here it is:"
brdbzw,Take a long rest
avftqa,The third one broke my mind.
dmpazx,Like spiders
balgiy,Druids irl
cci49y,Can’t win them all
dr7dff,fast as fuk
cqowmb,When the Wizard casts magic missile at highest possible level on a single goblin
azwscf,"""Let me just check my notes real quick..."""
cbfcaq,There's always a consequence for your players actions
b1f625,Thought you would all appreciate this like I did...
dig66w,"I don’t know if it’s very original, but I made this..."
dclcw9,My First Campaign Experience
avh0i4,I'm tempted to try this
bxzz28,"Me, DMing as every NPC in town"
ceku3w,*Whoosh*
bdsz4e,I mean... Uh... It's for playing your character well...
cyxn2a,"There’s always at LEAST one sadist, sometimes it’s the hippie who made everyone breakfast"
cpjyw4,"That's America's ass, that got knocked prone..."
amilxe,I just get so excited
bt5jg4,Never trust a rogue
chlps2,Try and tell me I’m wrong
dtknvo,Welcome to my world
aqhytl,That sweet +5AC
aj6wkb,Make a dex save
bxlje9,Best laid plans...
atv1l1,One day i’ll be a player.
dc8t3l,"Uh oh, I’ve got a bad feeling about this"
cmp9zu,How to D&D in real life
cy06zp,The dangers of playing chaotic neutral
d4f96b,You do not instant win.
b4hxft,“Roll a strength check” “26” “Yeah unfortunately that sword is just too dang heavy”
bplqgz,When the party is introducing themselves to each other and it gets to the lizardfolk's turn
dqzism,I don't know what's my DM was thinking
dk2icl,Big think
bmq0ir,Doesn't have to be tragic.
c6oyx4,Learn more about this addictive new drug more and more teens are buying
ahnnwd,"""No,"" said the metagamer, ""it has an AC of 18. I hit."""
dd9zr6,New Unearthed Arcana is out
c76ghl,Whatever floats their boats
dsxb56,"Rangers, before the rework"
ctk476,Y'all 🤡-in'
bjv1r4,They're So Damn Squishy
caeawn,WHEN IS IT
do48yl,"They told me they never wanted me to fudge rolls for them, since they thought it made the experience have less stakes..."
bn4jx0,Sorry for the ifunny watermark
cl4abk,So Strong
ds79p1,A joke from one murder-hobo to another.
dq6llk,The Wish spell isn't as broken as the Be the DM ability
dbrmq2,Just let it happen
d8am4v,Chaotic evil monks
cw2tc2,PSA: A bard can only seduce enemies if the DM allows it.
bs1yq3,D&D NATURAL SELECTION AT WORK
cjt6wy,Jack of All Trades be like
ci0tic,May the dice gods have mercy for the DM will not
b2hcj2,I hate edgy character backstories...
ayc1a1,"Behold, my Stand: Donkey. With a kick of his hoof, and reptile in the surrounding area is instantaneously seduced."
dvla0z,"""My voice gives me super stealth"""
dry072,"All Warlocks and Pacts are valid ,but pact of the Great Old One is underrated."
cxi26m,Don't touch Trinket!
cs751v,Yes Indeed.
b3ubzk,When the party gets TPKed at the end of the campaign by the BBEG
ddaldb,A Truth Found on Twitter...
b1rk88,Gives this man a group
dk8ptn,ToA is one hell of a drug
ce0389,They over-estimate their Charisma
avcu25,Guys remember diplomacy is an option
aptkba,"When the rogue, barbarian and warlock get into trouble and the Bard comes along to bail them out."
dfe4yv,True chaotic good
d8e78t,When your rogue picks the criminal background but made a generic and unoriginal character with no real personality
cf72p7,Overconfidence is a slow and insidious killer
d36dax,Me after running 3 sessions
dxcdbo,"As a DM, im proud of my players."
bfpgp8,"There are only two types of D&D Groups, change my mind"
cfce0o,Just don't be a dick
du4zqd,Chaotic Good Cleric
dw8hj2,"""Control Water"" sounds like a cool spell!"
bas2rx,A bardic insult found in the wild (found on r/rareinsults)
c449c0,"""Should I get a black one with spikes for intimidation factor? Or one made of bone for the creepy factor?"""
aoakju,Dance 'till you drop
dd8e3j,It feel like this sometimes
deoiyx,We're All Just Players in the End
d4bnim,Years of academy training wasted!
di0vu1,I'll jump if it means I can roll some more dice
d9ptw1,When you are a barbarian and get a +1 INT magic ring
cuipmj,When you botch your acrobatics check but nat 20 the dex save
df1uhg,The barb...
co5phr,Y'all would watch
cwowxv,"I'm sorry, future murder hobos..."
df36yy,"Hey, it was bound to happen"
dvlxed,My sounds shake the foundation of heaven.
dqrie3,[OC] A challenger approaches!
bn69p2,It really do be like that sometimes...
bk66r4,I've got some character sheets to update...
clhb0i,"It, uh, was consumed by the spell..."
ddqrhh,Roll initiative
deqtrp,Glass Bones; Paper Skin
dattzx,When the DM throws some bandits at a mid to high level party
bvrm50,Dead meme
bxpiwy,He lived his best life
dw1zep,When the whole group passes the perception check
d5iboz,If you ever thought perception checks were unrealistic
b60qxz,D&D and background music
arkniq,D&D mega construct ? Stolen from facebook
dvtztf,*TPK sounds in the distance*
bkdis8,My dumb ass a few sessions ago
bz2sqk,I don't have a clever title I'm just salty
ajtk26,"I'll just use a builder app, the character sheet is too confusing."
d857ty,"I just like my greataxe. Feast or famine, bring it on."
cy75wx,DM fell victim to one of the classic blunders!
dsevfy,Sorry Boblin
c0xyd9,The cleric fell first
d6x3mz,Every. God. Damn. Time.
chy9f7,Sums up about every character I’ve ever made
9sy8zk,Sorry guys I gotta have my fun too
cn82kc,i think the Satanic Panic was an overreaction
dva5kf,Paladin OP
bkbvuy,Pretty Please?
a9p93k,🤔🤔🤔
custo0,Well shit
cx8hsx,"Oh, how the game tables have turned"
ax5rv0,It's a simple spell but quite unbreakable
b1xkac,Oneshot in the dark
c68jc9,"So, what’s your backstory?"
d48dy2,Why divination is awesome
cdhvfa,never being in a campaign that lasts past level 7 be like
azxzag,Every fucking time
b024jx,My newest character is gonna be fun to play
bc1aqz,"Great old one warlocks: ""A forgotten god cannot ruin my life any worse then I am currently ruining it myself""."
csnly1,"Wise one, will I always be the DM?"
ao2ekw,Arcane spell casters in a nutshell
cfq1zh,Dwarves are actually just unusually hairy gnomes.
cmcrz1,Not even a history check
djv4eo,Do other people also worry about this?
d4y20r,The standard familiar of a divination wizard
cdw9i9,There are no downsides. Ignore the flames.
cf9wwm,Best explanation for higher powers you will ever find
c8vgu3,Sequel campaigns are the best.
crlgdq,"I mean I feel for you, but also I don't."
dfjvgj,Literally unkillable
agli8w,Me when i enter in r/dndmemes
al242j,"My state is about to get blasted by snow and ice, but D&D night is more important."
bz243b,This never gets old
b9xpcu,it does feel good
dp5r8p,It's the most entertaining way
bsazk6,Alcohol is a poison. Don't get in a drinking competition with a paladin
9zcdsf,Irritating
bcqvoz,When the two BBEGs meet each other and one is a much higher level than the other
dhizoa,"Less talkin', more payin'"
dkznx1,"Well yes, but actually no"
aje1h5,"Smites are crazy strong, but hey"
cyyfgx,It can't possibly fail...!
du18sh,Goodbye old friend
dk1wwy,"""What, Dwarf is tasty and I won't let this go to waste."""
dkzzxz,He just wanted to set the scene
cc9vf9,I'll tell them later
djwhek,"My alignment is questionable, my authority is not"
c1tsxu,Good times
dwfr03,"Please be respectful to your DM, especially new DM's."
avtqfz,"Ah, I love my subclass."
d1p8rn,Problem Solved
clo8hs,"We’ve been found out, boys!"
dqq1fi,It's poorly made but whatever.
cbkh21,Courtesy of the Skullspliter dice facebook page
b1dlj9,I wish this was a joke
ctm1li,I am the dm of one to be fair
blvpcm,When the 8 INT Barbarian gets a nat 20 on an INT check.
bxgy4d,How the DM expects the puzzle to be solved VS How the party actually solve it
c0ak0h,This is why I'm single
ctzu76,Long rest soon yeah?
dt2mq1,When you REALLY need players
b0pofj,Every. Single. Time.
acuml0,Bards are fun!
c8jc65,If you won’t come to the political intrigue I’ll bring the political intrigue to you
d4kd0x,It’s time for crime.
denebn,*confused screaming*
a7g1dn,"""Did you hear that? Must have been the wind"""
dl2908,He told me today he finished both seasons.
bs4d89,My Rogue's reaction when I won't let him get away with stealing the King's crown in front of his entire court...
dpwapc,"The DM: So what do you want to do with this downtime. The Fighter, Paladin, And Cleric:"
axuubo,Omg Ellen you didn't
dox845,The duality of the DM
do5tzc,What’s better than one bad British accent? Three bad British accents!!
dxmu6f,Rare footage of a baby Air Elemental playing in the rain.
dg3qih,"I analyzed over 1,000 posts on /r/dndmemes to find out how each class is talked about. These are the results."
aw2591,"DM: ""Make a Constitution saving throw."" Wizard with Counterspell:"
cv395f,Not wrong
ampo9o,I found I have certain patterns for character creation
dklbij,Clever girl
dnkn5r,That was unexpected
ckbmqp,"""That's Bob Lastname. He has never and will never do anything interesting."""
c6oh4w,"Oh no, this is what we call a classic love triangle"
bs2jdk,When the Cleric meets an NPC that worships the same god as them
banpgi,Stretchy mage
bcnvwg,When everyone thinks you're cancer
bc8yz0,meta roleplaying
dnrrat,"Oh, the betrayal...!"
b6fiav,Excellent DMing
c3va99,That is so true
d85lk6,On the road to the dice jail
auz9ep,When the party barbarian has 20 intelligence
dpbshm,DM throws a fireball at a level 2 party
bcujoz,DM: *accidentally uncovers battlemap for 2 seconds* Players:
c0q4wd,"The name of the campaign is 1,000 Ways to Die."
c0id9p,Paladins.
ds173u,I'm genuinely sorry if this has been done before
cmz3tx,HOW you play is more important than WHAT you play...
dnudu7,This year I decided to carve a very scary pumpkin to set the mood for my Halloween one-shot.
cu70gw,cake daaaayyyy meme
cf5s7k,Achilles was That Guy
c7m8r8,Shout out to the time one of my NPC encounters went like this.
dpywsk,My me and my fiancee have this peoblem alot lol
ck8upn,"Ok, how come you have 7?"
djsum8,"Oooh, bad choice"
cs3m2j,Mass suggestion op nerf pls
dtbh7f,Everyone deserves to feel pretty.
dek6nz,This is how Warlocks are made in a Modern Setting
awkef3,"Where were you? We needed you, dammit!"
d3fqus,“His name is Johnny Vapeweed. He’s a Wizard who studied in the School of Cool.”
am1k6f,When your AC is too damn high
cnsm5o,One of the best characters at my table was a Human Fighter
d5fae6,Sometimes a task is easy. And sometimes the DM just wants to move things along.
doth64,*Furiously writes down notes for next session*
crf5s8,"Roses are red, titles are hard, check out what happened to this goddamn bard"
atk4uc,I come from a land Drow-n under...
c6rx4i,Just say yes.
d5mqzm,Variety is the Spice of DND
dezxx4,Sometimes you just have to let players kill stuff
