post_id,title
cec448,I was without internet for a while. Decided to use my talents to make Deangelo actually juggle balls.
c1a2hf,Oscar was right....
ay2o5j,Should I call you Jimothy?
cmqwz7,“Which one is [Dwight]?”
90k4f9,"Met THE Michael G Scott today. Steve Carell is incredibly kind and just as hilarious in person. It took everything in my power not to say “Date Mike, it’s nice to meet you”."
c5gl2s,All of Netflix’s stock is gonna die
ds1aor,Truth
cir9l3,The state of Netflix in 2021
adpcwy,"Kevin wears his reading glasses to play poker, but not for his job of crunching numbers all day as an accountant..."
9dbitx,Day one: Snapshot taken at the first table read of The Office.
abufez,The cast's corresponding subreddits
7nfx6n,At the last minute I decided to have a nice quiet New Years with The Office. So what better way to start off 2018 than this.....
bc44gs,My best friend just revealed that Rainn Wilson used to babysit her
bzyz38,John Krasinski gave Jenna Fischer’s seat at Game 7 of the Stanley Cup to guess who...
a314bt,I wonder how her real husband feels?
8ol0s8,RIP Hugh Dane aka Hank
blwe1o,Oh its DAMN true!
9f2knc,When your reddit birthday is on 9/11
c5yqj5,A message from Creed.
cbw1e2,I love the little reminders that Michael really loves his employees
dgv5we,"I painted the exact moment Pam finds out Michael is dating her mom, oil on canvas."
80ni86,The Great Equalizer
azg106,Here's 2 minutes of John Krasinski breaking character
c2w94w,Oompa Loompa doobadee doo
afbac4,I'm not vegan
a7auqy,How Ricky Gervais really feels about the popularity of the The Office US...
cfmqz0,"I've been online for 3 days, decided to honor your requests."
ahraxv,"Long time lurker, first time poster"
a2hgqk,Low-key Office reunion
chozba,Nope. Don't like that.
d1c8hr,Toby finally receiving the love he deserves
asw0ao,You have a lot to learn
di664z,Poor Ed Truck ):
awvhsq,It was never about the location; it was just the wrong man...
avvk1w,The Scranton Strangler was at Dunder Mifflin!
90sga3,Why waste time?
607ip7,"Reddit's new algorithm was designed to keep Prison Mike off /r/all, but sadly that won't happen."
alhfeq,Wholesome
7eo92q,"Do you want to lose The Office? If not, help end the plan to gut Net Neutrality so we can all enjoy our rewatch binges!"
baxp64,"My city had an ""Office Trivia Bar Crawl"" this weekend and I went as Meredith on casual Friday."
a6eouy,'The Office' generates more viewing hours than anything else on Netflix
bm9bz6,I look amazinggggggggg
a7hddf,Boyfriend gave me this poster of Prison Mike made entirely of pictures of us 💜
aokvc9,Happy 75th Creed!
968s23,Kevin is too pure for this world 😥
7nqs0x,Today was a good start to 2018.
8pp51x,Ran into these two at Blue Jays game.
aqy0r7,Something to brighten your Friday.
ajh96s,I was so excited when I got to this scene
djmzi2,Why is this scene so under appreciated
al6mva,When my wife sends the kids out to play in the snow and we have exactly 4 minutes of alone time
939wn6,correct.
9c5jm1,Won the school art contest with this sculpture
9ed7cf,"Ah yes, THAT episode"
a2o15y,Belsnickel is NIGH!
axpzpz,Jenna Fischer’s (Pam) office themed birthday
93pg86,It's the truth
7pkyk7,The whole time.........
dggj3t,Professor Copperfield’s Miracle Legumes
d2icos,The more I watch the more I realize Dwight is a really good guy and loyal friend.
a4ny2q,"""It's not my sport, I'm just doing this for charity!"" Oscar Nunez"
ckw476,"This will be my last gif. Goodbye, and thank you for everything, love you all!"
arrlw7,"Bob Vance bought me this meme, it's from metropolitan Orlando"
cbhnv8,I check the time constantly.
awk34m,My favorite underrated Dwight line.
9vblgu,What did you expect Pam
am6022,Everyone has their opinion on what their favorite Jim prank is. This is mine
c3a34h,Too true
a402sy,The Dementors
aejb5e,The ultimate spin class instructor
8rrt2t,Happy Father's day to Assturd's real father!
a3bzg1,Micheal Scott on role-playing
a6teqb,New NBA Logo
9vl254,Never noticed this
9wufaq,Such a resigned “okay” too
a11jji,Lmao
a5uulv,Hello Clarice.
8tqukm,"When Dwight is acting manager, Andy starts wearing short sleeve shirts—continuing his strategy of ""personality mirroring"" to become number 2"
86sr3p,13 years ago today The Office aired for the first time ever
cn9i9n,My art progress measured in Dwights
a4fiq1,Oof.
ai0v0z,underrated scene
7rqxp8,IT IS HIS BIRTHDAY.
8ep30u,Michael Scott’s Best Moment
adx4rt,The worst of The Office
bn3yk2,THE OFFICE CHILD EDITION
ac5wlo,This sub
aeqrkm,Ryan still tryna control Kelly 🤷🏻‍♂️
dl9egb,It’s true
7z5izb,MASWEA!
arxgqk,Darryl’s underrated pranking ability
8jpjzj,How I feel anytime I post to reddit
9zj75j,Trey Quinn does The Scarn for his touchdown celebration!
asb95o,I struggle not to give this answer every time I'm asked
9nocsd,Jenna Fischer's son dressed up as Dwight for Halloween.
8ykp46,This is Florida Stanley
bh0079,Update
ax69o0,I highly recommend watching this series after you finish The Office
9ypidh,Pam and Dwight have the best office friendship
bd4ogz,Jim was no company man
apo6l5,the genie we deserved
87s83j,Need 🙌
a4l3x7,Scott’s Thots
8w1hmi,I can't think of a more American quote than this.
7qlgs1,Even netflix knows our secrets
8caxlx,Who wore it best?
ap3yna,Dwight thinking ahead
7rxp1q,"Met the Legend of Dunder Mifflin finally, at a Penguins game."
d20h9l,Rainn is savage
8z1vzq,when my first post here gets down-voted into oblivion
cgxnta,Boardroom designer nailed it
ak35b5,I finally broke down and bought myself a plasma TV
b3svmo,Happy First Day of Spring folks ☀️🥨
avqpfp,it's amazing how much she has changed
aufnka,Was going through my moms high school yearbook and ran across Meredith
8rflph,Met Japan’s #1 Heart Surgeon At My Graduation!
d4so37,Another fantastic Creed moment that shouldn't have been cut
bhmq1m,When you hear about NBC's streaming service.
9k080t,Petition to change up and down votes to Michaels and Tobys
a1sne0,True
7ojhin,Awesome deleted Creed moment. Bullying.
cd3rqr,"Hello, Clarice"
7u5gt5,"Little appreciation post for Michael Schur (“Mose Schrute”), who has actually been producer and writer for The Office, co-creator of Parks and Recs and Brooklyn Nine-Nine and creator of The Good Place. Ode to Mose!"
9pp42n,Making my husbands dreams come true on our honeymoon.
9lcc7z,"William M. Buttlicker, Founder of this country"
9ytmnw,I swear I don’t work for them but this made me laugh.
9a78rt,Creeds gotta be up there in top cast.
cicwho,Good old creed
8zw6t9,When my Office quotes get down voted in a thread.
9hzby7,Who’s your favorite ?
bmqmpx,"Stephen Silver, the artist who drew Kim Possible, was a fair in my town. He drew this and my gf got it and had him sign it! Pretty awesome gift!"
bj3ilq,I’m not crying I promise...
aalosl,And then the Michael Scott Paper company was founded
9d5vt6,How’s my favorite subreddit doing?
8hp9vm,Our first look at Jim Halpert in Ant-Man!
b00z62,It was Creed smoking in the parking lot.
9fbk34,There's too many people on this earth. We need a new plague.
dxp3fp,For god’s sake not now Toby
9mpfl4,RIP
aaa330,"The $80,000 salary that Dwight earns from his business with the Devil calculates to $6,666.66 a month."
b3l91u,Look who sat across from me on my flight!!
dnfdt5,We pulled a fake proposal prank at our friend’s Halloween party. No one got our Office reference and chaos ensued. Happy Diwali everyone!
9l7vsk,An interesting title
ca0n2z,My favorite double camera stare
acl9ft,I had always wondered this myself.
anrayl,I am a gentleman
cgjdbx,"First photo was taken in 2010, while I was at school at Nerinx Hall (our Alma mater!). The second was taken yesterday at closing night of a new musical I was in, which Jenna came to see."
cz3wlc,Remember Diversity Day from the first season?
bebw61,"Felt cute, might grill my foot later, idk"
dv0qo9,Ok boomer
9rk4sy,Michael knowing the name of Angela’s cat was an awesome detail by the writers.
9ylk4x,"If you look hard enough, you can see Michael Scott."
81737s,Mayor of San Jose looks like Prison Mike.
9cxahw,9 years since that faithful day.
96pq14,"To reach the top of r/DunderMifflin, you need to get a good quality screenshot, give it a good title, take the new post.."
6ing5f,Looks like The Office cast loves each other IRL
aq4z3u,Happy Anniversary to Ryan and Kelly.
agkbnc,Dwight and Pam’s friendship is the best
6ckiks,"Well played Amber, well played."
982vkn,How the turntables!
8oup8o,I made an Office thing.
8jwfz2,They said Avengers: Infinity War was the most ambitious crossover event in history
89zoge,Can we take a moment to appreciate how talented this woman is for convincing us she’s a human trash bag?
9qfjrs,👀
ata3dd,My son speed-crawls into the living room to watch The Office intro
8mqqo6,I met a heart surgeon while shopping
8wa85e,"For me, the best part about ""Scott's Tots"" is that Stanley kept that newspaper for 10 years, just waiting for this moment."
99hdyb,"Picture this... Thanos, but he is voiced by Kevin"
d7anjw,Wise words from Creed
97czzt,"This moment, at the end of the table read for the series finale, while the majority of the cast is wiping tears from their eyes, and John Krasinski takes one last look directly into the camera."
9sca32,My actual reaction when my alarm just went off
9eh85v,The best part of the US Open.
bcpdhb,Classic Jim
8dof0l,I figured this sub would appreciate my grad cap from last year!
71ui9v,Angela Kinsey retweeted this terrifying faceswap 😳
cfz13i,"When you finish cooking and leave your dishes in the sink to ""soak"""
a1hn45,My Secret Santa made me The Office version of Guess Who for me!
aic80h,Do we appreciate how happy the cast makes themselves look when we ask to take pictures?! Even if they are tired of it we wouldn’t know
9sfw2g,"I've never noticed this before, but in S5ep25, Idris Elba almost breaks because of Kevin's delayed hi."
c3pgt2,Met Andy Buckley (David Wallace) in a train station today. He gave me this:
886o3b,"Just realized that John Krasinski made his career essentially playing a character that specialized in non-verbal cues, and now he’s directing and starring in a movie where if you make noise you could be killed. This is what he’s been training for."
a5be4g,Let’s talk about how good a friend Kevin was to Jim
8p5j9o,"He wasn’t perfect but I always respected David Wallace for this. Drove all the way to Scranton, auctioned off time at his vacation house, and he even bid on Phyllis’ hug. He didn’t have to do that, I think he just genuinely cares about his employees."
as20bf,It’s true..😂
bxlh9i,"I sincerely don't know who made this, but lol"
91msgh,"Say it ain’t so, Big Tuna!"
cdhphc,Michael adding sugar to diet Cola will always be my favourite unspoken moment of his
ajul5b,Life is short. Drive fast and leave a sexy corpse
8a6r10,"Half naked women make it to r/all, but what about the best heart surgeon in Japan?"
a15ykc,A True Gentleman
8j43bb,Happy Mother’s Day!
ahh88u,The real 10 year challenge
905s5s,He's not an idiot! He's mentally challenged!
a1nr22,How’s my favorite subreddit doing!?
aukkev,He was always so happy for them.
bl0inw,Jenna Fischer and her cat Sonny (from her Instagram)
93vl2x,So my supervisor left me in charge for the day and I came up with the idea of remaking the office intro with my coworkers. Hope y’all like it!
a7zjp4,Petition: A reboot of the office entirely from Creed’s perspective
826hbl,I would assume Kevin is now loaded????
ciiva7,DAMN IT TOBY
bqu14i,"Classic michael, jim and dwight in one scene."
8apwlo,Remember Macklemore? This is him now.. Feel old yet?
a5hgiy,AttRM
c2h9tp,Your dentist's name is Crentist?
ah0dr3,Coincidence? I Think Not!
dcpwkl,Michael is not wrong.
aptjmq,Stop scrolling. Bow to Cherokee Jack. Continue. Later Skater.
da7h0p,It could have been so awesome
aot86y,"Conference room, 5 minutes"
amriwx,"So, where's Jim?"
by7ldt,You're dead!
d05orl,How’s my favourite branch doing
c06y1m,"I captured, in rather creepy fashion, the moment Pam realized Michael was dating her mother."
ajbseb,"First I was afraid, I was petrified"
9fl46u,Damn right
d3vyau,When Billie Eilish brags about having watched The Office 12 times...
9h4vt4,"Another gem I saw on twitter, sorry if this has been posted"
d8enwd,"Not sure if this has been posted, but that's 100% Roy"
9z4xja,A true gift from the heart
b0t3lz,One of my favorite Kevin moments.
dbzg98,I always loved this prank because I like to think of it as another subtle instance of Dwight secretly liking/appreciating Pam.
8ejx14,Too true...
98kr7l,Jim has had some great pranks but I don't think this get enough credit. He literally wrote an entire book to trick Dwight.
ckp08t,Why is this format not used more
alcvgl,Does anyone else agree that this might be the greatest Erin line?
cpxnud,Get Smart is the closest thing we have to a full length Threat Level Midnight
8llchb,Nicely done 👏
b0fsah,"Discovered “Tallahassee” was filmed in the hotel I was staying in. Of course I requested Jim’s room, 244. No bedbugs present."
an1u2i,Patriots fans VS. the entire rest of the NFL today
9zei12,whore
8b41fl,Michael looks so fed up with me for not hitting play lol
ae6ygl,Favorite Michael moment
b66vjw,Underrated moment
9oto39,If it ain't Pam it a scam
c7zzfw,The fact that I saw Stanley’s profile in the sponge shadow means I need a rewatch.
921w0n,Either you get it or you don't
d73ij6,I’m in my worky works...
9mth2s,Dwight has the biggest r/Showerthoughts moment in the history of the office.
9t2hal,I just realized that Gabe is so damned tall that he needed two costumes put together
9g70xv,So THIS happened today...
b0lz1p,I live in an apartment and my Wi-Fi name is 'Dunder Mifflin Paper Co'. A neighbor of mine seems to have changed their Wi-Fi name.
dcybuv,Jan’s Naked Breasts (DELETED SCENE)
bszg7t,In Real Life
ccbpv1,Shitposting Friday
cow48b,Damn Creed
bmxxx1,My transfer student’s graduation cap.
8cf6b7,Look who showed up at my work!
aedukp,🤦🏻‍♂️
99x7nn,The Office Characters drawn by John Loren
b90g3f,My dad is doing a presentation today and sent me a photo of the lobby
83nnea,When I realize DST stole an hour of sleep from me this morning
dpeqde,"Remember to get a glass of water, get the pills ready... AND SHOVE IT UP YOUR BUTT"
cr5ebv,Happy 57th to the World’s Best Boss!
aj17zj,The Office documentary confirmed via Robert Shafer’s (Bob Vance) Facebook.
dkkic4,"My daughter wanted to be Dwight, so that made my costume decision easy."
9iuk1c,Little bit suspicious
72nqr6,Went to my local Benihana in Ontario and I saw this picture!
ahljyj,Who's with me?
8mzkfw,"Since its lemonade stand season, lets appreciate some professional advice on conducting business this summer"
au156x,Today I realized Holly eats ass
b146s9,Craig Robinson was on my flight today
b4s7n3,"On this day, 14 years ago, the very first episode of The Office aired for the first time!"
8qa9de,What do you think of role-play?
ba62p4,I'd take that deal
8usxc9,Be careful who you make fun of in middle school
8eegp5,"Oceans, fish, jump, China"
7j7vhs,I fully support this
ag26jn,Just want to give a shout out to the camera man who was going to follow Michael and Andy to Mexico for 3 months.
9j71mj,Aged like fine wine
cjtww1,The Gift That Keeps On Giving
bv4qz9,"Beards, the male push-up bra."
avcljm,Toby’s only good Scene in The Office
b4i7ns,*shock*
a9a5jt,keeps me up at night
auyspl,Out of our control
apy5e4,The real love story
9ujild,Daylight Savings Be Like
aqn6ix,ANN PERKINS!
8wewj9,Friends Forever
aavy4r,#1 Most Watched Show on Netflix
adhixb,Me every single day of the year
d6vbpp,Oh boy
7loxg7,"One of my favorite ""Wholesome Christmas Moments"" of The Office"
d3p27z,Hoping no ones done this yet
akc7y7,Pictures you can actually hear
azk9bw,"I've always overlooked this line, it's absolute gold"
8zeyme,My sister was so excited to visit Scranton Business Park.
9u39b9,"Everyone: ""Don't forget to turn your clocks back an hour today!"" Me:"
cq7bsr,We all felt that
9ygdco,Probably the lowest point of “The Office” in one image
a49vwb,The perfect crossover doesn’t exi-
a45286,This scene warms my heart
c896ca,"Well, well, well, how the turntables"
ag7xs8,"Best CEO (Then, CFO) ever...."
c73u6y,I got to meet Angela at CatCon!
9tjop7,Hank always made the most of his little screen time
9878h8,The show we all want to see
a2rr9r,it do really be like that
c5806q,This format is still relevant right?
a502dn,Ri-di-di-di-doo
b1rcuj,Who would you cast in The Office 1980s?
a3uoj4,Darryl and Andy’s friendship was underrated
9tdj1g,We took a shot as Jim and Pam!
ax1auq,"People give Scott's Tots credit for being the cringiest, but this scene kills me"
7csz9u,The most Kevin thing that Kevin ever said
a56dtj,Talking to crush be like
alov6n,I find it funny that an actor who plays someone like Ryan Howard writes kids books in real life. This is adorable!
b8wcrc,Did anyone else hear this in Kevin’s voice?
al06xf,Come in!
7lv42n,When you finish all your Christmas shopping
b9wz5i,Come on Pam!
d1phxh,"In The Quiet Place (2018), John Krasinski can't speak a word as Jenna Fischer has jinxed him since The Office Season 2 and Krasinski is yet to find a single goddamn coke can."
chwklv,"Was rewatching through the first season, and during the part where everyone was listing down their diseases you can find that Phyllis actually had depression. It's so wholesome to find at the end of the series Phyllis being so happy and glad about the experiences she had - all because of the office."
7zbb86,This model looks like Dwight and Angela's baby.
akua25,"Wow, that's good timing..."
9xgq0z,Dwight’s not wrong this time
dvju9e,Old friends
9q7qnp,Happy Birthday Jim!
99s583,"Dwight too, had some wholesome moments"
d6j3ri,BUTTLICKER
aczl85,Get out of my head Zuckerberg
a84dc3,Can I get an AMEN!
aoemne,Deleted scene Kevin vs Ryan
7rkv8l,"A certain paper salesman decided to shoot a scene at my job, figured you guys might like this. (crappy phone quality)"
aguwga,get outta here toby
8p00uf,The evolution of John Krasinski(Jim)
90alu1,which one is jim?
c1skvm,Shout out to the camera man who actually followed Jim to Stamford
a34sls,When John Kransinski isn’t in the reunion picture
dv9r73,Surprises how Kevin even agreed to hold the greens.
bdszlj,Relatable
a778it,"On a recent re-watch of the series, I noticed the actor who played Jim in season 3 is the same actor who played Jim in season 4. The attention to detail in this show is amazing."
8mhp1h,Work
9aacjy,I highly recommend watching this series after you finish The Office
9h8jvl,Good ol Dwight
aivz7k,"Going on a first date tomorrow, and the guy sends me this a few minutes ago. I think he might be a keeper."
bekhw4,LOUDER SON!!!
a04cf5,Koi pond scene extended is hilarious
altd97,Am I wrong?
9ihc8b,Scranton Strangler Identity?
9vwxw5,I love Michael's face in this scene
abfbwo,Happy new year
9xcvh3,When I see a funny and original The Office post
csic14,When you see a conspiracy theory video on YouTube.
balyvh,just visited the holy land
d9d281,What??
9zpef5,Pretty sure it's a rite of passage for every subscriber of this subreddit
99707h,open toed shoes
cal2me,Found my old video iPod and it still had all my old episodes on it.
9t8t2x,My little sister attempted a “Kevin spilling his chili” pumpkin. How did it do?
75ylkt,Still one of my favorite Creed moments.
dc8h1s,rip
aa2pzg,I love all of these shows
7w1r6n,One of the reasons why I love Michael Scott.
9s7dan,Who else wishes they could’ve seen how this would turn out?
anao2j,The halftime show we deserved
airnwe,When I finally make a post on Reddit
cy9n97,Nice response though
ccs79f,Look who showed up to my mall for Pretzel Day!
czbkaa,We’ve all been there
awcsny,I always forget about this until I hear it again 😆
6gz2fh,Pam & Jim
7jtonw,When I see people complain of 'too many reposts' in r/DunderMifflin...
ar97bt,Dwight Schrute collections 🕵🏻‍♂️
77lcgw,"Happy Birthday John Krasinski! May you enjoy your day just as much as, we fans enjoyed the Office."
cb06ac,The mods are sleeping. Let’s make Creed the new manager.
a8fuql,It’s time to stop
ajmbnr,Happy Birthday Ed Helms!
9maomc,When a co-worker finds out I love The Office and let's me know they've seen a few episodes.
ap9o6v,Oh...
c64kum,Goodbye Michael (OC)
bvwrk1,Stupid SatNav
dwh2si,Pretzel day!
ayvmwy,The perfect clock doesn’t exi-
7yzsxd,When I see people complain there are 'too many reposts'...
bb7naa,"MRW they found out ""someone"" was streaming The Office at work so they blocked Netflix"
940jn2,When Jim makes a joke
9zri4r,Found on FB Office Super fans Group
85j4it,I think this belongs here
cvpzsy,Was Dwight’s Idea
88rcvk,"In honor of April Fools day, my favorite prank in the show."
bg727c,Does anyone else think Michael and Christian should have been friends after this?
9usvh0,It’s the way he catches it tho.
7qrrch,I struggle not giving this answer every time I'm asked at work.
dqnoi8,"Can we all agree that these two have been aging very, very gracefully?"
7wx5yn,That time of year again.
amy3k1,"Hey, nobody cares"
928xls,My local baseball team hosted “The Office Night” and gave out Michael Scott bobble heads. I dressed accordingly...
aw5auz,Creed just casually wears sweatpants around the office
achu9i,Get out
aa34tw,The Senator has a good point.
9oycjd,“Stanley yelled at me today”
ct5gxv,MRW I overhear casuals talking about The Office
d8ogdf,"Goodbye Strangler, it’s been nice"
7wg2fc,Omg haha
cda6op,I laughed every time
ddmzef,"You all be hating on Season 9 Andy,when we should be loving on Season 9 Nate"
afjo5s,We all need a ride-or-die Kevin in life
d7sv4j,Insult or compliment... depends on the season
a09i5h,I think most people in a relationship have been in Pam's shoes.
8x5nbq,Everything wrong about season 9 in one image
7m9ngv,You vs The Guy She Tells You Not To Worry About
bcko9c,"Hmm, very accurate"
80wl66,"Hey guys, I know I'm late to the meme party but I just thought of this and had to share it."
9v8xf7,Wholesome ❤️. This really took me back to my first time watching the show
ain10t,This is how I picture Creed sees the office.
aqairk,I'm a bit late but this is my Halloween costume! I am Three hole punch Asian Jim! Hope you guys can appreciate it!
832jks,Happy women’s day
9qwu52,The mods are sleeping. Let’s make Creed the new manager.
auevfp,The best of Erin
9cmn5m,Sirius Schrute
90x2zx,"I love how Michael just wanted to motivate people on the Booze Cruise, but kept failing. Then at the end, unintentionally, he kept Jim going."
d0015f,Dwight has the biggest r/Showerthoughts moment in the history of the office.
agntbe,This makes me so happy
amdv1e,I've been up for a while !
amifhj,My favorite Robert California quote
bvcjc6,Shout-out to Oscar with the best ELI5
bcdsck,"Sincerely, Jim."
91rxqt,Dwight always knew
8s0qha,"Never saw this coming the first time I watched the show, but I look forward to it on every rewatch"
9m6olv,My friend posted this on ig
9w3o8j,The woman Michael has been looking for all along
c0q9fl,Season 1 was weird
a5lo54,"For the return of Jim to the Scranton branch (S03E08), Pam got her hair done and put on a brand new sweater."
9n53gc,One of my favorite underrated Michael moments
94dqln,Y’all know what I’m talking about
7zx3in,"""Slapface"", brought to you by Jim Halpert."
950iqj,From r/WhitePeopleTwitter
897643,Maybe Someday
9gjbes,I figured out why John Krasinski made a nearly silent movie.
afv14j,skip it every time
dauic1,Give me 4 days 3 hours and 30 minutes
cgcesc,Everytime
9kc3fl,Perseverance
9ru62d,We met Meredith!
asi4p2,Michael’s full koi pond dive
7r1xf4,When a picture of someone's baby shows up on the Front Page
bnpvfb,Happy Mother’s Day to one of these three interns.
ardywr,This keeps me up at night
bivk50,We were robbed of a great episode
a6oson,How to find your soulmate
7oyzq0,"Logan Paul, 2017, colorized"
cf7x3q,I’m not good with titles
b85yy6,"Ever since I found out that Steve improvised the kiss with Oscar, I've been impressed that Rainn just got up instinctively to kiss Oscar because Dwight would have done it."
ab6lkq,Here's to 2019!
damwou,Thought you guys would appreciate our pregnancy announcement!
7x1jqu,When literally no-one wants to be my Valentine
axaj9x,Michael is always there for Pam.
ao87po,You’ll see..
ad6q6a,I hate how bad this green screen is...
d5inrw,"I have a lot of questions. Number one, how dare you?"
b2aiav,Oh no...
6lm0uo,Michael has the Italian flag on his desk in celebration of St. Patrick's day.
95b6f7,Accurate
8ins12,Without a doubt my favorite Michael moment.
9di1rn,Glow up
7ynh2k,"How to Celebrate Leslie David Baker’s 60th Birthday: buy a cake, get some candles, and shove it up your butt!"
9bskjm,They are in trouble
91i41b,You don't even know my real name
6e04yh,To those who served our country
bgf0sa,Just remember
azxodi,"Can we give credit to Darryl for driving 14 hours in one day for Michael and Holly, then trying to cheer up Michael?"
dsgzwf,"Just think, if Michael would have invested in Suck It. He could have paid for Scott’s tots college."
9avveh,Could never understand why everyone else felt Jim was in the wrong in this incident
8lyzbc,My WiFi Network is the top one. Today I noticed the bottom one.
9klpl7,Me trying to make small talk
c4lqe1,Underrated Jim Moment
932cf7,Mods are asleep... use the baler
9x76i2,Season 9 be like
c9hoyv,"Equally smart, equally handsome"
agdebh,#10yearschallenge
bdespk,Goodbye Toby!
dqzzrj,Classic Kelly
88zh13,"You don't know me, you've just seen my penis."
8wyfau,Lego Kevin's famous Chili skit
9hfcr1,Gotta love the Ice cold side of Jan.. watching the dinner episode.
abiz0a,An American soldier hiding in a trench from hostiles (c. 1945)
6pxvth,Either you get it or you don't
9uczv2,We all know who the real mvp is.
8gaa50,I just realized that they're both Creed!
cpch7b,Not bad for a day in the life of a dog food company
aj6glf,Wake up people!!!
