post_id,title
95f782,Don’t we all Angela...
bgmh7u,Oh God
8j831x,This is a meme this is not an actual Twitter post from Steve Carell but I felt like it belonged here
6qwe2v,Almost peed my pants when Dwight delivered this beaut.
bttlk8,Meredith Palmer...at my Target...omgomgomg.
d2qf8s,The Office meme
8f9ve9,I've never seen a better use of this meme format
5tm3pt,Me_IRL
7mnhpp,This is just beautiful. I hope it’s not repost
69eqls,Happy to see Jenna is publicly declaring it!
ddewk2,Watch me.
79n7yd,An OC post on r/dataisbeautiful looked oddly familiar
7ab96j,That time Andy dated a high school girl...
9dlu8k,Yepp
911b6v,Have we forgotten this moment when Pam was crying over Jim being with Karen and Dwight got protective?
8i1bvy,I painted the Assistant Regional Manager
62zhui,when she says that she only dates serious guys
a24s8t,Seems about right
8kv9zj,My kinda wedding
bovqgl,When you have no clue who James Charles is but keep seeing his controversy plastered everywhere for days on end.
8ayd7n,HOW'S IT HANGIN'
clp46o,"""Just pretend like we're taking a photo until the cops leave.""... Met Creed today!"
9b33ib,The calm before the storm
bc8iyl,Rainn Wilson came into my high school class today!
bz6ry4,I still haven’t finished
cyvt8x,"Found this van in Rock Spring, WY"
az8n4r,First Reddit Post Ever! Hope you guys enjoy
d89lp8,I cannot stand idly by while people say that any episode of The Office was better than “Dinner Party”
7y29md,Only Michael Scott
6o4zjh,Ha!
9emd4b,When someone says they want to watch something other than The Office on Netflix.
dbs4vt,Me watching kevin drop the chili for the 73 time
9qzxws,We all know he could do it.
dm7zos,The Office Beats Out Friends as the Most-Watched Licensed Show on Netflix
byayus,*sudden zoom in*
bjulvc,Happy birthday to everyone’s second favorite receptionist.
6xadv4,Angela just posted this on Instagram...incredible.
bibrhe,"Don’t ever, for any reason..."
6p1hki,Michael comes through when it matters
b17mmp,Never noticed Michael peeking through the cart. S6E2
8ypmre,Jim's reaction to literally everything
a0jogq,Chili’s has stepped up their merch game
7e5u4u,Michael Scott makes my life better
8m6x3v,Excuse me?!
70p438,Presented to you by WatchMojo.
a7uwc9,Petition for NBC to release a full version of Threat Level Midnight instead of an office reboot
d51ntl,Why would I be having monkey problems
8so0ni,Great Jim moment when he got up to sing the duet with Michael when no one else would.
c990f3,"""Of all the empty promises I have made, this one is by far the most generous"" - Michael Scott"
8vw8ed,My face when someone tells me Avatar has the best green-screen CGI in film history
8h45fh,Just a couple of kittens out on the town.
84maum,An appropriate image for the man of the hour.
bc00kt,"Dwight, you’re a kiss ass"
8h6s33,"William M. Buttlicker, Founder of this country"
99c6g4,"If you’ve ever worked in customer service, this Michael moment speaks to you on a spiritual level."
8f1sri,The day they take The Office off of Netflix is the day I’ll no longer need Netflix.
9i4erh,One of my favorite Kelly dialogue.
ch28pt,My first attempt. I usually lurk.
9gdbfv,Nobody seemed to understand why I did this but I knew you guys would. She said yes!
bro6cc,"This always kills me. Dwight leaning over to ""hear"" the phone that Michael has up to his ear."
9jr6b0,"Has anyone ever noticed this?? In lecture circuit pt 1 when they go to the Utica branch, there's a brief moment where you can see that they have put their industrial copier under lock and chain - after Dwight and michael attempted to steal it in the previous season 😂😂"
6s4xta,"Name a more iconic duo, I'll wait."
dch25l,Just seen the legend himself perform
