post_id,title
9wzxwh,Anniversary present...Prison Mike
aex6hj,Does anyone else feel like they need to prepare in case The Office is ever taken off of Netflix?
8pjq4e,Touch Pam’s leg. ;)
8oq8ky,I painted Stanley.
aqhhav,That time of the year again...
9p4juw,And isn’t it ironic
bnhxe8,Sister in law threw me a baby shower
akndm8,When you win the hottest in the office Dundy
8ij6qk,Season 3 DVD cover
6rbsi7,That time Andy dated a high school girl...
ccn9vs,His creations have definitely helped a lot of people through some rough times.
8vdgac,*jim face*
9vu6o0,The time Pam savagely murdered a young girl right in the conference room.
8ydcia,Oh Michael...
c5ojaf,"Watching everyone complain that the office is being removed from Netflix, when it was never on there for your country."
aaqanx,Netflix = The Office Streamer
9pkoe7,"Well well well, how the turntables 😄"
bjboxb,Spotted in my small town!
b7pk57,"After rewatching the series countless times, I only just realized that Danny Corday never left Dunder Mifflin and still works for the company as a traveling salesman."
8t9zbx,"""I am Schrute!"""
a8ocsj,He was so hurt by the fact they all knew
9mkqjd,When ads on reddit try and act like posts
bwu176,Started new job today. Some colleagues asked me about my artwork. Said it was a gift from my former secretary. One guy asked me if I previously worked at a paper company and winked.
axgwdn,It’s Orange
a9jy8l,Pretzel Stanley
9ck3nh,Did anyone else feel a lot more comfortable when david wallace was in charge?
dutehw,Happy Veterans Day.
ah4xoe,They make you feel lighter...
8u5fwc,One of the most underrated scenes of friendship.
7va5r8,Finding out Kylie Jenner had a baby
b7cudx,The most wholesome moment of the show
b7vyro,The most underrated character in The Office
9imiuf,This scene with Michael and Jim gets me every time
bpkxnz,My uncle (Tone Rodriguez) was the artist behind “The Adventures of Jimmy Halpert” He gets no recognition from it and a lot of people profit off of fake copies when he sells original copies. He is an amazing comic book artist originally from CA. Wanted to let you all know who the real artist was.
axkfj3,Who else wishes they could of seen this play out?
cfdr7y,"My husband got a vasectomy this morning, so I got him a cake for taking one for the team"
9i8raa,"r/DunderMifflin subscriber count hits 700,000. A celebratory interpretive dance ensues."
cb62bz,no complaints here
9rauwo,Uncanny
dlrta0,"Dunder Mifflin, the people person’s paper people"
ddvxs8,Dear Michael
936kkt,DARE forgot about this danger
d84q62,"I believe that ""Stress Relief: Part 1"" is universally accepted as the funniest episode of the series"
a4vesi,"Girls on Instagram get thousands of likes on a bikini pic, how many can our first responders get?"
7ot6wd,Micheal snuck this one in 10 years ago.
czn5ew,Petition to make this one of the sub’s rules.
9a21v5,Sign me up
af1zia,A Quiet Place (2018)
8y9lwt,Vampire Jim is one of my favorite characters
cs4jhf,the Malones
6rxpyx,I'm not crying...you're crying!
be62h7,Always gets me. Always.
9fhrok,Old but gold
7j280r,When you have an 8 am final
7w5fa1,Elon Musk's Tesla Roadster in space looks familiar...
adi9gw,This would be iconic.
8821tt,Life goals
7azdo3,TIL Jenna Fischer's husband (Lee Kirk) appeared in one episode of The Office. He was the lactation consultant in The Delivery.
76e7w2,"I met David Wallace (Andy Buckley) at my dads college reunion in the bookstore! He was super nice and totally fine with taking a photo while in line and after he bought his things, he said “hey Alex, nice meeting you” and slipped me his Dunder Mifflin card. I melted."
9nta8k,"Name a sadder cinematic moment. Go ahead, I’ll wait"
7vss16,"It was a weird day, lost the super bowl and accidentally cross dressed."
9qcb8o,Steve Carrell during his final episode...
d9z2x2,"My whole 4 years in Uni as Freshman, Sophomore,junior,Senior."
av49oz,It’s priceless
8x1u9x,Dang it Jim
atnfds,Dwight Rock n Roll
bafsmi,"Nate not only calls Ryan ""Brian"", but lays down this sick burn. What a fantastic character."
am188s,"10 years ago today, one of the greatest scenes in television history is released"
70h6mm,One of my favorite Pam and Jim moments.
8tf0yc,Stanley never loved Pam more than he did in this moment!
athb0p,I will divide then count to it (trying this post again)
9wdf6x,In my opinion one of the best Kevin moments
8kcod1,"Stanley has only a few lines each episode, but the things he says are gold"
b24fpw,Complex (March 2019) just updated the greatest sitcoms of all time: “ The Office “introduced us to the most original characters & tv writing in history”.
dfb037,Dwight you ignorant slut.
apff9u,Can’t help but notice that my 4-year-old self held the same energy as Toby
8e7oft,Jenna Fischer’s shirt is Michael’s grilled foot
6g1ld5,The day a Legend was hired
764k14,Happy Friday the 13th everyone!
9lv6bx,"I’ve never seen the The Office (US) before. It’s just arrived on Amazon Prime in the U.K. so this is me set for the weekend. I’m going in, folks."
7tjvyp,Posted by Netflix on Instagram
973d7z,This is the best XD
aih5rz,"Is it just me, or did Meredith pull off this Black Widow costume pretty damn well?"
7ttik8,Dwight teaching the younger generation
8fe0oq,All hail Queen Beesly
btzapi,"I painted Kevin's side eye, oil on canvas."
anx0im,Public schools be like
bfgupo,“What are you doing”
9boshc,"When me have Karma they see, they see..."
a8vkex,On her birthday too
6promj,I Met Erin on My Flight Today!!
95l6ja,And they say chivalry is dead
758zig,Guess Who?: Dunder Mifflin Edition
b31yzp,Is it just me or does Zach Woods absolutely nail his role as Gabe Lewis throughout the show?
8xqcr9,It’s my last day at a company I’ve been with for 5 years. This made me cry.
8l3ml7,Best day of my life! Brian is such a sweetheart and a pretty good golfer
8astld,When I see a post that made it to the top
93f35a,"It happened, IT HAPPENED!!!"
8ss9ii,Darryl teaches Michael how to talk like a black man
a0aj3c,Jenna Fischer and Amy Adams. Taken on the booze cruise.
a2xlu5,Darryl is honestly me
b8iak0,Ain’t no day like pretzel day!
b450tj,This scene always killed me when Jim received this revelation.
7l226s,"My pick for the ""Best Scene in an Office Christmas Episode"""
8u92lx,One of the greatest moments in television history.
cwiu80,Perfection.
8tmsil,Kevin’s face is perfect
aaejz3,We had a funeral for a bird.
7vf54w,Met my favorite accountant yesterday.
5gsmeq,half naked women get thousands of upvotes. How many for our Michael Scott's Dunder Mifflin Scranton Meredith Palmer Memorial Celebrity Rabies Awareness Pro-Am Fun Run Race For The Cure boys in blue.
adcdf6,No doubt
dsx912,Cold and flu season is upon us
dw95t4,Pam with her cat
7zojf7,"Scranton, WHAT?: The Claymation City"
8zlp5h,She's still got it ❤️
c20bmh,Are you there?
9dyrq0,Yeah you do
az3k02,Things boys do we love
9hucx9,One of the best Creed scenes
88c4gg,Goals.
8dz08c,He grew up so fast!
bfu3gm,Don't even think about it Ryan
8gyt0r,Michael's idea of recycling...
bg15o6,"Bob Vance, Vance Refrigeration"
8qs5ha,A tale worth telling
c123lu,An early Father’s Day gift.
92iik1,Imagine being famous for playing a character that wasn't you for 99.99% of it's existence
d59g6a,The most wholesome moment in the series for me
dbafwy,It just snuck up on me
8494br,When you get the job you're overqualified for
cwyrc0,This scene gets me every time
bsg2zk,My favorite part of one of my favorite episodes
9o5i92,Michael is selling his plasma screen at the garage sale
br1vyo,Flip your phone
9c9n4u,"If it’s wrong, I don’t want to be right."
8hwixf,"Noah, 2300 BC, Colorized"
diszkn,The Office (2005) vs The Office (Reboot)
aooic2,Shes very excited
9k1eci,"I was creating a player in NBA 2K19, and my guy looks like black Jim Halpert."
7li100,It is my wife’s birthday.
8d6idw,What did he expect?
9dtoc0,One thing they can agree on...
abmk94,Fuck this guy and his stupid meta character arc
8o9cxg,I finally named my boat. Michael Scott would be proud.
b06lg8,"Despite the countless cringey moments in this show, this scene always makes me cringe the hardest."
bf3r3k,Just got married... Feelin' hot hot hot 🎶
822qe7,Kelly and Ryan making a come back at the oscars
at3xqn,Break me off a piece of that
bui3z4,My OC was stolen and is now near the top of this sub.
9lrrc5,Who Pam should've ended up with tbh
8ni1ee,I love Michael's face in this scene
9pfdk4,Dwight eventually gets his chair
anw1zd,Love this little gem
a8sbzb,The trick is to undercook the onions
96mq44,What my food sees from inside the microwave
6lt6z9,One of the funniest scenes in TV history
ahvrcb,"It's Rainn Wilson's Birthday, Happy 53, Rainn!"
8der8l,"""See ya tomorrow Boss"" says Creed while holding Michael's Cup, is a perfect bye from Creed. Love this episode."
ab1nht,My WiFi is named Dunder Mifflin Paper Co. My neighbors just changed theirs to Vance Refrigeration.
clieoc,"I love inside trends, I hope to be part of one someday"
9mifie,The true Dunder Mifflin alignment chart.
b1k7ib,Saw this little diddy and had to pass it along
9vogys,Met Meredith outside our local 7/11!
a3oplm,"In season 6, Dwight starts growing a beet. Haven't noticed that before."
7pzeen,Maybe the best Christmas present I've ever gotten. For any reason. Whatsoever.
93k0zo,Where it all started.....
7wpmpe,Just us girls.
azsev0,A Star Is Born
9oebdc,Took my 3-year-old to a The Office-themed birthday party on Saturday
96ux5m,"When Roy finds about Jim and Pam’s kiss and starts yelling and throwing things, you can see Kevin clinching his fists ready to fight Roy"
8pwv7d,Dunder Woofin Paper Company
74qqv6,Micheal came in and yelled at me at work today
9exnh7,Hands down my favorite Kevin moment. Catches me by surprise every time❤️
9z0e7t,"He was the most calming, balanced presence in The Office"
7wlobn,Jim and Darryl attempting to be roommates was priceless.
cmwtyg,I absolutely love this show and have watched it countless times! Just now realizing this came true!
buvjo1,Thought you guys would appreciate my new credit card cover
8020a8,Has anyone ever noticed Stanley's resolution? Haha
bjh0qz,"In S07E08, Michael's favorite character on the show Glee is ""The Invalid"" who is played by the same actor who played the pizza boy in S04E03"
a3g85g,!!
autg9l,"I'm telling you this guy could be the star of a show called ""Guy's I Don't Care About."""
8t1cmt,Michael Scarn looks good in retirement
94u7fo,What keeps me up at night
b1a660,Happy day of birth Michael!
81mm4u,My dad in Vietnam in 1971. Didn’t know this photo existed until I came across it randomly on the internet. He cried when he saw it. Hope this is the right place to post it.
cw3e65,A regular day at 'The Office'. More in the comments.
dx81lq,Beat it!!
78wjx9,"Just came across this familiar looking fella on the set of his upcoming film, “A Quiet Place”. Offered him an Altoid, asked for a picture and bounced. Not a bad day."
9s2nxw,"""I'm Jim Halpert"""
bo28e6,Oscar has always been the most logical employee at Dundermifflin
9cf0ti,When I cheerfully greet a customer and they ignore me
9n9rs7,"‪13 years ago today,‬ ‪RYAN STARTED THE FIRE‬"
dka9tn,Allow my wife and I to start the r/DunderMifflin Halloween season!
8q5t9w,Anyone else wish Michael would’ve dated glove girl?
8viswr,John Krasinski visited my hometown and my brothers and his friends met him randomly in a local restaurant
bxxeap,"The only woman who made Dwight act like a normal guy. All apologies to Angela, but Isabel was the one that got away"
a68w9j,One of Creed's underappreciated lines
991u2g,"That time when Michael made some friends, who genuinely liked him for what he has to say"
drk4bj,Remember that Diwali proposal prank a week ago... well I popped the question for real this time! She said yes! Perfectenschlag.
8d1f1l,"*opens Netflix, scrolls through catalog, rewatched the Office for the 10th time *"
anewzx,"When you have an anxiety attack and someone says ""stop overthinking""."
9gvmyl,Rainn Wilson...through the years!!
8gk4gk,"If you’re a real NBA fan, who is this?"
b3bb0r,"Crazy how Netflix showed Kelly, Charles, Michael, and Kevin all next to each other"
7466ea,The Office rendered with architectural software.
8vsegp,Concussion Dwight was the best
b6fhz8,This one hurt the most
7uzai8,This guy at a Comic Con.
97bqnd,The slow train from Philly is officially derailed.
9y3a8u,It’s been too long
dqi4fk,"Adam Jones, guitarist from Tool got dressed as Dwight for their Halloween concert"
98gwkg,Michael was the biggest Jam shipper
bjojzb,"""It's not real until your wife is on board"" is the realest shit. Relationships need to be on the level. Thank you Darryl Philbin."
d0fjbw,Why you gotta do me like that.
acd1c7,My reaction to the repost police
a1vd60,A true love story
c5sc1h,Good luck Netflix
ac0agg,"Boy, have you lost your pretzel cause I’ll help ya find it"
9e4lnx,Watching The Office marathon on the $200 plasma tv in my hospital room.
b2lu21,"Petition to change the silver, gold, and platinum medals on this subreddit to the yogurt lid Olympic medals. *plays the Star Spangled Banner because Michael's condo is in the US*"
96g45h,That fast?
6w6584,"""Just as hot as Jan but in a different way"" -Michael Scott"
81rvou,Every of the time
9jqaxk,Who else was also wondering this?
8nso80,Calm down. Everyone just calm the f**k down!!
ck2dbm,World’s Best Poster.
9u7lmt,Greatest Plot Twist in Television History?
9xa7ac,Never forget
d2w2wr,Keeping the dream alive
9l0wre,Being with friends
bzdlbw,"One my favorite students is graduating 8th grade tomorrow, she stopped by my classroom to give me a gift before she’s gone 😭"
5quekr,Summary of the Muslim ban
ajzhse,Map of Sexual Relationships of Office Characters
8qn8qj,Say no more
c8ms4u,You don't know our pain
9b07dz,Petition to make this the new pic for r/Dunder mifflin
6sco6p,"In Season 3, Dwight admires a rocking chair at David Wallace's house and says he needs to get one for himself. In Season 9, he has it."
c7hj9s,I don’t hear many people talking about this moment
7c0nhz,Happy Veterans day
beohmm,"Noticed this on my 34th rewatch: In ""The Convict"", when Prison Mike visits the office, it's actually just Michael in disguise. If you look closely, Prison Mike appears right when Michael turns around. The attention to detail put into this show is phenominal"
daeot6,Glad this post aged like milk
aker5z,"Can we please appreciate this man who either created or co-created Brooklyn nine nine , the office , the good place and parks and Recreation"
8c74sg,R.I.P. Sprinkles
7keb2v,When someone tries to say that Stanley is the worst character on The Office...
a6k1be,You must vanquish fear itself
b2h11j,Not bad for a day in the life of a dog food company
cjfoju,Just Another Monday
byke68,Anger
bp2v9p,r/DunderMifflin is now in the 1mil club!
bsttmt,Dunder Middle Earth.
9kq9xm,When you keep creating fake accounts for free trials
8n8xa6,When a coworker asks you if you were slacking because you were in the bathroom for a half hour
b0d08g,Characters who did nothing wrong but we’re supposed to hate.
6yevz2,Me all day today
cvjlt9,Mondays Suck. Here's Pam in lingerie to make it a bit better.
bq2x54,I thought you guys would like my sisters college graduation cap
7cg0kp,This moment of self awareness from Kevin
8it0z1,Get on my level
dmrbev,My latest carving. Thought y’all might like it.
9y798k,Greetings From The Electric City!
81xopb,A drawing I found. Wouldn't mind some kind of The Office animated show.
a64knh,Men who love cats
bwa02k,When Jim makes a joke...
a0nyw5,Un-colorized history
8u0w56,The machine knows where it’s going!
bwnod7,"Bob Vance, Vance Refrigeration"
91d9ii,Robert California at his best
9z99km,Dwight’s soft spot for Pam one of my favorite things about this show
900ao5,I feel like Michael was his true self when alone with Jim and Holly
9pxog5,I am a server at Chili’s... I’ve had this sticker on my book for over a year and no ones ever commented on it ):
9e8fgf,A photo from Steve Carell’s new movie or checking in with Michael and Holly seven years later?
8xpas3,Dwight is so proud
ds72ta,dwigt be like:
b8pjj1,Relatable.
8bm5eu,This gave me a laugh
89ii3k,I can't believe I just realized this.
9w792a,Who is Michael Scott?
7ezoew,Happy Thanksgiving!
bpamgq,But it still lives on
afysd5,Thank god for that!
92ulqb,the perfect plan
aayoy6,"The cast of The Office invited 16-year-old Anna on to the set, where she met with Steve Carell, John Krasinski, Rainn Wilson, and the rest of the group. (Make A Wish Program)"
9sviq4,Happy Halloween!
9tu19h,EVERY. OF. THE. CANDY
b4zzsz,At least he gets it.
5p5n4j,Every single time.
83botc,kelly and ryan 4ever
6z2ed1,"My hotel in downtown Montreal has the same sick new plasma tv Michael Scott had, wall foldability and exposed wiring included!"
9ty3rm,HIS FACE
88ixkq,Bob and Phyllis are the real Couple Goals
6bpj44,What's my secret?
arldo1,"When the 900,000th subscriber comes in"
9rprsl,Our family costume this year
bpfbr4,"Rip Hugh Dane, Lost him a year ago today."
d5sx20,Tan everywhere. Jan everywhere. Tee hee.
d10olo,I’m sorry
cubvch,Dwight showed Jim a high level of respect here
99lcbr,I loved Weezer's earlier stuff
cttyzk,Running into these two after a looooong day of traveling was a nice surprise!
7o3u8s,"When you honeymoon in Sandals Jamaica, you have to recreate this iconic moment"
8dv6pn,I think Michael would be really mad if he knew Toby beat him at something
b4wd8l,It's either taping or calling!
bfala1,Rainn Wilson and his family in Boston circa 1985
6ssq03,Jim & Pam 'The Early Years'
89ov9f,Michael Scott teaches us how to jump start a car
bru7nq,Heck yeah
9pu5qq,"My buddy just found this on a building in Lexington, KY. Don’t know who did it but it is amazing."
d4jn3r,Redditditdidooo
ai6r9w,Me on social media tonight
dr7m77,"I love Stanley's reaction to "" No more meetings!"""
a8kjlo,S05E26 Kevin's famous chili
ar8n6k,Prison Mike.
9igx1m,Such a buildup to this moment!
7usnat,Creed has the best Quotes by far
9jw8ac,Cross Stitched Michael Scott
9babdt,SHUT UP ABOUT THE SUN
baseid,Angry Andy
9wqv4r,Why so surprised Pamela?
cdvox7,Kevin holding in his laughter when Holly tells him about the button in his change.
bw3dfs,Only now noticing that Nate is wearing a tie over his warehouse uniform. He is a gem.
6kuts3,Break me off a piece of that...
8vltzs,I finally broke down and bought myself a plasma TV
ao33de,Creed threatens Dwight
9llzah,Lmao Ryan 😂
cohd8k,"Me after seeing $27.38 in my bank account, thinking I only had $2.00."
9g11ss,The Catholic Church convicts Galileo of heresy (1633)
7joyv7,Thought I would share this useful information. Happy Holidays everybody!
dei0jk,Real love!
7x9pwy,Be careful out there.
a7mr7c,This hyperrealistic Prison Mike cake is “da belle of da ball”
8qi2f7,I painted Dwight wearing a mask.
8fz6io,My favorite Thanos line from infinity War
8pesgv,"somehow i got lucky enough to bump into the man, the myth, the legend"
86kryw,"Roses are red, and lightning bugs glow,"
b5gjvt,"Last but not least, Kate Flannery's portrait from this weekend!"
7ratqu,“Moms night out”
9pbuq9,F
9new7f,First table read by the cast of The Office
bs1utp,Be careful getting lice. You will forever be known as girl puncher
84soni,Boom. Roasted.
6t0lzf,Jim is savage when he wants to be.
805bww,Every time Toby opens his mouth
9tn125,Creed is so pure
8ge7aa,"Jenna Fischer revealed in her instagram live what Pam said to Michael at the aiport. She said ""that was me talking to Steve. I told him all the ways I was going to miss him when he left our show. Those were real tears and a real goodbye""."
8ai9a2,This is the greatest Ryan and Kelly moment you probably missed.
7k4v5r,When you rewatch The Office for the hundredth time and it's season 7 all over again
chgsph,Nard Dog
a1ztqg,The fine women of DM.
9493ms,That time Pam was on The Price Is Right...and also TIL Jenna Fischer’s real name is Regina.
8uisdy,"Is it just me, or does Pete Docter (Pixar movie writer) look like the perfect mix of Toby and Gabe?"
arjhnl,"With r/DunderMifflin's 900,000th subscriber due to walk through the door at any moment, Daryl, Kevin, and Oscar have begun the traditional Scranton Dance of Welcome and Celebration."
8hgyxa,Thanks to this subreddit for the inspiration!
cc7uuz,Don't get my hopes up
c1mo6y,Can we just give a huge shoutout to the cameraman that was willing to follow Michael and Andy to Mexico for 3 months!
api2fu,Dammit Kevin
88on6j,Am I the only one who just find Kevin's innocence so lovable?
83wlf5,“How many times are you going to watch The Office?”
c8rt0a,Met the inventor of SUCK IT at a golf tournament and he was repping a DM polo
blpzk1,I never noticed Kevin also took off his clothes when Dwight was on the fake radio interview!
cy3vim,Greatest crossover ever.
cxikpy,"Baltimore Ravens quarterback Robert Griffin III, wearing Prison Mike socks last night"
9qscl3,Now that’s a statement I can get behind
cxpzp7,A co-worker of mine sent me this. Very disappointing.
doeyov,Every single time
73lhmu,'The Dwight Schrute Collection'
9f6qv5,"Bears, beets, battlestar galactica"
98njc1,"Finally, justice for our 2002 WSOP $2,500 No-Limit Deuce-to-Seven-Draw Tournament Champion."
cxwa8i,Spotted on college gameday
bkk9hc,YOU’VE GOTTA BE KIDDING ME
6rsqcp,A family friend shared this. She recently became a mom.
97m4rt,My wife spent weeks making me “The Office” Guess Who for my birthday!!
coj4p9,Me and my sister met Toby in England!
9n0tot,What do you think of role-play?
b1wck1,I drove my brother back to college today and found out that he lives 15 minutes away from our beloved Scranton
85yqz3,"Everyone loves Jim's signature look, but Kevin's side glance is a beauty of its own"
8v25tg,"There’s classy, and then there’s Regional Manager Creed Bratton"
9d0f6x,Just the worst.
a0fg68,When you see your custom character in a cutscene.
dntd1o,Profile Photo vs Tagged Photo
dno7zh,Steve’s an alum at my college and he visited tonight for his improv troupe’s 40th anniversary show! He had a meet and greet afterwards! I’m also from his hometown so we briefly got to talk about that too
8ebec6,Duchess Kate has a boy!
71bhmx,The harmonica/melodica gets so loud halfway through
78bvyv,The best episode of the office doesn't take place in the office
b9lbqv,When someone says they’ve seen The Office twice
86y5ou,Big difference
912bms,Oscar's still got it
8zki7l,I always wondered what was Creed's plan with 3 chairs
dfmxab,My favorite line of the whole series
9ji1n9,Accurate
dhhdub,When your friend Jim does something really cool.
djdkym,At least there wasn’t any football cream!
94rhk0,The trick is to undercook the onions
ayd16n,Turn up
6sn6q3,scissor me!
95py5z,‪My dog’s face when I go back in the house after I forgot something‬
9iqe61,My heart sinks every time I see Karen's first smile at Jim. She was a great match fighting against a perfect match
6zywmg,One of the meeting rooms at the new office where I did my summer internship. Needless to say I always booked this one.
cnrv8u,"Sometimes I’ll start a gif, and I don’t even know where it’s going. I just hope I find it along the way."
cprijb,Jim in season 1
bosy1e,I met Steve Carell today!
cp3wqz,Jim with the ultimate troll job
cm4hya,Life goals
8franu,Graduating with a B.S. in Marine Biology
8sid7g,"Name a sadder cinematic moment. Go ahead, I’ll wait"
725pbv,Office Scandals
d9qxll,The sexiest accent of them all...
7v3xwp,I will take Dwight as my gym instructor any day.
a29gl6,"I'm fast! I'm very, very fast!"
credon,The exact moment that Dwight is my favorite character
bbfjwk,This cold open gets me everytime. You can see the genuine laughing by everyone involved. Good Kevin Good! Creed Bratton is the best.
96yrp3,Me sneaking into this sub today 🍰
bd1kc1,My name is Andrew Bernard. I was with a group called Dunder Mifflin.
9hl2eb,Jimception
7yajbj,Steve Carrell during his final episode...
dbkzdj,"The Committee to Plan Parties, short lived, but savage."
9m3nqf,You can’t see me
8guay5,The best thing I’ve ever found at Goodwill
8fnfql,My reaction when r/DunderMifflin is slowly turning into a nsfw subreddit
cmbu8o,Its tricky
byr548,Who is justice beaver?
8a9vh2,Jim Halpert in “A Quiet Place”
9fw28b,Jim&Pam first kiss sketch by me :) I know I'm years late for that but.. can't help but love them. What do you guys think?
b4mnml,"MFW someone tries to replace the shocked Pikachu meme with Pam, and uses a low-quality screenshot"
97i3g7,*Jim face*
dotxyi,Every freaking night
alxo4y,"Huh, it really do be like that."
9p9juc,In season 4 episode 2 Creed dyes his hair black. Micheal also says that the printer was out of ink in the same episode. This means that Creed dyed his hair with the ink from the printer.
cj8nhp,Deleted scene- Creed being bullied
9szamb,I’m going as Goldenface for Halloween.
bifvtj,One of my favorite Dwight moments
7g60m3,Dunder fucken Mifflin
a6zeib,You said come in!!
cqg7nk,"Snip, snap! Snip, snap! Snip, snap!"
a9u7v4,Has anyone seen this new movie called Bird Box on Netflix? This was my favorite scene!
abaizg,Happy new year guys.
9rzaaz,We will burn Utica to the ground.
7ktdrc,Me going into my last final
9vfams,My favourite Christmas jingle
8scw2j,Told him I would post it.
8unw4t,The moment I almost cried.
a4rc4k,Another reason why Creed is my favorite
6wyu4c,The time Pam savagely murdered a young girl right in the conference room.
8ram11,Who else wants to watch this era of The Office?
8mmhtx,me irl
bk0796,Pam gets Micheal’s old chair and I get Pam’s old chair....
bd96fw,My family is going to Europe without me and they sent me this picture from their flight.....
6tqxho,😂
dfwt3o,"Two eyes, two ears, a chin, a mouth, ten fingers, two nipples, a butt, two kneecaps, a penis. I have just described to you the Loch Ness Monster. And the reward for its capture? All the riches in Scotland. So I have one question. Why are you here?"
