post_id,title
5tuyq9,Hot slut begging to be used in puplic
5vl1az,Is there a free substitute to Adobe Acrobat Pro?
88o6m6,letting strangers have fun with them
5iy4qj,Fuckceptacles
6d5sv0,"Morning paper, coffee, and a sex slave to start your day off right"
8quxe8,The Freeuse Family
7pwagz,Czech Freeuse
6n471s,The benefits of having female roomates (x-post /r/SheLikesItRough)
4nsaax,If you have a Hulu subscription and you try and cancel right now they'll give you the next month for free.
6e4i81,"""Perfect maids dont exi--"""
c45qis,in the kitchen
9eiejv,When I'm playing BotW my body is free to use. 😏
7ioo91,She downloaded the TimeStop app.
51imrc,"The original with Chloe des Lysses, and a nice recreation of it by an unknown girl."
9dzvut,Just pick one.
6g8wgj,Walk up to her and she'll become available
7l4xlx,Some girlfriends are better than others during finals week.
9het1p,No need to form a line
7xy031,This maid is the definition of free use
6k9l6d,Breakfast
bij0za,Which one would you 🍆🍆🍆?
7r8l3w,Cosplay Queens Got Used
9qechc,Fucked in the hall as guests walk by
6bugsn,First Class Service
7lxqfn,"Hundreds travel every year to the famous ""Freeuse Bench""."
6yrwv6,Wake Up Call
73640p,My Presence Flog Your Confidence
7wt748,Riley Reid's sex show at adult store allows audience participation
71k64u,Freeuse party.
81i76d,Making dinner :) (F21) (OC)
9cl3rl,Cute production assistant having fun fluffing
cbrznb,Taking turns
ckopyk,Put the phone down
crx3pq,I just want to look at Tumblr 🙄
704wvx,Does this count as Freeuse? I just love Carmen Kinsley
7tk2fm,trying to enjoy a meal
doswk8,He couldn't resist her
cv9vhj,"He works out, she rides and gets covered in cum"
6bicbn,TV interview interrupted by special guest appearance
9l60en,Just wake her up if you're feeling horny
6mmgit,Ordering a blowjob for her friend! - Barbara Broadcast 1977 ;)
c6y3da,Study session
7nz8zq,"They should've called it a ""Bending Machine""."
7b3k02,Anna gets a surprise
ca9nes,Wish I could use a girl like this
ba23my,Reluctant toy
8n93nk,She had no idea what she was walking into. Literally.
6y87dy,He tries to play
8vsear,Early Sasha Grey scene. Used at a pool party by random dudes.
5mu8t5,Adriana is the office slut!
d3zh3a,just a friend you can grope
70y766,The Freeuse Bar
6nk94d,Iggy Azalea letting audience grope her
dbbm5i,Free use Reading a Book
b7i54o,letting strangers have fun with them (reposted)
552q4z,The Best Kind of Spin the Bottle
b7zcv1,Used while reading a book
bgiega,The Freeuse Employee Of The Month
7hksfm,Casual Blowjob
8pes54,Free use on the night train [xpost r/holdthemoan]
do7gl9,When your roommate lets you use her
c5xz60,Used to take care of morning wood
6tk4u2,Maid's daily duties
50czv8,Babysitter left for husband's anniversary present
a7446y,It wasn't a wet dream...
8utfje,Apparently my ass was hanging out during a nap so he decided to help himself [m+f]
843yt6,The first video that got me into freeuse: A world where sex in the work place is a normal part of the day.
ds4z6s,Georgehoffman
dgoyz4,Fucked in the hall as guests walk by
91p9yw,Crunchyroll & Chill? [OC]
5jgms0,Stuck in the windows and used
77ls8s,Petite submissive shared with crowd at adult toy store (MIC)
84qfkn,Taken by Surprise in the Bathroom (I was told this would be worthy here)
d5vv2q,Chopping wood is more interesting 🌳🌲🌳
a2e262,Yoga freeuse
adgi3n,When she is in the middle of a shoot but you fuck her anyways
bomq4h,She's studying
7e01lv,Free Anal
cqfq3a,A fantasy
5rd0uk,Company Retreat (SIC)
8smjud,This maid does a great job and is strongly recommended
ddrdr2,"""That laptop is going to overheat"""
bv64sa,Esperanza Gomez nude on stage is like throwing meat to hungry wolves
8imn6x,Bachelorette party
b4ckdz,Cardi B getting her titties grabbed by fans
805aws,Ashlynn Yennie
6j3izm,Always available to please
cc53fo,Step parents gift
70huo9,Caught In A Sticky Situation With Brother
9mfad0,Grab her by the pussy 👍
a9eaw1,No matters what she doing fuck time is fuck time
4ormtm,Using the maid
8a7wct,Jessie Rogers - Public Disgrace
cni4vv,Mia Malkova
bryrqm,Walk long enough and you'll find her.
747nqv,She brought a gift for her men
a7nron,Riley Reid trying to sign documents but James Deen wanna fuck
bw9ly6,Does this count?
80kgz8,Using an 18-year-old while she plays PC games
6wnvf8,Substitute Teacher gets time stopped in classroom... (xpost r/Javpreview)
b8nenq,She wants to be used as a real life fuckdoll
7m53zo,"Her present to Santa was a ""Freeuse"" pass."
djhjd1,Yui Xin
53kelm,Gamers need servicing too
7cacux,Stuck in the trunk (x-post r/NSFW_GIF)
7qi5pz,Handjob to a Stranger in Train (xpost: /r/Fapper_NSFW)
6og33x,"When rescuing overboarders, you get free access to their bodies"
c4twm3,Maybe She Lost A Bet.
d99ezw,Ashlynn Yennie in Submission
caqdoy,quality patient care (x-post /r/javdreams)
apnz4s,A Game at Dinner
coi2n4,"FakeHostel - Cherry Kiss, Katy Rose Stuck Under A Bed"
dll48n,She Entered the Sister's Friend by Surprise
b95hzl,Using her as she sleeps
4yd7g3,Tourist Trap in the Czech Republic! [GIF]
dtw6zn,Free to use
6ns8bz,Girl being used while texting her sister
a8fw8w,I wonder what movie they're watching...
9x0qcv,Fuck meanwhile stuck
dn3zrz,Goes from laying there to getting her holes fucked & creampied
7ye2vk,Laura Surrich free use in Spartacus
5oi4ji,The Perfect Maid
c7tqlb,Put one of these on every corner
7lrscz,Tending to their customers
dsi95a,When she wants to read but you want some action
84gy1r,Going to a nightclub naked and letting strangers grope her
azp488,Belongs here
cimdp7,Tied to a public fence
dvz2xl,"He needed somewhere to cum, so it would be rude to refuse"
9rpttk,She doesn't mind getting cum on her at ANY time.
73zsda,Just lay there
6oymdp,FreeUse dating gameshow | x-post r/NakedOnStage
4w4kcg,Laura Surrich in Spartacus. Slave girl.
6i03b9,"""I noticed you had a nice butt, could I see it real quick before we finish this interview"""
7cgf0t,While in bed
870h9v,Literally every phone conversation in a freeuse world
5ck8w4,Step right up
8vlpjr,What did she think hanging around in the house would lead to? [GIF]
cpaqqi,Free Use At The Local Porn Theater.
7sy0xy,Slaves auction
889l3n,Expect the unexpecdick
d0yf50,Now That's Some Excellent Customer Service
by50cd,Daddy fell asleep before he could make dinner 😂 [?] [M] [oc] ~🦆
922w77,Busy on the phone
bg4ssf,She is reading a book
ckas2x,Hog tied and ready to pork.
aa10jn,What's rarer than F on M Freeuse? F on F Freeuse!
cyo52e,"Adopt a pornstar - Kendra lust, Keisha grey"
adujon,Woman flashes her tits and gets groped during mardi gras
6unlqo,Random guys grope the tits of a girl flashing in the audience of a concert
csyuis,She comes with the service
8z918h,Have to finish the game
bts8d4,Just Grab A Seat
dczkri,A good throat to relax too
c39i31,While she makes her grocery list
8m32we,Hot chick gets used while doing stuff
bvxa4s,Free use
a6a451,Used while playing GTA
87oajj,On Halloween you can choose treat
decm9k,"Design Office ""fuck"" Always Co., Ltd."
a6mexc,Used while she plays RuneScape 🌳🌲🌳
9im1io,Helping him concentrate
6o9z1f,Surprise!
8ttk8b,Miss Banana gets interrupted while playing god of war
c8nuxo,she always become available
ag1ad9,She wants to smoke while he wants to fuck [GIF]
afonyw,Female Announcer Having Sex
9wnt0x,Fucking my gf while she plays COD
7df8sp,Drawing numbers
9cxygu,Trunk pussy
dcnqhe,Girl Fucked In The Ass While Talking To Her Mom
5xpvzd,Nicole Used on the Couch in Front of Friend
4c0ybd,Office slut doing what she was born to do
6sn0nu,Poolside Invasion [xpost NSFW_GIF]
c9do1s,Sis just ignores him
9nvjgq,Groped in the store
d4iqc4,"You Play Nutaku Games, I Fuck Your Asshole."
7pckru,Timestop sex in the middle of class
73lday,Using the secretary in her job
cqs9sz,"Stop making breakfest, im going to fuck you first!"
9gtp17,Disturb her with his cock
daj82t,She doesn't even care
dqk13b,Fuck Doll Fun
77z8rw,Meet the University Student Who Gives Free Blowjobs
acljlm,Fantastic Use
c2e7hp,Walk up to her and she'll become available
7oz7j3,Fucking ambush
9o26au,Insert Here Please
6enspx,Fucked around like a toy
alcy2o,That’s mine now
9n4kmg,New Gaming Chair
8b1anj,Freeuse householed.
799oke,Used While Playing Video Game Xpost /r/massivetitsnass
ci8b64,Free Use Snapchat Story
ab88fo,Would love to run into her on the street👀🤤💦
bcvpqj,2 girls jerking his huge dick while getting their hair done
6mf5hd,A restaurant where even the waitress is on the menu! - Barbara Broadcast 1977 ;)
ddamtx,Free Use Step Daughter
dxtve4,I would love a play myself!
9mqm6f,A Well Balanced Breakfast
bhh780,"Go ahead and feel them! That's what they're for, right sweetie?"
5s6rsp,Guy comes up behind Aubry Lee and fucks her during interview (xpost /r/exxxtras)
5rkd1q,Finding a fast fingering fix by the poolside.
c94k5c,My Obedient Step Sister
8cm8af,Cameraman casually fucks her while she gets her makeup done and everyone acts nonchalant - Lots of casual nudity and a great freeuse feel!
8ajkms,"Coffee, Tea, or Me"
5bpn9z,Using her tits how he wants
a4h788,First free use experience with my roommate.
d8owdc,The Best Kind Of Spin The Bottle
bd6mk8,Naughty daughter secretly gives blowjob to sleeping daddy
df9sgh,He didn’t even want to wait for her to finish her phone call
d4xwm6,Thanks for making dinner babe but im first going to fuck you
8t9h4s,"[Repost] The new subscription service, ""Bimbo in a Box"""
89zazu,Complimentary face fucking with every load of laundry
6ls99z,Interviewer fondled at Eros Liège 2016
6t71i6,happy to help
89p5qs,Francesca tied down and used by two men
9xcdng,Hottie fucked while she wash dishes in kitchen
c0vks7,Pick one for the use
73seoz,Virgin man sees tits for the first time thanks to the time stop machine
d4be70,I just want to look at Tumblr 🙄
ahn3iw,Freeuse but opposite
a4zsrs,Day two of being my roommate's fuck doll.
cot85v,Philippa's tuition payment (by Erenisch)
8900lt,Breakfast with a BJ
7l9ifz,Free use of Silvia Saint at a cocktail party. Throwback Thursday.
cfedka,Come and get it
81rivo,Three Ladies Got Used By Their Master
cgkvgd,He offers his help doing the dishes
7x0t2f,Customers at adult video store get a hands on experience with porn star Krissy Lynn
9ix74c,Lying there and taking it
65zueg,X post from r/OneDickManyChicks
bnx1ji,"The free use attitude - ""I'm inside you."" ""You are!"""
9stwar,Fingering her friend’s butthole at an outdoor music festival
dpt20b,Letting strangers have fun with them (Re-upload since last post got deleted)
4eh7so,The orafice leasing agency has an excellent selection
c79uoi,"""I just wanted a tan today."""
cr5ju4,Free use house
78bwuq,Interview interrupted by surprise guest
cehogm,Obediant Free Use Maid | Nina North
dhtv2d,She loves the fact people are watching
d3c5d7,While she's on the phone
5gkvd2,Mannequin Challenge
b0y205,"Women know what they're in for, going to a co-ed gym"
4975bb,He gets serviced while they do his wife's hair
6xo0aq,Fingering while she's talking on the phone
cwjwwh,He Plays Games While She Sucks Him Off
amo624,Bored
68moym,She really likes video games
d6ot3k,Package Delivery Girl Time Stop
9eq67a,I just wanted to play video games
djwlv9,Cooking and fucking (with audio)
cchg0a,GloryHo Brothel | Czech Fantasy
4wfvi5,Nicole Aniston - The Perfect Maid 2
c6ghs3,Breakfast for Two
d7nhjg,Sleep is not a show stopper
a42qx5,Used during her workout [GIF]
5706ay,"Try to finish quickly, it's Girls' Night Out"
daukmd,She rides him while he watches TV
bszul0,Breakfast is the most important meal of the day
dev9hj,She let's her GF use her while she's gaming
8eg95m,"Goddamn it, would Jason hurry up and cum already. The other frat guys were getting restless and she knew that that meant less pussy fucking and more ass fucking"
4t7v88,Waking Up With A Facial
b6ppyv,between her legs
agz97t,Zoe Doll Game Distraction
6088tb,Browsing Tumblr while he makes use of me...
9y997e,Firm handshakes are good
9k5zkd,Priorities (x-posted from /r/NSFWFunny)
7xjuit,The Freeuse Dating Game Show
4x6wu8,First Class Service on ASA Airlines (x-post from /r/nsfw_gif)
7gzxob,Japan subway
au6k4y,Guess breakfast will be late
8j4tsv,Freeuse TV's newest cooking show.
d0j3jn,He uses her while she does the laundry [GIF]
cf4hge,Evelin Stone fucked doggy style
duva5m,Doing my hair
dnjqxm,GloryHo Brothel | Czech Fantasy
70mvnl,Time Stop during class (xpost r/Javpreview)
9jhcfu,Hot sister used from behind while playing her game
8rpq17,Just helping pack the luggage
dq5ori,I Need One Of These
5pibw0,Do Your Job
5deyyr,[GIF] Just Another Day at Work
cguyfc,Ebony Three Player Game
czilxu,Gotta study hard
7okavh,While on the phone (x-post from /r/holdthemoan)
6zhdey,Blowjob while on phone
6wg1wh,Lady Gaga groped by fans
6a5at0,"Girl gives herself to delivery driver on a dare. ""do you wanna touch me? go ahead! :) """
auhxcp,Public breastfeeding debate goes on.
7s5xzh,Free Anal.
80w7o7,Laundromat [xpost from r/NSFW]
9jnsjp,One man's /r/trashy is another man's treasure
4r25wh,Office slut gets unexpected DP
8stl9o,Her hangover doesn't keep him from fucking her wet pussy [GIF]
6ms7oe,Mommy is always available
6tw5x4,Case study on how a Japanese firm resolved a PR crisis
8d8gza,"Jade Nile getting interviewed after a scene, and gets another load."
crlzkk,When she's so tired
dh4c7h,a Fucking Conversation- with Aaliyah Hadid
bvu3do,Cherie Deville - Spring Cumming
9fahv5,It's hard to stay focused on the phone call sometimes [GIF]
87ve0d,Taken out of her cage and used [x-post from /r/AdrianaChechik ]
chuahj,Anytime
9m362g,Maid Got Used While Cleaning The Floor
3v8f2p,The hockey team slut (x/posted r/cumsluts)
a7dwrb,Multi tasking
4fh36u,A Hole in the Wall.
7n8xv2,Happy New Year - Have some FREE Anal
5anign,Working at the car wash
75w5d5,Wife sucks friends dick in the middle of a get together.
6oq64i,Adult Store Interactive Display
99buoi,Office slut doing what she was born to do
84wro9,Hanging out with my best friend (F21) (OC)
6klbvn,"""This test is bullshit, can you come help me relax"""
8399z0,This airline lets you order any service you desire at no additional cost
79p9cr,Pornstar used by bar full of strangers as a fuck-toy
787671,Fell in
dwmchd,While he's nap on the couch
8yf19m,Marriage counselor helps couple [x-post r/SheMakesHerSuck]
67qb56,Like it's no big deal
6w9lam,While she's talking on the phone
9nambe,Until her alarm goes off [GIF]
b5hqe9,The Girl At The End Of The Tunnel
4xni8k,No choice in the matter
5lzitj,Designated cum dumpster
9yu5un,Son needs help getting rid of morning wood
8pte4p,"[SDDE-450] - AIKA - Cooking, Cleaning, And Satisfying The Sexual Urges Of 10 Boys In A Non-Stop Sex Life"
bfhetv,Freeuse barbershop
75ff90,Always Available To Be Used Even She Is Busy Playing Games [Xpost /r/massivetitsnass]
dc3s0r,Kitchen counter pussy licking
cp2top,She plays Mario Kart
9783sb,A NaughtyAllie classic
4s5dh6,Pumpkin Carving!
8jzkg5,Gamer Girl multitasking
8eq1au,Lexi Lore - Sex Doll
89ikl4,Never go AFK
6xgzy4,While talking to her
42oap0,Morning commute
dbrv6z,Sort of freeuse. The girl sleeping either has no clue or is a sound sleeper
6831ti,Haruki Sato - Time Stop (xpost r/timestop)
75qf6g,Cock outta nowhere
d2vifd,Piper Perri party pop
6plu3z,Liz Rainbow - Public Disgrace (x-post from /r/porninfifteenseconds)
7jzah5,First Class Travel in Air Japan (xpost from r/Javpreview)
b401bq,When the maid wants to finish off the floors
7qbem2,Board Games
7k1t77,"""You can use me, as long as you STFU!"""
7mc4e8,Keeping the teacher busy
7qn4nx,Breakfast with a BJ
d58oq9,"It's not rude to fuck, but it is to stare."
9vw8v8,Normal day at the office
af0usx,Daughter is free to use
5ifxe3,Jinx Maze used.
dtatq0,Cumming on stepsister while she uses her phone (not oc)
dxgcu1,Can't be bothered to use back
bux4kd,"""While"" videos are ruining this subreddit."
9i6rbr,On The Phone
9gfumk,Japanese Game Shows are amazing! [MIC]
csb0do,"Lost the bet, all yours for 1 hour..."
79wgan,Slutty submissive gets groped and fucked in a adult video store
akka3u,Kids trying to have breakfast. The dude has different ideas
9f0jcs,Cameraman intrudes women toilet and fucks Faye Reagan Behind The Scenes
97skty,A classic...
5tdbd3,"A little unusual, but here is a description of free use traditions in ancient Babylon, from Herotodus (5th century BC). I wasn't expecting to get turned on by my history reading..."
9beohq,Tending to the attendant
7zdbp4,Perfect maids do Exist (xpost: /r/Fapper_NSFW)
5z13kf,"Taking turns (Abbi Roads, Adriana Malao, Callie Calypso, Guiliana Alexis, Jayden Rae, Jessee, Kelsi Monroe, Mila Castro)"
4mp0xp,"""I want you to put your cock into me"""
7dqbhc,Serviced While Waiting
5kh5cb,Taking the train in s free use world
9q0qgr,Creampie while gaming.
a8w0by,She rides him while he watches TV
4d96bc,"For my birthday, sis tied herself to my bed and gave me an all day pass."
8o0vxc,[RCT-247] Video of a Female Announcer Having Sex 10
7sf4qs,Please dispose your semen into the designated cum dumpster
9e5bp5,Classic
dem4e4,Gamer Girl Does Blowjob Without Being Distracted From The Game
46qa60,Don't bother buying her a drink
db5116,Line at the Copier
8q2zly,She didn't wanna know who was who.
a8ptmn,Blindfolded blowjob competition with 3 besties
76fbhe,Just a Quick Pit Stop
86pvgi,Charity Crawford - Right in the Pussy
7axw3n,A+ customer service
c0b81j,Federica Palmer getting her big tits groped by store attendant
7bxn4c,Brides gets used
b4mh2r,"""Do what you want i'm busy gaming"""
d0bthf,After party
5yx5e8,Hand warmers
4jhfp8,Carpark Cum Dump
5fdm5o,An unexpected DP
7ffl5z,"After the Sexual Service act was passed, television presenters would flaunt their new power by forcing their guests to strip on live TV."
a8kzqa,Good girl cooking hamburgers
9a2jqo,Go On Stick In Me
dinhdq,Brunette German Surprise Anal Fuck in Public
3iyduv,Netflix and chill [xpost /r/NSFW_GIF]
8zhyid,Game addict used while playing video games
de11zd,Another Perfect Maid
7auc7x,Just walk up and start fucking
8bbwrp,pollination
awuscf,Nothing can ever distract her from her studies not even a dick
8ifl1u,Reading a book.
7fwi3y,"After porn scene, tells her to bend over cause he wants some more"
6a6s92,"In year 2020, Japan solves their aging population problem by issuing license to have sex with anyone anywhere."
87ie3o,Downside to a freeuse world: it may be a while until you get that drink you ordered
9u24r1,Hot chick fucked while interview
75k0fj,"""Let's go honey!"""
7mr0xd,Spartacus-Batiatus uses his slave’s ass
50umv0,Xpost nsfwgaming. Playing a game while doggy
d6koay,She is looking for Black Friday deals
9fomim,Welcome to the Freeuse News!
7yv4nv,"The Best kind of ""Spin The Bottle"" (xpost: /r/The_Best_Porno)"
9lyjqa,Sommer Ray's ass and tits being grabbed by her mom and sister
8bjguv,office whore [x-post from /r/AdrianaChechik]
781yea,She can't hold it in anymore
che0ff,Customer service
8mzt8m,the ultimate freeuse compliment 😍
6yhyna,When you date a professional gamer.
bvm5zd,"Female Anchor Calmly Continues Reading Her Script While She Convulses, Squirts And Pisses Herself"
d27ie5,Without being distracted from the game ...
5qldku,Used her remote doll
a86bip,Herself on an Elf.
674r05,Superheroine comic I wrote and drew. Let me know what you think!
7guewp,Free use tent at a festival
6rx2h5,A fan grabs Iggy Azelea's ass
3e5vz9,Trying to finish the level [x-post from /borednignored]
4aqax7,Woman Gets Arm Stuck and is Taken Advantage Of
a5we4f,Mardi Gras Flasher Getting Her Titties Sucked
9ug4ac,Public property !!
6pw5y5,Ordered a pale girl
apzkct,Sleepy brother
4z059m,Attempting to follow Priorities in a Free Use Society [GIF]
6dthou,Freeuse on the train
9iexan,Gamer Girl Facial
7o50uj,Heading to the top
6jm6mp,Women's Rights Activist Let's The Public Feel her Up - XNXX.COM
9b3hva,Think anyone can hear through the headset?
7zyno9,The TV series Spartacus has many free use scenes...
7rp1p2,Greetings
9vl83g,Hot slut gropped at concert !!
8zymo9,Pornstar freeuse at sex con
8mep05,Fun picnic with the girls by the river
9yn2rv,Nikky Dream
ae7ff1,Fucked meanwhile phone call
7p5y1q,Party Cove Free Use
4q3npu,Receiving line.
7wptye,Passersby help themselves to a handful of a blonde whore
5n9xes,Waking up
790yrr,Pussy so good you never wanna leave.
48abpm,Can't even have a beer first (crosspost r/nsfw)
dcdhpx,hot teen sister is horny and tricks her brother into fucking her by pretending to be stuck
bk4gqj,Can't miss that powerup
7jlb83,Fucking like a millennial.
5i4qjj,Virtual box is too damn fun
4htngt,Every girl needs a girl slave (via /r/porn_gifs)
a6k3fi,Fuck me and fill me up [19F]
9vc6w3,Hilary Duff in a party !!
dx5g8r,while she's playing a game
bk9d2c,South park: Play and Fuck
b4tr0g,What she is reading?
3wqte4,Sperm removal service
6au5st,What is your all-time favorite freeuse content?
8259vq,Blowjob in public got caught and strangers join in the fun
6o04hf,On her knees for dropping some plates! - Barbara Broadcast 1977 ;)
4adjgx,Obedience Training (x-post /r/fretton)
cwus6a,Performance art
7ya6ry,Roman general using a shepherd girl
8bg6xl,Gillian Anderson ignoring a guy pulling down her bikini and looking at her pussy
bkunk8,Do not distract the driver while driving! (especially with a blowjob)
5gxq3f,Girls night
8d2t37,Friends playing Guess Whose Tonque.
76uwhp,Blonde girl sucks off her bf on the beach and then invites strangers to cum on her
dtn8kj,"boobs for beer, timeless"
bydmvd,She just needed a place to sit before yoga class
dk7ult,Ava Knoxxx Anal Encounter With A Stranger
644kui,Every man needs a kitten around the house
6zuiir,Roommates freely use neighbor chick for pleasure (x-post r/Javpreview)
9goysv,[SDDE-331] Popular Cafe Where Cocks Are Popping Out From The Walls
5vomw8,Dinner Time
9a7mrt,Free use and the joy of multitasking
3st01e,Free Use Gif Captions
aqi0hu,Promo: STAR-165
4vk8zj,Rough day at the office for a free-woman
dg37pv,Neighbor Fuck Teen Sisters while they Watch Movie
ae1dfv,In the future we will have Freeuse parties.
7n4xhp,A casual fuck over lunch
6cayyc,"Another set of BTS videos with James Deen, this time featuring Janice Griffith"
4fq0gj,Meanwhile in the bathroom
6f73zq,FreeUse on the bus
4dog44,Picking one to take home
7txdyo,Feel free to use the maid while she works
bx4zik,My wife agreed to be my freeuse slut! Pic in story
aisbxl,Mia Malkova OF
5cy1wv,I'm a slut and this is my story!
dkjgif,Diamond Jackson & Simone Sonay [Anal]
dm5gjv,Chinese bride letting people grope her tits for money
7w0gqp,Banging before breakfast.
6s1n4o,"I finally splurged on a fancy new desk, so I can look the interns in the eyes while I am working"
4qmksi,Abella Danger - Free Anal 2
5rqwxz,"1 guy, 6 sisters and their mother"
d8i756,She Keeps Watching Her Movie While He Fucks Her [WMAF] (x-post r/AsianGirlsWhiteCocks)
3dopza,Comicon fantasy
5voyq2,Vr become reality
8jll54,The desk of the future
5q26c5,I'm just gonna leave this here...
4yaybq,Rich Bitch Public Toy (Album)
7eofvx,Welcome gentlemen
3zwgdk,Office freeuse
7bycry,Stewardesses offer First-class Service on Asia Airlines
617jbw,One by one now
81zl4x,Petite girl blows her room mates.
40xayc,The House-slut.
a625m1,[HND-228] I'm Stuck In A Wall!! AIKA
7t6jjv,Casually fucking the receptionist
bkn38c,Mortal Kombat ends with Blowjobality and Fuckality
6he8oo,"Smoke Weed, Play a game and Fuck (x-post from /r/holdthemoan)"
avbin8,Enjoy - a submissive for dinner - Clea Gaultier (w/ audio)
b3axaz,Gamer Girl Playing Call Of Duty
6ptw1k,"""Boring"" Dinner Party"
6rjnb8,My SO did a blowbang last week
7jhvkv,Wife makes herself free to strangers on beach
dmcxqt,Hottie trying to get her homework done.
85zupc,[HND-181] - Ai Uehara - Stuck in Wall!
8aqsd8,You play your game while I play with you
6lnicc,I'm in Charge of Dealing with My Six Sisters and My Mother
4y4ase,Do you guys like Rule34 FreeUse?
4xzrfw,The tour had moved on but as he unzipped her she knew that they would have to catch the next one.
5eqbej,Freeuse training
6pxwbs,Maid and fucktoy
3y5ksy,Self-Declared Slut is Fucked
493094,"Here, you play, I gotta suck this dick (from nsfw_gifs)"
cb0dp7,Stepmom and Sleeping step daughter
4s080w,Soccer practice
9r9vbq,Free use secretary at the office.
5p0ja0,Kaho Shibuya | Price Check
cepcw6,Close friends !!
5b8d98,Making it difficult to play pool
a99q1x,"Watching ""The Office"" and fucking"
7v0zku,Taking turns with the office slut.
c9s58i,[REAL-653] - Misaki Kanna - Cum Swallowing Female Announcer
729ho2,(Self post) Lazy day trying to warm up
7lhavr,Family Hotel
d6wxso,Can't Play Fallout 4 Without Getting Fucked
5pvpio,"Hey, ho -- *let's go!* ([gifv], Xpost /r/HappyEmbarrassedGirls)"
6syhk8,Welcome to Freeuse TV.
4u5kba,Since the country fully accepted freeuse the walk back to the car takes much longer now.
cfl40b,Cameraman casually fucks her while she gets her makeup done and everyone acts nonchalant - Lots of casual nudity and a great freeuse feel!
b61isq,"[HKM-001] - Kazuna Oki, Mitzuho Ayahara, Kaori Nishimura - We Made an AV Actress Be a Mannequin in a Show Window 3"
60l714,Used in the middle of a conversation with her mother
ausy3y,What could be better than freeusing Riley fuckin Reid?
96foof,Sleeper Carriage on a Train - Free Cock
4vubfv,Mia Li stuck in the window
9kn402,She is waiting for you
6xagsg,Multi Purpose Cleaner
7bc9ql,Switching it up
dnxtpv,Girl let’s old man use her on the train
7nr37b,Five star restaurant service
dhmzlg,just another day in a japanese office
4oiqxe,3 Ballerinas (from /r/standingout)
5efx39,Trying to do her homework but that ass is too tempting not to fuck..
b7stg9,Rachel Starr - Sneaky Spinning
6cudvp,Kajira
4ec5du,Her Throat is at Their Mercy
3p578s,Oops... This hanger needs to be fixed
ao2c5c,Girl wildly sucking off her bf and his friend while watching a movie
4zrwgf,Fucking while exercising:
doi1am,I Need One Of These
ccxgyl,He beats Sekiro while getting a blowjob then cums on her face | KaraTart
6huqnk,She's doing homework while he's doing her
