post_id,title
8j5vfm,Treasure Chest [xpost /r/GirlsInHoods]
aedkca,The hard life of Japanese news reporter (with sound)
9w980k,An average day as a teacher
55hir0,[GIF] Polite Table Manners
9mxk83,Lean back and enjoy the game... [GIF]
997wrl,Old But Gold: SDMT-522
d6uxm0,Laundry Day
8u3om2,[RCT-211] - Kouda Riri - Family Sex Game: Guessing Game! Fondle a Series of Young Girls and Guess Which Body Belongs to Your Daughter!
575y0g,Advertisements by the Department of Sexual Health [OC]
9byioo,"Routine male waxing session takes a turn as she freely grabs his cock, swats his hand away, and then finishes him off @3:25"
60oam2,Bus ride
4b7gsi,Surprise free use
9z7sje,Fucked while shopping
8fu2nf,Using her buns in the oven.
45mjd4,fucking her while she tries to study
5g4vxn,Should have never made that bet...
4py4k8,No more boring queues!
5v74jf,Saw this and thought of you guys.
8v7lra,[RCT-236] - Nishikawa Rion - Family Sex Game 6: Find Your Daughter If You're Her Father
dj85el,Cart girl offering extra service
abjjur,"Me and my wife, I have full access to her anytime, and it's awesome"
an7f1a,"[SDDE-553] - Hanasaki Ian, Tamaki Kurumi, Kanae Reno - Squirting While Reading The News"
8kfkiz,Casually taking a facial with no buildup
82slqq,"Glad I found this sub. Happy to swap pics, clips, chat on kik"
5fje65,Interviewing personal assistants.
74ng95,MissBanana - D.Va having a quickie while gaming
bo8mnn,He just starts fucking me while I'm studying [F18]
7e97hc,Love it when this happens at school (xpost r/Javpreview)
cl55fq,free use family in a free use world
83r0qa,Carrying on a conversation
6y132y,Performance art (xpost r/nsfw)
3hnndg,Guy having fun while she plays game
462f63,Cute teen gets fucked while browsing the web.
a7odf1,Servicing her way around the table
4kuqkc,Breaking News
a3ceop,Madison's perfect body is used and by guests at party
7vawvl,Carnaval the Rio is what introduces me to free use world
9rsxjr,Classic freeuse
4paz1h,This chair really helps to keep the workers motivated and without need for constant breaks.
77dool,Mom becomes fucking center of attention at kids birthday party
8ohlnx,"[RCTD-096] - Hamasaki Mao, Kurata Mao - She Was Working A Part-Time Job At A Food Stall Where She Had To Be Naked From The Waist Down And Get Fucked"
8lco92,Man uses three obedient ballet dancers for his own pleasure.
90ucj8,I think this fits here
9np3jy,Checking The Merchandise
c1jtah,Calling husband while being molested by bunch of guys
52ilqc,You've been tasked with hiring the new receptionist. Living in a freeuse society makes the interview process much more satisfying.
4fvlha,Waiting for a drink at the bar...
aagh76,When Comcast puts you on hold...
956o7l,"Teen girl of the house told to ""make [herself] available"""
csh30m,Asian girl sucks his dick while he watches TV
bojezf,It's always smart to keep a spare slut in your trunk for those long car rides.
40f3pd,Women... are doors [Hentai]
8c69y1,Carolina Sweets | My Family Pies
6uw32t,Instructions For Use
buf40g,"""A Fucking Conversation"" with Aaliyah Hadid"
7t9nb8,What a good maid
8cvz6v,Step Sister Fucked By Brother While Talking On Phone With Boyfriend
6lglum,Glory Hole
9edaet,Can't play Fallout 4 without getting fucked
563hho,Nasty Chicks Fucking In Club
9ybkd9,Cum and go
bmkq8p,How a free use club should be
49rcc9,The coaches bigges job is helping the team stretch after practice
9z5xu8,Lesbian gamer
6p8ea3,A well trained slut
5o94zm,Natasha Nice freeuse while rehearsing lines - Reno 911
8pjgsn,Using her while she plays Fortnite [gif]
7czz0e,Joining in on the fun
85fw1z,I believe that any man should be able to bust into the privacy of my room any time he wants and use my body for the toy that it is.
4xglh6,Work as a waitress
7ne8ya,Welcum to the Gloryhole Cafe
63ljgp,"You Pick, I deliver: Results"
4g7zfb,The King's servants
76dkvk,fucking Noemi while she tries to study (x-post /r/blackchickswhitedicks)
b7awoj,how to clean your cock
5eyn5c,"""Excuse me...can we get two drinks please?"""
5euwil,House maid
7k9ku1,Incase's finished webcomic on freeuse aliens that have joined human society.
3sc10t,It's all about creating a comfortable work environment.
484ekr,While she talking on the phone
ak51ro,Life of a pool attendant
86slr1,Timebomb 1-2 (comic)
89k71k,could not resist the temptation
bxhkfg,girl let herself being freeused and fingered at the bar by other people around her
4n02fc,Meanwhile in the bathroom
5qx5d2,The only way to survive the stress of rush hour.
5fb6hq,Step right up
4crsbm,Cleaning the floor
5t4iau,The sea be a harsh mistress
4h5vx8,Anonymous sperm donors.
bstk5u,"I made him breakfast, so he ate my ass in return.(FM)(Sound)"
9b807o,When the sister is free to use...
7i55yk,Aino Kishi Surprise Sex
d4yq5h,Guess breakfast will be late
4wcjp1,Like a Boss
3p7flr,"""Try to finish quickly, it's Girls' Night Out"""
8lwbgx,"[RCT-826] - Itou Beni, Natsume Eri, Sakura Chinami, Ichijou Rion - School Of Indifference 2"
4t9geo,He takes his stepmom whenever he wants
7jw4uq,The panty drop makes it.
bcl7gj,She uses his dick as she pleases while he sleeps
7mz9rv,Freeuse by the stairs
80bzfb,Attempting to follow Priorities in a Free Use Society [GIF] (xpost: /r/Porn_Kingdom)
7c6rkm,Neglected Bride
bpyd9j,"He plays Sekiro, I suck him off. [OC] (Vid in comments)"
blbari,girl talks on the phone with her boyfriend while getting fucked
7h4bkg,Things got a little crazy at Dunder Mifflin.
a1m5eo,Guy share his girlfriend on street
8geuc4,My table for taco tuesday
7i43pn,Doing what assistants do.
4yqvdq,The family decide that the best way to keep people from coming in the house to get relief on the long stretch of road they would take turns outside. It was just Sara's bad habit of getting bored and wandering off that needed to be fixed.
cvm4qf,Sleepy anal
91jkji,The Freeuse Office
7qbhuv,Last minute airline deal: Using the air hostess
5jmd03,"You wanted more of my 22f little fuck-toy, so here ya go... She's bound so I can use her holes and cum all over her face."
961dnr,Had an awkward boner my entire subway ride home because of this ad
a30hbp,destruction Level 900
31a8ue,"I'm busy catching up on TV, but you can borrow me for a bit"
dpewca,"Dont move, its not necessary my darling"
aghxdn,"With no respect for her privacy, dude fucks cutie while she's on a call"
9zpikh,Pornstar Aurora Snow is given to a bar full of fans and strangers to use as they please.
3w9r6d,sleepover.
4tm135,Just wanted to tie her shoe.
82dnoe,"""Can I borrow him?"" with Stacy Sweet and Norah Nova"
5bgwvc,Marsha May sucking dick
52yzcj,BONNIE SHAI GETS POUNDED ON THE BUS
azz7ev,Blonde bombshell friend used by couple while shopping
7sojds,The Japanese Mega Bang Bus
40xfve,Stuck in the wall
76j71a,Kelly's Summer Job (x-post /r/SparrowXXX)
48n4m9,Best Newsreader
b4u3rn,I need a woman like her
8kt7ip,[CJOD-089] - Meguri - Suddenly Time Stoppdf At The Exciting Academy: Ms. Meguri
5pr564,Casually fucking during an interview
bqlz0p,Travel anywhere you want to go
7h8hnn,"License to have sex with anyone, anywhere on demand"
7gr97l,Cream for her coffee.
8e3tyi,Freeuse of mom while the kids have breakfast
4n46te,The orafice leasing agency has an excellent selection
5daj75,Trying to do her work
a7uhqb,Whenever she's on Reddit...
4eyhh9,Freeuse does have one downside
5x0za3,Free use family
4wqhsr,Sexual education assistant (x-post r/hentai)
4bwkc3,"Resisting a fertile man is now a crime, but she still has to study."
7dbuip,Win 1 Million Yen If You Can Stay In Your Mom's Pussy For 60 Minutes [RCT-810]
6mxskl,"The meaning of ""Protect and Serve"" changed as the laws did"
ce6gnw,Everyone gets a turn [ABP-636]
51wd4b,Mom stuck under table
6fcq0v,"Husbands, Homeowners, and Hospitality"
4bluto,Freeuse Multimedia Source
66zgyr,She learns that a deal is a deal and there's no getting out of it
76mfm5,Girl wildly sucking off her bf and his friend while watching a movie
8s5h9u,"[RCT-543] - Sunohara Miki, Hara Chigusa - The Handjob Delivery Service For Busy Mornings Before Leaving For Work/School The Morning Ejaculation Service"
4x26ub,"She shouldn't have made that bet. Free fucks for a week, still 4 days to go!"
atjqlq,[VAGU-120] - Seira Ichijo - Beautiful Mannequin Wife
61kdb9,Poll: who would like to see an extensive FTF Law choose your own adventure/rpg?
4xp2gy,Massage Therapist takes full advantage
5hac2n,Hot and always available: The combination we all want!
4z7ie8,"""How many times have I told you? No panties in the office!"""
c280xr,23F - Love being a free-use whore!
4p5653,At This Point Her Work Breaks Mainly Consisted of Sucking Her Co-Workers Dicks
91us9i,Free Use Party
7kp6ku,[Story] He fucks me while I’m sleeping
aaskkb,Woodcutting lvls? 🌳🌲🌳
8ivyy0,"[POST-293] The School's Fire Shutters Shut For No Reason? Stuck Within The Shutters, A School Girl Gets Fucked From Behind By Her Classmates! 3"
8kd4rr,"2 hour long video of a mom being used, fucked and milked by her sons, seems super natural. The ULTIMATE freeuse movie."
63gua4,Maria Ozawa reads the news while being freely used
8hvozr,After the accident the head cheerleader was given a different job for the team
59p1k6,My wife dropped this one on me last night
8ab0zb,Dinner is interrupted so that he can fuck her in the ass
4f2k5x,boyfriend wants to play a different game.
ccmxxn,"Impressive Range, She Doesn't Need to Focus"
3w2zc3,"the ""freeuse"" couple"
45rxqi,Playing a game
52r2n7,HORNY STUDENTS FUCK IN THE SCHOOL BUS
avq8es,Clubs in a free use world
51raj6,Reading And Fucking
49zvlf,Mandy Muse plays vidya gaems
6m2f2x,Girl Celebrating birthday with the free use act
5skw2g,Guy gets his dick sucked while playing Super Mario World
4o2q3x,A scene from a free use world? Xpost /r/holdthemoan
61bhax,Home full of women cooking and doing schoolwork; man has his way with them. (super long too!)
d67wdq,Free use while making a puzzle
co2z57,[HIYC-103] Mamas Doing Housework Fantasy Play 2
8oqhm6,she didnt want to pay for pizza with money
6y3vc2,"""I choose you!"""
4ghovn,On the bus
asizg6,Casually waiting for strangers to come use her on the side of the road
7dhj95,"""Just use your daughter, she's available"" [SIC]"
2sh7nx,Just keep cleaning. You missed a spot.
8rcfp9,[VAGU-060] - Hatano Yui - Beautiful Mannequin Wife: Doll Fucking Guy's Daydream Sex
4omoth,"18 served... and counting (D.Va from Overwatch, by Lesidas)"
74c4n9,Using his friend's leg
dhx04g,Anri Okita
3onatz,India Summer is free to be used (SexuallyBroken)
d3hrmj,Gianna Dior Gets Fucked in the Doggy Door
8ml787,"[RCT-912] - Ninomiya Waka, Suzumi Misa, Noa, Mirano - Ignored, Drag Out SEX"
427dsz,Her students learn better after cumming
4bo6vf,Bridgette B - Free Anal
7ag7xv,Freeuse Stewardess Kurea Hasumi
5c7uds,5 Hours special of Primal
5irlx9,My true story of turning my maid into a blowjob machine.
38d8en,Free use Literally
4ddqld,Aria Alexander Opens Her Mouth For Business
4016rn,Playing call of duty!
b1iq85,Every guy's dream. Getting dick used while playing video games
4shmuv,Naked In Public And Sucking Cock
c1tn5s,Using her while she makes dinner
brd6u2,"Mai Satsuki, Nozomi Anzaki, Nanaka Miyamoto - A Female Announcer Squirts Like Crazy"
57v7sj,Samantha Fucking In Night Club
47g2lc,The acceptable way to tip the staff
815yym,Surprise anal in Bar
35ksjd,Beach blonde
4lhbtw,Stuck on the sink
4j2t3e,"Teacher receives a notebook that makes students do whatever is written, and uses it for his personal pleasure."
d00r8h,She is waiting for you
a60dx9,When it's finals week...
5dyg3y,"On the street, ready to be used"
49osu3,She asked for it
69mz3n,I apparently got this note delivered to me while I was at work. What should I do? [OC]
6h796d,She's taking a poll...
49kiai,Hogwarts Entrance Hall by Shadman
a6y5us,A Fucking Conversation With Lily Rader
dug85f,A drop-seat onesie is a perfect outfit for free use anal [8:52]
7nha60,freeuse school on island
74vol5,bus to school
5tdtwr,Newscaster trying hard to focus on her job
4qzrgc,Just a routine check
crnlyw,Study Session
9urf5z,Kitty JAne treating some random guys
9m6nsw,[RCT-439] The Soft Body Of A Rhythmic Sports Gymnast. Surprise Pussy Inspection
9gfu5v,"Hey, try this one!"
95gfh9,[/r/porngifs] Everyone's Wish
6eh4b4,Free Use in the Kitchen
54hnao,Just taking a break from playing tennis.
93e5os,Mom teaches daughter how to take it from the ass
6fr4h4,She was demoted to Elevator Slut and couldn't be happier
46qaod,She let's them all have a go
6nmyd4,Nicki Minaj getting her ass grabbed by random fan
4t5om7,Used when shes talking
d3neaf,Timestop Sex In The Middle Of Class
8flwil,On the other side of the wall.
45wh19,Guy facefucks the photographer when the pornstar just doesn't cut it
dtqpjx,Japan
5z3bfl,Even in the ski resort gondola. If I feel like putting my cock in her mouth she has to comply.
6aihn6,"Free Use School ""History of Whores"" Lesson"
6vt5wb,Sister on the phone
by2rcs,Intentionally accidentally freeused
cccj5l,Two hot girls get stuck under a bunk bed
8szndf,It's been a while since this hot casual public sex commercial was posted
6gnw73,"Girl gives me a blowjob while I watch Family Guy, because that's just what she has to do. Every day thing, no big deal."
dmz8xe,A Lucky Guy Fucks a whole Japanese Family
4k6wfw,Hand stuck under the sink
8blu0f,Cum doesn't bother her
czwlgb,A long lick
b50uw0,She Ruined His Fortnite Sesh
5brdyj,Now that's some excellent customer service
70m0je,Women use too.
4h97xw,Trashy tattooed girl sucking and squirting on the bus
ax5yet,Hottest Free Use video . just waiting for him with a note
7j1hi9,She is but a hole. Xposted
dsy4u3,Fucked by roommate while talking to the phone
c5fxn4,She let Her old man use Her like a sex doll
d867s4,[MIMK-045] - JULIA - Time Stop Club Busty Female Teacher Gets Used As A Living Sex Slave
bqvgfz,This crazy girl lets people finger her
bkj2jl,used as a cum dumpster while sleeping
4sgbkz,An Overwatch freeuse comic (3-pages) [Midnight-on-mars]
9h91p1,"You just wanted to go camping, now anyone can find you like this"
6nurbp,"""Bend over, I want to taste your ass"""
7m7s4r,Emily Ratajkowski having her tits and ass groped by her friends
3rsky9,A quickie during dinner... literally.
assr24,Just waiting to get used by strangers in the park
9ge1t9,Interrupted while playing COD.
6xvlgg,Step sister fucked while using laptop
8ag8gc,Want to see her dripping wet from being tied up like this? ;) (x-post /r/RachelAndJack)
6ic0kn,Her mom teaches her to take it in the ass
5kmpk8,Japanese teacher gets used by student during class (more in comments)
55tv4t,Hammering hard on the public school bus
93074i,Classic: Monique Alexander - Big Tits At Work - Brazzers
bxolox,Teen Cheerleader Gets Used When She's Frozen
6hopso,"In her home country, this is standard..."
4uxvvl,Chloe Camilla—The Dinner Party (X-post /r/sexinfrontofothers)
ap9suz,"You know that ""free fuck"" outdoor german girl that gets posted here every other day? Here is a version with anal."
44bu4f,Good way to get rides.
3z9sft,Putting it in
5xzb39,"Once she turned 18, her after-school sessions changed"
5gtkov,german pornstar fingered by fan at her autograph table
5coylr,A poor nights sleep is no excuse to avoid fulfilling her morning duties
41yi8n,"Man crash lands on an island of native women during their ""Melding Festival"" [Hentai Manga]"
50v6xd,Now spread 'em
c0od53,A lot of work for you [Sexgame]
7gd64d,IKEA commercial in freeuse society
adybkm,He Plays Games While She Sucks Him Off
a17384,HOT Teen Fucked while Gaming
6dtlno,Piper Perri Trying to Read
d2qopl,"[OC] When Daddy has freeuse rights and I drink too much, I get woken up with a load of cum in my pussy."
8jd7ey,The deal with her roommate [femdom]
9ucyhj,Wife Used At The Beach
79k3so,Ride-sharing can be rewarding for everyone
djol0p,Free use
a6kqb1,Day 3 of my mouth being a fuck hole for my roommate.
8nnqol,"The game is on, but she’s still free to fuck me while I watch the game, as long as she doesn’t block the screen"
aeq3i7,Freeuse alleyways will provide much needed stress relief.
7riihf,Gia Paige searches for a guy who will have sex with her for free
6ktax5,Town Uncovered - Visual Novel Game set in freeuse universe
6bwnma,Why get your secretary her own desk when you can just tie her up under yours? (x-post /r/Bondage)
4vh3pi,"In a perfect world, you don't have to decide between sex and video games! ;) [x-post /r/sexy_saffron]"
6ov1o2,Slut Scout Sleepover Camp
7nqjxx,"Tumblr captions now have a mirror in the comments, thanks to /u/TumblrDirect"
bte0li,French wife finger blasted and fucked by strangers on beach
4zz6lv,Video Game Session
bjudmb,Facefucking gamer girl
87x5vg,Introducing yourself in a freeuse world.
7dknpj,A free use game show
by3zdc,Japanese Office Free Use Cum Slut
7ogfct,A dedicated waitress
5xvgjx,The things you find on youtube
695w3j,Chick gets used on the bus. People clap at the end.
bd6lzq,She is a heavy ass sleeper
aj2v0w,"I've got a really important stage to pass, sorry"
6m8d31,Two friends stop to free use a girl in the middle of the street
51g0mx,"Style for the girlfriend, service for the boyfriend"
2x69wd,Checking the fridge
3c22zm,Fucked while playing Catherine [via /r/holdthemoan]
9ymkdd,"PSA: For the love of porn, please post only free use content!"
7tczk9,Finally Mom freely used in her Bed
5athxu,Soccer Mom Participation
8dwku3,Lily Rader fucked during interview
9flpka,Lunchtime
8d0x5x,"I’m calling it “The Freeuse Couch”. I know, how creative! (One of our first few attempts at freeuse, so please be nice) (X-post r/keepinitclassy)"
46sqb4,Timestop at a public bath house (x-post /r/timestop)
cxp3o0,I'm looking for the source
cmdv4x,That nod triggered something real hard
axno8w,Busting stepsister watching lesbian porn and then fucking her freely
bi7x75,"RK Prime - Kira Noir, Anastasia Knight - Dick Flicks And Chill"
8yldo7,Secretary used to seal business deal
bpe5n7,Used by neighbor while on the phone with BF
96g5g8,"Eva Long, Joseline Kelly, and Makayla Cox - The Master Plan 2 - Part Full House"
7im729,Busty Asian Used While She Is On Phone
9k3d09,Our daughter makes the best tea!
7oq592,Group Boat Orgy
b09b0d,Coming inside her while she watches porn
7z5sor,Club bitches dance and fuck
4zgtuc,I would love a freeuse society where you would see this on the daily.
3z0ng0,Used on the bus
5bwjap,"A hentai where a school changes the rules to basically make it FreeUse - the more sex you have, the better you do."
au2i2b,Gamer Girl gets fucked while playing super mario world
5d7h21,Secretary cleaning up after daily meeting
2u8j4h,Surprise BJ
b0gnty,No respect for her schedule today
638rsg,Serving the dude next door
61y8va,Submissive GF ordered to make herself cum in the car
5g27qb,The Perfect Maid Nicole Aniston free to use
3d2fve,Women use too.
4pg9kv,Working hard
cfclle,Diamond Jackson Casually Chats with Simone Sonay while Bartender Fucks her GIF by Reserved21 (@reserved21)
48jv4x,Sexual Matchmaking [Hentai]
bj4tls,Giving her a pounding while she's trying to sleep
50hno3,"If No One Can Notice Me, There's No Harm In Fucking A Bunch of Girls, Right?! [xpost from /r/doujinshi]"
askx7r,Some classic freeuse
b0pr11,When she's too into her music to care
51zqn8,Free use island resort
4jerou,Relationships Before and After Free Use Laws Went Into Effect
ch8u3t,Girl let herself being freeused and fingered at the bar by other people around her
ajkxyn,Sexy woman allows strangers to grope her as they wish in the name of art
6aouhh,The kind of slut that makes a company a great place to work
2ya9nm,Freeuse cafe
71bxy5,Got distracted when the maid asked for help
3ux7bx,Her employee orientation (x-post /r/AsianNSFW)
ba91is,Playing Mortal Kombat
6b2wrm,An ordinary day
99fr2e,Used while doing the laundry [GIF]
77v7jq,"Mao Kurata | The Man Who Can Stop Time Truly Exists! When He Sees A Happy Looking Fellow, He'll Fuck His Girlfriend! Infiltrating A Happy Couple"
56fwx7,Mirror Box
41u4ef,Your Typical Japanese School
52d1cj,STEP MOM SUCKING HER SON'S COCK UNDER THE TABLE IN FRONT OF DAD
3o8a0p,Some times you need to sign up
acei08,They are really into the game
6zxq8a,In a box
55epg4,Mom Sucking Her Son's Cock Under The Table In Front Of Dad
3df411,Something to come home to
7kq2r2,When the game you're playing is too good.
ay0mej,Fucked while playing Fortnite
3t6lj6,It's good to have these placed strategically along the property.
7wgny8,[Hentai] [incest] My older sister has no concept of chastity
a7ave4,Clean dishes
9kjnli,nude for ease of access
9udrc0,Using her knee to get yourself off
99kb5v,An audience
bgrych,While asleep! The best way to wake up!
6ts0mv,Free to use whenever and however I want
3pkgkt,Don't Mind Me (xpost from /r/BorednIgnored)
3a0egc,"Fucking whilst folding laundry, washing dishes and cleaning the floor [Gif]"
8gxn2g,Some freeuse anal at the bar
4naddw,"""Hurry up and finish, old man, I wanna go hang out with my friends."" [x-post from /r/annoyedtobenude]"
56565e,"She's playing game naked and on all fours, she asked for it"
9cbaa7,"Wake up if you want, I don't really care (xpost r/painal)"
43ocrw,Free Licks
4pilax,While she's make up on the mirror
ai5rva,Cousin gets fucked while on a call
3pen5n,no more boring queues! (x-post /r/JapanesePorn2/)
baonry,Getting a real life sex doll for Valentine's day and using her as intended
78qzr3,Titfucked While On Phone [Xpost /r/massivetitsnass]
652xrr,Gloryholes in Everyday Life
