post_id,title
b3y9nr,Another porn addiction recovery site answers one of the most commonly asked questions.
ajnhip,130 days. My secret rules of success
bywwsz,Discovered wife was having affair last year. Not going to porn for confort.
bj77ex,Completed 24 days today.. adding colours in my life day by day
d0w4jz,"Day 21, Started workout daily, listening podcasts daily, reading a book 50 pages minimum daily. I cant believe it. This thing really works. Join me this amazing process. You have my sword!"
alct1f,"Have gone from gaming all evening in my apartment to longboarding out here everyday to catch the sunset thanks to Nofap. Keep at it guys, the journey is so worth it!"
8ofetd,Face your problems or they'll overwhelm you
93p8nf,Can't be the only one to relate to this
b66gg9,To everyone discouraged because they keep breaking their streaks:
6l7vbs,This pic hurts alot coz deep down i know he's damn correct.
a14jp4,"Masturbated on a 383 day streak, important advice"
c3mrkm,I’m laying in my bed in tears.
ao67hm,Recovery Is Not Linear
9zfawa,Completed my first 90-day streak today. All I have to say: Wow. So thankful for the world and those around me.
b8kqsl,I'll be the black one for the rest of my life
7e8wj4,I knew it!
dab6qp,"hey guys, don't fap today"
7hnpp7,Don't ever fall for this again
bdshmd,YEAAA.. I DID IT TODAY 🎉🎉..90 DAYS WOW✌
9ic97t,Saw a post on nofap. Had to fix it.
7zvdp4,We all have to Start to somewhere
94g3nn,this hit me hard
98ep1w,This is correct
7c6xzv,"Porn addiction should be considered an epidemic. The change in my life style from 6 months ago is mind boggling. I was a worthless piece of shit couch potato. A real sap. Now just the thought of porn/masturbation makes me nauseous. The outdoors, the world is beautiful. Go out and explore. Live life!"
7aeol0,"Your future self is watching you right now through memories, and your past self is hoping for your success. Don’t let yourself down."
d3dkvk,A trick that has helped me reach 3 weeks. The mind can conquer anything.
1si0yo,My experience with NoFap so far
1ese5u,How I feel after not masturbating for almost two weeks.
berqt9,I wish the ladies found touching my penis as irresistible as I do.
curr75,Being addicted to porn is like Superman being addicted to kryptonite
d4fqio,"If watching porn and masturbating is considered ordinary and normal by society, then we should try to be extraordinary and beat the urges!"
8tbhrf,#150 in the Pokedex but #1 in our hearts
dqj4lt,me after finding out that one of you has relapsed.
anmfft,"TODAY, after 72 days, something crossed my mind."
cvzzzd,This is What helped me not relapse and it's amazing.
8dt1fr,Pornhub is playing dirty
d3642z,“Masturbation is like getting applause for something you never did”
d53hid,"It's my birthday today, but that's not the reason why i'm celebrating it, i'm celebrating because i have reached 48 days without fapping 🙌 🙌🎉🎉"
cj2nmb,Can I get a hell yeah for finally making it to 60 days after relapsing every week for 2 months!
d67q9w,I just relapsed after 7 days here's what i learned.
9nkujm,This is me now.
9i5kob,"Every time you get the urge to peek , remember that Vegeta resisted mind control just for the sake of his pride..."
d8hx8g,Don’t do NoFap for the superpowers. Do it because it will return your brain to normal.
apg7zz,Reasons why i'm not going to relapse today
d4002m,The reason quitting porn is so hard is because it makes me realize how terrible my life is.
ai69jv,I found this on r/memes
9ah08n,"Porn is an escape from reality, so in order to quit porn..."
bz7brm,To people asking if only watching Porn is OK ......Gollum in LOTR watched his Ring in the cave all the time...he really excelled in life.
6zkwpp,:)
94lypb,I think this quote can be applied to our problem as well
a0j3u1,My brain after I relapse
9qzxt2,"""You must be 18+"""
dst30p,This isn't a placebo.
b5wk0r,My brother confessed to me
abspiu,Fapstronaut who made it be like
9uwefz,Let's just do this.
cmqx23,"Instead of PMO, I'm reqding by the river! Thanks nofap!"
chkqlf,My girlfriend knows.
7ex97n,This is what happens when you watch too much porn.
9zx2mh,You cant climb the ladder of success with your hands on your dick
cxbzwu,I just deleted my 1TB folder of Porn
7gvmxi,Advice from one of the most successful YouTube musician
di6aj5,"ME AND MY GIRLFRIEND WE MADE A DEAL , SINCE WERE GONNA GET MARRY IN 6 MONTHS, I TOLD HER TO NOT LET ME MARRY HER IF I CANT GET TO 100 DAYS NO PORN AND MASTURBATION. 🙏🙏🙏SO LETS GO! PLEASE EVERYONE YOUR SUPPORT IS MUCH APPRECIATED!!"
9va3qo,"Day 600. If you have any questions, i will try to answer them!"
cuajhx,I DID IT!
ak1pvk,TRUE
9pfdyy,Are you?
8h4jvy,porn is disgusting
6ilxpf,Don't become the meme...
dn8ffd,Here's a hack that'll get you off of porn
9szex5,Good Morning
89p6j2,If you're thinking of relapsing right now
bs08xg,Day 900
b2ykl0,8 tips - You will never relapse after reading this
81qy27,"From masturbating 100 times in 90 days, to masturbating 0 times in 90 days."
c38o09,💯 days since I last fapped and was depressed in a heap on my bedroom floor . A lot has changed since then 💪😎 thanks to everyone in this amazing sub who has helped me a long the way .
9bsk9e,Had an urge so I went for a night jog.
8t2yb3,"In a nutshell, what everyone should focus on."
7immnq,"""An intellectual is a person who has discovered something more interesting than sex."" - Aldous Huxley"
7x9k7x,Remember: You’ve masturbated thousands of times before and it STILL hasn’t satisfied you. Why would this time be any different?
clvv1n,854 days in. A thank you note to all of you.
8h6pmd,True af
ciah2i,Can I get 3 cheers for my 1st three weeks?🏆
81i6we,One day you'll be a man
c4ys9x,Reminder that you can have a 180 days streak by Christmas if you stop watching porn right now
cwvxjm,I approached the hottest girl in class
8fzgwq,"Saw this in the campus library today, gives me hope for the future"
7z0j9g,Here's a little motivation.
7ksgb5,I think we all know the real reason behind his success
b5jh07,Made a meme for you lads to enjoy on your journey to a Porn free life
ag9464,I thought this community was bullshit
c0lkca,"Kind of demotivated.(If you can, please read)"
b3a6x6,"On average, 1000 people connect to PornHub every second. Stay away from the herd, don't be thay guy 🐑"
bqub0x,If you promise to complete 90 days before 2020 say “I”
bhssm9,My Goodbye to Reddit...
8esna9,"Realization: There are no benefits or ""superpowers"""
d9sch9,Told my wife...
dmhe6h,"The r/NoFap sub is the worst, most unnecessary thing that can happen"
9zmqtl,When you dont get urges anymore
dr5ihn,For everyone
b8we7y,I was so busy enjoying life that I didn't even realize I hit 90 days for the first time in my life.
dh4osp,Relapsed in a cold shower
civpmq,"Too Impatient to make a 90 day post, so here's my 89 day post! 🤩"
a7wd76,"The post that speaks to me on a personal level, perhaps."
9b8khh,Take note broskis
8kmto3,My Self-Confidence
aa61eu,"I'm 100% committing to this lifestyle in 2019. Join me, bros!"
dwpiba,No Payments for PornHub
bvu9g2,You're horny?
bstnb9,"""You spend your whole life stuck in the labyrinth, thinking about how you will escape it one day, and how awesome it will be, and imagining that future that keeps you going on, but you never do it. You just use the future to escape the present"""
af439n,Stop posting overtly sexual things
de1pvv,"Whenever I have an urge to relapse, I come to this community and read the posts, they help me keep going. Thank you all!"
843lxj,The real final boss
d73a7w,"""As a parent of young kids I believe rampant access to pornography is a real problem. We need to empower families to be able to moderate what our kids see and when."" - Andrew Yang (2020 Democratic presidential candidate)."
cjn7fq,A man is who he is when nobody’s watching.
8psgw3,BEAT MY FEET IN THE MORNING WOODS AND NOT MY MEAT WITH MORNING WOOD
825kx3,5 Celebrities Share Their Experiences With Porn
d4v93g,Work so hard that everyone knows your name. Period.
be55ju,Nofap. medical standpoint.
7px7k8,What a stupid frogs... oh wait
bdeodl,Don't fool yourself. It's not just a harmless pleasure. You know from experience you'll regret it.
cf2qi2,"My best bro has been struggling with depression and anxiety for months. I told him to try nofap. Today, he had so much fucking energy and wanted us to go on a huge adventure. He worked all day for the first time in forever & say nofap works! He feels so fucking good! I’m so happy for him and nofap!"
burvqh,One dot connect is equal to one successful day in nofap journey :)
avhsaj,"Day 1,000"
az6jhd,Starting to go outside (good way to fight the urges)
98m46a,"""Let me edge just a little bit."""
8d1dlh,"Day 8: Made a flowchart of events that lead to failing noFap. If you know the cycle, it is easier to stop yourself!"
ztid8,I have been forced to participate in nofap against my will.
cqwsnc,"Today was the first day of school. I feel like I should die, some of my friends don’t talk to me as much, most of my friends aren’t in my class, and the girl that I talked to a lot during summer school started talking to me less and she might’ve left me for her ex. I feel like I need some dopamine."
bk6pty,Everybody watches porn...
9a7e73,Don‘t be this guy
cm8gks,DON'T YOU F*CKING DARE!
d4lw71,EVERYBODY WANT A LONG ASS STREAK.
92btx3,"Saw this on r/GetMotivated, though it belonged here. On day 6 myself right now and going strong."
91dkes,Food for thought
9s4lhu,Reject a thought before it turns into an action
9kz0dg,Let us start it from Now. 😊
cb1u9c,Finally I did ejaculate properly!
afqnvm,Quit doing nothing.
8idwqz,What we all need
cfytu1,"Notice the situations where urge comes. When you are sad, depressed, anxious, lonely, afraid, ... and you want to quickly escape from those feelings. Right now I m feeling depressed, but I won't give up. I am not even thinking of doing such thing, rather fixing things up in my life. Never give up."
dhb8bi,"There's no excuse for relapse, Relapsing is a choice."
7n7dk1,#NONUT2018!!! WHO'S WITH ME?!?!!
9t7pi4,November 1st is here people
bm3pdq,Stop the delusion guys abstaining from masturbating won't magically make girls fall in love with you end of text.
89y0ps,Saw this on 9gag sad but true
a0b5ws,"If you start today, you will reach the first stage of reboot on Christmas Day. Join me brothers as we claim back our lives."
cg6uqd,I’m a man.
amaqge,31st Day of No fap and got first kiss of my life!
b8czsw,My father was my wake up call today.
bydkyi,"""I don't count my sit-ups, I only start counting when it starts hurting, because they're the ones that really count"" ~Muhammad Ali"
bls1v6,After 2 years of trying NoFap and self-improvement
2q6glg,Anon tries NoFap [Found on r/4chan]
8bf0rg,When you cum
dly9ej,Boredom is the main reason of relapsing.
9ku74w,When you just try to edge but relapse instead.
980rl0,The future is today.
8ytan1,The best starter kit ever!
8eae6p,True
8s737v,Everytime😂
bwmuaj,Look at you..
8yi71g,Bob Ross is rooting for you while you're struggling
8ua7o9,"Planted these when i started my Nofap journey, if i relapse, ill have to kill them:(- No relapse!"
8f5i7b,Focus on yourself first!!!!!
8ctty2,It took me 2 years to reach my goal 15 days of NoFAP. IT WASN'T FUKIN EASY :') Am gonna quit this shit for life.
aia8yj,NoFap Superpowers Explained! (They ARE Real!)
8inhe9,x-post from r/rickandmorty
6yf0ev,Me before resetting the counter
b9zeab,"If you start NoFap today, you will reach 90 days on July 4th, or America’s independence day. Let’s win this battle boys, and make July 4th our independence day!"
dkg18h,"Took my phone and called a girl I have a crush on. That feminine voice is bliss guys, PMO is really making us miss out. Confidently told her I wanna take her out and she said yes!"
bo3lsu,I don't find posts announcing sexual victory as a result of NoFap supportive at all
9v364d,"If you love life, don't waste time, for time is what life is made up of."
cxghgp,It has been 90 fucking daysssssssssss yallllllllllllllllllllll. Y’all better celebrate with me🤬🥳🥳🥳🤪🤪🤪🤪🤪
9ilghq,Let us not forget!
96o5lr,Original image was on iFunny. Added some text and I think we can all relate.
9l3kqa,How to succed at Nofap. Longtimer here
9frltx,Instead of relapsing I wrote a poem about Porn Addiction
6vrjzk,"When a ""science"" guy tries to convince you that masturbating and porn is a healthy and good thing"
99w7bt,Take action guys!
8kd5gn,Just why?
7otmo9,Pretty sure it belongs here
a6norr,Today is my 4 year anniversary of NoFap
8mcbp8,When you trade weeks of high energy levels and confidence for a 1.5 second orgasm.
8jjlz7,10 reasons for me to quit (not much success so far)
byjs29,Read this when considering a relapse
a6f33h,There's always a hope
a6z158,Something i plan to stop this year!
9pmu0x,A reminder:
9ko4vg,90 days from today is 31st of December.
dfthzh,This is how no fap+gym changed my life..
cz7txa,"I say this with tears in my eyes, but I signed up for my first Ironman."
9o14xr,Never doing that shit again
a22juw,So I visited my doctor today... [IMPORTANT]
cr36qi,The feeling after fighting an urge is better than an orgasm
cjw93d,It's my birthday today but I am more excited for completing 1 year on nofap in 15 days 🎉🎊
bvjdhd,Erectile Dysfunction
awx0in,Life’s all about a balance
a5o9ei,"Best quote I’ve ever seen, we move different now."
b77oqk,Can't even act normal around my (19M) female cousin (17F) who wore exposing shorts. Major wakeup call.
9ql18w,6 Messed Up Ideas About Sex That Porn Normalizes
cozmk1,Fuck porn
c1m1qf,Confession: I wasted my teenage years due to severe Brain Fog and Lack of Energy.
86ksp5,"Instead of fapping, I’m chasing my dream and working on my producing my music and putting it out there. It’s terrifying and exhilarating."
dbs6uk,I’ll just leave this right here
bi1zcy,"I had a strong urge, but enjoying nature killed it quickly 🌈 Have a nice day"
ci1ftk,This 17 year old is about to break his record of 59 days in a matter of hours
9w5j7g,Starting my NoFap journey. Day 0.
9krebs,Anyone relate?
85g0wf,Riding the final hours of Day 89
d46ls8,What I learned from NoFap: life is very short. Stop wasting time jerking off when you could be doing something great in life. Tomorrow or even your next minute is not guaranteed. Appreciate each moment in your life and stop wasting it on PMO.
azt513,Chess is the best way to verify how porn fucks up your mind.
8ek6og,all of us can relate
bbr2li,"If you beat your meat, you'll yeet your skeet, and greet defeat"
cyzcx1,"Today I have erased 240 GB of pornography, I really feel sad now because the time I spent on fantasy and fake reality I could use it to learn a new language . but, I'm looking forward to change my life. BTW I have 120 KB/S of download speed"
d2lz59,111 Days to 2020. You will be celebrating your full reboot on New year Eve .
cxszxa,The hardest choices require the strongest wills - Thanos
7xhtnc,My Dad always told me never chase buses or women. You always get left behind.
71s9wj,Look what i found from 1999's Fight club.
dagd4d,I GOT MY FIRST KISS
9y5y90,First 90 days 💪
djktk7,Being a man because Of NoFap is so much more satisfying than being a wanker
6mm1l7,Terry Crews knows whats up!
d0nm6j,This is fucking ABSURD. PUNCH in the face !
9jc0pd,It can be done.
dpxtj1,instead of doing just no nut november
cggbe6,An urologist take on abstinence and prostate cancer
cbac3j,Female here
ajy175,"Don't worry about 1000, 100 or even a 10 day streak. Just don't fap one day, today!"
c5za06,Fapping isn’t worth the few seconds of pleasure for a 24 hour wait time to achieve a day
9dpr50,Puppies > Porn
ave1iv,I will start now
7ti555,True
84aqa1,RIP To One of the Greatest Contributors to Modern Day Society
6luy7r,40 THINGS YOU CAN DO RIGHT NOW
8yescx,Another one :(
aiyj5o,"DAY 90! YEEEEAAAAH, I MADE IT!!"
8rue7r,Denzel Curry talks about his porn addiction and what helps him to try to stop it
c1fmv4,Porn Sites in Hong Kong Shut Down to Encourage People to Protest
8pmrr0,"I gave into my childish side and bought my first Lego set in over 13 years, and it’s very big. So I’ve decided to use it to hold me accountable. I can only do as many steps per day as my streak counter. (Day 1 = 1 step, Day 7 = 7 steps.) and if I relapse, I go back to 1 step. This is Day one."
cgr1jg,Reddit! Me and my best friend got married! Clean and happy! Dreams can come true and you can find a partner that will help you through anything! I love my wife!
97cbl1,We can all relate
8wb2xd,"Quote from ""The way of the superior man"""
8sqs8d,"One is going to kill you, another one will make you grow. Choose wise."
dhrzxy,"""Lust is a poor, weak, whimpering whispering thing compared with that richness and energy of desire which will arise when lust has been killed."" --C. S. Lewis"
daqvve,POSTURE CHECK NOW!
9vytl3,A summary before you decide
bcp43e,My crush is now my girlfriend!
a3e1tc,Day 18
6ynp8d,My reaction every time i relapse after a week
85x52a,Who is NOT watching porn Tonight?
ces2x6,"In 2017 I quit smoking, in 2018 I started exercising, in 2019 I'm quiting PMO."
awvl2m,Before You Do it
caqd5j,Porn sounds worse when you call it watching people fuck
dw1qiv,Found on r/pewdiepiesubmissions and thought it belonged here cause we need more memes
94z6j2,You have a power to become a superhuman.
8f38g2,Why you probably won't get 'superpowers'
aaie79,Progress isn't linear. Don't be afraid to fall a couple times before achieving success once and for all
b9pl71,"Dopamine levels on porn, sex, food & drugs illustrated"
bi0kbp,Imagine encountering the girl of your dreams and not having your masculine energy to approach her because you masturbated to porn earlier that day. Sucks to even think about it right? Then don't do it!
3sjpal,"Don't even bother with edging, it always ends the same way."
adtevc,When you play back the movie of your life...
7ng26j,"730 faps in 2015, 330 in 2016 and 6 in 2017"
bwsduv,What actually happens on nofap
9uoh8c,C.S. Lewis on Masturbation
7o9d1i,Seeing a hot girl while on a good streak
9rk38c,Porn is nothing but watching someone else fuck the girl that you're attracted to.
7yv6nx,The Iceberg Illusion
6xk1vd,I'm so proud of you.
7po0b0,When you're almost at two weeks without any urges whatsoever
a3h271,Thought it was relatable
7350z1,"US Navy SEAL, David Goggins, will inspire you to overcome any adversity. No matter what."
baqyut,"If you fight the urge, you get stronger. If you give in, you get weaker."
90p8c6,Daily Reminder!!!
8vhh0e,I have not fapped since November 2012
dnncw9,Giving up smoking is the easiest thing in the world. I know because I've done it thousands of times. - Mark Twain
a4qv31,Just a reminder. It all takes time.
5crla0,The Dopamine Challenge - are you tough enough?
dej9ob,"Ever wondered why ""Go Fuck Yourself"" is an insult?"
ce0uwc,How to tell you’re getting better?
aq82a6,Well.
b6eefp,Day 747
8c4b62,Your true friends
anw2q3,"Reminder: Stop posting that meme of naked or half-naked women covered up by characters in the foreground. Even if their private parts are covered up, it is still sexualized media and could arouse some users. This is a PORN ADDICTION recovery forum. Use common sense."
9d6l43,"Thanks to Nofap, I picked up hobby of photography and created my first time-lapse. :D"
8wgazc,So I heard you want to relapse...
c714ux,"Once you start peeking, or edging, there's almost no stopping. (Reminder post to myself and anyone else)"
cboxjg,1200 Days
94u5yj,I reached 365 days and relapsed on purpose. This is what I learned.
7vmyhn,Day 365. My story and final goodbye.
cmmvmm,You're a fucking king.
9aehkj,Today marks 6 days in a row I have worked out and had a cold shower
7nnt2r,90 days nofap vs relapse
di0dhl,"The minute you understand that ""social anxiety"" is actually being ashamed of yourself and that masturbation is the most profoundly and intuitively shameful act you ceaselessly partake in, your path and your reward would be very clear"
aeaxme,Day 70! Can i get a high five please?!
ca19bg,Don't put women on a pedestal
8d8i76,I decided to walk home from school (about 8 miles) instead of going home and fapping
bh29o2,Just beat an urge 😊
bpqeq7,"3 months back: depressed, no job, no life, no love, no purpose"
8clvba,"To all those struggling with nofap, a little motivation."
7r276w,We’ve all been there...
15lrh7,16 habits you should do EVERYDAY. (This changed my life) [FIXED]
8x6573,Did a self experiment and turned out exactly as I expected..
azeqxt,"If you're going through hell, keep going."
aoqp0j,My mom told me..
8lh6dh,The truth must be spoken
awjp37,PMO is like peeing your pants to get warmth. It's nice at the moment but then you're gonna freeze.
76nlnf,stupid brain
d6y5nu,I don't want girls to fall in love with me. I want me to fall in love with me.
9gxtxr,"How I beat urges. It might be harsh, but works every time."
9es84k,"Your brain will do anything to make the second one win. Stay busy and survive, stay strong brothers!"
b04nkl,Small victory in the gym today...
bg6k7c,ps: fuck you!
awtm0k,Here's why goals are necessary!
a498du,You are not missing out on good porn. Don't let the brain trick you.
9u6ft2,Just asked a beautiful beautiful girl out. She said yes with the cutest smile. I could not have done it without the confidence and good conscience that come with a healthier way of living. Thanks for your support everyone. Day 50. Hopefully she shows up to our date 😬😄
31o5xf,I think we all know the real reason behind his success
ckysw0,Urges are just energy
4xf35n,Terry Crews message to pornheads.
ct5zqm,"Today is my 25 birthday aaand i'm 180+ days fap free, smoke free and drug free"
9ho1mv,"Its just a bunch of C,H and Os."
9v053d,Today this lil boy help me with urge 😄 1 hour walk and I got my focus back
a4v3hq,Day 23
a01cdf,[Day 135] Me when my brain wants me to watch porn.
9qrma7,Go for it guys
d51y79,"A real man dosen't pretend to have sex with a woman through screen then cum on his bedsheet, that's pathetic."
aygz4i,"Deleted over 1000 porn bookmarks (over 7 years of saving). Is this how you'd begin the journey, or did I overdo it."
bifwwb,"""You can't go back and change the beginning, but you can start where you are and change the ending."" - C.S. Lewis"
a4y2lw,Definitely YES!
1b6etb,My reaction to all the boobs on the front page
coishv,Finally my first month without fapping ! :>
9lccy1,The sunset of day 20 since my freedom. I’ve never been happier
ccjwwz,Words from an Old Man
9uay5h,Keep working & believing in yourself!!!
7lqvnf,Be like Internet Explorer !
81zi6x,This guy makes a good point about what excessive porn use does to people
7z85lr,This is how I feel right now...
cv77w9,"If we are facing in the right direction, all we have to do is keep on walking.” – Zen proverb"
9d50vr,"Sometimes life forces you to step up, and IF that means quitting pmo, do it"
8kutd8,Instead of PMO i went out in the woods with my best mate.
27d6bs,What NoFap is actually about.
dxtgl0,Mid 30’s and 160 days hard mode - need to get this off my chest
8o7nt4,Guess who reached 1 year?
6xa21r,Who knows?
9fy2ru,"If you stop now, you'll celebrate Christmas having a 100 day streak!"
cmwigm,7 days guyyyys! I think I deserve to congratulate me!
5xorqm,Day 100!!! Possibly the most extreme NoFap transformation ever?
acffyw,Let the glass of water go
9n63gc,Saw this post by LAHWF
c6j43q,"To those that say - ""Don't Nofap for a girl"" ; you're wrong. Use whatever strategy you can to stop this abhorrent addiction."
bncdd7,I'm getting to 1000 days of nofap this year.. I can't believe it.
dpqz56,Keep fighting brothers and sisters.
bf7eq0,NoFap works because of one simple reason
95bscu,I think this applies to our situation as well bros.
c63qy0,Deleting my reddit account :)
9rvmwn,Brutal video on the caged addicted life we are living these days.
c9u8a9,"""that was such an amazing jerk off session, I feel alert, full of energy and happy with myself."""
d2ufae,"Neo: Why can't I fap? Trinity: Because you have been down there Neo, you know that road, you know exactly where it ends. And I know that's not where you want to be."
6ubqtf,"A Story about the worst feeling. ""Regret"""
b576so,"“My worst day sober, is better then my best day using”"
decozm,A list of productive things to do with your energy
bq5h0c,Finally Hit Day 90 🙏🏻🔥😭😭 after 2 years of Relapses
9cljs7,Relapse is not worth it
7wt924,After 60 days NoFap hard mode
2f5bht,I lost it all
6htzd8,Stumbled upon a Youtube comment...
bawlsy,"Instead of relapsing, I hit the gym and saw this on the wall. Beat your streak. Not your meat!"
80xwmp,The truth about noFap
cim883,"Porn is boring, you know what's gonna happen, that's the same movie but with different actors you watch again back and forth. Get rid of this shit man, when you're hungry you consume food or watch others how they eat ? lol"
a4006d,I GOT ACCEPTED TO AN INTERSHIP
bmkebn,9 days until day 90🔥💪🏻. (Ps: I relapsed 100 times until I got to current day 81)
9ax7jp,"Whenever you feel urge, remember the pain of relapse"
7vwlgo,It's never too late to begin
7udoia,Soul after relapse
98qt6l,The only good way to beat your meat
1hs8xw,How it feels after not masturbating for 2 days..
8atl9a,This makes me feel better NO MATTER WHAT
bhxoj6,A GIRL’S POV
b9ewi2,"Holy sh*t, triple digits"
7fh5ko,"Nervous to post this, but this is me when I first discovered porn vs. me seven years later"
9fgqow,"Had no urges, just decided to take a long walk."
c0sidz,"Just Deleted 452GB of Porn, I'm Serious this Next Streak"
buga5b,[Why porn is free.]
bthpcv,What not fapping does to your mind
78vjq4,Just say no 🚫
abc5ij,Snapchat is now trying to convince people that porn addiction isn’t real.
8xhbvz,Be strong.
a51ufo,This one gets me through it all
cv05rr,35.5 years old. I must and will transform my life. 6 weeks. 100 days. 6 months. 18 months.
940vt1,Be this guy
8ii5jf,The Climb
