post_id,title
du5u8z,If Only I'd Have Known Back Then
duumhs,The porn industry and its friends are trying to take NoFap and me down with defamation and deplatforming. Enough is enough. I've filed a federal lawsuit. Defend NoFap. End the harassment. NoFap.com/defend-alex
9tkbf2,Shit!
8l06vc,My Darkest Secret...
ay1vq5,Found this to be particularly telling
bykz0k,This gets me up to workout every day!
dwcpyx,This stuck me deep
crm69t,"My crush that previously ghosted me and called me names like chubby, and weirdo, and nerdy, ugly just texted me this morning. She told me I looked good and she was wrong about me and that we should go get coffee one time. I confidently told her to go fuck herself."
c7tbkg,The real cost
bi9atn,Something to get me to 100 days
cn4pmf,I thought this would fit here :)
drs4sa,"Stay strong. Be like Bill, guys."
dazcup,Pathetic.
dc8ben,I think this belongs here...
ducm8d,Absolutely correct......its effects everything.....
dqkaed,Thank you community for the huuuge support😁😁
blarjg,Motivation for today
8lwp1z,Every guy on NoFap
b4wrfj,Be carefull guys!
a8z5ig,Boiiiii
cswrno,It's no joke.
b5o3ig,Porn industry ads vs reality
ccqexk,MOTIVATION FOR ANYBODY WHO IS THINKING ABOUT RELAPSING!
dsxt2y,Ah shit here we go again
dfxqbx,He is absolutely right...
bfvcy2,WE IN CONTROL 💪💪💪
c5o8g3,He's right!
8tyxli,"The challenge starts now! Join me, bros!"
aqn0iv,Don't buy porn sites' lies.
9t3mcu,"November 1st, beginning of a journey. Wish me luck."
dv3b5x,"For those like me who didn’t succeed this NNN, remember this."
a1hfjq,Don't fall into the trap.
a5eu75,I thought this will fit here
b3hlwq,"The fact that there are anonymous people on the internet who help one another in a fight against modern man's biggest and most quiet addiction is just a testament that there are still some good people left. Be proud of yourselves, all of you. You are the 1% that has decided they own their life."
btz04l,Motivation for getting out of your comfort zone
dlkcjq,For all of you struggling out there!
c2tx2q,Hey bros. If u didn’t relapse last night raise your hand and be proud like me 🤚🤚🤚🤚🤚🤚
dq3rsy,"Guys raise your hands if you ""BELIEVE"" that you are not going to burst a nut during No nut November"
8b4qdb,When you finally take control~
amfbhp,Good luck everyone
acva2l,"Reddit interprets this one way, we interpret it as the complete opposite. Fuck Pornhub, when things get hard, we deal with it like men."
agk9na,"Fightin' urges! This came up on the emergency motivation tool, made me laugh!"
77ibqh,Most Successful Male Pornstar Of All Time Speaks Out On Porn
dr9toq,Couldn't have said it any better!
a7ye6w,Feels!
cg7xl2,1st image is the urge and the last is where you feel like a piece of shit.
buua3a,My dad died today
drg4vl,Fast Browsember
b2609z,Some motivation.
8702yn,Thought I'd share this here...
dwqdv9,This helped me through my 26 day streak and counting. My personal best so far.
at3tkh,Think about it.
d1bl5i,Saw this on r/GetMotivated. Decided it should go here for the bros.
9xx8an,Perhaps the perfect motivation
dsg1wp,Every single time
8m6pdn,NFL: NoFap League
cnkl6a,Somebody Clap for me 😉 I'm 53 days Porn free 🙂🙂🙂
b81712,Don't be like this
c92r4n,Know which way you're going if you keep relapsing? Read this.
8k3kv9,truth
af8p3d,Temporary Comfort
bg0aft,...
d8p82s,BEFORE YOU RELAPSE...
7axcam,Hey! We made it on a starter pack!
b2m6yj,Time for NoFap
db6i5g,Laws of nofap.
arjgm6,Be like this tree
8g97eq,(Re-uploaded) a beautifully illustrated comic about the sexual energy! 💓💓
920ole,I love this photo
ckmxtn,You're an inspiration...
dcqm7b,A GENUINE WARNING FROM A LOST SOUL WITH GOOD INTENTIONS
ck1r2j,Listen to Rick guys
9wckfg,Things to Consider: Cold vs. Hot Showers
anrfww,Yes please!
dqwuat,Benefits after 50+ days of Semen Retention
cvq7nt,Listen to JC guys!
aav46o,Don’t be this guy.
bx0zr8,"no fap is not about getting laid or being liked by your crush, its about not fucking your own hand, its about not watching a man fucking the girl in your dreams. stop being a cuckold. be a man, improve yourself, give yourself tasks to challenge and make your self valuable."
7glbjr,All we endure is for our future self
cyqxso,DAY 1000
aioqzm,Be better!
c2b1xu,I am the wife of a porn addict and I want to tell every single one of you that you are amazing.
bb71md,My favorite motivational quote
9ysihc,"I deleted Instagram from my phone. Now I can't share my pictures with friends, so I'll share some here with my brothers."
dx6c9q,100% True
dvbk3h,"Day 1 Update: The NoFap community and supporters have already almost raised $30,000 dollars in just under 1 day for my federal lawsuit against entities who are ""cozy with the porn industry"" who have been ruining my life and NoFap's reputation with defamation. Thank you so much for the support!"
adifl9,Doing nothing at all vs. making very small consistent efforts.
cem1p9,"Having conquered my addiction to PMO, I've finally got a girlfriend! It took me 3 years of trying and failing to get here, but I couldn't be happier. PMO does not compare to the company of a real woman. To anyone who is struggling, don't give up, the journey is so worth it. Stay strong!"
9zqhxq,Facts!
dt3e5x,Control those urges!
7dz7mo,'Tis the plan brothers
84jucq,Asked girl out at the grocery store
bgf0sm,HABITS AND LIFESTYLES Will soon come
6uh60b,When you hit 90 days
ad5j4f,"Nope, not happening again! Stop PMO!"
dry442,Progress Not Perfection
doco64,Something to motivate people
9bloct,PROMISED MY DYING GRANDPA I WILL NEVER FAP AGAIN...
a4lait,So sick of this addiction.
9ryvqw,I just found out how my girlfriend sees our relationship
a0wr0h,7 months streak + no alcohol + no smokes+ no marijuana + Regular running +Regular meditations + high in spirits
b1rq8e,My NoFap journey so far
dmqdua,KANYE WEST just came out about his porn addiction. Stumbled across a Playboy at only 5-years-old which led to a lifelong addiction that he only started to address recently. LET'S SEND HIM LOVE AND ENCOURAGEMENT for speaking openly about this issue.
bhk7sy,I lost my girlfriend today.
cgzern,"Remember, my Brothers. Porn is Temporary, but the Glory of Rome is Forever."
ayv317,"My longest streak of 32 days, my wife is unaware of my 15 yr PMO addiction, but she just told me this..."
9u3koi,Don't do it friends
cd4hdr,I made a new deal with myself. Going to plant a tree every time I relapse. Relapsed yesterday and planted these Five.
bagoks,"Putin Bans Porn In Russia Due To ""Damaging Effect On The Mind"""
bkvkki,Comfort Zone Analogized - Why talk to girls when I can just jack off?
abg802,Happy New Year Fapstronauts
cjbj9s,"Pornography is a relatively free drug & you can have as much as you want..... no! It's not free, the cost is your mental health, inability to form connections, depression, erectile disfunction, anxiety & the list goes on. I'm not paying the cost anymore & neither should you!"
93dv52,You're Fighting The Wrong Battle
7fxekw,"""I don't know why I'm depressed"" starterpack"
dq7q1a,I'm sure none of them is here!
bovov4,Hmmm
b0zcfj,"Day 49, everyday waking up at 3:30 am to row and this morning represent to me the time of my life"
acqob5,YOU CAN DO IT
al0ztu,I see this on r/dankmemes
bm4wr4,So who’s behind all of my problems?
c834u5,This view is way better than porn...
deyakt,Every relapse puts you further from success!
8lkomv,Me last night
d1ysue,Best way to combat porn
ax5exr,Hear it from the greatest meth cook of all time himself!
btjxxw,"I will go the entire month of june without porn, who's whith me?"
ca9hw8,"Instead of PMO I chose to read by the river yesterday. Today, a coffee shop. The road has been tough but I'm hanging in there. I hope you guys are too!"
btuost,I Just Walked Out On My Date
auy30u,My way of counting the days.
auf903,[Day 5] Could have stayed home & relapsed. Instead I climbed the tallest mountain in Wales. Get friends that force you out of your room & fill you with confidence.
9qc0tw,Whatever you do NEVER give up!
9xqojn,It took my a long time but I finally did it boys
a1tvq8,Thought this belonged here
8hefjt,WOKE
c1vcof,Post-Relapse feelings
dcsblk,Nofap
ddu6x9,"The fact that there are anonymous people on the internet who help one another in a fight against modern man's biggest and most quiet addiction is just a testament that there are still some good people left. Be proud of yourselves, all of you. You are the 1% that has decided they own their life."
1di0v1,Every single relapse
ac206v,Pls don't masturbate!
cqb95k,Day 68. Feeling fucking great. Just dont give up. You got this. Please stay positive.
a31lvx,I made this to help with the brain fog
ad9oeg,Reminder
bxtkdb,How it feels the first time you try cold showers
ag0ugi,Porn is the “cigarettes are healthy” for our generation.
csdh70,"There are 135 days left in 2019, who here intends to make them all about recovery? Who here will not waste a single one? Who's with me?"
8004rk,It always gets better. Just keep pressing forward
bzsy6i,This is what porn addiction looks like:
c4i83j,Why NoFap Might Be Killing You
87hqz9,Truer words have not been spoken
a70a31,The Human Trap
do11k9,Some of the realist words ever spoken 💯
d9cet2,"To all of you who beat the urges in the last 24 hrs, well done."
b8ha7c,A person who is a master of patience is master of everything else
co7pea,"Congratulate me on my 900th day, please, I beg you"
au27wy,Sincerely
8tgo7m,Thought this should go here as a reminder.
blf0ni,Truth
a3qluy,He’s not wrong
b6tzvt,A porn addict peeking at porn is like an alcoholic gargling alcohol telling himself he wont swallow.
czos2c,"""I fantasized, I might as well peek. I peeked, I might as well watch. I watched, I might as well edge. I edged, I might as well fap. I'm fapping, I might as well O. I Oed, I might as well binge."" DON'T. Don't give in to Escalation."
dqqon5,Just a friendly reminder :)
8dvswq,Find 3 hobbies.
diunxy,Don’t be like this
8aoqjc,This
9tenhl,"I failed No Nut November last year, lets make this one count boys."
dp8zd3,Dont be this guy
biof28,Important notice:
dgcsv8,You know you're addicted to porn when...
bg63oa,Tfw when you loose your streak
8x0iej,One thing I hate more than porn...
c9e38t,"If you do not take NoFap seriously, read my story."
ctae8a,We got this.
99cfxj,Found that on Instagram and I think it fits in here.
bwhwve,Everyday matters. You can do this.
9r9m1l,True dat
dpm3bk,Endure
bmm5zx,"No matter how loudly the reward circuit in your brain ""yells"" at you, it's lying. You WANT porn. You don't NEED porn."
bjzurx,Interesting Fact : You can't breathe when you Smile.
ds6uw4,"To all of us that beat the urges in the last 24 hrs, well done."
cftuvw,Imagine how incredible you'd be one year from now if you stopped fantasizing about a better life and instead actively started building it.
8jv091,I think we all owe this guy an official thanks.
dppibm,Tomorrow is day 1 of No-Nut November.
75igwc,this is what 'YOU' can achieve after 'X' amount of days!
as2pbz,Pathetic
dtfe9b,"I will be 500 days few days before Christmas. God is good. I tried and tried and tried and tried and failed. But kept at it. So, Keep at it!"
ccbl4q,You won't PMO anymore after you read this!
9yn7fm,"Found this in my fortune cookie tonight, I think we all could use this right now..."
avtlqy,"After many years of trying with varying success, I finally made it past 90"
ab6ypk,"Let's fully commit to NoFap lifestyle in 2019, who is with me?"
dk1j9b,"Ive Spent a Total of $51,419.93 on Porn..."
arargg,"I just had sex for the first time, it was nothing like I expected."
63t5sm,Lol we can all relate
boe9ds,I just realized that the NoFap subreddit has passed the porn subreddit.
bjfepg,What we say to the urges and porn?
c1pwze,The LAST post you should read.
8v1nvv,Stop being a doofus
ahg11d,This is what YOU can achieve after 'X' number of days;
d8732k,"Day 541- Mission complete, goodbye my friends. Final and full recovery very close."
as9di4,Try to be more like SunnyD💯
b6nj9x,One of my favorite funny twitter accounts was high-key preaching
cpvdex,"Most of you have probs seen this already but for the new ones here, this helped me alot..."
dbevnx,"If we make it through October without PMO, we will begin No Nut November with a 30+ day head start! Who's with me?"
7tvkx7,The irony....
6v8337,"When you trade your time, your energy, your mindfulness, your productivity, and your self-respect for a brief, artificial dopamine fix"
do88o0,"An Egyptian author called Ahmed Khaled Tawfik once said: ""When you give up some type of addiction, the biggest problem for you will be your free time. When you beat your free time, you can beat your addiction."""
bea6hd,Advice from Saitama
bb0g50,Tomorrow is the day I present my senior project!
8iusa6,Interesting take...
85phbs,Quit PMO. Focused my life on something worth while. Trained to be a Firefighter
b45548,"If you can beat porn, you can beat anything."
arwxup,"I had one of my most depressing days yet, so i did this to feel better."
a9zvim,This quote belongs here
a2d9x3,"Porn is like hacking a video game, no work, no challenge, cheat, win, be bored and end up quitting not being able to play the game normally anymore cause there's no point anymore"
cdkk9l,105Days & Still Going!
a0v2ta,Gotta take it one day at a time
9mz32g,New anti porn phone I bought for myself
bvan84,Let's make June our first month without PMO! Who's with me?
bgsg99,My father has been diagnosed with cancer (Stage 4)which isn't curable anymore and what my mom said made me cry like hell.
bd4j6k,Went on a hike instead of being alone in my house.... What a freaking view!!
a7leka,You think you have time..
bcb7z4,Woke up early for the first time in a while for my workout 😁
7mim17,don't let life pass you by
bzggjz,That's the truth
8p7pkq,Instead of wanking I took photos of baby geese how fucking adorable are these guys
c8ae9m,"It’s better to conquer the very peak of Mt. Evans (14,265′) than beat your meat in loneliness"
cr8gwz,"You are gonna nut in 4 minutes but you gonna regret it for 48 hrs. Think about it. Go play ball or do push ups, or something."
czylt2,"99% people here OVERSTATE NoFap ""superpowers""."
cgnkw0,My day with a porn star in Miami.
7ynite,When you finally hit 90 days for the first time...
cnxfbl,SOMEBODY CLAP FOR ME 😄😄I'M 241 DAYS PORN FREE 😁😁😁
dmuh7k,Day 364. Proved everyone wrong a million times but they still won't give up 😂
9z6ngv,"Unlike porn, these are good pixels to look at."
afv97n,Keep working hard bros...💖
dozwkg,This made me think of y'all
dxggx9,"If you stop fapping today, You'll hit 90 days on Valentine's Day."
c05kz9,"Made it to 30 days for the first time. I'm feeling no super powers, no beneficial physical changes, nobody notices my progress, no girls giving me attention. But you know what?"
cu0e3n,"Stop with porn, do not watch it ever again! START TODAY and celebrate 130 days PMO free by the end of the year!"
a3ae9d,Reminder
83f9rp,When you relapse.
bj21m8,Today is a gift.
9wyxtj,Sex vs Fapping
8rj577,I think everyone should watch this video to get a better idea on how to get better.
bse3a3,NoFap is NOT about avoid fapping.
dtu77h,"A month from now, you can either have a month of excuses or a month of progress."
b0e5a0,I mean he goes back to the light side in the end. Stay strong friends!
8s5a00,I found this posted on Twitter.
b7qkn9,"Had urges, went instantly walking for fresh air. :) South of france"
89f9mc,This is DEEP!!!
8w2u06,"I mean, he's not wrong"
8e5e06,This is how it works. Stay strong!
8tu735,Saw this on Instagram. PMO is our trap
dinxab,"A little shaky in the early going’s, but finished strong"
cpbp3n,"So after finally making 1 week of Nofap, after struggling the entire year, I’ve decided to celebrate by printing out a list of Daily Goals which I hope will become the back bone for who I am. Keep striving to be better no matter what. WALK AWAY from all bad habits."
dknjca,"There’s a passage from a Kurt Vonnegut novel where a man shows another man a photograph of a woman in a bikini and asks, “Like that Harry? That girl there.” The man’s response is, “That’s not a girl. That’s a piece of paper.“"
9yfiiq,I think this belongs here too
biu9kg,When the urge kicks in
8ix04p,"Saw this on r/funny, knew it belonged here"
dxlmpf,After two months of nofap I noticed something else than the usual things that come from nofap.
8mybl0,That’s all
aii3l7,What I see when I look back
d7bd9o,1000 Days of NOFAP BABY
cfcne1,“What a disgrace it is for a man to grow old without ever seeing the beauty and strength of which his body is capable.” Socrates
c7g16h,"For those of you who didn't make it through June (including me), let's try again and make July our first PMO-free month!"
d5unb7,5 main rules of NoFap and a list of common excuses for PMOing
8z997a,You aren’t sleeping with them. You’re sleeping alone.
d927uc,We have been brainwashed from the start
5bzem1,"If Trump can win the presidency, I can sure as hell stop fapping!"
bkopbh,Planted it when i started ... This plant will show me how far I've come along
a95fi5,6 Bad Habit Replacement Ideas for a Quality Life
aciqfn,Who Else’s 2019 Has Been Fap Free So Far!🤙🏼
azyljw,Thank you guys so much! You guys are the best:)
dl0aue,Is there anybody else on NoFap because they want to kick a addiction or sort out a problem in their life and NOT because they think it’ll magically get them a girlfriend?
dhm7td,NoFap wont work if you aren't practicing self-control.
9vtddk,[fuck porn] Opened browser in class and everyone heard the moan.
bx83cj,You might regret masturbating but you'll never regret not masturbating.
7y60bz,Temporary comfort
9xez61,Chris Rock on his porn addiction
9q528j,"Reason why after 15+ days, people on nofap say that they have high self confidence."
c8n03d,"Porn is like a desert mirage. You are thirsty af, and it seems like a great option to go there, but when you reach it you are tricked. Self hatred, a lack of energy and depression ensue."
a9fzxo,Fortune cookie hitting the nail on the head
8i5o1t,True
c3e2iv,"ProTip. When having urges, tuen the camera on and just look at your own face. When I do this, I get some kind of realization that what I'm about to do is dumb. Try it."
ay9z5i,ORGASM MAKE YOU FEEL GOOD FOR 5 SECONDS. SUCCESS MAKES YOU FEEL GOOD FOR A LIFETIME.
bnckc3,That guy in my class
2f483b,my reaction to all of the leaked pics today
91q3os,Got rejected tonight and usually I would relapse to numb the pain. This time I went for a run and decided that I will improve myself completely. No more regrets!
adg872,"A relapse is temporary, your willpower will remain and grow stronger."
bdz93n,"I'm on day 44 and it's actually getting hard , so 1 up = 1 additional day ( max is 100 days )"
9mvqcx,Don't be like this guys
ahmz8f,"What if NoFap doesn't give us superpowers, but porn hurts us so much we forget how it feels to be healthy? 🤔"
dy2tw8,So I just found this in my pocket form years ago. Stay strong guys 💪
cig39y,The goal of every living organism on this planet is to reproduce. This means that sexual urges are quite possibly the most powerful urges which exist. Think about how badass it is that YOU can control these urges. If you can do NoFap...you can literally do anything on earth. ✊✊
a8p8bi,Anon saw it coming
cqlnt5,"Isn't it ironic how porn sites are full of ads about curing erectile dysfunction? If you stopped watching porn, you wouldn't need those pills in the first place..."
akgmtv,72 hours. This is officially the longest I've gone without PMO in 11 years. My first tiny victory of NoFap.
av7fzf,"+4TB deleted, 2 accounts deactivated, over $1500 in custom videos gone in 5 minutes."
7viiq7,Just a reminder..
bvzoci,/Dangerous side effects of NoFap\
9t9b8c,Make it happen
8a18h4,How to Stay Clean ( This will Change everything!)
8mi6kx,Remember This
6swqr2,I ripped off my bedroom door so I would stop fapping #commitment
c56kwx,Reminder that you can have a 190 days streak by New Years Eve if you stop watching porn right now
deqp22,"Stop trying to push yourself AWAY from fapping and start pulling yourself TOWARDS your goals. When you climb a mountain, you're trying to reach the peak, not get away from the bottom."
906bm5,She's right you know...
8biq5p,NoFap in a nutshell
aw95or,You’re well overdue.
dj8sbl,Guys since 16 till 21 i was a hardcore porn watcher . Went into depression and flunked college . Now it's been 100 days i haven't faped nor watched porn . Going strong !
bl5teo,Didn't want to relapse so I went on a walk. Ended up finding this.
dfg3m6,Save this image and read the quote whenever you get an urge!
clg196,The longer you go on no fap the more you realize how SERIOUS of an addiction it really is.
akbtwd,"Been there done that, please don’t"
80pllj,Day 90 at last. I understand that this is a tradition now:
9vjg0l,It really does...
aohryo,Quit porn while you’re still young.
93y0xg,"Day 17, feeling much more confident."
cw4704,Give up 5 seconds of pleasure a day for a life with 5 times more pleasure
bs57fk,PMO is like a donut 🍩 it’s sweet but you’re left with a hole. So next time you’re thinking “donut” try thinking “don’t nut”.
bjn7j8,I think that pornography addiction should be part of the sex-Ed curriculum
cmf26y,The reason I love this sub.
917hlt,My father just killed himself
8wtftk,Don’t be this guy.
a2vi7b,Burning 5 decades worth of Playboy magazines
1ydnvm,How I feel immediately after I fap
chqluf,2 more months and I officially hit 1000 days of nofap!
c44k2i,I would bet my dick that 90% of nofap posts are probably from post-nut clarity/guilt.
9h693i,What I've Learned in 9 Months on Nofap (The Don't Give a F*ck Mentality)
d7om89,"Internet pornography, is like going to a restaurant, spending the evening looking at the menu but then just filling up on bread and going home unsatisfied each night."
cwmvff,"Why isn’t Porn Addiction an official mental health illness, but video game addiction is?"
akv24z,A great reminder from r/Stoicism
ba36rq,Urges are nothing but addiction leaving the brain.
99s9kv,It’s all up to you.
aq5q5c,"Society be like ""porn is good"" meanwhile in this community we are dealing with an abundance of minors who are suffering the negative effects of their PMO addiction, it's honestly ridiculous how normalized it is."
bozgc6,Had an urge so I just went to my backyard to enjoy the day
6eg82z,Tiger Woods on NoFap
90xpnp,Got this from another subreddit. Hope this is meaningful.
8usmnz,Remember THIS
82aibe,Life after nofap
dm9t4g,Go to sleep
dw6b4s,A warning from a 65 year old man: nip this in the butt now. You will thank yourself later :)
ancw0h,I wanna tell every fapstronaut .
cylo6b,You can you experience 120 clean days by 2020 if you start right now
9hxv9z,Stop fapping today and have 100 days on New Year's Eve!
a075uo,"Instead of doing it again, I made this meme for us. Take care of your brain."
asp89g,Be the person Uncle Iroh knows you can be.
dvy1jx,More attraction towards “average” looking women
bpbgeo,"Everytime you watch porn, you are a cuckhold, you are Training yourself to be that Person, watching People fucking the Girl you want! ist that really what you deserve? do yu really want to be that guy?"
8gyyk5,me after 7 days
d0fhg5,"Nofap shouldn't be a challenge, it's a lifestyle. Stop counting days and start living!"
bzzaz1,Better a hungry beast than a satisfied sheep: Why you need sexual energy
aaar0r,Don't Peek. Not Even Once. Or Else The Urges will Swoop Down and Get Ya.
8hp09o,"...and stop PMOing, definitely STOP PMOing!"
d3oyru,After 30-40 days something happens
a4fruy,"Depression hitting hard rn, at the park listening to music."
628pyp,This sub takes some shit way too far.
cgtgph,"You might regret masturbating, but you will never regret not masturbating."
6pn0v2,It's a trap
alltxz,"I think the best part about Nofap, if you don't lose your streak, is that you can have a shit day and not get anything done and still have progressed on something."
c18wvd,"The 90 day reset, why it works and how you used it to become addicted to PMO in the first place. (why you relapse answers)"
dvoktm,Self discovery during NNN
9c7nhz,Some needed motivation
b0notn,"Two weeks, too strong"
cs2nlt,Haven't fapped in over a year here are the benefits:
a2oikg,Early morning motivational quote
8qb9jy,Saw this on Instagram and thought I'd share it here. The damage that PMO does is scary.
82w330,Truth from the depths of hell itself
a51gu6,*For all you 25+ guys who haven't gotten laid
aalibc,1000+ Days of Nofap Yearly Highlights. The power of a man lies in his seed...
9j2377,This belongs here.
bzlvki,6 things that will happen to you if you keep watching porn
9m57gv,"Finally and after more than 7 years, I did it. I fucking did it. I hit the 90 days mark. My life was never better. Fuck porn. I'll never watch that shit ever again. Ever."
duru90,Keep at it!
8zxo3v,Get ya hands off that meat! Pay attention on life!
7cl8jr,May we all awaken our powers
cdu7i5,"You were not born on earth to please anyone; you have to live life to express yourself, not to impress someone. Don't pretend to be someone you're not, and never lose yourself in search of other people's acceptance and approval."
cfksta,“Suffer the pain of discipline or suffer the pain of regret.” – CT Fletcher
dxf8bh,Fuck you Vice
8sw596,"2AM, went for a ride to avoid PMO, took this pic that made me feel alive"
bqg5bi,I TOLD MY GIRL ABOUT NOFAP and she said
dqmqn7,Stay strong boys
b7ur70,GET THE F*** UP!
b7d3ek,Kissed a cute girl within 1 hour of meeting her.
8nnkpf,"My roommate and I promised each other that we would get the other a cake when one of us hits 90 days, and here it is, in all its glory!"
88ula8,An illustrated comic about Sexual Energy
ajbdwf,"16 years old, 400 days NoFap. Quick thanks to everyone, this'll be the first and prolly last time I post here."
a9au9k,Exactly
