post_id,title
cajgoc,Face it guys!!!
cve5cm,Think about this for a bit...
9z122p,Till I collapse 🎼
6znald,Pew pew
6qqqkv,All it takes...
dq7w8n,Some light on the darkness.
882hlb,When you stop watching pornography
9js2pm,FACT OF THE DAY
7oj6f5,Nofap Benefits timeline.
7qxhic,When you go out in public after you relapse
9p8a2q,Fight! The new Drug
8z1nzj,"I had urges, so I made a meme"
8y20w9,Giving 1% more everyday instead of 1% less.
1jsoz7,Please don't laugh - this is how I've now gone 2 weeks porn free.
b4mbq1,Porn now turns me off
cq48dz,I went on a date with a beautiful girl today. For the first time ever.
blm6zu,Reliable and scientific sources what semen (absorption) and masturbation does to you. You are welcome.
d2bae8,My truth about female attraction and general magnetism on NoFap
8m2cti,Every time you fap
7qdbov,Guys sharing their superpowers stories like
cmg9a7,"Was about to relapse, went instead to the vineyards! I also wanted to thank all of you for being such a nice community, and that we can grow together!"
dlts8u,“The porn industry telling you that NoFap causes prostate cancer is the same as cigarette companies telling you that not smoking is bad for you.”
dcfpkn,My Fucking 190 Days (41 yo)!!
8cf4tm,But what are the benefits and why should I start in NoFap?
dqjsb6,Can I post it here
3mz7ah,"I have bad news. missyaley, one of NoFap's moderators (in charge of our accountability group for women), has passed away."
1aixwg,The difference between Day 1 and Day 20. 
8gpgog,You know deep down there's something wrong
173oba,I once went eleven years without fapping...
8j3d0v,One thing I can assure you of...
837l9u,The consequences of masturbation (1947)
99n9xc,Words from an Indian guru
aokfuq,"Unpopular Opinion: If you’re on NoFap for the sole purpose of having sex, then porn has done more damage to you than you realize."
aewxv1,The fact that the question “Who is your favorite pornstar” is at the top of r/all really tells you how much this problem has permeated into everything
9omcwo,Hmmm
7a5ucy,"Porn wires your brain to become a ""voyeur""."
a8ae1a,Some information
dgsqbf,NoFap is the premium version of life.
ch1u95,Porn is a drug.
92ueyh,Old me/New me
7lmm2s,"When you accidentally find a friend's Reddit account, and see that they are actively involved in Nofap"
9hguhv,Even my local Chinese Resturant understands
86nl95,Friend committed suicide this week
b2vnxo,Day 30 for the first time in my life! I Did it and here is the benefits.
a9phmv,YOU WILL GET THROUGH THIS!
b7jzkd,Protip: Don't make a promise to never watch porn again. Make a promise to never search for porn again.
95vo41,"I quit porn,i stopped fapping,i started working out,2 months later.."
dlbnen,"I've masturbated 18,443 times. I am 26 years old and it ends now."
8e28g7,Nofap got me here
9k64nm,What I did with my free time (not perfect but oh well)
d5nc67,"PMO and me decided to break up. It turns out she was cheating on me with like 3 billion other guys. So, I took my stuff and left, and now I am going to find a girl who treats me with some respect. If you guys have dated her too, I recommend you call it quits now. She's a soul sucking vampire."
9ez4tl,If you to do something. Do it now.
bkj32c,"As the month of Ramadan approaches, I will be attempting my first 30 days streak!"
b946ke,Day 368- Something strange happened on day 366
7l0etv,When you are on nofap. But she's cute af.
dp7mbv,"Whenever you’re thinking of relapsing, thinking “just one more time...” say one of(or all) these out loud:"
cea6cn,"The past is gone. There is really no point in dwelling on what might have been.The future is ahead of you with white pages nothing written on it.What you’re doing today is the pen 🖊 that will decide how tomorrow is going to look like.Day 47!!Y’all are amazing ppl, and I love every single one of you"
bffoaq,Day 55— “I like this new version of you”
ajq7mk,"NoFap has 400,000 subscribers (community members!) on Reddit!"
86yn5m,"Really wanted to jerk off, but went to the moon instead."
c3qt8p,"Peeking/watching porn and telling yourself you won't masturbate is the equivalent of al alcoholic going to a bar ""just to socialize"" and won't drink."
9jygof,It's time to stop this once and for all.
ddc048,This thing shocked me
a62idm,2019 lads. 2019 .. stay strong !
11boq8,My vagina after not being touched for over a year
ariu22,Told a girl how I felt tonight
dneh3o,32 m and single. I simply have no energy to socialise. No interest to do anything until 5 days ago.
a8i58s,Porn kills love.
dg4whr,Just a little reminder!
8l5zzq,When day 7 comes and you can actually look people in the eye
8vcomr,Pleasure. The Subtle Art of Not Giving a Fuck.
8rfbds,Don’t be that guy
76v432,Truth
ag1c8q,"With the help of no fap, I've found new ambitions. 3 days ago, those ambitious became reality."
br8x66,I Finally asked her out..
84xczc,For those struggling:
6wz1sn,"If you've just relapsed, you have to know that ..."
c6ervn,Terry crews and porn
cotn1q,That genius kid within me I thought I lost forever is coming back
80bii0,Experts Talk About The Effects of Porn on the Brain
5u3vn2,This is the greatest quote I have ever read.
4cy299,"Hi, I founded NoFap back in 2011. Through the past 5 years I've experimented with abstaining from pornography and masturbation with mixed results. It just doesn't feel worth it anymore, and I've decided that I'm done, and wish that I never stopped PMOing. Here's why. (please be open-minded)"
1dag1i,Welcome to NoFap!
9c4pio,Those who faped. No worry. Always Be positive. Start a new journey. You can do anything... Stay strong 👍💪
8j2bel,One month clean
bvo1cj,You’ll never ever finish watching porn and say that was worth it
b1heep,Goodbye guys
9k7lnq,"Instead of beating my meat, i'm working hard for my exams. Day 76/300."
9g7aui,Be like me and study quantum physics at 4:43 am instead of watching porn and fapping!
7q64tn,Stop scrolling for a moment. Take this piece of motivation before you move on.
8xbr7m,From the book ‘The War of Art’
d5waar,Found this on r/suspiciouslyspecific but I think this belongs here. Might be a trigger.
c8s0mr,Doctors taking me off anxiety medication because of no fap
a5rojj,An Interesting Title
czhmu6,Relapse doesn't set you back all the way
9gb66g,"From now on, we grip this instead!"
8n8hw5,Do not allow the thoughts!
akw5hc,A quick reminder for our men of honor
7sl253,Thought id leave this here...
c0wiqz,"REMEMBER how DEPRESSED, REGRETFUL, USELESS and SHITTY you felt when you gave in the last time. REMEMBER the reasons you had for saying ""I'M GLAD I DIDN'T DO IT"" after resisting."
8fcb99,This is why we fight 💪
7rldpa,Maybe if I just edge a little bit I can get rid of this urge and keep my stre...
8l8z7w,"This was posted on r/memes. Problem is, it's only a matter of time before that dam breaks.."
7ar4fp,NoNutNovember
7gfwo7,This is how porn is ruining your life...
8c0cdl,Relapsing is Your Choice
ahaij2,Nofap made me come to the saddest realisation of all
8mb0x8,After 90 days - Here is the new me... The picture speaks for itself.
bwa18k,Ghosted on first date
898djw,I was gonna relapse today after 3 month but luckily i saw what i wrote when i was done mediating last night
8le3ip,Bingo! Isn't this basically NoFap?
6y263k,Yeah pretty much
2ederd,How I imagine people with 100+ days avoid urges.
b0tvgf,(17/M) Refused nudes today.
6k83ip,Dammit Morty...
bmybz6,"They tell you it's natural. If that's the case, I'm gonna be fucking supernatural."
9hc41z,Every urge I get disappears whenever I see this pic...amazing how weak the human being is until we THINK
8wyx7w,Found this on Pinterest
amyykw,You can't change even the past 5 seconds. But what you can change is the next 5 years.
a9x12y,Mom caught me...
ch648b,I’m a kid wanting to get this addiction out of my life
aou6xw,"Repeat after me: No matter how shitty life gets, I will never relapse!"
digpus,Advice from a 28-Year-Old Man.
758z3z,Patience is key.
7wz2eh,"""Road to success"""
5lftrm,I am so Proud; Finally my 1 year report
9e3oxg,"Fapstronauts getting their life back, be like!"
d6m8fj,"Rome Was Not Built in a Day, But They Were Laying Bricks Every Hour"
8aglza,I was edging and then....
ckj8qp,Asked a girl out today
6o8pdd,NoFap motivation
9p6p01,234 without masturbation. Here are my tips and tricks on how I did it and what helped me along the way.
7m90lk,Lies everywhere.
7i681f,Damn straight!
b6igms,#1 Anti Relapse trick with 100% success EVERY TIME - YOUR DICK HAS CHEAT CODES
a2in8g,Remember guy's.
8g7n9o,Exactly do not quit
82o9va,The pain when you relapse
bhcmyx,I beat DE and did it with my girl 4 times last night.
357axb,Terry Crews knows what's up
c26ilz,I ASKED MY CRUSH OUT.
9um3c2,My girlfriend cheated
9aieja,YOU run this shit
7hxfdz,Just saw this on Instagram...
brmf3q,I've still not broken my new year resolution.
9580hi,No longer a 21 year old virgin
bor0u2,My 75 reasons to quit PMO
8nk65s,I celebrated my 90 days yesterday by graduating High School!
c6y9a1,My First Kiss
9495o0,"Stop posting pictures of naked or half-naked people covered up by characters in the foreground. Even if their private parts are covered up, it is still porn and could arouse some of our fellow Fapstronauts."
cx40e9,"90 days, boys"
8dn5ul,Trying to resist a urge
8krkd7,Yes because you cause me to relapse all the time
8f9lvo,What happens when you are given everything and don’t EARN anything?
7s5ew5,Don't be ms. Puff
ao14z7,Something happened at the gym today...
8xyvul,Well...
88q52j,"1 April, but no joke"
1qg8sf,I hope this is a repost. Everyone here needs to see this.
b1cpns,Dont stay up late!
a0rbl2,👀
8dh7u3,What i thought nofap would be like when i started vs what it actually was during these 90 days of a great woar
814esf,Damn Trueee..
69n48h,So accurate
87xdz8,Change is worth a try.
do6za3,"Switch your mentality from ""I'm broken and helpless,"" to ""I'm growing and healing,"" and watch how fast your life changes, for the better."
abjgvy,Porn ended my marriage.
7vqirx,"I did it boys! First time I've gone through a whole box of napkins, only using them to blow my nose."
7kuoj5,Read this before you consider relapsing
ba9ggx,So why was it easier to stop drinking alcohol than it is to stop pmo you ask?
br3iqe,Tonight is my first real test on this streak. The Wife is out of town for a few days and I will need to keep it clean without supervision. Pray for me brothers.
7v2vb6,Think this belongs here
bml2i5,"German philosopher Schopenhauer called the post-orgasm moment of clarity ""The Devil's Laughter"" because it's when we realize we're slaves to a biological imperative uncaring of our happiness."
8ookzk,"I used to wank with my left hand. Now that it has nothing left to do, started to train writing with the left hand."
852zic,Take it One day at a time
7jg8cw,Great quote I found online after relapsing
zyl7m,These Spidymeme posts are not helping
dolgal,"Oh, whoopsie... looks like I just completed 4 FUCKING WEEKS OF NOFAP BABY!"
bjew55,I present to you Nofap bird ranks - which one are you???
d5ii6x,The Horrors of Porn Addiction (true story)
8qvych,"Day 60, had urges so I went to my quiet place"
9cymlv,-Michael jordan... FAILURE IS NOT THE OPPOSITE OF SUCCESS ITS PART OF IT.
6p8mce,The best motivation to start again after relapsing
9an29e,Thats for the people with social anxiety
9pi6hl,Don't relapse!
9gtu7v,Before NoFap
88edl5,when i see someone with 0 days
2f4qj6,The Nofap struggle
8t897j,"A little something for everyone that relapsed, like I did today"
bokevu,After 8+ years addicted and thousands of relapses I [19M] just got to 90 days.
atuinx,"“For after years of living in a cage, a lion no longer even believes it is a lion . . . and a man no longer believes he is a man.”"
d18ggy,Passed the 100-day mark without even paying attention!
9dv3of,To virgins and people who think women will make them happy
7coh5h,#NoNutNovember
9rtbv9,"5 days, the longest I've ever gone without maturbating in 10 years"
6k35m6,inspiring AF
13aghh,Don't be this guy.
bjcjv5,I wish i had never seen porn in my life
c14a2a,You don't need porn
aykeog,NoFap is 100% NOT PLACEBO
8sh9qs,Fixed it
6qiu78,Found this meme Hilarious
d9zpqp,"Porn is like a Mirage!! From far away it seems like on Oasis full of beauty, but once you see it clearly you realise its just an illusion that can provide nothing!!"
9bhihx,This so belongs here
80e3m8,Do it now🙂
805293,The setbacks were not easy but it taught me how to become stronger
cplzpg,Just a reminder that porn kills love
6jloi6,"Okay, just a little bit of humor to brighten your day!"
9c1dmr,"Free from fapping, Free to build habits"
9zl8pz,When life hits you.
8awgmg,endure the pain of discipline
6yy87o,I took a break from NoFap. Here's what I learned.
8ggfwf,I haven’t masturbated at all this month
6f1d27,Had enough of spending 10+ hours on the smartphone. Hopefully this will teach me discipline. Pray for me. :)
apkwyw,I'm (M49) an example of what could happen to you young men that don't face this head on.
da44p2,I did it guys!!! I asked her out
53k7t9,A list of all the bullshit you tell yourself before you relapse.
9t40tr,All of us walking into nonutnovember after Halloween night
8zb9hm,"Brain: Hey maybe you should mastrubate to porn today, Me: Nah brain im good"
