post_id,title
6ctoij,Terrorist Attack Right now in Marawi
azsmhn,"I wanted to give back to the Filipino community who has been so kind to me; I spent 6 hours at a “local’s” beach and cleaned it up a bit. I know it’s not a lot, but It’s a small way of saying “thank you.” #trashtag"
cmzd7a,This. I really don't get it bakit ayaw ng iba.
7r76pa,Mayon Volcano
74u1a5,Parking this here. The guy who said yes is a lawyer.
ck6zib,We are filipino developers and we just released our first indie game on steam! Please check it out!
di3igu,Pilipinas kong mahal?
4sg3d3,Philippines wins case vs China over West Philippine Sea
a6vtj8,Congratulations to the newly-crowned Miss Universe 2018
cg640o,"After vacation in the Philippines this was the first thing I installed back in the States! Never going back, long live bum guns!"
d15t78,Nani?!
dqwwvx,free ride happy life
dh59d7,Carlos Yulo — FIRST FILIPINO WORLD GYMNASTICS CHAMPION!
8gwtdu,Hardworking Filipino
7mzg5o,"Minsan, doing your job right goes beyond what's on your job description. Sending ❤ to that crew."
bgnaz6,Sorry just had to let it out
atadzj,What’s at the end of a rainbow? Pure Gold!
aueg3b,Kimi no Ayala
cy4bya,Meanwhile in the Philippines
cqlgfe,Rainy Night at Alabang Terminal
cfhbfb,Breaktime from all the news these days
cbtwhu,"Mangrove Rehabilitation Project (Barangay 83 Paraiso, Tacloban City) ctto Juan Miguel De Veyra"
cifbbv,I made a sorbetes cart pixel art!
c772uy,Street Smart 🏳️‍🌈
btaaw1,Omegle fun (Found on Twitter; Credit to @srslyrosaa)
c0th9a,"""Kung wala dun yung Vietnam, baka mamatay na kaming lahat,"" Insigne said."
cgdryc,PH team's SEA Games 2019 official Barong Tagalog by Francis Libiran
8rq0g5,Last Supper of Chickenjoy
clcmr8,Wholesome prof. Sana all
ccar6e,Yum yum yum
b455hz,Lolas be like...
cpmk2u,Baguio is a mood
dcl3bu,Sorry just had to let it out
dkcmlf,Modern bamboo design. (Negros Oriental)
ci94ei,There is an old Chinese Proverb . . .
dt9n6o,Pusit
by1kkn,Doggo tindero
csueyr,A Chinese tongue twister.
dxivhi,Protecting Filipino families since 1900s
ccxxqs,Alabang Palengke
cpc6r5,heheheheh
cxrdly,I feel attacked
czhr3y,sad reacts only
crx97g,"One small step for man, one giant leap for mankind."
coo8g2,It takes true talent to deliver a dead silent yet non awkward service
dhgykr,Nesthy Petecio — Women's World Boxing Champion. Two golds in 24 hours for the Philippines!
chgck7,Where the PH road ends. (travelworkseetheworld on ig)
ch6b5a,I love Philippines lmao
bogrzy,"Mike Enriquez folks. A brave and fearless journalist, straight up just voicing most of our sentiments this election."
d0abqn,Maligcong Rice Terraces 🌾
dedofg,"Honestly, Filipinos na mahiling mambara, mang smart shame, and mag de-value, in the face of a legitimate and debatable concern will be costing the country millions of pesos of possible positive, receptive, and intelligent youth that could change our country's tide and pride."
ckkco7,When your bro isn't a bro anymore but she's still your bro
cvyqqp,Pilandok (Philippine mouse-deer)
cri6yo,RIP to our Hero.
ckwcyp,"""Mga Gago"""
bb3gwq,Endgame
bg00x4,Earthquake posting megathread
as7o7q,Filipino barbecue is better than samgyupsal. Fight me.
c84j1y,A Philippine Visayan Leopards endemic to Panay and Negros (Photo by Pinoy Gonzales)
al9fvn,After 8 years of being a chain smoker I finally feel I'm doing something right
c5zdt9,A view from a thousand feet in the air...Majestic Mayon
6ir9zy,Senator Trillanes AMA ;)
6bh40q,"My Family’s Slave: She lived with us for 56 years. She raised me and my siblings without pay. I was 11, a typical American kid, before I realized who she was."
cvi2gs,A Filipino baby and her family on display inside a New York City “Human Zoo” in 1906. (from Pictures in History fb)
b4fcdf,"As a Filipino, I definitely agree to this one"
d0q4ru,"Photo of C5, taken from a plane about to land. 😁"
drqx2o,You don’t say
dguecq,Eating a freshly cooked peach mango pie
b8v0eb,The comment section everytime we get mentioned
6g62u0,Vitaliano Aguirre II [Upvote to make this picture #1 when googling Vitaliano Aguirre]
c5megx,Image that you can smell
ccmfek,Hayst.
bhbpc3,Time Lapse of Mayon Volcano in the Philippines by RA Valderrama
c3k0s5,nag-uumapaw na respeto para sa taong ito
bv7gt5,Ateneo valedictorian shares her thoughts on how her story is portrayed in the media.
bpl0pt,Luneta Park Reimagined
d2epgl,Did You Know...
cdsyxy,*Outstanding move*
76w7e1,Filipino Masterrace
ciqrmk,"la trinidad, benguet looks like a ghost town with all the fog coming in"
8uyydm,I finally got a job in the Philippines.
cj6v8w,Happy Nutrition Month!
d5845n,Mamang Sorbetero
c8vv1n,Tag-ulan na naman~
dkx8id,"The more, the merrier."
d8i0wi,"Toy pagarahe na ako, lipat ka na lang."
ah8kmp,Putangina sasuke
c1hqk3,Vietnam. Philippines. Friends.
cv4f9o,*Pinoy Pride Intensifies* (taken from Subtle Filipino Traits)
ddztr2,K zone for life
c6cji8,Pirmahan ng School Clearance be like...
d2pkgw,Hard meme
dv2ric,So the futuristic novel based on the West Philippine Sea I've been making has 4 Chapters ready for you guys
c40l2m,Good old days
akweay,Here's a better pic of the new Manila Bay. Thanks to the volunteers and dutz for the political will.
bjaylj,More fun in the Philippines?!
au3mti,"Indeed, a beautiful sunset"
6ze1d7,"Sen. Risa Hontiveros shows a photograph (accidentally taken) of Sec. Aguirre texting during a hearing, where the message can be clearly read as the Secretary plotting cases against the Senator."
750hhg,Saw this on fb. r/thathappened
bw7mq4,Shots fired! Ayala Malls throws shade at SM Cinema.
du4oj0,Woah
aklgyc,"Part of Manila Bay before and after 5,000 volunteers picked up rubbish yesterday."
dczbjb,Pm if interested
ctp1og,Philippine Eagle
d3xga8,Faith in humanity restored
a9k18r,My friend found this at an airport in the US
avc3wo,"This Kalamansi juice from Gen. Nakar, Quezon"
bcnpi9,"Very rare sa pinoy ang mapagtapos ng anak ang magulang sa kolehiyo. Congrats, Awra!"
d9cuq1,Police burn marijuana in Benguet.
d424jz,Anti-Ant Technology
d31ml1,Half-expecting a t-rex to emerge from these woods in Antipolo
bt6kpm,You know your childhood is awesome if you are mesmerized while watching workers mixing cement. Relatable mga batang pinoy
bzl309,Happy Independence Day !
djl7vo,Ma'am naman
aswohi,One of the best breakfast for us pinoys! Have a good day everyone ✨
cymfdo,Outsanding move by Samar Rep. Edgar Mary Sarmiento.
cft5hv,Cubao's Motel District
bfn4sc,Street lights. Neon lights. Red light. POBLACION.
dmp1j0,Yung akala mo rave party
bp8fu8,Chel Diokno back handling pro bono cases for the common people
c4f7g8,"Philippines Back in the Day: Mister Donut at Greenhills Greenlanes Arcade, 1980s and Present"
cxchi1,This is Bill. Gwardya sibil.
af2vkh,lmao this blew up on a meme page on facebook
diy4ed,Nice
d7oud9,In an internet shop nearby
8rux6w,Ooop c. Bawal ma-trigger dabarkads!
cc5pdx,Learn how to set your priorities.
dolkof,Pwede naman pala ihh
bj10dx,"Binondo, circa 1902. Colorized."
ahi2ho,Yan ang Logo!
drbhpt,ang damot
c9sr04,Blessing your feed with this cute little doggoooo | Photo courtesy of Aimy Bruce Into
aob8sq,"TIL While Filipino-branded phones like Cherry Mobile, CloudFone, and MyPhone uses ODM (original design manufacturer) from China, StarMobile hired 50,000 people in Calamba, Laguna, and is the first local phone distributor to manufacture its units in the Philippines."
dewqsx,Hungry bebu
dpm8uf,Every Filipino's childhood horror story
av7u1o,TIL We Filipinos are trashy.
6696u8,"As a father with a son who loves these kinds of vehicles, I thought this guy ought to have more customers."
d3adoq,This sub right now
bsf2mp,bruh
dtx4ek,"A portion of the Berlin Wall in the National Museum of the Philippines. The Berlin Wall fell on November 9, 1989 and this portion was given as a gift to the Philippines by Germany."
czx9hq,Bravo sir!
cdd33d,Philippines won 3 bronze medals and 1 silver medal in the 50th International Physics Olympiad
d4f5rq,Its more fun in the Philippines.
apt295,I love you edsa.
cm577q,The sidewalk gods have spoken
bnnkic,Ang problema ko araw araw
be2joo,"""Equity"""
c8fmtm,Probably my fave photo of my corgi on the beach. She was watching me surf.
c9efm1,Sad but true
d81v6m,Good job Philippines for bringing Polio back!
ayz139,When you are thinking of what to do first thing in the morning and the heaven gives you the sign
byr41f,kaines
cwwj68,Lolo ni Elmer's :D
d9uukh,Who's a good boy? Oh yes you are.
bz67p6,"Cleanup in Tingloy, Batangas👌 (DENR-AGOS Science Camp)"
8uilmz,PH Reality Talent TV Show in a nutshell...
dd47e9,Best Solution against Teen Pregnancy 😎😎😎
b7twda,The Philippines in Civilization VI
codkiw,Bataan Nuclear Power Plant control room
b044no,Brownout sa Probinsya
5zi3gc,Bless me father
drfiw2,"These people made a trap to prevent the trash from reaching the sea. This should be shared and do it viral not like the other challenge. 📷 Barangay Poblacion, Sibonga, Cebu"
bmtmlv,Sorry not sorry
djwivf,OpEd: Like It Is
apo2d0,"Half korean, half pinoy dog"
dlqlcb,OC meme
cyhpfq,"A different view of El Nido, Palawan"
a1xxvf,Rice is life.
dp3n4s,Happy Halloween!!! Best costume award goes to...
buds07,"Star-lord, Antman and Groot on board the Benatar. Guardians of the Galaxy 3 hype bois"
8qhylq,This amazing shot by Noel Celis of VP Leni Robredo standing under the rain while doing a snappy salute to our flag at today’s Independence Day celebration.
az9hfc,That translation though
c016c2,Matte
bccq4x,A small shop across the street. Used my dad's old film camera. #filmisnotdead
7appyx,What are some of Philippine Showbiz Industry's open secrets?
8lx3bs,Pinoy Barbershop Starterpack
c0fy3u,"Three Filipinos, inspired by Tiananmen, make and distribute free hot dogs to HK protesters"
c2uyc0,"Arguably the three most iconic Filipino actors of the last century. The hero, the villain, and the trickster. They're now reunited in heaven. RIP."
cr438x,Let’s wish good luck to our Pokémon TCG Word Championship competitors!
cbfrfi,"Ah yawa, here we go again."
b0j62h,Dumilim ang paligid
da4hvw,A perfect restaurant for the Filipinos
chme1l,Sis is serving
dn4ph2,Who remembers this?
dksd5o,Yep. Welcome to the language where you can have a conversation by saying ba
7ib435,"A Philippine Science High School student in Palo, Leyte, was awarded the Zuckerberg-funded Breakthrough Junior Challenge prize this year, which won her and her school $400K in educational funds. Watch her award-winning 3-min video on observational reference frames in relativity."
bxrrha,binibini ♥
dlcuoe,A Good Rebuttal for Students of State Universities
dk3m7h,Morning rush
a92xd0,It is always the poorest of the poor who knows how to give back
db68n5,Congestion kills. We've seen it in recent reports of ambulances getting stuck in heavy traffic. Congestion also takes away personal time. No Filipino should live and die in traffic.
7kqhjy,My favorite pancit canton flavor
b4ttqu,Nothing can beat taho
8dh4tv,2:31 AM kind of chill
ddwagg,Ano na?
cu7oth,"Poverty, the only motivation you'll ever need to get your butt off and go to work."
bykgxw,Sa ngalan ng IG
b1a9nn,"The Beatles in Manila, 1966"
dx2ehs,Saturday morning at Ayala Triangle 📸Huawei P20
c1wi8h,Found it at a Filipino store here in Edmonton
cj2qis,Sleep is for the weak anyway
abrsxk,Cebu - New Year's Eve
bloz1y,crystal clear water on the way to apo reef
7ydlxj,Filipino time LOGIC
ba3lko,I'm surprised nobody made this yet.
dj5hxf,Manila Bay Sunset
bguuwa,"Doggos that help in search and retrieval operation at Porac, Pampanga. So adooorbs."
8n8ik0,Wala ka ng pera pero dapat feeling class pa din
b0xd73,"Sad reality, but its true"
br3lvb,I found this slapped on one of the footbridges in Ortigas.
b9m24i,"The Milk Way and Planet Jupiter over the skies of Liwliwa, Zambales"
dtq6bi,beautiful
c9o0g4,Sunset in the Philippines
djj7cy,just waw
cmj988,Ph sunset
bzukcl,Burj Khalifa
bomasc,"Chel Diokno did not lose. We did. We lost the very chance of being served by someone who has the zeal of serving his country and its people. Thank you, Chel Diokno. Thank you for lighting the spark within us. We’ll keep the fire burning as we continue to hope and work for a better Philippines."
b84wam,Cultural Differences Be Like:
d1yj0i,"Marhay na aga, Bikolandia"
agrvid,This is the challenge we all should really worry about. #10yearschallenge. Phil still remain at the third spot as a pollutant of our sea.
7qaqvj,Battle of the Bastards - Philippine Edition [ctto]
alv8v5,Pinoys can relate
c4kgp7,Found this on twitter. Social class in the PH.
c14zny,How lumpia wrapper is made
a002dr,Local mall fires are no match for Captain Tsinelas
8mw8cv,Harvesting the mango trees in my backyard!
dg7ukj,Mandatory Bible Reading Act of 2019?
dc33d2,Sunog sa star city last night
ajj64i,Notice found at Manila Zoo
dauxry,Because who doesn’t love Probinsyano?
df875d,"Why so pogi, Fighter? Philippine Eagle Center, Davao"
c33v6b,"My dad, flight attendant for PAL back in the early 70s"
awgh27,SM Mall of Asia at sunset. Kinda proud of this one
d8599y,"Legendary murals of folklore lovers ‘Manda and ‘Luyong’ at the pillars of the Shaw Boulevard flyover along EDSA, created by young Filipino artists from the College of Fine Arts of UP Diliman."
cwhgt0,Truth!
blyn2p,everyone gets this moment
bme8nf,Budots
c9a530,The people elect the leaders they deserve
cavckl,Gender Equality Done Right: Filipino Edition
73p5lx,Indonesians. Savage AF
8ksy0v,Just a wild Pinoy comment on YouTube
8j07ta,Did anyone see the joke before it was removed? [Reposted from r/darkjokes]
ayv937,Happy International Women's Day! This is Clemencia Lopez. She is one of the founding members of the Philippine Feminist Association and is the first Filipina to step into the White House in 1902.
c6te9p,Paki hiwa ng manipis next time ma pls.
cljhvn,"As an OFW, I can assure you this is true."
dxen0a,"I made this collage of the Philippines in Photoshop, with each region having regional pictures."
db3kr7,I hope maayos biyahe nyo
cfck7a,After the Rain in España
b6z1e5,Metro Manila Morning
cp3ejh,Taken from CPH Memes for Fake Medtech Teens on FB (it ain’t stolen if I credit!)
aj6js3,"TIL Bruce Lee learned Arnis and Nunchaku from Dan Inosanto, a Filipino-American Martial Arts Instructor"
a2vxfo,"When you open your mouth to joke about everything, your words become empty and lose their meaning"
cayobn,Pride
bbui6z,Another interesting discovery! Dameng happenings ngayong week. Ang saya <3
7wb714,So I'm graduating tomorrow
8xbw1r,I was having a bad day until...
bg9r99,Don’t fall for the third-world cycle. Choose wisely this coming election.
8lq4l2,"Just some guy in Quiapo, Philippines."
amv87p,Meanwhile in the Streets of Hong Kong ...
dm80ov,"Filipinos. Smiling in the face of adversity since 1565 (Battle of Manila Feb. 13, 1945)"
8moid7,Accurate af
bo260x,Oops
bkw9ih,Chooo chooo 🚝
7h203s,Christmas Tree c/o MRT (Merry Christmas to all!) #EcksDee
djdpph,Spotted in Hong Kong: Who do you call when the police murders?
6olz96,"Linkin Park helped raise donations for Yolanda victims in 2013. Salamat, Chester. | #SuperficialGazette #InMemoriam"
ayj661,Marikina shoes (750/pair) sulit!
d3kj9n,Good Afternoon PH! I drew Miss Universe 2018 Catriona Gray using pointillism.
b7jpid,Kaway kaway sa mga entitled na politicians
bfbkv4,"""Walang masakyan."""
d1isbn,"Aw shit, here we go again."
8mluno,If only life was this easy
de8mis,Relate
dwkf06,Ortigas
btxcsa,"One of the most interesting things about Palawan other than its natural attractions is their native script, Ibalnan."
c39zct,"Pati ikaw, mapapangiti. 😁 The VP has visited our Fishermen w/o the riot police in tow. They were all relaxed and when asked what they talked about, VP said: “Nangamusta lang.” All 22 got Php50,000 from the OVP. Not payable in three years, mind you. Our taxes were spent well."
dnqgsc,Sexiest accent talaga.
bu82oh,I drew my own depiction of Bathala. Do you guys think I should do the rest of the pantheon?
bd8gun,Somewhere in the multiverse
dw7ecl,"Reynaldo San Jose, a self taught farmer, and his latest successful experiment - the propagation of different types of climate-smart rice varieties, including Saltwater- Resistant Rice. © Noel Guevara|ADB, CTI Southeast Asia"
cy89bl,I Made Lechon Pizza
ac1q2n,Last shot Mr. Stark
bekngj,"Sari-sari store sa Earl's Court, London"
aiszhl,SM cyberzone
bp1ked,Best snack for tag init!
b5jflu,Indeed...
9ulq0t,Padagdag naman po Sago 😋
c0kj4v,"UP Diliman Quezon Hall, MS Excel, 11550 cells"
ddls5k,Dude can you not
dfcfpt,Panelo's solution to PH's mass transport crisis
bsntim,National Museum of Natural History with the Fire Tree in full bloom.
83cd2d,When Filipinos experience Singapore..
dsclkl,It’s all clear now
d749um,Morning at Daraitan
d8z8u2,Wearing a seatbelt 101
4xt89y,It's funny cause it's true
cwei10,"whole new definition of wedding decor ""greens"" from a recent wedding in La Trinidad, Benguet"
bvtvfj,"Thanks Jabee sa new price, laki ng matitipid ko."
bq450p,"This is my first time colorizing b&w photos, lmk what you guys think // Pres. Manuel L. Quezon - November 1942"
bwwfhs,Rejoice ☀️✨🙌
bmi5nj,Samantha Poblete's costume for Bb. Pilipinas 2019
c3qllb,"""Manoy"", me, ballpoint pen on paper"
dkhn5w,Archie & Friends Travel : Manila
bwns3h,TIL: Eagles can get a passport.
bx7yrb,Philippine Roadworks and Repairs in a Nutshell
d6so3j,"Congratulations, Duterte Administration!"
aoo18p,Herd Immunity
ce3wj4,Komustaka! Not Filipino but I understand this joke.
dsogaz,"tommorow will be its 7th year, but the memories of that incident are still fresh to those affected #neverforgetyolanda"
dmuuvo,Syapi ilibin ilibin
c2j0dw,Kung chinese ship ang lumubog...
c7ziw9,And don’t forget the kulambo
aqiuon,Fuck you Bong Revilla
c7l38m,Hehehe
clv21f,Kawawa naman mga taga Manila wala dawng Pasko
dpzg04,Every mom’s fear. (Ma uwi na po ako wag n po kau galit 😇🥰 hehe labyu)
bexz3t,Working in Makati after Holy Week
cxh81d,"""Boy Tsinelas"" at Retrocon 2019 (held a few months ago)"
ctfetk,big ass fans
cd2hfk,Dapat lagi handa dahil hindi mo alam kung kailan ka mapapalaban. 💪🏽
aq1197,For your diabetic love one
9yqpow,Gusto mo bang kumita ng 10k - 15k per month? (found on FB)
dc9asm,"""there is nothing to grab"""
cbajyx,"Friendly doggo 'bantay' of Sombrero island, near Tingloy"
byguvy,r/HuwagPatayBuksanLoob
6dxi5g,Sounds familiar
8yz8oo,Same
ahvo73,‪Namiss ko ung thrill and excitement before vs now. ‬ ‪I dunno.. maybe because of time? politics?‬ ‪Congrats to Pacquiao tho! Made the filipinos proud‬
cummvy,The Solution to our Bathroom Problem CTTO
7lutoc,Maligayang Pasko! (OC art)
doaywd,Mag lakad kayo
bksjem,I feel very stupid just by watching his ad
crcbxv,Goodmorning Manila! 🇵🇭
bat6n7,"Good evening, people who sort by new :)"
dbjptq,Baka may kilala kayo na kailangan ng surgery. God bless!
aixddw,Dear Parents...
ck22ui,"Brgy. Alab Proper, Bontoc, Mountain Province"
cenw0j,Makaktulog ka sa sarap!!!
ax3g2i,"Yan tuloy, na memo kayo."
6unzrw,Raissa Robles FB post right before the elections
d9i40n,Most surreal sunset I've seen in Siargao.
b2hj9k,A little trip to memory lane. (photo not mine)
b0tzhm,"So, may tubig ba kayo?"
bd1tn3,Spotted Imee Marcos at MoA
bo9pbb,Naga City is the only place in the country that actually voted Otso Diretso straight up.
arw0j4,"""Aanhin natin ang eat-all-you-can, eh busog na ako sa ngiti mo pa lang."" Photo credit to E. Taeza"
dfvnys,Ang pambansang isda
amypos,Name a more iconic duo.
abosh9,Ate!
blawr9,"Samira Gutoc here, running for Senate this May. #36Gutoc! Ready for some tea? AMA! 👳🏼‍♀️"
9qxbjq,PawikangPilipino
ch1c7j,My jeepney driver watching an LTO exam reviewer video on Youtube while driving. Wtf bro
b958t1,"TIL Miniso is based in Guangdong, China, Japan Home Centre is based in Hong Kong, and American Bazaar is owned by Japan Home Centre. Daiso is based in Hiroshima, Japan and Muji is from Tokyo, Japan"
c4zfa5,let's save our home 💚
b2pv7g,Ano masasabi niyo mga ka-DDS?
bk0815,National Dish ng Pilipinas: SINIGANG NA BABOY
dsw83z,"""Nice"""
atsmhm,2 sides of the Philippines
dae7p5,This from Vancouver but it applies here just as much
ct9p1m,Yung mas matapang pa yung dengue kaysa presidente
bao4vq,hmm
8h4hgg,Seen on a NY Subway
cf096m,Hango sa totoong pangyayari | Ortigas
byux6j,Manila traffic in a nutshell
8r1dpg,The most colorful sari-sari I've ever spotted
8p8ht2,"DOST took the ""Is this a pigeon?"" meme a step further by citing the source of the screenshot, the exact episode where it came from in the standard APA citation format. (Source: https://twitter.com/UkiyaSeed/status/1003849284637245440)"
d1o8v3,The Philippine Flying Dragon (photo is not mine)
bflxn5,Berserker at Senakulo 😂
dmvt6d,May effort at meron talagang Effort 100x
c6rf18,"Filipino students when it started to rain - 2019, colorized"
9xyf0c,If this ain’t love. I don’t know what is
b6pc89,Best Pinoy breakfast 🍴
8snjoo,"Barracuda Lake, Coron."
bk59p8,“Anak! Magpapabunot ka na ng ngipin mo!”
acdb7z,Nakita nyo na ba to HAHAHA
b4lbaq,Sorry
b2w76i,"I'm looking at you, PPCWD."
d4nn1p,My Filipino mom has a lot of cool stuff from home. This is one of them!
bni91d,Isang araw nalang
cdoi69,Tropical rains in Palawan 🌴
dbqh03,Papatayin talaga tayo ng gobyernong to
bhwygs,Tita Power!!!
aeeilp,Found my motivation on Twitter
bork1u,Tuloy ang serbisyo. Tuloy ang laban.
b9wd0k,Oof
7xen0y,Happy Valentine's to all!
d6c07m,Math lesson for today
a7s598,How PLDT and Globe handled customer feedback for the year 2018
bfxbe4,Mano po!
bnbqxl,"No offense, but I think you need to reconsider your ~~religion~~ vote. ctto"
8px3az,Thoughts to ponder on a rainy day
adfout,Tricycle driver from Tayabas City
c21oqp,#Balakayodyan
bxnf1i,Philippines is 3rd highest plastic pollutant in the World - A recognition that no Filipino should be proud about
aoi411,Makes sense
a38qzk,[Shitpost] Anak! Paki-bantay nga yung tindahan.... Cge po ma!
8kxkvw,Feels like Japan here in Alabang 🌸🌸🌸
8bdn4y,Someone made a downloadable font similar to Jeepney signs! Quiapo by Aaron Amar
bk7xef,Wow Marvel really pulled this off huh 🇵🇭🌊
bfup78,Sidewalk sa Metro Manila starterpack
cx5lqy,Not sure if /r/CrappyDesign/ or /r/theyknew
cq7s4d,Just an observation
czbw0m,Manila
b74mp9,Basilan sunrise
8ppkb1,Aaand... guess who's back 🌧️
c6i0wh,Agree
b9bp8o,Amen to that! Be a good and law abiding citizen
d6lktr,"Dusky morning at one of the highest peak of Cebu, Osmeña Peak"
ca3sri,"Nasaksihan sa Jolo, #Sulu ang Light pillars o Lansuk-Lansuk (candles)"
7eorsq,Why is this not the top post here? I can already feel that Globe and Smart are starting. Setting yoir bandwidth to 256kbps and 128kbps respectively once you reached your cap. Baka sa susunod de metro na rin internet natin.
a88dcm,Store CCTV around the world
bc6f01,A Map of Manila's Jeepney Lines
b993zj,Bato-bato sa langit...
dwqcmg,Colon St. Cebu City
cotcl9,Bibisita sa mga apo.
bsbfv6,When even Chinabank is protesting China's encroachment into Philippine territories.
dw20a8,More than 300 Chinese nationals illegally working in the Philippines will be deported.
bljku7,"Simple life in Coron, Palawan"
7vek5b,We don't deserve to be dehumanized this way!
9gpy28,"“TV has always had a diversity problem. I mean, can you believe they did 15 seasons of ER without one Filipino nurse? Have you been to a hospital?”"
bbewr0,True
ar6zcl,So disappointing
amoczb,Ang taba ng utak ng nakaisip nito.
ax8am5,I'm the guy who made the Philippine Pokémon starters and now I made their second evolutions
drxftz,"""JuDgEmEnTaL kA"""
azc2dq,UP instructors can be savage af.
bx29x3,Sinigang by Nel Sun
afmcxj,"Redefining ""sleeping by the edge"" cat style"
a2bgo9,Family picture with bunso
7glffr,"Throwback Thursday: Manila, 1950s"
beghvy,Hehe
ap25aw,Bobo na lang talaga ang BOBOto sa kaniya
cafoy6,"there's a rainbow always after the rain (Boracay, Ph)"
dmeyvr,Kare Kare anyone?
cm847z,Shots fired from Mayor Isko.
aw16q0,"Nearly 8 months since i left my abusive partner in the Caribbean, I have been traveling since-- here was my Valentine's Day plunge off of the tallest Free Fall in the World, Danao Philippines. Thank you to the wonderful people and country who have helped me recover from abuse, I love the Ph."
co7pe1,Completely alone on this island!
9nhpxc,Lottery even in Philippine politics
d9xkgf,I guess this works...
bmyzyq,PBA Spiderman just wanted to give us a positive message for this coming elections
8jurn0,Daily pinoy commute
d66e1e,"Indeed, lol... reading my morning newspaper"
94ekzv,I made Manila Central Post Office in Minecraft
b1mrtw,we should have this too.
608c6z,"The center of our galaxy behind Basco Lighthouse, Batanes. I shot this behind a cemetery, by myself, for almost an hour. 😰 Creepy but worth it!"
ddhzjv,Proper meme
8wgmw0,"Someone on Twitter obtained a copy of Who Magazine's article about Pepsi Paloma's rape. Share everywhere in case it gets removed there, and to encourage others to release/look for copies of People's Journal and the footage of the apology"
a21z8s,When you wake up next to your frenemy.
dvhz5w,Batang 90s remembers
a8ran4,"May the Real Goverment, please stand up!"
9veedk,My sister is in Siargao right now and she sent me this lovely picture of their tour guide taking selfies with the local kids. ❤️ I thought this was beautiful and asked permission from her to share here.
aal232,"'Ariwanas' is Filipino for Milky Way (Jala-Jala, Rizal)"
9mdel3,"SUCCESS!!!! 11:13am we captured the International Space Station transit the Sun earlier in Malabon, Philippines! Shot by Per Edman (using Lunt Hydrogen Alpha solar telescope.) Processed by me. The whole transit was 0.56 seconds."
8nz1eq,Every fucking time
d7iw17,Ortigas Skyline
8y86g7,Senator Chiz Escudero on Mandatory Drug Testing for Grade School Students
awp414,Nakakatakot nga yung momo na yan :(
8u5657,I hope this hasn’t been done yet
