post_id,title
clr8nh,Oooopss.
b5yf3k,Found this gem on Lazada
anx9mf,Today marks his 5th death anniversary. RIP Tado.
czdmoh,BREAKING: Pole vaulter EJ Obiena is the first Filipino to qualify for the 2020 Tokyo Olympics after clearing 5.81 meters in an athletics meet in Italy
cjqxr0,Ang bangayan ni Munggo at ni Mangga
bcwmma,"Burn, Sandro (Literally)!!"
bbwdj7,Plus points for acting.
aasc9l,MRT on holidays. Happy New Year r/Ph!
a907q4,"TIL the difference of Afritada, Mechado, Menudo and Kaldereta"
bf6p2w,"I was reading an ebook version of ""From Third World To First (The Singapore story 1965-2000)"" authored by Lee Kuan Yew the man who brings Singapore to an economic success, and he has something to say about the Filipino people."
b7c872,Today’s sunset at the University of the Philippines
acuqt3,PUPPY UPDATE: Pup has found a forever home! Thanks r/phillipines and u/frostedmelodies06 !! (We'll miss the little guy)
bupmc0,"Alagaan sana natin ang ating bansa. Coron,Palawan"
c63s5q,Hahahahhahahahaha
a3lv4e,Baguio traffic makes a large Parol
7l9m3c,"Ladies and gentlemen, Ethel Booba 🔥"
dq8tu3,Stahp!
87t1fj,that escalated quickly
db8jb8,Pinoys = Deep fried caramel asians
cm16vx,Benefits of public transport
bya4w6,Just found a new seasonal teleserye to watch.
b3xp8t,Panawid gutom [Pansit/Egg/Ham]
ancd2k,these are the people who vote this coming election
ci1nxh,Heya! AMA tomorrow :)
alip8r,6:10 AM EDSA Ayala
b6bqmr,Venezuela? We’re getting there
8wal14,Smiling still
7v5g9y,"Photo of a native Filipino royal couple, early 20th century."
cox98b,Pilipinas kong mahal
c57mox,Life hack for job seekers
bqv0i1,I saw this on Twitter so I’ll be sharing it to y’all.
b54bis,I want to give this Guy a chance in the Senate...
am9i4s,"26th Str., BGC 06:00AM"
aeujws,Powerful
c0x32k,"Thank you Vietnamese, very cool"
9ctls4,"17-year old DOTA champ killed by cops does not even know how to use a motorcycle; cops claim he was riding one and ""nanlaban"""
886fga,You don't see this everyday in Makati
cw5geo,Another crossover nobody asked for.
b3izd5,"Panglao, Bohol"
b8odde,Ano ang tagalog ng ''In a nutshell''
b16yik,Andumi nga naman eh.
aqb9rt,Filipino Woman In Traditional Rain Cape
83radt,Pinoy-Style Parenting
6w4ugo,"Baguio during the rainy season is spooky. (Wright Park, Baguio)"
d0fbis,Sometimes I ask myself...
dcv02g,"It's 2:30AM, had too much to drink. Sakto sa lasing."
bhskvd,"They had us on the first half, not gonna lie"
8u8nlm,Bida ang saya? (cto)
cf5zi8,Nadaanan ko kanina sa taas ng footbridge sa Gil Puyat. Nagbebenta siya ng artworks niya.
bqit2a,Para legal agad kay dad
7ytkb8,We've finally solved the trolley problem for good
d0x5y2,Urban Planner’s take on urban planning in the Philippines
8l7j5t,..While the rest were men having sex with.. what :)
bbn03n,"A local tv reporter here in our country brings her baby dog in her workplace, the dog stays with here like that until the end of the news show. But the camera only shows the upper half of the reporters body."
b591c2,"Ate, sa harap mo ilagay ang bag mo.."
68z2dg,Comelec janitor passes the 2016 bar exams
apaa74,Louder...
8q7ni3,"""Kung masipag ka lang, hindi ka magugutom sa Pilipinas"" -DBM Sec. Benjamin Diokno"
8heoj0,I have no words...
dgc9qb,Yehey!
c2rmz0,This man's defeated face will haunt our country's soul for years to come
do4ye5,Letseng headline
azlkgz,"Good morning, PH Redditors!!!"
cb38sy,lmao
dhy7xm,Kapag wala pang traffic sa EDSA
cs7q6l,RIP Gina Lopez
buzkg5,Sorry po
bixe22,Plz protect
anoyk4,Signature over printer name
dv9mde,"Crying Mountains, Kibungan, Benguet"
64qhi5,Night picture of Taft Avenue I took(beside DLSU)
chwmuz,"No wonder the store owner ignored the cat eating, the cat actually owned the place. Lol Proof: take a closer look at sack, it's her face."
bzaod7,Thanks tv5
b3n98g,Sad but true
8isdrj,So they removed all the graffiti in this bridge except for this one.
8fv2qf,Happy Meal
b3912w,Green Frog Hybrid Company is ending the Honesty System because it did not work
am0aro,Cold as what?! I saw what you did there Philippine Star. Haha
8hmcas,"Snapped a photo of two strangers sharing the sunset in La Union. No phones, just good company."
8b4zan,Oo nga naman hahaha
ajx8v9,"A clear river running thru a municipality with 50,000 people in Surigao Del Sur"
8sgmna,Found in Makati Ave...
8qy3an,Fucking Tape!
bihlds,"Massive karst in El Nido, Palawan."
bget4h,Doggo rushes out half groomed as quake hit Makati yesterday.
asmwm5,Fatality
9tceoc,My sister's Halloween costume. She was banking on Filipino votes
7uqlek,Manila during the Lunar Eclipse
bw5b96,Good job anak.
96obu0,The resilience of the Filipino
8epqn3,Laban lang sa buhay.
dqjwjj,Mad respect for Capt. Ebora! #salute
8oe9sh,i love you china!!!!!!!!!!!!!!!!!
8dlg55,Usual MRT Morning Scene
7ftu6j,"When you're having something delivered to your office/condo, please don't get mad at the delivery person when they ask you to go down to the building lobby to get your package."
crun92,This morning in Palo. 8/17/19
cgmt5x,*sad underweight noises*
6it3h0,Photo taken during earlier's AMA. Thank you for all your questions! I had a great time.
bjsink,Bravo UP!
bot70i,"Win or lose, they still choose to serve the people"
aqgmcr,"Maria Ressa: ""Finally out. Thank you for your Support! #HoldTheLine"""
dfhr7d,Pilipinas 🇵🇭
d79hil,hmmm
a7jpc2,Merry Christmas! Papatayin Kita! Ganern? BILI NA!
9qn5kl,Fishball bender
6gqmtu,The Vice President.
bkkmet,Election meme shitpost coming through.
8d397j,Kahit Maputi Na Ang Buhok Ko
cjoo9v,"PH dominates recently concluded IJMO and VANDA Science Global Finals, 4 earned the PAExS award. I'm in this photo, let's promote STEM together!"
blo01p,Phone case na inorder sa Shopee...
7aos99,Hello my lazy a** thesis groupmate
dlcx7u,Mainland Chinese in PH starter pack
9y5xv8,Philippine Writing Scripts
bfjjf4,Cherry blossoms in Iloilo City
b7a2i1,My version of Darna [OC]
asitbf,So I drew this comic based on a conversation between my dorm mates.
btv80b,An image you can taste
bstv3b,"The old senate session hall which now houses the ""Filipino Struggles Through History"" artwork by the late National Artist Carlos ""Botong"" V. Francisco"
dupay2,Vietnam is going to ban China-made smartphone which comes with map apps containing 9-dash-line.
c5gogl,Oooops. 🤣
co3627,Special Skilzz
83lhhj,Hate it when these things fall apart
ag6gay,What we all need. Declutter 😝 #mariekondo
6vhtce,"13,414"
bobkpg,"Naga City, Camsur is woke"
8oyolt,Charot!
8opo46,Kris Aquino to Mocha Uson
b5mu2n,How very fitting.
7nsi3f,Don't. Yun lang. Don't lang.
c6xz6p,Ang lamig ngayon
8a8gmi,Ganto rin ako. Kayo rin ba?
cv82c3,Bonifacio Global City
ce90k7,Just.... Don't.
b60g7l,Apply ointment to burned area..
8joq3q,The view from my hotel room. Escala Tagaytay
d9ad0a,Relevant to our culture of popularity and personality politics.
bvrk2c,Camerashot from the back of a Jeep on the most scenic roads i've seen on my entire one year worldtrip. Siargao Philippines.
b01q57,They worked so hard more than anyone under the scorching heat and mostly with no benefits then only to be called lazy.
7skjdl,"Today I fucked up by telling my vegan friend i was cooking Vigan Longganisa and he ate them, thinking it was Vegan."
bacs49,how would a dog wear pants
7rvgqy,Seen on Facebook: Doctor gets hollered at by a random pedicab driver who turns out to be the father of one of his former patients when he was still a pedia resident.
aqufge,Ang Alamat ng Edsa
affqw9,Bangus Belly with bagoong rice by Cardiac Delights in Marikina
8d9s9p,Just a jeep... with beverages for sale inside. ♥️
auk6tb,The hero we need
9phqjm,Mga ilaw sa daan
a60xk5,"Philippine government doesn't care about us, commuters"
calg8z,Today's sunset. Nakauwi ako bago dumilim!
c8q5zd,Why?
8r9bdp,Kapag sobrang honest ni seller sa ads nya.
817jlj,I flew to Palawan to photograph this Kingfisher
cejzxy,"Might as well post it here, HAHAHAHAH one point"
c1u7hd,Been avoiding this word too but now i strongly agree
bkf01i,Helping mama iron the clothes the old Filipino way.
dgqw7w,Great idea?
axvo9n,(c) Neil Doloricon
d4x7rw,When a konyo uses “like parang” in a sentence:
c03i6c,When the president is much more concerned about Canada’s trash than his constituents
bnkyqk,My respect ends where the support of oppression begins..
bi90mt,"Ed Garcia, one of the framers of our 1987 Philippine Constitution, handing out election leaflets in buses/jeeps and bus/jeep terminals, in support of Otso Diretso (From Never Again F B page)"
ahs7wv,Retired na daw sya sa pagiging x-man
bdlaol,Election Season.
8vnfhn,Anong iniinom niyo?
bx0pi2,r/boneappletea tagalog version
alne2t,funeraria
a66zrw,Agree or agree? lol
7p7aef,Manila Sky had an interesting gradient today.
cqzh2d,Beautiful weather in Boracay
904z5p,Salamat to all redditors. I hope you had fun!
8m9iqi,Woof
6vx2j8,Killer Clown
b0elbk,Magnanakaw ng Masa
8jcx4x,Vietnam has refused entry to a group of Chinese tourists wearing t-shirts with a map showing China's illegal 9-dash line. Source: PDFF
akhs2d,"TIL the currency symbol for Peso (₱) is only used in the Philippines. Other countries using the Peso as a monetary unit (Argentina, Chile, Colombia, Cuba, Dominican Republic, Mexico, Uruguay) are using the dollar sign ($). All countries were former Spanish colonies."
a4qwg6,only in da pilipins
70luwp,Pennywise sa Pilipinas: You have no power here.
d25625,"Just a PAL plane, thought it looked cool"
bjreqg,Sharing the latest work of my dressmaker nanay
ar0ugj,When a DDS fake news purveyor walked right into a trap...
a6bmbj,"Mt. Apo and Mt. Talomo as seen from a footbridge in Bangkal, Davao City"
dui05c,And the FAMAS Best Actor goes to..... Pebbles dela Rosa. 👊
8kztct,Ethel is at it again
btgzn1,Immunity from Duterte.
aikqy7,OldSchoolCoolPH: Juan Luna in his Paris studio.
8v1v92,I also got a job in the Philippines!
cpt5w4,"Here's a list of Presidents of the Philippines, from the past to the present. #SuperficialGazette"
843cac,Happy Lemon Day! 🍋🎉
ak9nds,Hi pinoy boomers and boomer politicians
902hn8,Foreigner friend living here for 6 years told me that Filipinos are very friendly but few are honest and genuine friends. Most see him as a cash dispensing machine.
cy25b9,"Our local bakery's roll gradually lost more than half of its size in the span of five years. Probably due to inflation. Thankfully, di nagbago lasa. Masarap pa rin."
c1o3ui,Nice
brcxfs,Filipino moms got no chill.. 😂
cnnsjy,Wholesome.
8oo7jb,Manong Driver
bzqddt,"Happy independence day, from Armenia!!"
bl7u5c,Ganito dapat
8nf6yn,Internet in the PH: “Do Settle for Lag”
a6n72c,Is this the jeepney barker?
8yqc9o,Mini Shop
8tj9wr,This is why KPOP is so famous in the country!
beszyi,People like this are the worst.
aepdvy,Anatomy of a UV Express
ab28e6,Paalala lang po: On New Year's Eve
8vi5ai,Hey dad
ai4vcp,So Pinoy <3 (Palawan)
aagd98,"Never change, r/Philippines"
8x08t3,Waiting for announcement..
a56scq,Maria Ressa named one of 2018 Time Magazine's person of the year.
8srq81,Thoughts?
aiha4r,Found this on FB: Rare old photo of Cagsawa Church. Probably dated before 1814 Mayon Eruption?
7nzvpk,Give us this day
dnm5a8,"Some reasons given for the big protests in Chile. Parang same situation sa Pinas, pero bakit dito wala nagre-react?"
catre9,"Sunset at akiki trail, Pulag National Park, Mountain Province."
8xwv6y,filed under: top 10 question science still cant answer
8s1u80,Pautang walang bayaran
8d46nc,Say no more.
aa63uz,Malaking tulong para sa mga may maintenance na gamot. Happy new year!
a9aqh4,Animated timelapse of Mayon Volcano
ca5z58,The rupok is strong with this one
b6fza1,Imee Marcos is shookt.
6zlxz5,"JUST IN: Voting 119-32, the House of Representatives approves the P1,000 CHR budget for 2018."
bvx31n,SM being your greedy 🇨🇳 capitalists again.
bh2hho,Kaya tuloy nagkakaroon ng moral dilemma... (Tweet not mine)
8g5b13,Isang patunay na malayo ang kayang marating nating mga Pilipino
8buxnq,Escalator etiquette for couples
8yiqr2,Subarashiiiiii
bi8479,Might not be completely accurate but you get the idea
bdd0jj,Spittin' some truth.
7t9m75,Saw this on Facebook. Figured its worthy to share here.
9wo2kz,Opkors my friend
dg6mn0,The Philippines Is Dead Last in the Ranking of Smartest Countries in ASEAN
8nnqnk,Philippines Map (1734)
5hqejp,dont upvote. magkano magpatanggal ng manboobs.
c19qjk,Been following stories on Hong Kong protests and there’s one thing I can say: THEY SURE KNOW WHAT THEY ARE DOING.
bm3dxd,"Bus na nag overtake sa L300 na nag overtake sa Avanza na nag overtake sa Tricycle.. at Gumaca, Quezon PH Courtesy of Tin Tin 📷"
bl5yrn,Buti pa si Ethel sensible.
binfp2,A cat was roaming around in SM Megamall’s basement. Wala pa naman sumisita hehe
avnhnf,Kasya pa?
8wt092,Every Mayor and Vice Mayor right now.
85xxwb,Life hack #683
9yayfm,A short animated film I made during my free time
dpcsyd,Talagang ginagago na lang tayo ng gobyerno ano
8n5xf0,Harp
8woznz,Best way to end your report
8pgz4k,"Kung naiisip mo minsan na nahihirapan ka na o tinatamad ka na sa hanap buhay mo, tignan mo lang itong litrato na ito at makikita mo na may mga taong nag-tatiyaga mabuhay lang niya ang kanyang pamilya."
8o44aq,Lako
auys3d,Kiligz 😍
ab6vhu,Spike
c922ft,Finally got to tick off Mt. Dulang-Dulang in my hiking list. Took four days to finish!
b2bein,From PH to CA. Anong masarap na pulutan?
6mbxrm,I drew jollibee as a school girl!
dih28t,Ngiting Yamanin
bg900d,Just leave this here
8v6c2b,Tourist attraction for Americans
5l1es4,"Hi r/ph! We are Team Saving Sally, Ask Us Anything (7pm December 30)"
cyvtse,The beauty of silence. Diplomat Hotel.
a0v77p,"This is the original design my parents had for the Natural History Museum in 2014, with the DNA elevator shaft and the green wall."
7wwdcd,Jeepney Fierce
a07igh,Madalas nga ganito
cdbq3o,Cyberpunk PH 2030
ah3kri,I'm just gonna leave it here
dp17jf,No shade
axid0z,I Came Out to my Mom this Morning
8tzend,wag munang mag-boypren
cmbpn9,Ganto sa Pinas!
8zi1q5,Ghibli adaptation when? (anyone knows the artist?)
8ohidk,End of Day 1 hahaha
a4k3aj,Biology 100
des09l,Put...ina!
b7z0yg,After election = bahala na kayo dyan
dqguzq,Wala yata nakakaintindi ng Tagalog dito samin
c1nnkv,Priorities
bn7zlz,"Ang pogi kasi e, hindi magnanakaw yan. 🙄"
ao2kst,Anti-vaxx be like
ae4peu,Sa loob mismo ng presinto smh
9om6k5,Eddie Garcia on the latest Esquire looks damn badass at 89
8twvm2,Hindi po kami tambay
9xib8r,Malapit na ang Miss Universe Pageant eh
98k3wy,Bitter Truth about the PH today..
8pzzxp,True Love
d5h2zv,"""Gising Na, Tatang"""
boodis,minimalism in the government... why not?
bdtisj,DPWH joined the group. DPWH left the group.
b4xm7o,Eggsilog
czrzdg,Pagpag
8t8wr6,"""Charot lang!""; when gay people are on the giving end of (verbal) sexual harassment."
chxutr,We “Skip the Straw” for what reason again? Corporate antics never fail to disappoint.
akaznp,Hápon... Hapón
b0pinr,Balete City Pinoy RPG Game Support us at Patreon.com/Baletecity and our fb page at search our page on fb. balete city pinoy video game
b22cx1,"Roses are red, you gotta hand it to 'em"
8nphp9,My tita got her check from the Commission of Human Rights today. She's a political detainee during the Martial Law and was jailed for at least a year. This is Marcos' ill-gotten wealth given as reparation to victims of his regime through the cases won by PCGG against the Marcoses.
812kga,Ginagamit ang mata - Nanay
c1z9yk,hello spineless RodriGAGO
azf5lz,Congrats Team Philippines for winning DOTA2 WESG tournament with 500k dollars prize
djwuub,Welcome to SM Robinsons
buc1g4,“Do you vape?” “Yeah.”
8j7ie3,Manila South Harbor at midnight
dnc8ix,Sunset
7ysm3e,Sila yung pinaka affected pag nasiraan ang MRT :((
cclisu,Mura na mabango pa. teknik ni kuyang grab 🤣
8qrpee,Someone should make German sausages in Pampanga and call it Pampanga's Wurst.
7u60j0,"Mayon Volcano, a beautiful tragedy"
cjirup,Mayor Joy Belmonte made urban poor community wait for 10 hours.
bdrz9f,astig 👌
adlfys,Ang bubuo ng Gilas Pilipinas
8e1vay,Banawe Rice Terraces. Nagbike kame sa banawe at nadaanan namen to. Sa halagang 50 pesos mahirap pigilan ang sarili ng huwag subukan. Masaya!
bhikd6,Trudeau VS Trantadeau
ausw54,The Queen.
9dmrad,Filipino boy with pet dog (1949). Photograph by Jack Birns. Colorized by Homer Fernandez.
c3yanu,Palitaw - a Philippine dessert/snack
dlwkdd,My neighbor snappedt.
bjp0ef,Sa ganito nagsimulang matutong mag-drawing
87nfo0,Back when life was really easy
ajwbjz,Michael Jackson visits Parañaque Community Hospital (1996)
8zesfj,European Jews in the Philippines after escaping the Holocaust
b3pyvm,Minsan may kayamanan sa facebook
bqbf0n,Namiss ko to: P50 taho every Sunday breakfast
bvk3de,At least alam mo bat di sila nagsasakay
ardy4f,Wasn't disappointed with my chicken and rice.
54vsx4,Consider this my apology letter for being a Duterte supporter during the election
bao0ns,But there is no right or wrong...
8hticl,"Spotted at Compostela, Cebu. This section is the only bottleneck of an otherwise pretty wide road."
c1vxi3,"The original life | Buenavista, Marinduque"
89q1hu,Mind=Blown. (sauce: Ser Alec Miguel Medrano)
9rxstc,Bangsilog!
civ7un,God bless you 😇
bb4x13,Saw this lola and lolo playing apex legends at a comp shop
an5i0w,Chinese-Filipino
bv34ug,Manananggal I drew for #maynananggal
8qob22,Qiqil niyo si araw
dusqxl,"'If we are not asking our soldiers to buy their own bullets, then why should we be forcing our teachers to buy their own provisions in fighting illiteracy?' Senate President Pro-Tempore Ralph Recto says"
9hmcp1,In front of UST now
8p58mb,Sta. Cruz Plaza before the Japanese invasion
beud3y,good friday sa Welcome Rotonda
9tt1jg,When you invite friends to the south but they say it's too far
9jxeo1,"Afternoon walk, UP Diliman."
bvghox,Nagaaway sila
a7ad8g,purrivate furst claws khajiit
dfdsml,Panelo to PH commuters:
9q07j0,"Abra, Philippines"
9bt1fw,0 to 100 Real Quick
86i8tx,Saludo kami sayo Tay!
bjexwd,Saludo sa mga manggagawang Pilipino
9yo7ue,"Live version of Winnie The Pooh and Piglet, 2018"
cnxzpc,Legit
amd953,Barbero Philosopy (credits to @gplusian of Twitter)
bafj9u,Kayo na pala may-ari ng kalsada
9s9xfx,Money can’t buy you class 🙄
a9ev8s,(Merry) Christmas
9zvkui,Spitting some truth...
a2mx1r,Duterte admits using marijuana to keep him awake
8ikl86,"BREAKING: Supreme Court ousts 24th Chief Justice Ma. Lourdes Sereno in historic ruling, grants quo warranto petition of SolGen Calida."
992hkw,"No internet, no problem."
6hkdvv,I took a shot at making a Pinoy Snoo.
dd1782,"We can't save your lives, but we can save your files."
arsdzw,di ko alam ano ang pamagat
8tobru,Ang alamat ng Edsa
cjo2i8,Kaya pala ang galing ni kobe sa steals. He took tips from one of the best.
9wbqug,Famous bridges
b1r0g9,PSA: Please be advised that the Portkey located in the 2nd Flr Men's Loo in SM City Iloilo is under construction. All Wizards who plan to go the Kagawaran ng Salamangaka't Pangkukulam are advised to use the lone Tsinelas Portkey at Parking Area 3B. Thank you.
d4u092,Majestic Mayon
a5tohx,Yung tinawag ka ng crush mo pero ayaw mo magmukhang atat. Yaaas. Slay. #Philippines
a4czoz,Philippine Christmas Village made from cardboard boxes
dwi76x,Friend went to Russia: Brought back a Duterte Souvenir
dhoh4x,Manila Harbor by Elizabeth Keith (1924)
7q2gob,"""Dress for the job you want, not the one you have got"""
d9f77h,Wow empty.
bi4i37,This old house renovated with modern design (not my house)
8ten5u,This is simply amazing. (Natawa talaga ako dito)
5q99ms,Sen. Lacson shows new tokhang for ransom video with PNP cops victimizing an entire office
8ej728,Took a phone shot of tapsilog that we serve in our tapsilogan.
591vot,"Chinese construction firm set to undertake infrastructure projects in Phils under Duterte's deals from China, is currently under a World Bank blacklist for corruption"
a75b1v,IE as usual
9wjwkf,Walang hotdog?!
7dpr60,‪You and the guy she told you not to worry about‬
71hv7h,From Red Dela Dingco Tani: Nailed it
dik6iy,Legit
dfpdqa,"I rarely see tagalog on mainstream US tv, so I always crack up when they have tagalog bits on the show Superstore"
cgq5rl,"After 18 years of living life not knowing of the relatives I have back in the Philippines, I finally met them in June. This first visit was more than I could ever dream of. Thank you so much for having us. (story of photos in comments)"
c4km74,PLDT the best service for the Filipino.
9t78l6,Scorching heat and knee-deep floodwater failed to dampen the spirit of a woman in paying respect for her departed loved one.
9ocznq,Look at that smile.
9oxs1h,Truthslap
6yz19n,Some of you on this subreddit need to chill when it comes to correcting people. Here's a quote for you.
8hd8zl,Huling pasahero sa bus
aotw6u,Tumpak!
d4w4vb,Salamat DOTr.
c6u39y,Wala ka nang magagawa
8e8muv,Milkyway over Puerto Galera
dy059u,Mandaluyong 2049
79zby9,Scariest halloween costume ever
doliwa,Top 5 Worst Cities to Drive in the World According to Waze
c8l3db,"Kaya pala sabi ng Lola ko, wag kakain ng galing sa nakaw. 😂"
9aceaz,Manila was clean. Before. Manila Bay 1960's
82szrp,"Guys, she made a Reddit profile na 😃 re: Ethel Booba AMA"
bodoxu,Mike Enriquez has no chill!
b1zbg0,Nuff said
9v4uub,The perfect tweet
8afjz2,"Sunrises taken in the same spot at 5 different months, Dumaguete City"
bp7o6o,Swift as a coursing river. #LabanLolo #Diokno22
8lgr8r,Neko-Chaaaaannn 😄
8ap3yg,View sa likod ng apartment namin sa Metro Manila
8qehck,"""Some would consider knowing the title of our National Anthem a small thing. But not knowing it reflects badly on how we value our Independence."" Nice one, Philippine Star."
7g9pqb,Pia Wurtzbach makes a statement regarding the recent drug bust
98gksc,FerDILISation
8y48p1,new meta
awtcbl,“Issues”
a9v1wt,"Kahit isa lang ang pasahero, tuloy ang flight ng PAL nung Dec 24."
dgm4w2,Bakit ang bobo ng Pinoy? (A repost)
cvm149,San Bidet
arozl7,Hypocrisy on full display
aedc5d,I finally engaged a private detective to look for my father. And the tension is killing me.
9rfvm5,The spotless white and powdery sands on the shores of Boracay is ready to receive tourists once again after 6 months of rehabilitation.
86rerj,Walang ligtas sa Pilipinas
dc4nln,A classic breakfast combo~
6y3xrs,"Yung akala mo Insurance and binibenta, Mani lang Pala. Lol (Isa kang alamat Sir!)"
8f21ci,"Yup, still available cyst"
aq4t7a,"""Yan ang senador ko!"" - Bobotante"
8m58z0,"Uy, enebe"
8x4ywj,"I took this photo at Coron, Palawan (OC)"
8vz0e5,Langaw na!
btz512,Aren't we all?
9z2s96,ABS-CBN News with the shade 🔥🔥🔥
btsybq,"Today in Philippine History: May 28, 1898: The Philippine Flag was unfurled for the first time after Gen. Emilio Aguinaldo won his first military victory in the Battle of Alapan, Cavite. Today is also known as National Flag Day."
bgcl2j,Amen mga kapatid.
cebnxl,Philippines road map.
ay0vfo,Goodbyes at Burnham Park
a49r00,Mga Bong sa buhay ni Duterte
8og3z7,Eeeey
8byeru,Wow! It's happening. Change is really coming to facebook.
4r9259,A day in the life
9xtooa,"Amphitheater Rice Terraces of Batad, Banaue, Philippines. [OC]"
8kckts,"Spotted at Starbucks, Pacific Star Bldg., Makati."
671d5o,Sistema ng panukat sa Pilipinas
61qawn,Sorry sa mga Taxi drivers
a0qbk1,Guadalupe
8bnrjm,"This dog deserves the ""Let's be friends forever"" award!"
878l4u,New Model Air conditioned Jeeps
8li6u1,Flying over Hundred Islands habang atin pa ito :(
8fh01s,Fluffy boye does a jeep
c35wam,Gen Z romance movie starter pack
8glxaw,Opismeyts Komiks: Commute
8e35vo,"I was taking a break from my weekend bike ride when these 3 watched and judged me while I ate 5 siomais and a whole buko. Taken at Basic Trail, Timberland, San Mateo, Rizal."
8clp5n,View outside the office (Cubao)
cqgp5x,"No context or agenda, just rest your eyes on this childhood artifact and enjoy. [Bandai Tamashii Nations Soul of Chokogin 40th Anniv. model.]"
9wg3ky,6 decades in TV history.
7x7u1g,Anyone misses this? THE BEST IMO.
700lnz,To serve and protec
a47gn7,Sari sari store on a whole new level.
8k8wx9,Raket
bpqj5b,""" Bong Revilla steals"". Well played CNN PH👏🏻👏🏻👏🏻"
by7usx,Made adobo fried rice topped w/ tortang kamatis for my foreigner friends :)
a83sut,Read Ateneo's Response to the ''bullying'' incident - Annotated
557521,it's time we have our own counter [humor]
actbok,"Adopted this puppy for a day in Manila. Can't take him back to Bangkok but don't want to give back to the homeless person who initially wanted to ""sell"" him. Clean, warm and loving. Anyone want to adopt?"
7zulun,Gawain mo rin ba toh? #Batang90s
dxvc3p,"Harvest time, samahan ko lang mga magsasaka natin na bibilihan ko ng palay sa tamang presyo. Mahirap na trabaho, pero maliit na kita. Tulong sa mga kababayan na baon na sa utang."
aux2je,Priorities
cub9z1,Nakakapamura
bo195j,Who did this? Saw on wikipedia
a8hz9x,It be like that sometimes *ctto*
9zjeey,早上好菲律宾
6cv2bs,[live] Terrorist Attacks in Marawi City [/r/Philippines]
aj6hw5,"Good Morning ,😁"
99uuji,Pwede pwede
8z0fdo,"Baidan, Philippines"
cr08dz,i’m just gonna drop it here
8z5qu3,Waiting for QC to Suspend Classes
dwwp6t,nga naman
ca3xr3,Same goes to ordinary people
8y4w63,Trike driver knows.
do1i9d,It's that time of the year again
a10x8v,My Trese fan art. Trese will be the first Filipino comics that will be animated and featured in Netflix.
8oqdu1,"Buti pa sa Marikina, hindi epal mga pulitiko"
8g782g,Silent Hill Vibes in Baguio
88pzzl,Mang Taho-San! Yameeroooo!
7d00jt,Merlion PH edition
8crwpe,"Pulitzer Prize awarded to Filipino journalist Manuel Mogato, as part of Reuters' team covering Duterte’s War on Drugs."
7t1gtt,Breathtaking shot of a couple with Mayon Volcano (cto)
avwcsz,Taba ng utak ng magulang ni sir ah!
c7cpz8,Kinagat kagat ko pa eh!
78sv73,"Not a fan of beauty contests, but our rep in Miss Grand International slayed it."
dtmz4m,It sounds repetitive to them
