post_id,title
9he0kr,Thank you for commemorating Josefa Llanes Escoda. She died fighting for liberty. A great Filipina.
dvn344,Wag kang lilingon!
ayne6o,QC DRRMO LUF 60 Unmanned Firefighting Machine in action
ay7cjd,Bad talaga yang MOMOL na yan. Dapat COCOL lang!
7oprp1,"Nieves Fernandez, the only known Filipino female guerilla leader shows US Army Pvt. Andrew Lupiba how she used her long knife to silently kill Japanese soldiers. (1944) [1200x920]"
binmcz,Para sa mga makata
8wxggl,Words of wisdom from Dong Abay.
677j7o,Anak as Retirement Program
4wmfyi,Hidilyn Diaz (weightlifting) won SILVER in Rio!
dc7jrv,Oh no! Artwork by: caveman draws
8fagi0,Kelangan pang takutin
7stqn4,"Maria Ressa, Rappler, AMA :)"
9osxus,"Teach your tita how to Facebook they said, it will be fun they said"
9aj63t,Philippine National Museum made using Minecraft
73d5j9,CHR Chair Chito Gascon. AMA!
aktyn7,Had a good laugh with this one. :D
a8ksjh,I made this artwork a few weeks ago. My friends encouraged me to post it here.
cfygp7,Okay Manny.. now do your real job
a97x14,This Icelander just built a school for abused and trafficked girls in the Philippines. It would be nice if people could subscribe to his channel and help him do more for these young Filipinas.
9g9ox5,TIL unfriending someone over politics need not be ugly. Still a little sad though
8nw2k7,My tatay's diskarte : combining a clothespin and two forks to make a tong
8levac,How sad naman.
85s1pk,Nice earring!
5f2vy8,"Pati si Jollibee umaasenso na, from Nokia naka-iPhone na"
c1ywsf,Kawawang Pilipinas at mangingisda
8pl1eo,“Para kaming magnanakaw sa sariling katagatan.”
8c6ogg,Casting be like
dw4ily,Article 681 of the Civil Code of the Philippines states that fruits naturally falling upon adjacent land belong to the owner of said land.
9r49n7,"TIL The International Rice Research Institute in Los Baños has been sending thousands rice seed samples to Svalbard Global Seed Vault aka Doomsday Vault located in Spitsbergen, Norway. It's aim is to preserve a wide variety of seeds that are duplicate samples of seeds held in gene banks worldwide."
9k4r29,Kimi No Edsa 😅😂😂
8kpccn,This is my second favourite picture from my trip to your beautiful country!
8ivo3p,Found this gem on FB. Credits to the owner
c63sqg,I hate being a former Duterte supporter.
899tem,Philippines according to people from Metro Manila
7efsrs,hmmmmm
c1c53q,Fun fact for today
bq2au3,Sad -- 17% voter turn-out from this Ateneo Class
c9ej66,Must be consumed within 3 to 6 months.
9fn59o,Who would win?
9rriga,Michael L. Tan’s reminder for parents on UPCAT
amk51d,Bangsamoro
ajzpdi,pathetic.jpg
61e8mt,"A Philippine Lady, Manila, Philippine Islands, 1899"
ariho3,Manong’s jeepney valuables.
a798j5,This Shop Display at Greenhills
9u1vs3,If only we had more sidewalks like these
a4uoeh,True
9qbnf9,TIFU at Miniso.
8z7qv5,Third top image when you Google “Philippine Idiot”
6tcel1,Kind hearted boy feeding a family of strays (rural Philippines)
8rfz3c,"Rodel Rodis: Senate President Tito Sotto has ""requested"" the Philippine Daily Inquirer to remove all the articles I wrote about him (""The Rape of Pepsi Paloma"" and ""Was Pepsi Paloma Murdered?"")."
7bxvip,Jollibee never looked so aesthetic
b4s2qt,Wait... what?
a8vjo8,Sunset earlier in Davao City straight up looked like instagram logo colors!
82emab,"University Ave., Diliman, Quezon City"
72wquy,This kid is going places
d27vve,im from qc and can confirm this
cch2qo,Nutrition month be like
ak8k0g,"Before we blame “lack of discipline” for traffic, let’s reconsider cars"
