post_id,title
9fgda3,Potato gratin
8se1hr,Here’s my second dish. Chicken tortilla soup. Only bummer is I used just a little too much broth so it’s a little runny but delicious nonetheless!
6f42lr,"I was missing my home town, so I made pulled pork with some Kansas City beer."
7j7qbe,Barbacoa beef sliders
c95dl7,Making grandma's baked beans.
8bcoa0,Slow Cooker Baked Ziti.
cgztwy,Chipotle chicken bowls
9msw8a,Salsa Chicken Tostadas
9c0h5s,I made carnitas from the front page post the other day!
80w44k,Thai coconut pulled chicken sandwich (like Tom Kha Gai)
ar0yls,First chili in my new crock pot!
7g5chc,Guinness beef stew. Can’t wait to get home. (Recipe in comments)
60tgat,I made some heavenly pork ribs last weekend. Thought I'd share.
7q8sbu,"With NW Florida getting into the 20s, i figured it was a good day to make some white chicken chili!"
b3m2wl,St Louis style ribs
b1s3qg,Mediocre street taco
506gza,Easy White Chicken Chili
780eo4,The waiting is the hardest part
9d0huy,Slow cooker beef and broccoli served with rice (meal prep)
3wk35i,This dynamic duo is slowcooking's ally in the fight against watered-down flavor.
dd5uq4,Update on the pulled pork! It's done and delicious. Recipe in comments
betv3v,Pot roast.
baghfx,TIL that garlic can turn blue when cooking! My red beans aren't so boring this time around!
bt2dg8,Bacon and Cheese Dip
7xj2vb,"Snow is on the ground, chili is in the crock pot! It’s gonna be a good day!"
7d6gc2,My first try at slow cooker Chilli (9 hours)!
9o2yhl,Slow cooked chicken BBQ sandwiches
9k6do9,Creamy Tomato Tortellini Soup
8119ac,27 years old I decided to buy my first slow cooker. Couldn't be happier with the way this roast turned out.
6ru2pm,15 Meals in 2 Hours! Recipes in Comments
4m84go,My work owns this. I'm so happy I finally got to put it to use!
c3h7ww,Super easy BBQ pulled chicken!
9s8pkc,Made upvote tuscan chicken for my husband’s lunches this week. I think I’ll have to snag and hide some for myself...
7xpbnx,This Feijoada is the best meal you can make in a slow cooker.
acbmgl,Rosemary Lemon-Garlic Leg of Lamb
8dn88x,Venison BBQ Sandwich
5mekpr,See you in 9 hours! (Pot roast)
97tmtt,Chicken tortilla-less soup
9vzt54,Red beans and rice. Home style with cornbread.
55uton,Made pulled pork chili. Highly recommend!
75dm9j,Tri-tip roast with all the trimmings.
a0usz3,"""So-good-you'll-pull-yo-hair"" Porter Pulled Pork"
dnbzfg,"Wood chips slow cooked pulled pork (shoulder and tenderloin), waiting to be dipped in their liquids."
bhnptq,Zuppa Toscana for dinner tonight 😁
9yxyyz,"Finished pork belly with pineapple, jalapeños and soy sauce."
9tdli1,Indian Butter Chicken
1xjy33,It smelled so good until I checked on it!
dbqlhk,Rainy day calls for Salsa verde chicken enchiladas - see you in 8 hours
ba3qnb,Vegetable Scrap Stock
dh3orn,Baked potato soup for a chilly day
ar9bws,"I made pulled pork! The smell is amazing, can't wait to dig in this evening"
5ym7v4,My first time with Salsa Chicken... it was magical.
6pjvt5,"It's not the prettiest, because I already packed it up, but I love chicken and gnocchi soup"
9uhyb3,"Got the flu, chicken noodle soup ensued"
3vy4xk,"Dropped into the slow cooker before I head to do a final, I'll be eating like a king in 6 hours"
b6dam4,Shredded tri-tip tacos (the meat’s under all that sour cream)
b5z2gp,First slow cooker chicken chilaquiles ever on this subreddit and I created it myself!
8rdteq,Some carnitas I made last Friday for our D&D session. Happy Friday!
80evmq,I made Brazilian Feijoada for the first time!
6l7b99,Happy 4th of July! Here's my American BBQ Rib sandwich made with the help of my crockpot!
33dhvb,"My first crockpot meal! Made Taiwanese Beef Noodle Soup, my Mainlander boyfriend said it tasted authentic."
7359cl,bf and i cook in our new crockpot for the first time (rosemary chicken w/ potatoes)
4dc42a,Killer Slow Cooker Bánh Mì
8a47e3,"First time. I have almost no cooking experience. This is literally just chicken, honey and salt. Lets see what it looks like when I wake up"
79a7s2,Mistakes Everyone Makes Using The Slow Cooker
b7fqmg,Slow cooked beef casserole 😍
92ryj0,Butcher shop had a sale on ribs!
8v3js4,"First time making something out of my comfort zone, white chicken chili! I will say it’s pretty decent."
7c3qci,Potato cheddar bacon soup
b0mz67,Salsa chicken in the slow cooker for easy Meal prep
7tkr2o,Potato soup for the chilly sunday
7ogvew,Boom. Roasted.
7b65n7,Ham on high for 5 hours
45m0yc,My new WIFI crockpot!
8kpyui,Reddit tempted me to try Mississippi Pot Roast. Amazing dish!
dcizc0,"Made a pot of sauce for pasta. Used San Marzano tomatoes and a pork shoulder. Sautéed a sweet onion and Whole bulb of garlic and a full bunch of fresh basil, salt and pepper."
add3gj,Another upvote soup picture
9tm8os,Slow cook ribs are the best
82y140,Made pulled pork for the first time
d046x0,Ground Turkey and Pumpkin Chili
auxmav,"Slow-Cooked ""Barbecued"" Beef Burger"
9rtjle,"My friends think im weord for talking to food, you guys understand...right? (4h sausage casserole)"
34l7ir,Cross post from r/funny - it's only a matter of time for some of us...
9frnzq,Ya’ll talked about it enough. Chicken with Salsa!
9rl8ph,Crock pot chicken noodle soup! 😋😋
8urnec,My turn for creamy spinach tortellini soup
886naf,My lid shattered! Is the food safe to eat if I can remove the lid without the glass falling apart?
9vb77p,Reindeer stew
8ruldf,"I’ve been lurking for months, and finally pulled the trigger on a Mississippi pot roast."
6jl4yd,Slow-Cooker Mozzarella-Stuffed Meatballs And Sauce
bq4nq8,Slowcooked meatballs 4 hours to go!
au3chz,I don’t have a name for this. I just threw together some stuff that was getting to the use it or lose it point. It turned out amazing.
5z6rum,Slow cooker corned beef brisket - Ruben Sandwich
cfemxf,Finally made Mississippi pot roast. Woooow!
bihpgy,6hours in the slow cooker and 15minutes in the oven
9yq862,"Slow-Cooker Bread, Part 2 -- no-knead, ~70% whole wheat (link to recipe in the comments)"
5pg2za,I finally prepared this subreddit's rite of passage.
bb7u5p,My Inaugural Veggie Broth making effort begins!
7h2oa0,Amazing Beef Carnitas - Few Ingredients and Easy
8qbox5,Beef stew for tomorrow's tea
86gsez,Missisippi Pot Roast tacos
7lx1bu,Artichoke & Spinach Dip/Buffalo Chicken Dip
b747ln,Tragedy.
7psi27,10 hours later
664rrz,Made Slow-Cooker Chicken Tikka Masala from & it was excellent
8n4epg,Slow cooked improvised creamy chicken noodle soup!
525pjq,Chicken Chili - about $.40 per serving
87rwi8,See you in 8 hours Mr. Pork Butt
8cpuqp,[Update] Slow cooker feijoada! I'll post the recipe when I get home if people are interested!
5n4dd4,See you in 10 hours.
a2jepo,Slow Cooked Corned Beef
ca5nl7,"I see carnitas getting lots of love around here, what about Rancheros?"
729p0p,Slow cooked corned beef and sauerkraut in Guinness for a delicious homemade reuben.
41ei00,Slow-cooked Coconut Chicken Curry
5slrxx,It's like an onion-scented air-freshener(?) for the whole house. Don't cook if you live in an apartment building. Overnight French Onion Soup
bsvelk,Honey Sriracha Chicken with sweet peppers for meal prep this week.
3b3c7f,This bad boy is going in the slow cooker.
dvapxl,Beef and Mushroom Stew for a cold and rainy day! See you in 10 hours.
9wwehk,"I made the Tortellini soup, I'm sorry."
81s8fa,Slow Cooked Sausages in Caramelised Onion Gravy (before/after)
7gsw11,Carnitas money shot
90tq1j,My most heartfelt thanks to the people that recommended slow cooking ribs a few weeks ago
6rgljj,Something I came up with for summer: Cherry Balsamic Pork
59iaca,"Bold statement: Kenji from Serious Eats argues that in almost all situations in which you'd use a slow cooker, you are better off choosing one of two other options listed in this article. Your thoughts or experience on this topic?"
83nmkn,I think mine could put up a good race!
7ss65d,nobody ever writes how big your slow cooker has to be for the recipe..
dssaea,"A chilly, fall day called for cozy chicken and biscuits"
accl1g,"Carnitas Tacos, soooo freaking good"
9zk791,My Mom brought out the classic Crock Pot for Thanksgiving. I’m pretty sure it’s older than me
c9dpw5,"What I hope will be tender, sticky, Chinese spare ribs in about 9hrs - fingers crossed!"
a8f3ev,Something new...
88qnyq,8 hours till pulled pork
4bi0wt,Jerk chicken
2w0neg,Wonton Soup (inspired by my slow cooker chicken stock)
3ez8sc,"Red bean, sausage and rice"
5lmid6,First time slowcooker barbeque chicken
bacnrv,Split pea soup with bacon
7r9qs3,I let it cook all day while I was at work.
5wht4g,Moose chilli.
bsns4t,Pulled pork sandwich
7zhebc,pulled pork butt with garlic honey chili sauce
7mnn21,I made it! Thanks u/One_Big_Nostril for the article yesterday which inspired me to finally try the Mississippi Roast. SO loved it.
5f4mn2,My first foray with the slow cooker - Chicken Tikka Masala
9cdx6k,Finally joined the club 🤤
atamrh,All done!
9eo4ud,8 hour chilli
7pheka,I am pleading to this whole sub...
9ma0ya,Tuscan Chicken : 🤰🏼 Pregnant wife approved ☑️
8cyh3p,Wagyu-Angus Southwest Brisket Tacos
7mr2i0,Tragedy struck this morning
671fo4,What's your favourite 'showing off' recipe?
delr9w,Coq au Vin
af7rz0,Slow cooked octopus and potatoes
982151,Granpa's Spaghetti *Slow Cooking edition* Final product!
85zxpj,Never shred chicken with forks again.
43aacw,Slowcooker gif recipe - BBQ Pork Ribs
2n6itk,Chicken Tortilla Soup (it's that time of year again!)
5nugap,I made sauerkraut and Polska kielbasa for my cake day.
7ihblq,"Chicken and Black Bean soup, from a Crock Pot recipe book"
3lq6am,Creamy Thai Chicken Soup
bz534v,Love how this Beef Stew came out.
cbgwq1,Another Mississippi pot roast post. I hope the order doesn’t bother you.
5jd8x1,Mulled cider
dprgyb,Hungarian “Ghoulash” for Halloween - see ya in 8 hours! I’ll add elbow macaroni and 2 cups of water when there’s an hour to go to finish it
bv3jxx,Chicken Tikka Masala
2ks8vp,The result of 100 lbs of apples picked a week ago and my slowcooker running almost constantly since then (apple butter recipe in comments)
cb5nsh,Carnitas
buduzu,It’s always chili season
5tund5,Slow-cooked some corned beef and sauerkraut to make some homemade Reubens.
aetffc,Chilli rubbed slow cooker pulled pork w/iceberg luttuce and crunchy coleslaw Tasty!
8p57gk,"My first attempt at Mississippi pot roast, smells amaaaaazing"
82gzt7,Chicken Tikka Masala
bdm9c7,Guinness and Rotisserie chicken stew... pollen season in AZ.
djzciq,Coming home to this smell was the best. Mexican style shredded chicken. Nom nom.
9ixlwa,Crockpot Apple Butter tastes like fall.
71k42q,First Stew of the Season! So Excited for Tonight.
aii0ej,Sirloin tip roast is my favorite to slow cook. Melts like butter. Always tender and juicy. Recipe in comments.
7a4vei,Beef pot roast in and waiting for me after class today
73u31k,I made Brunswick stew for the first time.
7ixv98,Today I made apple butter for Christmas presents!
7cibon,Rainy Day Lamb Stew
a5fp10,"8 hours of slow cooker to make amazing beef tongue tacos, sounds strange to some people, but turned out amazing!"
5o4kg6,"""Texas Red"" Chile con Carne"
60le1r,My Girlfriend and I Make Boiled Peanuts
803b8j,Semi-dry braised pork shoulder
bshoi0,Beef carnitas burrito!
9z3g1e,Decided to finally get one.
9tub5j,Beef stroganoff
9940m4,It’s our wedding anniversary and we’ve already done a big celebration at the weekend so I’m giving this a go tonight
3nhlhe,Easy Chicken Curry
cu7fw2,"Dinner last night; pork loin and potatoes with apples cooked with hard pear cider, and a side of asparagus. Turned out great!"
855ahc,"Corned beef, one in the slow cooker one sous vide. Will update what the family thinks about each later!"
7ddzdw,My first slow cooker try is this (pre 8-hours of cooking) Beef Bourguignon recommended by someone on here!
4fekvr,"Slowcooker burst into flames, Cuisinart denies responsibility and won't help me"
8ylol6,"Crock-pot whole Apples with granola, maple syrup and a dash of butter, served with a dollop of ice cream - recipe in comments"
5w4s1a,Simple Cows Tongue
b0c18z,I made Beef and Broccoli (and cauliflower)!
7acp8n,"Followed the Mississippi recipe all the way to Flavortown, USA"
2rhrnq,"I got a slow cooker for Xmas, then I learned you can use it to make fudge."
96izgn,Asian Style Ribs
5x9gq9,Slow cooker ribs I made from this subs advice. Perfect!
5plea6,Super cheesy crockpot ziti
3zcnq0,Made some chicken and dumplings today!
9p4lnd,Creamy Tortellini Soup
6a72ug,"I cooked the Olive & Apricot, lamb Tagine that u\uzblot posted. Seriously good stuff! A big hit in our house."
3thfcb,[image]. I made those mozzarella filled meatballs
bazw8x,Beef carnitas: born in the slow cooker; reached perfection under the broiler
5a0hgj,Apple Glaze Pulled Pork
49ek5k,I gave that zuppa Toscana recipe a shot (with some small modifications) and it was amazing
784ecl,"Tomorrow is supposed to be chilly, so naturally I made...well you get it."
90qrdm,Cuban Shredded Beef
7gi786,"Cabbage rolls - not the prettiest, but one of the tastiest things I've made in the crockpot!"
693i5o,It's always the time of year for Pot Roast
anh3ho,Loaded potato soup in 8 hours!
5gkmch,"I made a mistake... a delicious, wonderful mistake."
3ugsgd,WTF has happened to my slow cooker?
68fbrq,I completed the /r/slowcooking rite of passage that is the Dr Pepper pulled pork recipe from the sidebar.
5ja604,Made some ribs in the slow cooker... turned out fantastic! Bones slipped right out... pretty easy recipe too!
a7h8zm,8 hour minestrone soup.
879l2w,I got a Chuck roast and didnt make a Mississippi Pot Roast
5tiut8,2 Years Later - Still BEST Baked Potato Soup EVAR!!
8gz6dz,"Bulgogi Sliders with ""Kimchi"" Slaw and Garlic Sriracha Aioli!"
2rcy1u,[RECIPES x40] The Slow Cooker Recipes You'll Never Want to Live Without
3qk72z,"Easy, lazy, healthy bolognese sauce"
altuxk,"6 bean chili with rice. First time making it, still learning the slow cooker ways. Be gentle"
8dq8j3,You guys convinced me to make the Mississippi pot roast. My god it was delicious.
7f3c8a,We do ribs instead of turkey! 🇺🇸🇺🇸🇺🇸
6qhuvo,Slow Cooking Sunday with an Angus pot roast
amv2sk,Homemade Butter Chicken from Scratch!
97bhga,"Pick-N-Save had a sale on whole turkey breast, so I went ahead and crossed that off my crockpot bucket list."
8pta7s,Simple Marinara Sauce (w/ help from a stick blender)
aksqk9,Super simple and tasty chicken “burrito bowl” for a chilly day
91f91r,Crockpot ravioli lasagna
52c9in,Slow Cooker Beef Bourguignon (recipe in comments)
b5q2zk,I made A Mississippi Pot roast From the Google doc that was posted a couple of days ago.
a7a3vb,I have the day off so I'm making a Beef Goulash 😊 I've not made it before but it smells delicious! Only 8hrs to wait...
bylpvt,A “I need to use these vegetables before they go bad” crock pot dinner!
bffxzx,(I made) Dolmades (stuffed vine leaves). Recipe in comments.
7qm1i0,15 Make-ahead Freezer-Bag Crock-Pot Meals
9kg5cd,Slow cooker beef stew and dumplings
3g1xlv,Slow cooked BBQ Chilli Brisket
99emid,6 hours away from some Jambalaya!
8e6sqq,Beef barbacoa is complete!
38cu8v,Moved to a new house and the tacky counters match my tacky crock pot!
3878dk,"My girlfriend's mum was about to give this to goodwill, I called dibs"
c9uvmt,I also was inspired by the carnitas on here recently! Hands down one of the best meals I’ve ever cooked. Here is what it looked like out of the slow cooker vs after a 7-minute broil. It was enough for the week and for a ton of frozen burritos for next week. Delicious!!
5gqyzu,"Chicken thighs, Rotel, Black Beans, Dirty Rice"
bdu41o,"When I think of slow cooking I think of winter meals (stews, soups, etc.). What summer dishes can I prepare with a slow cooker to pair with foods I make on the grill?"
