post_id,title
7o6u8n,"Newb mistake, I assumed a logic order of increased temp settings and 4 hours later my chicken is still raw."
74jsqf,so much chili mac. easy and cheap!
7pog1q,"See you in 10 hours, beautiful"
c8d61w,My slow cooker has a keep werm setting.
7nhglx,I WAS going to make chicken tortilla soup
3o9eel,Mozzarella stuffed meatballs
drz734,Mental health has been in the toilet for a long time but I have been experiencing one of my lowest points for about a month now. This morning I made self care a priority and made my first crockpot dinner plus a Panera inspired grain bowl for lunch. Feeling like I'm getting some control back :)
a1vsxc,Alaska just got hit by a massive earth quake...this was my only casualty.
5w9lej,Learned a very hard lesson in Newton's first law of motion.
83ghtv,Saw this fast slow cooker at the thrift store... $10!
8c9cl0,First date was awesome last night. Tonight she’s coming over to see what I’m truly made of! Wish me luck my fellow crockers!
591lwt,"We had a pretty productive Sunday, 20 freezer friendly slowcooker meals."
8mt9zn,Taiwanese Beef Noodle Soup
6zx0zs,Another pot roast
5q6y7y,"Oh no, I ruined my vegetarian chili with all this delicious thick cut bacon!"
5yyqi4,"Before the Rival company bought it and re-branded it as the Crock-Pot, here's the original slow cooker, the Naxon Beanery All-Purpose Cooker, invented by Irving Naxon 47 years ago - He was inspired to invent it by his Lithuanian Great-grandmother's bean & barley stew that slowly cooked for 18 hours"
66ozeb,Doubled my pot on 4/20 again this year. Beef ribs!
dpe2wq,Someone is VERY happy I made The Soup!
a1czjh,Chicken Tikka Masala with saffron rice and homemade naan
7l2oo4,Reddit Secret Santa really came through!
dmxvm1,"First time making THE soup. Added some melted mozz on top, 10/10 did not disappoint."
atkt5j,I found this at a thrift store. I was told y’all might enjoy this.
dijo9k,My husband made this handy shopping list on Google Sheets to make crockpot freezer meal prep weekend less tedious. I enter how many of each recipe I want to make and the ingredients update to show what and how much to buy.
7lyr5j,College student currently living on frozen pizza and pasta. Just got this for Christmas. Excited to to start working my way through all your recipes Reddit.
8nx0xy,Chicken Tortellini Soup! So happy with how it came out.
74bigy,"Chuck roast w/mashed potatoes, carrots and green beans..,kids said 10/10."
dapls4,Advertising at one of the local stores here in Aus.....
as7d89,Slowcooking has it's own pace
8fl8lf,Liquid gold: the essential party dip
7n9mpz,I too jumped on the bandwagon and made the Mississippi pot roast. Out of this world good.
8hsfqh,"[request] can we post more finished products and less raw food (""see you in ___ hours"" posts)?"
5rwmo1,"My coworkers asked me to bring chili for chili dogs and said ""a can of chili will be fine""....I couldn't let that happen!"
3jz1w1,My girlfriend and I spent 4 hours to create 13 amazing freezer meals. Bring on next semester! Recipes in comments.
c5jf9c,"Alright, I give in. First attempt at slow cooker carnitas."
agl13f,Made butter chicken in the slow cooker last night- the first curry I’ve made that tasted like it came from a restaurant! 👌🏻
7x35xz,Prepping for the arrival of our twins in a few months.
9r0ghn,Crocktoberfest at my office today. So far no fuses have been blown.
blyj6y,Made the Tuscan Chicken tonight. Added sauteed mushrooms to the recipe from the Google doc.
9gclyg,Where would church potlucks be without slow cookers?
8vbmsz,The dangers of moving.. Rest easy sweet prince.
4n5hh8,Slow-cooked mac n cheese
a6a20v,French dip with provolone cheese and horsey mayo
818nx1,I made Spicy Beef Ramen
c1rman,My crockpot is right by the door and I'm doing yard work outside. Makeshift cooler!!! #CrockTheCasbah
8xcos8,Anyone else sick of seeming the same meal over and over?
d257bm,When you want to cook curry but you live in a tiny apartment...
7vngof,"Made a Mississippi pot roast, shredded it and put it on an onion roll covered in cheese whizz for a religious experience."
bxsnvn,Had family over for dinner. Cooked the lamb shanks over 8 hours with red wine 👌
a4xxzf,North Carolina checking in with a snow day pot roast
dfin7k,The snow is flying so it’s time for tomato basil soup.
c11h4b,At the family cottage making chilli in Grandmas Very old Slow cooker.
9wkxcp,When you ask your husband to put the coconut curry veggie stew in the fridge....and he puts the entire crockpot 🤔
deazqm,Chicken and dumplings! 1 more hour
apa68p,16 year old’s first attempt at slow cooking. Decided to make “upvote soup”
9qgsuz,"A thick, cold fog has blanketed Seattle. In other words, it’s crockpot season."
6dtjft,Here's 6 different ways to spice up your crock pot Corn-on-the-cob
dbalry,Beef Bourguignon is ready to go in the Crock Pot! Feels like fall!
aw5lb4,I made this for the first time a month ago and I’ve made it at least once every week since then
7be8sy,10/10 house air freshener
cldclq,Made chicken noodle soup for my buddy who has pneumonia.
dkn9d0,"I like waking up to the smell of Mexican pulled pork - sue me - and since I don’t have a butler, I have to do it myself. It is delicious. It’s good for me. It’s the perfect way to start the day."
bvyk9z,$7 yard sale find. Not too shabby.
dvuuhn,Chili cook off at work today. I made a red wine and venison version. Wish me luck.
clw2rq,Slow Cooked Beef Brisket with BBQ Sauce.
6vany8,Oxtail Stew
4k9xqb,My crock pot is famous! As seen in Uncharted 4. (X-post from /r/gaming)
cyq977,The start of making cannabutter in my slow cooker! All in one step
bdba7y,"Had to eat this at 10PM because I didn’t time my cooking right, but it was worth it. Boeuf Bourguignon."
bh1r6f,My first attempt at beef bourguignon in the slow cooker. A bit soupy but still good! And I get to drink the left over wine.
8wnouv,Fine! I'll try the dang soup!
bcra7g,Slow cooked Chicken Broccoli Alfredo
8z2imj,Pulled pork after 10 hours in the slowcooker
8tly34,The chicken and dumplings I made last weekend! Not bad for the first attempt!
8vxa6v,"Made upvote soup tonight, and it is extremely delicious"
c49khs,"Carnitas topped with cilantro, onions, and queso fresco"
acvch3,Made some spicy meatballs stuffed with mozzarella and marinara sauce.
ahbz6y,Chili cook off at work today!
7hbd2j,Potato bacon soup
doih3g,I made the soup! It's a hit
3u94gp,We're having a potluck at work today. I brought the only logical item. (I was told you guys would get a kick out of this.)
cusmec,Bought a slow cooker today! Creamy chicken and rice
c6yoe9,"10 Hour Shift today... IM TRUSTING THE HYPE ON THIS SUBREDDIT, DONT LET MY DINNER DISAPPOINT ME!"
bno2x1,I was at my parents’ house this weekend and got to cook our Mother’s Day meal in this beaut from 1982
b45l37,I started making a google doc with the tried and true recipes from this sub and decided to share it. What else should be added?
7sd9qx,My first attempt at a slow cook recipe from this sub. Honey Soy Garlic shredded chicken. 10/10 tasty (recipe in comments)
d6me1o,"Proud young, First Nations woman getting better at my bannock. Slow cooked beef stew (8hrs) and bannock (fry bread)."
d8n9kc,15 hour slow cooked steak served with eggs and hash browns
ajp5a3,"At my work, we bring soup to share each Friday. Naturally, I made upvote soup. Lunch can’t come soon enough!"
bu5pzc,My dad surprised me with this beauty today. Italian beef with giardiniera peppers and dip. Closest in taste if not better than anything I’ve ever had in Chicago.
76jwfv,Apple butter made in the slow cooker.
aoienw,Started this 10 hour rump roast on a -5° morning
d59ir9,Homemade Chex Mix
au88gp,Meal two - slow cooked meatballs stuffed with mozzarella cheese.
7rshvj,We clearly need to change the name of this sub to Crockery Cookery
d1r8qo,7lbs of pork = 4 happy college kids
d64qud,Chicken tortilla soup
ci2dc2,Red beans and rice!
con9qi,Made this brisket recipe.... needless to say it was as good as it looked.... it was posted a couple says ago and I’m new to reddit and don’t know how to link the old post....
al3ny7,It's FREEZING outside but we have our first ever crock full of upvote soup :) so excited :)
46m21h,[Meta] Would it be possible for you to include the size of your cock pot while providing the recipe? It would help adjust the recipe accordingly.
8onw2n,Made the Chicken Tortellini from the other day. Confirming it is very good!
264fff,This sub ought to be called /r/pulledpork
9ajd49,Slow Cooker Creamy Tuscan Chicken. OP wasn’t lying...10/10
34fnlb,"3,125 Mix-and-Match Slow-Cooker Meals"
dqzstn,Staying with the wife's parents. Brought the slow cooker in a suitcase and made The Soup. It went down a storm!
9neh6y,Loaded Potato Soup!
d3csdk,It's finally cool enough outside for chili :)
6lik9l,Inherited my mom's first crockpot when I moved into my first apartment. The sentimentality adds a wonderful flavor
6wjso9,Crock-Pot Style Loaded Baked Potato Soup
5bhhar,I did it! Twenty slow cooker freezer meals in 4 hours
dcoapl,Chicken and dumplings
apbghp,"I made upvote soup! Not pictured: clenched fist, trembling lip, single tear."
43vvf8,Slowcooker gif recipe - Chicken Tikka Masala (crosspost from r/gifrecipes)
8vo1rt,Can confirm. It’s as good as everyone says it is
c7fzq1,Beer and Lime Braised Chicken turned Nachos!
awulfh,See you later stew!
7oqzd3,Japanese curry via slow cooker!
7mvyfn,"Not the most flattering picture, but this crock lasagna came out great!"
bnf4ri,Beef bourguignon served over rosemary sourdough with a side of mashed potatoes
dgvtji,Gearing up for a family potluck!
b7ogdx,Sweet sesame chicken served with broccoli over rice
96auu0,Nothing like opening the lid right after coming home from work
9azd0i,Looking forward to my carnitas after work
9wpgkq,Made the butter chicken that’s been posted on here a few times. It was delicious!
dnvdv0,7th annual chili cookoff amongst friends
dc0nph,Terrible picture but i bought my first crockpot yesterday and today i made possibly the best meal ive ever had. Beef roast with potatoes and veggies 8hrs on low. Im in love
cwrok2,Crockpot Carnitas! Before and after the slow cook.
cqcock,Slow cooked Mexican pulled chicken for tacos.
bp0zlw,Sweet and Sour pork for the first time!
c3pon3,Carnitas on the way!
bqbmpx,RIP my friend of 10 yrs... You will be missed
cgtjw4,7 lbs of Carnitas!
1xcpe8,"It's the simple things in life, like waking up to the smell of cooked chicken BECAUSE I PUT ONE IN THE CROCKPOT WHEN I WAS DRUNK."
cw69gl,Slowcooked brisket!
a97fqx,New Christmas Eve tradition!!
draash,My first slow cooked meal! A white chili with chicken and everyone was impressed
adnj8p,I tried making slow cooker French Onion soup and it’s as amazing as it sounds!
aiauao,"I Took a Stab at Upvote Soup for Sunday Night Dinner. Suddenly, My Whole Family Thinks I’m a Great Chef."
dvkpey,"First Post, Chicken Dumplings during the cold snap in the south"
ca8053,It's chicken stock day!
60agj2,Oprah says this is how you're supposed to stack your food in your slow cooker
9x4oak,Lazy Lasagna
b2564e,Happy St. Paddy’s from Boston!
d7s4vt,Nothing groundbreaking but I’m excited - the first applesauce batch for fall!
7z5kub,"Got this for $5, how did I do?"
9u2lk9,I made THE chicken tortellini soup.... and immediately went and took a nap.
c52te5,"My heavily-seasoned carnitas slow cooking on low for 7hrs in fresh-squeezed orange juice, squeeze of lime, veggie broth, garlic, and onions."
9vog63,I was gone for a couple hours. My Beef Stew decided to turn into Beef Stewn't
6z4wz2,It feels like fall so I made a pot roast
bc1wpm,Beef stew made with Guinness.
ag1nv4,Potato Soup (recipe in comments)
7wfbpr,What better way to weather a winter storm than with a department crock-pot fiesta?
aqjy9k,Upvote soup with Italian sausage
atw7a9,Bought a slow cooker yesterday.. delicious beef massaman curry today!
8206nn,5 hours until French Dip sandwiches
7meiuz,"""Fifteen years ago, a woman named Robin Chapman made a pot roast in her slow cooker. Now known as Mississippi Roast, it would become one of the most popular recipes on the web, an unlikely star with unlikely ingredients."""
5da44v,Loaded Slow-Cooker Potatoes
8sqk7e,It’s a chilly 4°C (39°F) in Melbourne tonight so I’m treating myself to a hearty beef stew!
duwi89,My first time making gumbo
78cmlw,this butter chicken was 10/10
cbo76d,"i, too, tried the mississippi pot roast for the first time yesterday. turned out fantastic."
ce36k9,Mississippi pot roast through a steamy lid
az7tjp,Polish Hunter's Stew
8ardyn,Guinness and Beef Stew with dumplings
aa18sz,That Jalapeno Popper Chicken is something else
d4x3nl,"Delicious Slow Cooker Creamy Tortellini, Spinach and Chicken Soup. My kids loved it, they had 3 plates each!"
c5uwo6,Dat gun be good
7y09wl,This subreddit has become a forum for Mississippi Roasts
deqg70,Effortless Crockpot Pasta
daexrl,Slow Cooker Honey Soy Chicken Wings
cj1rtx,My daughter is pretty proud of the cake she made
b4k9ti,"Visited a farmers market for the first time and bought too many apples, so I decided to slow cook applesauce!"
a6k08t,"I tried the butter chicken that I saw multiple posts on, it did not disappoint."
am5src,The best tomato sauce I’ve ever made. Using it for Chicago style pizza tonight!
7u547z,My grandma wanted Pot Roast. So what she wants is what she gets!
5r8g64,Eating my 20th portion of tikka masala i made 3 weeks ago!
bvpioa,My Favorite Chili And Corn Bread Recipes for A Rainy Day :) (recipes in comments)
9hfllm,"My boyfriend made carnitas in our slow cooker, and they were melt in your mouth good"
djngas,My first attempt at real chili
b3dtgx,Creamy tortellini soup with sweet Italian sausage and chicken
aruyzi,"When they bail on birthday dinner, make the best for yourself!"
co4qfw,Simple Pot Roast
d08yeo,Guys...I know wings are probably a tired subject. But these were legit.
6rlutt,Here's the final product after an 8 hour corned beef cook.
d0hbq0,"Just threw what I had on hand in the crock pot, can’t wait!"
dm2flk,My fave part 😍
dssjmg,Texas style chili con Carne!
dfp4fv,"Tomato basil soup complete, as requested."
c0jak0,Slow cooker mixed berry cobbler with vanilla ice cream! Tasted like it was from a restaurant.
87b4bv,I call this... “the produce is about to expire”
8x2i14,"Allergic to chicken, made the soup with pork chops"
34tqif,R/food likes my crock pot chili. Figured I'd share with you guys..
805l0t,No longer will I have to use my jobs nasty microwave.
5na4wd,"Anybody else sick of the ""see you in x hours"" posts?"
at34fi,12 hr marinated hoisin honey pulled pork
4ns0ak,Slow-cooked beef and broccoli
ccs1j7,Chipotle Chicken Burrito Bowls
dk7mce,First slow cook of the season! Chicken parm soup (recipe in comments)
9ijru8,"Since it's pretty much autumn outside, I felt like making a hearty beef stew"
9zf5ca,Thanksgiving is in.
c31ery,"Slow cooker rice pudding, one of my favorite desserts/snacks/things to keep in the fridge"
9pkpgf,10 hour brisket spicy Ramen noodles !!!
9xmw8v,Blueberry Cornmeal Tea Cake
9uqa5w,Slow cooker butternut squash soup! Just in time for Thanksgiving
aj3ido,Had to give the famous slow cooker butter chicken a try. Exquisite!
8yfvxq,"8 hours in the cooker and a broiler finish, these guys came out great"
5qw587,"UPDATE: Final product from my dorm room super cheesy spinach and artichoke dip, recipe and crock pot pic in comments."
a707tt,Made that chicken tortellini soup last night and it was incredible.
23lcxe,"This year on 4/20, I doubled my pot."
ciinti,My attempt at Lemon rosemary chicken
chd1aw,Rosemary chicken with carrots and potatoes
7nqjgr,My 2018 is starting off on the right foot. My poor brisket
d3s51o,I made the famous chicken tortellini soup
b0ueeu,"Finally made the creamy tortellini spinach and chicken soup, and my entire family approved, including a picky toddler and an even pickier guest!"
79ynij,Cauldron cooked BBQ brisket for Halloween
ddoi6k,I'm thinking of buying of it. Do you all think it's a good deal?
7ojzxf,"Just done my first ever big meal prep, really looking forward to trying out each of these recipes!"
bwzs8g,Slow cooked chicken with mashed potatoes and grilled courgette/zucchini
94m5lf,A scandinavian attempt at the Mississippi roast
dxoctc,I always gets a little anxious on Sundays; dreading going back to work the next day. But it’s not so bad when I have this delicious feast waiting for Sunday dinner.
brw0u2,First attempt at slow cooked Pork Carnitas and wow these are delicious.
4lf9zf,Baked a loaf of bread with a slowcooker!
9oonr3,In 6 hours m house is going to smell amazing
ct2isx,Got this at an estate sale for $5. Looking forward to my slowcooking journey.
cyay31,"It's been unseasonably cold, therefore beef stew season has come early."
cfoahg,"Going Boating, see you in 8 hours."
c9mczu,"Your carnitas inspired me to make carnitas and they are out of this world. I introduce, my carnitas"
7wr5ii,Made the Mozerella-stuffed Meatballs but with ground turkey instead of beef cuz I gotta be a good Hindu
bpe57o,Slow Cooked Chicken Alfredo Lasagna Rollups 🙂
cv9q0c,"TIL that barbeque sauce, without extra water, can burn meat. Don't make my mistake!"
asmdub,"Mod-post: Now removing all posts that have ""upvote soup"" in the title"
3s28cw,I made some spicy coconut curry chicken this weekend.
cekqqy,"Asian inspired slow cooked pulled chicken. Good for topping Asian style nachos and tacos, or on top of a rice bowl."
7cpn7x,"I can't wait to get home from work...pork tenderloin, red potatoes, and carrots."
7v756y,EASY Crockpot French Dip Sandwich!
5s2nut,Made 12 Hour beef stew. Originally wanted to let it sit in the fridge overnight for the game.... couldn't resist....
bbgtl6,Low-country Boil
7qjz6x,Deer baron roast. 9 hours on low.
dmipg9,Korean inspired pot roast over rice
bklpvu,8 Hours Beef Stew - It’s ready and the house smells amazing
b59m3x,Made Tuscan chicken last night... a new favorite recipe thanks to this sub!
bioixo,Scratch chicken noodle soup and homemade sourdough
a9grod,"Ham was too tall, had to get creative. Merry Christmas!"
dwrogo,See you after work carnitas!
dgec3b,Tacos with slow cooked pulled pork
axmbd5,"My favorite dish, by far. I make it almost weekly. Thanks Reddit!"
77w0wf,I made pork loins and potatoes today for under $5. I love how my house smells when I use the slow cooker. The best part was that my daughter actually ate onions.
dqbrnc,First ever slow cooked meal I made! Not too bad for someone that burns everything. This sub has given me confidence to finally take initiative in my meal prepping! Thank you all
drlgk0,It’s that time of year in the upper Midwest when chicken soup is a staple of the season.
cevf0x,Keto Meatball Pizza Bake
a09lqd,"Slow cooked shredded beef with roasted red peppers and diced pepperoncini. I opted for the finished product instead of in the crockpot, hope you don’t mind."
3p65zi,30 slowcook meals done and ready for the freezer!
d6ydk2,"Beef Stew in 8 hours, perfect start to the Fall."
bex2df,BBQ pulled pork & mac n cheese 🤤
aimn32,Tortellini soup! Collage of this subs soups in this past few months!
d2yrui,Just got this Crockpot for $6 at target! It’s only 2qt but that’s good enough for just me.
6ogid2,Mongolian Beef
584l9v,Crispy pork ramen ^_^
9xvvqp,"had to make ""Lazy lasagna"" I seen on here. I woke up to it half gone"
dx8pep,"Lemon garlic chicken, I mixed the leftover broth with some flour and caramelized onion to make a pasta sauce"
9l858w,In Memoriam
8w77op,"I, too, made upvote soup!"
abi8ds,Little different cut from normal: deer neck barbacoa tacos. These were the crowd favorite
7jmy1h,Smells like Chicago.
752j8v,Perfect food for a cold and wet autumn day.
93r39p,"Tried to add finger to slowcooker, but no flavor?"
cqrpot,"Before and after of short ribs and gravy. The taste was great, the smell in my house for seven hours was even better!"
a1n3n4,A&W Rootbeer Pulled Pork with Coleslaw
7fwqob,Learn from my mistake!!! A PSA about dried beans
dll8mf,My actual award winning chili
777rz9,As promised: Jamaican beef stew aftermath. Best thing to come home from class to!
ayafxj,8 hour beef cheeks with red wine mushroom sauce
ahmsg6,We know about upvote soup. How about some upvote bread bowl? Creamy chicken tortellini soup in homemade sourdough bread.
a6pban,"Hard to beat waking up to the smell of not one, but Two slow cooker breakfast casseroles! ! !"
70q8kw,NFL Gameday Gumbo!
clo854,"Sweet potato, black bean, and quinoa chili before adding broth, tomato paste, and molasses. Vegan’s delight."
dl01u6,Filipino pork belly and pineapple adobo
98gsl5,Chicken and dumplings after 5 hours
9jft8y,Been using a 45$ turkey roaster from Amazon as a crock pot for awhile for mass meal making. 35$ in ingredients from Costco gets me 27 16oz containers of southwestern chicken soup for healthy lunches.
516gjy,5hr Wine Braised Beef W/ Mushrooms Over Roasted Garlic Mashed Potatoes
8fsmrk,8 and a half hours later... we have beautifully crispy carnitas. This has become a regular Sunday thing now!
8ddilt,About to turn on my air freshener
b51te9,Slow cooker chicken Tikka masala w/homeade naan bread
cfu2y9,Tried making bread in the crock pot today.
df4qhc,Vegetable stew with cauliflower and coconut milk
dp3fnz,Chicken and Gnocchi soup for rainy night dinner!
ax9354,It was a perfect winter day here in the NW to finally try out the Creamy Tortellini Soup!
apj0gr,Tomatosoup and cheesy garlic toast
bem1yt,Behold! The pulled pork pizza sandwich!
76rgms,Classic beef chuck on mash potatoes
c68kg7,Someone gave me the Pork Carnita recipe... oh my!
d868nx,Six hours slow cooked beef stew
aamb71,Slow Cooker Beef & Broccoli
dqrv0i,Ok you were all right. Used hot chicken sausage and tri color tortellini
bmkvvs,Slow cooked a tasty mushroom broth overnight so I can have this for lunch :)
85qweo,My attempt at the mozzarella meatballs
bf7jz7,Slowcooked taco soup. Probably my favorite thing I've made with it.
bivozj,I like...pig...butts and I cannot lie
d6difr,First attempt at ribs in the slow cooker and they were amazing!
7wmpml,Old Vs. New
bt74xp,Slow cooked sweet BBQ beef brisket for a stormy Sunday night in Aus
3tpc9b,It's Cider Season!
di7wty,Taco Tuesday carnitas! See you in 8 hrs.
cm9cd8,Creamy Lemon Chicken
43ed5l,Recently got a crockpot so I searched the top post of all time in this sub and I made it. Mozzarella-stuffed meatballs!
acjep0,Italian Pot Roast over Parmesan Cheese Risotto
azn0j5,Korean braised short ribs
aum05z,Mississippi Deer Roast - Canada style.
7v1bdi,Home made tikka masala! Amazing!
ay1chh,"Peruvian aguadito de pollo (chicken, cilantro and rice soup)"
9y7ur9,Hawaiian Meatballs
dhu6ia,"Wild Turkey Barbacoa, See You In 7 hrs"
avsen6,BBQ chicken tacos
9c79qd,"Attention gate keepers, I made unauthentic jambalaya in my crock pot, was delicious no regrets"
dwd8sk,My new favorite
d1acw3,20 year old beauty has seen many delicious recipes over the years.
9xdc44,Hubby just got me this because I mentioned to him that I missed having one 🥰😍
303n12,"Hey /r/Slowcooking, you're Subreddit of the Day! Congrats!"
du3ojb,"When the handle breaks halfway through making 'the' soup, you improvise."
907zqg,He thinks they'll be some left for him
7yvq7n,Slow Cooker Butter Chicken before/after
cd5cw0,Chicken tomato curry
9nx16v,Fall incoming in 8hrs
bmqo7s,Asian pork tacos with grilled pineapple salsa for a yummy weeknight meal
6fd65h,"My no heart disease, cheap ass, still tastes good, #dontgiveadamnaboutinstagram compilation"
2nflcr,My arsenal for Thursday's meal
8wvfx1,"Broke in my brand new cooker with the upvote soup. (I wasn't disappointed, ty guys)"
dnlsxq,Crock pot burrito bowl
b1e44t,Chipotle and creamy cheese potatoes - see you in 4 hours
b6n9nv,Carnitas Street Tacos
56y2f6,Fall Weather Means Crock Pot Potato Soup (recipe in comments) topped with Shredded Cheddar and Complimented with a Grilled Cheese Sandwich
ahtgkv,Coconut turmeric chicken curry
cvh4qb,See you in 8 hours tomato soup
ckd1hi,My first ever meal in my first ever crock pot! (Mississippi pot roast)
cpckyw,A slow cooker vegan lentil and sweet potato curry served over some steamy rice :)
3bvgqr,My first attempt at a pizza
dfw5te,Chicken taco soup 🍲
9kn863,Crock-Pot red beans and rice for a rainy Monday.
5d17mr,"Yes, I know how it looks. But Swedish yellow split pea soup with pork is great comfort food for when the Nordic autumn days grow shorter and colder."
1w4oml,The reason this slow cooker got returned is interesting... (repost from r/funny)
d0uz8c,Arrrggghhh when someone cuts you up when you've got the party's most important guest!
bveb6d,Trying to keep up with one new recipe a week. This week is Summer Beef Stew! Delicious and fresh!
8nn0yd,I had heard of this happening but now I understand. RAGE.
8iewdi,"Slightly drunk me decided to put a couple of shanks in the slow cooker overnight. Results were very satisfying. Woke up to a delicious, unexpected smell."
7eak2y,Creamy Chicken and Wild Rice Soup is Perfect for a Rainy Day
cg1pfn,Chilli con carne (recipe in comments)
caswmb,Sunday’s Chile Verde
a8521d,Smashed Potato Soup in a Bread Bowl
amqodz,Preparing for Superbowl and hopefully a Patriot loss today
dizpfj,2 days worth of Crockpot Apple Butter.
7k0lxw,10 great crock pot meals ready to freeze! Recipes in comments
ctlhf1,Reindeer stroganoff
88mpyr,I made slow cooker Barbacoa! Tastes EXACTLY like Chipotle's barbacoa
aac0cx,A mix of Indian slow cooked dishes.
bkw14s,Hong shao rou (red braised pork belly)
9v1def,Turkish Lemon Chicken Soup
ae8la4,And so it begins... Cream Cheese Chicken Chili
b2hym5,Last week's chipotle cheesy potatoes - after shot!
2v52b7,Honey Sriracha Chicken Wraps - Best thing I've tasted in a looong time
57rum7,"First roast of the season all prepped, now into the slow cooker we go!"
afqc87,"Best roast I’ve had to date. Of course, recipe in comments"
cmiv83,Gave Ropa Vieja a shot. Super simple prep.
