post_id,title
cs5037,More meal prep! Lemon garlic chicken (with stovetop rice).
88f0os,TIFU Turkey breast and heirloom carrots... purple carrots. Everything turned out brown.
bmdd9g,"Dry rubbed, slow cooked, basted, and broiled!"
9zvloy,4 hours in the crock 10 min on the fry pan pork tacos
as0xj6,Slow Cooker Carnitas
cxhsdk,Something tells me it’s been awhile since I used my slow cooker. Bring on Soup Season!!!
4jn7i0,Thai Beef Curry
b13ifq,Jamaican jerk chicken tacos with mango salsa!
aekn81,"Rump of beef slow cooked for 8 hours in red wine, stock, onions, mushrooms & Carrots. The meat fell apart"
b1k4kg,When you’re craving Chinese takeout 🥡
amy3ph,First time making pot roast in my slow cooker. Will do it this way from now on!
aljnt5,Some Bolognese sauce to make college a little more bearable
57jfdh,"My favorite Fall meal, slow-cooked beef stew and homemade rolls."
69v53i,So I made that bahn mi.
9eu2bq,"First time ever slow cooking, made honey garlic chicken. Also my first ever posting on Reddit. So double jeopardy right?"
dhb8o7,Lamb and butternut squash stew
9w6xc8,Potato and Kielbasa Soup
8lshu8,Pineapple Pulled Pork Carnitas A+ would make again!
9ac1fb,Y’all... I think I died and went to heaven. It isn’t the prettiest but this Tuscan Garlic Chicken + Potatoes with homemade Alfredo sauce is to die for. 10/10.
ckt3s0,Slow cooker Asian style pork spare ribs
863xiy,Company-wide Chili Cook-off!
buj9fb,"Pulled pork tacos, ft. mango and lime salsa! Cooked on Low for 10 hours"
cgesm9,Made the Asian pulled chicken from here and whipped up a sushi bowl. Very yummy!
bw8fwz,Lamb shanks in red wine sauce. Absolutely delish on a cold night with some cheesy risotto.
alefhu,Hearty Chicken Stew for Polar Vortex Chicago!
cnr8zz,"Honey, Ginger & Lemon, perfect for coughs or sore throats"
9px0wm,"It's getting colder here, so some Super Gravy was in order."
av5vtz,Beef Barbacoa
9tp29g,Suggesting a collage format to show the three primary stages of slow cooking. Hatch Green Chile Stew; the most delicious green trash water you'll ever eat
b2wt6m,My grandmother's Thai coconut curry
abtmh5,"I have made the tortellini soup. So flippin good. Would make 1,000 more times no question."
dt6l3k,Jambalaya in the crockpot and we all loved it. Definitely a keeper!
7m8bii,Longtime lurker but first time posting. I present to you my Mississippi Pot Roast.
cz73c4,"3 meat chili, obligatory see you in 8 hours!"
7qd9ky,8 Crockpot Freezer Meals in an hour
81llio,It's cold and everything is awful but this pork ramen is not
b8zlld,10 hours of slow cooker perfection
azvkop,Irish Beef Stew :-) (link in comments)
c413bf,"What do you do at 3am when you can’t sleep? Prep for carnitas, of course"
9sfmll,Slow cooker chicken wings. They came out super tender and tasty!
cl288e,"This was the perfect dinner after days of being too sick to cook. Took about 10 minutes of hands on time, made the house smell amazing, and tasted like a dream. - Beer Braised Pulled Pork with Homemade Hickory-Maple Barbecue Sauce."
b2nzgs,Before and after adding cream and butter. Sweet corn chowder for an end of winter almost spring night.
apsarq,Slow cooker spicy barbacoa
8hjr9s,First attempt at Carnitas!
7yepye,Cilantro Lime Chicken. See you in 8 hours.
c7uujh,Irish Pot Roast
1x4xno,"I got my first slow cooker last week, and today my roommate thought it was a good idea to heat up some pot roast on the stove... in the pot :("
dxfp6z,Chicken and Wild Rice Soup for the cold weather!
9solf6,Slow Cooker Keto Beef Gyros
7pajyp,Made BBQ chicken in my Crockpot after getting it for christmas!
80mz83,"Just moved out, I hope this is a good start!"
ab0mv2,"It’s been seen, it’s been done, but here is mine!"
d46mpq,First time doing pulled pork. Now the waiting game
8uc912,"I made one too! (Creamy tortellini, spinach and chicken soup)"
7lbqs1,Today I'm making turkey chili in the crockpot I received as a wedding present in 1971. Rival brand with removable pot and replaceable glass lid (broken more than once in 40+ years). Bonus: burnt orange! What's not to love?
5kgclq,Pulled pork was a success! I am now expected to make it every year.
9ddvpf,Chicken Chili bowl after 5 hours. Oh and Peach.
crq1vx,Very handy tool for slow cookers ...
766c8t,"Ah, the beginnings of a good Guinness stew."
87z95b,"Girlfriend doesn’t use reddit, but spies on me when I scroll, and had me stop on u/cpe3 ‘s pot roast. She followed the recipe and voila! Thanks r/slowcooking!! Delish. Recipe screenshot in comments."
anl3db,17 hour slow cooked beef stew!
9znexy,Happy Thanksgiving slow cookers!
ak0gz9,Made ribs today. Turned out fantastic!
awnbje,"Goodnight oxtail pho, see you tomorrow!"
a0k9f9,Green Bean Casserole with Bacon
910491,"Ten Hour Cook Time, Home Grown Potatoes, Home Grown Carrots, Traditional Pot Roast."
9jx86k,Fall Is Here...Gumbo Time!
46rvbh,Made Korean Beef this evening.
2wd4qe,Moving in with my boyfriend. Meet the extended family :)
2dojjv,Super Easy Chicken Tikka Masala that tastes as good as any Indian restaurant can make--Recipe in comments
8r27mh,1st attempt at a “faux-tisserie” crispy whole chicken
aot4w0,Ropa Vieja
8zut75,"Many r/Slowcooking recipes call for ""BBQ sauce"" but I was ignorant of the different kinds until I saw a regional breakdown graphic in a video"
dmb5iq,My Pregnant Wife Requested the Famous Soup
9y220z,I made the butter chicken someone posted a couple days ago. It was amazing!
7wsyb2,Finally pulled the trigger yesterday on the Mississippi Pot Roast. Believe the hype.
b6vxsr,What a way to kick off the weekend
a7oaic,"Meatballs, Sausage & Sauce for office potluck"
7arg0z,"Lurked here for awhile, finally decided to make some pulled pork with the roommate"
6t13mr,Italian beef on a homemade sandwich roll
6s5952,"Slow cooked barbecue ribs, slaw & wedges"
c2cb5d,A finished slow slowcooker meal to offset the uncooked posts.
7ls7pu,10lbs of pulled pork for an American Legion Christmas party
7r23oc,Carnitas for burrito bowls on this snowy day
bn34cb,Slow cook Bbq chicken and egg sandwich. My first recipe!
afkojj,Slow cooker Crunchy Fudge! Recipe In comments.
7wwqd9,Possibly my favorite new slow cooker recipe! Kung Pao Chicken
9dokuv,I make boiled peanuts for football season every year!
9ogc5y,"My ‘Popeyes Ain’t Shit!’ Red Beans and Rice, New Orleans style"
ccgudr,First attempt at Mississippi Pot Roast! Very easy and turned out delicious
9f8src,My cuban sandwich after pics as requested.
bxl6mk,Slow Cooker Shredded BBQ Chicken
8juv5y,Kalua Pulled Pork
b3xbep,Pot Roast
7eii7f,"As promised, the ""sauce"" for pasta fagioli (pasta and beans) after 12 hours. This'll go over top of some rigatoni with a bit of butter and fresh Parmesan."
6hmfmp,Ropa Vieja - a Cuban dish of spiced shredded beef (recipe in the comments)
djci13,Korean beef and rice with sauteed vegatables
blbpk0,Just finished putting together a chicken noodle soup! Hoping it turns out good!
9tzlc4,First Crock Pot Meal: Pulled Pork Tacos
cvx9dc,Sweet and sour meatballs
9aa4b8,In 5 hours I’ll have some Tuscan garlic chicken and potatoes with homemade Alfredo sauce. Posting both recipes in the comments :)
dtilu1,Made some vegetable curry for tea :)
9cpch1,A terrible thing happened today.
9yh5ts,Ropa Vieja (Cuban shredded beef)
81szzl,"The finished product of this recipe rarely gets posted, so.. Mississippi pot roast sandwiches"
byjyj8,Pulled pork from slow cooker - first try
9258lw,Creamy Pork Chop Soup over a bed of rice. And one sneaky doggo.
7afri7,Went on a thrifting run today and spotted THREE vintage crockpots!
8ilhp6,"My first ever slow cooking adventure was a grand success! Seasoned chicken, potatoes and green beans. So hearty. So healthy. Sooo easy."
7s0xle,Honey Garlic Pork Ribs..broiled in the oven for 8 mins to caramelize
6uky1i,"I wanted to comment and say ""WELL THEN CLOSE THE DARN LID!!""... but refrained."
an427t,2 Day Carnitas for Super Bowl Street Tacos
40xwh2,Crockpot caramelized pork ramen
bwcno4,See you in 10 hours. Portuguese lamb.
88yeit,Bbq pulled pork 14hrs later
7qtf5j,"My attempt at whole30 ""gumbo"". It ain't got a roux, but it'll do!"
9kbca2,"Tried my hand at this creamy tortellini, spinach and chicken soup for fall! First slow cooker recipe ever."
avi6nz,Lunch break meal prep! Buffalo-lime chicken
9n6fk7,"Added a ghettotech Reynolds wrap second deck to my 1971 crock pot to cook some redskins and a bulb of garlic over my pork concoction. A worthy experiment indeed. Mashed those spuds with the garlic and hot damn son of a bitch, dinner is served. Sorry if things seem a bit sideways."
ajetp0,Pasta Fagioli
6nvaji,Trying out this little guy.
cq0jl1,First real meal in my new apartment....Garlic & Herb Pork Loin Filet
c0a7pp,Slow cooked saffron pears
bfqpdd,1st attempt at Slow cooker Duck Confit. If all goes as planned I’ll put the how to in the post. Wish me luck!
afcixo,Made my first crock pot anything!! Buffalo chicken dip!
3pxoeg,Mozzarella Stuffed Meatballs from that GIF - now with less GIF!
awh8kn,Chef John's Rigatoni alla Genovese adapted for the slow cooker
9jscx3,Homemade pork ramen
3m8jdf,"""Issue"" with slowcooker (xpost from /r/funny)"
2qe7c0,My grandparents hooked me up this year.
9id4gx,Hearty Fall Chicken Pot Pie 🥧
30k3od,Leftover Pulled Pork? Pulled Pork Grilled Cheese for Lunch!
ag99in,The Famed Mississippi Pot Roast - Done slightly different (blurb in comments)!
ddgkbr,Spicy Mac And Cheese with Bacon! Recipe in comments
cn647j,Horseradish cream pot roast with mushrooms and onions
1v1gxz,44 Slow Cooker Recipes with 4 Ingredients or Less
7040cz,I made some sesame beef stew! Probably one my favorite beef recipes.
aivs8o,"Easy, delicious comfort food. Chicken and dumplings!"
bydzgc,"Slow cooked ribs, finished off in the broiler. So damn delicious 🤤"
a3fn6m,Found this beauty at a Savers. Best five bucks I've spent :)
92x4ox,Can't wait to eat this Jamaican jerk chicken later
679ctm,I made the Honey Garlic Chicken from the showing off thread =)
d9kj2r,8 hour slow cooked lamb stew with cheesy scones!
938jzt,Chorizo & beans... the results!
2sssao,20 meals prepped in 6 hours.
akngts,Cashew Chicken
6p3eqs,Meatballs NOT stuffed with cheese!
ayh6ts,Zuppa Toscana soup
a107ce,(Leftover Thanksgiving) Turkey and Dumpling Soup
73lm71,BBQ pulled chicken - First time ever using a CrockPot
8odke6,"I won the online auction for this bad boy recently, paid 180 zł (roughly USD 50). Super stoked about it, she's got my first ever chili brewing inside. So excited to start cooking for myself!"
d2q9u8,Meat ball subs
6pvbwu,Another Gammon joint that just fell apart!
872942,Carnitas! One of the best smells in existence.
7utqt5,Now we play the waiting game
bg7bz8,24 hour pulled pork. The bone came out completely clean.
a60fco,Jalapeño popper chicken was a dank dinner
9o7vgg,Don’t judge my chipped bowls. Lol! Vegetable beef stew cooked low and slow all day.
743slc,Nachos with guajillo chile pork made in my slow cooker
7pxdz0,Paprikash
akxady,Gonna be a high of 0 degrees for the next couple days so I made a big batch of chili to get me through
9nqh13,Crockpot Beef Bourguignon.
c4o1y5,Joining the carnitas train! Chugga chugga Choo choo! See you in 10 hours!
7yo5o7,My first slowcooker dish. White chicken chili.
adw76b,"Tried my hand at Corned Beef w/Cabbage, Carrot, Onion & Potato. SO Good!"
8k63np,I got tired of stews. Pork Banh Mi!
84o4gk,BEEF OXTAIL 8 hours to go!
84ddpn,Corned Beef Brisket T-8hrs
af1c44,My very first slow cooker whole chicken - finished result!
dsh6a4,Going in on Mississippi pot roast! see ya in 8 hours.
43zttq,Slowcooker gif - Mexican Pozole
97hteu,"General Tso - Turned out amazing, recipe in comments"
6skivw,Are meta posts allowed? I think some people need a reality check about slowcooking.
6155tp,"10/10 with rice (honey garlic chicken, recipe in comments)"
an5wln,8 years of slow cooking and I only just thought of this way to tidy the cable!
dosc9d,"Just got this as a present from my gf (its a chalkboard finish) it's 3,5L, what should I cook as my first real slowcooker meal?"
7gmod2,Simple crockpot baked ziti
5ebdgv,Slow Cooker Cranberry Apple Pie Cobbler
a8wo7w,A little Christmas-Eve-Eve roast so that I can have leftovers this week while my fiancée is out of town
4qy9q5,Got to keep the in-laws in check
btuoq5,Studying for the bar means maximizing my (limited) free time - ground turkey burrito bowls!
92ein4,Hot and spicy bbq pulled pork with chips
a3od2x,Apple BBQ Pulled Chicken Sandwich w Apple Slaw
7bmgsy,Minestrone soup. Very good vegetarian soup
972z6g,BBQ pulled pork.
48qwfq,"Zuppa Toscana (Yeah, like at Olive Garden)"
c27zq1,It was a beef hot pot and it was delicious.
6birgr,Beef stew with dumplings.
ammw3g,"I made upvote soup, was not disappointed"
7ri34o,Nothing beats a bowl of slow cooker French Onion soup during this cold weather streak in FL!
5rgtla,Lucky(?) coincidence that I started chicken noodle soup before work and then caught a cold while I was at work...
dtwl9d,Time for some fall cookin'!
8g90el,One jambalaya coming up!
5i6r8s,My first attempt with a slowcooker: Chicken Tikka Masala
ck3by1,First time making Slow Cooker Ribs! (Album in comments)
b029o4,"Slow Cooked, Stout Cheese Steak Sandwich."
de3rg3,Beef brisket. See you at dinner time!
8aaxd5,See ya in 8 hours buddy🍗
a2d6f0,Christmas chutney is on its way!
85kggn,Looks like slop but tastes amazing. When depression is winning slowcooker allows me to healthily feed my family without huge effort !
dbskwq,Macaroni and Cheese
4i9haq,:-( A replacement costs almost as much as a new unit.
crbol0,Apple and cider gammon for a rainy day dinner
cozd87,Hearty Bean Dip
bon1ac,Salsa Chicken!
5r0syj,Buffalo Chicken Burgers - in a sriracha/buffalo sauce with blue cheese coleslaw.
8ysr76,Slow cooked sticky Chinese pork
7ozeat,"Crockpot Chicken & Stuffing (it's not beautiful or fancy, but it's delicious)"
9pa5zu,Slow Cooker Chuck Roast with Red Wine Reduction
7ll0xc,A fabulous start to spaghetti sauce
78ozkk,"Absolute best pot roast I've ever had, put some on a sandwich roll with some coleslaw and you're set. Sorry for the picture, it was very rushed and I couldn't stop myself from taking a bite!"
2dv5r6,"Four hours of prepping and one growler of beer later, my partner and I have 20 slow cooker meals in the freezer."
7miwmq,Walmart Canada has these for Boxing Day. Did I place this directly into my cart? Yes. Yes I did.
bk8in0,8 hours to glory (chili).
bat4de,Asian Pulled Pork Sandwich
63v721,Easiest Chicken I've ever made (walk through in comments)
9d6yj2,10hr Carnitas
9bkc91,Slow cooker Stuffed Peppers with a creamy tomato sauce.
bk1ftm,Stew my mom made
dunyez,Winter is coming...
dq2d2t,"First attempt at a slow cooked sweet barbecue pulled pork, can't wait for that smell. See you in 6 hours!"
51xfny,Slow Cooker Buffalo Chicken Mac and Cheese
42n0nu,Slowcooker gif recipe - Honey Garlic Chicken
c81zah,Chicken Chickpea Coconut Curry
andn98,I might have hoarded veg scraps for stock for a bit too long...
bqms8u,I made Slow Cooker Salsa Chicken in 3 1/2 hours!
ayr1yt,Fallen in love with slow cooking! Last night’s dinner was pav bhaji (Indian food)
a2q4xr,BBQ Pulled Chicken for Slow Cooker Sundays
cdxryy,Venison “carnitas” (subbed venison for pork and turned out amazing!)
9kw4gg,"Herb butter chicken, carrots and potatoes"
b5gvqx,"I've been feeling under the weather for a couple of days, so I decided to make some chicken tortellini soup!"
8gudbr,"Mississippi Pot Roast..But not? French Dips with the MPR, au jus Not Pictured!"
8i7r5x,I love getting home to slow cooked pork shoulder!
2iwqfn,Straight out of the crock pot. Perfect way to nurse my flu.
83unpb,Day two of this yummy beef stew from u/sevin8nin makes for a great lunch!
8az0sj,[I made] Mississippi pot roast everyone has been raving about
9s0obo,"Progression of apple butter, 24 hours and lots of added apples at each stage!"
a26elo,Giant meatballs incoming.
54h2cb,Fall Beef Stew
cxwn69,Taking my pot to the absolute limit.
a42q1n,First attempt at pulled pork in the slow cooker :)
5gyvs2,Slow Cooker Quiche (Brunch Recipe)
cbvnlg,Even in defeat it was something to be proud of.
32ny1q,The best thing I've ever done with my slow cooker: Mexican Braised Beef. Recipe for burritos in comments
dh6z91,"I'm a copycat. Mozzarella stuffed meatballs, but I did tweak 'em a little bit."
6nhv59,Experimenting with whole chicken and veggies... hope this works!
478rm9,Well this was nice to come home to
2v56v0,"Not only did I find this brand new, still-in-the-box vintage slow cooker, but I found the matching ceramic canister set too! Best part: it was only $45 for all of it!!!!!"
dhhuoc,First Pot Roast of the season.
9l4bjt,Just a time-lapse of me shredding 10 hour slow-cooked pulled pork. Recipe in comments.
5cnmsx,"After 9 hours on low, these babies are ready for the broiler"
2f84t1,My friend and I made 27 frozen slow-cooker meals in 3 and a half hours! All 12 recipes we used in comments.
ak7dj9,Italian Sausage Soup
69lje4,Was told that this sub might be interested my slow cooker pulled pork banh mi. Enjoy!
458jxl,Best part of eating beef stew is dipping bread into that gravy
3x1gxs,Slow cooked pot roast over garlic mashed potatoes and a creamy beef broth
7w78dx,New ingredients on Slow Cooker pork tacos
19dgom,After letting it sit for 7 hours I discovered this. Definitely not making that mistake again. 
8ml5kb,Slow cooked beef bourguignon
6xb4dv,Dallas folks are panicking and causing a gas shortage. I'm good for a few days. (My take on chili)
96tpgt,Chicken and dumplings
7t7dgh,"Jambalaya, see you guys in 4 hours!"
9ee0pz,First cool rainy day deserves some spicy chili
2napkk,"I made the same pulled pork everyone else makes and made an album like everyone else does. Kind of like a /r/SlowCooking rite of passage. Come check it out. Or don't, I don't care."
7dlokq,Two weeks of freezer crock pot meals while kitchen is getting renovated (X-post r/MealPrepSunday)
d7afm4,First time making Mississippi Pot Roast!!!!
6gl85j,"What are the best recipes with 3-4 ingredients that are literally ""throw in and leave"" to take to work?"
9m03dy,"Sick kid, prego wife, so I am trying soup for the first time."
cc0i7q,Moroccan Chicken Tagine
5osgmj,Slow Cooker Korean-Style Barbecue Short Ribs
8emfz4,Zuppa Toscana Soup
abaqcg,Broccoli/cauliflower cheddar soup. First time using my new kitchen aid hand blender.
4bcx6y,Power Fail MacGyver
asu1pz,Lush Mexican Quinoa
cdqxit,Beef Pho to warm up an Aussie winter 😋
a56vhh,Snow day Carnitas
8swiut,"My first time using a slow cooker. Creamy Tortellini, Chicken and Spinach Soup. Turned out great!!!"
3zkvsm,Overnight slowcooking = pot roast for breakfast!
2y5jem,"A while back there was a popular ""40 meals in 4 hours"" link posted. I made a spreadsheet to auto-generate a shopping list based on whatever combination of recipes you want to use"
b9hlze,Slow cooked Gammon 'camp fire' stew
79o19n,Slow Cooker Ham & Potato Soup
7lhgi9,Slow Cooker Enchilada Chicken
8y2y0s,Time to work my way through this cookbook. Very interested to see how much I save on my food budget during this.
5zg7nz,Thai Coconut Chicken Wild Rice Soup
9e8ofy,Homemade broccoli cheddar soup on this dreary evening.
70e1mr,Made chicken tortilla soup and from scratch bread bowls.
9ys60c,Rosemary Garlic Beef Stew
6zbkzh,Made yesterday's front page pot roast
8plyaq,Chicken Tortellini Soup
5sv2bm,Slow Cooker Pork Summer Rolls with Peanut Sauce
94aobb,Beer & Balsamic Short Ribs
cf4ugf,Reindeer roast 🦌
cjr2kj,"Made carnitas, but need help thinking of what to do with the juicy leftovers (recipe in comments)."
3vsevs,"for my wife: braised Osso Buco with mushrooms, charred rabe and parmesan polenta."
d1jbd6,This beauty was my grandmothers and has to be at least 30 years old. Still works like a charm.
8xqgp6,"A delicious ""crack-pipe"" chicken recipe given to my parents from old neighbors a while back. (transcript in comments)"
989fbx,Carnitas Tacos
7iumyf,Slow cooker Sunday underway - Guinness beef stew
dudkfw,Slow cooker shiitake mushroom beef stew...it’s that time of year!
2w4925,A decision was made today
76yk31,The beginning of something beautiful . Chicken tortilla soup.
6as59i,Made those mozzarella stuffed meatballs finally.
c6h3j3,Oxtail soup - so good on rainy nights
1to82y,We are using an outlet converter to cook mash potatoes in the crockpot while traveling today.
c0rwd4,First time ever using a slow cooker. Wish me luck!
bpqd73,Provençal beef casserole inbound T-6hrs!
9i2rub,Cost me $5.07 at a thrift store (pork inside not included)
cjcicv,[Homemade] BudgetBytes BBQ Pork Spare Ribs and Six-Hour Baked Beans
6wzlb5,Garlic Parm and Herb Chicken on a bed of potatoes & onion.
6tf751,Empty pot; the cracks formed over time are really beautiful.
btnvn5,Spicy shredded pork
argt3e,My finished potato soup! Came out great in the slow cooker :)
ashi3a,"After pic, three layer roast I posted earlier today. Gravy made from the drippings."
8rn4ly,"Felt like having Asian cuisine tonight, so I made some slow cooker sesame chicken"
9g1kmo,I have my own roast recipe
bajklt,"Slow cooked Char Siu pork, finished under the grill"
axfr5i,As a Texan in 30 degree weather... decided it was the perfect day to skip class and make creamy tortellini soup (dairy free)
dkh04x,First slow cooked meal living in my new place!
abo0v7,Rose Bowl Reubens- 10hr corned beef brisket
9gjxa7,So glad I remembered to try this out for making chicken stock!
d5yibe,Meatless Southwestern Stuffed Peppers
4uxusf,"With only 20 minutes left, disaster strikes"
3yv26v,Can I show off my slow cooked phở?
bchktd,"Slow cooked pulled beef, delicious!"
ap4m1g,Mongolian Beef on this cold day!
79jfes,Mojo Pork Tacos
9s5yvz,Hands down the easiest recipe I’ve ever followed. See you in 4-5 hours!
am1ca3,My first beef stroganoff!
7zy8bd,Slow Cooker Pulled Pork before/after
ai4tr3,Super simple beef dips.
67qbsd,The best part of a ham are the leftovers. Ham bone beans!
8w232l,Slow cooker cannabis butter!
ahj7p7,I now understand why the creamy chicken tortellini soup is so popular here. This is amazing!!
8u1i6u,"Fairly new to reddit, and I have been loving this sub. So Since if recent post from the thebabbster I decided to give my go at chicken and dumplings!"
ba715h,Chunky potato soup I made by combining a bunch of recipes
91ljaz,Crock pot jamaican chicken curry
b4wsyn,Yesterday I showed y’all what I did with the apples...here’s what I made with the carrots I got from the farmer’s market! Gajar Halwa (took 9 hours in the slow cooker)
4kkwes,Slow cooker chicken tikka masala... Far exceeded my expectations.
aq27sp,Goat tacos made with mango and garlic finished in bacon fat.
9m4yf3,I made slow cooked carnitas for the first time!
42mbex,Creamy Chicken and Wild Rice Soup. Made this on Saturday during the blizzard. Husband and 5-yr-old both LOVED it.
5u1tra,"I tried this Slow Cooker Ribs this weekend, and WOW it was super easy and AMAZING."
bzzam0,Slow Cooker Pavlova
5okspl,"Mint condition Cookin' Crock in box, never used"
2y3e6r,Snow Day Pot Roast
bhvccc,Update [Zuppa Toscana] I let it cook for 5 1/2 hours
9wh8sa,My first slow cook ever!
5idvuq,Slow-Cooker Garlic Parm Chicken
5f8tpk,First Chili of the Season
1sbpnd,My wife is a meat and potatoes kind of girl. I'm expecting her no less than 8 hours from now. I think she'll be pleased.
b80vzs,Slow Cooker Pasta e Fagioli
br3ba7,Chipotle Chicken Stew
aj43id,Tried a new recipe for slow cooker Beef Dip sandwiches - they were amazing. The recipe isn’t lying when it says you’ll want to drink the Au jus
a5kzlu,"Tonight we are having pork, potatoes and carrots. I'll make a gravy with the juice after it cooks. My daughter gets so excited when she knows I'm planning to use the slowcooker"
d8dzyl,7 & 1/2 hour Southern Style Chicken Stew!
ca329t,Oxtail stew
789cfx,[I made] The gumbo from September's top 5 ... omg delicious ...
2tkpnp,"Cookies and cream fudge made right in my 3.5qt crockpot, prepped in the afternoon, enjoyed in the evening. RIC"
4c3frs,Roasted garlic marinara sauce
840pqj,Honey Garlic Chicken 👌 came out so good
d4iz45,"Joined the family and using a Coleman’s sachet beef bourguignon, any home made recipes?"
5qeoeq,Living in my messy dorm room won't stop me from making my favourite spinach and artichoke dip!👍🏼
8284r4,Two pork shoulders ready to be pulled
9j9d3g,Beef stew with Peach
6oxp51,Beef and Potato Au Gratin (it's a lazy day)
anx9lp,Lentil and Italian sausage soup on a snowy day
8q1a7d,Slow Cooked Chicken Tikka Marsala (small portion recipe in comments)
90i0ve,How I eat the Mississippi roast
dy3p8b,Not one I see on here too often - slow cooker dog food!
bd2x6v,First Guinness Beef Stew - See you in 5 hours
7y7yyh,Spicy Chicken Taco Soup
7pbahi,To the Redditor who turned the knob ‘up to’ warm..my SO didn’t plug it in.
9u8zrk,Chicken Tortilla soup.
9f15h7,Creamy Italian chicken pasta
82ot7m,"Beef Bone broth - 12 hours down, 24 to go! 😛"
31ouhs,The crazy amount of pollen has turned my family into a useless pile of goo. Too hot to turn the stove on. Slowcooked chicken noodle to the rescue.
dlic5k,Slow cooker chili with bonus pecan pie. Perfect for fall. Recipe in comments
9pdtsz,Took a stab at the Chicken Tortellini Soup. Looks great!
871v5r,Fall-off-the-bone tender oxtail with delicious mellow Chinese flavors and buttery diced fennel!
b1x52t,Easy and Delicious Stuffed Peppers
ad7etd,First time ever using a slow cooker! 8 hour Beef Goulash!
9g5zcw,Upvote soup ya’ll! Finally gave in and it was deeeelicious.
28sdq6,"Looking for something different? My wife made a chocolate cake in the slow cooker. Simple, easy to follow instructions in the imgur link. The most moist cake I have had for a very, very long time."
3v5p0s,Cheesey Bacon Ranch Potatoes - First slow cooker attempt.
2qgx83,Slow Cooker Chicken Cordon Bleu Rolls
3nmge3,Shredded Buffalo Chicken Salad
bnb08k,Slow cooked beef ragu
b7vg35,slow roasted carnitas taco night 🌮
8d5t05,White Chicken Chilli
