post_id,title
7v8irq,I have changed the way I make my chicken plushies :) (needle felted wool)
9xwc9t,For all my fellow Leah fans out there
cmqbxj,"Worried about you, Haley"
ahm977,I drew me & my boyfriend's farmers back in 2018.
b6rguo,I made isometric pixel art of Elliott's cabin!
cphlxo,Who wants to see memes allowed on this sub again?
8bn2fm,When I'm trying to milk my cows
7guisl,Stardew Valley currently rated #8 game on Steam of all time
9md882,Today was a good day. 100 iridium starfruit wine. 450000g
b3ncri,"Unexpectedly lewd dialogue, but I love it"
8s9jn5,LOOK IN THE MIRROR CAROL
d9a1p0,"I've played hundreds of hours, never seen this before. Thanks SDV I was missing my grandpa today."
cf4s3e,"Turns out, I have a seahorse!"
9w4kdg,IRL supermarket now stocking cave carrots
a85sh2,Updated holiday icon and I'M LOSING MY MIND!
ahz1g3,Jas just casually skipping rope at 1am in the freezing cold
9opb2b,But I can change them!
dxp4bw,New adventurers are coming in Stardew Valley Expanded!
brmz87,Did you know that you can fill your watering can up from your kitchen sink!?
buc6t4,You mean to say there's a chance?
94cerq,This gives me a minor heart attack every time...
55p3ez,1.1 update released!
6540ev,I literally bought a farm thanks to Stardew Valley!
6p376k,Made this little illustration for my new home!
csfb3n,Have so much space left in my farm. Decided to create a sushi shop and a welcome center.
93ddzb,Just broke up with my partner. Hoping this will make me feel some sense of calmness during this pain.
bs4ne8,My Forest Brewery Plan! I put this on r/FarmsofStardewValley but thought you would enjoy it too.
8s4dtm,Shane's therapist [OC art]
9diii2,When you're mining and hear the bat noise
b1mdr4,Me at 01:50 am
7ph2cj,When you hear the raindrops in the morning.
bnbk41,Saw this little fella walking downtown
9c20v9,"I wanted to be a player, but"
85arya,Stardew Valley IRL
9v506v,Uhhhh... Pam?
cyi8rd,Date night<3
bcx75k,"And this isn’t the first time, either."
91gznv,"Pam, you have no idea how right you are."
8nkm11,When Abigail finds out Pierre has been selling your crops as his own
9kslea,YES YES YES! I CANNOT WAIT!
90m15m,Best name for a character. This game is so chill now..
7j9tqp,"The largest Amethyst Geode in the world, Clint would probably only extract 1 coal from it."
cuc85g,Doodle I did a while back of Abigail! I think she’s cute!
asgqt0,Finally got my whole wallet filled out! :)
aivehw,i've cracked the code
ak1dhl,Don't know who made this but i thought it was cute!
9lb9gb,GOOD things take time !
6lm7gp,Is there any other way to play?
8nqsy8,My farm through the seasons
ceqtmw,I finished the community center!!!
cjp4oy,heres a lil comic i made when i did something terrible
bvkcp7,First time discovering this little guy! Iridium crab. I almost squealed seeing it.
9aitfr,This game really has some great music!
dwliiv,Just bought the furniture catalogue 😍
8krxf4,glad to see that Concerned Ape finds Abigails responses as funny as we do :D
bmk66q,Found this rock that looks just like soapstone at a museum
bw56u0,“I’m also working on a new game that takes place in the same world as Stardew Valley...”
96gkpw,Joja Farm! Now with employee graveyards!
9d5zfl,im in a long distance relationship with my bf and we used to play stardew valley together. this is a pic of us... <3
apigz8,Casual Abigail Selfie
bbyisr,Agnelli Farm - Fall Y3
9rrc73,Shane leading his army to Joja
6lf8nz,"Soon, Penny."
8i2jqy,Stupid sexy easter eggs hunts
b2xo7x,"Been lurking here for a while, this is my farm layout. It can be adapted for early game too (details in the comments)."
caqwsf,"A blue chicken I just finished painting! It’s my first box painting, so it’s not the best, but I’m still pretty proud of it!"
9qq3x7,"I can’t keep plants alive irl, but at least I can live out my dreams in game!"
6m0k96,So I drew a thing...
cfx16h,Oh no...
ajwrex,My friend made this mug for me- I am definitely at a full 10 hearts today ❤️
cqiglj,Clint Being Useful For Once
7ialrc,"I gifted my girlfriend SV on steam yesterday, I wasn’t sure if she’d like it. 24 hours later I see this next to her computer."
8cdwcm,I made a 1920x1080 HD wallpaper using Stardew Valley sprites!
b6b868,Got a new tablet so I had the 100% completely original and unheard of idea to draw the boys and girls as Animal Crossing villagers
987ke5,I started a poll a few days ago. It seems we have a clear winner.
bkczur,"I considered divorcing Sebby and marrying Alex again, but now I'm not so sure. Who left this bowl of onions here?"
9xe5ua,"I made some Junimo charms, because I haven't had the time to play lately. What do you guys think??"
9e9lws,Ahem. Almost a perfect game. 9/10.
ddpdxu,"You saved me when I fainted in the 1st week, I can do this much for you man."
blqqd5,I want a divorce
8soj72,"Robin is in the middle of building my kitchen and it's cold and rainy, so I brought her a cup of coffee. I forgot her birthday. She's out doing hard labor in the freezing rain on her birthday and thinks the coffee is her gift 😢 I'm a terrible person"
aycgsl,"Harvesting chilis and gifting to friends irl, but still haven’t received any blue chickens..."
dlfz9b,I made this tiny junimo cross stitch recently. I thought you might appreciate it because I think it’s adorable! ☺️
cazhr2,"End Of Fall, Year 3 Of My Mushroom Field"
a9wp40,Is she... is she going to eat me?
9densn,True heroes restore the community center!
8jidkp,I turned Grandpa's shrine into a bit of a garden.
ccf859,"My potatoes didn't come out as smoothly as they do on my OTHER farm, but I'm happy with my first time growing em irl! Next year, I have some new ideas from other helpful starmers I'm gonna try out :)"
8mdxrd,Pierre's Policy
6zvmav,ConcernedApe's next game will take place in the same universe as Stardew Valley
9pvx6i,Starting a new save! ♡
7utoa7,The secret to a long and healthy relationship
8da30b,When you're a jar opening lesbian but your crush says this to you
9b7pq2,Sorry if this isn't all that uncommon but I've never seen so many in one place before
77fc3x,I drew Abigail!
9q9obp,Stardew valley irl
7y6mue,"Tiyuri, CEO of Chucklefish, has this to say about Stardew Valley Multiplayer"
bmx2ce,"Go home, there is nothing to see here!! XD I am just a trash goblin trying my luck inside the trash cans...."
cug4zw,When you go to buy hay but she's at gd aerobics class
b995qv,Had to share my new Redbubble sticker that combines my fave things...Vine & Stardew!
7uab05,I knitted a Junimo!
792ewp,"""Watering"""
aypsuh,When you know it's time to head back to the farm
biu6lr,My grandma's been lonely lately and started watercolour painting. These are her void chickens!
ap9mhg,Hey Can I Copy Your Homework?
8rkl6g,Wait... what?
9b4jkg,tried drawing portraits of my farmers and i'm quite happy with how they turned out!
dxoqx5,I named my second child [789] for this moment
7yverx,For the person who has never seen Dusty the pupper.
bwpt9q,2nd Year Spring 7th and i got witch event.
86cy64,Now if only I could sew.
7su3fz,No more sharing with the husband.
9fxlv6,"My friend was only interested in making friends with people that would give her cooking recipes, so I made this for her. Thought it might of use to someone else too."
8wt72b,"As soon as we discovered our first Rarecrow, we realized we had to find them all and worship them as a pantheon of gods. So we built them a shrine."
cnsek0,"First year, Spring 19, look what I got fishing!"
csif69,"Krobus was selling complete breakfast for 100 gold, so I bought over two stacks, using all my money. I made 250 gold for each complete breakfast I bought and sold!"
9xjpai,Happy harvest season <3
89ucwi,"I don't know, anyone feel like arguing today?"
801o9h,Waiting for Pierre to open his shop
by446o,Shane and my male OC during pride month 🏳️‍🌈🏳️‍🌈
8mr6qa,I will see your first season giant melon and raise you 3 more in the second
4flgj3,All of Pelican Town almost found out I was a horrible person...
9n55je,It's too accurate...
c59cuu,Sometimes I worry about my wife.
cu6ews,Nothing to see here. Not at all.
8tq43k,when you need 1 clay
c00qkh,I made a japanese Onsen / Bath House for my farm :D
d52kvc,A stardew valley inspired farm that I built in sims 4 🍂
c2zp1o,Hugs for Shane. Old Fanart. (GIF)
9zcfb7,"Nominated For ""Best Developer"" and ""Labor of Love"""
8vre2s,"Someone's stealing Stardew Valley asset then release it on Playstore (and it's not free), please report this."
88ksue,My daughter and I play Stardew together. Today is my birthday and she made me this card.
9fab9m,This happened
9fhozj,Joja Mart sure have some... interesting products.
9y7dnx,"They say you can have a relationship in this game, am I doing this right?"
85lo9z,"Sweetie, won't you buy something?"
bizueb,One day she will be mine.
dg0a87,My tiltshift Stardew farm animation! I think i finally got a link that works for it!
70jr85,Grand champion grange display at the Washington state fair
98db7j,First day of college? Couldn’t forget to water my plants
br4bvd,Cute Nature themed bedroom for the kids! :3
7n3nig,Today my fiancé proposed via Stardew Valley 😭😭 My heart is so full ❤️
9tw0ll,Three big bois!
8ru3cl,Everytime I see a Pierre/Wednesday post
6bxzs9,I turned my farm into a cozy little village. Forget wine... the true value is in real estate!
8xwd6a,I made a little Italian restaurant in my shed.
b8g80i,I climbed down to a monster filled lava dungeon to mine this gold and gave it to you Sam and you're angry at me!?
7xr6ad,When you start a cheat play through
bdoiqj,god I love Evelyn
cgj97q,Drew a little comic about how jarring it must be for the townsfolk when the farmer first gets the return scepter [OC]
9ju66c,"So, ahhhhh... this just happened. I got the ring, and he got a homemade Mermaid’s Pendant and vinyl :)"
d4d4y8,Stardew Valley didn’t have any box art for Switch... so I decided to make my own!
cd1tx9,Stardew watercolour
80ojgw,My proudest accomplishment so far!
dx6rj2,Addicted to the Skull Cavern so it’s a pride display this year.
bp7v97,Adventuring With Abigail [OC]
7wgdil,I crocheted Shane's blue chicken!
aoygos,I’m *married* to Harvey and he does not care. Savage.
8z4lgi,All the train wagon graffiti I've been able to capture
c8cwjg,Mom Partied Too Hard and This is All I Could See
6u1cqu,"Subtle, Leah"
5wakg4,HAPPY FIRST BIRTHDAY STARDEW VALLEY
avyej2,Found a Dino trying to be a Junimo today. Had to adopt it.
9ess8z,Coconut goes on vacation.
cufmz7,I'm jelly. I know we have beehives but where are our cute bees?
759ckg,How I feel the Monday after playing Stardew Valley all weekend...
8k6lzh,"My grandma passed away last July, and one day I was having a really hard time and missing her a lot. To calm myself down I decided to play Stardew Valley and bought a duck for my new coop. This is the name it gave me. We always called her Grana and she used to take me to feed ducks."
8f3k0z,Why does the wool sprite look like it's judging me?
7rsyfk,[Fanart] Single Ladies!
d37ljl,thoughts on this? from stardew.info/planner/
5jk92t,"A handy gift guide I made, might help newbies like me"
a4zo7r,Hello yesterday
858ku1,Someone remade the whole Pelican Town Center in the Sims 4!
9dyw9h,"When everyone posts about how Stardew Valley helps their long distance relationship, but, you yourself, don't have a lover."
bo1jop,"You’re not wrong, Caroline."
ajib27,Gus with his Joja Cola burrito
9q3dut,"Stardew Valley in the Fall, Acrylic painting 11""x14"""
9hazro,Oh no.
4q6ohm,10/10 Realism.
85uykc,It's me cosplaying as your DYING GRANDPA because all you incredible cosplayers are going to be the death of me
bpupp7,My amazing boyfriend had an artist turn us into Stardew pixel portraits for my birthday! I’m a lucky lady! 😍
b43vc9,Night Festivals in a nutshell
6jtney,Too proud of my farm to not share
9r9xd0,"Well, RIP my life."
8848u6,How to instantly get thousands of karma
9uflxt,When you do Abigail's 2 hearts event...
840ati,Accidentally eating a flower that you needed for a bundle.
97ifor,"Now, I feel so confident when I trim my mint"
8a7l0u,drew my character!
8uumyw,Moonlight Jelly Emily Fanart
98npbd,I drew junimos
91u746,"Apparently, Marnie's room also contains Mayor Lewis's suspenders along with his boxers."
drsi8j,My wife's small classroom
73toet,"Stardew Valley is coming to Nintendo Switch on Thursday, October 5!"
909sca,I really wish my farmer would change outfits to match the other girls :( I look so out of place
bgac94,"A day late, but my wife and I made a Void Egg."
djw7va,My (attempt) at a jack-o-lantern this year. Still looks like a chicken! :)
9rmz4l,Will never play that game again
d1g5bk,I harvested a pretty good blackberry today
8t9tg3,me irl
7m1lr6,Merry Christmas!
8bxx0y,American drug dealer makes his first salary. (Ca 1970 colorized)
8xq56d,r/niceguys?
93od6r,They really weren’t kidding about the luck today
7fi2wr,I hate this bush...
9e484h,Currently me. Anyone else love the thrill of starting a new farm rather than playing an older one? 😅
a31c72,I got this commissioned for my bf and thought this sub would appreciate
cvjuno,I like to imagine this is what our character would say if talking to someone who they used to work with at Joja
apj8iz,Pain in three words
b7jfwi,I made a portrait of my farmer!
9o1vw6,Don’t have to tell me twice.
9lmlok,My girlfriend crocheted this Junimo for me! She’s definitely a keeper. :D
du6vpn,I only started playing this year and I really liked it! So I did this artwork of Penny!
deogpf,"As I was about to fill my new greenhouse with ancient fruit, something occured to me"
78bs3y,I love when Marnie isn't working
8hz01a,when you have 2 identity
5m92hh,"Stardew Valley's Single Developer Has Made Over $30 Million, and It's Well Deserved"
7zp3s2,"I re-watched the ""tomatoes"" heart event and thought of making this."
8xzyxd,I organized my chests by color
850c5p,"Hey guys, this is my cosplay of Morris from Jojamart. Took me a couple tries to get the facial expression down but I think it was worth it!"
5nadq9,My animals are starving dammit
7q3rwp,Oh an artifact sp-- nevermind...
cos5jx,Got new socks and I think they are perfect for playing stardew valley in...
cc1rer,oh lawd he naked
d8pyei,About to play for the first time! Wish me luck
9aevyy,Made a Seance Room to see if I could communicate with Granpa's spirit
bebcdf,"This is me, buying 500 Tom Kha Soups from Krobus for 180g to resell to Pierre for 250g so I can get that cash moneys"
86a37p,Villager Gift Help Sheet
