post_id,title
bwa87g,It is how it is
dvukgg,Benefits of High Friendship
cdn19h,"Tip: Whatever you're working in the shed, keep one of it outside, so if you lose track of time you'll know when it's done without having to keep entering it."
ct4gj4,"Finally, a president for us!"
d03zwf,1.4 sneak peak
dbyq8r,ConcernedApe is now self-publishing Stardew Valley on the Switch!
agbcmg,My friend got this awesome mug for me for Christmas!
cjzepu,Abslotutely nobody asked for this yet here it is.
d29i6s,What is an extreme sport?
b9lk0o,So I made something...who likes The Office?
buig4v,Petition to change Reddit Awards to Stardew Valley Quality Stars
btv68k,A Spring Morning Pixel Art
ad7qbn,my cursor glitched out and i knew what i had to do
at5acq,Why does he have to close in the middle of the week when all my seeds magically need to be refreshed...
dipzib,Who needs a team of 5?
b19oog,For the first time in years a game has overtaken Minecraft on the paid games in the Play Store and its Stardew!
dm5uz5,Literally all I did during my first playthrough
b9ue14,i don’t think my boyfriend really understands the game at all LOL. at least he’s supportive
cioy7h,We all know it's true
bvy21k,Look at what my friend made me!
941jv4,you vs the guy she told you not to worry about
bfqqwd,Almost all the NPCs + junimos!
9zpgty,I'm beginning to suspect a conspiracy
cxilnk,Nobody fucking move
cv6v3p,Crab Rave - Stardew Valley Edition! | Sound On [OC]
a8yyiw,"Well, wish me luck guys."
am569k,My Farmer at the Flower Dance!
ci221e,I really wish there was a way to clean up this beach
bo6gfx,The only reliable business in Stardew Valley
cc71ms,Press F to pay respects to my 500 radish miscalculated summer ;-;
axn7t6,My boyfriend recently showed me Stardew Valley so as a thank you I painted the farm for him 😄
c2qqf2,Got a new smart watch and had to see if there was a watch face for Stardew
d0gms7,"Long distance relationships can be hard sometimes, but games like this make it a little easier"
d2x56e,Why can't I just... step over him?
a7e99a,"We did it, Stardew Valley is one of the Nominees for Labor of Love for The Steam Awards 2018."
allipz,Best relationship advice ever
cektag,My sister spends her whole life farming.
c28gbi,First Spring in Stardew Valley starter pack... hope nobody has done this!
bx12wi,Spilling the real truth tea sip sip
dmg0ln,The pollution in Stardew Valley is getting out of hand so this year I filled my Grange Display with trash to bring awareness to the issue. I did not win.
a24k7b,Poor Pam
b0yicp,I received the best gift in the recent reddit bookmark exchange!
c46ilf,A little too true
c36ih5,If only it was this easy
asny7i,Anyone seen Awkward Zombies Stardew Valley comics?
ce0cw6,How's my farm looking?
bz4kt7,Got my mom playing Stardew and her recent texts are A++
cjclol,I recreated the Stardew Valley girls in the Sims 4 a few weeks ago and decided to share!
cwo0a6,Mayor Lewis isn't so sure about the new farmer...
dn283y,Seriously where do they keep getting them???
do73ml,I know I'm Elliott to some but just wanted to say how grateful I am for all the hair options and ways to be me. Have a happy Spirit's Eve!
c2fev6,Just wanted to share my latest haul from the hat mouse. Happy Summer! See you at the Luau!
da61xy,Been asked to share my 67lb cabbage you you lovely people. Hope you enjoy and i think its fitting for the group :)
afapjw,stardewvalley_irl
d45px1,Money management 💵
7nwet1,"Stardew Valley won the award for ""The World Is Grim Enough, Let's Just All Get Along""!"
cgjj0n,Hi i dont know if anybody cares but I finally did it
bzq4pv,Can everyone appreciate my supreme editing skills and the photo quality
c7fy9v,You don't know how much I hate clay
9y29c0,[OC] The day after a mining spree
br8ve2,I knew my new monitor would come to great use!
bfhq5h,This was our pregnancy announcement- inspired by another Redditor
aq1sb4,Sad story...
ds95er,"You thought wrong, Mr. Mayor"
9peqfs,When you're trying to get married before the end of year one.
batvsw,The new SDV graphics update is insane
bd91te,Thank you for doing nothing
aalnz2,My proposal scene with Shane :))
cd54yw,"I saw someone post drawing of them and their SO, so here's Stardew themed portraits of my gf and me ♥"
c0662n,My girlfriend is babysitting right now
a0z2b9,Poor Robin
cidw49,Concerned Ape featured on Appstore story today 👏👏👏
chdwy1,My twin sister and I decided to start a file together. We picked the same outfit and hairstyle without knowing it!
97b7mf,"These ain't ""twigs"" or ""stems"""
af1y60,Got an old Guess Who and turned it into Guess Who in Stardew!
ceaehn,ProZD just became one of us.
dd6ywj,"Goosetober 4th: Stealing Stardew Mayor Lewis's lucky purple ""shorts"""
d3x38s,Credit: ExtraFabulousComics
8klprv,How'd you know I was hungry?
as0mgt,"Wanted to give this gift to someone as an appreciation for them buying me the game, but I'm on a tight budget. Does this look convincing?"
ctxaho,"""Wait, who's taking care of the farm?"""
82wvrp,Everybody loves Pierre
cprx37,"I have the friendship mod which let's you ask a marriage candidate to hang out with you for a day, I was going to hang with sebastian but I forgot I named my cat sebastian as well and got the cutest glitch possible. Yes he did use a sword when we were in the mines... somehow."
c9mnuf,Hardcore Gamer
crpxt3,Look what I found!
adv3mz,The best egg festival route I’ve found! I’ve beat Abigail every time!
d4w675,*clapping crescendos*
bjv1a7,The ritual is nearly complete. Only 4 more Great Pumpkins to go. 🎃
cbpawl,this is my dream spouse
b08ukn,"I felt bad about always leaving my horse at the bus stop, so I built him a pen!"
atpdbi,"Stardew Valley just reached over 100,000 reviews on steam and is still overwhelmingly positive! Congrats Concernedape!"
bhm41q,saw this on tumblr and wanted to share with y’all bc it was funny 2 me
cnkpcn,Imagine locking the door literally the exact second a valued paying customer turns the knob to enter
9ibvt8,That's right I said it
dri5k2,Enjoying Stardew Valley with Friends! (A Commission)
aqkbw8,Valentine’s gift for my boyfriend :)
7g7fdr,I built Pelican town in the Sims 4 during my Twitch stream last week.
bovtne,Kinda easy if theyre in the same places each year.
ccsjop,"Abashed the mayor stood before his sins, exposed for all to see"
c517l8,How to marry someone
cvptfd,Future generations
bolxud,Is there any other way to play? [OC]
dbhw8t,Every few days on my farm [OC]
d9f9ut,Finally got my first giant crop!
c1m45u,Would anyone like a cauliflower?
cyq9el,Wholesome YEAH!!!
7xkyai,It all makes so much sense now... (found on Tumblr)
aektj2,"""Why don't you shut your god damn mouth."""
d8tia0,A couple of you asked for a gift guide on my previous post. I did my best.
dr53hy,My husband and I were Harvey and Penny for holloween
b6h2uc,Ouch
digryt,Took me several years to grow a snow yam inside the submarine
cryr0h,Nice.
8mzr5q,I HARVESTED 500+ CROPS TODAY. I TOOK CARE OF OUR 90+ ANIMALS. I WENT FISHING. I GAVE YOU A PUMPKIN THIS MORNING. YOU VISITED YOUR PARENTS AND WENT TO THE SALOON. I AM SO HURT RIGHT NOW.
cev2gf,I was high as shit during this scene and it was amazing
9f4ucw,Thought we could all relate to this one...
d85d74,"Tonight on ""mods I downloaded when drunk and forgot about..."""
dw9cn9,"Tip: Put your sprinklers on a path, that way you can hoe through the sprinklers without breaking them"
d7oml4,How to run around all day and accomplish absolutely nothing.
aw488q,"My guy and I met on this subreddit. Been flying 5,000 miles back and forth to see each other when we can get vacation time and afford tickets. Today he proposed in-game and irl! 💙👨🏻‍🌾💍👩🏽‍🌾💛"
c3xy24,My boyfriend made a mermaid pendant and proposed this morning! I'm making all the arrangements and we're getting married in 3 days 😉
c5pbdo,I went to Legoland yesterday and made the Stardew Valley chicken out of legos!
9sszgg,420!
bld003,y'all when someone's farm is just designed to look nice
dgeux9,"He's not perfect, but I'm proud of my first attempt at this type of friendship bracelet :)"
d6fplf,".....first of all, we’re married with kids."
ak83sg,Finally decided who to marry in Stardew Valley
d55h3a,I spent the better part of a week making this and I'm pretty happy with the result. Let me know what you guys think.
akf63d,Stardew valley irl
by95zz,cozy
afuj0y,"BRB, starting a new farm so I can name my animals like this."
d3azt8,When your vegetable reaches iridium level.
a3pbn8,I was messing around with the spawning cheat and this happened
9z6ho4,A Worthy Inclusion
bgge2c,painted this today
b8ydgm,We are building Pelican Town in Minecraft. Work in progress.
8y4fyb,Was about to sleep and my boyfriend decides to...
cdutfh,"Taking inspiration from /u/Capri-Cassi and /u/cinnamon-coffee, I drew my IRL girlfriend in SDV portrait form !"
dpqv68,I made a corn maze! Happy Halloween!
bvo5yn,Gentle reminder that the creator behind Stardew Valley is ONE guy...please be patient about the updates
dkhn3i,I love how cosy my farmhouse is at night
90smi9,"With multiplayer coming out soon, hear me out..."
duib77,Every Stardew morning (not mine :)
b8paqt,"Gentlemen, behold! My witch crafting shed!"
b84835,So my kitten loves watching the leaves blow in the wind in fall 😻
dauhy0,I made the Stardew farm on Minecraft. Thinking about doing the whole town.
cl2y1v,"My first supercrop and it matches my hair! (First post here, hi 😊)"
bh3h1w,"Well guys and gals, they were right!"
bbhbc5,I remember playing this game when I was still 'in the closet'
bez8a6,I got up early and watered some crops for you. I hope it makes your job a little easier today.
8t5jmr,I drew Wally's Fish Shop
cfom9t,"Inspired by one of the top posts on this subreddit, I got my boyfriend this because all he ever drinks is milk."
d1aedu,Is Abigail cheating on me?!
baemx4,I've been building Pelican Town in Minecraft the last few days.
d2namd,My recent project turned out to be pretty decent. Not perfect but after spending hours I think this is as good as it gets lol
d9puon,"Putting the mayo maker into the coop is efficient, sure, but the guilt hangs in the air a bit too heavily for me."
bxejki,Me and the boys gonna play some Stardew Valley
azglv5,The Most Important Meal
clz6hg,I Was Asked To Post My Giant Turnip Here! Enjoy
dc8imj,Light roast comics has been playing SDV lately
cmax0b,It was nice of ConcernedApe to add a blind character to the game
79ykex,My farmer is adorable so I made a portrait of her
cp6ir8,"""Khajiit has wares if you have coin"""
d1y851,Stardew Valley is getting me through my cancer treatment
cz418z,Some say games cause violence. In my case it caused pumpkins.
cfibzw,"""I am the danger"""
an3q1a,Im sorry for making this
des4e0,Helping Krobus feel more welcome and loved :)
aor9nq,Made another building mod! Japanese Buildings. Others coming soon!
bes148,Lul so tru
avqe8k,OH LAWDY HE COMIN’
ckpuyp,Finally the multi-player update for my GBA is here!!
c8izc3,Today I learned that salmon berries exist outside of Stardew
abbbnm,I Hope no one has done this yet :D
cakupp,"Alright, who's ready for disappointment?"
d6uhgz,I just realized... nobody has a bathroom in their home
a8a7vp,I made a reversible jumino plushy!
db40s3,"SDV cake from Lyla Jones Bake Shop in Raleigh, NC"
doe1z2,Working on and off with this cross stitch for nearly 2yrs - and this isn't even all of it!
cpbs0a,"After 6 in-game years, I finally reached my goal of recreating my farm into a mini-village!"
aimrb6,My Maru cosplay at PAX South last weekend.
bt10mk,"That's my wife, Vincent."
dxw9gj,I'M AN IDIOT
8grqv6,Stardew seasonal crop cross-stich series that my fiancee did.
c9u80l,Haley soaking in the summer sun 🌞
dkyeiz,"Start a new game, bought 10 potato seed, go to sleep, meteor fall on my farm, destroy half of my potato. This is the first time a meteor fall on my farm and i've been playing this game for 2 years..."
d0yhpx,I found an indigenous tribal village near my farm.
c4rejs,Growing up with a Fantasy
7gmgcb,Stardew Valley Fancomic
bkxf4h,The only valid use for the quarry
cix57i,100+ hours I’ve dumped into this game and I didn’t know that you can place torches on fence.
bnht7c,"This past year has been very tough, but Stardew helped me get through it. I just had to reference it on my graduation cap!"
6kdlqm,Jake... from State Farm
cr73wo,Thought this also fit here :)
brwxgw,"My girlfriend constantly bashes me for handing out our Blueberry Jelly to win the hearts of the people of Pelican Town. Maybe she feels left out, I decided to make some Blueberry Jelly in real life and give it to her. Hopefully she'll like it."
8czpxq,Found this funny comic from Awkward Zombie
a1a0k3,First year Luau woes
b5jsnu,Couldn't find a simple style fishing bundle guide that I liked so I made one! Hope it helps!
abuq2g,"After many hours, my reference book is complete! (Download in comments)"
d1531n,We went to FanX today and nobody recognized us but I know y’all will.
aof47g,Didn't see this anywhere on the sub: good news for those who struggle at fishing
al80f4,First time playing multiplayer with my bf and this is the first thing he does
bk1lzj,This one sparks joy
cuuop3,In love with my new coffee cup!
c0yorm,I got a 3rd monitor specifically to play stardew valley. End to end of the map section is visible!
90f8ys,I spent half an hour working at Paint just for this shitty meme
bi14i4,"You may not like it, but this is what peak treeformance looks like."
8idgdu,I've lost so many fish because of this habit
ahhs3i,Linus said his tent got cold in winter. So I got him a heater.
dhah73,Stardew Valley really nailed the realism
cb5x4s,"Me, knowing I'm about to be late for a festival:"
b0lsg7,Amethyst Bouquet :)
c0i3gc,Me when i get the iridium axe upgrade
cf7rtq,"[Fan Art] Abigail, you're a true gem (eater)"
9qvjy7,Finally got a Giant Crop! ... in every possible spot. Only took 21 years.
cpk9os,Made my mushroom cave less spooky 😊
cgc2qm,The best part about playing multiplayer Stardew is being able to invade your friends cutscenes.
dhqxse,Love this quote from Penny.
cmy9l3,help I have 30-50 feral hogs in my yard
8vl0i7,Day 2 of adventuring.
b2bf8w,I’m an idiot.
akntou,You know you’re obsessed with Stardew when you start seeing Artifact Spots IRL...
czqqup,Will love Stardew Valley forever
b1gk2i,A rainbow quarry
9x6l94,I always feel out of place during the Egg festival...
b3r7ad,I got this game today
cxx0jf,"Scythes, irl. In case you were wondering."
9wokm0,I noticed there's a lack of Pikachu memes here
c70api,"New phone case, what do you think? :D"
bsm20j,This is what I like to imagine happens when I get another cow from Marnie
c1bpag,For Father’s Day my girlfriend rented out a theater so my daughter and I could play video games on the big screen and eat donuts! Here’s my daughter excitedly showing off her house!
c8ya0j,The Forest is a Wonderful Place...
cokbg6,I finally have a Void Chicken!
a1svna,I just thought I’d share my farm in case anyone feels bad about theirs since everyone posts cool stuff here
8je84q,When you’ve used almost all your energy on one floor of the mines and still can’t find the ladder
dq8jzv,I recreated the beautiful Night Market in The Sims 4!
c67mwi,A very quick doodle I did last night of Mayor Lewis.
8io2sg,When you play Stardew Valley for the first time
71mu3v,"I named my in-game cat after one of my previous cats, who passed away a little while ago because the in-game cat resembled him a lot. I couldn't help but tear up a bit when this popped up"
c8nmxj,"Uploading this real quick before I go out for the day! 15 hours and 30 minutes later, the whole piece is finally done :D Thank you to everyone who left nice comments on the last three posts, they really motivated me to finish this behemoth lol"
dlklli,I finally saved up enough from answering surveys to buy it on mobile!
cqof9r,"What's better than one cat? Sebastian the monster fighting cat has duplicated, I thought it was a temporary glitch but it's been a few in-game days and I've opened and closed steam several times and both of them are still here. One to watch the farm and one to go on adventures with Ariel!"
b2ozat,This game and my life in a nutshell.
9hssg5,Turned my farm into a bustling town!
7ojzhf,Saturday evening with my wife
8hewcn,My boyfriend and I are in a long distance relationship. We've really been enjoying the new update. This is us together <3
9toa7l,please help me
cgsbix,Gottem
anz331,"A cross-stitch picture was posted on this subreddit nearly a year ago. Seeing that picture inspired me to pick up the hobby, and I’ve finally finished my own cross-stitches of the Stardew seasons!"
amj15l,Tell that to the 15+ times you have found me unconscious in skull cavern
aiyex6,Gud boye is actually a rebel
cqtljk,Thought you all might appreciate my new sticker
a7xs71,Seize the means of production!
dago0e,So this is how a Prismatic Shard looks like in real life...
dhfaqe,"Over 500 hours of gameplay, and I still do this every single time..."
cmt6qh,"Saw this on the steam workshop a while ago, I don’t know the original artist though"
7blmrk,pierre_irl
d1rpzo,[SVO] Here's the full preview of the Spirit's Eve costumes!
ati739,My Japanese Buildings mod is now complete!
aicsvo,Stardew Stabbin' Chart
bjbp70,My cat tries following my farmer to the back of the tv
b1s3q9,Went to collect the eggs and came to the conclusion one of our chickens is very happy
9ntqec,"When your husband says he fed the animals, and you have auto-feeders."
c88ywf,"My Syrup Grove, looks pretty at night too"
azurz9,"Ohh well, i tried."
9rg2e4,Stardew Valley is already #1 on the app store!
a0ig9i,God dammit
8nwoq2,multiplayer pants glitch in the bathhouse
9aupjz,"Mayor Lewis leaving my house at 3am with 523 blueberries, 27 containers of mayo, and 62 bottles of wine"
921dbj,Is that my boy Krobus I see?
cwbljt,"Ah, character names"
d5w90y,"Yeah, keep on keeping on. (Stardew Valley Expanded)"
bg2d2f,"When it’s been a long winter, the hay is running low, and tough decisions need to be made."
d5l8lu,Birthday presents from my husband! Only the lovely folks on here would get how much this means!! :)
biog9q,Hi! I am Flint. Brother of Clint. Ready to take on a Miner's Challenge (Mining Only and Crystalariums) and sweep Emily off her feet. (Sorry Bro!)
4s9esv,Point Of View
do18g3,SHE SAID YES! :D
ajd607,Giant amethyst geode
bduyd3,Nothing feels better after an exhausting day of work
b7nw3p,"Oh my God, someone FINALLY put it into words!"
bf12j2,New update hint
cqakic,"Friend: What did you do this summer? Me: Got married, had kids, built a successful brewery, became a millionaire, and helped the local economy in more ways than one. Yeah, I’ve been pretty busy."
84lwml,"Congratulations, /r/StardewValley! You are Subreddit of the Day!"
ddi1e4,I think the devs have just accepted it
bj2yog,"Because of me, the divorce rate is high in Pelican Town"
ar921h,Hunbby did good with a custom stardew valley skin for my switch controller. I love it!
aub6v8,have a boi
anglyn,Recently took up cross stitching and was inspired by Stardew's resident poultry population
drw44z,Someone mentioned that you can make the villagers interact with slimes by placing a slime incubator in town. No one told me the slimes would start JUDGING ME FOR ROOTING THROUGH TRASH!
a0rf2y,They did surgery on a grape.
cmjxih,"This farm was brought to you by the Joja Corporation, official proprietor of Joja Bluu. When will YOU turn Bluu?"
dfuuph,How can a virtual pet be this damned precious?!
caeev0,"My first ever themed art inspired by the title screen of Stardew. I’m not very artistic, but am immensely proud of this."
ckhp03,shane needs someone to talk to
bcbzin,I hope they planted it on the first day of the season..
5vjwf9,Let's get this off of the play store.
ba3gga,Basically what my farmer looks like when going on the trip around town
9kz5ry,I think this goes here
axdfw9,My experiment worked!
a46qy1,I talked to Emily and she still had her dialogue from the Luau and I almost had a heart attack.
adikfp,"I made a teeny tiny Jumino out of felt, he is 1cm tall with a £1 coin for scale!"
83oitf,When you get killed in the mines and have to wait through the loading screen to find out what you lost.
bqucg8,My friend sent me this the other day
8pebb2,Forgetful farming
btmoui,I made a little guide to crops profitability using data from the wiki. I'll leave it here in case it can help others.
dvcxuw,This should be what happens if you’re up too late in a barn.
c0s0x9,"Stardew Valley's first farmer NPC, Andy!"
de9qz8,#7 in my Rarecrow series! Hopefully this one is less creepy than the others :)
c3n1qh,NOOOOOOOOOOOO
c7s9hr,Finally finished my gem shed!!
84c69g,"My quick Elliott cosplay. I have to brush my hair daily, or else it'll clump up into messy knots. It's hard work"
ca15ti,Used my pickaxe on an artifact spot instead of my hoe by accident and managed to collect it
bpudu4,"I named my second child ""Junimo"", this is his icon in the menu."
cy3v3p,This grange display at the fair today would totally win first place.
d66n8c,This is always a satisfying sight 🍒
b486ck,Back when I first started the game. My fiancé got me hooked on it.
byzgel,saw this car over the weekend!!
dtr88i,Just poaching Willys fish
bk6egu,HEYYY. I made Avengers logo! What do you think of it?
c600mc,"My boyfriend and I are in a long distance relationship. We play Stardew Valley as our part of our bonding time. I wanted a pink room for the house, and he didn’t want the mod because he likes his batcave with the ingame furniture. He sent me a picture of what I see versus his 😂😂😂"
a8tgr8,it's divorce season
bwh447,Seems Legit
c3csld,A short summary of how my first play through is going.
aoltjz,Nice.
cq2no0,200+ hours put into this game and I just discovered this part of the secret forest...
dcqeek,Kicking off spooky season!
awansl,I bought this game a year ago and took a long hiatus after only a few hour of playing it. I named the cat after my cat who was around back then. After I came back from my hiatus to this game I'd forgot what I'd named the cat and I was surprised and a little tearful to see this message
cumn2o,"My young niece is a budding artist and drew her SDV character, Maggie! I want to share her successes 😊"
atxc2p,Saw this today and had to share it
dj7vn3,Pepper poppers
ccnkd5,My real live farm part 1
9m57z5,Painted this after falling in love with this game!
aijbcb,me_irl
ctgfma,"By our powers combined, we are the Farmers!"
byjyw9,"Me, Harvey and little Carson enjoying our newly decorated indoor forest 🌿🌲"
b4tcgy,I just thought these two trees look like a cute couple with a baby
8w4hih,The money machine
bkq5hl,Created the fisherman's pier in Blender today
8flk0m,How I get through my daily visits to the cancer clinic
a0a8b0,"Downloaded Stardew Valley 2 weeks ago, sure is good to reconnect with the outside world."
byrv6c,co-op is the best thing that ever happened
9vufv4,WHAT DID WE DO?!
df2m6t,My girlfriend went to Comic-Con this weekend and got me a Stardew chicken pin!
bi9oyc,My girlfriend made me some cakes for my birthday 😁
cg53bt,"Not gonna lie, the Hat Mouse letter always makes me smile"
czgai4,Let people enjoy stardew valley!
anb1b6,"What about a post-apocalyptic, reverse version of Stardew Velly?"
asxy9b,Everytime I make a new game with the intention of getting the Joja Co member achievement
bidctu,I made a thing with transitions
coytz8,Can I have a moment of silence for the sweet gem berry that turned into mixed seeds
745o21,It looks so...right
cg03vq,"Decided to use a shed to display every recipe, took some time but it's finally done!"
cwzora,Real life Prismatic Shard
bqohd1,"My farmer, at fishing level 0, going up against Willy in the Year 1 ice fishing competition"
c9g3xk,"If robin is working on your farm, Demetrius dances by himself"
a9ivxv,"[UPDATE] Well, wish me luck guys. ** She said yes! Context and details in the comments."
dpdlua,I got to see Marnie’s rare text in person!
dtyxxr,My boyfriend decided on a great theme for my birthday!
b7twy2,When you plant your seed on the wrong tile
ari3br,I work at an animal shelter. We got this stray chicken in. I couldn't help myself. I named her Void. Now we have a Void Chicken.
buw9eq,I made her her own little garden area. 🐱♥️
9yrvrz,For those who can’t remove bait from fishing rods in the mobile version.
7lslju,When you get all hearts with more people.
a711wq,Oh Haley...
8v9xcq,"Thanks, CA"
8obowg,I've always thought that Willy bears a resemblance to Robin Williams.
ai3lbf,Holy shit she cheatsy-doodled
c6sscd,"Play Stardew multiplayer, they said! It’ll be FUN, they said....! Me arriving home at 1:50am:"
cnvvtt,"Got a new smartwatch today, who likes my theme?"
d75q4p,"It doesn’t seem to matter how long I’ve played this game (it’s been years), I keep getting surprised by new things!"
alz8b4,4k resolution loads entire town on one screen
a5ene7,Sent a thank-you message to Concernedape before the year ends. Stardew helped me get through a tough year :)
a6ct4y,Just made this cake for my husband's birthday
cw2a06,damn shane :(
89lspx,When It's 1:30am
d4f1f0,"This is one of many reasons why I love this game so much. As a lesbian irl, being able to marry another woman in a game means more than you might think. I love that there’s different dialogue for same-sex relationships!"
ba6k4g,When the TV forecasts both rain and luck.
burpx0,Amazing Stardew Valley art
cdfxgf,Finally finished my farm! ✨
b75246,Got a chance to see ConcernedApe in person! This was a really amazing experience to see and hear from him about how Stardew Valley was created.
blrowo,Here’s another WPA style poster since you guys liked the first one
9u07ff,WHO NEEDS RED DEAD REDEMPTION??!
ao6jgf,Don’t purchase the Joja membership
c6kafy,"I wanted to recreate everyone's favorite painter in the game and uhh... well, I tried..."
b3fqmn,I got this game today
c78h5j,Aaaand that's why I love it
