post_id,title
dj12ot,A garden I made dedicated 4 of my grandparents who died this year
87avjs,I got a new laptop sticker that I thought you guys would appreciate.
bb4887,I made an Ice Fishing Festival wallpaper!
cshjko,I just proposed to you >:(
dx277x,I have played 100+ hours and this is the first time I’ve seen a sea monster
csu5d7,I’m not going to get too many animals.
d7wwdw,I'm gonna try to go through all the suitors!
ajrfmy,When Clint cracks open a geode for 25 g.
dmujb2,Maru isn’t this saucy once married!
c4ljz0,"No matter how many times I play this game, the Dance of the Moonlight Jellies touches me on an emotional level. I have no idea why."
c19ygf,after lots of modding i'm finally happy with my farmhouse!
d7cmoj,"My husband, seeing me bringing these into the house: “Great! We need to take one of those to the community center!”"
7v3huu,There room for two in that tent? ~<3
d3oiac,"I tried making a Junimo plushie for a friend's birthday, hopefully she isn't on Reddit 🙊"
au52kk,So I died in the skull caverns on the day of the spirits eve festival and now I can’t leave the clinic until it starts😅
bckwcs,I just wanted another heater
bd24s4,"When Clint keeps hitting on your wife, and he tells you that he's tired of his job"
bv5lam,My lil bro enjoying the valley. Wholesome ❤️
dgwuqa,Thought you guys would appreciate what my boyfriend got me for my birthday - Original Soundtrack Vinyl Box Set!
ah34u1,"As a game developer, this is how I feel now that I finally know what ConcernedApe looks like IRL"
9np3cn,Robin thinks she's funny
dk7o16,I've finally obtained the ultimate way to experience stardew valley.
bbbtv4,Was reading through the comments on a video about the quarry and saw the most wholesome comment ever
aq7mrs,The 29 Million dollar shipment!
8x2hd1,My wife and I love playing Stardew Valley together. Tonight I proposed in-game. She said yes!
a7882m,My storage room
duck9n,Ralph is definitely a fan of Stardew Valley
bh9g0t,Just saw an example of Stardew Valley being used as an example of a helpful game in a college level psychology class
aro3xq,My husband built me a Stardew Valley-themed time/weather display for Valentine's Day!
czmpqs,"[OC] When election time comes, remember who feeds the homeless in Pelican Town. Remember who brings the food to all of the holiday events. This message has been brought to you by Gus for Mayor 2020. He has some food for that!"
az45vp,when you’re just trying to have a good time and nothing goes your way
8b9mjd,Multiplayer rolling out in a month! Get Hypeee!!
dcx1am,[fanart] Favorite crop = Strawberries !!
a1gvor,Fanart by Sun Dai
c7mwur,Not totally an artist but I loved watercoloring a lil Stardew home !!!
ac8hwn,Last photo I took of my oldest cat. Had to put her down last Friday. My time in the Valley kept my lap free for her. I haven’t been able to play since.
ayspjo,Hm...
cecwef,I drew a map today :)
97pux8,when I have the materials for a sprinkler system it’s over for you bitches
9a6781,Found these lovely ladies at Gamescom
cdbbww,I finally finished my drawing of the bachelorettes :)
7e4bvf,New to the game. My home decor is still pretty bear bones right now.
dourlg,Brought the outside in with a secret garden bedroom
cj4a9k,Sometime I read the wiki and randomly find this kind of things wtf I love this game
czc1f9,We cleaned up the polluted beach :) [OC]
ay4acx,Yoba bless the traveling cart lady. I was able to finish the community center in year one because of her.
b9dyh3,What if you wanted to go to heaven...
aum1ec,a bit on the spooky side
b6yrxa,Girls only want one thing and it’s fucking disgusting.
d1l6kh,Went to Our State Fair and Saw a Real Life Grange Display!
96zbo5,*Passes out from filling a water bowl*
7l0gcw,Stardew Valley got me like...
dlw6fr,Dust Sprite [X-Post from r/aww]
b8hcgj,I painted Emily!
9jez52,My kid made all the Stardew animals out of perler beads and we now display them over the TV
cq6k52,"This is for everyone who wanted to see how Sebastian the cat fights in the mines, we went back today and the game hasn't crashed yet!"
cs8hq7,3d printed and painted the fully upgraded house!! 😊
5o73n5,I just started this week...
ddnr5g,"My first 1,000,000 gold night!!!"
8ghmnz,How the multiplayer update really feels
ahu348,Turns out Stardew's lumber collection was more accurate than I thought.
a4g0tf,Top 10 Saddest Moments In Gaming
9okajt,"Well, well, well!"
7uha7k,"Alright guys, HERE IT IS - by popular demand! A Stardew Community Center Guide in folded booklet form! So thankful for all the love on my larger version! Printable PDF in comments."
8q3dxa,Drew me and my boyfriend's farmer after hearing about the 1.3 update with multiplayer option
av0fwd,shane is practicing self love in my mailbox
ab2l2h,I wonder if they're selling any Rare Seeds today?
a8onl2,Guess I have three days now. An early Christmas present from my husband.
a6tkpw,This is not what I wanted. This is not what I wanted. This is not what I wanted.
67e1gw,After 1.5 years of hoarding fish: I present the Fish Museum!
7t3vce,Reminder Tip: If you hold a piece of hay while interacting with animals you won't bring up their info tab.
b8cr92,Chose the river layout for once. Rate my farm
8yegdq,Killin' it
9997pm,r/StardewValley is leaking
d5esfb,Abigail that was a diAMOND-
8vxk5t,Day 3: Fishing struggle
anmzcz,krobus
aed4cr,I'm so excited!! I finally got my first giant crop!!
chofj3,Spring foraging bundle I made from Pearler/Hama beads :)
8sw75t,When I start a new farm and think I’m going to do something different this time
c909nb,My son’s birthday was last week and his mom made him this cake - thought you might enjoy it.
8hmf81,"[Beta] Finally, we actually see Linus's reaction to the farmer digging in the trash."
bxnnxc,I can make it! I can ma— ZzZzzz...
99tlgx,Kent's troubled past...
cbwfh2,my pride and joy
amvd60,Stardew Valley themed bullet journal spread for February~
bt8pq7,"Found this at my local comic book shop, only £20!"
7l96gi,"Stardew Valley has been nominated in the Steam ""The World Is Grim Enough Let's Just All Get Along"" Award"
ave64d,Hooray for three lovely years of Stardew Valley!
78vcdm,Just figured out why I recognized Rarecrow #1
7vvwzq,It's official. I am the town hoe.
8ubl31,"My 10 year old son knows my favorite game is Stardew Valley, and made these for me on father’s day."
7vl858,evelyn i didn't know you were like that
8g0j7s,Stardew Valley 1.3 beta
df84cu,I made this chart to help while going for all 10 heart friendships. Hope it can help others!
9ti8af,[Not my art] Hmm...when you put it that way.
dla7r4,My 8-year-old daughter entered this Junimo pumpkin into her school's pumpkin decorating contest
co5t3n,My Crop Museum
8arbbk,As a first time player with little experience
di5wzj,Put those eggs in an incubator...
acfdjh,I thought you guys would appreciate this piece of artwork that I paid way too much for and have nowhere to display!
9nli0g,I have depression and lately it’s been really bad. I made this farm as an escape and I finally feel proud of something I’ve done. I hope you like it.
dsjfg5,Most money I’ve made in a single day
9u50zm,Let's Get This Bread
92oid1,Abigail_irl
ap6tp4,"Welcome to “The Frozen Flamingo”, Alex’s Ice Creamery won’t have a Leg to Stand on Now that We’re Open!"
auv25b,I just accidentally found out I can put a hat on my horse... my jaw dropped
dh3mee,Started playing Stardew Valley the other week and all I want to do is draw Shane.
bm554q,My boyfriend and I changed our appearances after watching End Game...
b7cex1,A Stardew Valley checklist I made in my bullet journal!
dqvo2w,My lil’ kitchen ⭐️
crhmx9,Some spring and summer crops I painted!
bjhsfo,saw this and immediately thought of stardew
8ck5uq,The absolute madman got us all
awl0kb,This is what I imagine the Queen of Sauce episodes look like
bnw5nm,I made an emo farmer who only raises void chickens.
bn5d94,Should I tell her me and shane have been married for 2 years now?
dxhg3r,Emily is finished! The most colourful character by far 🦜
9plma3,That's not how dating works
be4o65,Those ores aren't going to crush themselves.
djhv8p,I gave him a can of Jaja cola and did not expect Kent’s response
9uud7z,marnie seems like a genuinly nice woman but i can't help but feel like i'm using her
dgozo3,My 6 year old son has been really into Stardew Valley and watching me play. He drew this for me today!
a5y8im,ConcernedApe is on the case :)
ag3tnb,"I used the villager gift help sheet made by Nnie23 and organized by bdays, removed difficult items, added easy-to-get likes and made it 1920x1080 for desktop backgrounds"
co9uq5,Girl it’s been at least 7 years... dump Lewis if he doesn’t put a ring on it
ckcf7l,I see your buff ConcernedApe and I enter my boy into the ring
amp9jo,Stardew Valley is Ukraine
bpdedl,"As someone who struggles w addiction, Shane’s 3 heart scene makes me so sad"
awyk0n,Floor 3
7o3o5v,Decided to model the moment I fell in love with this game. Any other scenes you want to see?
8wmdyt,Did a small painting of Pierre's General Store
aa33rw,"Colorized, circa 1987"
agx9cu,Opened the App Store to this! Good read (:
djnmzj,Breakfast anyone?
bxvq42,Happy Pride Month to Stardew!
d0204g,"Since you guys enjoyed my pumpkin the other day, here's the end result."
bkjy1l,"RIP me, I found a dinosaur egg on Day 3 Spring 1 only to accidentally yeet it into the ocean when I pressed the wrong button for a screenshot"
dnedsp,House and cellar collage.
90z2dl,Decided to treat myself to a new OLED TV and this is the first game i turn on... My farm has never looked so crisp
cog6by,I'm starting to think Clint does this on purpose
d0sfq7,It just got me that it’s kinda messed up to put my mayonnaise machines in the coop. Making my chickens watch me turn their kids into mayonnaise...
dnoryg,I married alex! So glad this game has same gender marriage!
b20pcd,i covered pierres store and house with grass because thats a thing i guess
c5ddi3,"""Hey... maybe I'll take you for a ride someday..."""
8e7luf,Made a pub in a shed and decided to populate it with rarecrows so it looked less sad.
8o4l0m,Item Loss
b69f3z,Handmade from modeling clay...Now I just need to make some junimos!
bzeovs,he so cute
9cwd7i,"Concerned Ape: I know many are wondering when the multiplayer update for consoles will come out. The truth is, I don't have a set release date yet. I don't want to make any vague promises, so all I can say is that it's in development, and I will let you know the release date as soon as possible"
8p1yek,"No, it is not >:("
act2ip,when you start your second playthrough and realise
c8svxr,"You guys were so supportive, I’m still working on multiple scenes as promised :P thanks for being the coziest happiest community ever"
dfhpd1,Local Cafe Hosting a Stardew Dinner!
duv5i0,My sister just got married! Painted this for her
dp4erf,George is a WAY better secret Santa than Marnie!
94km7y,When I see Shane on a morning
84hgx0,"Here's my Abigail impression, tried to get the facial expression right"
ch6cb9,Ooo i forgot i finished these guys! So glad there are people who like the winter version junimo i did!
blj1gw,I cross stitched Penny 🧡
dti9if,For Abigail
7ihy4n,"Stardew Valley multiplayer beta coming early 2018, underwater area teased"
dckpb1,Now this is an iridium quality Grange Display
aymbfr,Waiting for someone to walk by so you can go through the trash
88wdml,A tourist at the Stardew Valley Fair is your old coworker from the Joja Corporation
bnp9jy,"I will never disrespect the Quarry, again"
bbra4p,Took a break from Stardew for a while. Then on my way home yesterday I saw a familiar sight calling me back to the farm.
8g8rt7,The reaction my wife and I made after winning the Easter Egg hunt against 2 smack talking friends
7z6fz6,Me every playthrough
8xceos,I'm getting some mixed messages from Pierre today...
amcyaq,I tried XD
9w9px5,I think they might be onto something
5db3vr,Stardew Valley is nominated for Best Independent Game @ The Game Awards 2016!
9t99rc,"[Meta]Something just hit me. We're a fandom for a popular game that's been around for years now and we have no famous controversy tied to us, are not regarded as toxic and have not generated a 'push back' negative reaction despite the fact that we're always recommending the game and gushing about it"
ddrh6e,Fall scene I have been working on for Inktober. Hope you enjoy it!
d9zmp9,My farm is almost complete! It's pretty vanilla but i love it and would like to share it. What do you guys think?
bqh2y5,Leah (By BouncyTuna | Tumblr) 😍😍
9t3r4f,Stardew bachelor/ettes Halloween costumes by @stv_tara on Twitter
abidqu,Thought it would be nice to show how dapper my farmhouse is on new year's🎉
9dojje,Clint really out here giving me geodes for Christmas that I have to pay him to open??
a53irr,I decided to decorate the area around my house a little.
9ikx7n,It's a sweet gift but...
cqt7h8,Kent stop giving me this sh-t
9msl79,Stardew Valley - Mobile Announcement Trailer
9rychd,"No one at the party knew who we were, but I think we nailed it."
byo7rw,"I didn’t realise the game automatically added farm, so now my farm is called “HeeHaw Farm Farm.”"
9cl0gx,I just found out about the item spawning cheat and couldn't help doing this
d4kjga,"Drew Harvey in Papers, Please art style. What do you think?"
ai9q9s,My favourite insults from the fair
9zxnhq,What the fuck is Linus talking about
dg5glh,Ahh the miracle of birth
a04z85,Why thank you.
8iypre,After a few crazy weeks settling into our first home .. it’s finally time to relax
a4mmw7,Area 51 is actually located in Stardew Valley
4b8s7v,"I'm ConcernedApe, developer of Stardew Valley. Ask Me Anything!"
b63owa,"Me, playing Stardew Valley for ten hours:"
bph4rh,Created a chart showing each villagers Loved Items
bl66nh,Working on decorating my farmhouse! Super happy with how the bedroom turned out.
a5iowp,Spring in Pelican Town
ayz8ug,Penny when she realizes that the farm she just moved to is actually a massive unlicensed winery/brewery that's been feeding her alcoholic mother free booze for months
8ykqct,Did I accidentally ruin a Crayfish Scholar meeting or something?
crl67n,I was originally going to marry Alex but you guys convinced me to see what would happen if I proposed to human Sebastian with my cat npc glitch. I didn't end up marrying the kitty but now I have all three Sebastians together so it's a happy ending for us ❤
8r3p2o,The Lady in the Travelling Cart
c8065d,"Linus looks like Robin Williams in the beginning of Jumanji. This has been on my mind for so long, had to share it with you guys."
dwroiu,I’ve played 400+ hours and this is the first time I get a visit from the crop fairy. On the first night of a new save!!
bal87x,I CAUGHT ALL FIVE OF THEM!!!! IM SO HAPPY!
8j95b9,"Next update, maybe?"
a4uqgn,My friend had a child with Harvey
9widrp,I accidentally ruined Sam's life.
c235aq,"Met my boyfriend on this sub, about 1,5 years later and it's safe to say we're still a bit addicted :P"
ctqds1,"I usually prefer the cat, but I couldn't resist going with the dog for this farm and naming her after my new irl doggo, Lily!"
5dnv7e,"Concerned Ape wins breakthrough award at the Golden Joystick Awards! Congrats, it's well-deserved."
a7lbbv,Made my boyfriend a cross-stitch with some of our favorite SDV friends!
dehjj1,Finally done decorating!
afmfv6,My girlfriend surprised me with this ❤️
bdfsj8,Is this a hint Alex?
aaar6c,My farm Design (Year 4 spring)
cn4iau,starfruit wine harvesting day is truly the most satisfying!
cxb2yy,Welcome to my Farm Museum
b4j12r,"Where is the ""please stop trying to ask out my wife"" option?"
dv49z8,"I kind of wish Stardew Chickens looked like this, ha!"
d8kf9j,Update to the drunk kitty slime mod. I spent 5 in game hours doing this.
dez3dw,Got blessed with the best randomised name
bq38yc,Sebastian 😚 (By Pakkiedavie On DeviantArt)
d93em8,Farmer cat in training
bhy5hl,Stardew Valley Setup by @SariaArts
apix6w,My gf is so cute and she loves this game so much.
6s3oxo,This is how my wife plays stardew
6xmd13,Just started playing. Probably the fastest restart I've ever done.
dk324k,Farmer Chimi!
dpmpgc,Thought you guys would like my monitors at work!
9jyr6w,Foreal tho
dt8rk2,My new cat looks like The stardew valley cat. His name is Sparky!
cyqr2f,"Okay Governor, let's pretend I already feel terrible about it, and that you don't need to rub it in anymore :("
bj8819,"Let's go to the Winchester, have a nice cold pint, and wait for this all to blow over"
cjthve,"Me, Haley. He’s doing me."
duqo3t,I think my tractor has become self aware. Should I be scared?
ad2oyi,I’m not crying you’re crying
8qor2e,"I've been obsessed with making these little guys lately, thought I'd share."
7pnlkg,Visual Community Center by Season
82gkz8,"Stardew Valley publisher Chucklefish's next venture is Spellbound, a wizard school simulator"
akwgf4,"Tried making a comic, hope you like."
880nau,hi
8zni0y,Stardew Paintings 2: Home
9gkmjp,nice to see my boy Harvey in the new Mary Poppins Returns trailer
b5qi9q,Didn't know Mayor had this in his schedule.
8zynax,How to use a Second Monitor correctly
c15gwf,"Me and the boys on our way to the saloon to ""play Journey of the Prairie King"""
a2d2yz,The Stardew Valley Guidebook is gorgeous! Highly recommend it!
99ej7q,I've decided to hold a small protest in front of Mayor Lewis' house.
ca85gx,One of my chickens snoozing with my cat in the summer sun. Kinda glad I let those fences degrade now.
dq3i8p,I love how when you finish a bundle a Junimo will follow you around. I wish they could live in my house with me they are just too cute!
cqe98i,"I bought the SDV soundtrack to play in my car, and, it came with this awesome poster!!"
7re5dd,"I accidentally built an extra shed that I didn’t know what to with, so I made a pub! Welcome to the Old Bear at Vali Farm!"
bguxma,Saw this at our local produce farm. Reminded me of my Stardew farm.
awhkul,feels good man :)
c6u9cn,Listen to the girls!
bcs18m,I think this level might be bugged...
cya8bk,Void Chicken
cbeqqd,My farmer got married and now I feel like I've done something with my life which is dangerous cuz I'm actually just a jobless broke student
cwjne0,Best idea ever
b24r09,"Named my farm cat after my real cat, Matilda. Pet her in-game today and got the message “Matilda loves you <3”, right as this was happening in real life. Heart melts."
960j1i,"Just figured, when i saw Linus."
9538ez,Me on Monday Mornings
9gd2zi,"Today, is a good day."
9ujeky,Basically sums up my weekend
bxx0ki,"I made a Krobus plush, he even has a glow in the dark face!"
ae42qw,Yoba bless the slime that dropped this prisma shard.
8i782i,when you step outside and see that the blueberries are ready
bqej05,Lewis after I put his underoos on the Grange display for the 9th year in a row
awsxmy,I really wish my ducks could swim on my river farm.
80grzs,Stardew Valley has officially turned 2
8ys0c2,Those street lights hurt my brain...
89qall,Farming while farming.
aci7ro,A good way to feed your animals and manage the grass
9lvl2h,I should probably go see Clint soon
b5z6s3,"I personally find it hilarious that in order to understand the Junimo language, you need to trip on potions with the Wizard while having hallucinations of trees."
bc0y2o,irl Stardew Valley physics lol
9kffj5,"It might sound silly, but this game is the only thing that’s saving me from depression these days. Today I get this."
6tnu8m,Things got a little intense last night...
alspia,"Oh hey there, wanna spoon?"
a9b14d,"2 years ago I started dating a guy and we would play Stardew Valley at his place, we fell in love and tonight we started our co op farm on our Switches in our house in real life we live in together too"
9ix451,The struggle is real...
8rdc0v,Anyone else mad that you cannot make anything else out of coconuts?
9sdhyf,My wife and I when we went from the Riverland Farm to Standard yesterday
aa27i6,My first cross stitch!
ahn8oq,What the heck did you expect?
a8jnne,"Congratulations /r/StardewValley, 250,000+ subscribers! ♡"
c94ezb,Happy Shane with a happy blue chicken!
ds30e1,"I never noticed, your dog sleeps between your kids sometimes. My heart melted."
cj1cbp,I finally completed my regenerating rainbow crystal shed!
a95qqg,Finally starting my Stardew Valley journey!
appiz7,"My Dutch Farm - Spring Year 3, what do you guys think? :)"
avk67q,Can I just pass out on my front steps in peace?
8g5g8h,New Multiplayer let's you accomplish so much together!
5w6abc,Giving gifts in Stardew like
8twkgu,My greenhouse with each kind of fruit tree and every crop/flower
bqaa65,Shhh. They're trying to sleep.
acul04,Sebastian is that you?
a3ggax,Sometimes you find the craziest stuff dumpster diving.
9xq2ev,Kitty Catching Leaves
b59qym,I'm a witch florist and here's my Summer Year 3 farm. I only sell flower-related produce and no animal produce.
80bmpz,Awkward Zombie: Going Down Swinging
b4ww5a,"For those of you married to Abigail, I'm on my way to steal yo gurl."
b2ifaa,Was curious if anyone would like a thunder egg I got from a geode...
aew8jk,Join us. Thrive.
anr1h7,Krobus thinks snails are pretty cool
934xh1,I saved up roughly 24 thousand bottles of Ancient Fruit Wine and 12 thousand Diamonds and then sold them all at once. Umm I think I broke it.
an0k91,pretty much finished my 'aesthetic' farm. im a bit proud.
axyyez,Been playing a lot of Stardew lately and thought I would make some pins!
991dp2,Spongedew Valley
belciy,I did a cross-stitch of me and my boyfriend’s characters fishing 🎣
begn87,But I don’t want to shove her
a9p36a,"There's really nothing more satisfying than waking up to this view after a long, cold winter spent deep down in the mine."
bebhwg,A Very Happy Dancing Duck
b01xvn,This man has an uncanny resemblance to Elliott...
9c845a,Perfect
7qakcs,Updated Visual Community Center By Season~
5vbpfz,When you open the barn on a sunny day at 6:30 AM
cyc93n,shhh..she's mourning
8sih6r,My first harvest for the summer.
co3ds8,I am in love with my farm.
ctoy6i,"I just started this game a few days ago and this is my current farm. It's small, but I'm proud of it. It ain't much, but it's honest work!"
a2vo31,Then what is the POINT?
a6nrxy,"I would like to start a petition to hold Marine responsible for not being available for one, but TWO DAYS and may I add, CONSECUTIVE DAYS during Winter!! Now my poor babies will have to starve for two days because this irresponsible woman has the nerve to not even notify when she’s unavailable!"
a65okt,Shane and the Farmer tho
8m6vya,It just never ends
8ik75t,Stardew Valley provides a realistic simulation of a wholesome and natural lifestyle
8cs0y4,"Saw this on Facebook today, knew immediately who would like it."
dvjt6v,"1.4 launching for PC on November 26th, consoles will follow after."
8lkv9a,I made a poster for Stardew Valley. Let me know what you think!
ahb00o,The valley looks more interesting in the rain...don't you think?
d6q4n1,Just picked up the new Switch Lite. Of course this was the first game I downloaded!
dbc1aw,Well...That’s one way to ruin the beauty of the Moonlight Jellies.
9bpfix,Clint was on Forged in Fire the other day.
85fs64,Stop by my cabin if you want to huddle under one of my quilts & drink cider!
aqroaf,Gave my partner a Mermaid’s Pendant for Valentine’s Day! Guess we are getting married in 3 days now.
c9gzqi,"Have a comic I found on imgur, credit in the pic."
684uo7,Guess I better start collecting those bundles...
b40m4c,Had a productive day at work if I do say so myself...
7qkrk0,You can marry other players for online
74gvhk,me_irl
a1ynse,Stardew Valley irl
ap18kj,Linus spent what little money he had to get me something good. I’m crying. He’s the best character.
acxgy8,Friendly reminder that Stardew valley Auto generated this name for my chicken
brgels,Been really depressed these last couple of months. SV helped me through by showing the value of doing a little bit every day. My dad and I don’t have the best relationship but we’re working on it. Here’s a picture of our garden we just planted.
dqn31i,Real life prismatic shard
dpwvql,Dressed up as a sad boy for Halloween
a5ncni,[GIF] First year Flower Dance crippling depression (album in comments)
95bi1f,Witnessed the birth of a slime in the wild for the first time. Just look at those proud parents! Truly magical.
dao0d2,It’s sunflower season!
7w6a6w,Infographic - Easiest gifts to spam for Singles
7kcfvl,What I always imagine happens when you drive home from Calico Desert
9ccyoa,Very good ha ha yes
c839c0,Completed haley cosplay 💖
9s50l9,I always decorate pumpkins with my current obsession.
bsukgi,"I happened to visit my grandma's home and found her working in her farm! With my stardew instinct, I helped her out till afternoon, all sweating but happy. :)"
brsiyu,I spent way too much time on this...
covrxq,Waiting for harvesting my own crops !
616h2t,How I feel when I find a giant crop
a2iv8g,Something sappy before getting back to regularly scheduled (?) Toni antics.
b32b7t,I made a cute little Junimo!!
90nhk1,Why are we like this
aptjhu,THE BEST FEELING IN THE WORLD
cx7o3w,A new community center bundle should unlock this
5s9cge,Old Dog Learns New Trick
9b1do1,"At the fair, one's true colors are revealed..."
58m0s2,"Anyone else want Stardew Valley on the Nintendo Switch! Would be the first ""portable"" console that supports the game!"
dkot1s,Waiting for lighting to strike my She Shed.
8jwvz1,"You did it again, didn't you."
bbkywo,small garden for Linus
9oxdpf,ConcernedApe messaged me back on tweeter. can’t wait for switch multiplayer!
dsroil,My attempt on Japanese style decor. How did I do?
a9f88c,Best wife ever got me this for Xmas!! Super stoked to fill the house with these jams!
blpbq6,I really like WPA travel posters and Stardew Valley so I combined them
dj9xey,I found where the traveling cart goes on the rest of the days of the week
ac3gcv,Jumino watercolor
