post_id,title
9gqm2d,Thandie Newton just won a freaking Emmy!
7vbfwg,Westworld Season 2 Trailer (Superbowl)
8hbm88,"Elon Musk: ""What do you think we're living in?"""
8ybb69,Everything you feel is true. Ed Harris has been nominated for “Outstanding Lead Actor in a Drama Series” at this year’s Emmys.
8v28fd,Angela thanks reddit for her birthday post ❤️
8otf02,"At my high school, Seniors carve wooden plaques that are placed in the walls after they graduate. This was mine, but it doesn’t look like anything to me"
9fkziy,‘Westworld’: Aaron Paul Joins HBO Sci-Fi Series For Season 3
8tyu4o,What if Bernard's eyes matched the location of his glasses?
5cxis3,"'Westworld' renewed for second season, likely returning 2018"
6oydh6,'Westworld' Season 2 Official Trailer
8ltu2i,My programmer friend made this for a sugar skull decorating contest at his job... no one got it.
8sn3r7,Welcome to Chez Bernard
5gxuy2,Siri watches Westworld!
8hykff,Bernards Immensely Complex Encryption :(
6ipf8h,Westworld Season 2 Filming Starts Tomorrow
bug4le,Hosts won't let me down.
5gjovu,"Westworld - 1x10 ""The Bicameral Mind"" - Post-Episode Discussion"
9ayqkd,"Westworld, Explained"
8vdk4k,When it’s Sunday but there are no more new episodes of Westworld
8m9rwz,Evolution of Dolores....
7g3saw,"“Winning doesn’t mean anything unless someone else loses.” Happy birthday to our man in Black, Ed Harris!"
8ux3ia,"Happy birthday to Angela Sarafyan, our darling Clementine!"
5gokjm,They have already told us Ford's plan at Episode 6
5eww9o,I just watched all the Westworld episodes
7b6pnu,Westworld Returns Spring 2018
bqon1t,Westworld III - HBO 2020
8twq0h,The numbers on the all-black book profile in the Forge create an IP address that leads to a password protected site
5bojry,The flashlight of the future is....THREE FLASHLIGHTS
8xjgg7,Freeze all Maeve functions!
6temjx,The pie isn't meant for you
7deqtw,"[NO SPOILERS] Just Evan Rachel Wood being her badass self. With fierce women at the helm, Westworld will continue to inspire and create new standards for women in film."
5mwmwc,Evan Rachel Wood opts not to wear a gown at the Golden Globe Awards - our kind of rebel
8j6ael,Happy Mother’s Day to Westworld’s #1 Mom
8j09kw,When you time travel so you can be your own best friend
7kay4y,"Angry customer: ""Is it something you CAN'T do or something you WON'T do?"" Me:"
8tsft3,"It’s Bernarnold's cornerstone, Jeffrey Wright. Ask Me Anything(ish)!"
8vremn,Re-edited a meme
br0ula,What's west of Westeros?
6yi5dp,Google Assistant is self aware
5qv82a,Clem & The Techs at The SAG Awards
5i87sj,These violent delights have delicious ends
8i7k29,My Westworld fan poster
5fv2gk,If /r/westworld actually went to Westworld:
8pvsb6,My Dolores Cosplay from a con this weekend!
5zfvah,I noticed that Dolores has kind of a small face... And then I couldn't help it
5g9dpa,I made a LEGO version of Ford's office. (xpost r/lego)
8pjggj,If Lego was owned by Delos Incorporated
8u4oq9,How I felt after watching that Finale.
5h05hp,Lets give our warmest congratulations to our head of Behaviour. Jeffrey Wright turns 51 today
7drz4j,[S01E01] The Original
8sufls,"William just learned that sometimes, it does matter"
8tlq3q,Made some snacks for the finale...
7v573d,During the Superbowl...
5maqxw,Robots - Rami Malek and Angela Sarafyan
88njtn,Reminder that there is a fan made 94 minute linear version of Westworld Season 1
7rixi0,Here's the Man In Black poster I created tonight.
5eakpn,I finally figured out who Hector kept reminding me of every time he came onscreen.
86d80u,New S2 Poster
5hwnv3,Westworld was just nominated for a Best Drama Golden Globe Award!
8jdp18,"It's Westworld Co-Creator/Executive Producer/Director Lisa Joy, Ask Me Anything!"
brirr1,GoT/WesterosWorld Alternate Ending
5uw56z,"Met Jeffrey wright in Hawaii earlier today. Super nice guy, very friendly/talkative."
9impez,MFW someone downvotes me.
62v94d,Reading anything online today
5gogwa,Westworld beat Game of Thrones with the most-watched first season in HBO's history
5a4x0n,The fiancee and I decided to take a stab at Westworld!
5gd564,I drew the cast as cats! Please enjoy!
7w0ls5,Westworld poster by Dustin Goebel
8ivnrp,The many faces of Bernard
5fd5ei,William is a massive piece of shit
881y9i,Westworld - Season 2 | Official Trailer
7rzuao,Westworld Crew Has Wrapped Up Filming On The HBO Show
c62lif,In every comment section on this sub...
6xvd86,I'm not a conspiracy theorist. All I'm saying is I've never seen William and former president Jimmy Carter in the same room together.
8z5eyy,How it really happened
8q9k2j,is that a cameraman following maeve on the left ?
79pgdm,My very talented friend’s costume this year!
8hj721,"Behind the Scenes Pic: Man in Black, Dolores, Bernard hanging out with Lisa Joy, showrunner."
8tqh0p,Early season 3 promo photos
64qke3,When someone says Dolores is the best blonde host in Westworld
5lt4fi,I really want this t-shirt.
5xht57,Clem's dress doesn't look like anything to me.
7wu5gk,Behind the scenes picture. I love this show and filming at these locations must have been incredible!
5esc5q,Timeline Theory Deniers
8yy7zs,Dolores in season 2 is Bender from Futurama
5kama5,"The Reveries. By me. Pen on 9x12"" paper."
c4zr4h,My Dads button from the 1973 film
916i8z,1950s Westworld
8tnsu8,Season 1 scenes replayed in the Forge
79ycpi,My take on Dolores this year for Halloween
8keesj,Me anytime the Man in Black does anything badass
5j6gne,Westerosworld by Caio Oliveira
6n2fbf,"""Westworld"" Nominated for Best Outstanding Drama. ""Evan Rachel Woods,"" ""Anthony Hopkins"" Nominated for Best Lead Actress/Actor"
9urwhz,Vote (xpost r/hostworld)
8vwfmg,A Fantastic Artist
742amk,I'm at a gaming conference in Las Vegas right now and just stumbled upon a Westworld lounge!
5f9bec,"Westworld - 1x09 ""The Well-Tempered Clavier"" - Post-Episode Discussion"
5ijcen,A match made in heaven
8wgij4,Not sure who’s original content this is but I LOL-ed
5hrlxf,HBO registered exploresamuraiworld.com (and exploreshogunworld.com) on Friday
cy2fmz,"Took a while to find the exact spot, but an awesome view at Dead Horse Point State Park in Utah!"
bxeerb,William became a total different person.
71rnvz,James Marsden on set!
8j8x88,"Absolutely, without doubt, the best episode of the whole of Westworld so far! Applaud to all involved! Who agrees?!"
784sdd,Wife and I were popular at DragonCon this year!
9seg55,My wife and I went to a party where no one knew who we were dressed as. I thought our costumes turned out well!
abgvr8,Today is Sir Anthony Hopkins’ 81st Birthday!
5gspll,Ford is a millennial
5d92im,It's Always Sunny in Westworld 3... A Peak in Bulk Apperception - (x-post from /r/highqualitygifs)
5gua52,[Spoilers] Let's show some appreciation for a show that had the guts to tell a complete story in its first season.
61jqv7,"Been drawing some Westworld characters, here's the Man in Black."
8uizal,"My GF painted Akecheta yesterday (acrylic painting on canvas), but she was too shy to post it herself, so with a permission, I do it for her. What do you think guys?"
5yk6ti,Futurama scene vs. this dramatic Bernard and Ford scene (they're the same)
7w93s3,Found an old newspaper from 1973 in a wall. It had this cinema advertisement on the back!
8jo6gl,Behind the Scenes Pic: Westworld Besties
5fs1lz,Thought you guys would like my WIP MIB 1/6 Scale Figure
5pv1eg,Um guys!!!!!!!!! Maeve and Dolores
8sc2zt,The Wizard stays hustling.
7fposg,This scene was shown in reverse so that the fluid would seem to glide off the host.
758etg,I'm not sure if this is a repost
5kf0pe,I decided to build Westworld... In The Sims 3
5labiq,"Time to wish a Happy Birthday to one of the best antagonists in TV and Film, Anthony Hopkins, the nefarious Dr. Robert Ford on Westworld."
5h3drw,Amazing fan poster by Berkay
91tvyp,HBO Boss Responds To ‘Westworld’ Backlash: ‘It’s Not For Casual Viewers’
6kvdlu,Maeve and Hector from Westworld Cosplay
8uaw7e,"At the end, MiB finally finds the maze."
5cu0kq,(SPOILERS) The fandom right now
bsxp8i,This sub do memes?
8g3biz,My exam procrastination has lead me to hand drawn memes.
8pedux,My attempt at some Maeve fan art
cfp57c,the cast at comic con
8m230b,Armistice and Hanaryo
8wl8kt,[Spoiler] Delos Family Before and After William
8tt907,Updated Timeline with S2E10 events
8p0pqb,"Happy birthday to Jonathan Nolan, co-creator of Westworld. Thank you to you and Lisa for this amazing show!"
5b3usi,I made a fan poster for the show
co6gay,"""Freeze all motor functions"""
7qludv,You may also recognize Rodrigo Santoro from 300
8s1l40,"Oh, painful foreshadowing. 30 years, he never figured it out."
9alwec,It's been one hell of a ride
5jfw15,If I went to Westworld...
7z8hhn,HBO to build an actual Westworld town outside Austin
8gglwf,Arnold's House In Progress Is Actually A Real World Architectural Masterpiece By Frank Lloyd Wright
8thxem,Posted by Shannon Woodward (Elsie)
5fii5l,Can we stop referring to Talulah Riley as Elon Musk's ex-wife?
5gh3qr,Early birthday gift from the wife. Hope the theories true!
bts0az,"Rewatching from the beginning. I believe this series so far is near flawless in everything it does, particularly the first season, but I believe what really glued the entire beginning together is the phenomenal performance from Evan Rachel Wood"
6pk6mq,True love
6k1n3l,Evan Rachel Wood is such a good sport.
7fiej8,"Westworld, Hand-cut Collage 2017. Thought I should post this here too."
74fjtb,"The Bicameral Mind, by Vinh Pham."
chu887,Gotta love a good composer
bq3wby,I 3D printed this coaster set - but it doesn’t look like anything to me
8tn0k2,"Westworld - 2x10 ""The Passenger"" - Post-Episode Discussion"
8y67lf,Let's all hear it for Hanaryo's cheekbones
5bin85,I made some fan posters for Westworld.
8l07rl,My new favourite caption of all time
8ueqmq,Ed Harris' reaction to filming the riding scene
bzsepb,Accidentally walked into the new Cuba World
5hcj4o,[SPOILER] S01E01 vs. S01E10
8fzmrg,"[SPOILERS] When my buddy and I finally save up enough money to go to Westworld, but it's not quite like I imagined"
7pc6un,Jimmi Simpson Confirms He Will Be Back For Season 2
8o4v4z,"[SPOILERS] For me, this was the most heartwarming scene of the entire show"
5f24qs,Maze? Doesn't look like anything to me. Visited one of Westworld's filming location.
8xwh3s,When you realize Ford beat Thanos to it
8odnac,Can we talk about the security guards?
75tbye,Second cosplay ever so OF COURSE i needed to be Armistice.
5ugs5j,"Westworld's version of ""Paint it Black"" is my favorite musical piece from the show"
6232pf,I drew Clementine!
5ihghf,When my friend spoils the finale before I got a chance to watch it
8e76qc,"I made drink coasters as gifts to give out during the premiere tonight. I've been told they came out fantastic, but they don't look like anything to me."
5kitt0,When you show someone Imgur/Reddit for the first time.
bwgmrb,Me to every friend of mine
8nho6m,S01E03 in case there’s any doubt about the direction Teddy is going
bz9xb0,"Thanks, subtitles"
5h7d29,Westworld 80's logo
8s9apo,Hats in the data gathering facility in S02Ep01!!
8rvwmr,"[Spoiler] Well, that explains this comment from Lisa Joy..."
5fhjzi,Made me chuckle
7t652b,It’s not a story HBO would tell you
8e843u,"Westworld - 2x01 ""Journey into Night"" - Post-Episode Discussion"
8tnnk1,Congrats! EVERYONE's theories were right!
9y53e3,I am only now realising the foreshadowing behind this line
8urb5w,I think this is the most powerful line of this series.
8ecn4q,"Westworld Composer, Ramin Djawadi here to answer your questions!"
9szlww,Halloween as this terrible human being
6somkm,I'm sure that this has been posted here many times. But I just couldn't help but laugh when I came across it
8x18tl,The Elsie Hughes Blues
8tnb2a,One of the hardest turnarounds I've had on a TV character. Time to pay respects.
6r70ps,Dolores fanart by David Thomas
byw1ta,Aaron Paul's character: Host or Human?
8qt6zj,"Nine layers, why? Dante, that’s why."
9dozm2,Just Shoot It
8roycg,Akecheta's Official Portrait by Artist Berkay Dağlar
5ng0io,I feel like poor Teddy had this look on his face 90% of the show
dt8f2m,Game of Thrones and Westworld composer Ramin Djawadi has a sensory condition called synesthesia that allows him to visualize music.
6v4zj1,Trying to look at eclipse with cellphone camera
5ctrv6,"Westworld - 1x07 ""Trompe L'Oeil"" - Post-Episode Discussion"
8qf1rc,"Ghost Nation season 3, episode 2! Thats me on the Right! Fun day of work."
cj11tj,If /r/westworld actually went to Westworld:
8iihtw,Yesterday I got this poster
9vnwjl,Damn.
5gmcyx,I just realised that Felix...
6nkzrx,"After seeing this image I realised, that I would like to see a forgotten, ""killed"" host in season 2"
8onw2t,Dolores seems to have an odd affect on the people around her.
93tvu1,Team Maeve
8vl6g7,"Dr. Robert Ford ""💬"":"
63lpit,Dolores Disassambled
5wvd2c,"This guy sums it up perfectly. ""Dr. Ford"" by Ramin Djawadi."
8u1802,[Spoilers] The actors don’t know the context of each scene they’re doing
ckuqu9,Did I buy this turntable solely because it was featured in S2 of Westworld? Maybe.
92vp3t,"Jonathan Nolan, Lisa Joy, Evan Rachel Wood & James Marsden on set."
5g4x2r,I'm at Comic Con Experience (Brazilian Comic-Con) and HBO has this beauty over here
8jktx3,My New MiB Wallpaper.
c167iz,Me & Bernard (Jeffrey Wright) outside the cafe I was working at in Utah; October 2017. The cast visited several times while filming Season 2!
95b8nq,When it's only been 44 days since the season 2 finale.
6h8139,When Your Special Lady Friend Thinks You Haven't Seen the Show
7am40k,My girlfriend sewed her Dolores costume by hand
8a79wn,They did a pretty darn good job on Young Ford
8qxnk5,Even Deeper
5r6w17,The playground wasn't meant for you
8jvgm4,Amazing use of make-up and CGI
5jlqnp,Why wouldn't Delores let William eat the corn?
8xagry,I think it's clear what HBO's new AT&T overlords are asking them to create.
5gk1jw,Ep 10 Spoiler: How to figure out if you are a host.
9sr2ub,These violent delights have violent ends..
5l3e8a,Having your ancestors for dinner
5slyc2,Cease all motor functions!
92k060,The chairs in the old field lab are from McDonald's.
8aztn4,"We are Westworld Co-Creators/Executive Producers/Directors Jonathan Nolan and Lisa Joy, Ask Us Anything!"
61v7yg,Louis Herthum (Peter Abernathy) will be a season 2 regular cast member
8w27gh,Doesn't look like anything to me
cgfcib,Some believe the sky is blue because we live inside the eye of a blue-eyed giant
5hmoaj,Just now realizing the irony of the name one of West World's production companies
cb0bta,Jeffrey's Insta
5gnwrh,Who's gonna tell him
bxzthm,Favorite Logan scene
56tqz2,Noticed something kinda funny while watching episode 2...
8hsa66,Just noticed familiar face in Maeve's flashback
cfawru,They claim to be an insurance company but I’m not convinced
924c9l,Just Bernard things
8tozjf,"""They simply became music..."""
8ejofi,Am I the only one who think Ed Harris looks like Freddy Krueger?
8mzfx2,"I took a photo of Westworld at sunrise. Utah, Valley of the gods. (A pretty fitting name if you ask me)"
5btbop,We know everything about the people in our park... except for these two blistering idiots playing with a host in an all glass room.
9nq156,"You guys liked Dolores, so here's Maeve."
bkg5fh,FIRST LOOK! Evan and Aaron filming season 3
672w2i,"As soon as I finished watching the last episode, I began stitching this piece."
6d5dtx,Rewatching for all the delicious bread crumbs I missed the first time (S1E02)
9rw5ns,Akecheta
8tu7pw,Pure bliss at last
8nteam,**Fan Art of a non-Artist** I drew my own Bernard
9tp1ok,Made the Man in Black in Red Dead Redemption 2
8u8eit,Timelines
bu8hih,The different layers so many scenes have when you rewatch the series is quite frankly astounding
c3albu,Visual representation of waiting for Season 3 after binging the first two seasons in two weeks
7jmo2g,It's finals season!
5g0dvl,"Hey guys we can stop the debate now, it's been answered"
8zw41r,"I stopped thanking my Alexa because I realized it was pointless, but then envisioned myself getting hung by Dolores in, like, 7 years."
5gou76,[S1E10] When someone says that they don't like Westworld
8tn4al,"[Spoiler] Favorite moment of S2E10: ""What door?"""
5indsk,My favorite moment from the whole series. The smile is priceless.
8ujn29,"Me, after studying for 30 mins."
bbod67,"William,M'boy"
8q5x3l,An essential timeline of every important event on 'Westworld' Till S2E08 👍🏻
8ugpkr,Whenever someone tells me they didn't like season 2
8rrpmm,Paranoia Will Destroy Ya
8mq6y0,Team Meave looking badass
ck28j8,My attempt at a portrait of Dr Ford
8klww8,You're still miscalibrating.
bmmalp,Made a piano cover of Old Town Road if it was in Westworld
cdc8uo,Is Westworld really Toy Story 5 ???
94iwnw,"The Women of Westworld - Ingrid Bolsø Berdal, Lisa Joy, Thandie Newton, Evan Rachel Wood, Shannon Marie Woodward, Angela Sarafyan & Katja Herbers"
8yjizb,"My Secret Santa sent me a package, but it doesn't look like anything to me."
5kuoip,Got my mom hooked on Westworld. Came home for Christmas to find this...
632e3h,Evan Rachel Wood & Millie Bobby Brown. Aww my heart!
5gldxh,[Ep 10 Spoilers]A Simple Handshake
5iwy0c,My poster design inspired by season 1 of Westworld
5f5k6j,Queen Mab is my Juliet.
8qdelg,My reaction to episode 2.8 (I grew up in the Oglala Lakota world and am part Lakota)
anklk5,Am I recreating Westworld in Sims 4 as I restlessly wait for season 3? Absolutely not. 👀
5ie1rt,"George R R Martin says Westworld is favorite to win the Golden Globe, even over GoT."
5koq01,That's one humdinger of a costume
bphf0p,"Tessa Thompson Featured in Time's ""Next Generation Leaders"""
9kh1z0,Halloween preview - My Dolores (season 2) costume!
ah2fx2,It Hurts
8ti4hr,Gun fight tips from Westworld.
8fwgez,[Spoilers] The best shot of tonight's episode
8rw1ig,The saddest moment of S02E09
8gajo1,/r/Westworld every time a new sneak peak comes out
6dhwjq,My Dolores Costume!
5e6ors,And This is Where it All Goes Downhill...
d59ne1,It’s real...what I dreamt...
cs4dlo,I drew a minimalist Westworld poster. What do you think?
8lqc0p,I did this today because I can’t stop thinking about Shogun World. Enjoy!
8j8ynm,"Dear HBO: PLEASE, have Lisa Joy direct more HBO episodes!"
ceq7xj,I put William through the FaceApp and this is the result
7usjmf,Westworld season 2 trailer to debut during Super Bowl
8p6es4,"""They called me a host, so I hosted their funerals"""
6hraek,Westworld Season 2 Premiere Title Has Been Revealed
dn8nf8,I noticed something while watching Romeo and Juliet
8raczp,There’s a “Dear Dolores” hydrangea also known as “Wyatt LeFever”
8hn8fq,"""Shoot a woman? Over my dead body!"" Suddenly Rebus' reaction make sense."
bs11e1,This season 3 casting call is peak Westworld...
5obhom,This is what Siri told me when I tried giving her a Westworld command
9c3z5c,"Akecheta, 16"" x 12"", acrylic on black canvas."
76w286,Season 2 Filming in my town. Saw this a couple days ago.
6lxq6c,New on the website!
6lml66,"They have no free will, and they can never be together: our domestic robots"
8tn26b,The ending we all wanted :)
5f9fma,"Between Westworld and GoT, Ramin Djawadi deserves an Emmy for Best Music Composition in a Series"
blk5uz,"Finally convinced my girlfriend to watch, just got this text."
5s046x,Westworld poster by Joseph Harrold
bfemot,Season 3 Spoiler!
8qbuyi,Simon Quarterman (Sizemore) deserves a lot of recognition. His acting is very underrated and I hope to see him in the future to come.
9a0a3u,Dolores cosplay by Ver1sa
daaxoz,Season 2 leaves me feeling the same way
7l2c9z,Bernard's update for season 2 is wild
75jolk,"Filming for Season 2, who’s coming to Utah?"
8inkzl,I am painting a Westworld portrait series in india ink. Each will feature one character and a quote. First up Clementine Pennyfeather.
9058ft,Cartoon by futurism
cgp5hc,Poster for Westworld (2020)
8k5ugp,I drew The Man in Black from my new favourite scene. What do you think? Promarkers on Bristol Board.
5fcbkn,THE MOST IMPORTANT REVEAL OF E09 (and one no one is talking about)
brou46,Daenerys or Dolores?
8pb6k0,Dolores Abernathy
aw6vuo,"We're Gonna Be Brothers, Billy"
8tow7t,Love this answer by Jonathan Nolan. He and Lisa just respect and trust the intelligence of the audience.
cg2nmh,One more for you fine people.
891yvc,Just visited Paramount Ranch...
5ctwfo,We have seen the basement before!
8q5sfn,"Westworld - 2x08 ""Kiksuya"" - Post-Episode Discussion"
6qypts,Jimmi Simpson Recaps Westworld Season 1 in 6 Minutes
70sjxk,These stupid awards have stupid winners
92rqhu,How fast you running if you saw this zooming towards you?
5fm9zd,She wasn't joking ...
8tn8xo,All the Way Down
bw433r,OMGG 😮 Just notice this in 16th time i watched the trailer! Well done HBO
biftl5,"Willion, Teddian, and Arnal"
5conlr,"Some fun/interesting continuity, the host getting filled with blood in E6 was only at the design stage back in E2."
d9sl7h,Is this legal?
8ttc0i,The people I wanted to see in the Valley Beyond :(
9tg8m8,I was Armistice from Westworld for Halloween!
dq00ez,When we can’t wait for new season... Halloween is our “candy”
cio3or,Shogun-World visible in S1-Ep3
5gjzfi,[Spoilers] The Hosts...
8c8xzn,I've just noticed that the host that took the role of Peter Abernathy was initially the bartender in Moriposa Saloon
ab4ruh,TRIED THIS TO GOOGLE ASSISTANT AND IM DEAD 😂
9ukf1x,Happy Bday to our beloved Maeve. Thandie Newton turns 46 ♥️
c3rw1c,Dr Ford's theme (Just found this in the YouTube comments section)
c8ycj4,Basically Dolores in S1E1 ending
5tmx7r,Duh... Ford. You don't never think through.
cw63z2,But whyyyyyyy
9ggd3d,Lag
5d6hel,Will Transforms
buxarc,That ain't no Clementine
5d0zee,The real question no one is asking...
80kiaj,Fahrenheit 451 shares Westworld's vision that the future of the flashlight is indeed three flashlights
90fpai,Questionable Motives
8q638x,Ford’s speech at the season finale was actually about Akecheta
5glvpk,Westworld Character Status Chart - Episode Ten
7oe1xx,"Hey guys, this our Maeve and Hector Cosplay! Hope you enjoy it!"
9nfit5,Dolores portrait I Did. Thought you might appreciate it.
6mqjnr,1880 Town in South Dakota. Has some striking similarities to the Westworld set
5j0xj8,Dr. Ford
8k7ov8,Evan Rachel Wood
d1stve,Time for the yearly rewatch! Can't wait for S03
8pqlcb,One of my favorite pieces of fanart...
5e6x8x,"Can we make the black spoiler line read ""Doesn't look like anything to me""?"
8kaur9,"Tried to draw MIB looking happy, accidentally made something very creepy instead."
a0w5xd,Happy Birthday to our black hat (who is actually a grey hat) Ed Harris!
5szjst,Westworld helped HBO reach 1.5 Billion in revenue.
cqim7s,I just really miss him.
b5rfau,She's Tired
8jghp7,"Bring yourself back online, Dolores (I finished my S2 cosplay!)"
5dlaq5,What a nice guy
a08vlg,Be Careful What You Wish For
5gmgyx,In what universe is it OK to go into a glass room and pleasure yourself in front of your co-workers?
800y4j,One of the most underrated characters. I'm psyched to see what happens to her on S2.
5xesj5,Dolores by Susan Ramirez
5cjmaa,"THOSE ARE CLEARLY NOT BERNARD'S HANDS - Seriously, you guys will argue for Multiple Timelines for months but Multiple Black Guys is unthinkable in the future?"
8rih6p,"I never bought into the ""William is a host"" theories... But I came across these two posters and he's the only human in both. Or is he?"
5cusxj,Can we give props to Sidse Babett Knudsen for her amazing performance this episode? She's one of my favourite parts of the show.
blzpup,The starbucks cup proves Game of Thrones is a Westworld park....
8jz4xc,Westworld Besties
9njx83,My gf and I cosplaying Hector and Armistice at DragonCon
81lro5,"I finally got around to watching season 1 recently. My mind is still blown, and I had to do some artwork. I thought you all might enjoy, although it doesn’t look like anything to me."
9u8k8h,I found Escalante this morning
92czq5,The Maze in a park in Bucharest
bo99kb,Their main selling point
8nzc1d,A familiar place..
d8gqi0,"Someday, Everything will make perfect sense."
5qb9bi,After 2 weeks waiting my 3D printed ring finally arrived :D
cvdb0r,Digging my setup
83jqto,HBO Might Plant False Fan Theories To Throw People Off
9o8lxo,I paused S02E09 to check the wiki and came back to William accurately reflecting my mental state.
8dfvqd,In about 30 mins we are going to watch first episode of season 2 in my local cinema!
5m4kxt,A bit late but my girlfriend made me this westworld terrarium. Thought y'all might like it.
a3dhwo,Timelines (xpost r/hostworld)
94a4kv,Does anyone else find this ad placement hilarious?
78qtao,"The cast and crew of Westworld filming in Kanab, Ut."
8n5435,Evan Rachel Wood speaks out on Dolores hate this season
8tdiuo,Your Favourite Moments
bdeqsm,from their Twitter:
8rvw5m,"Westworld - 2x09 ""Vanishing Point"" - Post-Episode Discussion"
8tb1kk,r/Fortnite Didn't seem to appreciate my new skin suggestion...
7i198l,Westworld to resume production today.
8kxdlo,"Westworld - 2x05 ""Akane No Mai"" - Post-Episode Discussion"
55ps3t,"Westworld Ratings: HBO's biggest premiere in nearly 3 years, with 3.3 million viewers"
98c44n,'Westworld' Creators Have Had a Plan for Season 3 Since the Pilot
aq6kcm,"I mean, just look at it"
8laza3,[SPOILER] My favourite part of yesterday's episode.
9hqpu0,MIB and Lawrence chillin' at Emmys
8zlla3,[IMAGE] There's No Time For Anything Else...
6cy6qs,"My aunt took a pic of this prehistoric (possibly 40,000 year old river bed rock) in Rivona, India. Amazing"
5gjp9z,"Ok, I don't care about Westworld anymore. Give me Samuraiworld"
993ucv,My friend is an embroidery artist and this was my birthday present this year.
8tpau9,Every Frame a Painting
8qnfbd,When you realise there's only two episodes left so we'll start getting some answers
5fahei,"All Fords in one picture, what amazing visual effects job"
