post_id,title
5ncfd9,WestWorld must spend a fortune on Windex.
5gjgih,I totally appreciate Westworld having a 93-minute finale.
de6nio,Rented a Jeep and went off-roading in Utah. Found something full of Splenda.
ako31n,October 2017 I binge watched Westworld in one disgusting sitting. I immediately got my wife cowboy boots and she dressed up as Delores for Halloween.
5mgub7,Westworld poster by John Conlon
5u8vo4,Y'all mofos are changing the way shows are written and secured! (Stranger Things article)
7652y1,Oh my god... they made a Westworld slot machine!
9ln2yz,William's life
8tssqr,Westworld understands Reddit more than Reddit understands Westworld
8fbbvo,My favourite visual of the S2 opening: The black hat turning to eclipse the light
8nm1su,Just finished this painting. Thought you’d enjoy! It doesn’t look like anything to me.
79gc27,HBO asked me to do Armistice's makeup!
cdj2v0,My favorite photo of my Hector Escaton cosplay.
9yh752,I Met Dolores Last Night
5gecwy,The picture of Juilet that started it all is a stock image!
8fq4aj,Brain device was revealed S1E10
dgtuqm,Ford really loves his creations
9xmr1m,"If You Do Things Right, People Won't Be Sure You've Done Anything At All (xpost r/hostworld)"
5e24ag,"[Episode 8 Spoilers] We now know what ""truth"" the Wyatt narrative is rested in."
8h2bgf,White Hat & Black Hat ID Badges handed out in downtown Chicago
cn18fe,Surely just a licensing issue...
bqubk4,yee haw
8zgtkj,Should’ve gone back to dental school
5gjqp0,[Spoiler] Delosincorporated.com updated after ep 10...
7xnifz,"You have 200 points at your disposal, how do you distribute your points?"
bva3b1,It was a relentless fucking experience.
8cml6h,"HBO has changed the video title of the Westworld Opening Credits to the ""Westworld Season 1 Opening Credits"", further confirming a brand new opening for Season 2."
976nqh,Another Great Poster
59j7rq,Westworld X Futurama
7ae7l3,‘Westworld’ Suspends Filming After Cast Member Suffers Fall
8mlsyh,"No seriously, Sizemore is a treasure trove of plot clues and foreshadowing. Look again."
8kfagu,Day 20 of not drinking...
8f70ld,Alt Shift X - Westworld S2E01 Explained
8mmkw7,"Westworld - 2x06 ""Phase Space"" - Post-Episode Discussion"
5aj8lg,"The Official cover of ""Paint It Black"", from Westworld's Soundtrack"
5ctt50,Let's just dispel the notion once and for all that Ford doesn't know what he's doing.
8odnbq,"Westworld - 2x07 ""Les Écorchés"" - Post-Episode Discussion"
5morum,Doesn't look like anything to me
99nl53,"If you can’t tell, does it matter?"
5nrble,I drew the Man in Black. All those lines in his face were fun.
8dvm68,Thandie Newton said she was surprised at how respectful the cast and crew were after nude scenes
96478i,"I just really, really miss this show. Original artwork done by yours truly!"
bnl992,HBO’s Mother’s Day Cards - Here’s Maeve’s!
bgyfuk,Rodrigo Santoro (Hector) just started to film season 3
5czaap,"WESTWORLD is averaging a gross audience of 11.7 million viewers, outperforming “Game of Thrones” and “True Detective” during similar times in their first seasons."
8jensx,[spoiler] What Bernard really says to the drone host
5d35ok,"Can we stop using the word ""timelines"" when what we mean is ""time frames"" or ""periods of time""?"
8l4omn,Bugs in the code.
8twink,Hiatus shitposting begins... Now
deqx8j,Main cast wraps on S3. Clementine is also back this season!?!
9zewng,"Happy Turkey Day, Turkeys"
8oe59p,The finest of cinematography
5c6gaa,"The truth behind Bernard, he is actually..."
9s3xj9,Doesn’t look like anything to me
5tglvq,[OC] Minimal Westworld Poster
5i4eto,"I was trying to remember the ""it doesn't look like anything to me"" quote. This was the top result in google."
brbtjk,Made a Maeve poster
8qf0nf,Another beautiful episode with some gorgeous shots
7qi3vj,"(No spoiler) Meet “Sideburns guy” also known as Steven Ogg, the voice of Trevor in GTA:V"
cd4gcd,When parents return home with your newborn brother
58npuz,"Westworld is Now Number 1 on IMDb's list of ""Most Popular TV Shows"""
8j8swx,"Westworld - 2x04 ""The Riddle of the Sphinx"" - Post-Episode Discussion"
9g4r9z,In light of the recent news that Aaron Paul will be joining the cast
8sm8xj,Wait ... next week is the finale?
8qqn5z,Fan Art - My Painting of Bernard
a4uapp,I thought some of you might appreciate the Westworld cross stitch I did recently
cejdvd,Dolores of Tarth
8le6vv,Jimmi Simpson Reads Absurd Westworld Fan Theories
9z46qq,Happy birthday to our man William! (Jimmi Simpson)
5tuzu0,Evan Rachel Wood loves the Westworld memes.
8d7kly,'Westworld' season 2 to have several super-sized episodes
8wxl6k,Westworld poster by Fernando Reza
8doe7w,"Thandie Newton Confirms That She, Too, Will Receive Equal Pay for Westworld Season 3"
acqieh,Fan art: Opening sequence with white charcoal on black paper.
85y1l8,[OC] Facts.
7k3hsr,Westworld Bloopers.
5womoi,"""Hotel California"" on the pianola, a.k.a the one song we all wanted to hear"
ct6oeq,The lights in the library are the same as the ones in the citadel of game of thrones.
9dyytj,Figure I'd throw in my two cents
5fey75,"Evan Rachel Wood - send love, send praise. Surely this couldn't have been easy and we are a community above everything, make her feel the love we have!"
8tn1k8,[Spoilers] What we learned in the Season 2 Finale - The Passenger
5h1uvt,"Since horses are manufactured in Westworld, would that make them..."
5bwqex,I've figured it all out
8nrsgw,"The real MVP of ""Phase Space."""
6gssq9,[Meta] Can we end the endless maze image posts?
5s61mw,Jeffery Wright stopped by an interestingly named bar while shooting his next film...
bmazgs,"This is Besalú, Catalonia. Filming will take place here from 22 to 24 May."
bon0ks,Vintage cookie jar I got from my aunt. She couldn’t figure out why I wanted it so badly.
5ht227,When you realize it's the first Sunday without a new Westworld episode
9q8o91,"First Halloween party of the year, I saw an obvious costume for my husband"
5jcqfb,"The one thing that was never properly explained, according to my coworker"
clx1qc,So Many Details Rewatching S1:E1
djee32,The search engine must have been changed at some point
8jep9g,[S2E4] The three stages of Wiliam facing James Delos
8jpcs8,"""...you didn't recognize him sittin' across from you this whole time."""
97hx26,“Talent Management”
9m9c59,My cosplay for NYCC. Doesn’t look like anything to me.
bch3mx,Chimes
5gjymu,Ford added another layer to Arnold's pyramid
8kpb8m,Tomorrow’s episode in a nutshell.
6gbqoy,Got to meet William this week. Such a chill and down to earth guy!
5gkgey,The only logical response to the finale
dipvax,S1E2 Summarized the Entire Show
7m14pr,"So I did it, I reached consciousness, now what? (Very happy with this Christmas present!)"
af0o1e,The way this Samsung commercial fits the Westworld theme is almost unreal
a0kzgg,Splendor
ctgjbz,Season 4 confirmed!
8fw52a,"Westworld - 2x02 ""Reunion"" - Post-Episode Discussion"
8s1ccj,[Spoilers] The reason they didn't show us the result.
5cwwq2,I redesigned r/westworld after the Delos behavior tablets. Let me know what you think.
5sgywo,"My husband watches this show and I don't, I bought him this shirt thinking it looked cool, but he told me doesn't get it. Did I buy a shitty shirt that has nothing to do with the show or can I get an explanation so I can tell him?"
8unvey,It's easy to misunderstand intentions
8fwamg,"""There’s not a man alive would talk to me like that."""
8etp59,new narrative
61p6fo,Here's that Dr. Robert Ford drawing I was finishing today!
8j9o6y,[Spoiler] This surprise return from session 1 gave me a laugh.
96r2wg,Poster for The Raj by Angie Son. Part of the Delos Tourism Series
cuxxz6,"""Someone once told me that there's a path for everyone. And my path leads me back to you."" - Teddy Flood"
8102mq,Westworld star Evan Rachel Wood testifies before Congress in support of the Sexual Assault Survivors' Bill of Rights Act
8uuhmp,Hold the door...
5w5esh,BTS photo of the Sweetwater train station
9p0n0e,'Westworld' Stars Score Big Raises Ahead of Third Season
clibz3,I just really miss him
bj4jji,It doesn't look like anything to me.
9veduz,Westworld’s Clifton Collins Jr. Says He Turned Down Invite to Go to Borderline Bar Night of Shooting
8oeumw,The cinematography has been so good this season
bx4ddl,Thought of this when re-watching season 02 the other day.
5f9is4,Props to /u/Spock_Nipples who figured out Arnold's full name 42 DAYS ago before episode 3 had even aired.
5e2n78,Poor bots :(
d8ljky,Monsters...
bxs1b9,Made with Microsoft Word™
9vx1oc,Set for ‘Westworld’ and Other Shows Destroyed in California Fire
bvhlcj,One of my favorite quotes. Which is yours??
6iyx96,James Marsden (Teddy) quick draw training for season 2
5e1ta1,"Westworld - 1x08 ""Trace Decay"" - Post-Episode Discussion"
dm0q9q,Rewatching Inception & just spotted a familiar face picking Fisher’s (Cillian Murphy) pocket
5hf1vq,"""Wyatt disappeared while out on maneuvers. He came back with some strange ideas.He claimed this land didn't belong to the old natives or the new settlers, that it belonged to something that had yet to come that it belonged to him"" Teddy"
8si26t,Take My Heart When You Go: art inspired by 'Kiksuya'
65fcmy,"Data goes nuts, Maeve falls in love (crosspost from /r/combinedgifs)"
b956f6,Westeros World Title Sequence (OC)
8mn7ev,"The ""Previously On Westworld"" before this episode was a piece of art."
6augfr,Boyfriend and I just got back from Maui and I was told to post this here. [OC] [4000x3000]
5z94kb,A friend made this. You're welcome.
8r62io,Akecheta and Ford in Las Mudas
8rvvce,[Spoilers] William's Profile
bvo9xf,FREEZE ALL MOTOR FUNCTIONS.
csrzdl,Why does Ford need a photograph when he has a host?
8u1epk,Dolores & Teddy
5el6uw,A Chronological View of Westworld's Timeline
bp139o,Inspired by Dolores
5sb7h6,"This sculpture seen at the Snow Sculpting Contest in Lake Geneva, WI"
cpw83k,My Wife added a nice touch when she framed this print for me...
cxgimg,A few posters from the recent Westworld: Awakening VR game!
7beqnh,"Westworld, the way it was meant to be seen"
5gjha9,DON'T CLICK THE SIDEBAR
amqs2z,Developed by Dolores
9cvki9,Lawrence/William
7jwms9,Westworld Wraps Filming in the California Desert! - Westworld Watchers
99exua,Deserves more awards!!
8tm0i1,Just enjoying some of this natural splendor at the Westworld Park. No killer robots spotted.
8fyk8p,When three new timeframes are added and it's only Episode 2
5gt35l,"(Spoilers) Nolan: ""They’re picking up everything we’re laying down — Reddit in particular — are picking up all the details and spinning out beautiful theories, many of which connected to the show."" (Lots of great answers in interview!)"
5h7n3s,I 3D printed the maze from the season finale
6jdmjp,Amazing westworld cosplay at SupaNova Sydney 2017
ajeh6x,"Bernard, take a look at this."
a15noc,Akecheta
5v4yj1,What do you think about Westworld's Funko Pop?
5apt0w,Is it just me or ...? Maze Diagram vs Westworld Image
8qjnbw,Man In Black Art
8oh231,[SPOILERS] Screengrab showing all the horrifying ways hosts can be tortured
5ebzsp,"Hi there, HBO Westworld's CGI team"
5gjku4,Probably one of the most striking scenes throughout the series.
8tlbn4,Hopefully Elsie Survives
5ib2fh,WW Inspired Tip Jar
9rr2iw,"Not as good looking as Ed, but hoping people get the costume and don't think it's just a cowboy!"
dofs1n,“Doesn’t look like anything to me...”
5gjrc4,"Anthony Hopkins, Season 2."
8u6m54,S2E10 mansion scene w/ Bernard and Dolores looked familiar...
8gb7t9,Season 3 confirmed
5bdsrl,Sandblasted this WestWorld map glass for fun (notice the logo on the bottom). Turned out pretty awesome!
8ks7e1,I drew William/MiB
8l4uxm,"Westworld/Shogun World ""Paint it Black"" Side By Side"
8tn71b,"[SPOILER] Honestly this was the only scene I genuinely cared about, and it wasn’t even close!"
aqk5z0,My battery is low and it's getting dark
8tpww1,Season 3 (spoiler)
5eok1y,So this is interesting.
5dtuzu,There's a path for everyone. Your path leads you back to me
b68w8t,Just finished my first 3D print but it doesn't look like anything to me...
7bsdum,The Delos employees booklet that is included in the blu-ray of westworld neatly explains what happens to deceased hosts.
a83sb7,*gasps*
cz1d85,.
5gmaj3,How about a big thank you to Jonathan Nolan for an incredible first season!
az8b0x,Dont forget you saw Don Quixote in Westworld
5jtngj,"I painted a thing! The Reverie, 48"" x 48"" acrylic on canvas."
9wqrnu,[SPOILER] HBO Interested In Antonio Banderas For WESTWORLD Season 3
5qp36w,Watching the show for the first time and noticed an old friend
8je31s,We've come full circle.
87side,Evan Rachel Wood Says ‘Westworld’ Season 2 Is Something That’s ‘Never Been Done’ Before on TV
bez0la,Man in Black's Core Drive...
9a75hh,Thandie Newton (Maeve) celebrates 20 years with her husband! Wow!
8q8wbg,Thank you HBO and the cast and crew of Westworld for this amazing episode. Kiksuya is a masterpiece in storytelling.
8gr0mx,[AltShiftX] Westworld S2 E2 Explained
5f9dwq,ERW Twitter: Last episode 90 minutes long!
8e7uv6,This is how train scenes are shot
9u0ghu,"""Just trying to look chivalrous"" - Tried making Teddy in Red Dead Redemption 2"
aatl76,Watching season 2. Why are these fucks so goddamn scary?
bdu9ft,Typical Bernard....
8kktlb,For the nineties/millenial people watching Westworld
6s8xax,William - Pen & Acrylic Warmup Sketch
5jjwl8,Ford on Life + Creation
8jbo81,"[Spoiler] Time for a spin, darlin'"
85cei8,My birthday present doesn’t look like anything to me!
5mruvu,Playing god
8ty985,Akecheta in Windows Xp
d3s9vh,Once Amazon buys Delos...
8jnqii,Does it matter?
ads8uq,"[SPOILERS!!!] 'Westworld': Full chronological timeline explained in one graphic (if you find the story confusing even after watching the whole series, this can help to clarify it mostly ☺)"
5awph6,Westworld: What Makes Anthony Hopkins Great (nerdwriter1)
cwve04,Still one of my favorite moments in television
c2dyhy,"[Season 3 Spoiler] My subway stop was covered with these ""ads"" and green screens last week..."
8cu42o,"I know it's a little early to be talking about spin-offs, but what do you think??"
6ibf9i,Petition to Change the Text on a Post With No Comments to This:
5p6pxu,"Dolores, by Van Gogh (1890)"
8noi0g,A New Interpretation of Old Bill's Toast
7y4rrl,I manage a restaurant and had to put this on the fridge. The staff keep stealing the juice.
dhcrz4,Me rewatching season 1...
8twm4l,Can We Just Take A Moment.... This Ake's Homeboy W/O The Makeup
6x0dex,I found this in the field today...
5a9s83,"Westworld - 1x05 ""Contrapasso"" - Post-Episode Discussion"
7xaptn,"Y'all are trying to figure out season 2 from the trailer, and I'm just here still trying to guess what this guy's lesson was"
8fufud,"That Teddy human guest partner was cool. I can't remember when we last saw her, I hope she's ok"
5lc6cj,Me at the beginning of 2016 / Me at the end of 2016
6p81kr,Very suggestive hips Dolores..
8tn3te,[MAJOR SPOILER] shoutout to
7nneb4,Hmmm. Maybe if I cover my eyes during the bad parts?
8uwg9p,Happens to the Best of Us
abv6cj,All of the Knowledge Needed to Defeat Evil (xpost r/hostworld)
9q6j0c,Maeve and Dolores
8tyyzo,When my wife tried to turn off the TV before we’d seen the after-credits scene
5fxfhe,Who else is really enjoying seeing each piano cover of a dope song like paint it black or black hole sun in every episode?
8edq8c,"tl;dw Season 2, Episode 1 Recap"
9ly78l,Three half-days of driving and cycling in the southern Utah desert paid off. I found the dilapidated Building Teddy and Delores went to on Westworld.
8rwcio,[Spoilers] Dolores and William is literally the mirror reflection of each other
8qnrwp,And then he couldn't stop drawing it
7vnxbd,I put together this triple monitor wallpaper in anticipation of Season 2
be9bb9,Human or Host???
5ght15,Westworld is exactly why I still prefer serial dramas to be released weekly rather than all at once
8o0puw,Season 1 Episode 7 gave us some insight into Ford's opinion of the James Delos Project
6jh9qh,Westworld creator warns fans to stay away from Reddit if they want to 'play the game' with them
8trk0h,Right ?
8u0du6,Season 3 is just a NYC Sitcom
78i6td,My friend and I found the Delos NYC office during NY Comic Con
5f9aho,You guys are fucking good
8glwf0,And there you have it. The debates can cease: they’re both sentient.
b7gpzn,A common complaint
5f9fop,Hidden Ford
6qkhil,Jimmi Simpson confirmed he will return for Season 2.
55ll2i,"Westworld - 1x01 ""The Original"" - Post-Episode Discussion"
8j9880,Updated timeline with Ep. 4 for all Us confused roombas
7cqmra,Honey Nut Cheerios? Doesn’t seem like anything to me.
5grxx3,"Voice Commands Confirmed - ""These Violent Delights Have Violent Ends"""
5e9plp,Thought this scene was a subtle nod to one of the greats
5k2isb,Here is my watercolour painting of the church we all know. I'd appreciate any suggestions :)
a8cprr,"Is this....Bernard? Nah, just my friend's mom's colleague pretending to be Bernard. Or is he?"
bqqkpg,It do be like that
5bm79k,[Episode 6] Ford's reflection
cfhfqa,When a grown ass man at the restaurant I work at uses crayons to play the games on the back of the menu
9gyqkk,Fan art allowed here?
8nc5xg,One of the actors who wears the drone host costume in Westworld is also a ballet dancer
9rzy0f,Have you ever questioned the nature of your reality?
byolnz,Slot machine at a casino.
8tsy0t,[SPOILER] Detail about the final scene of the finale
6tww4r,"‘Westworld,’ ‘The Handmaid’s Tale,’ ‘Stranger Things’ battle for cinematography Emmy"
9uf4a1,This is from a Fallout (videogame) commercial. Anyone else feel like they used Dolores as heavy inspiration for this?
5e46si,[Episode 8 Spoilers] Not the first time big decisions have been made there...
8br5xc,Was inspired to do another piece of fan art after feeling the community love. Looking forward to exploring Shogun World.
8wsjz7,Dolores' Data Log
ca9gbh,Hate the usual lack of Westworld merch but got this for birthday and love it!
68fbub,I don't know if this subreddit enjoys posters but I made this for Westworld.
9nyoue,The crossover nobody knew we needed.
5f9gmq,Westworld: The Safe Hector Really Wants
7sfvhb,From this months lootcrate
8oh59i,"Props to HBO for casting Zahn McClarnon, who is Lakota, to fill a Lakota role."
8g86ix,Giancarlo Esposito Is in Westworld Because Anthony Hopkins Loves Breaking Bad
8sijde,"This subbreddit does not fool me, you underestimated me Ford"
bhke1y,Westworld pixelart (S1)
86sypl,Found a number sequence in the New Season 2 poster
8je4ed,The Riddle of The Sphinx is the Crux of the Season
9ia80s,Congrats to Thandie for her Emmy
8s77ju,Updated westworld major events timeline Till S02E09 🙂
5pddgu,Dolores by Pernille Ørum
5k5wvw,Sir Tony wishes us Merry Christmas :)
5gtw8h,[Episode 10] The Reason Why Security Didn't Shoot Them: Ford Programmed Them Not To
8g87hg,Something interesting regarding Bernard's House! (The Sign)
9tanz6,My wife said it didn't look like anything to her...
5gzd8a,Evan Rachel Wood is ranked 6th on the IMDB 'Best of 2016'. A deserved achievement!!
93pe79,My Dolores cosplay!! Still have a few things I'd like to fix up but I tested it out at a con last weekend and was pretty pleased.
7nvlzp,Dolores Fanart via
7zie7r,A mashup series I just started - Toyworld
8czd4c,Our favorite hosts!
5f9j1m,"After this season, I'd like to imagine this sub predicting great moments in history..."
8o9l0v,A Host from the Beach was in the Cradle
aium6n,A Flood of Emotion
5fa50x,Happy 66th birthday to Ed Harris! Our ruthless and enigmatic Man in Black.
8eoqsx,"The champagne glass next to Bernard is not from the party/dinner, plus Bernard's clothes are different from that night"
8d1yzk,Thought that dress looked familiar...
5u0dh3,"'NSFW' Guys, looks like we already know our Season's 2 main plot."
8e9ujk,My reaction when I see Floki from Vikings
5gct2a,One more fan piece before tomorrow's finale.
57vg3m,Shannon Woodward keeps it real.
93jl61,"[Spoiler] I have to show off my birthday cake, and no one else gets it."
88e9wh,1st-ever cosplay attempt: Dolores Abernathy from Westworld!
99rcva,The real star of the show.
8bzi6z,BI: 'Westworld' season 2 is even better than the first and transcends the last sci-fi tropes holding it back
8oi5gw,Press F to pay respect
8xrph7,Ramin Djawadi
5gprif,Season 1 Finale tl;dw
b1nlek,Decided to rewatch. This has to be the best show I have ever seen.
5e9383,Spoilers all: where are the flys?
b3lyfm,Animated Samurai Fight Scene from season 2
8tnsmc,Excellent detail: MC Escher's Drawing Hands in Bernard's home lab
b0pyz5,Westworld inspired tattoo
95301a,Love this beautiful Dolores poster that Evan Rachel Wood tweeted
chem85,"I want a video of every time Anthony Hopkins says ""Behnahhhd"""
axnlrd,What Do We Say To Death? Bring More Alcohol.
8ee4co,"[S02E01] The clues were all there, over a year ago..."
57uyof,"Westworld - 1x03 ""The Stray"" - Post-Episode Discussion"
5e1v5g,The fragmentation pattern Bernard had up looks a lot like the maze illustration.
8j8xmu,It took forever to get the right frame but this horse derping in tonight’s episode cracked me up (no spoilers)
bc61in,"I’ve started raking every day, here’s today’s"
b2wh6m,"Aaron Paul's Very Big Year: The Breaking Bad Movie, Westworld, and a New Apple TV Series"
8ot1zf,I Miss the Old Teddy
8oduua,She watches almost all of almost all episodes
8q68of,Zahn McClarnon was amazing.
8hk368,"Westworld - 2x03 ""Virtù e Fortuna"" - Post-Episode Discussion"
c33krw,The only thing better than Westworld is Westworld in Dolby Atmos and HDR
8ma1bb,🤔🤔
5gm6in,Joy of modern firearms
5924lk,"Westworld - 1x04 ""Dissonance Theory"" - Post Episode Discussion"
7iphjt,Evan Rachel Wood: Just another day at the office. 🤖#westworld
aoptpf,Filming starts soon for S03!
beldjp,IDK
8rveav,S2E08: They removed the cameramen following Maeve!
cjg2ex,"Anyone notice in season 2 episode 8, only Dolores has the “Safety coffin” with the bells attached? Was Arnold/Bernard afraid of Dolores coming back?"
aou31i,404
5h2l8w,Westworld - Season 1 Discussion
dhq3xq,"The Wolf: still today, I don't fully understand the meaning of the wolf in WW."
97ssf9,Westworld Safety Tip #35
8b4mib,Westworld Season 2 -- A Primer
d3a4el,Timeline of westworld s1&2 Credit : Insider
8l9652,Philosophical Backbone of S2 So Far (And Why So Many People Think It's Boring)
5asxoz,Angela Sarafyan on the set of Westworld taking a selfie as Clementine
5h1ir4,"'Westworld is officially the most watched first season in HBO history, even topping Game of Thrones'"
5a04fc,Some people choose to see the ugliness in this world... I choose to see the beauty.
5e47u0,Regarding Felix
5qhcps,I hope you guys appreciate this poster I did inspired on the series. Where Life Begins
5fnwqo,If she only knew ...
afaiy6,Runaway - Kanye West : Delos Corporation Presents Music from Westworld
a2uej2,Dolores Abernathy🌷
7op0sy,Tried to 3D print a coaster... at the very end the printer just stops. Guess the maze isn’t meant for me.
797mh4,Last year I did Armistice for Halloween; it was too soon and no one knew who I was... maybe if someone does it this year they will know 😂
cfqgbj,WESTWORLD SEASON 3 TRAILER
93dppb,Abernathy's Radical Notion - Remember
aalimb,Happy holidays from the Westworld showrunners!
8oes2s,"[SPOILERS] For me, this was the most close-minded thing in the whole episode"
aa114m,Not from the show. But still an amazing christmas present.
8tnxxt,Human codes are like lines of music.
btceoz,Was traveling through Phoenix when I found a place that looked so familiar
8rvyjl,"William's Books - Moby Dick, Slaughterhouse Five, Jude the Obscure, Plutarch's Historical Methods, and Plutarch and Rome"
5k7zek,My Christmas present wasn't meant for me.
clfjrv,Season 2 episode 10 is piece of art.
a385zi,Me after finishing season 2.
64cluk,I used to think the Man In Black was really good with comebacks...
8j9khn,Forbidden Snacks
7j3kr3,An interactive homescreen for my phone that looks something like the cool UI used on Delos tablets and phones
bdn65z,Philosophy
a61f6b,Bernard on Animatrix?
8e90hg,"I mean, yeah"
8tyaxz,Do-lo-res
8r2sh2,Various Dialogue Echoes
a3nu3e,"Thandie Newton is nominated as Golden Globes' Best Supporting Actress in a Series, Limited-Series, or TV Movie"
9hxts8,AKECHETA 8x10 canvas painting by me
9j8fgd,My Birthday cake 🎉🎉🎉😍😍😍
arzdcd,Simply became Code
dtoybf,Westworld | Season 3 | Incite Anthem | HBO
a00oa9,*sees any kind of maze* this sub: “OMG WESTWORLD”
c2rot0,Westworld Inspired Tattoo
6k9iwo,Coming Soon: Westworld Road Show
8e9e2v,"The 'mother' in the new intro looked familiar, so I made this gif to compare face shape."
56i70m,Louis Herthum voted as TVLine's Performer of the Week
5hpbkm,"I'm almost certain that this moment was the intentional reveal of the two timeframe theory, yet, everybody dismissed it as Lawrence being reset on his loop."
5dlrgj,What the Man In Black actually looked like when he was young.
9v4wy6,I just finished watching Westworld after binging both seasons and I thought I’d just make a collection of the season one characters. It’s really nothing special - I just hadn’t been able to find any collages of the characters together.
8tvv1b,Costa’s comment on “virgin” hosts in S2E5 makes sense in light of S2E10 [Spoiler]
8oh8nn,One of the best shots of this season
7i9rvx,New Westworld footage in HBO's 2018 trailer
8r8a8q,Not sure if anyone’s noticed this yet but...
5fs06p,"When Westworld is finished, someone should edit the series in chronological order so I can understand what's going on."
5bk5vs,99 OVR Maeve
5hkg2d,Ford's game plan laid out in his office at the beginning of Episode 10
8mpfoo,This is his last Tweet a month ago ... and then we had last night
5mlaf4,"Ed Harris looking a lot like MIB in the poster for the 1987 film ""Walker"""
5f7i2l,A familiar face
