post_id,title
5fbw8n,A Chronological View of Westworld's Timeline (updated - episode 9)
5803xu,"tl;dw Season 1, Episode 3: Tragedy_Not_Found"
8uunxf,[OC] The Westworld intro... in LEGO
be46hm,Dolores setting down some of that natural splendor
auh1zr,Westworld is fun
6y3ukb,"Maze Easter Egg, Teen Titans Go! S4e32 lication"
ast0jm,Time's Up
9f98wn,More Character art - Instagram @andersoncarman
816dq0,"EW cover story reveal: 'Westworld' season 2 is more epic, brutal, trippy"
dicz0u,Attended a cast iron making event at my local Makerspace.
8j8lvj,Beginning of episode reminded me of the introduction to Desmond in Lost
cal8yh,Atlas Bar in Singapore as a dystopian Westworld destination.
5ggv1p,Someone made a compilation of commercials featuring actors from Westworld (so no spoilers)
8je2yp,"tl;dw Season 2, Episode 4 Recap"
8jc8xf,"[Spoiler] Weird detail I noticed, just makes me appreciate Westworld more."
6u9p6r,The HBO hackers leak Westworld season 2 detailed production schedule
a1hjim,Thandie 🌸💮
dckbtu,Awesome poster by Joseph Harrold
8tqxmo,Did this dude seriously think that was gonna work
8rzwhy,I miss Theresa
906qio,The one where they're all conscious.
b2b1pj,Drew Dolores with white charcoal ♥️
6yuqsh,If they ever need to cast someone as William's brother...
cq71rh,This Cake Isn't Meant For You
5grfsv,So the cast of Westworld is pretty funny off camera.
791yqq,Arnold’s Maze pumpkin carving
5nxbbh,Real life Westworld - Abandoned American theme park in Japan
8y1dwe,"Happy birthday to the late, great Yul Brynner, the original Man in Black. Glad he got an Easter egg back in season one."
9garm6,Shitpost Warning
5gjomi,Some clever setup for Season 2...
5bjvml,"Westworld - 1x06 ""The Adversary"" - Post-Episode Discussion"
8hlw47,"This Ghost Nation guy is asking all the questions we’re thinking, right? (Sky Atlantic)"
80subk,Found this at our local used bookstore for $8...SuperEmoFriends!!!
8mn0zo,Bernard's growth is so sad... (S1E3)(S2E6)
8bizpn,Shall we drink to the lady in the white shoes? Some fan art I made in anticipation of season 2
8tywjk,The only human who knows how to shoot
8kxvsq,This show is in the details. (S2E5 vs. S1E1)
8381j1,Elon loves Westworld! Looking forward to this short.
bptuxe,Westworld and Black Mirror (15 million merits) use the same type of exersise bike.
5vvhhe,The amazing Dolores Animation from the latest Kurzgesagt Video.
8mmobs,Ford's Greyhound [Spoiler]
5dfl9s,[Spoiler] The birth of the man in black
5n1xdl,Westworld poster by Laura Racero
8u2ri0,Stubbs dropping hints in S01
btn0vw,I unapologetically love Season 2 of Westworld
6w50m4,Doesn't look like anything to me...
63bkxf,Westworld' Season 2 Won't Pick Up Where Finale Left Off
8cfrqp,Face Palm
ba4zls,The Awake-o Kid
8q5udz,[Spoilers] What We Learned in S2E8 - Kiksuya
8msasn,"tl;dw Season 2, Episode 6 Recap"
avmg00,🤯
a8plb0,Found this in the discount bin at a Best Buy and I think I'm gonna give it to myself for Christmas
7qwqv7,Westworld season 2 release date accidentally 'confirmed' by star
c7gxib,"'Westworld Season 3' Finalises New Location, Production update and Expected to release by Spring 2020."
5wgyw1,"Man, I'm glad I marathoned this show instead of watching it week to week. That would have driven me crazy haha."
69h987,Robert Ford by Raborlatte Posters
5a1gls,"I decided to make a Dolores costume for Halloween. It's not perfect, but I made it in only one day."
8l3kdt,[Spoilers] This scene reminded me of something...
6lf8up,WESTWORLD to get 4K Blu-ray release on November 7th
5few78,"tl;dw Season 1, Episode 9: Dearly Departed"
a735ol,Present from my secret santa. Perfect!
5xucyj,My fiancée just found our next vacation destination.
cyzgxi,Westworld Adult Verification Question in Leisure Suit Larry Game on Apple IIGS - 1987
5acjvr,Westworld Character Status Chart - Episode Five
crf920,"Is that you, William?"
9nd3pm,[Spoiler] My favorite quote from Season One.
5cwy81,A pretty big callback from last night's episode.
71jxyy,"My theory on the meaning of ""These violent delights have violent ends"" **SEASON 1 SPOILERS**"
5g1sw6,Went to Spotify to listen to the Westworld Soundtrack...never been this nervous about logging in before.
5eebky,"""The Maze Is All That Matters Now"""
5cwfui,Thandi Newton nominated for best supporting actress in a drama series for Westworld by the Critics Choice Awards
8e2j8y,Return to Westworld | Season 2 Featurette
5hffaf,"For those who, like me, have played World of Warcraft, this kept coming to mind..."
5fat9n,"Yes, HBO, we get it. It's very clever."
8eea2v,When you've read all the theories on Westworld
5dsjzw,[Spoilers for Episode 7] An innocuous turn of phrase by Ford takes on new meaning.
5frq9k,[WW theory bet]I will drink my own pee if Logan is MiB
6azx38,Found the maze in southern Utah
5ctsfs,What door?
6t2zua,Oliver Bell (the little boy in Westworld) came into my workplace today!:o
9cdrcp,Who's gonna tell him
9jztf6,Just wanted to show some appreciation for Geisha Akane dancing to a C.R.E.A.M cover and then being a total badass. Probably my favorite scene in all of television.
8tm6oy,Be careful what you wish for
apctfl,'Westworld' Season 3: Jimmi Simpson Says Young William 'Is Less of a Focus'
8hkt4l,"Just a reminder of Teddy's description of Wyatt & Wyatt's gang in S1E3, which is beyond relevant to S2E3..."
8lbs20,When someone asks how Maeve has magical powers
7vk4iq,Second Park theme from Westworld universe.
5gi6rx,"Westworld hasn't even truly begun yet, according to ERW. Season 1 is just the backstory for the real story to begin in S2"
8wuurl,"Can't get over season two. I started this after watching akane no mai (one of my favorite episode. Beautifully shot episode.), just finished it today."
8u0qf2,[Spoiler] And the dumbest scene of the season goes to..
5e1y59,"""Ni"""
8t98kp,ERW and James Marsden : What if Westworld was a sitcom?
8odn18,[Spoilers] What we learned in S2E7 - Les Écorchés
8mprid,Host's best friend.
5gk0q1,"""Mozart, Beethoven, and Chopin never died. They simply became their music."""
arah83,You Got Some Sufferin' to Do
5f9cdt,The writing on this show is incredible
64amgc,"""I imagined a story where I didn't have to be the damsel."""
8woho0,[OFF-SEASON SHITPOST] Ford and Arnold in happier times...
8kxe5k,C.R.E.A.M
cnrx2u,"Found this at my local mini market, like seriously I've digged the entire mall for funko and didn't find shit,yet got the coolest keyring ever in a small ass mini market, you lads think there are any chances those who possess this keyring get tracked and will be offered 3rd season early preview:(((?"
7tq0z2,It looks like Westworld Season 2 could premiere in late March or the first 2 weeks in April!
d6jfvl,"Bugged my friend to make some stickers for me, had to put one on my board"
bspqbb,Anyone who didn't notice Marshawn Lynch in the trailer clearly wasn't paying attention to his shirt.
74xvqy,Looks like Westworld is filming!
8kxez1,In the weeks ahead
cfyf16,"""you & I have no mother, no father; we are alone""; Teddy's soul in Hale?"
afqg7u,Thandie Newton won Best Supporting Actress at the Critic's Choice Awards!
8uanpd,The true location of Bliss in \W/.
8edt1l,So the group of grafitti artists who live next door to me are killing it this week!
ai50lk,Doesn’t look like anything to me!
828msz,I got this week's EW today
c9f4ko,Westworld filming in Singapore (Aaron Paul spotted!)
5gjph5,I cried.
bkwy6s,Can we discuss this review I found on Imdb?
dnqhpt,My 3D Printed Westworld Maze
c8m257,They were filming Westerworld S3 at my school in Singapore today
9lhr3d,Shitpost Warning (Xpost r/hostworld)
8ycn1v,Reading the Emmy nominations and not seeing anything for the true star of season 2.
8uqgr5,This morning my sister and I kayaked through Westworld.
8b8gug,"In preparation for Season 2, here's the best recap of Season 1 I've come across"
569pcm,"Westworld - 1x02 ""Chestnut"" - Episode Discussion"
93bo9i,Inside the mind of Wyatt
5g9s9f,My drawing of the Man in Black.
8mwxum,"The CR4-DL reveal, and what it means"
8fyozh,(Spoilers) - updated timeline with episode 2 from ThisIsInsider
atobgc,Something I thought of looking at the Mesa and other facilities (also every sci-fi movie ever)
8e87bl,[Spoilers] What we learned in S2E1: Journey into Night
7gnmzy,Ramin Djawadi plays the Westworld theme song
5ywkwt,I was testing my diy laser engraver but it doesn't look like anything to me.
8ut2e3,What Ake should've said
5e6xqo,Figured out how Ford knows everything ... He's been lurking in /r/Westworld for info.
8yv33f,Dr. Ford🧠 [ig]@westworldquotes_
57x1pk,"Dolores, and Arnold's model for consciousness"
5gnh0v,The Many Faces of Felix Lutz.
7a5c5n,This pumpkin isn't meant for you.
8tp2ds,[Spoiler] Oh how the tables have turned.
8l1vji,"Honestly, some people on this sub need to chill out..."
9qwe1s,Poster I made a little while back
8ko4np,anyone else mad that Elsie’s hair was perfect despite being chained in a cave FOR DAYS??
8ugc6s,Can we take a second to thank the amazing Ramin Djawadi... This show wouldn't be the same without his music.
dqftmi,Joining the ranks of those pumpkins that came before me...
5n6r5y,"Here's what Westworld's player piano cover of ""Black Hole Sun"" sounds like with the original vocals added in"
59xtef,I'm going as a host tonight
8oqd8v,[Spoiler] Body Ford Was Printing Is....
b6ysik,Westworld and Assasins creed will make a perfect crossover
7cz8ph,Gearing up for Spring 2018
8tpptd,[Spoiler] Spotted this book before the reveal...
8leouc,Saddest scene in the show so far?? This one was pure melancholy for me
8u08mg,They never died. They simply became music.
5cvhyu,Westworld Character Status Chart - Episode Seven
6c48xo,Just finished the show last night. Been avoiding this sub until now. Wanted to share something I noticed.
6532sx,Finished an embroidery project today inspired by the show.
943xmt,I live in the Southwest US and anytime my family and I go for a road trip nearby I always end up listening to the Westworld soundtrack. Im fully immersed and end up questioning the nature of my reality. Hats off to Ramin he really captured the essence of the wild Wild West
8tzc6e,Teddy's cornerstone in the finale [spoiler]
74okjj,This cross stitch is not for you...(x-post from r/crossstitch)
6zsfbs,Heavy breathing
5ej8aj,My father's theory on Ford's endgame
8l1y9b,[Spoilers] Haters gonna hate but this Maeve arc is my favorite part the season
5gj35w,30 min until the finale. Let's have one last drink to the woman in the Wyatt shoes...
8jb6am,Anyone else notice that this is the same host?
dgky8z,Decided to test out the new 3D Printer at work!
69ztnl,"""This Maze Isn't Meant For You."" I wood-burned a small wooden box."
90qm61,I made a piano cover of this awesome main theme ;)
bb8eey,Toll Booth
6tr81c,Rodrigo Santoro confirmed for Season 2
5swzt8,"My girlfriend was watching The Notebook on The W Network. I had to do a double-take when I walked into the room and saw Teddy in the chair with the W logo onscreen. For a moment I thought ""I don't remember this scene..."""
9xvahv,Just arrived in time. Such a good way to start my weekend.
dli0t3,The Man In Black
